[32m[I 2026-08-06 17:40:38,146][0m Trial 20 finished with value: 4.080101444253324 and parameters: {'boosting_type': 'gbdt', 'max_depth': 14, 'num_leaves': 135, 'learning_rate': 0.026116734935707105, 'n_estimators': 1840, 'subsample': 0.8603029175244544, 'subsample_freq': 8, 'colsample_bytree': 0.6412001851309218, 'reg_alpha': 1.2981056492481963e-06, 'reg_lambda': 7.063463090393332e-07, 'min_child_samples': 5, 'min_child_weight': 0.031622230925317296, 'min_split_gain': 0.9852077475702727, 'cat_smooth': 0.7390602587342983, 'cat_l2': 28.94950107230588}. Best is trial 20 with value: 4.080101444253324.[0m
Training until validation scores don't improve for 30 rounds
Early stopping, best iteration is:
[120]	valid_0's rmse: 4.44016	valid_0's l2: 19.715
Training until validation scores don't improve for 30 rounds
Early stopping, best iteration is:
[232]	valid_0's rmse: 4.10972	valid_0's l2: 16.8898
Training until validation scores don't improve for 30 rounds
Early stopping, best iteration is:
[175]	valid_0's rmse: 4.16059	valid_0's l2: 17.3105
Training until validation scores don't improve for 30 rounds
Early stopping, best iteration is:
[179]	valid_0's rmse: 4.21894	valid_0's l2: 17.7995
Training until validation scores don't improve for 30 rounds
Early stopping, best iteration is:
[196]	valid_0's rmse: 3.56206	valid_0's l2: 12.6883
[32m[I 2026-08-06 17:40:39,829][0m Trial 21 finished with value: 4.09829519125906 and parameters: {'boosting_type': 'gbdt', 'max_depth': 14, 'num_leaves': 131, 'learning_rate': 0.02482134285879486, 'n_estimators': 2286, 'subsample': 0.864453243364416, 'subsample_freq': 8, 'colsample_bytree': 0.6430088670329513, 'reg_alpha': 1.781272817882336e-06, 'reg_lambda': 3.6104047483793754e-07, 'min_child_samples': 5, 'min_child_weight': 0.02861068595875266, 'min_split_gain': 0.937490612189089, 'cat_smooth': 0.5174219484548352, 'cat_l2': 27.78248047406434}. Best is trial 20 with value: 4.080101444253324.[0m
Training until validation scores don't improve for 30 rounds
Early stopping, best iteration is:
[311]	valid_0's rmse: 4.52651	valid_0's l2: 20.4893
Training until validation scores don't improve for 30 rounds
Early stopping, best iteration is:
[431]	valid_0's rmse: 4.20937	valid_0's l2: 17.7188
Training until validation scores don't improve for 30 rounds
Early stopping, best iteration is:
[375]	valid_0's rmse: 3.99243	valid_0's l2: 15.9395
Training until validation scores don't improve for 30 rounds
Early stopping, best iteration is:
[201]	valid_0's rmse: 4.44551	valid_0's l2: 19.7626
Training until validation scores don't improve for 30 rounds
Early stopping, best iteration is:
[431]	valid_0's rmse: 3.57791	valid_0's l2: 12.8014
[32m[I 2026-08-06 17:40:41,401][0m Trial 22 finished with value: 4.150344249492688 and parameters: {'boosting_type': 'gbdt', 'max_depth': 14, 'num_leaves': 143, 'learning_rate': 0.02088730369240071, 'n_estimators': 1861, 'subsample': 0.8517582902228746, 'subsample_freq': 8, 'colsample_bytree': 0.6521113159080636, 'reg_alpha': 1.8896221689075935e-06, 'reg_lambda': 2.4483746353879916e-07, 'min_child_samples': 15, 'min_child_weight': 0.031341332370531015, 'min_split_gain': 0.9387364150798391, 'cat_smooth': 2.9835103335122466, 'cat_l2': 29.164710899992034}. Best is trial 20 with value: 4.080101444253324.[0m
Training until validation scores don't improve for 30 rounds
Early stopping, best iteration is:
[308]	valid_0's rmse: 4.74004	valid_0's l2: 22.468
Training until validation scores don't improve for 30 rounds
Early stopping, best iteration is:
[615]	valid_0's rmse: 4.29098	valid_0's l2: 18.4125
[32m[I 2026-08-06 17:40:41,903][0m Trial 23 pruned. [0m
Training until validation scores don't improve for 30 rounds
Early stopping, best iteration is:
[457]	valid_0's rmse: 4.52419	valid_0's l2: 20.4683
Training until validation scores don't improve for 30 rounds
Early stopping, best iteration is:
[616]	valid_0's rmse: 4.11362	valid_0's l2: 16.9219
Training until validation scores don't improve for 30 rounds
Early stopping, best iteration is:
[380]	valid_0's rmse: 3.95552	valid_0's l2: 15.6461
Training until validation scores don't improve for 30 rounds
Early stopping, best iteration is:
[343]	valid_0's rmse: 4.51716	valid_0's l2: 20.4047
Training until validation scores don't improve for 30 rounds
Early stopping, best iteration is:
[472]	valid_0's rmse: 3.57136	valid_0's l2: 12.7546
[32m[I 2026-08-06 17:40:44,246][0m Trial 24 finished with value: 4.136369652403539 and parameters: {'boosting_type': 'gbdt', 'max_depth': 14, 'num_leaves': 104, 'learning_rate': 0.014530891778773774, 'n_estimators': 1590, 'subsample': 0.9648586002051283, 'subsample_freq': 8, 'colsample_bytree': 0.6607750161414577, 'reg_alpha': 2.7363498521409297e-06, 'reg_lambda': 8.318799961817219e-07, 'min_child_samples': 15, 'min_child_weight': 0.03912969570283405, 'min_split_gain': 0.994140397267223, 'cat_smooth': 5.711660043927896, 'cat_l2': 17.891614745789543}. Best is trial 20 with value: 4.080101444253324.[0m
Training until validation scores don't improve for 30 rounds
Early stopping, best iteration is:
[437]	valid_0's rmse: 4.59965	valid_0's l2: 21.1568
Training until validation scores don't improve for 30 rounds
Early stopping, best iteration is:
[670]	valid_0's rmse: 4.15058	valid_0's l2: 17.2273
Training until validation scores don't improve for 30 rounds
Early stopping, best iteration is:
[474]	valid_0's rmse: 3.92965	valid_0's l2: 15.4422
Training until validation scores don't improve for 30 rounds
Early stopping, best iteration is:
[350]	valid_0's rmse: 4.40385	valid_0's l2: 19.3939
Training until validation scores don't improve for 30 rounds
Early stopping, best iteration is:
[414]	valid_0's rmse: 3.69075	valid_0's l2: 13.6216
[32m[I 2026-08-06 17:40:46,331][0m Trial 25 finished with value: 4.154895889276871 and parameters: {'boosting_type': 'gbdt', 'max_depth': 14, 'num_leaves': 109, 'learning_rate': 0.015524800330124437, 'n_estimators': 1549, 'subsample': 0.9993438976254572, 'subsample_freq': 8, 'colsample_bytree': 0.6728192855187279, 'reg_alpha': 2.3229774618477877e-07, 'reg_lambda': 1.7402086369211276e-06, 'min_child_samples': 17, 'min_child_weight': 0.04635872448471071, 'min_split_gain': 0.872326570592522, 'cat_smooth': 5.401320584806761, 'cat_l2': 17.335263513565263}. Best is trial 20 with value: 4.080101444253324.[0m
[32m[I 2026-08-06 17:40:48,802][0m Trial 26 pruned. [0m
Training until validation scores don't improve for 30 rounds
Early stopping, best iteration is:
[480]	valid_0's rmse: 4.66219	valid_0's l2: 21.736
Training until validation scores don't improve for 30 rounds
Early stopping, best iteration is:
[432]	valid_0's rmse: 4.45274	valid_0's l2: 19.8269
[32m[I 2026-08-06 17:40:49,244][0m Trial 27 pruned. [0m
Training until validation scores don't improve for 30 rounds
Early stopping, best iteration is:
[185]	valid_0's rmse: 4.45582	valid_0's l2: 19.8543
Training until validation scores don't improve for 30 rounds
Early stopping, best iteration is:
[389]	valid_0's rmse: 4.11245	valid_0's l2: 16.9122
Training until validation scores don't improve for 30 rounds
Early stopping, best iteration is:
[284]	valid_0's rmse: 4.14702	valid_0's l2: 17.1978
Training until validation scores don't improve for 30 rounds
Early stopping, best iteration is:
[384]	valid_0's rmse: 4.25562	valid_0's l2: 18.1103
Training until validation scores don't improve for 30 rounds
Early stopping, best iteration is:
[287]	valid_0's rmse: 3.55173	valid_0's l2: 12.6148
[32m[I 2026-08-06 17:40:52,278][0m Trial 28 finished with value: 4.104527659373959 and parameters: {'boosting_type': 'gbdt', 'max_depth': 13, 'num_leaves': 96, 'learning_rate': 0.013434222474010065, 'n_estimators': 1589, 'subsample': 0.8628722558295463, 'subsample_freq': 7, 'colsample_bytree': 0.6541397806839806, 'reg_alpha': 7.370850213186211e-08, 'reg_lambda': 3.2654758885276325e-05, 'min_child_samples': 5, 'min_child_weight': 0.005588035436930806, 'min_split_gain': 0.9319836387127608, 'cat_smooth': 13.312880111032086, 'cat_l2': 26.758527436337843}. Best is trial 20 with value: 4.080101444253324.[0m
[32m[I 2026-08-06 17:41:05,688][0m Trial 29 pruned. [0m
Training until validation scores don't improve for 30 rounds
Early stopping, best iteration is:
[196]	valid_0's rmse: 4.41828	valid_0's l2: 19.5212
Training until validation scores don't improve for 30 rounds
Early stopping, best iteration is:
[284]	valid_0's rmse: 4.11761	valid_0's l2: 16.9547
Training until validation scores don't improve for 30 rounds
Early stopping, best iteration is:
[152]	valid_0's rmse: 4.00489	valid_0's l2: 16.0391
Training until validation scores don't improve for 30 rounds
Early stopping, best iteration is:
[255]	valid_0's rmse: 4.31655	valid_0's l2: 18.6326
Training until validation scores don't improve for 30 rounds
Early stopping, best iteration is:
[258]	valid_0's rmse: 3.57888	valid_0's l2: 12.8084
[32m[I 2026-08-06 17:41:07,256][0m Trial 30 finished with value: 4.087241023113986 and parameters: {'boosting_type': 'gbdt', 'max_depth': 11, 'num_leaves': 48, 'learning_rate': 0.028262603581103378, 'n_estimators': 1929, 'subsample': 0.8711990034460453, 'subsample_freq': 9, 'colsample_bytree': 0.6953488755179453, 'reg_alpha': 7.884814277241844e-08, 'reg_lambda': 4.6707562467024276e-05, 'min_child_samples': 12, 'min_child_weight': 0.01698515851958948, 'min_split_gain': 0.8055583271914607, 'cat_smooth': 16.273833286439427, 'cat_l2': 36.76925059424302}. Best is trial 20 with value: 4.080101444253324.[0m
Training until validation scores don't improve for 30 rounds
Early stopping, best iteration is:
[237]	valid_0's rmse: 4.40727	valid_0's l2: 19.424
Training until validation scores don't improve for 30 rounds
Early stopping, best iteration is:
[296]	valid_0's rmse: 4.1916	valid_0's l2: 17.5695
Training until validation scores don't improve for 30 rounds
Early stopping, best iteration is:
[252]	valid_0's rmse: 4.05617	valid_0's l2: 16.4526
Training until validation scores don't improve for 30 rounds
Early stopping, best iteration is:
[226]	valid_0's rmse: 4.4701	valid_0's l2: 19.9818
Training until validation scores don't improve for 30 rounds
Early stopping, best iteration is:
[280]	valid_0's rmse: 3.44323	valid_0's l2: 11.8558
[32m[I 2026-08-06 17:41:08,836][0m Trial 31 finished with value: 4.113674078584024 and parameters: {'boosting_type': 'gbdt', 'max_depth': 11, 'num_leaves': 45, 'learning_rate': 0.030239875001749204, 'n_estimators': 1890, 'subsample': 0.8707925382310356, 'subsample_freq': 9, 'colsample_bytree': 0.6983601689821364, 'reg_alpha': 7.084458133439278e-08, 'reg_lambda': 4.9276915529639995e-05, 'min_child_samples': 13, 'min_child_weight': 0.017203991117067573, 'min_split_gain': 0.8227168570316264, 'cat_smooth': 15.202760779705365, 'cat_l2': 36.82412731812958}. Best is trial 20 with value: 4.080101444253324.[0m
Training until validation scores don't improve for 30 rounds
Early stopping, best iteration is:
[144]	valid_0's rmse: 4.37762	valid_0's l2: 19.1636
Training until validation scores don't improve for 30 rounds
Early stopping, best iteration is:
[126]	valid_0's rmse: 4.08932	valid_0's l2: 16.7225
Training until validation scores don't improve for 30 rounds
Early stopping, best iteration is:
[149]	valid_0's rmse: 4.04063	valid_0's l2: 16.3267
Training until validation scores don't improve for 30 rounds
Early stopping, best iteration is:
[261]	valid_0's rmse: 4.24308	valid_0's l2: 18.0037
Training until validation scores don't improve for 30 rounds
Early stopping, best iteration is:
[115]	valid_0's rmse: 3.65411	valid_0's l2: 13.3526
[32m[I 2026-08-06 17:41:10,407][0m Trial 32 finished with value: 4.0809533968413305 and parameters: {'boosting_type': 'gbdt', 'max_depth': 11, 'num_leaves': 83, 'learning_rate': 0.0293745103515525, 'n_estimators': 2004, 'subsample': 0.83933888371474, 'subsample_freq': 9, 'colsample_bytree': 0.6327369778070812, 'reg_alpha': 6.538703062801348e-07, 'reg_lambda': 1.1249548026535644e-05, 'min_child_samples': 5, 'min_child_weight': 0.019788919932419876, 'min_split_gain': 0.920419163553317, 'cat_smooth': 14.835786716652136, 'cat_l2': 27.400427190506377}. Best is trial 20 with value: 4.080101444253324.[0m
Training until validation scores don't improve for 30 rounds
Early stopping, best iteration is:
[260]	valid_0's rmse: 4.57201	valid_0's l2: 20.9033
Training until validation scores don't improve for 30 rounds
Early stopping, best iteration is:
[397]	valid_0's rmse: 4.22827	valid_0's l2: 17.8783
[32m[I 2026-08-06 17:41:11,095][0m Trial 33 pruned. [0m
[32m[I 2026-08-06 17:41:22,417][0m Trial 34 finished with value: 4.188470148092152 and parameters: {'boosting_type': 'dart', 'max_depth': 9, 'num_leaves': 52, 'learning_rate': 0.018235463686065153, 'n_estimators': 2292, 'subsample': 0.8307278168124319, 'subsample_freq': 9, 'colsample_bytree': 0.6220156630012398, 'reg_alpha': 5.343611414487081e-06, 'reg_lambda': 0.0004180572672079624, 'min_child_samples': 13, 'min_child_weight': 0.017218128320418732, 'min_split_gain': 0.6559586461574025, 'cat_smooth': 8.882427631904271, 'cat_l2': 30.404611619045873, 'drop_rate': 0.15525870591280835, 'max_drop': 1, 'skip_drop': 0.18792572659193343}. Best is trial 20 with value: 4.080101444253324.[0m
Training until validation scores don't improve for 30 rounds
Early stopping, best iteration is:
[275]	valid_0's rmse: 4.56821	valid_0's l2: 20.8685
Training until validation scores don't improve for 30 rounds
Early stopping, best iteration is:
[352]	valid_0's rmse: 4.36109	valid_0's l2: 19.0191
[32m[I 2026-08-06 17:41:22,937][0m Trial 35 pruned. [0m
Training until validation scores don't improve for 30 rounds
Early stopping, best iteration is:
[297]	valid_0's rmse: 4.51563	valid_0's l2: 20.3909
Training until validation scores don't improve for 30 rounds
Early stopping, best iteration is:
[413]	valid_0's rmse: 4.20184	valid_0's l2: 17.6555
Training until validation scores don't improve for 30 rounds
Early stopping, best iteration is:
[359]	valid_0's rmse: 4.13366	valid_0's l2: 17.0871
Training until validation scores don't improve for 30 rounds
Early stopping, best iteration is:
[188]	valid_0's rmse: 4.67554	valid_0's l2: 21.8607
Training until validation scores don't improve for 30 rounds
Early stopping, best iteration is:
[273]	valid_0's rmse: 3.67111	valid_0's l2: 13.477
[32m[I 2026-08-06 17:41:24,199][0m Trial 36 pruned. [0m
Training until validation scores don't improve for 30 rounds
Early stopping, best iteration is:
[83]	valid_0's rmse: 4.51722	valid_0's l2: 20.4052
Training until validation scores don't improve for 30 rounds
Early stopping, best iteration is:
[224]	valid_0's rmse: 4.23554	valid_0's l2: 17.9398
Training until validation scores don't improve for 30 rounds
Early stopping, best iteration is:
[81]	valid_0's rmse: 4.32522	valid_0's l2: 18.7076
[32m[I 2026-08-06 17:41:24,665][0m Trial 37 pruned. [0m
[32m[I 2026-08-06 17:41:28,853][0m Trial 38 pruned. [0m
Training until validation scores don't improve for 30 rounds
Early stopping, best iteration is:
[159]	valid_0's rmse: 4.83878	valid_0's l2: 23.4138
Training until validation scores don't improve for 30 rounds
Early stopping, best iteration is:
[229]	valid_0's rmse: 4.371	valid_0's l2: 19.1057
[32m[I 2026-08-06 17:41:29,198][0m Trial 39 pruned. [0m
[32m[I 2026-08-06 17:41:43,858][0m Trial 40 pruned. [0m
Training until validation scores don't improve for 30 rounds
Early stopping, best iteration is:
[357]	valid_0's rmse: 4.45147	valid_0's l2: 19.8156
Training until validation scores don't improve for 30 rounds
Early stopping, best iteration is:
[420]	valid_0's rmse: 4.12661	valid_0's l2: 17.0289
Training until validation scores don't improve for 30 rounds
Early stopping, best iteration is:
[294]	valid_0's rmse: 4.00809	valid_0's l2: 16.0648
Training until validation scores don't improve for 30 rounds
Early stopping, best iteration is:
[378]	valid_0's rmse: 4.35275	valid_0's l2: 18.9464
Training until validation scores don't improve for 30 rounds
Early stopping, best iteration is:
[378]	valid_0's rmse: 3.39038	valid_0's l2: 11.4947
[32m[I 2026-08-06 17:41:46,425][0m Trial 41 finished with value: 4.065861105893954 and parameters: {'boosting_type': 'gbdt', 'max_depth': 13, 'num_leaves': 92, 'learning_rate': 0.01560998848313237, 'n_estimators': 1351, 'subsample': 0.8488802586974605, 'subsample_freq': 7, 'colsample_bytree': 0.6784698217693163, 'reg_alpha': 1.1051809912752064e-08, 'reg_lambda': 6.058301813995366e-05, 'min_child_samples': 10, 'min_child_weight': 0.006622489844207943, 'min_split_gain': 0.9389686293271704, 'cat_smooth': 14.074180695617148, 'cat_l2': 26.868063797091754}. Best is trial 41 with value: 4.065861105893954.[0m
Training until validation scores don't improve for 30 rounds
Early stopping, best iteration is:
[378]	valid_0's rmse: 4.51615	valid_0's l2: 20.3956
Training until validation scores don't improve for 30 rounds
Early stopping, best iteration is:
[424]	valid_0's rmse: 4.25392	valid_0's l2: 18.0959
Training until validation scores don't improve for 30 rounds
Early stopping, best iteration is:
[511]	valid_0's rmse: 4.14095	valid_0's l2: 17.1475
Training until validation scores don't improve for 30 rounds
Early stopping, best iteration is:
[252]	valid_0's rmse: 4.61194	valid_0's l2: 21.27
Training until validation scores don't improve for 30 rounds
Early stopping, best iteration is:
[378]	valid_0's rmse: 3.53038	valid_0's l2: 12.4636
[32m[I 2026-08-06 17:41:48,123][0m Trial 42 pruned. [0m
Training until validation scores don't improve for 30 rounds
Early stopping, best iteration is:
[136]	valid_0's rmse: 4.62457	valid_0's l2: 21.3867
Training until validation scores don't improve for 30 rounds
Early stopping, best iteration is:
[145]	valid_0's rmse: 4.19365	valid_0's l2: 17.5867
[32m[I 2026-08-06 17:41:48,900][0m Trial 43 pruned. [0m
Training until validation scores don't improve for 30 rounds
Early stopping, best iteration is:
[130]	valid_0's rmse: 4.56033	valid_0's l2: 20.7966
Training until validation scores don't improve for 30 rounds
Early stopping, best iteration is:
[190]	valid_0's rmse: 4.081	valid_0's l2: 16.6546
Training until validation scores don't improve for 30 rounds
Early stopping, best iteration is:
[127]	valid_0's rmse: 4.05028	valid_0's l2: 16.4048
Training until validation scores don't improve for 30 rounds
Early stopping, best iteration is:
[180]	valid_0's rmse: 4.24683	valid_0's l2: 18.0355
Training until validation scores don't improve for 30 rounds
Early stopping, best iteration is:
[186]	valid_0's rmse: 3.52243	valid_0's l2: 12.4075
[32m[I 2026-08-06 17:41:50,294][0m Trial 44 finished with value: 4.092174634168986 and parameters: {'boosting_type': 'gbdt', 'max_depth': 12, 'num_leaves': 128, 'learning_rate': 0.03552957486451993, 'n_estimators': 2171, 'subsample': 0.930144267245206, 'subsample_freq': 8, 'colsample_bytree': 0.5178230961580246, 'reg_alpha': 1.1437938490357426e-08, 'reg_lambda': 0.0002699257271197304, 'min_child_samples': 10, 'min_child_weight': 0.004648509004349725, 'min_split_gain': 0.754322493154806, 'cat_smooth': 12.61295424288367, 'cat_l2': 20.24232113693909}. Best is trial 41 with value: 4.065861105893954.[0m
Training until validation scores don't improve for 30 rounds
Early stopping, best iteration is:
[173]	valid_0's rmse: 4.3892	valid_0's l2: 19.2651
Training until validation scores don't improve for 30 rounds
Early stopping, best iteration is:
[186]	valid_0's rmse: 4.00626	valid_0's l2: 16.0501
Training until validation scores don't improve for 30 rounds
Early stopping, best iteration is:
[149]	valid_0's rmse: 3.94786	valid_0's l2: 15.5856
Training until validation scores don't improve for 30 rounds
Early stopping, best iteration is:
[189]	valid_0's rmse: 4.30771	valid_0's l2: 18.5564
Training until validation scores don't improve for 30 rounds
Early stopping, best iteration is:
[159]	valid_0's rmse: 3.46757	valid_0's l2: 12.0241
[32m[I 2026-08-06 17:41:51,719][0m Trial 45 finished with value: 4.023719697143319 and parameters: {'boosting_type': 'gbdt', 'max_depth': 12, 'num_leaves': 115, 'learning_rate': 0.03624407114200571, 'n_estimators': 1749, 'subsample': 0.9262142486357817, 'subsample_freq': 6, 'colsample_bytree': 0.5047586550781161, 'reg_alpha': 1.2282814280625453e-08, 'reg_lambda': 0.00015937235878788104, 'min_child_samples': 11, 'min_child_weight': 0.0045210953141523935, 'min_split_gain': 0.6818983598693341, 'cat_smooth': 18.708353630371576, 'cat_l2': 20.37797028638127}. Best is trial 45 with value: 4.023719697143319.[0m
Training until validation scores don't improve for 30 rounds
Early stopping, best iteration is:
[965]	valid_0's rmse: 4.76659	valid_0's l2: 22.7204
Training until validation scores don't improve for 30 rounds
Did not meet early stopping. Best iteration is:
[1465]	valid_0's rmse: 4.27413	valid_0's l2: 18.2682
[32m[I 2026-08-06 17:41:53,158][0m Trial 46 pruned. [0m
Training until validation scores don't improve for 30 rounds
Early stopping, best iteration is:
[149]	valid_0's rmse: 4.39654	valid_0's l2: 19.3296
Training until validation scores don't improve for 30 rounds
Early stopping, best iteration is:
[150]	valid_0's rmse: 4.35985	valid_0's l2: 19.0083
Training until validation scores don't improve for 30 rounds
Early stopping, best iteration is:
[275]	valid_0's rmse: 4.08534	valid_0's l2: 16.69
Training until validation scores don't improve for 30 rounds
Early stopping, best iteration is:
[205]	valid_0's rmse: 4.39864	valid_0's l2: 19.348
Training until validation scores don't improve for 30 rounds
Early stopping, best iteration is:
[140]	valid_0's rmse: 3.57064	valid_0's l2: 12.7495
