[32m[I 2026-08-06 17:41:54,287][0m Trial 47 finished with value: 4.162202541266152 and parameters: {'boosting_type': 'gbdt', 'max_depth': 12, 'num_leaves': 95, 'learning_rate': 0.04227174703284085, 'n_estimators': 1718, 'subsample': 0.5050269761741197, 'subsample_freq': 5, 'colsample_bytree': 0.4407371224840171, 'reg_alpha': 1.0340780255204991e-08, 'reg_lambda': 0.0020892124296219565, 'min_child_samples': 10, 'min_child_weight': 0.0022781193275481374, 'min_split_gain': 0.6280163896539241, 'cat_smooth': 21.869699360503713, 'cat_l2': 43.451813450749604}. Best is trial 45 with value: 4.023719697143319.[0m
Training until validation scores don't improve for 30 rounds
Early stopping, best iteration is:
[209]	valid_0's rmse: 4.63317	valid_0's l2: 21.4663
Training until validation scores don't improve for 30 rounds
Early stopping, best iteration is:
[342]	valid_0's rmse: 4.11994	valid_0's l2: 16.9739
Training until validation scores don't improve for 30 rounds
Early stopping, best iteration is:
[253]	valid_0's rmse: 3.97885	valid_0's l2: 15.8312
Training until validation scores don't improve for 30 rounds
Early stopping, best iteration is:
[219]	valid_0's rmse: 4.37636	valid_0's l2: 19.1525
Training until validation scores don't improve for 30 rounds
Early stopping, best iteration is:
[182]	valid_0's rmse: 3.52555	valid_0's l2: 12.4295
[32m[I 2026-08-06 17:41:55,578][0m Trial 48 finished with value: 4.12677321394902 and parameters: {'boosting_type': 'gbdt', 'max_depth': 10, 'num_leaves': 62, 'learning_rate': 0.033932027420348745, 'n_estimators': 1766, 'subsample': 0.9697209876380842, 'subsample_freq': 6, 'colsample_bytree': 0.41010130668933836, 'reg_alpha': 4.0829350727238195e-07, 'reg_lambda': 1.7390965139308925e-05, 'min_child_samples': 19, 'min_child_weight': 0.004249554372923711, 'min_split_gain': 0.8025657927827654, 'cat_smooth': 19.80210923419761, 'cat_l2': 34.71169494973061}. Best is trial 45 with value: 4.023719697143319.[0m
Training until validation scores don't improve for 30 rounds
Early stopping, best iteration is:
[300]	valid_0's rmse: 4.47036	valid_0's l2: 19.9841
Training until validation scores don't improve for 30 rounds
Early stopping, best iteration is:
[340]	valid_0's rmse: 4.15602	valid_0's l2: 17.2725
Training until validation scores don't improve for 30 rounds
Early stopping, best iteration is:
[256]	valid_0's rmse: 4.12393	valid_0's l2: 17.0068
Training until validation scores don't improve for 30 rounds
Early stopping, best iteration is:
[324]	valid_0's rmse: 4.45194	valid_0's l2: 19.8198
Training until validation scores don't improve for 30 rounds
Early stopping, best iteration is:
[355]	valid_0's rmse: 3.33056	valid_0's l2: 11.0927
[32m[I 2026-08-06 17:41:58,078][0m Trial 49 finished with value: 4.106563445770266 and parameters: {'boosting_type': 'gbdt', 'max_depth': 13, 'num_leaves': 117, 'learning_rate': 0.016341457744341113, 'n_estimators': 1049, 'subsample': 0.8175555325433013, 'subsample_freq': 6, 'colsample_bytree': 0.9236191506042905, 'reg_alpha': 3.482562204294117e-08, 'reg_lambda': 2.779704459583229e-05, 'min_child_samples': 10, 'min_child_weight': 0.0006768624201315174, 'min_split_gain': 0.7143811391744231, 'cat_smooth': 15.54907280500366, 'cat_l2': 13.587608005886555}. Best is trial 45 with value: 4.023719697143319.[0m

=== Best Trial ===
  CV RMSE: 4.023720
  Params:  {'boosting_type': 'gbdt', 'max_depth': 12, 'num_leaves': 115, 'learning_rate': 0.03624407114200571, 'n_estimators': 1749, 'subsample': 0.9262142486357817, 'subsample_freq': 6, 'colsample_bytree': 0.5047586550781161, 'reg_alpha': 1.2282814280625453e-08, 'reg_lambda': 0.00015937235878788104, 'min_child_samples': 11, 'min_child_weight': 0.0045210953141523935, 'min_split_gain': 0.6818983598693341, 'cat_smooth': 18.708353630371576, 'cat_l2': 20.37797028638127}

============================================================
Training Final Model with Best Hyperparameters
============================================================
Training until validation scores don't improve for 50 rounds
[50]	valid_0's rmse: 5.11173	valid_0's l2: 26.1298
[100]	valid_0's rmse: 4.91203	valid_0's l2: 24.1281
[150]	valid_0's rmse: 4.88931	valid_0's l2: 23.9054
Early stopping, best iteration is:
[138]	valid_0's rmse: 4.88217	valid_0's l2: 23.8355

============================================================
Test Evaluation
============================================================
  Test MSE:  20.1220
  Test RMSE: 4.4858
  Test MAE:  3.1482
  Test R²:   0.6121

============================================================
Top 20 Feature Importances
============================================================
   1. MolWt                      148.0
   2. atom_mean_35               132.0
   3. tail_ratio                 130.0
   4. LogP                       107.0
   5. atom_std_25                86.0
   6. atom_std_35                84.0
   7. HeavyAtoms                 83.0
   8. atom_mean_48               81.0
   9. RotBonds                   79.0
  10. atom_mean_39               78.0
  11. atom_mean_47               76.0
  12. atom_std_47                76.0
  13. atom_mean_3                75.0
  14. atom_std_54                74.0
  15. atom_mean_52               73.0
  16. brics_30                   73.0
  17. atom_mean_24               71.0
  18. atom_mean_23               71.0
  19. atom_mean_25               70.0
  20. atom_mean_26               68.0

Plot saved to runs\Pi_CMC\Pi_CMC_lightgbm_20260806_174010\pred_vs_true.png
Model saved to runs\Pi_CMC\Pi_CMC_lightgbm_20260806_174010\model.pkl

============================================================
SUMMARY — LightGBM + PharmHGT Features
============================================================
  Features:  522-dim (atom_agg + bond_agg + MACCS + BRICS + surfactant + descriptors)
  Train:     552 (val 79)
  Test:      70
  Optuna:    50 trials, 5-fold CV
  Best CV RMSE: 4.0237
  Test RMSE: 4.4858
  Test MAE:  3.1482
  Test R²:   0.6121

指标已保存: runs\Pi_CMC\Pi_CMC_lightgbm_20260806_174010\metrics.json
索引已更新: runs\Pi_CMC\_runs_index.csv
索引已更新: runs\_runs_index.csv
