============================================================
lightgbm — 运行开始  20260806_174010
  输出目录:  runs\Pi_CMC\Pi_CMC_lightgbm_20260806_174010
============================================================
============================================================
LightGBM + PharmHGT-style Featurization for Pi_CMC Prediction
============================================================
[Cache HIT] Loading features from data\features\surfpro\Pi_CMC
  Train features: (631, 522)
  Test features:  (70, 522)

Split: Train 552, Val 79, Test 70

============================================================
Optuna Hyperparameter Tuning (50 trials, 5-Fold CV)
============================================================
[32m[I 2026-08-06 17:40:12,614][0m Trial 0 finished with value: 21.940321441593863 and parameters: {'boosting_type': 'dart', 'max_depth': 12, 'num_leaves': 159, 'learning_rate': 0.009470976192691145, 'n_estimators': 890, 'subsample': 0.5290418060840998, 'subsample_freq': 9, 'colsample_bytree': 0.7207805082202461, 'reg_alpha': 0.023585940584142682, 'reg_lambda': 1.5320059381854043e-08, 'min_child_samples': 98, 'min_child_weight': 0.021368329072358756, 'min_split_gain': 0.21233911067827616, 'cat_smooth': 9.091248360355031, 'cat_l2': 9.17022549267169, 'drop_rate': 0.09823025045826593, 'max_drop': 27, 'skip_drop': 0.13526405540621358}. Best is trial 0 with value: 21.940321441593863.[0m
[32m[I 2026-08-06 17:40:18,984][0m Trial 1 finished with value: 9.159338032045046 and parameters: {'boosting_type': 'dart', 'max_depth': 4, 'num_leaves': 85, 'learning_rate': 0.02240870575939826, 'n_estimators': 1640, 'subsample': 0.8925879806965068, 'subsample_freq': 2, 'colsample_bytree': 0.6599641068895281, 'reg_alpha': 0.0021465011216654484, 'reg_lambda': 2.6185068507773707e-08, 'min_child_samples': 63, 'min_child_weight': 4.809461967501571e-05, 'min_split_gain': 0.06505159298527952, 'cat_smooth': 47.44427686266666, 'cat_l2': 48.28160165372797, 'drop_rate': 0.24443523095377373, 'max_drop': 16, 'skip_drop': 0.03832491306185132}. Best is trial 1 with value: 9.159338032045046.[0m
Training until validation scores don't improve for 30 rounds
Early stopping, best iteration is:
[1295]	valid_0's rmse: 4.82067	valid_0's l2: 23.2389
Training until validation scores don't improve for 30 rounds
Early stopping, best iteration is:
[784]	valid_0's rmse: 4.68078	valid_0's l2: 21.9097
Training until validation scores don't improve for 30 rounds
Early stopping, best iteration is:
[1134]	valid_0's rmse: 4.38192	valid_0's l2: 19.2013
Training until validation scores don't improve for 30 rounds
Early stopping, best iteration is:
[1214]	valid_0's rmse: 4.71432	valid_0's l2: 22.2248
Training until validation scores don't improve for 30 rounds
Early stopping, best iteration is:
[1281]	valid_0's rmse: 3.66609	valid_0's l2: 13.4402
[32m[I 2026-08-06 17:40:21,516][0m Trial 2 finished with value: 4.452757133662436 and parameters: {'boosting_type': 'gbdt', 'max_depth': 4, 'num_leaves': 134, 'learning_rate': 0.005755963034165359, 'n_estimators': 2774, 'subsample': 0.6293899908000085, 'subsample_freq': 7, 'colsample_bytree': 0.5181977532625877, 'reg_alpha': 0.0004793052550782129, 'reg_lambda': 0.0008325158565947976, 'min_child_samples': 22, 'min_child_weight': 0.07556810141274425, 'min_split_gain': 0.7751328233611146, 'cat_smooth': 46.97494707820945, 'cat_l2': 44.74136752138244}. Best is trial 2 with value: 4.452757133662436.[0m
[32m[I 2026-08-06 17:40:25,108][0m Trial 3 finished with value: 21.294443677076643 and parameters: {'boosting_type': 'dart', 'max_depth': 4, 'num_leaves': 62, 'learning_rate': 0.006017151754328819, 'n_estimators': 1313, 'subsample': 0.6943386448447411, 'subsample_freq': 3, 'colsample_bytree': 0.8801162564063505, 'reg_alpha': 1.6247252885719427e-05, 'reg_lambda': 3.376063348877853e-06, 'min_child_samples': 57, 'min_child_weight': 3.661819220392426e-05, 'min_split_gain': 0.8021969807540397, 'cat_smooth': 3.727532183988541, 'cat_l2': 49.34434683002586, 'drop_rate': 0.23395098309603066, 'max_drop': 10, 'skip_drop': 0.011601413965844696}. Best is trial 2 with value: 4.452757133662436.[0m
Training until validation scores don't improve for 30 rounds
Early stopping, best iteration is:
[673]	valid_0's rmse: 5.14633	valid_0's l2: 26.4847
Training until validation scores don't improve for 30 rounds
Early stopping, best iteration is:
[1089]	valid_0's rmse: 4.67025	valid_0's l2: 21.8112
Training until validation scores don't improve for 30 rounds
Early stopping, best iteration is:
[1053]	valid_0's rmse: 4.65763	valid_0's l2: 21.6935
Training until validation scores don't improve for 30 rounds
Early stopping, best iteration is:
[971]	valid_0's rmse: 4.80353	valid_0's l2: 23.0739
Training until validation scores don't improve for 30 rounds
Early stopping, best iteration is:
[745]	valid_0's rmse: 3.91528	valid_0's l2: 15.3294
[32m[I 2026-08-06 17:40:26,568][0m Trial 4 finished with value: 4.638603358296988 and parameters: {'boosting_type': 'gbdt', 'max_depth': 12, 'num_leaves': 200, 'learning_rate': 0.006770684770701556, 'n_estimators': 1396, 'subsample': 0.5579345297625649, 'subsample_freq': 9, 'colsample_bytree': 0.7363086887792905, 'reg_alpha': 9.507847858536042e-06, 'reg_lambda': 3.732717755563729e-08, 'min_child_samples': 34, 'min_child_weight': 0.00019986340778528852, 'min_split_gain': 0.7296061783380641, 'cat_smooth': 31.877873567760656, 'cat_l2': 44.36063712881633}. Best is trial 2 with value: 4.452757133662436.[0m
Training until validation scores don't improve for 30 rounds
Early stopping, best iteration is:
[92]	valid_0's rmse: 4.48155	valid_0's l2: 20.0843
Training until validation scores don't improve for 30 rounds
Early stopping, best iteration is:
[90]	valid_0's rmse: 4.2295	valid_0's l2: 17.8887
Training until validation scores don't improve for 30 rounds
Early stopping, best iteration is:
[109]	valid_0's rmse: 4.10884	valid_0's l2: 16.8825
Training until validation scores don't improve for 30 rounds
Early stopping, best iteration is:
[207]	valid_0's rmse: 4.35103	valid_0's l2: 18.9315
Training until validation scores don't improve for 30 rounds
Early stopping, best iteration is:
[84]	valid_0's rmse: 3.63366	valid_0's l2: 13.2035
[32m[I 2026-08-06 17:40:27,528][0m Trial 5 finished with value: 4.16091519777889 and parameters: {'boosting_type': 'gbdt', 'max_depth': 12, 'num_leaves': 198, 'learning_rate': 0.04977436807314311, 'n_estimators': 2428, 'subsample': 0.7468977981821954, 'subsample_freq': 6, 'colsample_bytree': 0.5992787128509847, 'reg_alpha': 1.6934490731313353e-08, 'reg_lambda': 9.354548757337708e-08, 'min_child_samples': 8, 'min_child_weight': 0.003512704726270845, 'min_split_gain': 0.3143559810763267, 'cat_smooth': 25.42853455823514, 'cat_l2': 45.37832369630465}. Best is trial 5 with value: 4.16091519777889.[0m
[32m[I 2026-08-06 17:40:28,567][0m Trial 6 pruned. [0m
[32m[I 2026-08-06 17:40:30,056][0m Trial 7 pruned. [0m
Training until validation scores don't improve for 30 rounds
Early stopping, best iteration is:
[275]	valid_0's rmse: 5.37542	valid_0's l2: 28.8951
Training until validation scores don't improve for 30 rounds
Early stopping, best iteration is:
[345]	valid_0's rmse: 5.47443	valid_0's l2: 29.9694
Training until validation scores don't improve for 30 rounds
Did not meet early stopping. Best iteration is:
[625]	valid_0's rmse: 4.83485	valid_0's l2: 23.3758
Training until validation scores don't improve for 30 rounds
Early stopping, best iteration is:
[290]	valid_0's rmse: 5.4417	valid_0's l2: 29.6121
Training until validation scores don't improve for 30 rounds
Early stopping, best iteration is:
[340]	valid_0's rmse: 4.56568	valid_0's l2: 20.8454
[32m[I 2026-08-06 17:40:30,610][0m Trial 8 finished with value: 5.138415867041019 and parameters: {'boosting_type': 'gbdt', 'max_depth': 3, 'num_leaves': 161, 'learning_rate': 0.03915699341344363, 'n_estimators': 628, 'subsample': 0.6393232321183058, 'subsample_freq': 10, 'colsample_bytree': 0.46769332346688064, 'reg_alpha': 2.0139739500176936e-07, 'reg_lambda': 0.0002541410632209718, 'min_child_samples': 99, 'min_child_weight': 9.294394155644992e-05, 'min_split_gain': 0.6721355474058786, 'cat_smooth': 38.08098076643588, 'cat_l2': 11.881877199619984}. Best is trial 5 with value: 4.16091519777889.[0m
Training until validation scores don't improve for 30 rounds
Early stopping, best iteration is:
[509]	valid_0's rmse: 4.65189	valid_0's l2: 21.6401
Training until validation scores don't improve for 30 rounds
Early stopping, best iteration is:
[275]	valid_0's rmse: 4.57123	valid_0's l2: 20.8961
Training until validation scores don't improve for 30 rounds
Early stopping, best iteration is:
[424]	valid_0's rmse: 4.41747	valid_0's l2: 19.514
Training until validation scores don't improve for 30 rounds
Early stopping, best iteration is:
[425]	valid_0's rmse: 4.56521	valid_0's l2: 20.8411
Training until validation scores don't improve for 30 rounds
Early stopping, best iteration is:
[308]	valid_0's rmse: 3.89908	valid_0's l2: 15.2028
[32m[I 2026-08-06 17:40:31,376][0m Trial 9 finished with value: 4.420975521651956 and parameters: {'boosting_type': 'gbdt', 'max_depth': 11, 'num_leaves': 167, 'learning_rate': 0.044839259184207204, 'n_estimators': 725, 'subsample': 0.917651247794619, 'subsample_freq': 4, 'colsample_bytree': 0.4305629572798979, 'reg_alpha': 2.3279640748356466e-08, 'reg_lambda': 0.0020798714270728416, 'min_child_samples': 70, 'min_child_weight': 1.1650681118986128e-05, 'min_split_gain': 0.512093058299281, 'cat_smooth': 11.324788759896897, 'cat_l2': 32.25863952047249}. Best is trial 5 with value: 4.16091519777889.[0m
Training until validation scores don't improve for 30 rounds
Early stopping, best iteration is:
[27]	valid_0's rmse: 4.53869	valid_0's l2: 20.5997
Training until validation scores don't improve for 30 rounds
Early stopping, best iteration is:
[29]	valid_0's rmse: 4.23547	valid_0's l2: 17.9392
Training until validation scores don't improve for 30 rounds
Early stopping, best iteration is:
[61]	valid_0's rmse: 4.29837	valid_0's l2: 18.4759
Training until validation scores don't improve for 30 rounds
Early stopping, best iteration is:
[59]	valid_0's rmse: 4.38905	valid_0's l2: 19.2638
Training until validation scores don't improve for 30 rounds
Early stopping, best iteration is:
[25]	valid_0's rmse: 3.65837	valid_0's l2: 13.3837
[32m[I 2026-08-06 17:40:31,727][0m Trial 10 finished with value: 4.223990881409134 and parameters: {'boosting_type': 'gbdt', 'max_depth': 8, 'num_leaves': 16, 'learning_rate': 0.227364806419381, 'n_estimators': 2938, 'subsample': 0.8139601740123973, 'subsample_freq': 6, 'colsample_bytree': 0.31464890149101077, 'reg_alpha': 3.331630946893803, 'reg_lambda': 0.04422317327084487, 'min_child_samples': 7, 'min_child_weight': 0.002949971987301989, 'min_split_gain': 0.34052523698531706, 'cat_smooth': 21.71781358782057, 'cat_l2': 23.63570033289743}. Best is trial 5 with value: 4.16091519777889.[0m
Training until validation scores don't improve for 30 rounds
Early stopping, best iteration is:
[18]	valid_0's rmse: 4.60478	valid_0's l2: 21.204
Training until validation scores don't improve for 30 rounds
Early stopping, best iteration is:
[57]	valid_0's rmse: 4.37107	valid_0's l2: 19.1063
Training until validation scores don't improve for 30 rounds
Early stopping, best iteration is:
[26]	valid_0's rmse: 4.0757	valid_0's l2: 16.6114
Training until validation scores don't improve for 30 rounds
Early stopping, best iteration is:
[63]	valid_0's rmse: 4.51984	valid_0's l2: 20.4289
Training until validation scores don't improve for 30 rounds
Early stopping, best iteration is:
[18]	valid_0's rmse: 3.87492	valid_0's l2: 15.015
[32m[I 2026-08-06 17:40:32,105][0m Trial 11 finished with value: 4.289262273128797 and parameters: {'boosting_type': 'gbdt', 'max_depth': 8, 'num_leaves': 17, 'learning_rate': 0.23953129153336494, 'n_estimators': 2928, 'subsample': 0.8078766364822536, 'subsample_freq': 6, 'colsample_bytree': 0.32115714350578634, 'reg_alpha': 0.9465205392725847, 'reg_lambda': 0.03437860194381641, 'min_child_samples': 8, 'min_child_weight': 0.003605373423410191, 'min_split_gain': 0.34279928826631645, 'cat_smooth': 20.552612036841047, 'cat_l2': 23.885061810240234}. Best is trial 5 with value: 4.16091519777889.[0m
Training until validation scores don't improve for 30 rounds
Early stopping, best iteration is:
[51]	valid_0's rmse: 4.74388	valid_0's l2: 22.5044
Training until validation scores don't improve for 30 rounds
Early stopping, best iteration is:
[25]	valid_0's rmse: 4.34786	valid_0's l2: 18.9039
Training until validation scores don't improve for 30 rounds
Early stopping, best iteration is:
[33]	valid_0's rmse: 4.20485	valid_0's l2: 17.6808
Training until validation scores don't improve for 30 rounds
Early stopping, best iteration is:
[61]	valid_0's rmse: 4.47298	valid_0's l2: 20.0075
Training until validation scores don't improve for 30 rounds
Early stopping, best iteration is:
[28]	valid_0's rmse: 3.52311	valid_0's l2: 12.4123
[32m[I 2026-08-06 17:40:32,444][0m Trial 12 finished with value: 4.2592446453905195 and parameters: {'boosting_type': 'gbdt', 'max_depth': 8, 'num_leaves': 21, 'learning_rate': 0.2893505264962859, 'n_estimators': 2450, 'subsample': 0.8079907687060501, 'subsample_freq': 6, 'colsample_bytree': 0.5734900914025272, 'reg_alpha': 7.614591835427478, 'reg_lambda': 1.9604671139490574e-06, 'min_child_samples': 7, 'min_child_weight': 0.002704737199549875, 'min_split_gain': 0.39260797274014597, 'cat_smooth': 23.16048296976551, 'cat_l2': 22.61631564388042}. Best is trial 5 with value: 4.16091519777889.[0m
Training until validation scores don't improve for 30 rounds
Early stopping, best iteration is:
[103]	valid_0's rmse: 4.66303	valid_0's l2: 21.7438
Training until validation scores don't improve for 30 rounds
Early stopping, best iteration is:
[176]	valid_0's rmse: 4.12568	valid_0's l2: 17.0212
Training until validation scores don't improve for 30 rounds
Early stopping, best iteration is:
[81]	valid_0's rmse: 4.24122	valid_0's l2: 17.988
Training until validation scores don't improve for 30 rounds
Early stopping, best iteration is:
[75]	valid_0's rmse: 4.60932	valid_0's l2: 21.2459
Training until validation scores don't improve for 30 rounds
Early stopping, best iteration is:
[92]	valid_0's rmse: 3.58164	valid_0's l2: 12.8282
[32m[I 2026-08-06 17:40:33,082][0m Trial 13 finished with value: 4.244178349140449 and parameters: {'boosting_type': 'gbdt', 'max_depth': 15, 'num_leaves': 248, 'learning_rate': 0.10059099752153669, 'n_estimators': 2330, 'subsample': 0.9913430783889022, 'subsample_freq': 5, 'colsample_bytree': 0.9967841647106989, 'reg_alpha': 0.0823060263603205, 'reg_lambda': 1.1791139247966352e-05, 'min_child_samples': 22, 'min_child_weight': 0.0006897395462103529, 'min_split_gain': 0.17676135789481792, 'cat_smooth': 33.0299622914229, 'cat_l2': 2.4975717167187597}. Best is trial 5 with value: 4.16091519777889.[0m
Training until validation scores don't improve for 30 rounds
Early stopping, best iteration is:
[58]	valid_0's rmse: 4.74091	valid_0's l2: 22.4763
Training until validation scores don't improve for 30 rounds
Early stopping, best iteration is:
[98]	valid_0's rmse: 4.33119	valid_0's l2: 18.7592
Training until validation scores don't improve for 30 rounds
Early stopping, best iteration is:
[68]	valid_0's rmse: 4.20337	valid_0's l2: 17.6683
Training until validation scores don't improve for 30 rounds
Early stopping, best iteration is:
[85]	valid_0's rmse: 4.56994	valid_0's l2: 20.8844
Training until validation scores don't improve for 30 rounds
Early stopping, best iteration is:
[78]	valid_0's rmse: 3.55937	valid_0's l2: 12.6691
[32m[I 2026-08-06 17:40:33,500][0m Trial 14 finished with value: 4.2809568185253415 and parameters: {'boosting_type': 'gbdt', 'max_depth': 8, 'num_leaves': 101, 'learning_rate': 0.12740947038253528, 'n_estimators': 2163, 'subsample': 0.7908231072588576, 'subsample_freq': 7, 'colsample_bytree': 0.3066324406958802, 'reg_alpha': 3.575451953341736e-07, 'reg_lambda': 0.21180848321587975, 'min_child_samples': 24, 'min_child_weight': 0.01197635766406829, 'min_split_gain': 0.44016315543372253, 'cat_smooth': 14.281820714462503, 'cat_l2': 33.68994426171048}. Best is trial 5 with value: 4.16091519777889.[0m
Training until validation scores don't improve for 30 rounds
Early stopping, best iteration is:
[40]	valid_0's rmse: 4.5259	valid_0's l2: 20.4837
Training until validation scores don't improve for 30 rounds
Early stopping, best iteration is:
[69]	valid_0's rmse: 4.35429	valid_0's l2: 18.9598
Training until validation scores don't improve for 30 rounds
Early stopping, best iteration is:
[66]	valid_0's rmse: 4.1157	valid_0's l2: 16.939
Training until validation scores don't improve for 30 rounds
Early stopping, best iteration is:
[105]	valid_0's rmse: 4.25106	valid_0's l2: 18.0715
Training until validation scores don't improve for 30 rounds
Early stopping, best iteration is:
[57]	valid_0's rmse: 3.56488	valid_0's l2: 12.7084
[32m[I 2026-08-06 17:40:34,104][0m Trial 15 finished with value: 4.162363970869126 and parameters: {'boosting_type': 'gbdt', 'max_depth': 10, 'num_leaves': 128, 'learning_rate': 0.10967767672646274, 'n_estimators': 2687, 'subsample': 0.723004607732685, 'subsample_freq': 1, 'colsample_bytree': 0.6003195309450419, 'reg_alpha': 0.00019189111663470626, 'reg_lambda': 0.01216157378449502, 'min_child_samples': 8, 'min_child_weight': 0.009182380300848954, 'min_split_gain': 0.5425773205460362, 'cat_smooth': 27.023652757799557, 'cat_l2': 21.593480092704628}. Best is trial 5 with value: 4.16091519777889.[0m
Training until validation scores don't improve for 30 rounds
Early stopping, best iteration is:
[239]	valid_0's rmse: 4.74063	valid_0's l2: 22.4735
Training until validation scores don't improve for 30 rounds
Early stopping, best iteration is:
[207]	valid_0's rmse: 4.41777	valid_0's l2: 19.5167
[32m[I 2026-08-06 17:40:34,359][0m Trial 16 pruned. [0m
Training until validation scores don't improve for 30 rounds
Early stopping, best iteration is:
[446]	valid_0's rmse: 4.59913	valid_0's l2: 21.152
Training until validation scores don't improve for 30 rounds
Early stopping, best iteration is:
[518]	valid_0's rmse: 4.25508	valid_0's l2: 18.1057
Training until validation scores don't improve for 30 rounds
Early stopping, best iteration is:
[394]	valid_0's rmse: 4.1647	valid_0's l2: 17.3447
Training until validation scores don't improve for 30 rounds
Early stopping, best iteration is:
[251]	valid_0's rmse: 4.54577	valid_0's l2: 20.664
Training until validation scores don't improve for 30 rounds
Early stopping, best iteration is:
[304]	valid_0's rmse: 3.5332	valid_0's l2: 12.4835
[32m[I 2026-08-06 17:40:35,777][0m Trial 17 finished with value: 4.2195762718011185 and parameters: {'boosting_type': 'gbdt', 'max_depth': 15, 'num_leaves': 118, 'learning_rate': 0.019501002200285413, 'n_estimators': 2052, 'subsample': 0.6708751158066085, 'subsample_freq': 2, 'colsample_bytree': 0.7126801222840108, 'reg_alpha': 2.2431957681667424e-08, 'reg_lambda': 3.203411504928979e-07, 'min_child_samples': 16, 'min_child_weight': 0.0761235826585147, 'min_split_gain': 0.5968195030219837, 'cat_smooth': 41.06306244734352, 'cat_l2': 33.40419382464215}. Best is trial 5 with value: 4.16091519777889.[0m
Training until validation scores don't improve for 30 rounds
Early stopping, best iteration is:
[330]	valid_0's rmse: 4.75943	valid_0's l2: 22.6522
Training until validation scores don't improve for 30 rounds
Early stopping, best iteration is:
[285]	valid_0's rmse: 4.50885	valid_0's l2: 20.3297
[32m[I 2026-08-06 17:40:36,126][0m Trial 18 pruned. [0m
Training until validation scores don't improve for 30 rounds
Early stopping, best iteration is:
[40]	valid_0's rmse: 4.63241	valid_0's l2: 21.4593
Training until validation scores don't improve for 30 rounds
Early stopping, best iteration is:
[117]	valid_0's rmse: 4.13149	valid_0's l2: 17.0692
Training until validation scores don't improve for 30 rounds
Early stopping, best iteration is:
[46]	valid_0's rmse: 4.08264	valid_0's l2: 16.668
Training until validation scores don't improve for 30 rounds
Early stopping, best iteration is:
[47]	valid_0's rmse: 4.46809	valid_0's l2: 19.9638
Training until validation scores don't improve for 30 rounds
Early stopping, best iteration is:
[100]	valid_0's rmse: 3.69963	valid_0's l2: 13.6873
[32m[I 2026-08-06 17:40:36,561][0m Trial 19 finished with value: 4.202853720531963 and parameters: {'boosting_type': 'gbdt', 'max_depth': 6, 'num_leaves': 185, 'learning_rate': 0.15207932461778287, 'n_estimators': 2065, 'subsample': 0.899292690930697, 'subsample_freq': 4, 'colsample_bytree': 0.8273652262244475, 'reg_alpha': 0.00012789221869450492, 'reg_lambda': 0.000109643496455972, 'min_child_samples': 16, 'min_child_weight': 0.007194921407223268, 'min_split_gain': 0.0469514163943332, 'cat_smooth': 29.202629537841542, 'cat_l2': 38.12829080304144}. Best is trial 5 with value: 4.16091519777889.[0m
Training until validation scores don't improve for 30 rounds
Early stopping, best iteration is:
[127]	valid_0's rmse: 4.40555	valid_0's l2: 19.4089
Training until validation scores don't improve for 30 rounds
Early stopping, best iteration is:
[231]	valid_0's rmse: 4.06555	valid_0's l2: 16.5287
Training until validation scores don't improve for 30 rounds
Early stopping, best iteration is:
[140]	valid_0's rmse: 4.15044	valid_0's l2: 17.2262
Training until validation scores don't improve for 30 rounds
Early stopping, best iteration is:
[233]	valid_0's rmse: 4.22307	valid_0's l2: 17.8343
Training until validation scores don't improve for 30 rounds
Early stopping, best iteration is:
[184]	valid_0's rmse: 3.55589	valid_0's l2: 12.6444
