[32m[I 2026-08-02 20:02:01,821][0m Trial 162 finished with value: 0.5019130250776112 and parameters: {'n_estimators': 1587, 'max_depth': 6, 'learning_rate': 0.018328189512260843, 'subsample': 0.9047345422632919, 'colsample_bytree': 0.9568457285554013, 'colsample_bylevel': 0.9801393364238545, 'colsample_bynode': 0.7385634335159965, 'min_child_weight': 11.425841221766014, 'gamma': 0.1561986920576423, 'reg_alpha': 0.01069980026386419, 'reg_lambda': 1.6952005518204987e-06, 'max_delta_step': 1.8251873950828625, 'booster': 'gbtree'}. Best is trial 128 with value: 0.49161333181334654.[0m
[32m[I 2026-08-02 20:02:07,900][0m Trial 163 finished with value: 0.5045648090195783 and parameters: {'n_estimators': 2620, 'max_depth': 6, 'learning_rate': 0.04808297554629631, 'subsample': 0.7546867513005172, 'colsample_bytree': 0.8037702421946714, 'colsample_bylevel': 0.9413157219453685, 'colsample_bynode': 0.7654328522157572, 'min_child_weight': 6.734951904246276, 'gamma': 0.20267270538355503, 'reg_alpha': 0.0017156911758439502, 'reg_lambda': 0.00011923231913890677, 'max_delta_step': 1.5022725542051818, 'booster': 'gbtree'}. Best is trial 128 with value: 0.49161333181334654.[0m
[32m[I 2026-08-02 20:02:10,955][0m Trial 164 pruned. [0m
[32m[I 2026-08-02 20:02:13,598][0m Trial 165 pruned. [0m
[32m[I 2026-08-02 20:02:32,934][0m Trial 166 finished with value: 0.5033851392017852 and parameters: {'n_estimators': 1059, 'max_depth': 9, 'learning_rate': 0.028431081067290673, 'subsample': 0.7265360366653009, 'colsample_bytree': 0.7728994528424008, 'colsample_bylevel': 0.6615168055500682, 'colsample_bynode': 0.38141824759752574, 'min_child_weight': 2.6544373132609222, 'gamma': 0.07653076022483217, 'reg_alpha': 2.5748435370812808, 'reg_lambda': 0.002085251269017032, 'max_delta_step': 0.1616339895782084, 'booster': 'dart'}. Best is trial 128 with value: 0.49161333181334654.[0m
[32m[I 2026-08-02 20:03:00,204][0m Trial 167 finished with value: 0.5035555747726697 and parameters: {'n_estimators': 1439, 'max_depth': 8, 'learning_rate': 0.011216399617651036, 'subsample': 0.7865894318034152, 'colsample_bytree': 0.9647875782095935, 'colsample_bylevel': 0.7514033550671084, 'colsample_bynode': 0.6969928466360759, 'min_child_weight': 2.081701954483369, 'gamma': 0.1071378551293799, 'reg_alpha': 0.19853070053681904, 'reg_lambda': 9.778331846661659e-05, 'max_delta_step': 3.03649344772974, 'booster': 'dart'}. Best is trial 128 with value: 0.49161333181334654.[0m
[32m[I 2026-08-02 20:03:05,299][0m Trial 168 pruned. [0m
[32m[I 2026-08-02 20:03:14,829][0m Trial 169 pruned. [0m
[32m[I 2026-08-02 20:03:28,740][0m Trial 170 finished with value: 0.5033228619172465 and parameters: {'n_estimators': 1362, 'max_depth': 7, 'learning_rate': 0.04917590217123715, 'subsample': 0.6858992624246235, 'colsample_bytree': 0.7469802398890354, 'colsample_bylevel': 0.9491706573466716, 'colsample_bynode': 0.42857706279119967, 'min_child_weight': 14.514362877066743, 'gamma': 0.019761822650022097, 'reg_alpha': 5.444307601469365e-07, 'reg_lambda': 0.0002966625577371649, 'max_delta_step': 0.16336619730353602, 'booster': 'dart'}. Best is trial 128 with value: 0.49161333181334654.[0m
[32m[I 2026-08-02 20:03:43,263][0m Trial 171 pruned. [0m
[32m[I 2026-08-02 20:04:02,788][0m Trial 172 finished with value: 0.50088899499554 and parameters: {'n_estimators': 1417, 'max_depth': 7, 'learning_rate': 0.013668792716332952, 'subsample': 0.7310082045910474, 'colsample_bytree': 0.7382841301209071, 'colsample_bylevel': 0.9376699662016232, 'colsample_bynode': 0.42703662070774767, 'min_child_weight': 4.376188167395537, 'gamma': 0.15461309388126002, 'reg_alpha': 2.1580511686734162e-06, 'reg_lambda': 2.2860843218328167e-05, 'max_delta_step': 0.701288511540253, 'booster': 'dart'}. Best is trial 128 with value: 0.49161333181334654.[0m
[32m[I 2026-08-02 20:04:10,974][0m Trial 173 pruned. [0m
[32m[I 2026-08-02 20:04:25,139][0m Trial 174 pruned. [0m
[32m[I 2026-08-02 20:04:39,441][0m Trial 175 finished with value: 0.505070246195691 and parameters: {'n_estimators': 1749, 'max_depth': 8, 'learning_rate': 0.0172401336918558, 'subsample': 0.6893966275548702, 'colsample_bytree': 0.8700418658655441, 'colsample_bylevel': 0.581856787085572, 'colsample_bynode': 0.533235738868848, 'min_child_weight': 1.0674707486193877, 'gamma': 0.11313408883836762, 'reg_alpha': 0.01494305552770337, 'reg_lambda': 0.03012731914576975, 'max_delta_step': 2.633977509102711, 'booster': 'dart'}. Best is trial 128 with value: 0.49161333181334654.[0m
[32m[I 2026-08-02 20:04:47,982][0m Trial 176 finished with value: 0.5037106148208647 and parameters: {'n_estimators': 1425, 'max_depth': 11, 'learning_rate': 0.04599499881929531, 'subsample': 0.6892814945532146, 'colsample_bytree': 0.7388884485529286, 'colsample_bylevel': 0.7431626366122874, 'colsample_bynode': 0.4683497292438831, 'min_child_weight': 12.76791989284791, 'gamma': 0.10878057917646512, 'reg_alpha': 0.17351575555207793, 'reg_lambda': 0.009346373985132106, 'max_delta_step': 1.4420199899465722, 'booster': 'dart'}. Best is trial 128 with value: 0.49161333181334654.[0m
[32m[I 2026-08-02 20:04:55,987][0m Trial 177 finished with value: 0.4939912076334904 and parameters: {'n_estimators': 1241, 'max_depth': 6, 'learning_rate': 0.03330669416074828, 'subsample': 0.67712139411171, 'colsample_bytree': 0.6599207307253224, 'colsample_bylevel': 0.8306933333464561, 'colsample_bynode': 0.31518348326798223, 'min_child_weight': 4.001113530005648, 'gamma': 0.11249073942371407, 'reg_alpha': 1.3176737746612004e-05, 'reg_lambda': 0.003283323987419119, 'max_delta_step': 1.221482821384627, 'booster': 'dart'}. Best is trial 128 with value: 0.49161333181334654.[0m
[32m[I 2026-08-02 20:05:10,920][0m Trial 178 finished with value: 0.5109507563578567 and parameters: {'n_estimators': 962, 'max_depth': 8, 'learning_rate': 0.018898767329885408, 'subsample': 0.8519952286452148, 'colsample_bytree': 0.8897461695129605, 'colsample_bylevel': 0.7823028755865619, 'colsample_bynode': 0.5357212121111535, 'min_child_weight': 2.207429932560509, 'gamma': 0.34357248142556635, 'reg_alpha': 0.0008490264880344864, 'reg_lambda': 0.0002917852841993036, 'max_delta_step': 0.2991862343559212, 'booster': 'gbtree'}. Best is trial 128 with value: 0.49161333181334654.[0m
[32m[I 2026-08-02 20:05:35,626][0m Trial 179 finished with value: 0.49518196532945796 and parameters: {'n_estimators': 1884, 'max_depth': 4, 'learning_rate': 0.013367195727139613, 'subsample': 0.8516950790228732, 'colsample_bytree': 0.7905790025311983, 'colsample_bylevel': 0.969566280744424, 'colsample_bynode': 0.758467678863296, 'min_child_weight': 3.561218367512732, 'gamma': 0.06578173040603977, 'reg_alpha': 0.018902994204289526, 'reg_lambda': 0.023843370185972365, 'max_delta_step': 1.8671314955689364, 'booster': 'gbtree'}. Best is trial 128 with value: 0.49161333181334654.[0m
[32m[I 2026-08-02 20:05:43,305][0m Trial 180 pruned. [0m
[32m[I 2026-08-02 20:05:50,853][0m Trial 181 pruned. [0m
[32m[I 2026-08-02 20:05:54,988][0m Trial 182 pruned. [0m
[32m[I 2026-08-02 20:05:58,239][0m Trial 183 pruned. [0m
[32m[I 2026-08-02 20:06:02,036][0m Trial 184 pruned. [0m
[32m[I 2026-08-02 20:06:14,966][0m Trial 185 pruned. [0m
[32m[I 2026-08-02 20:06:29,547][0m Trial 186 finished with value: 0.5102281292777228 and parameters: {'n_estimators': 2125, 'max_depth': 7, 'learning_rate': 0.012339754302129564, 'subsample': 0.763810556347632, 'colsample_bytree': 0.6801631645188577, 'colsample_bylevel': 0.6516069705808816, 'colsample_bynode': 0.3943780365364698, 'min_child_weight': 2.963065950670216, 'gamma': 0.21621263252895295, 'reg_alpha': 0.039318552121094176, 'reg_lambda': 0.0017372624767861915, 'max_delta_step': 5.44888734613089, 'booster': 'gbtree'}. Best is trial 128 with value: 0.49161333181334654.[0m
[32m[I 2026-08-02 20:06:39,098][0m Trial 187 finished with value: 0.5005925462332226 and parameters: {'n_estimators': 1857, 'max_depth': 6, 'learning_rate': 0.024987324262731026, 'subsample': 0.7021039456020333, 'colsample_bytree': 0.8910418757717832, 'colsample_bylevel': 0.6514697052258351, 'colsample_bynode': 0.49806442573263215, 'min_child_weight': 5.282870818452267, 'gamma': 0.12241596307980555, 'reg_alpha': 0.17489490168939975, 'reg_lambda': 0.06792477514185728, 'max_delta_step': 3.3699871465491062, 'booster': 'gbtree'}. Best is trial 128 with value: 0.49161333181334654.[0m
[32m[I 2026-08-02 20:06:42,569][0m Trial 188 pruned. [0m
[32m[I 2026-08-02 20:06:45,484][0m Trial 189 pruned. [0m
[32m[I 2026-08-02 20:06:51,799][0m Trial 190 pruned. [0m
[32m[I 2026-08-02 20:06:57,684][0m Trial 191 pruned. [0m
[32m[I 2026-08-02 20:07:06,484][0m Trial 192 pruned. [0m
[32m[I 2026-08-02 20:07:21,077][0m Trial 193 finished with value: 0.5016382044497532 and parameters: {'n_estimators': 1745, 'max_depth': 7, 'learning_rate': 0.015498170328873977, 'subsample': 0.7781527104048159, 'colsample_bytree': 0.6967368928118882, 'colsample_bylevel': 0.861193716982633, 'colsample_bynode': 0.6418792009390877, 'min_child_weight': 2.6160608918043193, 'gamma': 0.0802052596907189, 'reg_alpha': 0.0073078184184490105, 'reg_lambda': 1.6472310940146207e-05, 'max_delta_step': 1.2876184812549734, 'booster': 'gbtree'}. Best is trial 128 with value: 0.49161333181334654.[0m
[32m[I 2026-08-02 20:07:24,994][0m Trial 194 pruned. [0m
[32m[I 2026-08-02 20:07:28,880][0m Trial 195 pruned. [0m
[32m[I 2026-08-02 20:07:40,636][0m Trial 196 finished with value: 0.5027345687353278 and parameters: {'n_estimators': 1994, 'max_depth': 5, 'learning_rate': 0.018361066269437405, 'subsample': 0.8739790381337512, 'colsample_bytree': 0.620972738440394, 'colsample_bylevel': 0.8780824166104275, 'colsample_bynode': 0.7262346850637384, 'min_child_weight': 4.011363407566848, 'gamma': 0.1490766341537601, 'reg_alpha': 0.005747505537197591, 'reg_lambda': 0.44080220691371663, 'max_delta_step': 3.117647641368735, 'booster': 'gbtree'}. Best is trial 128 with value: 0.49161333181334654.[0m
[32m[I 2026-08-02 20:07:51,299][0m Trial 197 pruned. [0m
[32m[I 2026-08-02 20:08:12,276][0m Trial 198 finished with value: 0.5015688726863197 and parameters: {'n_estimators': 1239, 'max_depth': 9, 'learning_rate': 0.07607872919411052, 'subsample': 0.7386490665425139, 'colsample_bytree': 0.5730626718980822, 'colsample_bylevel': 0.8828814755033024, 'colsample_bynode': 0.36214307250734934, 'min_child_weight': 3.868282278140703, 'gamma': 0.007186351278836864, 'reg_alpha': 9.342265342120028e-08, 'reg_lambda': 0.0002410851951296774, 'max_delta_step': 0.05967017225196325, 'booster': 'dart'}. Best is trial 128 with value: 0.49161333181334654.[0m
[32m[I 2026-08-02 20:08:27,249][0m Trial 199 finished with value: 0.5077384847202697 and parameters: {'n_estimators': 951, 'max_depth': 9, 'learning_rate': 0.023754227339742088, 'subsample': 0.8092408543301742, 'colsample_bytree': 0.9242620574127952, 'colsample_bylevel': 0.9834736781852995, 'colsample_bynode': 0.561981556358395, 'min_child_weight': 1.958517158620156, 'gamma': 0.12247529598473167, 'reg_alpha': 0.22169918353705884, 'reg_lambda': 0.005616606194984587, 'max_delta_step': 1.918574719619544, 'booster': 'dart'}. Best is trial 128 with value: 0.49161333181334654.[0m

------------------------------------------------------------
All Trial CV Results:
Trial  Mean RMSE  Std RMSE  CV Scores
------------------------------------------------------------
    0     0.5578
    1     0.5287
    2     0.5232
    3     0.5660
    4     0.5192
    5     0.5286
    6     0.5462
    7     0.5341
    8     0.5535
    9     0.5628
   10     0.5557
   11     0.5365
   12     0.5368
   13     0.5403
   14     0.4988
   15     0.4981
   16     0.4972
   17     0.5040
   18     0.5240
   19     0.5103
   20     0.5040
   21     0.5101
   22     0.5054
   23     0.5002
   24     0.5102
   25     0.5108
   26     0.4972
   27     0.5287
   28     0.4990
   29     0.4944
   30     0.5058
   31     0.5117
   32     0.5069
   33     0.5003
   34     0.5056
   35     0.5024
   36     0.5120
   37     0.5020
   38     0.5022
   39     0.4988
   40     0.4977
   41     0.5027
   42     0.4928
   43     0.5114
   44     0.5085
   45     0.5015
   46     0.5099
   47     0.4995
   48     0.5019
   49     0.5131
   50     0.4951
   51     0.5868
   52     0.5160
   53     0.4967
   54     0.5152
   55     0.5216
   56     0.4958
   57     0.4953
   58     0.4921
   59     0.4985
   60     0.4942
   61     0.5081
   62     0.5044
   63     0.5007
   64     0.5291
   65     0.5072
   66     0.5022
   67     0.5081
   68     0.5063
   69     0.5311
   70     0.5045
   71     0.4997
   72     0.4998
   73     0.5400
   74     0.4974
   75     0.4991
   76     0.5174
   77     0.4982
   78     0.5072
   79     0.5166
   80     0.5009
   81     0.5105
   82     0.4992
   83     0.4962
   84     0.4939
   85     0.5123
   86     0.5069
   87     0.5034
   88     0.5124
   89     0.5451
   90     0.4971
   91     0.5435
   92     0.5219
   93     0.4961
   94     0.5208
   95     0.5375
   96     0.5150
   97     0.5008
   98     0.5201
   99     0.5021
  100     0.4992
  101     0.4958
  102     0.5122
  103     0.4987
  104     0.5172
  105     0.4969
  106     0.4987
  107     0.5044
  108     0.5188
  109     0.5087
  110     0.5192
  111     0.5171
  112     0.5266
  113     0.5090
  114     0.4960
  115     0.4995
  116     0.5018
  117     0.4950
  118     0.5028
  119     0.5021
  120     0.5005
  121     0.4963
  122     0.4983
  123     0.5014
  124     0.4938
  125     0.5061
  126     0.5163
  127     0.5356
  128     0.4916
  129     0.4954
  130     0.4983
  131     0.4959
  132     0.4999
  133     0.4997
  134     0.5151
  135     0.5129
  136     0.5181
  137     0.5000
  138     0.4995
  139     0.5073
  140     0.5032
  141     0.5275
  142     0.5268
  143     0.5042
  144     0.4916
  145     0.4955
  146     0.4951
  147     0.4954
  148     0.5065
  149     0.4990
  150     0.5029
  151     0.5072
  152     0.5006
  153     0.4991
  154     0.5115
  155     0.4998
  156     0.4975
  157     0.4952
  158     0.5083
  159     0.5040
  160     0.5095
  161     0.4999
  162     0.5019
  163     0.5046
  164     0.5164
  165     0.5263
  166     0.5034
  167     0.5036
  168     0.5086
  169     0.5345
  170     0.5033
  171     0.5168
  172     0.5009
  173     0.5048
  174     0.5007
  175     0.5051
  176     0.5037
  177     0.4940
  178     0.5110
  179     0.4952
  180     0.4986
  181     0.5098
  182     0.4954
  183     0.5023
  184     0.5270
  185     0.5023
  186     0.5102
  187     0.5006
  188     0.5012
  189     0.5091
  190     0.4942
  191     0.5152
  192     0.5166
  193     0.5016
  194     0.5142
  195     0.5096
  196     0.5027
  197     0.4994
  198     0.5016
  199     0.5077
------------------------------------------------------------

=== Best Trial ===
  CV RMSE: 0.491613
  Params:  {'n_estimators': 1636, 'max_depth': 6, 'learning_rate': 0.020331459031715477, 'subsample': 0.7662024954079603, 'colsample_bytree': 0.821424275851276, 'colsample_bylevel': 0.6764078720752115, 'colsample_bynode': 0.5368595511238561, 'min_child_weight': 1.2411232899932865, 'gamma': 0.02270857913826103, 'reg_alpha': 0.15369169864694893, 'reg_lambda': 0.0021095519927514703, 'max_delta_step': 0.9810519208973468, 'booster': 'dart'}

Parameter Importance:
  gamma: 0.7991
  max_delta_step: 0.0802
  colsample_bynode: 0.0296
  max_depth: 0.0274
  colsample_bytree: 0.0162
  reg_lambda: 0.0114
  min_child_weight: 0.0104
  subsample: 0.0088
  learning_rate: 0.0080
  n_estimators: 0.0041
  colsample_bylevel: 0.0032
  booster: 0.0013
  reg_alpha: 0.0001

============================================================
Top-5 Holdout Validation — selecting most generalizable params
============================================================
 Rank    CV RMSE   Holdout RMSE   Holdout R²
------------------------------------------------------------
