[32m[I 2026-08-02 19:51:58,850][0m Trial 107 finished with value: 0.5044493476537407 and parameters: {'n_estimators': 1142, 'max_depth': 8, 'learning_rate': 0.03581189266823931, 'subsample': 0.7846809149079008, 'colsample_bytree': 0.9856379292187376, 'colsample_bylevel': 0.9050609271774586, 'colsample_bynode': 0.536228348235283, 'min_child_weight': 10.753764674909728, 'gamma': 0.23015573461107539, 'reg_alpha': 1.1730900658211933e-06, 'reg_lambda': 9.252427421905454e-06, 'max_delta_step': 3.801026891269825, 'booster': 'dart'}. Best is trial 58 with value: 0.4921282524438041.[0m
[32m[I 2026-08-02 19:52:04,092][0m Trial 108 pruned. [0m
[32m[I 2026-08-02 19:52:06,705][0m Trial 109 pruned. [0m
[32m[I 2026-08-02 19:52:08,537][0m Trial 110 pruned. [0m
[32m[I 2026-08-02 19:52:13,031][0m Trial 111 finished with value: 0.517128766685322 and parameters: {'n_estimators': 1171, 'max_depth': 11, 'learning_rate': 0.06538655987608341, 'subsample': 0.7308756835613615, 'colsample_bytree': 0.9170597199951601, 'colsample_bylevel': 0.9372025517956624, 'colsample_bynode': 0.3099115495613687, 'min_child_weight': 10.79577791698406, 'gamma': 0.4770147817615473, 'reg_alpha': 1.024547487577206e-07, 'reg_lambda': 5.3820798052411825e-06, 'max_delta_step': 4.342416319942959, 'booster': 'dart'}. Best is trial 58 with value: 0.4921282524438041.[0m
[32m[I 2026-08-02 19:52:16,324][0m Trial 112 pruned. [0m
[32m[I 2026-08-02 19:52:18,423][0m Trial 113 pruned. [0m
[32m[I 2026-08-02 19:52:30,690][0m Trial 114 finished with value: 0.4960407800996266 and parameters: {'n_estimators': 2141, 'max_depth': 7, 'learning_rate': 0.026419018891728673, 'subsample': 0.7476061276522785, 'colsample_bytree': 0.9057777244708588, 'colsample_bylevel': 0.3526326600426977, 'colsample_bynode': 0.48709679536745754, 'min_child_weight': 9.772375344518968, 'gamma': 0.061496193196008034, 'reg_alpha': 0.6634145813453133, 'reg_lambda': 1.4744651321976089e-05, 'max_delta_step': 4.224566329740235, 'booster': 'gbtree'}. Best is trial 58 with value: 0.4921282524438041.[0m
[32m[I 2026-08-02 19:52:39,216][0m Trial 115 finished with value: 0.49950902040965434 and parameters: {'n_estimators': 2302, 'max_depth': 10, 'learning_rate': 0.04524160645505711, 'subsample': 0.7493345520601069, 'colsample_bytree': 0.9818088917183632, 'colsample_bylevel': 0.36743177837519897, 'colsample_bynode': 0.4033526468008525, 'min_child_weight': 10.868395666431073, 'gamma': 0.04899147204519727, 'reg_alpha': 0.0302551019235167, 'reg_lambda': 0.0003663947547542796, 'max_delta_step': 5.652715972402875, 'booster': 'gbtree'}. Best is trial 58 with value: 0.4921282524438041.[0m
[32m[I 2026-08-02 19:52:55,113][0m Trial 116 finished with value: 0.501840509394073 and parameters: {'n_estimators': 2723, 'max_depth': 6, 'learning_rate': 0.022204626482098352, 'subsample': 0.6746830402164007, 'colsample_bytree': 0.7516223472660141, 'colsample_bylevel': 0.36315689543382107, 'colsample_bynode': 0.47739972203307557, 'min_child_weight': 20.930781297567435, 'gamma': 0.050318038001124235, 'reg_alpha': 0.2470097516211756, 'reg_lambda': 1.54335350317932e-08, 'max_delta_step': 5.82533472003313, 'booster': 'gbtree'}. Best is trial 58 with value: 0.4921282524438041.[0m
[32m[I 2026-08-02 19:53:18,540][0m Trial 117 finished with value: 0.4950446723200891 and parameters: {'n_estimators': 1311, 'max_depth': 7, 'learning_rate': 0.013620990997041482, 'subsample': 0.8085516566588399, 'colsample_bytree': 0.8283918959409957, 'colsample_bylevel': 0.7458287801531379, 'colsample_bynode': 0.5714114902895238, 'min_child_weight': 1.501394289311461, 'gamma': 0.005224933107643439, 'reg_alpha': 0.011252553008550313, 'reg_lambda': 0.00020126160308000737, 'max_delta_step': 1.250031782553268, 'booster': 'gbtree'}. Best is trial 58 with value: 0.4921282524438041.[0m
[32m[I 2026-08-02 19:53:31,342][0m Trial 118 pruned. [0m
[32m[I 2026-08-02 19:53:51,619][0m Trial 119 finished with value: 0.5020936787153227 and parameters: {'n_estimators': 1353, 'max_depth': 7, 'learning_rate': 0.011518813407853025, 'subsample': 0.8169172644165414, 'colsample_bytree': 0.8146205497186632, 'colsample_bylevel': 0.6568820313508503, 'colsample_bynode': 0.478393234516415, 'min_child_weight': 1.5943739124836072, 'gamma': 0.06288134421940123, 'reg_alpha': 0.5701392572736913, 'reg_lambda': 0.0003705651224542362, 'max_delta_step': 1.8472263160775135, 'booster': 'gbtree'}. Best is trial 58 with value: 0.4921282524438041.[0m
[32m[I 2026-08-02 19:54:15,319][0m Trial 120 finished with value: 0.500501436441833 and parameters: {'n_estimators': 1474, 'max_depth': 8, 'learning_rate': 0.011898881731673198, 'subsample': 0.7429545266356666, 'colsample_bytree': 0.695767147348787, 'colsample_bylevel': 0.8029631771721452, 'colsample_bynode': 0.5478707114347366, 'min_child_weight': 1.8089291541633017, 'gamma': 0.023972279986114897, 'reg_alpha': 1.8159218734907106e-07, 'reg_lambda': 0.9971579135799306, 'max_delta_step': 3.6155771271029282, 'booster': 'dart'}. Best is trial 58 with value: 0.4921282524438041.[0m
[32m[I 2026-08-02 19:54:25,293][0m Trial 121 pruned. [0m
[32m[I 2026-08-02 19:54:33,494][0m Trial 122 pruned. [0m
[32m[I 2026-08-02 19:54:49,253][0m Trial 123 finished with value: 0.5013819794430522 and parameters: {'n_estimators': 1938, 'max_depth': 4, 'learning_rate': 0.02532998401357693, 'subsample': 0.6792824340942026, 'colsample_bytree': 0.8997523899357478, 'colsample_bylevel': 0.8434018897840683, 'colsample_bynode': 0.4277317868172753, 'min_child_weight': 3.3249438116711, 'gamma': 0.12711008782861163, 'reg_alpha': 2.1727736759226235, 'reg_lambda': 0.008167756230104177, 'max_delta_step': 4.911571921611197, 'booster': 'gbtree'}. Best is trial 58 with value: 0.4921282524438041.[0m
[32m[I 2026-08-02 19:55:04,806][0m Trial 124 finished with value: 0.49375872713291863 and parameters: {'n_estimators': 2293, 'max_depth': 4, 'learning_rate': 0.017103338143196596, 'subsample': 0.6862730268394519, 'colsample_bytree': 0.9293166707063083, 'colsample_bylevel': 0.42592214531093175, 'colsample_bynode': 0.31547824907919436, 'min_child_weight': 10.420637635351298, 'gamma': 0.04336673434651839, 'reg_alpha': 0.045811053521342626, 'reg_lambda': 1.7674180737128572e-06, 'max_delta_step': 1.6977707561842874, 'booster': 'gbtree'}. Best is trial 58 with value: 0.4921282524438041.[0m
[32m[I 2026-08-02 19:55:12,397][0m Trial 125 finished with value: 0.5060578390531747 and parameters: {'n_estimators': 2096, 'max_depth': 5, 'learning_rate': 0.03051995802879429, 'subsample': 0.6794630518147982, 'colsample_bytree': 0.9908953515570456, 'colsample_bylevel': 0.3483806488138841, 'colsample_bynode': 0.3326541313498484, 'min_child_weight': 9.966322836047059, 'gamma': 0.2111743452199218, 'reg_alpha': 0.012857903553345245, 'reg_lambda': 0.003265790205336468, 'max_delta_step': 0.5226805684381581, 'booster': 'gbtree'}. Best is trial 58 with value: 0.4921282524438041.[0m
[32m[I 2026-08-02 19:55:18,220][0m Trial 126 pruned. [0m
[32m[I 2026-08-02 19:55:23,239][0m Trial 127 pruned. [0m
[32m[I 2026-08-02 19:55:37,196][0m Trial 128 finished with value: 0.49161333181334654 and parameters: {'n_estimators': 1636, 'max_depth': 6, 'learning_rate': 0.020331459031715477, 'subsample': 0.7662024954079603, 'colsample_bytree': 0.821424275851276, 'colsample_bylevel': 0.6764078720752115, 'colsample_bynode': 0.5368595511238561, 'min_child_weight': 1.2411232899932865, 'gamma': 0.02270857913826103, 'reg_alpha': 0.15369169864694893, 'reg_lambda': 0.0021095519927514703, 'max_delta_step': 0.9810519208973468, 'booster': 'dart'}. Best is trial 128 with value: 0.49161333181334654.[0m
[32m[I 2026-08-02 19:55:47,743][0m Trial 129 finished with value: 0.4953762901190844 and parameters: {'n_estimators': 989, 'max_depth': 6, 'learning_rate': 0.021509144164027612, 'subsample': 0.6989490527330142, 'colsample_bytree': 0.8514936905027547, 'colsample_bylevel': 0.9000118642711237, 'colsample_bynode': 0.3627011120674365, 'min_child_weight': 7.370631527638621, 'gamma': 0.1092756135739289, 'reg_alpha': 2.073124874803922e-05, 'reg_lambda': 6.787959293605299e-05, 'max_delta_step': 1.9549407440262676, 'booster': 'dart'}. Best is trial 128 with value: 0.49161333181334654.[0m
[32m[I 2026-08-02 19:55:58,671][0m Trial 130 finished with value: 0.4982727203026962 and parameters: {'n_estimators': 1721, 'max_depth': 6, 'learning_rate': 0.037783324131752616, 'subsample': 0.7214641149791954, 'colsample_bytree': 0.775985220320485, 'colsample_bylevel': 0.5764805746529973, 'colsample_bynode': 0.5895772494734898, 'min_child_weight': 1.5535927160880285, 'gamma': 0.23585791840158343, 'reg_alpha': 0.6267358391729654, 'reg_lambda': 0.00014006134069857468, 'max_delta_step': 0.16709771664088913, 'booster': 'dart'}. Best is trial 128 with value: 0.49161333181334654.[0m
[32m[I 2026-08-02 19:56:10,562][0m Trial 131 finished with value: 0.4959445391785045 and parameters: {'n_estimators': 925, 'max_depth': 6, 'learning_rate': 0.021218215599863036, 'subsample': 0.669562901219227, 'colsample_bytree': 0.9522801621223564, 'colsample_bylevel': 0.8839612805450426, 'colsample_bynode': 0.3483979538559861, 'min_child_weight': 9.863871574870636, 'gamma': 0.08296356089210509, 'reg_alpha': 1.8868914749303974e-06, 'reg_lambda': 0.00020516146519345598, 'max_delta_step': 1.5290112645210494, 'booster': 'dart'}. Best is trial 128 with value: 0.49161333181334654.[0m
[32m[I 2026-08-02 19:56:21,441][0m Trial 132 finished with value: 0.49993312970867354 and parameters: {'n_estimators': 2579, 'max_depth': 7, 'learning_rate': 0.019807017794429223, 'subsample': 0.797549956997605, 'colsample_bytree': 0.7762550243434276, 'colsample_bylevel': 0.8025475967961401, 'colsample_bynode': 0.47320106864342465, 'min_child_weight': 1.465458107238274, 'gamma': 0.04406085618641543, 'reg_alpha': 0.014252397442042207, 'reg_lambda': 0.01092966050327064, 'max_delta_step': 1.1316573195095194, 'booster': 'dart'}. Best is trial 128 with value: 0.49161333181334654.[0m
[32m[I 2026-08-02 19:56:35,066][0m Trial 133 finished with value: 0.49974097019735647 and parameters: {'n_estimators': 1191, 'max_depth': 5, 'learning_rate': 0.014187677018755816, 'subsample': 0.6626234949671711, 'colsample_bytree': 0.8427582430895202, 'colsample_bylevel': 0.6931601139898105, 'colsample_bynode': 0.3055391095555624, 'min_child_weight': 7.488046167118263, 'gamma': 0.2049329531168848, 'reg_alpha': 2.2550741760794296e-07, 'reg_lambda': 0.00016132434044537834, 'max_delta_step': 0.37801155405027975, 'booster': 'dart'}. Best is trial 128 with value: 0.49161333181334654.[0m
[32m[I 2026-08-02 19:56:38,533][0m Trial 134 pruned. [0m
[32m[I 2026-08-02 19:56:42,382][0m Trial 135 pruned. [0m
[32m[I 2026-08-02 19:56:48,041][0m Trial 136 pruned. [0m
[32m[I 2026-08-02 19:56:56,971][0m Trial 137 finished with value: 0.4999685057321642 and parameters: {'n_estimators': 2399, 'max_depth': 4, 'learning_rate': 0.0224321431021203, 'subsample': 0.6767583182439737, 'colsample_bytree': 0.9137737712246248, 'colsample_bylevel': 0.33335210353864553, 'colsample_bynode': 0.3315542301618572, 'min_child_weight': 4.323680192145605, 'gamma': 0.21030610919045045, 'reg_alpha': 0.0020741959514388873, 'reg_lambda': 8.383643505337709e-08, 'max_delta_step': 0.9085325659031078, 'booster': 'gbtree'}. Best is trial 128 with value: 0.49161333181334654.[0m
[32m[I 2026-08-02 19:57:04,281][0m Trial 138 finished with value: 0.4994978651025013 and parameters: {'n_estimators': 858, 'max_depth': 6, 'learning_rate': 0.02749438538596909, 'subsample': 0.6430801681361881, 'colsample_bytree': 0.818633523866903, 'colsample_bylevel': 0.9789353212780426, 'colsample_bynode': 0.4225764778563092, 'min_child_weight': 2.088828919399337, 'gamma': 0.20968432226249656, 'reg_alpha': 2.8292598378127015e-07, 'reg_lambda': 0.0022565648315968226, 'max_delta_step': 1.8375101140854246, 'booster': 'dart'}. Best is trial 128 with value: 0.49161333181334654.[0m
[32m[I 2026-08-02 19:57:12,424][0m Trial 139 pruned. [0m
[32m[I 2026-08-02 19:57:30,671][0m Trial 140 finished with value: 0.5032206978121322 and parameters: {'n_estimators': 2794, 'max_depth': 4, 'learning_rate': 0.027928141258245963, 'subsample': 0.6945791435329243, 'colsample_bytree': 0.8293790267413096, 'colsample_bylevel': 0.5403100779421877, 'colsample_bynode': 0.309117140676679, 'min_child_weight': 13.535805942668325, 'gamma': 0.06856288439964431, 'reg_alpha': 0.021866201100969318, 'reg_lambda': 1.6193875502024102e-06, 'max_delta_step': 0.14092561315203045, 'booster': 'gbtree'}. Best is trial 128 with value: 0.49161333181334654.[0m
[32m[I 2026-08-02 19:57:33,890][0m Trial 141 pruned. [0m
[32m[I 2026-08-02 19:57:38,750][0m Trial 142 pruned. [0m
[32m[I 2026-08-02 19:57:50,217][0m Trial 143 finished with value: 0.5041951733688401 and parameters: {'n_estimators': 906, 'max_depth': 6, 'learning_rate': 0.015077257943552134, 'subsample': 0.7106620337113791, 'colsample_bytree': 0.9062864228336136, 'colsample_bylevel': 0.9187029516983832, 'colsample_bynode': 0.3282811934652155, 'min_child_weight': 10.766655853495612, 'gamma': 0.26539197665384806, 'reg_alpha': 0.0007203290348960392, 'reg_lambda': 5.158489990866143e-06, 'max_delta_step': 1.020415012470898, 'booster': 'dart'}. Best is trial 128 with value: 0.49161333181334654.[0m
[32m[I 2026-08-02 19:57:59,411][0m Trial 144 finished with value: 0.49162993872965155 and parameters: {'n_estimators': 1363, 'max_depth': 6, 'learning_rate': 0.03283295928282673, 'subsample': 0.6798112965305891, 'colsample_bytree': 0.8303181597226095, 'colsample_bylevel': 0.9357839162968358, 'colsample_bynode': 0.33131332707351935, 'min_child_weight': 7.010785091205655, 'gamma': 0.03967298075071597, 'reg_alpha': 2.259147289954519e-06, 'reg_lambda': 5.1398811262786575e-05, 'max_delta_step': 1.67520434455432, 'booster': 'dart'}. Best is trial 128 with value: 0.49161333181334654.[0m
[32m[I 2026-08-02 19:58:15,695][0m Trial 145 finished with value: 0.4954846621710153 and parameters: {'n_estimators': 1428, 'max_depth': 7, 'learning_rate': 0.023343711274837187, 'subsample': 0.7035857243554732, 'colsample_bytree': 0.7654727666572527, 'colsample_bylevel': 0.9803435266810264, 'colsample_bynode': 0.32467731226582064, 'min_child_weight': 6.360725072497962, 'gamma': 0.06002538741222024, 'reg_alpha': 3.541414761729755e-07, 'reg_lambda': 0.00019570095148805784, 'max_delta_step': 0.2412779046803104, 'booster': 'dart'}. Best is trial 128 with value: 0.49161333181334654.[0m
[32m[I 2026-08-02 19:58:27,412][0m Trial 146 finished with value: 0.4950864522640919 and parameters: {'n_estimators': 1292, 'max_depth': 8, 'learning_rate': 0.03209804995804881, 'subsample': 0.7453818251809823, 'colsample_bytree': 0.8471062445777159, 'colsample_bylevel': 0.9458844524268357, 'colsample_bynode': 0.47186602466385436, 'min_child_weight': 6.982165096565965, 'gamma': 0.020810098212398553, 'reg_alpha': 0.00043369244141319745, 'reg_lambda': 4.1481477896218354e-07, 'max_delta_step': 1.8953263742278572, 'booster': 'gbtree'}. Best is trial 128 with value: 0.49161333181334654.[0m
[32m[I 2026-08-02 19:58:36,273][0m Trial 147 finished with value: 0.495368608723728 and parameters: {'n_estimators': 2057, 'max_depth': 6, 'learning_rate': 0.037190547264439655, 'subsample': 0.8067984010873082, 'colsample_bytree': 0.8808997364535935, 'colsample_bylevel': 0.910421720608916, 'colsample_bynode': 0.4809647297168539, 'min_child_weight': 10.18673389879555, 'gamma': 0.08711946992382916, 'reg_alpha': 0.16330235415322414, 'reg_lambda': 0.0001309525566984317, 'max_delta_step': 0.981747288723187, 'booster': 'gbtree'}. Best is trial 128 with value: 0.49161333181334654.[0m
[32m[I 2026-08-02 19:58:47,898][0m Trial 148 pruned. [0m
[32m[I 2026-08-02 19:58:51,860][0m Trial 149 pruned. [0m
[32m[I 2026-08-02 19:59:00,047][0m Trial 150 finished with value: 0.5028671278012155 and parameters: {'n_estimators': 1845, 'max_depth': 4, 'learning_rate': 0.05128300312927525, 'subsample': 0.8464272302897138, 'colsample_bytree': 0.7518124955145651, 'colsample_bylevel': 0.8795532569798071, 'colsample_bynode': 0.44315631699561636, 'min_child_weight': 8.514689824626068, 'gamma': 0.19898358702405833, 'reg_alpha': 0.529352172706249, 'reg_lambda': 0.009010124761353851, 'max_delta_step': 0.32559410058315164, 'booster': 'gbtree'}. Best is trial 128 with value: 0.49161333181334654.[0m
[32m[I 2026-08-02 19:59:13,259][0m Trial 151 finished with value: 0.5071876218465302 and parameters: {'n_estimators': 1748, 'max_depth': 5, 'learning_rate': 0.012923503926361952, 'subsample': 0.8266439629309723, 'colsample_bytree': 0.716541605411222, 'colsample_bylevel': 0.599493938098134, 'colsample_bynode': 0.42908274324789175, 'min_child_weight': 1.3938189353982515, 'gamma': 0.17788260368035988, 'reg_alpha': 0.016874652399387402, 'reg_lambda': 0.00029215279831463646, 'max_delta_step': 1.8672683155685257, 'booster': 'dart'}. Best is trial 128 with value: 0.49161333181334654.[0m
[32m[I 2026-08-02 19:59:20,058][0m Trial 152 finished with value: 0.500574433654236 and parameters: {'n_estimators': 802, 'max_depth': 7, 'learning_rate': 0.04851341875668156, 'subsample': 0.694551275361612, 'colsample_bytree': 0.8858692338476208, 'colsample_bylevel': 0.9140380566481283, 'colsample_bynode': 0.5199437992008781, 'min_child_weight': 8.021286499045004, 'gamma': 0.09824644915245088, 'reg_alpha': 1.6359200940250394e-05, 'reg_lambda': 2.735876827219841e-07, 'max_delta_step': 2.570535417526419, 'booster': 'gbtree'}. Best is trial 128 with value: 0.49161333181334654.[0m
[32m[I 2026-08-02 19:59:33,188][0m Trial 153 finished with value: 0.49909667055139 and parameters: {'n_estimators': 1346, 'max_depth': 8, 'learning_rate': 0.018424401021684897, 'subsample': 0.6806663369221545, 'colsample_bytree': 0.512835538037955, 'colsample_bylevel': 0.9629602057858259, 'colsample_bynode': 0.31429197869853787, 'min_child_weight': 7.905960150791214, 'gamma': 0.051329003971423634, 'reg_alpha': 1.8518929861770277e-07, 'reg_lambda': 0.0025834950788931996, 'max_delta_step': 4.325636137389274, 'booster': 'dart'}. Best is trial 128 with value: 0.49161333181334654.[0m
[32m[I 2026-08-02 19:59:47,208][0m Trial 154 pruned. [0m
[32m[I 2026-08-02 20:00:10,073][0m Trial 155 finished with value: 0.49983305420182855 and parameters: {'n_estimators': 1637, 'max_depth': 9, 'learning_rate': 0.03695166789056985, 'subsample': 0.7685788288004606, 'colsample_bytree': 0.9041671207475004, 'colsample_bylevel': 0.906567740785745, 'colsample_bynode': 0.4374800400620091, 'min_child_weight': 3.5592279510481184, 'gamma': 0.031099463923166107, 'reg_alpha': 1.212243068222369e-05, 'reg_lambda': 7.360064528775669e-08, 'max_delta_step': 0.11574322729150399, 'booster': 'gbtree'}. Best is trial 128 with value: 0.49161333181334654.[0m
[32m[I 2026-08-02 20:00:17,853][0m Trial 156 finished with value: 0.49749328754096667 and parameters: {'n_estimators': 1114, 'max_depth': 8, 'learning_rate': 0.03346442883896408, 'subsample': 0.6761876750381388, 'colsample_bytree': 0.8724040605159727, 'colsample_bylevel': 0.9730761857503865, 'colsample_bynode': 0.36353890979872266, 'min_child_weight': 5.506511740314504, 'gamma': 0.13694680839492118, 'reg_alpha': 1.6664130863041391e-06, 'reg_lambda': 6.668096850023271e-07, 'max_delta_step': 1.232268396312416, 'booster': 'dart'}. Best is trial 128 with value: 0.49161333181334654.[0m
[32m[I 2026-08-02 20:00:46,584][0m Trial 157 finished with value: 0.4952496974809498 and parameters: {'n_estimators': 1973, 'max_depth': 5, 'learning_rate': 0.01093999045544296, 'subsample': 0.8677969419040512, 'colsample_bytree': 0.8954055696266703, 'colsample_bylevel': 0.9980817044753809, 'colsample_bynode': 0.539704699019694, 'min_child_weight': 1.3186953394937004, 'gamma': 0.027947016881905838, 'reg_alpha': 0.21798509170744543, 'reg_lambda': 0.2423823829433936, 'max_delta_step': 2.9764412207774003, 'booster': 'gbtree'}. Best is trial 128 with value: 0.49161333181334654.[0m
[32m[I 2026-08-02 20:01:01,180][0m Trial 158 finished with value: 0.5082616353994225 and parameters: {'n_estimators': 2033, 'max_depth': 4, 'learning_rate': 0.015818389320651664, 'subsample': 0.9000676496670519, 'colsample_bytree': 0.9042357966335224, 'colsample_bylevel': 0.9181549797748388, 'colsample_bynode': 0.3894565515136323, 'min_child_weight': 1.041315025308154, 'gamma': 0.2737266461657001, 'reg_alpha': 0.012404071639357205, 'reg_lambda': 1.293141136329448, 'max_delta_step': 3.1999894654719405, 'booster': 'gbtree'}. Best is trial 128 with value: 0.49161333181334654.[0m
[32m[I 2026-08-02 20:01:23,963][0m Trial 159 finished with value: 0.5040313803251486 and parameters: {'n_estimators': 1619, 'max_depth': 8, 'learning_rate': 0.01052982337148506, 'subsample': 0.9475504796688279, 'colsample_bytree': 0.9642794471690063, 'colsample_bylevel': 0.9338878538090462, 'colsample_bynode': 0.33863488732174385, 'min_child_weight': 1.5656941865774572, 'gamma': 0.0409357845052565, 'reg_alpha': 0.07024877629722005, 'reg_lambda': 0.038637153267500945, 'max_delta_step': 5.087281428018427, 'booster': 'gbtree'}. Best is trial 128 with value: 0.49161333181334654.[0m
[32m[I 2026-08-02 20:01:31,682][0m Trial 160 finished with value: 0.509469746726839 and parameters: {'n_estimators': 1075, 'max_depth': 6, 'learning_rate': 0.024511588480829516, 'subsample': 0.8452952829499893, 'colsample_bytree': 0.73994359290802, 'colsample_bylevel': 0.9158757068669657, 'colsample_bynode': 0.34491859348802073, 'min_child_weight': 4.994539287536099, 'gamma': 0.2101175800656984, 'reg_alpha': 1.6474656199367945e-06, 'reg_lambda': 0.0003614216062749757, 'max_delta_step': 4.308137752785157, 'booster': 'dart'}. Best is trial 128 with value: 0.49161333181334654.[0m
[32m[I 2026-08-02 20:01:49,706][0m Trial 161 pruned. [0m
