[32m[I 2026-08-02 19:41:01,993][0m Trial 42 finished with value: 0.49278452194901873 and parameters: {'n_estimators': 2025, 'max_depth': 7, 'learning_rate': 0.03308040170115068, 'subsample': 0.6703723331110415, 'colsample_bytree': 0.8974942293470323, 'colsample_bylevel': 0.7192439669832223, 'colsample_bynode': 0.4934887045356924, 'min_child_weight': 3.5389865017291062, 'gamma': 0.037651971877001325, 'reg_alpha': 0.053514557218707265, 'reg_lambda': 0.04530554027080594, 'max_delta_step': 3.0674146140446377, 'booster': 'gbtree'}. Best is trial 42 with value: 0.49278452194901873.[0m
[32m[I 2026-08-02 19:41:09,327][0m Trial 43 pruned. [0m
[32m[I 2026-08-02 19:41:14,901][0m Trial 44 pruned. [0m
[32m[I 2026-08-02 19:41:20,611][0m Trial 45 finished with value: 0.5015438262901012 and parameters: {'n_estimators': 2179, 'max_depth': 5, 'learning_rate': 0.044414150736117125, 'subsample': 0.630313283699243, 'colsample_bytree': 0.8717899014232776, 'colsample_bylevel': 0.4802016155787639, 'colsample_bynode': 0.5945773164971946, 'min_child_weight': 3.3193914546244416, 'gamma': 0.254410236557223, 'reg_alpha': 0.021234729656834348, 'reg_lambda': 0.5554417073673709, 'max_delta_step': 2.976420395922699, 'booster': 'gbtree'}. Best is trial 42 with value: 0.49278452194901873.[0m
[32m[I 2026-08-02 19:41:24,902][0m Trial 46 pruned. [0m
[32m[I 2026-08-02 19:41:31,444][0m Trial 47 pruned. [0m
[32m[I 2026-08-02 19:41:47,699][0m Trial 48 finished with value: 0.5018640764461251 and parameters: {'n_estimators': 2308, 'max_depth': 8, 'learning_rate': 0.018293328408518255, 'subsample': 0.8272006296000572, 'colsample_bytree': 0.814777675895344, 'colsample_bylevel': 0.6885483639070077, 'colsample_bynode': 0.6488156179654181, 'min_child_weight': 5.92825648585161, 'gamma': 0.050426336691427195, 'reg_alpha': 0.1734992192380948, 'reg_lambda': 0.2027560029134861, 'max_delta_step': 5.291799597675295, 'booster': 'gbtree'}. Best is trial 42 with value: 0.49278452194901873.[0m
[32m[I 2026-08-02 19:41:55,972][0m Trial 49 pruned. [0m
[32m[I 2026-08-02 19:42:22,499][0m Trial 50 finished with value: 0.4951243654969522 and parameters: {'n_estimators': 1384, 'max_depth': 6, 'learning_rate': 0.014979183838928128, 'subsample': 0.7953661213593985, 'colsample_bytree': 0.823633418726985, 'colsample_bylevel': 0.8149945032747282, 'colsample_bynode': 0.6315293206821478, 'min_child_weight': 1.716694933720376, 'gamma': 0.019485077058237377, 'reg_alpha': 0.011727932146331135, 'reg_lambda': 0.0004564650490343592, 'max_delta_step': 0.2102915804348635, 'booster': 'gbtree'}. Best is trial 42 with value: 0.49278452194901873.[0m
[32m[I 2026-08-02 19:42:27,330][0m Trial 51 pruned. [0m
[32m[I 2026-08-02 19:42:44,227][0m Trial 52 pruned. [0m
[32m[I 2026-08-02 19:43:02,899][0m Trial 53 finished with value: 0.496681652301237 and parameters: {'n_estimators': 831, 'max_depth': 7, 'learning_rate': 0.0287169001378404, 'subsample': 0.798014662824405, 'colsample_bytree': 0.8205530978976233, 'colsample_bylevel': 0.8423176349721252, 'colsample_bynode': 0.6281475922284443, 'min_child_weight': 2.9342066268884146, 'gamma': 0.019998525141397515, 'reg_alpha': 0.3694867954100214, 'reg_lambda': 2.0122614271691255, 'max_delta_step': 0.2421369888358858, 'booster': 'gbtree'}. Best is trial 42 with value: 0.49278452194901873.[0m
[32m[I 2026-08-02 19:43:13,489][0m Trial 54 pruned. [0m
[32m[I 2026-08-02 19:43:16,753][0m Trial 55 pruned. [0m
[32m[I 2026-08-02 19:43:28,204][0m Trial 56 finished with value: 0.4958410062260136 and parameters: {'n_estimators': 810, 'max_depth': 8, 'learning_rate': 0.026560342454859366, 'subsample': 0.7688384072211193, 'colsample_bytree': 0.9314147299873468, 'colsample_bylevel': 0.8355549184802745, 'colsample_bynode': 0.3849858495474324, 'min_child_weight': 3.163448195347011, 'gamma': 0.06112793872767682, 'reg_alpha': 0.06990725655575097, 'reg_lambda': 0.013786226232306896, 'max_delta_step': 0.5121316810197978, 'booster': 'dart'}. Best is trial 42 with value: 0.49278452194901873.[0m
[32m[I 2026-08-02 19:43:40,881][0m Trial 57 finished with value: 0.495289262239537 and parameters: {'n_estimators': 1268, 'max_depth': 7, 'learning_rate': 0.02664805487808966, 'subsample': 0.7746701268047868, 'colsample_bytree': 0.8132129548060889, 'colsample_bylevel': 0.9906512599099562, 'colsample_bynode': 0.3541506975375633, 'min_child_weight': 6.481201467750113, 'gamma': 0.013232131237815026, 'reg_alpha': 0.00027963448796133465, 'reg_lambda': 2.2917205840394206e-05, 'max_delta_step': 2.5069635723538966, 'booster': 'dart'}. Best is trial 42 with value: 0.49278452194901873.[0m
[32m[I 2026-08-02 19:43:51,402][0m Trial 58 finished with value: 0.4921282524438041 and parameters: {'n_estimators': 1059, 'max_depth': 10, 'learning_rate': 0.041714638777938136, 'subsample': 0.7531882967252731, 'colsample_bytree': 0.8245256390141672, 'colsample_bylevel': 0.873443236018468, 'colsample_bynode': 0.3861157273507753, 'min_child_weight': 9.246946840703057, 'gamma': 0.04506267315374568, 'reg_alpha': 0.6341044740304188, 'reg_lambda': 0.06218826931327274, 'max_delta_step': 1.4327866731864987, 'booster': 'dart'}. Best is trial 58 with value: 0.4921282524438041.[0m
[32m[I 2026-08-02 19:44:04,272][0m Trial 59 finished with value: 0.49853205751561863 and parameters: {'n_estimators': 1275, 'max_depth': 11, 'learning_rate': 0.028245748934305717, 'subsample': 0.7346721325617029, 'colsample_bytree': 0.9442552630853155, 'colsample_bylevel': 0.8431576826013979, 'colsample_bynode': 0.30773445084643336, 'min_child_weight': 6.25598657427841, 'gamma': 0.021605519029413118, 'reg_alpha': 0.02625610745967805, 'reg_lambda': 0.021993636589723507, 'max_delta_step': 2.953674909321583, 'booster': 'dart'}. Best is trial 58 with value: 0.4921282524438041.[0m
[32m[I 2026-08-02 19:44:10,836][0m Trial 60 pruned. [0m
[32m[I 2026-08-02 19:44:15,305][0m Trial 61 pruned. [0m
[32m[I 2026-08-02 19:44:24,686][0m Trial 62 finished with value: 0.5043553811587766 and parameters: {'n_estimators': 1453, 'max_depth': 9, 'learning_rate': 0.02661534364859632, 'subsample': 0.7502734202726541, 'colsample_bytree': 0.6740690767916798, 'colsample_bylevel': 0.9410448424303953, 'colsample_bynode': 0.3987447307436355, 'min_child_weight': 1.6870414712584036, 'gamma': 0.1681048378054735, 'reg_alpha': 0.012776043845789545, 'reg_lambda': 0.004726467884295017, 'max_delta_step': 0.8087832760523884, 'booster': 'dart'}. Best is trial 58 with value: 0.4921282524438041.[0m
[32m[I 2026-08-02 19:44:31,922][0m Trial 63 finished with value: 0.5006757058388027 and parameters: {'n_estimators': 1801, 'max_depth': 6, 'learning_rate': 0.03774444167548709, 'subsample': 0.7401033714404534, 'colsample_bytree': 0.8894818666729118, 'colsample_bylevel': 0.8551515234002637, 'colsample_bynode': 0.38144512749095477, 'min_child_weight': 8.469765611810415, 'gamma': 0.1230448874240402, 'reg_alpha': 6.990918625723743e-05, 'reg_lambda': 0.003787494209019804, 'max_delta_step': 3.4095345176961893, 'booster': 'dart'}. Best is trial 58 with value: 0.4921282524438041.[0m
[32m[I 2026-08-02 19:44:33,863][0m Trial 64 pruned. [0m
[32m[I 2026-08-02 19:44:36,547][0m Trial 65 pruned. [0m
[32m[I 2026-08-02 19:44:45,299][0m Trial 66 finished with value: 0.5022455159224715 and parameters: {'n_estimators': 1559, 'max_depth': 8, 'learning_rate': 0.04086862864195671, 'subsample': 0.6454377850683279, 'colsample_bytree': 0.9136148086503284, 'colsample_bylevel': 0.6281916441556569, 'colsample_bynode': 0.4447553679815862, 'min_child_weight': 2.7565820366356197, 'gamma': 0.016450186772756687, 'reg_alpha': 0.0023381262825126286, 'reg_lambda': 0.008784548570934957, 'max_delta_step': 4.6239363257212736, 'booster': 'gbtree'}. Best is trial 58 with value: 0.4921282524438041.[0m
[32m[I 2026-08-02 19:45:08,968][0m Trial 67 finished with value: 0.508067042714742 and parameters: {'n_estimators': 1507, 'max_depth': 6, 'learning_rate': 0.027733497439993954, 'subsample': 0.777340383390531, 'colsample_bytree': 0.7838734802885969, 'colsample_bylevel': 0.5970963819185158, 'colsample_bynode': 0.6302422045699085, 'min_child_weight': 2.8034917247335307, 'gamma': 0.2199330431558502, 'reg_alpha': 0.052933603039710675, 'reg_lambda': 2.673033261621592e-05, 'max_delta_step': 0.05297554329885698, 'booster': 'gbtree'}. Best is trial 58 with value: 0.4921282524438041.[0m
[32m[I 2026-08-02 19:45:13,670][0m Trial 68 pruned. [0m
[32m[I 2026-08-02 19:45:17,083][0m Trial 69 pruned. [0m
[32m[I 2026-08-02 19:45:27,526][0m Trial 70 finished with value: 0.5045183983226194 and parameters: {'n_estimators': 1644, 'max_depth': 7, 'learning_rate': 0.020431060892603187, 'subsample': 0.7923648002000332, 'colsample_bytree': 0.7524659723405617, 'colsample_bylevel': 0.9983920399316427, 'colsample_bynode': 0.3713639349033917, 'min_child_weight': 5.690003328726791, 'gamma': 0.1374833190454074, 'reg_alpha': 0.0015121045222547442, 'reg_lambda': 5.074083474610786e-07, 'max_delta_step': 2.68169785333144, 'booster': 'dart'}. Best is trial 58 with value: 0.4921282524438041.[0m
[32m[I 2026-08-02 19:45:40,226][0m Trial 71 finished with value: 0.49971341896922616 and parameters: {'n_estimators': 1070, 'max_depth': 9, 'learning_rate': 0.019293106774832123, 'subsample': 0.8984572716367691, 'colsample_bytree': 0.8511847456156407, 'colsample_bylevel': 0.8328941692658541, 'colsample_bynode': 0.3870086383695936, 'min_child_weight': 8.633521436815318, 'gamma': 0.06808316164923164, 'reg_alpha': 0.2845719714120143, 'reg_lambda': 6.050401014121243e-07, 'max_delta_step': 1.1169716461133201, 'booster': 'gbtree'}. Best is trial 58 with value: 0.4921282524438041.[0m
[32m[I 2026-08-02 19:45:50,291][0m Trial 72 pruned. [0m
[32m[I 2026-08-02 19:45:57,990][0m Trial 73 pruned. [0m
[32m[I 2026-08-02 19:46:16,706][0m Trial 74 pruned. [0m
[32m[I 2026-08-02 19:46:33,630][0m Trial 75 finished with value: 0.49905444272579247 and parameters: {'n_estimators': 1424, 'max_depth': 5, 'learning_rate': 0.010438860592117814, 'subsample': 0.7815238029207868, 'colsample_bytree': 0.9405640246976674, 'colsample_bylevel': 0.9416013989279596, 'colsample_bynode': 0.3600442147093456, 'min_child_weight': 1.3390264204327107, 'gamma': 0.11375548442923462, 'reg_alpha': 1.2491914325832885e-07, 'reg_lambda': 6.181495912414402e-06, 'max_delta_step': 0.9215854195785402, 'booster': 'dart'}. Best is trial 58 with value: 0.4921282524438041.[0m
[32m[I 2026-08-02 19:46:39,240][0m Trial 76 pruned. [0m
[32m[I 2026-08-02 19:46:45,718][0m Trial 77 finished with value: 0.498157257104649 and parameters: {'n_estimators': 819, 'max_depth': 7, 'learning_rate': 0.04069961435291875, 'subsample': 0.685691955019505, 'colsample_bytree': 0.6461731000712927, 'colsample_bylevel': 0.8727305655759806, 'colsample_bynode': 0.4334594987862084, 'min_child_weight': 7.651991890887294, 'gamma': 0.1021679978372134, 'reg_alpha': 0.0025612338711565818, 'reg_lambda': 0.00010336925075281226, 'max_delta_step': 4.316481837904474, 'booster': 'dart'}. Best is trial 58 with value: 0.4921282524438041.[0m
[32m[I 2026-08-02 19:47:16,519][0m Trial 78 finished with value: 0.5072336028782466 and parameters: {'n_estimators': 1781, 'max_depth': 9, 'learning_rate': 0.010049867801131374, 'subsample': 0.9040335655226324, 'colsample_bytree': 0.772201017959451, 'colsample_bylevel': 0.8586408516975029, 'colsample_bynode': 0.7491840269969003, 'min_child_weight': 1.1235799645834474, 'gamma': 0.08889221753027995, 'reg_alpha': 0.4263911990185813, 'reg_lambda': 1.6653398775298652e-05, 'max_delta_step': 1.8719764404340056, 'booster': 'gbtree'}. Best is trial 58 with value: 0.4921282524438041.[0m
[32m[I 2026-08-02 19:47:21,239][0m Trial 79 pruned. [0m
[32m[I 2026-08-02 19:47:34,215][0m Trial 80 finished with value: 0.5009001572899747 and parameters: {'n_estimators': 1092, 'max_depth': 8, 'learning_rate': 0.02017404160919845, 'subsample': 0.9792468058841862, 'colsample_bytree': 0.815269502430657, 'colsample_bylevel': 0.8767051575932684, 'colsample_bynode': 0.32433047943608234, 'min_child_weight': 2.3244651014886584, 'gamma': 0.013453441322070806, 'reg_alpha': 0.0025007773659802973, 'reg_lambda': 0.04148417930228656, 'max_delta_step': 1.5452834200872965, 'booster': 'dart'}. Best is trial 58 with value: 0.4921282524438041.[0m
[32m[I 2026-08-02 19:47:39,587][0m Trial 81 finished with value: 0.5104504966638993 and parameters: {'n_estimators': 1195, 'max_depth': 10, 'learning_rate': 0.053803725679037157, 'subsample': 0.8881181342201221, 'colsample_bytree': 0.8055339070896391, 'colsample_bylevel': 0.7957249140359326, 'colsample_bynode': 0.3277486285164713, 'min_child_weight': 8.785998594572694, 'gamma': 0.15136464947359574, 'reg_alpha': 0.04577574859109291, 'reg_lambda': 0.0013958053517043004, 'max_delta_step': 1.4239640939468594, 'booster': 'dart'}. Best is trial 58 with value: 0.4921282524438041.[0m
[32m[I 2026-08-02 19:47:52,603][0m Trial 82 finished with value: 0.499191817306361 and parameters: {'n_estimators': 955, 'max_depth': 5, 'learning_rate': 0.0176079739415999, 'subsample': 0.7719854380580705, 'colsample_bytree': 0.7166291527837545, 'colsample_bylevel': 0.666247856995264, 'colsample_bynode': 0.6546227792975591, 'min_child_weight': 2.0385815175414184, 'gamma': 0.11203283684144363, 'reg_alpha': 0.00760775564105124, 'reg_lambda': 8.142167410031822, 'max_delta_step': 0.46286943177392215, 'booster': 'gbtree'}. Best is trial 58 with value: 0.4921282524438041.[0m
[32m[I 2026-08-02 19:47:57,354][0m Trial 83 pruned. [0m
[32m[I 2026-08-02 19:48:12,714][0m Trial 84 finished with value: 0.49392522677258716 and parameters: {'n_estimators': 1156, 'max_depth': 10, 'learning_rate': 0.020614080783997586, 'subsample': 0.7232151136696762, 'colsample_bytree': 0.6230314054866488, 'colsample_bylevel': 0.924815749726502, 'colsample_bynode': 0.34317762669739954, 'min_child_weight': 6.4449907460096, 'gamma': 0.04195031558454104, 'reg_alpha': 2.8262638349291367e-08, 'reg_lambda': 0.011999754438503893, 'max_delta_step': 2.0089412333409817, 'booster': 'dart'}. Best is trial 58 with value: 0.4921282524438041.[0m
[32m[I 2026-08-02 19:48:16,223][0m Trial 85 pruned. [0m
[32m[I 2026-08-02 19:48:27,405][0m Trial 86 finished with value: 0.5069364860854426 and parameters: {'n_estimators': 1385, 'max_depth': 10, 'learning_rate': 0.022792489944778494, 'subsample': 0.660485533616162, 'colsample_bytree': 0.6179222649004098, 'colsample_bylevel': 0.9075744453739448, 'colsample_bynode': 0.32964204465298785, 'min_child_weight': 5.096160706343019, 'gamma': 0.2460250879801632, 'reg_alpha': 2.3156778340068027e-08, 'reg_lambda': 0.014082520993707182, 'max_delta_step': 1.0958257761165369, 'booster': 'gbtree'}. Best is trial 58 with value: 0.4921282524438041.[0m
[32m[I 2026-08-02 19:48:31,389][0m Trial 87 pruned. [0m
[32m[I 2026-08-02 19:48:36,326][0m Trial 88 finished with value: 0.5124257820498237 and parameters: {'n_estimators': 1133, 'max_depth': 10, 'learning_rate': 0.09730666890645959, 'subsample': 0.7725637590561062, 'colsample_bytree': 0.7432753958406941, 'colsample_bylevel': 0.866125385895704, 'colsample_bynode': 0.4177361447225762, 'min_child_weight': 7.583402102982379, 'gamma': 0.26653496871756055, 'reg_alpha': 1.340916329956129, 'reg_lambda': 0.7236036568742907, 'max_delta_step': 4.394990986435456, 'booster': 'dart'}. Best is trial 58 with value: 0.4921282524438041.[0m
[32m[I 2026-08-02 19:48:39,410][0m Trial 89 pruned. [0m
[32m[I 2026-08-02 19:48:55,928][0m Trial 90 finished with value: 0.4970623080438168 and parameters: {'n_estimators': 1899, 'max_depth': 4, 'learning_rate': 0.01157384479299124, 'subsample': 0.7212733227616266, 'colsample_bytree': 0.8177316965882513, 'colsample_bylevel': 0.3134315820381536, 'colsample_bynode': 0.577420084890526, 'min_child_weight': 5.619648888997879, 'gamma': 0.1637132438817155, 'reg_alpha': 0.13568304786101978, 'reg_lambda': 7.612738223702405e-05, 'max_delta_step': 4.356049659314384, 'booster': 'gbtree'}. Best is trial 58 with value: 0.4921282524438041.[0m
[32m[I 2026-08-02 19:49:03,824][0m Trial 91 pruned. [0m
[32m[I 2026-08-02 19:49:09,007][0m Trial 92 pruned. [0m
[32m[I 2026-08-02 19:49:25,718][0m Trial 93 finished with value: 0.4960812433490931 and parameters: {'n_estimators': 2673, 'max_depth': 7, 'learning_rate': 0.013561574034408296, 'subsample': 0.6362277813300075, 'colsample_bytree': 0.7141309224131589, 'colsample_bylevel': 0.7453980183175536, 'colsample_bynode': 0.445666336276518, 'min_child_weight': 8.044969070901395, 'gamma': 0.1114460494062257, 'reg_alpha': 0.0011483516521187198, 'reg_lambda': 0.0001758323110715091, 'max_delta_step': 5.278013788796705, 'booster': 'gbtree'}. Best is trial 58 with value: 0.4921282524438041.[0m
[32m[I 2026-08-02 19:49:30,618][0m Trial 94 pruned. [0m
[32m[I 2026-08-02 19:49:36,664][0m Trial 95 pruned. [0m
[32m[I 2026-08-02 19:49:44,147][0m Trial 96 finished with value: 0.5150440123936356 and parameters: {'n_estimators': 1362, 'max_depth': 12, 'learning_rate': 0.05829833162871913, 'subsample': 0.8453468291300125, 'colsample_bytree': 0.6761079389783399, 'colsample_bylevel': 0.8321912791474456, 'colsample_bynode': 0.4695995393009179, 'min_child_weight': 2.1584780029381037, 'gamma': 0.06785876332412318, 'reg_alpha': 3.184844901315365e-07, 'reg_lambda': 0.04717975448248074, 'max_delta_step': 4.201675991299005, 'booster': 'dart'}. Best is trial 58 with value: 0.4921282524438041.[0m
[32m[I 2026-08-02 19:49:58,431][0m Trial 97 finished with value: 0.500835081616047 and parameters: {'n_estimators': 801, 'max_depth': 10, 'learning_rate': 0.028376020793612657, 'subsample': 0.7160343411538737, 'colsample_bytree': 0.9341521804822841, 'colsample_bylevel': 0.781825004273583, 'colsample_bynode': 0.3902207425215272, 'min_child_weight': 3.263968377805869, 'gamma': 0.1003713617671193, 'reg_alpha': 0.04012070921107353, 'reg_lambda': 0.08384880358657003, 'max_delta_step': 0.29507159794435545, 'booster': 'gbtree'}. Best is trial 58 with value: 0.4921282524438041.[0m
[32m[I 2026-08-02 19:50:02,874][0m Trial 98 pruned. [0m
[32m[I 2026-08-02 19:50:16,114][0m Trial 99 finished with value: 0.5020950250464129 and parameters: {'n_estimators': 1970, 'max_depth': 4, 'learning_rate': 0.017225286147220607, 'subsample': 0.7543782228494813, 'colsample_bytree': 0.9655583979115909, 'colsample_bylevel': 0.34277476305789517, 'colsample_bynode': 0.6601000287925652, 'min_child_weight': 10.795541543124427, 'gamma': 0.20584779715411503, 'reg_alpha': 0.7461569880718315, 'reg_lambda': 3.311143142580711e-05, 'max_delta_step': 3.479819546945293, 'booster': 'dart'}. Best is trial 58 with value: 0.4921282524438041.[0m
[32m[I 2026-08-02 19:50:31,727][0m Trial 100 pruned. [0m
[32m[I 2026-08-02 19:50:51,227][0m Trial 101 finished with value: 0.4958419013789424 and parameters: {'n_estimators': 2080, 'max_depth': 4, 'learning_rate': 0.014125147682282792, 'subsample': 0.7507696259021178, 'colsample_bytree': 0.7278631228388097, 'colsample_bylevel': 0.40919733497618394, 'colsample_bynode': 0.4206277742953146, 'min_child_weight': 8.105684609170321, 'gamma': 0.04277254005631638, 'reg_alpha': 0.6467650465489047, 'reg_lambda': 0.00041564054692452276, 'max_delta_step': 2.4270152378569527, 'booster': 'gbtree'}. Best is trial 58 with value: 0.4921282524438041.[0m
[32m[I 2026-08-02 19:51:04,116][0m Trial 102 finished with value: 0.5122481447767525 and parameters: {'n_estimators': 2758, 'max_depth': 8, 'learning_rate': 0.01760547439771306, 'subsample': 0.6810907088875255, 'colsample_bytree': 0.8612396164754348, 'colsample_bylevel': 0.8354483769433796, 'colsample_bynode': 0.3209745202362938, 'min_child_weight': 2.5344202065854464, 'gamma': 0.3145141640984486, 'reg_alpha': 0.02967395122598324, 'reg_lambda': 3.3192678169101933e-05, 'max_delta_step': 4.806840231097179, 'booster': 'gbtree'}. Best is trial 58 with value: 0.4921282524438041.[0m
[32m[I 2026-08-02 19:51:22,237][0m Trial 103 finished with value: 0.498729842949479 and parameters: {'n_estimators': 1909, 'max_depth': 4, 'learning_rate': 0.014094259358447344, 'subsample': 0.8165824921049224, 'colsample_bytree': 0.7401482976138765, 'colsample_bylevel': 0.31887634038210255, 'colsample_bynode': 0.7065738368183673, 'min_child_weight': 5.477318806964061, 'gamma': 0.11538707257263289, 'reg_alpha': 1.103583198386915, 'reg_lambda': 3.345162322424562e-05, 'max_delta_step': 1.5688710797655672, 'booster': 'gbtree'}. Best is trial 58 with value: 0.4921282524438041.[0m
[32m[I 2026-08-02 19:51:30,876][0m Trial 104 pruned. [0m
[32m[I 2026-08-02 19:51:36,599][0m Trial 105 finished with value: 0.49691889158270264 and parameters: {'n_estimators': 927, 'max_depth': 9, 'learning_rate': 0.05197414441265424, 'subsample': 0.8052342316884045, 'colsample_bytree': 0.9635778736763323, 'colsample_bylevel': 0.8886456250801166, 'colsample_bynode': 0.3822169517780075, 'min_child_weight': 10.156438704675166, 'gamma': 0.11706748150419921, 'reg_alpha': 3.521067309147675e-07, 'reg_lambda': 0.0001555995721720818, 'max_delta_step': 3.0736089151781263, 'booster': 'dart'}. Best is trial 58 with value: 0.4921282524438041.[0m
[32m[I 2026-08-02 19:51:51,687][0m Trial 106 finished with value: 0.498707342628706 and parameters: {'n_estimators': 2383, 'max_depth': 6, 'learning_rate': 0.01599877425845726, 'subsample': 0.6097128500194079, 'colsample_bytree': 0.7939424786257826, 'colsample_bylevel': 0.8012965139437963, 'colsample_bynode': 0.5792229357860694, 'min_child_weight': 11.336195797047107, 'gamma': 0.13275128856013804, 'reg_alpha': 0.00041241402429504124, 'reg_lambda': 0.00021168089351147768, 'max_delta_step': 5.704462785180778, 'booster': 'gbtree'}. Best is trial 58 with value: 0.4921282524438041.[0m
