============================================================
xgboost — 运行开始  20260802_193437
  输出目录:  runs\pCMC\pCMC_xgboost_20260802_193437
============================================================
============================================================
XGBoost + PharmHGT-style Featurization for LogCMC (pCMC) Prediction
============================================================
[Cache HIT] Loading features from data\features\surfpro\pCMC
  Train features: (1204, 522)
  Test features:  (140, 522)

Split: Train 1053, Val 151, Test 140
  CV (Optuna): 1083, Holdout (Top-K filter): 121

============================================================
Optuna Hyperparameter Tuning (200 trials, 5-Fold CV)
============================================================
[32m[I 2026-08-02 19:34:42,599][0m Trial 0 finished with value: 0.5578114725882763 and parameters: {'n_estimators': 1624, 'max_depth': 12, 'learning_rate': 0.08960785365368121, 'subsample': 0.8394633936788146, 'colsample_bytree': 0.40921304830970556, 'colsample_bylevel': 0.40919616423534183, 'colsample_bynode': 0.3406585285177396, 'min_child_weight': 19.030368381735816, 'gamma': 1.2022300234864176, 'reg_alpha': 0.023585940584142682, 'reg_lambda': 1.5320059381854043e-08, 'max_delta_step': 7.759278817295955, 'booster': 'gbtree'}. Best is trial 0 with value: 0.5578114725882763.[0m
[32m[I 2026-08-02 19:34:47,536][0m Trial 1 finished with value: 0.5287340358694123 and parameters: {'n_estimators': 1200, 'max_depth': 5, 'learning_rate': 0.024878734419814436, 'subsample': 0.8099025726528951, 'colsample_bytree': 0.602361513049481, 'colsample_bylevel': 0.5038603981386294, 'colsample_bynode': 0.7282970263056656, 'min_child_weight': 1.6071238512039876, 'gamma': 0.5842892970704363, 'reg_alpha': 1.9826980964985924e-05, 'reg_lambda': 0.00012724181576752517, 'max_delta_step': 6.281407691144109, 'booster': 'dart'}. Best is trial 1 with value: 0.5287340358694123.[0m
[32m[I 2026-08-02 19:34:50,819][0m Trial 2 finished with value: 0.5232369609623245 and parameters: {'n_estimators': 2103, 'max_depth': 4, 'learning_rate': 0.061721159481070736, 'subsample': 0.6682096494749166, 'colsample_bytree': 0.3455361150896956, 'colsample_bylevel': 0.9642198760773333, 'colsample_bynode': 0.9759424231521916, 'min_child_weight': 15.635108708133458, 'gamma': 0.6092275383467414, 'reg_alpha': 7.569183361880229e-08, 'reg_lambda': 0.014391207615728067, 'max_delta_step': 3.5212199499168104, 'booster': 'dart'}. Best is trial 2 with value: 0.5232369609623245.[0m
[32m[I 2026-08-02 19:34:55,284][0m Trial 3 finished with value: 0.5660420013964735 and parameters: {'n_estimators': 875, 'max_depth': 12, 'learning_rate': 0.02171103454376615, 'subsample': 0.8650089137415928, 'colsample_bytree': 0.5181977532625877, 'colsample_bylevel': 0.6640476148244676, 'colsample_bynode': 0.6826971955402957, 'min_child_weight': 1.8752209455786402, 'gamma': 1.9391692555291171, 'reg_alpha': 0.09466630153726856, 'reg_lambda': 2.854239907497756, 'max_delta_step': 7.158618803421191, 'booster': 'dart'}. Best is trial 2 with value: 0.5232369609623245.[0m
[32m[I 2026-08-02 19:35:02,623][0m Trial 4 finished with value: 0.5191677025974502 and parameters: {'n_estimators': 994, 'max_depth': 5, 'learning_rate': 0.011450964268326641, 'subsample': 0.7301321323053057, 'colsample_bytree': 0.5720741027826374, 'colsample_bylevel': 0.4899443222417271, 'colsample_bynode': 0.8801162564063505, 'min_child_weight': 3.3648671441879534, 'gamma': 0.5618690193747615, 'reg_alpha': 0.0007660634613082914, 'reg_lambda': 1.8548894229694903e-07, 'max_delta_step': 6.417575846032317, 'booster': 'dart'}. Best is trial 4 with value: 0.5191677025974502.[0m
[32m[I 2026-08-02 19:35:12,861][0m Trial 5 finished with value: 0.5285515171995266 and parameters: {'n_estimators': 2499, 'max_depth': 5, 'learning_rate': 0.010166803740022877, 'subsample': 0.9261845713819337, 'colsample_bytree': 0.7948001406933319, 'colsample_bylevel': 0.810305017628691, 'colsample_bynode': 0.8398892426801621, 'min_child_weight': 1.286390810198991, 'gamma': 0.7169314570885452, 'reg_alpha': 1.1036250149900698e-07, 'reg_lambda': 0.5860448217200517, 'max_delta_step': 4.986385014620463, 'booster': 'gbtree'}. Best is trial 4 with value: 0.5191677025974502.[0m
[32m[I 2026-08-02 19:35:14,800][0m Trial 6 pruned. [0m
[32m[I 2026-08-02 19:35:22,825][0m Trial 7 finished with value: 0.5340559479044807 and parameters: {'n_estimators': 855, 'max_depth': 4, 'learning_rate': 0.010987283063579408, 'subsample': 0.8545641645055122, 'colsample_bytree': 0.5200491867534287, 'colsample_bylevel': 0.6559994838152918, 'colsample_bynode': 0.9352965317482651, 'min_child_weight': 2.3347202509035236, 'gamma': 0.8207658460712595, 'reg_alpha': 0.06308995924905789, 'reg_lambda': 1.1459970229341322e-06, 'max_delta_step': 0.6158392786303439, 'booster': 'gbtree'}. Best is trial 4 with value: 0.5191677025974502.[0m
[32m[I 2026-08-02 19:35:25,132][0m Trial 8 pruned. [0m
[32m[I 2026-08-02 19:35:31,002][0m Trial 9 pruned. [0m
[32m[I 2026-08-02 19:35:33,916][0m Trial 10 pruned. [0m
[32m[I 2026-08-02 19:35:42,846][0m Trial 11 pruned. [0m
[32m[I 2026-08-02 19:35:44,057][0m Trial 12 pruned. [0m
[32m[I 2026-08-02 19:35:46,828][0m Trial 13 finished with value: 0.5403000711906898 and parameters: {'n_estimators': 1635, 'max_depth': 4, 'learning_rate': 0.10978626875153677, 'subsample': 0.7334437070793008, 'colsample_bytree': 0.3596828750878944, 'colsample_bylevel': 0.8433333977341397, 'colsample_bynode': 0.997832829994649, 'min_child_weight': 6.860622626363863, 'gamma': 1.1619084794833203, 'reg_alpha': 2.5314498413323836e-06, 'reg_lambda': 0.08810262850141574, 'max_delta_step': 1.3275832297603047, 'booster': 'dart'}. Best is trial 4 with value: 0.5191677025974502.[0m
[32m[I 2026-08-02 19:35:56,563][0m Trial 14 finished with value: 0.4988372579504108 and parameters: {'n_estimators': 1117, 'max_depth': 4, 'learning_rate': 0.018256088167666162, 'subsample': 0.697150323465752, 'colsample_bytree': 0.6512816095089177, 'colsample_bylevel': 0.363539427272077, 'colsample_bynode': 0.5310026124859382, 'min_child_weight': 3.98421083006667, 'gamma': 0.01161932514567432, 'reg_alpha': 0.0010563944880194625, 'reg_lambda': 1.9205560425124832e-07, 'max_delta_step': 6.315922139258089, 'booster': 'gbtree'}. Best is trial 14 with value: 0.4988372579504108.[0m
[32m[I 2026-08-02 19:36:04,362][0m Trial 15 finished with value: 0.4980850372077702 and parameters: {'n_estimators': 1476, 'max_depth': 6, 'learning_rate': 0.025382011460766806, 'subsample': 0.6675677808664311, 'colsample_bytree': 0.7195198782700667, 'colsample_bylevel': 0.42948426787821425, 'colsample_bynode': 0.5326142712290104, 'min_child_weight': 7.115665364031085, 'gamma': 0.11178917465387342, 'reg_alpha': 0.0030174440697725174, 'reg_lambda': 1.2957400084911288e-07, 'max_delta_step': 6.844993497864411, 'booster': 'gbtree'}. Best is trial 15 with value: 0.4980850372077702.[0m
[32m[I 2026-08-02 19:36:18,270][0m Trial 16 finished with value: 0.4971878580500794 and parameters: {'n_estimators': 1612, 'max_depth': 4, 'learning_rate': 0.016664487039013045, 'subsample': 0.7384623889864128, 'colsample_bytree': 0.6762118267398433, 'colsample_bylevel': 0.45727705301134225, 'colsample_bynode': 0.4604581026730133, 'min_child_weight': 5.9373416318787156, 'gamma': 0.09094355540664868, 'reg_alpha': 0.052118554336861286, 'reg_lambda': 7.189314559438563e-05, 'max_delta_step': 6.782422459525532, 'booster': 'gbtree'}. Best is trial 16 with value: 0.4971878580500794.[0m
[32m[I 2026-08-02 19:36:31,118][0m Trial 17 finished with value: 0.5040313622450903 and parameters: {'n_estimators': 1991, 'max_depth': 4, 'learning_rate': 0.02038992546399375, 'subsample': 0.6107161001694589, 'colsample_bytree': 0.6906095724488288, 'colsample_bylevel': 0.3121219948140353, 'colsample_bynode': 0.42839882276047025, 'min_child_weight': 9.24779538777139, 'gamma': 0.2822200228701522, 'reg_alpha': 0.3495385981481336, 'reg_lambda': 0.02824487091212639, 'max_delta_step': 7.075871978372667, 'booster': 'gbtree'}. Best is trial 16 with value: 0.4971878580500794.[0m
[32m[I 2026-08-02 19:36:37,746][0m Trial 18 finished with value: 0.5239888891745851 and parameters: {'n_estimators': 1567, 'max_depth': 6, 'learning_rate': 0.036904798666153774, 'subsample': 0.6153815260139253, 'colsample_bytree': 0.9367345075898507, 'colsample_bylevel': 0.6957380328556559, 'colsample_bynode': 0.5303346197902039, 'min_child_weight': 13.787960370129737, 'gamma': 0.609817228949325, 'reg_alpha': 0.0004892636656553103, 'reg_lambda': 3.547712529008811e-08, 'max_delta_step': 7.149603566973529, 'booster': 'gbtree'}. Best is trial 16 with value: 0.4971878580500794.[0m
[32m[I 2026-08-02 19:36:42,829][0m Trial 19 finished with value: 0.5102811426695539 and parameters: {'n_estimators': 1966, 'max_depth': 5, 'learning_rate': 0.046116603803425985, 'subsample': 0.815695948094109, 'colsample_bytree': 0.6080495437096044, 'colsample_bylevel': 0.416550764289214, 'colsample_bynode': 0.8768833377988736, 'min_child_weight': 5.775614990844337, 'gamma': 0.1996327447163861, 'reg_alpha': 0.6401426754910446, 'reg_lambda': 9.96288956025025e-06, 'max_delta_step': 7.804657667484163, 'booster': 'gbtree'}. Best is trial 16 with value: 0.4971878580500794.[0m
[32m[I 2026-08-02 19:36:59,032][0m Trial 20 finished with value: 0.5040082483094321 and parameters: {'n_estimators': 1888, 'max_depth': 7, 'learning_rate': 0.013090013835107779, 'subsample': 0.819265190699724, 'colsample_bytree': 0.9353282185926133, 'colsample_bylevel': 0.6706213462866626, 'colsample_bynode': 0.5702266076748733, 'min_child_weight': 3.232039115648222, 'gamma': 0.20697145625567123, 'reg_alpha': 0.3476511857481995, 'reg_lambda': 3.039362624336858e-08, 'max_delta_step': 5.242126473939264, 'booster': 'gbtree'}. Best is trial 16 with value: 0.4971878580500794.[0m
[32m[I 2026-08-02 19:37:05,558][0m Trial 21 finished with value: 0.5100513357637662 and parameters: {'n_estimators': 825, 'max_depth': 7, 'learning_rate': 0.025659535825232165, 'subsample': 0.7412165351568734, 'colsample_bytree': 0.6272760127872091, 'colsample_bylevel': 0.40454574661557396, 'colsample_bynode': 0.3130299388271382, 'min_child_weight': 4.826283779190152, 'gamma': 0.20242397044100413, 'reg_alpha': 8.302737041759417e-05, 'reg_lambda': 8.653331119044694e-07, 'max_delta_step': 6.217911841389556, 'booster': 'gbtree'}. Best is trial 16 with value: 0.4971878580500794.[0m
[32m[I 2026-08-02 19:37:16,451][0m Trial 22 finished with value: 0.5053550882903505 and parameters: {'n_estimators': 1190, 'max_depth': 4, 'learning_rate': 0.014687257514320238, 'subsample': 0.6946464292056508, 'colsample_bytree': 0.773655992047818, 'colsample_bylevel': 0.5382192596418083, 'colsample_bynode': 0.5753581360399489, 'min_child_weight': 5.473875196184412, 'gamma': 0.3506356865996322, 'reg_alpha': 0.0021056052807171856, 'reg_lambda': 9.826261224575253e-08, 'max_delta_step': 4.6042146407592455, 'booster': 'gbtree'}. Best is trial 16 with value: 0.4971878580500794.[0m
[32m[I 2026-08-02 19:37:22,761][0m Trial 23 finished with value: 0.5002459750402226 and parameters: {'n_estimators': 1843, 'max_depth': 4, 'learning_rate': 0.040374465697161264, 'subsample': 0.8342661052446272, 'colsample_bytree': 0.7013159224201821, 'colsample_bylevel': 0.4949554062598227, 'colsample_bynode': 0.3312257454224478, 'min_child_weight': 3.913922119980567, 'gamma': 0.00391941540106959, 'reg_alpha': 0.0023260301926375983, 'reg_lambda': 0.009241748909411273, 'max_delta_step': 3.3372994263806803, 'booster': 'gbtree'}. Best is trial 16 with value: 0.4971878580500794.[0m
[32m[I 2026-08-02 19:37:36,310][0m Trial 24 finished with value: 0.5102093334253143 and parameters: {'n_estimators': 2067, 'max_depth': 5, 'learning_rate': 0.0159800475709758, 'subsample': 0.7301719347936615, 'colsample_bytree': 0.6904929305346879, 'colsample_bylevel': 0.5786419312956401, 'colsample_bynode': 0.3827513082137103, 'min_child_weight': 3.81787933716416, 'gamma': 0.3088107989180418, 'reg_alpha': 0.217699747220631, 'reg_lambda': 1.2710166331139483e-05, 'max_delta_step': 6.945639383128019, 'booster': 'dart'}. Best is trial 16 with value: 0.4971878580500794.[0m
[32m[I 2026-08-02 19:37:46,158][0m Trial 25 finished with value: 0.5108034716003321 and parameters: {'n_estimators': 823, 'max_depth': 5, 'learning_rate': 0.011290886093831115, 'subsample': 0.8874027162877461, 'colsample_bytree': 0.4973085650860787, 'colsample_bylevel': 0.4430144524040204, 'colsample_bynode': 0.5772365283133611, 'min_child_weight': 2.893489202087579, 'gamma': 0.01766316295978111, 'reg_alpha': 0.8242655981447761, 'reg_lambda': 0.0002806851383331334, 'max_delta_step': 5.931035831591384, 'booster': 'gbtree'}. Best is trial 16 with value: 0.4971878580500794.[0m
[32m[I 2026-08-02 19:37:52,151][0m Trial 26 finished with value: 0.49720033075387765 and parameters: {'n_estimators': 853, 'max_depth': 5, 'learning_rate': 0.050664962856090026, 'subsample': 0.6333232848191556, 'colsample_bytree': 0.7070265961977338, 'colsample_bylevel': 0.4166870153970073, 'colsample_bynode': 0.6068580956425889, 'min_child_weight': 6.150763688559443, 'gamma': 0.07107827147704515, 'reg_alpha': 0.08854494491835731, 'reg_lambda': 5.391993293040001e-07, 'max_delta_step': 6.976856720828882, 'booster': 'dart'}. Best is trial 16 with value: 0.4971878580500794.[0m
[32m[I 2026-08-02 19:37:53,779][0m Trial 27 pruned. [0m
[32m[I 2026-08-02 19:38:04,247][0m Trial 28 finished with value: 0.4989593733861519 and parameters: {'n_estimators': 1705, 'max_depth': 7, 'learning_rate': 0.03339663838447931, 'subsample': 0.6619557885914839, 'colsample_bytree': 0.7477411401581059, 'colsample_bylevel': 0.4108946909809468, 'colsample_bynode': 0.7262333911270377, 'min_child_weight': 4.328104152584806, 'gamma': 0.031488745075461955, 'reg_alpha': 0.3566692855212581, 'reg_lambda': 1.422019788694678e-07, 'max_delta_step': 7.340313576800291, 'booster': 'dart'}. Best is trial 16 with value: 0.4971878580500794.[0m
[32m[I 2026-08-02 19:38:21,440][0m Trial 29 finished with value: 0.4944284953025469 and parameters: {'n_estimators': 2179, 'max_depth': 7, 'learning_rate': 0.015816836897987425, 'subsample': 0.6876646822912759, 'colsample_bytree': 0.6661763430649896, 'colsample_bylevel': 0.6528627792255695, 'colsample_bynode': 0.4914275526998965, 'min_child_weight': 5.769265696104173, 'gamma': 0.015002884229786476, 'reg_alpha': 0.006700159191262021, 'reg_lambda': 0.00014578464827374294, 'max_delta_step': 4.3014307929443625, 'booster': 'gbtree'}. Best is trial 29 with value: 0.4944284953025469.[0m
[32m[I 2026-08-02 19:38:33,611][0m Trial 30 finished with value: 0.5058024636234398 and parameters: {'n_estimators': 2094, 'max_depth': 8, 'learning_rate': 0.01420187870922698, 'subsample': 0.6061587394044864, 'colsample_bytree': 0.4804403025898183, 'colsample_bylevel': 0.586548573768352, 'colsample_bynode': 0.482809329032916, 'min_child_weight': 5.507231977902724, 'gamma': 0.1728478127987842, 'reg_alpha': 0.01864974569959378, 'reg_lambda': 0.004241191999906208, 'max_delta_step': 4.866245000914267, 'booster': 'gbtree'}. Best is trial 29 with value: 0.4944284953025469.[0m
[32m[I 2026-08-02 19:38:39,001][0m Trial 31 finished with value: 0.5117385977455774 and parameters: {'n_estimators': 822, 'max_depth': 5, 'learning_rate': 0.11959443140094851, 'subsample': 0.636779902417878, 'colsample_bytree': 0.6657275820160193, 'colsample_bylevel': 0.4224918600899402, 'colsample_bynode': 0.5897867382382885, 'min_child_weight': 2.8240285928553805, 'gamma': 0.07026503393609036, 'reg_alpha': 4.087400036947569, 'reg_lambda': 9.343795763871621e-07, 'max_delta_step': 5.813632805972976, 'booster': 'gbtree'}. Best is trial 29 with value: 0.4944284953025469.[0m
[32m[I 2026-08-02 19:38:56,413][0m Trial 32 finished with value: 0.5068772421228499 and parameters: {'n_estimators': 1996, 'max_depth': 9, 'learning_rate': 0.010715998830264941, 'subsample': 0.6898954999588973, 'colsample_bytree': 0.798014909181748, 'colsample_bylevel': 0.5003516270747393, 'colsample_bynode': 0.5064480604543387, 'min_child_weight': 8.667511899475235, 'gamma': 0.2577670886909236, 'reg_alpha': 0.0006436983148116983, 'reg_lambda': 0.006243980997419854, 'max_delta_step': 1.705363467042945, 'booster': 'gbtree'}. Best is trial 29 with value: 0.4944284953025469.[0m
[32m[I 2026-08-02 19:39:04,967][0m Trial 33 finished with value: 0.5002975269057394 and parameters: {'n_estimators': 1949, 'max_depth': 4, 'learning_rate': 0.02865578559980868, 'subsample': 0.7654406500117744, 'colsample_bytree': 0.792417296690377, 'colsample_bylevel': 0.6622122783793407, 'colsample_bynode': 0.435525321573841, 'min_child_weight': 6.917688269126784, 'gamma': 0.2000485251445298, 'reg_alpha': 0.1160246739631821, 'reg_lambda': 7.6211699264857585e-06, 'max_delta_step': 6.935742596819053, 'booster': 'gbtree'}. Best is trial 29 with value: 0.4944284953025469.[0m
[32m[I 2026-08-02 19:39:13,887][0m Trial 34 finished with value: 0.5055674282102465 and parameters: {'n_estimators': 900, 'max_depth': 6, 'learning_rate': 0.030190316467304433, 'subsample': 0.6749358833024237, 'colsample_bytree': 0.6797263401329088, 'colsample_bylevel': 0.4220193436705885, 'colsample_bynode': 0.6205881118705341, 'min_child_weight': 12.418285545473964, 'gamma': 0.1290563563247245, 'reg_alpha': 0.4462719118260839, 'reg_lambda': 8.685319051773414e-08, 'max_delta_step': 4.835893895023673, 'booster': 'dart'}. Best is trial 29 with value: 0.4944284953025469.[0m
[32m[I 2026-08-02 19:39:32,847][0m Trial 35 finished with value: 0.5023504623050303 and parameters: {'n_estimators': 2205, 'max_depth': 8, 'learning_rate': 0.012577481200316262, 'subsample': 0.6749353189827528, 'colsample_bytree': 0.7375097595549314, 'colsample_bylevel': 0.9640755755306278, 'colsample_bynode': 0.41796484607002904, 'min_child_weight': 1.884339380044196, 'gamma': 0.06515885108382624, 'reg_alpha': 8.227252912261662e-07, 'reg_lambda': 1.3490383177213932e-05, 'max_delta_step': 4.159569712262289, 'booster': 'gbtree'}. Best is trial 29 with value: 0.4944284953025469.[0m
[32m[I 2026-08-02 19:39:36,901][0m Trial 36 finished with value: 0.5120344335683479 and parameters: {'n_estimators': 1300, 'max_depth': 4, 'learning_rate': 0.0815303646332063, 'subsample': 0.6055400414023853, 'colsample_bytree': 0.7062624934667908, 'colsample_bylevel': 0.3315269225620223, 'colsample_bynode': 0.7384607719141341, 'min_child_weight': 7.724944824293338, 'gamma': 0.28060314547517534, 'reg_alpha': 0.16072753650375116, 'reg_lambda': 0.023666736153791182, 'max_delta_step': 6.674110394059385, 'booster': 'dart'}. Best is trial 29 with value: 0.4944284953025469.[0m
[32m[I 2026-08-02 19:39:54,767][0m Trial 37 finished with value: 0.5020343779479124 and parameters: {'n_estimators': 2393, 'max_depth': 8, 'learning_rate': 0.011526075410917823, 'subsample': 0.6833502677308532, 'colsample_bytree': 0.7797854837483461, 'colsample_bylevel': 0.544340140010864, 'colsample_bynode': 0.6159906176729643, 'min_child_weight': 4.54286623548795, 'gamma': 0.19936513727339877, 'reg_alpha': 0.00014609884568056496, 'reg_lambda': 2.0624380581545737e-05, 'max_delta_step': 4.318895572146978, 'booster': 'dart'}. Best is trial 29 with value: 0.4944284953025469.[0m
[32m[I 2026-08-02 19:40:00,980][0m Trial 38 finished with value: 0.5022376551615031 and parameters: {'n_estimators': 1197, 'max_depth': 6, 'learning_rate': 0.0662866979477708, 'subsample': 0.6182429094258871, 'colsample_bytree': 0.7453770798208235, 'colsample_bylevel': 0.6166197112923824, 'colsample_bynode': 0.6085110224682211, 'min_child_weight': 4.314789845327955, 'gamma': 0.01825744196650765, 'reg_alpha': 0.009471888195759094, 'reg_lambda': 1.0375150455914698e-08, 'max_delta_step': 5.360944175698893, 'booster': 'dart'}. Best is trial 29 with value: 0.4944284953025469.[0m
[32m[I 2026-08-02 19:40:18,111][0m Trial 39 finished with value: 0.4987929391813517 and parameters: {'n_estimators': 1410, 'max_depth': 6, 'learning_rate': 0.011419352644395793, 'subsample': 0.7075035427201873, 'colsample_bytree': 0.7462885774409648, 'colsample_bylevel': 0.4969372875823417, 'colsample_bynode': 0.43510746737173667, 'min_child_weight': 6.406802192905976, 'gamma': 0.10995378828442429, 'reg_alpha': 0.27255471268022663, 'reg_lambda': 1.6674772684012815e-05, 'max_delta_step': 7.761134588084509, 'booster': 'gbtree'}. Best is trial 29 with value: 0.4944284953025469.[0m
[32m[I 2026-08-02 19:40:35,029][0m Trial 40 finished with value: 0.4976776929288967 and parameters: {'n_estimators': 2085, 'max_depth': 5, 'learning_rate': 0.01324004270505891, 'subsample': 0.6386613789543489, 'colsample_bytree': 0.8207972633991051, 'colsample_bylevel': 0.7515141783719681, 'colsample_bynode': 0.48981670692027424, 'min_child_weight': 2.1272734122425723, 'gamma': 0.15349608457441427, 'reg_alpha': 0.4377248542261048, 'reg_lambda': 5.748654018594871e-06, 'max_delta_step': 1.7761545870039468, 'booster': 'gbtree'}. Best is trial 29 with value: 0.4944284953025469.[0m
[32m[I 2026-08-02 19:40:52,379][0m Trial 41 finished with value: 0.502718268361785 and parameters: {'n_estimators': 2012, 'max_depth': 6, 'learning_rate': 0.011296303602261751, 'subsample': 0.6243356332118514, 'colsample_bytree': 0.7543545541820643, 'colsample_bylevel': 0.6236830770968691, 'colsample_bynode': 0.539901609693274, 'min_child_weight': 1.5560773521392346, 'gamma': 0.2046688929132421, 'reg_alpha': 0.13721950877816838, 'reg_lambda': 9.423549984900843e-08, 'max_delta_step': 2.077623236730651, 'booster': 'gbtree'}. Best is trial 29 with value: 0.4944284953025469.[0m
