============================================================
rf — 运行开始  20260807_100009
  输出目录:  runs\Area_min\Area_min_rf_20260807_100009
============================================================
============================================================
RandomForest + PharmHGT-style Featurization for Area_min Prediction
============================================================
[Cache HIT] Loading features from data\features\surfpro\Area_min
  Train features: (607, 522)
  Test features:  (70, 522)

Split: Train 531, Val 76, Test 70

============================================================
Optuna Hyperparameter Tuning (50 trials, 5-Fold CV)
============================================================
[32m[I 2026-08-07 10:00:13,022][0m Trial 0 finished with value: 0.7141362808232152 and parameters: {'n_estimators': 874, 'max_depth': 29, 'min_samples_split': 37, 'min_samples_leaf': 30, 'max_features': 'sqrt', 'bootstrap': True, 'max_samples': 0.8540362888980227}. Best is trial 0 with value: 0.7141362808232152.[0m
[32m[I 2026-08-07 10:00:14,461][0m Trial 1 finished with value: 0.6419226349502472 and parameters: {'n_estimators': 237, 'max_depth': 30, 'min_samples_split': 42, 'min_samples_leaf': 11, 'max_features': None, 'bootstrap': True, 'max_samples': 0.645614570099021}. Best is trial 1 with value: 0.6419226349502472.[0m
[32m[I 2026-08-07 10:00:18,384][0m Trial 2 finished with value: 0.6698407045777945 and parameters: {'n_estimators': 1301, 'max_depth': 6, 'min_samples_split': 16, 'min_samples_leaf': 19, 'max_features': 'log2', 'bootstrap': False}. Best is trial 1 with value: 0.6419226349502472.[0m
[32m[I 2026-08-07 10:00:19,693][0m Trial 3 finished with value: 0.5792013419953929 and parameters: {'n_estimators': 283, 'max_depth': 20, 'min_samples_split': 10, 'min_samples_leaf': 4, 'max_features': 'log2', 'bootstrap': True, 'max_samples': 0.8421165132560784}. Best is trial 3 with value: 0.5792013419953929.[0m
[32m[I 2026-08-07 10:00:22,793][0m Trial 4 finished with value: 0.5644802382526422 and parameters: {'n_estimators': 992, 'max_depth': 6, 'min_samples_split': 26, 'min_samples_leaf': 2, 'max_features': 'sqrt', 'bootstrap': False}. Best is trial 4 with value: 0.5644802382526422.[0m
[32m[I 2026-08-07 10:00:24,755][0m Trial 5 pruned. [0m
[32m[I 2026-08-07 10:00:26,039][0m Trial 6 finished with value: 0.6549671124241166 and parameters: {'n_estimators': 281, 'max_depth': 12, 'min_samples_split': 21, 'min_samples_leaf': 14, 'max_features': 'sqrt', 'bootstrap': True, 'max_samples': 0.9010984903770198}. Best is trial 4 with value: 0.5644802382526422.[0m
[32m[I 2026-08-07 10:00:27,184][0m Trial 7 finished with value: 0.6251090159836924 and parameters: {'n_estimators': 334, 'max_depth': 30, 'min_samples_split': 39, 'min_samples_leaf': 10, 'max_features': 'log2', 'bootstrap': False}. Best is trial 4 with value: 0.5644802382526422.[0m
[32m[I 2026-08-07 10:00:27,864][0m Trial 8 pruned. [0m
[32m[I 2026-08-07 10:00:38,392][0m Trial 9 finished with value: 0.7068451016257098 and parameters: {'n_estimators': 1514, 'max_depth': 20, 'min_samples_split': 45, 'min_samples_leaf': 24, 'max_features': None, 'bootstrap': False}. Best is trial 4 with value: 0.5644802382526422.[0m
[32m[I 2026-08-07 10:00:44,080][0m Trial 10 finished with value: 0.6476791180999087 and parameters: {'n_estimators': 1915, 'max_depth': 3, 'min_samples_split': 27, 'min_samples_leaf': 1, 'max_features': 'sqrt', 'bootstrap': False}. Best is trial 4 with value: 0.5644802382526422.[0m
[32m[I 2026-08-07 10:00:47,145][0m Trial 11 finished with value: 0.4878062061061583 and parameters: {'n_estimators': 680, 'max_depth': 20, 'min_samples_split': 3, 'min_samples_leaf': 1, 'max_features': 'log2', 'bootstrap': True, 'max_samples': 0.7516400374040881}. Best is trial 11 with value: 0.4878062061061583.[0m
[32m[I 2026-08-07 10:00:50,573][0m Trial 12 finished with value: 0.48290188308936977 and parameters: {'n_estimators': 759, 'max_depth': 22, 'min_samples_split': 2, 'min_samples_leaf': 1, 'max_features': 'log2', 'bootstrap': True, 'max_samples': 0.7157007399204262}. Best is trial 12 with value: 0.48290188308936977.[0m
[32m[I 2026-08-07 10:00:53,582][0m Trial 13 finished with value: 0.660926403435976 and parameters: {'n_estimators': 678, 'max_depth': 22, 'min_samples_split': 2, 'min_samples_leaf': 9, 'max_features': 'log2', 'bootstrap': True, 'max_samples': 0.7201875794162571}. Best is trial 12 with value: 0.48290188308936977.[0m
[32m[I 2026-08-07 10:00:56,386][0m Trial 14 finished with value: 0.48362728923006976 and parameters: {'n_estimators': 609, 'max_depth': 25, 'min_samples_split': 2, 'min_samples_leaf': 1, 'max_features': 'log2', 'bootstrap': True, 'max_samples': 0.7409994019071536}. Best is trial 12 with value: 0.48290188308936977.[0m
[32m[I 2026-08-07 10:00:58,023][0m Trial 15 pruned. [0m
[32m[I 2026-08-07 10:01:00,580][0m Trial 16 finished with value: 0.6564249017256322 and parameters: {'n_estimators': 573, 'max_depth': 25, 'min_samples_split': 16, 'min_samples_leaf': 6, 'max_features': 'log2', 'bootstrap': True, 'max_samples': 0.5068998398220526}. Best is trial 12 with value: 0.48290188308936977.[0m
[32m[I 2026-08-07 10:01:02,157][0m Trial 17 pruned. [0m
[32m[I 2026-08-07 10:01:05,553][0m Trial 18 finished with value: 0.5666199689206264 and parameters: {'n_estimators': 514, 'max_depth': 25, 'min_samples_split': 2, 'min_samples_leaf': 8, 'max_features': None, 'bootstrap': True, 'max_samples': 0.7798079465483917}. Best is trial 12 with value: 0.48290188308936977.[0m
[32m[I 2026-08-07 10:01:07,524][0m Trial 19 pruned. [0m
[32m[I 2026-08-07 10:01:09,533][0m Trial 20 pruned. [0m
[32m[I 2026-08-07 10:01:11,966][0m Trial 21 finished with value: 0.5230042258987869 and parameters: {'n_estimators': 526, 'max_depth': 17, 'min_samples_split': 2, 'min_samples_leaf': 2, 'max_features': 'log2', 'bootstrap': True, 'max_samples': 0.7523594782378045}. Best is trial 12 with value: 0.48290188308936977.[0m
[32m[I 2026-08-07 10:01:15,567][0m Trial 22 finished with value: 0.6131848771338919 and parameters: {'n_estimators': 813, 'max_depth': 27, 'min_samples_split': 6, 'min_samples_leaf': 6, 'max_features': 'log2', 'bootstrap': True, 'max_samples': 0.7995267225160303}. Best is trial 12 with value: 0.48290188308936977.[0m
[32m[I 2026-08-07 10:01:20,101][0m Trial 23 finished with value: 0.5175456437152384 and parameters: {'n_estimators': 1034, 'max_depth': 22, 'min_samples_split': 6, 'min_samples_leaf': 1, 'max_features': 'log2', 'bootstrap': True, 'max_samples': 0.6757582228467287}. Best is trial 12 with value: 0.48290188308936977.[0m
[32m[I 2026-08-07 10:01:22,116][0m Trial 24 finished with value: 0.6250457857744339 and parameters: {'n_estimators': 444, 'max_depth': 18, 'min_samples_split': 13, 'min_samples_leaf': 6, 'max_features': 'log2', 'bootstrap': True, 'max_samples': 0.7149872794581776}. Best is trial 12 with value: 0.48290188308936977.[0m
[32m[I 2026-08-07 10:01:27,611][0m Trial 25 finished with value: 0.5207284084336244 and parameters: {'n_estimators': 731, 'max_depth': 27, 'min_samples_split': 5, 'min_samples_leaf': 5, 'max_features': None, 'bootstrap': True, 'max_samples': 0.8368709056781178}. Best is trial 12 with value: 0.48290188308936977.[0m
[32m[I 2026-08-07 10:01:31,432][0m Trial 26 pruned. [0m
[32m[I 2026-08-07 10:01:33,601][0m Trial 27 finished with value: 0.4722299603915472 and parameters: {'n_estimators': 451, 'max_depth': 23, 'min_samples_split': 2, 'min_samples_leaf': 1, 'max_features': 'log2', 'bootstrap': True, 'max_samples': 0.9074136202529426}. Best is trial 27 with value: 0.4722299603915472.[0m
[32m[I 2026-08-07 10:01:34,408][0m Trial 28 pruned. [0m
[32m[I 2026-08-07 10:01:39,875][0m Trial 29 finished with value: 0.5932263121405607 and parameters: {'n_estimators': 856, 'max_depth': 23, 'min_samples_split': 33, 'min_samples_leaf': 10, 'max_features': None, 'bootstrap': True, 'max_samples': 0.8998892026135178}. Best is trial 27 with value: 0.4722299603915472.[0m
[32m[I 2026-08-07 10:01:41,791][0m Trial 30 finished with value: 0.6432290203683023 and parameters: {'n_estimators': 418, 'max_depth': 28, 'min_samples_split': 13, 'min_samples_leaf': 5, 'max_features': 'log2', 'bootstrap': True, 'max_samples': 0.5001310561523566}. Best is trial 27 with value: 0.4722299603915472.[0m
[32m[I 2026-08-07 10:01:44,772][0m Trial 31 finished with value: 0.532543702594557 and parameters: {'n_estimators': 664, 'max_depth': 24, 'min_samples_split': 4, 'min_samples_leaf': 2, 'max_features': 'log2', 'bootstrap': True, 'max_samples': 0.6808750565360016}. Best is trial 27 with value: 0.4722299603915472.[0m
[32m[I 2026-08-07 10:01:48,075][0m Trial 32 finished with value: 0.4775954323783023 and parameters: {'n_estimators': 715, 'max_depth': 21, 'min_samples_split': 2, 'min_samples_leaf': 1, 'max_features': 'log2', 'bootstrap': True, 'max_samples': 0.8149265624063259}. Best is trial 27 with value: 0.4722299603915472.[0m
[32m[I 2026-08-07 10:01:49,102][0m Trial 33 finished with value: 0.6442437042437121 and parameters: {'n_estimators': 209, 'max_depth': 22, 'min_samples_split': 8, 'min_samples_leaf': 9, 'max_features': 'log2', 'bootstrap': True, 'max_samples': 0.8997317025229603}. Best is trial 27 with value: 0.4722299603915472.[0m
[32m[I 2026-08-07 10:01:52,969][0m Trial 34 finished with value: 0.5752235228236391 and parameters: {'n_estimators': 882, 'max_depth': 16, 'min_samples_split': 5, 'min_samples_leaf': 4, 'max_features': 'log2', 'bootstrap': True, 'max_samples': 0.8092443217074275}. Best is trial 27 with value: 0.4722299603915472.[0m
[32m[I 2026-08-07 10:01:55,839][0m Trial 35 pruned. [0m
[32m[I 2026-08-07 10:01:57,752][0m Trial 36 finished with value: 0.5170027422012894 and parameters: {'n_estimators': 575, 'max_depth': 26, 'min_samples_split': 10, 'min_samples_leaf': 4, 'max_features': 'log2', 'bootstrap': False}. Best is trial 27 with value: 0.4722299603915472.[0m
[32m[I 2026-08-07 10:02:00,421][0m Trial 37 pruned. [0m
[32m[I 2026-08-07 10:02:04,573][0m Trial 38 finished with value: 0.6067454398331679 and parameters: {'n_estimators': 943, 'max_depth': 19, 'min_samples_split': 18, 'min_samples_leaf': 7, 'max_features': 'sqrt', 'bootstrap': True, 'max_samples': 0.8193009560425797}. Best is trial 27 with value: 0.4722299603915472.[0m
[32m[I 2026-08-07 10:02:05,912][0m Trial 39 finished with value: 0.5120608905767383 and parameters: {'n_estimators': 390, 'max_depth': 14, 'min_samples_split': 12, 'min_samples_leaf': 3, 'max_features': 'log2', 'bootstrap': False}. Best is trial 27 with value: 0.4722299603915472.[0m
[32m[I 2026-08-07 10:02:07,263][0m Trial 40 pruned. [0m
[32m[I 2026-08-07 10:02:10,438][0m Trial 41 finished with value: 0.5210323381567812 and parameters: {'n_estimators': 710, 'max_depth': 21, 'min_samples_split': 4, 'min_samples_leaf': 2, 'max_features': 'log2', 'bootstrap': True, 'max_samples': 0.7569699454062044}. Best is trial 27 with value: 0.4722299603915472.[0m
[32m[I 2026-08-07 10:02:13,304][0m Trial 42 finished with value: 0.48443206970298175 and parameters: {'n_estimators': 610, 'max_depth': 24, 'min_samples_split': 2, 'min_samples_leaf': 1, 'max_features': 'log2', 'bootstrap': True, 'max_samples': 0.7396036725164276}. Best is trial 27 with value: 0.4722299603915472.[0m
[32m[I 2026-08-07 10:02:16,062][0m Trial 43 finished with value: 0.48558001168770415 and parameters: {'n_estimators': 596, 'max_depth': 24, 'min_samples_split': 2, 'min_samples_leaf': 1, 'max_features': 'log2', 'bootstrap': True, 'max_samples': 0.6946915760137313}. Best is trial 27 with value: 0.4722299603915472.[0m
[32m[I 2026-08-07 10:02:17,117][0m Trial 44 finished with value: 0.5680706865515895 and parameters: {'n_estimators': 307, 'max_depth': 23, 'min_samples_split': 7, 'min_samples_leaf': 8, 'max_features': 'log2', 'bootstrap': False}. Best is trial 27 with value: 0.4722299603915472.[0m
[32m[I 2026-08-07 10:02:18,849][0m Trial 45 finished with value: 0.5954216786713867 and parameters: {'n_estimators': 373, 'max_depth': 30, 'min_samples_split': 4, 'min_samples_leaf': 4, 'max_features': 'log2', 'bootstrap': True, 'max_samples': 0.6289279473644842}. Best is trial 27 with value: 0.4722299603915472.[0m
[32m[I 2026-08-07 10:02:22,492][0m Trial 46 finished with value: 0.5839342063924954 and parameters: {'n_estimators': 829, 'max_depth': 24, 'min_samples_split': 9, 'min_samples_leaf': 4, 'max_features': 'log2', 'bootstrap': True, 'max_samples': 0.7369878127468459}. Best is trial 27 with value: 0.4722299603915472.[0m
[32m[I 2026-08-07 10:02:25,297][0m Trial 47 finished with value: 0.5996850158034815 and parameters: {'n_estimators': 626, 'max_depth': 26, 'min_samples_split': 4, 'min_samples_leaf': 7, 'max_features': 'sqrt', 'bootstrap': True, 'max_samples': 0.8001464081820545}. Best is trial 27 with value: 0.4722299603915472.[0m
[32m[I 2026-08-07 10:02:31,264][0m Trial 48 finished with value: 0.45759695947688617 and parameters: {'n_estimators': 1827, 'max_depth': 21, 'min_samples_split': 7, 'min_samples_leaf': 1, 'max_features': 'log2', 'bootstrap': False}. Best is trial 48 with value: 0.45759695947688617.[0m
[32m[I 2026-08-07 10:02:36,860][0m Trial 49 finished with value: 0.5977141593556604 and parameters: {'n_estimators': 1817, 'max_depth': 19, 'min_samples_split': 7, 'min_samples_leaf': 10, 'max_features': 'log2', 'bootstrap': False}. Best is trial 48 with value: 0.45759695947688617.[0m

=== Best Trial ===
  CV RMSE: 0.457597
  Params:  {'n_estimators': 1827, 'max_depth': 21, 'min_samples_split': 7, 'min_samples_leaf': 1, 'max_features': 'log2', 'bootstrap': False}

============================================================
Training Final Model with Best Hyperparameters
============================================================

============================================================
Test Evaluation
============================================================
  Test MSE:  0.2682
  Test RMSE: 0.5179
  Test MAE:  0.3115
  Test R²:   0.5884

============================================================
Top 20 Feature Importances
============================================================
   1. atom_mean_48               0.0
   2. atom_std_26                0.0
   3. atom_mean_38               0.0
   4. maccs_101                  0.0
   5. maccs_105                  0.0
   6. atom_mean_54               0.0
   7. atom_mean_26               0.0
   8. atom_std_48                0.0
   9. atom_std_38                0.0
  10. NumRings                   0.0
  11. MolWt                      0.0
  12. brics_10                   0.0
  13. atom_std_35                0.0
  14. atom_mean_20               0.0
  15. atom_mean_47               0.0
  16. atom_std_20                0.0
  17. LogP                       0.0
  18. tail_ratio                 0.0
  19. atom_std_47                0.0
  20. head_ratio                 0.0

Plot saved to runs\Area_min\Area_min_rf_20260807_100009\pred_vs_true.png
Model saved to runs\Area_min\Area_min_rf_20260807_100009\model.pkl

============================================================
SUMMARY — RandomForest + PharmHGT Features
============================================================
  Features:  522-dim (atom_agg + bond_agg + MACCS + BRICS + surfactant + descriptors)
  Train:     607 (split 531 train + 76 val)
  Test:      70
  Optuna:    50 trials, 5-fold CV
  Best CV RMSE: 0.4576
  Test RMSE: 0.5179
  Test MAE:  0.3115
  Test R²:   0.5884

指标已保存: runs\Area_min\Area_min_rf_20260807_100009\metrics.json
索引已更新: runs\Area_min\_runs_index.csv
索引已更新: runs\_runs_index.csv
