[32m[I 2026-08-06 15:14:21,397][0m Trial 58 finished with value: 0.6438271361369922 and parameters: {'n_estimators': 1065, 'max_depth': 6, 'learning_rate': 0.011558315207791672, 'subsample': 0.633010282828247, 'colsample_bytree': 0.3217318500502983, 'colsample_bylevel': 0.45826794240583746, 'colsample_bynode': 0.9097388454382436, 'min_child_weight': 1.0683519704912825, 'gamma': 0.2223841115697756, 'reg_alpha': 8.392828002076488e-06, 'reg_lambda': 4.898402681744658e-07, 'max_delta_step': 1.7523388034633924, 'booster': 'dart'}. Best is trial 47 with value: 0.6220440534441585.[0m
[32m[I 2026-08-06 15:14:25,844][0m Trial 59 finished with value: 0.6443090659256073 and parameters: {'n_estimators': 2464, 'max_depth': 4, 'learning_rate': 0.031413209377962215, 'subsample': 0.6314369265469533, 'colsample_bytree': 0.4103738709856329, 'colsample_bylevel': 0.6135707107093683, 'colsample_bynode': 0.9305120088121079, 'min_child_weight': 8.236096021457929, 'gamma': 0.13572571273234482, 'reg_alpha': 3.052563887132925e-08, 'reg_lambda': 0.005830701332380456, 'max_delta_step': 4.693089628104046, 'booster': 'gbtree'}. Best is trial 47 with value: 0.6220440534441585.[0m
[32m[I 2026-08-06 15:14:29,338][0m Trial 60 finished with value: 0.6248833953883063 and parameters: {'n_estimators': 1959, 'max_depth': 5, 'learning_rate': 0.030306748164217703, 'subsample': 0.702288232192788, 'colsample_bytree': 0.7254266143313659, 'colsample_bylevel': 0.3441845319702622, 'colsample_bynode': 0.9928219610217002, 'min_child_weight': 1.6100955518785272, 'gamma': 0.08551041107342727, 'reg_alpha': 2.342719841532409e-05, 'reg_lambda': 7.516416007305236e-06, 'max_delta_step': 6.10998100264136, 'booster': 'gbtree'}. Best is trial 47 with value: 0.6220440534441585.[0m
[32m[I 2026-08-06 15:14:32,944][0m Trial 61 finished with value: 0.6336627354632348 and parameters: {'n_estimators': 1867, 'max_depth': 5, 'learning_rate': 0.035136386963973365, 'subsample': 0.6961454757469244, 'colsample_bytree': 0.610370143789527, 'colsample_bylevel': 0.3852382296411858, 'colsample_bynode': 0.9263313275309946, 'min_child_weight': 1.3291075762678903, 'gamma': 0.1326957222991426, 'reg_alpha': 3.499684244724964e-05, 'reg_lambda': 0.0008615053798310587, 'max_delta_step': 6.313064284090294, 'booster': 'gbtree'}. Best is trial 47 with value: 0.6220440534441585.[0m
[32m[I 2026-08-06 15:14:33,726][0m Trial 62 pruned. [0m
[32m[I 2026-08-06 15:14:41,594][0m Trial 63 finished with value: 0.6357121031636926 and parameters: {'n_estimators': 1383, 'max_depth': 4, 'learning_rate': 0.013421178080620606, 'subsample': 0.6223976442548577, 'colsample_bytree': 0.42165906459114233, 'colsample_bylevel': 0.675313238838898, 'colsample_bynode': 0.8476818391835435, 'min_child_weight': 3.677775567881497, 'gamma': 0.20602932106332675, 'reg_alpha': 0.003174108447663465, 'reg_lambda': 0.00013638849472767255, 'max_delta_step': 5.49345715458983, 'booster': 'gbtree'}. Best is trial 47 with value: 0.6220440534441585.[0m
[32m[I 2026-08-06 15:14:46,250][0m Trial 64 finished with value: 0.6328256146326585 and parameters: {'n_estimators': 2784, 'max_depth': 4, 'learning_rate': 0.03085509762720349, 'subsample': 0.7990642787432332, 'colsample_bytree': 0.8117243622404747, 'colsample_bylevel': 0.3573946364892479, 'colsample_bynode': 0.7929966761280605, 'min_child_weight': 2.358347938029115, 'gamma': 0.04737665632930457, 'reg_alpha': 6.303087850171357e-05, 'reg_lambda': 2.850034405384017e-07, 'max_delta_step': 6.8867602724234604, 'booster': 'gbtree'}. Best is trial 47 with value: 0.6220440534441585.[0m
[32m[I 2026-08-06 15:14:47,424][0m Trial 65 pruned. [0m
[32m[I 2026-08-06 15:14:48,708][0m Trial 66 pruned. [0m
[32m[I 2026-08-06 15:14:54,831][0m Trial 67 finished with value: 0.6437880383812862 and parameters: {'n_estimators': 1386, 'max_depth': 4, 'learning_rate': 0.01570530194409419, 'subsample': 0.8461639160772413, 'colsample_bytree': 0.32872046887327283, 'colsample_bylevel': 0.33068726855057795, 'colsample_bynode': 0.9879373187842673, 'min_child_weight': 1.8014788304012717, 'gamma': 0.11555276650635934, 'reg_alpha': 1.728473156243034e-08, 'reg_lambda': 9.993621801829419e-08, 'max_delta_step': 4.807453787506056, 'booster': 'dart'}. Best is trial 47 with value: 0.6220440534441585.[0m
[32m[I 2026-08-06 15:14:59,986][0m Trial 68 finished with value: 0.6242399639570964 and parameters: {'n_estimators': 1703, 'max_depth': 5, 'learning_rate': 0.020616441138016695, 'subsample': 0.6017829206157135, 'colsample_bytree': 0.33395700812612467, 'colsample_bylevel': 0.492370283751296, 'colsample_bynode': 0.9042641229232707, 'min_child_weight': 1.9984479726989197, 'gamma': 0.08539688995555296, 'reg_alpha': 6.86324097468416e-07, 'reg_lambda': 7.450450133393805e-07, 'max_delta_step': 4.211715194277928, 'booster': 'gbtree'}. Best is trial 47 with value: 0.6220440534441585.[0m
[32m[I 2026-08-06 15:15:01,351][0m Trial 69 pruned. [0m
[32m[I 2026-08-06 15:15:04,055][0m Trial 70 finished with value: 0.6496786294270724 and parameters: {'n_estimators': 1627, 'max_depth': 5, 'learning_rate': 0.05061128904902762, 'subsample': 0.6080209132977478, 'colsample_bytree': 0.32191155977374997, 'colsample_bylevel': 0.4842317632098017, 'colsample_bynode': 0.9414743455777297, 'min_child_weight': 1.52625138316646, 'gamma': 0.5459509931220524, 'reg_alpha': 4.0424475790108685e-05, 'reg_lambda': 1.887718481229365e-06, 'max_delta_step': 1.6284956943322326, 'booster': 'gbtree'}. Best is trial 47 with value: 0.6220440534441585.[0m
[32m[I 2026-08-06 15:15:07,900][0m Trial 71 finished with value: 0.6272815379186327 and parameters: {'n_estimators': 2751, 'max_depth': 6, 'learning_rate': 0.040084664959238236, 'subsample': 0.6756958626856384, 'colsample_bytree': 0.6645595520176932, 'colsample_bylevel': 0.4163669972145057, 'colsample_bynode': 0.9457358282348018, 'min_child_weight': 1.5692474921133768, 'gamma': 0.015742148456688865, 'reg_alpha': 5.367460244273672e-07, 'reg_lambda': 1.647387061284276e-06, 'max_delta_step': 5.203659260491808, 'booster': 'gbtree'}. Best is trial 47 with value: 0.6220440534441585.[0m
[32m[I 2026-08-06 15:15:13,875][0m Trial 72 finished with value: 0.6192449534188588 and parameters: {'n_estimators': 2834, 'max_depth': 4, 'learning_rate': 0.019198298586250093, 'subsample': 0.7183376547870615, 'colsample_bytree': 0.5391612042454658, 'colsample_bylevel': 0.4179131077052903, 'colsample_bynode': 0.6627887683296392, 'min_child_weight': 1.9913581988897235, 'gamma': 0.06904067011441789, 'reg_alpha': 4.795456520051569e-08, 'reg_lambda': 2.193158844629758e-05, 'max_delta_step': 3.753632538540201, 'booster': 'gbtree'}. Best is trial 72 with value: 0.6192449534188588.[0m
[32m[I 2026-08-06 15:15:15,293][0m Trial 73 pruned. [0m
[32m[I 2026-08-06 15:15:18,985][0m Trial 74 pruned. [0m
[32m[I 2026-08-06 15:15:24,568][0m Trial 75 finished with value: 0.6447979150220269 and parameters: {'n_estimators': 2048, 'max_depth': 7, 'learning_rate': 0.02115458653944392, 'subsample': 0.6048680206209291, 'colsample_bytree': 0.44109112507446524, 'colsample_bylevel': 0.600618605598002, 'colsample_bynode': 0.9156606724766334, 'min_child_weight': 2.045900749703801, 'gamma': 0.22660528964553672, 'reg_alpha': 2.9656608175249383e-08, 'reg_lambda': 9.013199611389058e-07, 'max_delta_step': 6.772525118085964, 'booster': 'gbtree'}. Best is trial 72 with value: 0.6192449534188588.[0m
[32m[I 2026-08-06 15:15:25,545][0m Trial 76 pruned. [0m
[32m[I 2026-08-06 15:15:28,635][0m Trial 77 finished with value: 0.6297012694177575 and parameters: {'n_estimators': 2720, 'max_depth': 6, 'learning_rate': 0.0516329989204952, 'subsample': 0.6727278486162346, 'colsample_bytree': 0.5753325603772447, 'colsample_bylevel': 0.310394291270006, 'colsample_bynode': 0.9991039413316898, 'min_child_weight': 1.042365649545897, 'gamma': 0.05453359877812769, 'reg_alpha': 4.606805251550798e-08, 'reg_lambda': 3.9627108939171935e-07, 'max_delta_step': 3.9732427146935168, 'booster': 'gbtree'}. Best is trial 72 with value: 0.6192449534188588.[0m
[32m[I 2026-08-06 15:15:34,669][0m Trial 78 finished with value: 0.6358821962979389 and parameters: {'n_estimators': 2815, 'max_depth': 5, 'learning_rate': 0.016007559875542088, 'subsample': 0.7393231359563935, 'colsample_bytree': 0.35718878184260167, 'colsample_bylevel': 0.6718072656563857, 'colsample_bynode': 0.6062040688075294, 'min_child_weight': 2.4335732739743783, 'gamma': 0.20955454018006606, 'reg_alpha': 2.3688756494653023e-08, 'reg_lambda': 2.5435429106999783e-05, 'max_delta_step': 4.883142258709757, 'booster': 'gbtree'}. Best is trial 72 with value: 0.6192449534188588.[0m
[32m[I 2026-08-06 15:15:39,099][0m Trial 79 finished with value: 0.633335306319384 and parameters: {'n_estimators': 2882, 'max_depth': 6, 'learning_rate': 0.031214536167938078, 'subsample': 0.7019996192231468, 'colsample_bytree': 0.5019470545542501, 'colsample_bylevel': 0.5900825051184402, 'colsample_bynode': 0.8036517645793687, 'min_child_weight': 1.6882286566955256, 'gamma': 0.05964006866821356, 'reg_alpha': 5.954148944364959e-05, 'reg_lambda': 0.0003621947967327199, 'max_delta_step': 3.9025992018014923, 'booster': 'gbtree'}. Best is trial 72 with value: 0.6192449534188588.[0m
[32m[I 2026-08-06 15:15:42,036][0m Trial 80 finished with value: 0.6342880798682398 and parameters: {'n_estimators': 2473, 'max_depth': 5, 'learning_rate': 0.03507831556456517, 'subsample': 0.6240889183995578, 'colsample_bytree': 0.5315417947291585, 'colsample_bylevel': 0.391644065264055, 'colsample_bynode': 0.47644315903810075, 'min_child_weight': 3.465744172551304, 'gamma': 0.23871287536196278, 'reg_alpha': 0.00011770091647674286, 'reg_lambda': 1.5573156851699334e-06, 'max_delta_step': 4.57305883288204, 'booster': 'gbtree'}. Best is trial 72 with value: 0.6192449534188588.[0m
[32m[I 2026-08-06 15:15:44,533][0m Trial 81 finished with value: 0.6334230519628125 and parameters: {'n_estimators': 2617, 'max_depth': 6, 'learning_rate': 0.06627871836862047, 'subsample': 0.812365689393091, 'colsample_bytree': 0.5696794798740644, 'colsample_bylevel': 0.3519714027885544, 'colsample_bynode': 0.7969517120883174, 'min_child_weight': 1.4882476259630244, 'gamma': 0.1540653884463793, 'reg_alpha': 6.546070664011652e-08, 'reg_lambda': 5.434250567148981e-08, 'max_delta_step': 3.640686298084636, 'booster': 'gbtree'}. Best is trial 72 with value: 0.6192449534188588.[0m
[32m[I 2026-08-06 15:15:46,678][0m Trial 82 finished with value: 0.6633029405077211 and parameters: {'n_estimators': 2647, 'max_depth': 10, 'learning_rate': 0.05807344537139717, 'subsample': 0.6418040528122082, 'colsample_bytree': 0.6308430410871098, 'colsample_bylevel': 0.3734034769047541, 'colsample_bynode': 0.8806820760475593, 'min_child_weight': 1.7125574272550066, 'gamma': 0.32832812612231954, 'reg_alpha': 2.33612054704108e-07, 'reg_lambda': 3.2997376165207864e-06, 'max_delta_step': 3.8555563980773173, 'booster': 'dart'}. Best is trial 72 with value: 0.6192449534188588.[0m
[32m[I 2026-08-06 15:15:51,293][0m Trial 83 finished with value: 0.6322362962945112 and parameters: {'n_estimators': 1973, 'max_depth': 8, 'learning_rate': 0.030049068475395083, 'subsample': 0.6006767265405761, 'colsample_bytree': 0.9028792511209283, 'colsample_bylevel': 0.402571523440515, 'colsample_bynode': 0.983016050693383, 'min_child_weight': 2.2734685907416368, 'gamma': 0.09173141617616358, 'reg_alpha': 0.0020970231338028732, 'reg_lambda': 2.3756744590469034e-06, 'max_delta_step': 6.902095717574978, 'booster': 'gbtree'}. Best is trial 72 with value: 0.6192449534188588.[0m
[32m[I 2026-08-06 15:15:52,378][0m Trial 84 pruned. [0m
[32m[I 2026-08-06 15:15:53,913][0m Trial 85 pruned. [0m
[32m[I 2026-08-06 15:15:59,244][0m Trial 86 finished with value: 0.6338409468311064 and parameters: {'n_estimators': 2332, 'max_depth': 5, 'learning_rate': 0.016466304254120864, 'subsample': 0.6415753182174831, 'colsample_bytree': 0.3267662269761843, 'colsample_bylevel': 0.5934655552676802, 'colsample_bynode': 0.8635896092657003, 'min_child_weight': 1.4364553846427945, 'gamma': 0.15721664668296756, 'reg_alpha': 6.041548804623785e-08, 'reg_lambda': 5.863545369481356e-06, 'max_delta_step': 2.345969691680038, 'booster': 'gbtree'}. Best is trial 72 with value: 0.6192449534188588.[0m
[32m[I 2026-08-06 15:16:07,933][0m Trial 87 finished with value: 0.6193639814886731 and parameters: {'n_estimators': 2275, 'max_depth': 4, 'learning_rate': 0.0157037282108265, 'subsample': 0.7108813127256923, 'colsample_bytree': 0.8036531395812572, 'colsample_bylevel': 0.4300011530300987, 'colsample_bynode': 0.9811964956460643, 'min_child_weight': 1.2126559422254195, 'gamma': 0.03376916357033167, 'reg_alpha': 8.419973621884678e-07, 'reg_lambda': 4.5101009341842833e-07, 'max_delta_step': 5.439592180898993, 'booster': 'gbtree'}. Best is trial 72 with value: 0.6192449534188588.[0m
[32m[I 2026-08-06 15:16:17,295][0m Trial 88 finished with value: 0.6248274899812102 and parameters: {'n_estimators': 1881, 'max_depth': 5, 'learning_rate': 0.011183376562158266, 'subsample': 0.6686063641865257, 'colsample_bytree': 0.7396925733801771, 'colsample_bylevel': 0.44604926252829363, 'colsample_bynode': 0.9422692485782217, 'min_child_weight': 1.3699811546776082, 'gamma': 0.09331620855690197, 'reg_alpha': 1.7148427627148932e-06, 'reg_lambda': 4.759751755546924e-08, 'max_delta_step': 5.9756678970809105, 'booster': 'gbtree'}. Best is trial 72 with value: 0.6192449534188588.[0m
[32m[I 2026-08-06 15:16:24,211][0m Trial 89 finished with value: 0.6447118564400043 and parameters: {'n_estimators': 1812, 'max_depth': 5, 'learning_rate': 0.012813862339195577, 'subsample': 0.6982321806806205, 'colsample_bytree': 0.6443385145735847, 'colsample_bylevel': 0.31967642680021924, 'colsample_bynode': 0.9889826819535643, 'min_child_weight': 1.583227276081412, 'gamma': 0.38186801819343974, 'reg_alpha': 6.896507063811891e-08, 'reg_lambda': 6.430050325216687e-08, 'max_delta_step': 5.731432458888199, 'booster': 'gbtree'}. Best is trial 72 with value: 0.6192449534188588.[0m
[32m[I 2026-08-06 15:16:29,815][0m Trial 90 finished with value: 0.6222252953984682 and parameters: {'n_estimators': 2652, 'max_depth': 4, 'learning_rate': 0.02343512676326415, 'subsample': 0.6511152774337289, 'colsample_bytree': 0.47698675437137483, 'colsample_bylevel': 0.31388270332665014, 'colsample_bynode': 0.7261985073910228, 'min_child_weight': 1.62091412930334, 'gamma': 0.06779857063725832, 'reg_alpha': 3.386168385860661e-07, 'reg_lambda': 0.0026089634726331567, 'max_delta_step': 1.755588276068738, 'booster': 'gbtree'}. Best is trial 72 with value: 0.6192449534188588.[0m
[32m[I 2026-08-06 15:16:35,673][0m Trial 91 finished with value: 0.6499003186689625 and parameters: {'n_estimators': 1609, 'max_depth': 8, 'learning_rate': 0.01772134933917943, 'subsample': 0.6048665579221455, 'colsample_bytree': 0.3268798315673799, 'colsample_bylevel': 0.8460673636966569, 'colsample_bynode': 0.7346917666513749, 'min_child_weight': 1.2281890739415031, 'gamma': 0.3689867567013898, 'reg_alpha': 9.190751401660378e-05, 'reg_lambda': 1.3548986974727328e-07, 'max_delta_step': 4.048859942249012, 'booster': 'dart'}. Best is trial 72 with value: 0.6192449534188588.[0m
[32m[I 2026-08-06 15:16:40,738][0m Trial 92 finished with value: 0.6281200032012564 and parameters: {'n_estimators': 1828, 'max_depth': 5, 'learning_rate': 0.020047537011021827, 'subsample': 0.6919942175685306, 'colsample_bytree': 0.5304799850274294, 'colsample_bylevel': 0.3611449953279288, 'colsample_bynode': 0.6857229274290387, 'min_child_weight': 2.6034942340305385, 'gamma': 0.16549589588443442, 'reg_alpha': 5.781919553718521e-05, 'reg_lambda': 0.015223840789107466, 'max_delta_step': 2.0876942038631654, 'booster': 'gbtree'}. Best is trial 72 with value: 0.6192449534188588.[0m
[32m[I 2026-08-06 15:16:41,588][0m Trial 93 pruned. [0m
[32m[I 2026-08-06 15:16:45,429][0m Trial 94 finished with value: 0.6419505843381919 and parameters: {'n_estimators': 2031, 'max_depth': 5, 'learning_rate': 0.02783621593665207, 'subsample': 0.6275955122682698, 'colsample_bytree': 0.4901401139508929, 'colsample_bylevel': 0.472988572886204, 'colsample_bynode': 0.7512200699164612, 'min_child_weight': 1.1388858540796003, 'gamma': 0.32635438198387956, 'reg_alpha': 8.704028164315039e-08, 'reg_lambda': 0.0031644608172119457, 'max_delta_step': 1.0806753928934374, 'booster': 'gbtree'}. Best is trial 72 with value: 0.6192449534188588.[0m
[32m[I 2026-08-06 15:16:54,982][0m Trial 95 finished with value: 0.6302347910748123 and parameters: {'n_estimators': 1474, 'max_depth': 6, 'learning_rate': 0.010990082711540252, 'subsample': 0.7462534556183207, 'colsample_bytree': 0.943898638616401, 'colsample_bylevel': 0.5582119522421699, 'colsample_bynode': 0.8613685893568898, 'min_child_weight': 3.187854063779621, 'gamma': 0.11367899845502549, 'reg_alpha': 2.3933493442563503e-08, 'reg_lambda': 9.581087941094635e-08, 'max_delta_step': 6.050968725734429, 'booster': 'gbtree'}. Best is trial 72 with value: 0.6192449534188588.[0m
[32m[I 2026-08-06 15:16:59,188][0m Trial 96 finished with value: 0.6554128342731181 and parameters: {'n_estimators': 1955, 'max_depth': 5, 'learning_rate': 0.021340498330615253, 'subsample': 0.6261373940978693, 'colsample_bytree': 0.6568947687565682, 'colsample_bylevel': 0.47159634487442753, 'colsample_bynode': 0.9924323440831595, 'min_child_weight': 1.1524239966278502, 'gamma': 0.2681454226724561, 'reg_alpha': 0.00011272049303094633, 'reg_lambda': 3.865691969619325e-08, 'max_delta_step': 5.3398301859620725, 'booster': 'gbtree'}. Best is trial 72 with value: 0.6192449534188588.[0m
[32m[I 2026-08-06 15:17:03,555][0m Trial 97 finished with value: 0.6335302616369697 and parameters: {'n_estimators': 2745, 'max_depth': 5, 'learning_rate': 0.02294346458364147, 'subsample': 0.7794484431587836, 'colsample_bytree': 0.5363515330902653, 'colsample_bylevel': 0.32048938978921776, 'colsample_bynode': 0.9727345497992599, 'min_child_weight': 2.2509790898681383, 'gamma': 0.1322486112014151, 'reg_alpha': 6.637858212260877e-06, 'reg_lambda': 0.0023632280702331394, 'max_delta_step': 1.4132489557093113, 'booster': 'gbtree'}. Best is trial 72 with value: 0.6192449534188588.[0m
[32m[I 2026-08-06 15:17:10,728][0m Trial 98 finished with value: 0.6306362289571241 and parameters: {'n_estimators': 2581, 'max_depth': 4, 'learning_rate': 0.012859941485456204, 'subsample': 0.6952307708491785, 'colsample_bytree': 0.6580202494665164, 'colsample_bylevel': 0.4138965049964115, 'colsample_bynode': 0.856526054467397, 'min_child_weight': 2.1099094010714046, 'gamma': 0.1511785868641469, 'reg_alpha': 1.7149462681526626e-07, 'reg_lambda': 0.0007786460238354122, 'max_delta_step': 5.543406387440944, 'booster': 'gbtree'}. Best is trial 72 with value: 0.6192449534188588.[0m
[32m[I 2026-08-06 15:17:17,983][0m Trial 99 finished with value: 0.6269044838443035 and parameters: {'n_estimators': 2438, 'max_depth': 4, 'learning_rate': 0.026290638420963915, 'subsample': 0.7618752105264133, 'colsample_bytree': 0.5050435559038638, 'colsample_bylevel': 0.3898635968967744, 'colsample_bynode': 0.6525320919745798, 'min_child_weight': 4.738624121638926, 'gamma': 0.02090335686961181, 'reg_alpha': 3.021957234496507e-08, 'reg_lambda': 0.00010103013222621522, 'max_delta_step': 4.682492352097178, 'booster': 'gbtree'}. Best is trial 72 with value: 0.6192449534188588.[0m
[32m[I 2026-08-06 15:17:19,283][0m Trial 100 pruned. [0m
[32m[I 2026-08-06 15:17:26,799][0m Trial 101 finished with value: 0.6274677161849447 and parameters: {'n_estimators': 2709, 'max_depth': 4, 'learning_rate': 0.02208242577601817, 'subsample': 0.6939135411458798, 'colsample_bytree': 0.41364813337096007, 'colsample_bylevel': 0.40940652665478816, 'colsample_bynode': 0.5612896632973674, 'min_child_weight': 2.6031230784253605, 'gamma': 0.03368620897522665, 'reg_alpha': 6.620941358814372e-06, 'reg_lambda': 0.013005491978140207, 'max_delta_step': 0.46681769801359674, 'booster': 'gbtree'}. Best is trial 72 with value: 0.6192449534188588.[0m
[32m[I 2026-08-06 15:17:29,104][0m Trial 102 pruned. [0m
[32m[I 2026-08-06 15:17:31,820][0m Trial 103 pruned. [0m
[32m[I 2026-08-06 15:17:32,821][0m Trial 104 pruned. [0m
[32m[I 2026-08-06 15:17:38,498][0m Trial 105 finished with value: 0.6455937060739266 and parameters: {'n_estimators': 1447, 'max_depth': 5, 'learning_rate': 0.015238003253321244, 'subsample': 0.7102931196432073, 'colsample_bytree': 0.6367670873173561, 'colsample_bylevel': 0.4383968004191565, 'colsample_bynode': 0.976172777501908, 'min_child_weight': 1.2052410777286935, 'gamma': 0.351690769398286, 'reg_alpha': 5.447464254590926e-05, 'reg_lambda': 6.467515378589882e-05, 'max_delta_step': 3.9718107609860644, 'booster': 'dart'}. Best is trial 72 with value: 0.6192449534188588.[0m
[32m[I 2026-08-06 15:17:41,401][0m Trial 106 pruned. [0m
[32m[I 2026-08-06 15:17:45,477][0m Trial 107 finished with value: 0.6393496366340468 and parameters: {'n_estimators': 2805, 'max_depth': 5, 'learning_rate': 0.022659918423152466, 'subsample': 0.6606138475576621, 'colsample_bytree': 0.5695061746539689, 'colsample_bylevel': 0.41984866152304207, 'colsample_bynode': 0.5263553627866566, 'min_child_weight': 1.757498997103559, 'gamma': 0.20508600009401567, 'reg_alpha': 1.4099843123979475e-08, 'reg_lambda': 0.02002501680790135, 'max_delta_step': 2.9446950003511407, 'booster': 'gbtree'}. Best is trial 72 with value: 0.6192449534188588.[0m
[32m[I 2026-08-06 15:17:48,428][0m Trial 108 pruned. [0m
