[32m[I 2026-08-06 15:17:51,510][0m Trial 109 finished with value: 0.6451113462482195 and parameters: {'n_estimators': 1995, 'max_depth': 7, 'learning_rate': 0.041093607722702714, 'subsample': 0.6835036393467078, 'colsample_bytree': 0.3335984613055219, 'colsample_bylevel': 0.8506602629000006, 'colsample_bynode': 0.3604462383456788, 'min_child_weight': 6.903499357317497, 'gamma': 0.17202571990404136, 'reg_alpha': 1.7493662533764965e-05, 'reg_lambda': 7.237061712127117e-06, 'max_delta_step': 1.3902393628638532, 'booster': 'dart'}. Best is trial 72 with value: 0.6192449534188588.[0m
[32m[I 2026-08-06 15:17:53,147][0m Trial 110 pruned. [0m
[32m[I 2026-08-06 15:17:57,538][0m Trial 111 finished with value: 0.6298119724251735 and parameters: {'n_estimators': 2357, 'max_depth': 5, 'learning_rate': 0.020678256949360974, 'subsample': 0.7918147498925022, 'colsample_bytree': 0.3037175055668207, 'colsample_bylevel': 0.48742407489408984, 'colsample_bynode': 0.4590619495342572, 'min_child_weight': 1.603282353215907, 'gamma': 0.06982657116257225, 'reg_alpha': 1.8203536413762992e-05, 'reg_lambda': 0.007531642471162639, 'max_delta_step': 2.6086309141404227, 'booster': 'gbtree'}. Best is trial 72 with value: 0.6192449534188588.[0m
[32m[I 2026-08-06 15:17:59,738][0m Trial 112 pruned. [0m
[32m[I 2026-08-06 15:18:01,924][0m Trial 113 pruned. [0m
[32m[I 2026-08-06 15:18:06,961][0m Trial 114 finished with value: 0.6253028129820715 and parameters: {'n_estimators': 2942, 'max_depth': 5, 'learning_rate': 0.02001133406743577, 'subsample': 0.7303687006182982, 'colsample_bytree': 0.38752066599023205, 'colsample_bylevel': 0.43295179335451983, 'colsample_bynode': 0.6321038032535885, 'min_child_weight': 2.6246423653266584, 'gamma': 0.09838407654090753, 'reg_alpha': 1.0434161703196202e-07, 'reg_lambda': 3.9038563584421754e-05, 'max_delta_step': 1.9576472644282312, 'booster': 'gbtree'}. Best is trial 72 with value: 0.6192449534188588.[0m
[32m[I 2026-08-06 15:18:13,919][0m Trial 115 finished with value: 0.6402104737775635 and parameters: {'n_estimators': 2804, 'max_depth': 4, 'learning_rate': 0.013288300874777665, 'subsample': 0.653882809563999, 'colsample_bytree': 0.5224859225557358, 'colsample_bylevel': 0.3071581501513647, 'colsample_bynode': 0.7231963518410494, 'min_child_weight': 1.1695120219036828, 'gamma': 0.23251529471253662, 'reg_alpha': 6.877162232958181e-07, 'reg_lambda': 0.00803164714645568, 'max_delta_step': 1.454733380561154, 'booster': 'gbtree'}. Best is trial 72 with value: 0.6192449534188588.[0m
[32m[I 2026-08-06 15:18:21,331][0m Trial 116 finished with value: 0.6349542594727998 and parameters: {'n_estimators': 2681, 'max_depth': 4, 'learning_rate': 0.013975142079104339, 'subsample': 0.6830188687153212, 'colsample_bytree': 0.597885610948296, 'colsample_bylevel': 0.35081181116548527, 'colsample_bynode': 0.5605305993491131, 'min_child_weight': 5.544088479576278, 'gamma': 0.13700260699699573, 'reg_alpha': 1.2666177513206667e-08, 'reg_lambda': 2.7440176755391083e-06, 'max_delta_step': 6.453326924106097, 'booster': 'gbtree'}. Best is trial 72 with value: 0.6192449534188588.[0m
[32m[I 2026-08-06 15:18:26,781][0m Trial 117 finished with value: 0.6325074653696201 and parameters: {'n_estimators': 2926, 'max_depth': 6, 'learning_rate': 0.0252193281816517, 'subsample': 0.7482305452587782, 'colsample_bytree': 0.35809558681584003, 'colsample_bylevel': 0.4064418828336254, 'colsample_bynode': 0.6391056849577338, 'min_child_weight': 4.8617610129925, 'gamma': 0.03989376072062407, 'reg_alpha': 2.8277239552765856e-08, 'reg_lambda': 0.00024965768743786333, 'max_delta_step': 2.140286809560923, 'booster': 'gbtree'}. Best is trial 72 with value: 0.6192449534188588.[0m
[32m[I 2026-08-06 15:18:30,644][0m Trial 118 pruned. [0m
[32m[I 2026-08-06 15:18:32,588][0m Trial 119 pruned. [0m
[32m[I 2026-08-06 15:18:45,654][0m Trial 120 finished with value: 0.6257240011602339 and parameters: {'n_estimators': 2061, 'max_depth': 4, 'learning_rate': 0.012205544038570373, 'subsample': 0.7323853032672839, 'colsample_bytree': 0.8537413422967037, 'colsample_bylevel': 0.4933659156237903, 'colsample_bynode': 0.9625895661469616, 'min_child_weight': 1.3014832306807667, 'gamma': 0.02463391305765862, 'reg_alpha': 4.953607003733511e-07, 'reg_lambda': 1.5455763440234707e-08, 'max_delta_step': 5.966001181225273, 'booster': 'gbtree'}. Best is trial 72 with value: 0.6192449534188588.[0m
[32m[I 2026-08-06 15:18:51,802][0m Trial 121 finished with value: 0.6227754514769079 and parameters: {'n_estimators': 2139, 'max_depth': 4, 'learning_rate': 0.020486624698937143, 'subsample': 0.6915230839277822, 'colsample_bytree': 0.9782522646176549, 'colsample_bylevel': 0.3034062877895802, 'colsample_bynode': 0.8913337755765701, 'min_child_weight': 1.0566012604177113, 'gamma': 0.11238367222677056, 'reg_alpha': 4.235540085881109e-05, 'reg_lambda': 1.4282995353264553e-07, 'max_delta_step': 5.5398601333574415, 'booster': 'gbtree'}. Best is trial 72 with value: 0.6192449534188588.[0m
[32m[I 2026-08-06 15:18:55,391][0m Trial 122 finished with value: 0.6184687548596528 and parameters: {'n_estimators': 1622, 'max_depth': 5, 'learning_rate': 0.03224883617947603, 'subsample': 0.766300654192665, 'colsample_bytree': 0.803065735155023, 'colsample_bylevel': 0.43639521762424416, 'colsample_bynode': 0.9130541223539328, 'min_child_weight': 1.2512831340374533, 'gamma': 0.1015607240563418, 'reg_alpha': 3.1028294993047728e-06, 'reg_lambda': 3.2148419367288497e-08, 'max_delta_step': 4.950292821751309, 'booster': 'gbtree'}. Best is trial 122 with value: 0.6184687548596528.[0m
[32m[I 2026-08-06 15:18:56,967][0m Trial 123 pruned. [0m
[32m[I 2026-08-06 15:19:01,328][0m Trial 124 finished with value: 0.6288287742844966 and parameters: {'n_estimators': 2275, 'max_depth': 4, 'learning_rate': 0.04107362323598293, 'subsample': 0.711250740829136, 'colsample_bytree': 0.9227338305559005, 'colsample_bylevel': 0.38080809937481086, 'colsample_bynode': 0.943224759685417, 'min_child_weight': 1.1905111025190125, 'gamma': 0.08972986766678478, 'reg_alpha': 1.0313926759552193e-07, 'reg_lambda': 1.3766053719468464e-06, 'max_delta_step': 6.091597985517058, 'booster': 'gbtree'}. Best is trial 122 with value: 0.6184687548596528.[0m
[32m[I 2026-08-06 15:19:03,061][0m Trial 125 pruned. [0m
[32m[I 2026-08-06 15:19:13,899][0m Trial 126 finished with value: 0.6267044016929825 and parameters: {'n_estimators': 1755, 'max_depth': 4, 'learning_rate': 0.012766861791367814, 'subsample': 0.7903343876887443, 'colsample_bytree': 0.8628868494338319, 'colsample_bylevel': 0.5319683168475806, 'colsample_bynode': 0.9931362757512759, 'min_child_weight': 1.4039544053403759, 'gamma': 0.04292989985153434, 'reg_alpha': 3.645649401993937e-06, 'reg_lambda': 3.736125797762453e-08, 'max_delta_step': 7.451094924386229, 'booster': 'gbtree'}. Best is trial 122 with value: 0.6184687548596528.[0m
[32m[I 2026-08-06 15:19:22,779][0m Trial 127 finished with value: 0.6364241472750333 and parameters: {'n_estimators': 1869, 'max_depth': 4, 'learning_rate': 0.010370730023592928, 'subsample': 0.6679761798655953, 'colsample_bytree': 0.8014816010359044, 'colsample_bylevel': 0.37467746078050723, 'colsample_bynode': 0.7793619765060698, 'min_child_weight': 1.0727177129817091, 'gamma': 0.2041002199945769, 'reg_alpha': 7.2997583698105e-05, 'reg_lambda': 2.957586314482877e-07, 'max_delta_step': 5.325594619427307, 'booster': 'gbtree'}. Best is trial 122 with value: 0.6184687548596528.[0m
[32m[I 2026-08-06 15:19:29,214][0m Trial 128 finished with value: 0.6297012984599251 and parameters: {'n_estimators': 2178, 'max_depth': 5, 'learning_rate': 0.019738686392289217, 'subsample': 0.7471203715710355, 'colsample_bytree': 0.5267625902819733, 'colsample_bylevel': 0.3206891807146485, 'colsample_bynode': 0.8054713700203907, 'min_child_weight': 1.12321580886774, 'gamma': 0.02497423987447176, 'reg_alpha': 3.481559608522171e-05, 'reg_lambda': 9.298124599090956e-06, 'max_delta_step': 3.6580067578439235, 'booster': 'dart'}. Best is trial 122 with value: 0.6184687548596528.[0m
[32m[I 2026-08-06 15:19:30,077][0m Trial 129 pruned. [0m
[32m[I 2026-08-06 15:19:31,614][0m Trial 130 pruned. [0m
[32m[I 2026-08-06 15:19:45,817][0m Trial 131 finished with value: 0.6199949412012227 and parameters: {'n_estimators': 2202, 'max_depth': 4, 'learning_rate': 0.010443881636434584, 'subsample': 0.6614688543240481, 'colsample_bytree': 0.8987157407564131, 'colsample_bylevel': 0.7179483956039832, 'colsample_bynode': 0.872611683093506, 'min_child_weight': 1.4755624775368656, 'gamma': 0.027760350415877363, 'reg_alpha': 1.5722862899848688e-08, 'reg_lambda': 2.4525450308966326e-08, 'max_delta_step': 5.639500763150245, 'booster': 'gbtree'}. Best is trial 122 with value: 0.6184687548596528.[0m
[32m[I 2026-08-06 15:19:49,384][0m Trial 132 pruned. [0m
[32m[I 2026-08-06 15:19:59,404][0m Trial 133 finished with value: 0.6261195883870017 and parameters: {'n_estimators': 2348, 'max_depth': 5, 'learning_rate': 0.011479233720653272, 'subsample': 0.7003399368618642, 'colsample_bytree': 0.881912608460681, 'colsample_bylevel': 0.7098906342477669, 'colsample_bynode': 0.8366783846998491, 'min_child_weight': 2.172396487958337, 'gamma': 0.16843820831096595, 'reg_alpha': 5.422726152929634e-06, 'reg_lambda': 6.84878178604603e-08, 'max_delta_step': 5.4224419880261765, 'booster': 'gbtree'}. Best is trial 122 with value: 0.6184687548596528.[0m
[32m[I 2026-08-06 15:20:02,314][0m Trial 134 pruned. [0m
[32m[I 2026-08-06 15:20:10,181][0m Trial 135 finished with value: 0.6201372309403637 and parameters: {'n_estimators': 2753, 'max_depth': 4, 'learning_rate': 0.015018828064823315, 'subsample': 0.6554845302291101, 'colsample_bytree': 0.46236095672151517, 'colsample_bylevel': 0.4629286315750264, 'colsample_bynode': 0.6447197423830046, 'min_child_weight': 1.8226738915998448, 'gamma': 0.0559099476752129, 'reg_alpha': 5.637081762969529e-07, 'reg_lambda': 4.088605486572087e-05, 'max_delta_step': 4.926584869776363, 'booster': 'gbtree'}. Best is trial 122 with value: 0.6184687548596528.[0m
[32m[I 2026-08-06 15:20:12,858][0m Trial 136 pruned. [0m
[32m[I 2026-08-06 15:20:15,815][0m Trial 137 finished with value: 0.6431578359217193 and parameters: {'n_estimators': 980, 'max_depth': 4, 'learning_rate': 0.03635456094009688, 'subsample': 0.742185357053875, 'colsample_bytree': 0.9188244716641276, 'colsample_bylevel': 0.33272788784103674, 'colsample_bynode': 0.9684669014097596, 'min_child_weight': 1.7620770421442855, 'gamma': 0.2454647685146344, 'reg_alpha': 8.498313036023883e-07, 'reg_lambda': 1.2303791217836664e-08, 'max_delta_step': 4.189914767359238, 'booster': 'gbtree'}. Best is trial 122 with value: 0.6184687548596528.[0m
[32m[I 2026-08-06 15:20:23,285][0m Trial 138 finished with value: 0.6345577096711792 and parameters: {'n_estimators': 1674, 'max_depth': 5, 'learning_rate': 0.016671207017024337, 'subsample': 0.6259307067624655, 'colsample_bytree': 0.8531252152885523, 'colsample_bylevel': 0.8903805310505333, 'colsample_bynode': 0.866078551090721, 'min_child_weight': 1.0204726674611944, 'gamma': 0.18074301227356232, 'reg_alpha': 1.6260806344285634e-08, 'reg_lambda': 2.4404556037542216e-06, 'max_delta_step': 5.304994258105046, 'booster': 'gbtree'}. Best is trial 122 with value: 0.6184687548596528.[0m
[32m[I 2026-08-06 15:20:24,890][0m Trial 139 pruned. [0m
[32m[I 2026-08-06 15:20:33,327][0m Trial 140 finished with value: 0.6268068273461537 and parameters: {'n_estimators': 1971, 'max_depth': 4, 'learning_rate': 0.01841281982848146, 'subsample': 0.7140340308894912, 'colsample_bytree': 0.7836523553951639, 'colsample_bylevel': 0.543270725798913, 'colsample_bynode': 0.9051092464410463, 'min_child_weight': 2.5965110576721897, 'gamma': 0.04395078902550017, 'reg_alpha': 1.4531569301739748e-06, 'reg_lambda': 1.553420600516047e-07, 'max_delta_step': 4.25697477222959, 'booster': 'gbtree'}. Best is trial 122 with value: 0.6184687548596528.[0m
[32m[I 2026-08-06 15:20:41,002][0m Trial 141 finished with value: 0.6529834277856341 and parameters: {'n_estimators': 2237, 'max_depth': 7, 'learning_rate': 0.0155826610704351, 'subsample': 0.7736395985147769, 'colsample_bytree': 0.9774366901262957, 'colsample_bylevel': 0.7840925621996657, 'colsample_bynode': 0.9708881118549632, 'min_child_weight': 1.9825273941848596, 'gamma': 0.2644881496221997, 'reg_alpha': 4.419380353793753e-06, 'reg_lambda': 6.142753386555484e-08, 'max_delta_step': 5.623336059488741, 'booster': 'gbtree'}. Best is trial 122 with value: 0.6184687548596528.[0m
[32m[I 2026-08-06 15:20:52,393][0m Trial 142 finished with value: 0.6314822012130276 and parameters: {'n_estimators': 1726, 'max_depth': 4, 'learning_rate': 0.010555533601016001, 'subsample': 0.6744115405278077, 'colsample_bytree': 0.8433852751572202, 'colsample_bylevel': 0.6143955823780303, 'colsample_bynode': 0.8175254507993932, 'min_child_weight': 1.4967810162144868, 'gamma': 0.0713506789803682, 'reg_alpha': 1.2946268795514325e-06, 'reg_lambda': 2.2429515848409962e-08, 'max_delta_step': 5.131458459172908, 'booster': 'dart'}. Best is trial 122 with value: 0.6184687548596528.[0m
[32m[I 2026-08-06 15:21:01,818][0m Trial 143 finished with value: 0.625156537959789 and parameters: {'n_estimators': 2156, 'max_depth': 5, 'learning_rate': 0.0167744278375144, 'subsample': 0.6273988892590663, 'colsample_bytree': 0.9858225523580508, 'colsample_bylevel': 0.6647061500849482, 'colsample_bynode': 0.7441131086286767, 'min_child_weight': 2.310540894869984, 'gamma': 0.05089757145197034, 'reg_alpha': 4.047300864053536e-08, 'reg_lambda': 2.881562069125294e-08, 'max_delta_step': 6.031404858227368, 'booster': 'gbtree'}. Best is trial 122 with value: 0.6184687548596528.[0m
[32m[I 2026-08-06 15:21:04,499][0m Trial 144 pruned. [0m
[32m[I 2026-08-06 15:21:18,099][0m Trial 145 finished with value: 0.6231824567197435 and parameters: {'n_estimators': 2269, 'max_depth': 4, 'learning_rate': 0.012106575082089021, 'subsample': 0.6577593437362105, 'colsample_bytree': 0.98528401580408, 'colsample_bylevel': 0.5963889634737121, 'colsample_bynode': 0.6248512298735018, 'min_child_weight': 1.3853444584460672, 'gamma': 0.017827504318948265, 'reg_alpha': 2.399201421292635e-07, 'reg_lambda': 6.023703751135553e-07, 'max_delta_step': 3.4892464481438052, 'booster': 'gbtree'}. Best is trial 122 with value: 0.6184687548596528.[0m
[32m[I 2026-08-06 15:21:28,912][0m Trial 146 finished with value: 0.6208079574708056 and parameters: {'n_estimators': 2524, 'max_depth': 4, 'learning_rate': 0.0137406776260456, 'subsample': 0.6086824292812251, 'colsample_bytree': 0.9835658324773446, 'colsample_bylevel': 0.5466731400845891, 'colsample_bynode': 0.5291102803803374, 'min_child_weight': 1.1051760956087575, 'gamma': 0.027617989095060445, 'reg_alpha': 1.6058900327470686e-08, 'reg_lambda': 1.6216108138665682e-07, 'max_delta_step': 3.721234164596976, 'booster': 'gbtree'}. Best is trial 122 with value: 0.6184687548596528.[0m
[32m[I 2026-08-06 15:21:35,776][0m Trial 147 finished with value: 0.6279053581751166 and parameters: {'n_estimators': 2960, 'max_depth': 4, 'learning_rate': 0.018325788118148008, 'subsample': 0.6949668848196658, 'colsample_bytree': 0.946136344948523, 'colsample_bylevel': 0.5696204092666843, 'colsample_bynode': 0.5309779300323267, 'min_child_weight': 2.0475953180102597, 'gamma': 0.08835400442381096, 'reg_alpha': 1.670969806625956e-05, 'reg_lambda': 5.917156057128519e-05, 'max_delta_step': 2.5072745573084405, 'booster': 'gbtree'}. Best is trial 122 with value: 0.6184687548596528.[0m
[32m[I 2026-08-06 15:21:40,491][0m Trial 148 finished with value: 0.617748053876028 and parameters: {'n_estimators': 2619, 'max_depth': 5, 'learning_rate': 0.02423642862079751, 'subsample': 0.6965765422558279, 'colsample_bytree': 0.9257134472202266, 'colsample_bylevel': 0.33032716544085794, 'colsample_bynode': 0.6015590155900147, 'min_child_weight': 2.4081980728736543, 'gamma': 0.05413422020719896, 'reg_alpha': 1.6284182386099662e-07, 'reg_lambda': 5.704770616748505e-08, 'max_delta_step': 5.41209980598694, 'booster': 'gbtree'}. Best is trial 148 with value: 0.617748053876028.[0m
[32m[I 2026-08-06 15:21:49,527][0m Trial 149 finished with value: 0.621836747659583 and parameters: {'n_estimators': 2086, 'max_depth': 6, 'learning_rate': 0.015402069333160143, 'subsample': 0.6051615868062751, 'colsample_bytree': 0.9051968243106785, 'colsample_bylevel': 0.48425945722186287, 'colsample_bynode': 0.47090590425020235, 'min_child_weight': 2.2125394810014196, 'gamma': 0.037834825097065886, 'reg_alpha': 1.1264838006081941e-08, 'reg_lambda': 2.3780478746563995e-06, 'max_delta_step': 2.0517966769449885, 'booster': 'gbtree'}. Best is trial 148 with value: 0.617748053876028.[0m
[32m[I 2026-08-06 15:21:53,074][0m Trial 150 pruned. [0m
[32m[I 2026-08-06 15:21:59,386][0m Trial 151 finished with value: 0.6218864587382607 and parameters: {'n_estimators': 2450, 'max_depth': 6, 'learning_rate': 0.027322108905148326, 'subsample': 0.6377110586813388, 'colsample_bytree': 0.9387280063319855, 'colsample_bylevel': 0.4812790038485315, 'colsample_bynode': 0.7626819659207618, 'min_child_weight': 2.857752490962629, 'gamma': 0.022189820901254202, 'reg_alpha': 2.757330457183065e-08, 'reg_lambda': 1.575935792920163e-06, 'max_delta_step': 1.267571095161529, 'booster': 'gbtree'}. Best is trial 148 with value: 0.617748053876028.[0m
[32m[I 2026-08-06 15:22:01,342][0m Trial 152 pruned. [0m
[32m[I 2026-08-06 15:22:02,417][0m Trial 153 pruned. [0m
[32m[I 2026-08-06 15:22:04,783][0m Trial 154 pruned. [0m
[32m[I 2026-08-06 15:22:21,187][0m Trial 155 finished with value: 0.6140876181601123 and parameters: {'n_estimators': 2397, 'max_depth': 7, 'learning_rate': 0.01962616956996237, 'subsample': 0.6629737096290099, 'colsample_bytree': 0.9347611669269049, 'colsample_bylevel': 0.5070175251333152, 'colsample_bynode': 0.4367548518168107, 'min_child_weight': 1.3505999334649075, 'gamma': 0.03234292519932689, 'reg_alpha': 2.0160292792974567e-08, 'reg_lambda': 2.0528907281490118e-07, 'max_delta_step': 0.13690534084820594, 'booster': 'gbtree'}. Best is trial 155 with value: 0.6140876181601123.[0m
[32m[I 2026-08-06 15:22:29,170][0m Trial 156 finished with value: 0.6324529927012408 and parameters: {'n_estimators': 1675, 'max_depth': 8, 'learning_rate': 0.01258390289338703, 'subsample': 0.6698840463649839, 'colsample_bytree': 0.8559344861848909, 'colsample_bylevel': 0.5028979618429309, 'colsample_bynode': 0.36717114522517585, 'min_child_weight': 1.911038685297808, 'gamma': 0.1129572759321988, 'reg_alpha': 5.570112071422557e-07, 'reg_lambda': 2.4156920102138615e-06, 'max_delta_step': 3.226420883905752, 'booster': 'gbtree'}. Best is trial 155 with value: 0.6140876181601123.[0m
[32m[I 2026-08-06 15:22:30,327][0m Trial 157 pruned. [0m
[32m[I 2026-08-06 15:22:35,706][0m Trial 158 finished with value: 0.6249180309749609 and parameters: {'n_estimators': 2329, 'max_depth': 6, 'learning_rate': 0.028053375700555147, 'subsample': 0.6772510109667161, 'colsample_bytree': 0.9051008717199739, 'colsample_bylevel': 0.4880479588379723, 'colsample_bynode': 0.5316610428569979, 'min_child_weight': 1.514308925337146, 'gamma': 0.019632010240264362, 'reg_alpha': 3.19510335559045e-08, 'reg_lambda': 1.7521662135436285e-07, 'max_delta_step': 2.230263103604674, 'booster': 'gbtree'}. Best is trial 155 with value: 0.6140876181601123.[0m
[32m[I 2026-08-06 15:22:43,597][0m Trial 159 finished with value: 0.617785034468499 and parameters: {'n_estimators': 1909, 'max_depth': 11, 'learning_rate': 0.025351383104778885, 'subsample': 0.6061705434882874, 'colsample_bytree': 0.9251821829710793, 'colsample_bylevel': 0.5156514956649985, 'colsample_bynode': 0.3749952734655179, 'min_child_weight': 1.8328491916324117, 'gamma': 0.030906339448004666, 'reg_alpha': 1.2400300576165077e-08, 'reg_lambda': 3.8081409364111204e-08, 'max_delta_step': 0.42277421741407695, 'booster': 'dart'}. Best is trial 155 with value: 0.6140876181601123.[0m
[32m[I 2026-08-06 15:22:47,430][0m Trial 160 finished with value: 0.6309752563586709 and parameters: {'n_estimators': 2570, 'max_depth': 7, 'learning_rate': 0.03129644726215152, 'subsample': 0.6036086283497177, 'colsample_bytree': 0.9899973939263434, 'colsample_bylevel': 0.38357556462887193, 'colsample_bynode': 0.5290517685529729, 'min_child_weight': 2.7336780397195333, 'gamma': 0.22210279316300774, 'reg_alpha': 1.7517286394201374e-06, 'reg_lambda': 0.00018300210994536524, 'max_delta_step': 2.8038424052304562, 'booster': 'dart'}. Best is trial 155 with value: 0.6140876181601123.[0m
[32m[I 2026-08-06 15:22:48,672][0m Trial 161 pruned. [0m
[32m[I 2026-08-06 15:22:55,647][0m Trial 162 finished with value: 0.6270112765455729 and parameters: {'n_estimators': 2080, 'max_depth': 9, 'learning_rate': 0.01970544280234219, 'subsample': 0.6398082519867924, 'colsample_bytree': 0.9878918798818694, 'colsample_bylevel': 0.4231808307154504, 'colsample_bynode': 0.7122335082321529, 'min_child_weight': 4.904096484358663, 'gamma': 0.08276183061781181, 'reg_alpha': 1.276874289288126e-07, 'reg_lambda': 8.302908492076135e-08, 'max_delta_step': 1.2015892973847404, 'booster': 'gbtree'}. Best is trial 155 with value: 0.6140876181601123.[0m
[32m[I 2026-08-06 15:23:01,020][0m Trial 163 finished with value: 0.6355615668829799 and parameters: {'n_estimators': 2078, 'max_depth': 5, 'learning_rate': 0.019970961837625586, 'subsample': 0.6013038264405729, 'colsample_bytree': 0.90694973922612, 'colsample_bylevel': 0.36378090135141217, 'colsample_bynode': 0.47235334105549837, 'min_child_weight': 3.1202664682851213, 'gamma': 0.15690610505607888, 'reg_alpha': 9.3508244222928e-07, 'reg_lambda': 1.1702702156945256e-08, 'max_delta_step': 5.183018130325299, 'booster': 'gbtree'}. Best is trial 155 with value: 0.6140876181601123.[0m
