[32m[I 2026-08-06 15:23:08,081][0m Trial 164 finished with value: 0.6377766697395146 and parameters: {'n_estimators': 2802, 'max_depth': 5, 'learning_rate': 0.014266515274505082, 'subsample': 0.7200197251298504, 'colsample_bytree': 0.9309166235823793, 'colsample_bylevel': 0.37492772228674287, 'colsample_bynode': 0.7246051344597287, 'min_child_weight': 2.4574213835436916, 'gamma': 0.20827088234781876, 'reg_alpha': 6.024475100899152e-05, 'reg_lambda': 4.527128447369684e-08, 'max_delta_step': 5.245095443847213, 'booster': 'gbtree'}. Best is trial 155 with value: 0.6140876181601123.[0m
[32m[I 2026-08-06 15:23:10,701][0m Trial 165 pruned. [0m
[32m[I 2026-08-06 15:23:14,575][0m Trial 166 pruned. [0m
[32m[I 2026-08-06 15:23:20,355][0m Trial 167 pruned. [0m
[32m[I 2026-08-06 15:23:27,872][0m Trial 168 finished with value: 0.6378525586784773 and parameters: {'n_estimators': 1661, 'max_depth': 10, 'learning_rate': 0.015503289489528694, 'subsample': 0.6439396375250535, 'colsample_bytree': 0.9452919777910543, 'colsample_bylevel': 0.5129994360298553, 'colsample_bynode': 0.5958617990816637, 'min_child_weight': 4.189024327327813, 'gamma': 0.2415051095932137, 'reg_alpha': 3.372201294460487e-08, 'reg_lambda': 1.9506218696147513e-07, 'max_delta_step': 0.7961474113700306, 'booster': 'dart'}. Best is trial 155 with value: 0.6140876181601123.[0m
[32m[I 2026-08-06 15:23:39,150][0m Trial 169 finished with value: 0.6198649012679543 and parameters: {'n_estimators': 2634, 'max_depth': 6, 'learning_rate': 0.012940148131077075, 'subsample': 0.6174944135953803, 'colsample_bytree': 0.8376193084888752, 'colsample_bylevel': 0.7121067340798285, 'colsample_bynode': 0.565086285118638, 'min_child_weight': 1.6308774992343387, 'gamma': 0.023333641933360693, 'reg_alpha': 4.0737894947905747e-07, 'reg_lambda': 1.6658337682207765e-06, 'max_delta_step': 0.8769261545166382, 'booster': 'dart'}. Best is trial 155 with value: 0.6140876181601123.[0m
[32m[I 2026-08-06 15:23:40,779][0m Trial 170 pruned. [0m
[32m[I 2026-08-06 15:23:43,176][0m Trial 171 pruned. [0m
[32m[I 2026-08-06 15:23:47,771][0m Trial 172 pruned. [0m
[32m[I 2026-08-06 15:23:49,955][0m Trial 173 pruned. [0m
[32m[I 2026-08-06 15:23:59,578][0m Trial 174 finished with value: 0.6208105229569671 and parameters: {'n_estimators': 2992, 'max_depth': 5, 'learning_rate': 0.013272254963616817, 'subsample': 0.617845827712725, 'colsample_bytree': 0.8360284237113601, 'colsample_bylevel': 0.5873056995721847, 'colsample_bynode': 0.3128327102740159, 'min_child_weight': 1.1472110152687234, 'gamma': 0.04199175843112837, 'reg_alpha': 1.0601747240250388e-06, 'reg_lambda': 1.5729527729041295e-08, 'max_delta_step': 2.3945893092423907, 'booster': 'gbtree'}. Best is trial 155 with value: 0.6140876181601123.[0m
[32m[I 2026-08-06 15:24:06,201][0m Trial 175 finished with value: 0.6376213199464275 and parameters: {'n_estimators': 2574, 'max_depth': 6, 'learning_rate': 0.013707872499930805, 'subsample': 0.6113571093892913, 'colsample_bytree': 0.9511693466401457, 'colsample_bylevel': 0.4579451938320405, 'colsample_bynode': 0.5260687561162071, 'min_child_weight': 1.056579060306413, 'gamma': 0.11425038295937846, 'reg_alpha': 4.052199477906577e-08, 'reg_lambda': 4.484277220872491e-06, 'max_delta_step': 5.15389389488859, 'booster': 'dart'}. Best is trial 155 with value: 0.6140876181601123.[0m
[32m[I 2026-08-06 15:24:07,089][0m Trial 176 pruned. [0m
[32m[I 2026-08-06 15:24:19,000][0m Trial 177 finished with value: 0.6334366950453388 and parameters: {'n_estimators': 2183, 'max_depth': 4, 'learning_rate': 0.01094106421573588, 'subsample': 0.6434923693131942, 'colsample_bytree': 0.7992648760917884, 'colsample_bylevel': 0.8617593538875731, 'colsample_bynode': 0.9549523388564709, 'min_child_weight': 3.534353080305609, 'gamma': 0.2011350674312245, 'reg_alpha': 4.144682530312895e-08, 'reg_lambda': 2.376282768000577e-08, 'max_delta_step': 4.113141587050876, 'booster': 'gbtree'}. Best is trial 155 with value: 0.6140876181601123.[0m
[32m[I 2026-08-06 15:24:21,164][0m Trial 178 pruned. [0m
[32m[I 2026-08-06 15:24:22,292][0m Trial 179 pruned. [0m
[32m[I 2026-08-06 15:24:33,662][0m Trial 180 finished with value: 0.6101163911629331 and parameters: {'n_estimators': 2199, 'max_depth': 6, 'learning_rate': 0.025161728401418015, 'subsample': 0.6058862420665573, 'colsample_bytree': 0.8317503611049091, 'colsample_bylevel': 0.9025956595292608, 'colsample_bynode': 0.4518086932574078, 'min_child_weight': 1.0526795691306694, 'gamma': 0.0014616149417590006, 'reg_alpha': 4.70247809344792e-06, 'reg_lambda': 3.108242170536658e-06, 'max_delta_step': 0.33085192212567716, 'booster': 'dart'}. Best is trial 180 with value: 0.6101163911629331.[0m
[32m[I 2026-08-06 15:24:35,376][0m Trial 181 pruned. [0m
[32m[I 2026-08-06 15:24:41,177][0m Trial 182 finished with value: 0.6281658336985959 and parameters: {'n_estimators': 2965, 'max_depth': 5, 'learning_rate': 0.016710548732844246, 'subsample': 0.6148553670885364, 'colsample_bytree': 0.9472289196700934, 'colsample_bylevel': 0.36441960999672074, 'colsample_bynode': 0.41091217646683026, 'min_child_weight': 1.2626593268752462, 'gamma': 0.18003279493689653, 'reg_alpha': 1.4986143745409017e-06, 'reg_lambda': 5.192671793664208e-07, 'max_delta_step': 2.8180663126041114, 'booster': 'gbtree'}. Best is trial 180 with value: 0.6101163911629331.[0m
[32m[I 2026-08-06 15:24:49,227][0m Trial 183 pruned. [0m
[32m[I 2026-08-06 15:24:50,999][0m Trial 184 pruned. [0m
[32m[I 2026-08-06 15:24:57,868][0m Trial 185 pruned. [0m
[32m[I 2026-08-06 15:25:04,676][0m Trial 186 finished with value: 0.6211124664584808 and parameters: {'n_estimators': 1987, 'max_depth': 8, 'learning_rate': 0.033082879101412284, 'subsample': 0.672965013885505, 'colsample_bytree': 0.8678651261178183, 'colsample_bylevel': 0.8723849301289985, 'colsample_bynode': 0.3302006142295187, 'min_child_weight': 1.1799810217257651, 'gamma': 0.09249775462188241, 'reg_alpha': 0.0041628366969709936, 'reg_lambda': 1.0717372126124877e-08, 'max_delta_step': 0.29893590084660715, 'booster': 'dart'}. Best is trial 180 with value: 0.6101163911629331.[0m
[32m[I 2026-08-06 15:25:07,366][0m Trial 187 pruned. [0m
[32m[I 2026-08-06 15:25:08,191][0m Trial 188 pruned. [0m
[32m[I 2026-08-06 15:25:11,930][0m Trial 189 finished with value: 0.6316719557360587 and parameters: {'n_estimators': 2068, 'max_depth': 7, 'learning_rate': 0.04001766882211283, 'subsample': 0.7203556120396646, 'colsample_bytree': 0.8800236928522801, 'colsample_bylevel': 0.8489652099767044, 'colsample_bynode': 0.5413561396841542, 'min_child_weight': 1.470106823090105, 'gamma': 0.1309225518511888, 'reg_alpha': 0.0003643846025729797, 'reg_lambda': 1.7235202451046664e-07, 'max_delta_step': 0.894103048138393, 'booster': 'gbtree'}. Best is trial 180 with value: 0.6101163911629331.[0m
[32m[I 2026-08-06 15:25:14,468][0m Trial 190 finished with value: 0.6466429928608596 and parameters: {'n_estimators': 1549, 'max_depth': 4, 'learning_rate': 0.056213994507782104, 'subsample': 0.822219595447416, 'colsample_bytree': 0.6256430112984828, 'colsample_bylevel': 0.5274954915730756, 'colsample_bynode': 0.7949739430648625, 'min_child_weight': 1.780734026300861, 'gamma': 0.21851349015241, 'reg_alpha': 4.1265860288331163e-07, 'reg_lambda': 1.1096871358713644e-08, 'max_delta_step': 4.423350629852232, 'booster': 'gbtree'}. Best is trial 180 with value: 0.6101163911629331.[0m
[32m[I 2026-08-06 15:25:15,482][0m Trial 191 pruned. [0m
[32m[I 2026-08-06 15:25:17,071][0m Trial 192 pruned. [0m
[32m[I 2026-08-06 15:25:24,124][0m Trial 193 finished with value: 0.6288963280789401 and parameters: {'n_estimators': 2403, 'max_depth': 4, 'learning_rate': 0.013265080863434468, 'subsample': 0.6051647382603681, 'colsample_bytree': 0.6753973667591879, 'colsample_bylevel': 0.5771405827174965, 'colsample_bynode': 0.6196036162018153, 'min_child_weight': 1.2639398169031237, 'gamma': 0.17364516178766187, 'reg_alpha': 1.6697720121265541e-06, 'reg_lambda': 8.05105258327431e-06, 'max_delta_step': 2.0264399246166613, 'booster': 'dart'}. Best is trial 180 with value: 0.6101163911629331.[0m
[32m[I 2026-08-06 15:25:33,170][0m Trial 194 finished with value: 0.6351312485714142 and parameters: {'n_estimators': 2779, 'max_depth': 6, 'learning_rate': 0.011284247896419861, 'subsample': 0.664491933442916, 'colsample_bytree': 0.736270944506684, 'colsample_bylevel': 0.6278323067413224, 'colsample_bynode': 0.32047848640473015, 'min_child_weight': 2.1135968504349196, 'gamma': 0.12390661561638786, 'reg_alpha': 3.326827861092195e-07, 'reg_lambda': 1.5690060011461225e-07, 'max_delta_step': 3.9971168769282217, 'booster': 'gbtree'}. Best is trial 180 with value: 0.6101163911629331.[0m
[32m[I 2026-08-06 15:25:36,621][0m Trial 195 pruned. [0m
[32m[I 2026-08-06 15:25:42,603][0m Trial 196 finished with value: 0.6325114862062328 and parameters: {'n_estimators': 2781, 'max_depth': 8, 'learning_rate': 0.030558910295413563, 'subsample': 0.6561666149530057, 'colsample_bytree': 0.9783920103262382, 'colsample_bylevel': 0.9601660050163182, 'colsample_bynode': 0.3868306916384959, 'min_child_weight': 1.2223796972813952, 'gamma': 0.03537684460223876, 'reg_alpha': 5.957520981267664e-08, 'reg_lambda': 2.8064943126581306e-05, 'max_delta_step': 2.35734362197691, 'booster': 'dart'}. Best is trial 180 with value: 0.6101163911629331.[0m
[32m[I 2026-08-06 15:25:43,571][0m Trial 197 pruned. [0m
[32m[I 2026-08-06 15:25:45,970][0m Trial 198 pruned. [0m
[32m[I 2026-08-06 15:25:50,586][0m Trial 199 finished with value: 0.6283968472858198 and parameters: {'n_estimators': 1713, 'max_depth': 6, 'learning_rate': 0.030177939673042328, 'subsample': 0.6095949760537904, 'colsample_bytree': 0.7776161685790919, 'colsample_bylevel': 0.9212673167505766, 'colsample_bynode': 0.4626763951837687, 'min_child_weight': 1.0125946604750113, 'gamma': 0.049578016166431114, 'reg_alpha': 0.0007873889874013358, 'reg_lambda': 3.223893319287454e-08, 'max_delta_step': 0.9975247305031913, 'booster': 'dart'}. Best is trial 180 with value: 0.6101163911629331.[0m

------------------------------------------------------------
All Trial CV Results:
Trial  Mean RMSE  Std RMSE  CV Scores
------------------------------------------------------------
    0     0.7333
    1     0.6699
    2     0.6733
    3     0.7125
    4     0.6574
    5     0.6739
    6     0.6990
    7     0.6726
    8     0.7113
    9     0.7056
   10     0.7082
   11     0.6421
   12     0.6496
   13     0.6558
   14     0.6728
   15     0.6563
   16     0.6542
   17     0.6365
   18     0.6593
   19     0.6425
   20     0.6328
   21     0.6470
   22     0.6408
   23     0.6178
   24     0.6276
   25     0.6529
   26     0.6397
   27     0.6236
   28     0.6708
   29     0.6286
   30     0.6345
   31     0.6504
   32     0.6330
   33     0.6490
   34     0.6310
   35     0.6407
   36     0.6266
   37     0.6155
   38     0.6210
   39     0.6287
   40     0.6173
   41     0.6324
   42     0.6149
   43     0.6476
   44     0.6248
   45     0.6451
   46     0.6258
   47     0.6220
   48     0.6242
   49     0.6388
   50     0.6418
   51     0.6312
   52     0.6344
   53     0.6334
   54     0.6250
   55     0.6616
   56     0.6361
   57     0.6453
   58     0.6438
   59     0.6443
   60     0.6249
   61     0.6337
   62     0.6201
   63     0.6357
   64     0.6328
   65     0.6594
   66     0.6435
   67     0.6438
   68     0.6242
   69     0.6331
   70     0.6497
   71     0.6273
   72     0.6192
   73     0.6410
   74     0.6359
   75     0.6448
   76     0.6519
   77     0.6297
   78     0.6359
   79     0.6333
   80     0.6343
   81     0.6334
   82     0.6633
   83     0.6322
   84     0.6240
   85     0.6316
   86     0.6338
   87     0.6194
   88     0.6248
   89     0.6447
   90     0.6222
   91     0.6499
   92     0.6281
   93     0.6274
   94     0.6420
   95     0.6302
   96     0.6554
   97     0.6335
   98     0.6306
   99     0.6269
  100     0.6395
  101     0.6275
  102     0.6115
  103     0.6385
  104     0.6082
  105     0.6456
  106     0.6282
  107     0.6393
  108     0.6484
  109     0.6451
  110     0.6154
  111     0.6298
  112     0.6224
  113     0.6362
  114     0.6253
  115     0.6402
  116     0.6350
  117     0.6325
  118     0.6222
  119     0.6703
  120     0.6257
  121     0.6228
  122     0.6185
  123     0.6379
  124     0.6288
  125     0.6392
  126     0.6267
  127     0.6364
  128     0.6297
  129     0.6423
  130     0.6193
  131     0.6200
  132     0.6287
  133     0.6261
  134     0.6301
  135     0.6201
  136     0.6183
  137     0.6432
  138     0.6346
  139     0.6192
  140     0.6268
  141     0.6530
  142     0.6315
  143     0.6252
  144     0.6247
  145     0.6232
  146     0.6208
  147     0.6279
  148     0.6177
  149     0.6218
  150     0.6235
  151     0.6219
  152     0.6294
  153     0.6285
  154     0.6228
  155     0.6141
  156     0.6325
  157     0.6454
  158     0.6249
  159     0.6178
  160     0.6310
  161     0.6253
  162     0.6270
  163     0.6356
  164     0.6378
  165     0.6084
  166     0.6326
  167     0.6280
  168     0.6379
  169     0.6199
  170     0.6254
  171     0.6147
  172     0.6131
  173     0.6062
  174     0.6208
  175     0.6376
  176     0.6673
  177     0.6334
  178     0.6263
  179     0.6266
  180     0.6101
  181     0.6115
  182     0.6282
  183     0.6217
  184     0.6097
  185     0.8071
  186     0.6211
  187     0.6341
  188     0.6302
  189     0.6317
  190     0.6466
  191     0.6146
  192     0.6321
  193     0.6289
  194     0.6351
  195     0.6141
  196     0.6325
  197     0.6387
  198     0.6435
  199     0.6284
------------------------------------------------------------

=== Best Trial ===
  CV RMSE: 0.610116
  Params:  {'n_estimators': 2199, 'max_depth': 6, 'learning_rate': 0.025161728401418015, 'subsample': 0.6058862420665573, 'colsample_bytree': 0.8317503611049091, 'colsample_bylevel': 0.9025956595292608, 'colsample_bynode': 0.4518086932574078, 'min_child_weight': 1.0526795691306694, 'gamma': 0.0014616149417590006, 'reg_alpha': 4.70247809344792e-06, 'reg_lambda': 3.108242170536658e-06, 'max_delta_step': 0.33085192212567716, 'booster': 'dart'}

Parameter Importance:
  gamma: 0.6303
  max_depth: 0.0957
  max_delta_step: 0.0518
  subsample: 0.0438
  colsample_bynode: 0.0381
  reg_alpha: 0.0351
  n_estimators: 0.0300
  learning_rate: 0.0288
  reg_lambda: 0.0284
  min_child_weight: 0.0080
  colsample_bylevel: 0.0050
  colsample_bytree: 0.0046
  booster: 0.0006

============================================================
Top-5 Holdout Validation — selecting most generalizable params
============================================================
 Rank    CV RMSE   Holdout RMSE   Holdout R²
------------------------------------------------------------
    1     0.6062         0.6231       0.7631
    2     0.6082         0.6710       0.7253
    3     0.6084         0.6056       0.7763
    4     0.6097         0.6586       0.7354
    5     0.6101         0.6076       0.7748

  → Selected params (holdout RMSE=0.6056):
    n_estimators: 2373
    max_depth: 6
    learning_rate: 0.026408534396282244
    subsample: 0.7437492712478228
    colsample_bytree: 0.9422153878278597
    colsample_bylevel: 0.896192165824438
    colsample_bynode: 0.8878569369756439
    min_child_weight: 5.93037856844973
    gamma: 0.10349894866159795
    reg_alpha: 3.21883494862455e-08
    reg_lambda: 4.455934030896096e-08
    max_delta_step: 0.6377111121607884
    booster: gbtree

============================================================
Training Final Model with Best Hyperparameters (X_cv: 507 samples)
============================================================

============================================================
Test Evaluation
============================================================
  Test MSE:  0.4222
  Test RMSE: 0.6498
  Test MAE:  0.4665
  Test R虏:   0.7039

============================================================
Top 20 Feature Importances
============================================================
   1. atom_std_44                0.2
   2. maccs_137                  0.1
   3. atom_max_44                0.1
   4. maccs_77                   0.1
   5. maccs_65                   0.0
   6. atom_std_46                0.0
   7. atom_mean_44               0.0
   8. bond_mean_13               0.0
   9. atom_mean_46               0.0
  10. NAtoms                     0.0
  11. maccs_141                  0.0
  12. atom_std_40                0.0
  13. bond_std_5                 0.0
  14. maccs_92                   0.0
  15. atom_std_49                0.0
  16. bond_std_3                 0.0
  17. brics_7                    0.0
  18. atom_mean_16               0.0
  19. bond_mean_4                0.0
  20. MolWt                      0.0

Plot saved to runs\pC20\pC20_xgboost_20260806_151000\pred_vs_true.png
Model saved to runs\pC20\pC20_xgboost_20260806_151000\model.pkl

============================================================
SUMMARY - XGBoost + PharmHGT Features
============================================================
  Features:  522-dim (atom_agg + bond_agg + MACCS + BRICS + surfactant + descriptors)
  Train:     507 (holdout 57)
  Test:      70
  Optuna:    200 trials, 5-fold CV, multivariate TPE, gap penalty
  Top-K:     5 candidates re-evaluated on holdout (57 samples)
  Best CV RMSE: 0.6101
  Holdout RMSE: 0.6056
  Test RMSE: 0.6498
  Test MAE:  0.4665
  Test R²:   0.7039

指标已保存: runs\pC20\pC20_xgboost_20260806_151000\metrics.json
索引已更新: runs\pC20\_runs_index.csv
索引已更新: runs\_runs_index.csv
