============================================================
xgboost — 运行开始  20260806_151000
  输出目录:  runs\pC20\pC20_xgboost_20260806_151000
============================================================
============================================================
XGBoost + PharmHGT-style Featurization for pC20 Prediction
============================================================
[Cache HIT] Loading features from data\features\surfpro\pC20
  Train features: (564, 522)
  Test features:  (70, 522)

Split: Train 493, Val 71, Test 70
  CV (Optuna): 507, Holdout (Top-K filter): 57

============================================================
Optuna Hyperparameter Tuning (200 trials, 5-Fold CV)
============================================================
[32m[I 2026-08-06 15:10:03,376][0m Trial 0 finished with value: 0.7333244993662765 and parameters: {'n_estimators': 1624, 'max_depth': 12, 'learning_rate': 0.08960785365368121, 'subsample': 0.8394633936788146, 'colsample_bytree': 0.40921304830970556, 'colsample_bylevel': 0.40919616423534183, 'colsample_bynode': 0.3406585285177396, 'min_child_weight': 19.030368381735816, 'gamma': 1.2022300234864176, 'reg_alpha': 0.023585940584142682, 'reg_lambda': 1.5320059381854043e-08, 'max_delta_step': 7.759278817295955, 'booster': 'gbtree'}. Best is trial 0 with value: 0.7333244993662765.[0m
[32m[I 2026-08-06 15:10:10,646][0m Trial 1 finished with value: 0.6699158339263805 and parameters: {'n_estimators': 1200, 'max_depth': 5, 'learning_rate': 0.024878734419814436, 'subsample': 0.8099025726528951, 'colsample_bytree': 0.602361513049481, 'colsample_bylevel': 0.5038603981386294, 'colsample_bynode': 0.7282970263056656, 'min_child_weight': 1.6071238512039876, 'gamma': 0.5842892970704363, 'reg_alpha': 1.9826980964985924e-05, 'reg_lambda': 0.00012724181576752517, 'max_delta_step': 6.281407691144109, 'booster': 'dart'}. Best is trial 1 with value: 0.6699158339263805.[0m
[32m[I 2026-08-06 15:10:13,749][0m Trial 2 finished with value: 0.673304389004274 and parameters: {'n_estimators': 2103, 'max_depth': 4, 'learning_rate': 0.061721159481070736, 'subsample': 0.6682096494749166, 'colsample_bytree': 0.3455361150896956, 'colsample_bylevel': 0.9642198760773333, 'colsample_bynode': 0.9759424231521916, 'min_child_weight': 15.635108708133458, 'gamma': 0.6092275383467414, 'reg_alpha': 7.569183361880229e-08, 'reg_lambda': 0.014391207615728067, 'max_delta_step': 3.5212199499168104, 'booster': 'dart'}. Best is trial 1 with value: 0.6699158339263805.[0m
[32m[I 2026-08-06 15:10:18,417][0m Trial 3 finished with value: 0.7125087819488776 and parameters: {'n_estimators': 875, 'max_depth': 12, 'learning_rate': 0.02171103454376615, 'subsample': 0.8650089137415928, 'colsample_bytree': 0.5181977532625877, 'colsample_bylevel': 0.6640476148244676, 'colsample_bynode': 0.6826971955402957, 'min_child_weight': 1.8752209455786402, 'gamma': 1.9391692555291171, 'reg_alpha': 0.09466630153726856, 'reg_lambda': 2.854239907497756, 'max_delta_step': 7.158618803421191, 'booster': 'dart'}. Best is trial 1 with value: 0.6699158339263805.[0m
[32m[I 2026-08-06 15:10:24,959][0m Trial 4 finished with value: 0.6573831629132576 and parameters: {'n_estimators': 994, 'max_depth': 5, 'learning_rate': 0.011450964268326641, 'subsample': 0.7301321323053057, 'colsample_bytree': 0.5720741027826374, 'colsample_bylevel': 0.4899443222417271, 'colsample_bynode': 0.8801162564063505, 'min_child_weight': 3.3648671441879534, 'gamma': 0.5618690193747615, 'reg_alpha': 0.0007660634613082914, 'reg_lambda': 1.8548894229694903e-07, 'max_delta_step': 6.417575846032317, 'booster': 'dart'}. Best is trial 4 with value: 0.6573831629132576.[0m
[32m[I 2026-08-06 15:10:32,618][0m Trial 5 finished with value: 0.6739224730284009 and parameters: {'n_estimators': 2499, 'max_depth': 5, 'learning_rate': 0.010166803740022877, 'subsample': 0.9261845713819337, 'colsample_bytree': 0.7948001406933319, 'colsample_bylevel': 0.810305017628691, 'colsample_bynode': 0.8398892426801621, 'min_child_weight': 1.286390810198991, 'gamma': 0.7169314570885452, 'reg_alpha': 1.1036250149900698e-07, 'reg_lambda': 0.5860448217200517, 'max_delta_step': 4.986385014620463, 'booster': 'gbtree'}. Best is trial 4 with value: 0.6573831629132576.[0m
[32m[I 2026-08-06 15:10:33,494][0m Trial 6 pruned. [0m
[32m[I 2026-08-06 15:10:35,693][0m Trial 7 pruned. [0m
[32m[I 2026-08-06 15:10:36,516][0m Trial 8 pruned. [0m
[32m[I 2026-08-06 15:10:39,364][0m Trial 9 pruned. [0m
[32m[I 2026-08-06 15:10:41,307][0m Trial 10 pruned. [0m
[32m[I 2026-08-06 15:10:49,354][0m Trial 11 finished with value: 0.6421013418799452 and parameters: {'n_estimators': 1245, 'max_depth': 7, 'learning_rate': 0.016533299688492164, 'subsample': 0.6365947042022191, 'colsample_bytree': 0.38180186499966196, 'colsample_bylevel': 0.4370541119944715, 'colsample_bynode': 0.7569997133644708, 'min_child_weight': 9.205175929278184, 'gamma': 0.10304389888704435, 'reg_alpha': 7.13565343844229e-06, 'reg_lambda': 8.594858757777225e-07, 'max_delta_step': 7.557654811435774, 'booster': 'dart'}. Best is trial 11 with value: 0.6421013418799452.[0m
[32m[I 2026-08-06 15:10:57,905][0m Trial 12 finished with value: 0.649605450188752 and parameters: {'n_estimators': 1450, 'max_depth': 5, 'learning_rate': 0.010971299417485671, 'subsample': 0.7206175126310708, 'colsample_bytree': 0.3353290144548863, 'colsample_bylevel': 0.3291780474899833, 'colsample_bynode': 0.6919272255733547, 'min_child_weight': 13.195638545778207, 'gamma': 0.013447817283792879, 'reg_alpha': 1.0493076203561789e-07, 'reg_lambda': 2.0853925757951582e-07, 'max_delta_step': 5.04683086920639, 'booster': 'gbtree'}. Best is trial 11 with value: 0.6421013418799452.[0m
[32m[I 2026-08-06 15:11:04,430][0m Trial 13 finished with value: 0.6558386116779114 and parameters: {'n_estimators': 1678, 'max_depth': 4, 'learning_rate': 0.0220461882120811, 'subsample': 0.6546826601928994, 'colsample_bytree': 0.3444796346163434, 'colsample_bylevel': 0.4020006428965137, 'colsample_bynode': 0.4649820840867551, 'min_child_weight': 14.137122299250752, 'gamma': 0.1687192780465728, 'reg_alpha': 1.4605595695570422e-08, 'reg_lambda': 3.004336586600213e-08, 'max_delta_step': 2.5363171638147115, 'booster': 'gbtree'}. Best is trial 11 with value: 0.6421013418799452.[0m
[32m[I 2026-08-06 15:11:06,391][0m Trial 14 pruned. [0m
[32m[I 2026-08-06 15:11:09,369][0m Trial 15 pruned. [0m
[32m[I 2026-08-06 15:11:18,354][0m Trial 16 finished with value: 0.6542265857217461 and parameters: {'n_estimators': 1397, 'max_depth': 6, 'learning_rate': 0.013947558065777672, 'subsample': 0.6017395975859409, 'colsample_bytree': 0.4629486012725701, 'colsample_bylevel': 0.4842706957172487, 'colsample_bynode': 0.9837604738242391, 'min_child_weight': 16.86387790632727, 'gamma': 0.2567190232737396, 'reg_alpha': 3.2041396155224605e-05, 'reg_lambda': 0.009007426404134527, 'max_delta_step': 7.755477587378273, 'booster': 'dart'}. Best is trial 11 with value: 0.6421013418799452.[0m
[32m[I 2026-08-06 15:11:24,082][0m Trial 17 finished with value: 0.6365353355367009 and parameters: {'n_estimators': 2036, 'max_depth': 4, 'learning_rate': 0.020327730561457508, 'subsample': 0.6064799865360607, 'colsample_bytree': 0.4023606870461419, 'colsample_bylevel': 0.3077690808396162, 'colsample_bynode': 0.8018546757139061, 'min_child_weight': 3.540580325417723, 'gamma': 0.18630214530479594, 'reg_alpha': 9.217315682658662e-06, 'reg_lambda': 8.546593957038998e-08, 'max_delta_step': 6.108313871985454, 'booster': 'dart'}. Best is trial 17 with value: 0.6365353355367009.[0m
[32m[I 2026-08-06 15:11:25,138][0m Trial 18 pruned. [0m
[32m[I 2026-08-06 15:11:30,658][0m Trial 19 finished with value: 0.6425420503277687 and parameters: {'n_estimators': 2429, 'max_depth': 6, 'learning_rate': 0.01612317552787115, 'subsample': 0.6582166129739072, 'colsample_bytree': 0.5062457445557689, 'colsample_bylevel': 0.30349799557409507, 'colsample_bynode': 0.6621987597716539, 'min_child_weight': 1.7347334676110389, 'gamma': 0.2407383739461303, 'reg_alpha': 1.9905036212373506e-06, 'reg_lambda': 9.853429695612671e-07, 'max_delta_step': 6.718419672557927, 'booster': 'dart'}. Best is trial 17 with value: 0.6365353355367009.[0m
[32m[I 2026-08-06 15:11:37,829][0m Trial 20 finished with value: 0.6328477423550998 and parameters: {'n_estimators': 1949, 'max_depth': 6, 'learning_rate': 0.03275819417140919, 'subsample': 0.6051389464895688, 'colsample_bytree': 0.4230894409552188, 'colsample_bylevel': 0.8590753270296511, 'colsample_bynode': 0.5810218711610139, 'min_child_weight': 11.639534663120308, 'gamma': 0.022260153210420547, 'reg_alpha': 6.0254695847495995e-06, 'reg_lambda': 2.0315467116205453e-08, 'max_delta_step': 4.7561704591069764, 'booster': 'dart'}. Best is trial 20 with value: 0.6328477423550998.[0m
[32m[I 2026-08-06 15:11:45,746][0m Trial 21 finished with value: 0.6470419422693695 and parameters: {'n_estimators': 2249, 'max_depth': 7, 'learning_rate': 0.01897261765499869, 'subsample': 0.6849676822403599, 'colsample_bytree': 0.46621711719701087, 'colsample_bylevel': 0.8010334186960392, 'colsample_bynode': 0.5301449235102703, 'min_child_weight': 15.66156699808287, 'gamma': 0.18834228677173898, 'reg_alpha': 1.4063607916622236e-08, 'reg_lambda': 7.506179058952641e-08, 'max_delta_step': 5.349586498658881, 'booster': 'dart'}. Best is trial 20 with value: 0.6328477423550998.[0m
[32m[I 2026-08-06 15:11:49,689][0m Trial 22 finished with value: 0.6407623141192864 and parameters: {'n_estimators': 2031, 'max_depth': 5, 'learning_rate': 0.06521913686290731, 'subsample': 0.6195633617226453, 'colsample_bytree': 0.5765252806385521, 'colsample_bylevel': 0.8207973423720654, 'colsample_bynode': 0.6626651180637461, 'min_child_weight': 9.048382586452009, 'gamma': 0.049754462491081564, 'reg_alpha': 0.004411087912383524, 'reg_lambda': 1.3837841334842782e-08, 'max_delta_step': 6.119160989219116, 'booster': 'dart'}. Best is trial 20 with value: 0.6328477423550998.[0m
[32m[I 2026-08-06 15:11:50,504][0m Trial 23 pruned. [0m
[32m[I 2026-08-06 15:11:52,677][0m Trial 24 pruned. [0m
[32m[I 2026-08-06 15:11:56,519][0m Trial 25 finished with value: 0.6529246110244206 and parameters: {'n_estimators': 2546, 'max_depth': 4, 'learning_rate': 0.05200841574448728, 'subsample': 0.6494001519950054, 'colsample_bytree': 0.7863531730080514, 'colsample_bylevel': 0.5871246701287336, 'colsample_bynode': 0.7081994569361755, 'min_child_weight': 17.97697893222341, 'gamma': 0.2687451245886048, 'reg_alpha': 0.001211601844696157, 'reg_lambda': 5.906085824399023e-08, 'max_delta_step': 4.729756748479786, 'booster': 'dart'}. Best is trial 20 with value: 0.6328477423550998.[0m
[32m[I 2026-08-06 15:11:58,852][0m Trial 26 pruned. [0m
[32m[I 2026-08-06 15:12:01,174][0m Trial 27 pruned. [0m
[32m[I 2026-08-06 15:12:01,987][0m Trial 28 pruned. [0m
[32m[I 2026-08-06 15:12:09,649][0m Trial 29 finished with value: 0.6286429760954205 and parameters: {'n_estimators': 1760, 'max_depth': 4, 'learning_rate': 0.013456337003765846, 'subsample': 0.6095437857997246, 'colsample_bytree': 0.3620781381138457, 'colsample_bylevel': 0.3822205574375524, 'colsample_bynode': 0.7936471581028587, 'min_child_weight': 1.7036753758227614, 'gamma': 0.04929165112465342, 'reg_alpha': 2.5800256068375636e-07, 'reg_lambda': 1.9481915969267106e-06, 'max_delta_step': 3.7382560451124145, 'booster': 'dart'}. Best is trial 29 with value: 0.6286429760954205.[0m
[32m[I 2026-08-06 15:12:16,335][0m Trial 30 finished with value: 0.6345327110904453 and parameters: {'n_estimators': 1697, 'max_depth': 5, 'learning_rate': 0.013322619071855566, 'subsample': 0.602245649629014, 'colsample_bytree': 0.32241918849069773, 'colsample_bylevel': 0.38448386634367565, 'colsample_bynode': 0.7569056654768931, 'min_child_weight': 1.9813291253906418, 'gamma': 0.18256442668899867, 'reg_alpha': 2.3622218645641626e-06, 'reg_lambda': 7.840192545707042e-05, 'max_delta_step': 4.330452506063862, 'booster': 'dart'}. Best is trial 29 with value: 0.6286429760954205.[0m
[32m[I 2026-08-06 15:12:19,080][0m Trial 31 pruned. [0m
[32m[I 2026-08-06 15:12:25,113][0m Trial 32 finished with value: 0.6329827406843294 and parameters: {'n_estimators': 1348, 'max_depth': 7, 'learning_rate': 0.015750551093166844, 'subsample': 0.6895851975135866, 'colsample_bytree': 0.37474769060064617, 'colsample_bylevel': 0.3665719577115939, 'colsample_bynode': 0.7836466595507474, 'min_child_weight': 1.8464647884197836, 'gamma': 0.0611215746897245, 'reg_alpha': 1.2630141791418438e-06, 'reg_lambda': 3.9388767442727774e-07, 'max_delta_step': 4.536272807834408, 'booster': 'dart'}. Best is trial 29 with value: 0.6286429760954205.[0m
[32m[I 2026-08-06 15:12:32,323][0m Trial 33 finished with value: 0.6490350742237991 and parameters: {'n_estimators': 1046, 'max_depth': 9, 'learning_rate': 0.010681176316356874, 'subsample': 0.6098838787098122, 'colsample_bytree': 0.40027135228877253, 'colsample_bylevel': 0.3033288894196122, 'colsample_bynode': 0.8991244269363735, 'min_child_weight': 1.1303318841980106, 'gamma': 0.2258020458762427, 'reg_alpha': 4.826730089001675e-08, 'reg_lambda': 4.318524593374729e-07, 'max_delta_step': 5.755302102246678, 'booster': 'dart'}. Best is trial 29 with value: 0.6286429760954205.[0m
[32m[I 2026-08-06 15:12:37,394][0m Trial 34 finished with value: 0.6309832590824207 and parameters: {'n_estimators': 1698, 'max_depth': 4, 'learning_rate': 0.029929583444507878, 'subsample': 0.6084922316494346, 'colsample_bytree': 0.3534371299908565, 'colsample_bylevel': 0.5975227095926812, 'colsample_bynode': 0.8651821054593115, 'min_child_weight': 3.936866520714627, 'gamma': 0.046146566983179205, 'reg_alpha': 2.5586995953268324e-06, 'reg_lambda': 0.001730343664418838, 'max_delta_step': 4.657518961699175, 'booster': 'gbtree'}. Best is trial 29 with value: 0.6286429760954205.[0m
[32m[I 2026-08-06 15:12:40,483][0m Trial 35 finished with value: 0.6407249561193205 and parameters: {'n_estimators': 1306, 'max_depth': 5, 'learning_rate': 0.037816655232624855, 'subsample': 0.6178085530826753, 'colsample_bytree': 0.36976124415429784, 'colsample_bylevel': 0.5788042039466916, 'colsample_bynode': 0.9292869364082539, 'min_child_weight': 2.830012716941222, 'gamma': 0.2491142289662243, 'reg_alpha': 1.6519369082747096e-07, 'reg_lambda': 0.019181036104071087, 'max_delta_step': 6.273701549115195, 'booster': 'gbtree'}. Best is trial 29 with value: 0.6286429760954205.[0m
[32m[I 2026-08-06 15:12:46,829][0m Trial 36 finished with value: 0.6265888789084934 and parameters: {'n_estimators': 1924, 'max_depth': 8, 'learning_rate': 0.03687923133923441, 'subsample': 0.6475213537422572, 'colsample_bytree': 0.3178237495203716, 'colsample_bylevel': 0.7606445399745864, 'colsample_bynode': 0.5177431884118521, 'min_child_weight': 4.446651276345701, 'gamma': 0.002114899840478572, 'reg_alpha': 0.00020368407985517614, 'reg_lambda': 5.778761410365726e-08, 'max_delta_step': 2.1444041027699927, 'booster': 'dart'}. Best is trial 36 with value: 0.6265888789084934.[0m
[32m[I 2026-08-06 15:12:48,091][0m Trial 37 pruned. [0m
[32m[I 2026-08-06 15:12:49,650][0m Trial 38 pruned. [0m
[32m[I 2026-08-06 15:12:50,958][0m Trial 39 pruned. [0m
[32m[I 2026-08-06 15:12:54,131][0m Trial 40 pruned. [0m
[32m[I 2026-08-06 15:12:55,713][0m Trial 41 pruned. [0m
[32m[I 2026-08-06 15:12:59,042][0m Trial 42 pruned. [0m
[32m[I 2026-08-06 15:13:05,552][0m Trial 43 finished with value: 0.647625264116591 and parameters: {'n_estimators': 2350, 'max_depth': 8, 'learning_rate': 0.022288001295238946, 'subsample': 0.6186487071684146, 'colsample_bytree': 0.32280472995641957, 'colsample_bylevel': 0.7463257420514209, 'colsample_bynode': 0.6497957235804508, 'min_child_weight': 11.909041158672007, 'gamma': 0.20708363486500767, 'reg_alpha': 0.0028472729145738104, 'reg_lambda': 1.3658819038686988e-08, 'max_delta_step': 2.8955145469346086, 'booster': 'dart'}. Best is trial 36 with value: 0.6265888789084934.[0m
[32m[I 2026-08-06 15:13:07,816][0m Trial 44 pruned. [0m
[32m[I 2026-08-06 15:13:13,924][0m Trial 45 finished with value: 0.6450730583288629 and parameters: {'n_estimators': 1370, 'max_depth': 5, 'learning_rate': 0.05454845181217917, 'subsample': 0.6651370726353585, 'colsample_bytree': 0.4049618612484391, 'colsample_bylevel': 0.9288515207150796, 'colsample_bynode': 0.5226875203061458, 'min_child_weight': 25.68164685478203, 'gamma': 0.03207375355579034, 'reg_alpha': 2.33523345665471e-05, 'reg_lambda': 1.5010106296382253e-05, 'max_delta_step': 6.732174599038335, 'booster': 'dart'}. Best is trial 36 with value: 0.6265888789084934.[0m
[32m[I 2026-08-06 15:13:22,688][0m Trial 46 finished with value: 0.6257517583802766 and parameters: {'n_estimators': 1583, 'max_depth': 5, 'learning_rate': 0.01128153495238336, 'subsample': 0.7666387335395268, 'colsample_bytree': 0.3376700563681182, 'colsample_bylevel': 0.3648270669830612, 'colsample_bynode': 0.9875173233294319, 'min_child_weight': 1.3336777583096906, 'gamma': 0.03720869086895046, 'reg_alpha': 4.29975383703513e-08, 'reg_lambda': 3.3646815277433154e-07, 'max_delta_step': 2.0536306603092385, 'booster': 'dart'}. Best is trial 46 with value: 0.6257517583802766.[0m
[32m[I 2026-08-06 15:13:29,784][0m Trial 47 finished with value: 0.6220440534441585 and parameters: {'n_estimators': 1947, 'max_depth': 5, 'learning_rate': 0.01433934047018185, 'subsample': 0.7758462818445409, 'colsample_bytree': 0.5119469977770736, 'colsample_bylevel': 0.3041411661050307, 'colsample_bynode': 0.9275738992194434, 'min_child_weight': 1.123460013710274, 'gamma': 0.06012615725246029, 'reg_alpha': 1.6493250225591283e-06, 'reg_lambda': 1.5286963362141542e-06, 'max_delta_step': 3.6981008637702897, 'booster': 'dart'}. Best is trial 47 with value: 0.6220440534441585.[0m
[32m[I 2026-08-06 15:13:31,850][0m Trial 48 pruned. [0m
[32m[I 2026-08-06 15:13:35,097][0m Trial 49 pruned. [0m
[32m[I 2026-08-06 15:13:42,727][0m Trial 50 finished with value: 0.6418169975040697 and parameters: {'n_estimators': 2356, 'max_depth': 6, 'learning_rate': 0.010270521634909364, 'subsample': 0.7245166415473803, 'colsample_bytree': 0.6235185175663689, 'colsample_bylevel': 0.37517726029132775, 'colsample_bynode': 0.9347599808458861, 'min_child_weight': 1.4304083305943434, 'gamma': 0.18665070487787278, 'reg_alpha': 5.873904633521973e-08, 'reg_lambda': 1.7710663639880508e-07, 'max_delta_step': 3.42486826853909, 'booster': 'dart'}. Best is trial 47 with value: 0.6220440534441585.[0m
[32m[I 2026-08-06 15:13:50,378][0m Trial 51 finished with value: 0.6312047509323009 and parameters: {'n_estimators': 1204, 'max_depth': 6, 'learning_rate': 0.011217553983899517, 'subsample': 0.7478996491917536, 'colsample_bytree': 0.31339763839981294, 'colsample_bylevel': 0.3179994680052286, 'colsample_bynode': 0.9267258931265885, 'min_child_weight': 1.577368665112787, 'gamma': 0.060083997574294556, 'reg_alpha': 1.606207333121672e-08, 'reg_lambda': 1.9408554340223963e-07, 'max_delta_step': 1.9504699240450223, 'booster': 'dart'}. Best is trial 47 with value: 0.6220440534441585.[0m
[32m[I 2026-08-06 15:13:52,705][0m Trial 52 pruned. [0m
[32m[I 2026-08-06 15:13:59,928][0m Trial 53 finished with value: 0.6333678722667562 and parameters: {'n_estimators': 1025, 'max_depth': 5, 'learning_rate': 0.010737136892226712, 'subsample': 0.8263403312739733, 'colsample_bytree': 0.34435497862395487, 'colsample_bylevel': 0.5098953125316626, 'colsample_bynode': 0.8871878886144059, 'min_child_weight': 1.266711346308186, 'gamma': 0.07217297768446859, 'reg_alpha': 6.407733447948238e-08, 'reg_lambda': 3.857314117017208e-07, 'max_delta_step': 1.5532557936761897, 'booster': 'gbtree'}. Best is trial 47 with value: 0.6220440534441585.[0m
[32m[I 2026-08-06 15:14:01,674][0m Trial 54 pruned. [0m
[32m[I 2026-08-06 15:14:05,697][0m Trial 55 finished with value: 0.6615502393006713 and parameters: {'n_estimators': 2424, 'max_depth': 6, 'learning_rate': 0.017733734706463607, 'subsample': 0.9379525772844687, 'colsample_bytree': 0.4815421917840761, 'colsample_bylevel': 0.33500463778474004, 'colsample_bynode': 0.9645101523675667, 'min_child_weight': 1.7607214957699566, 'gamma': 0.3795128819050665, 'reg_alpha': 0.0005127548998667663, 'reg_lambda': 0.00011471926043221496, 'max_delta_step': 5.190088776817717, 'booster': 'dart'}. Best is trial 47 with value: 0.6220440534441585.[0m
[32m[I 2026-08-06 15:14:08,781][0m Trial 56 finished with value: 0.6360682989498859 and parameters: {'n_estimators': 1954, 'max_depth': 5, 'learning_rate': 0.04210090370001794, 'subsample': 0.6470482279588525, 'colsample_bytree': 0.4261521582830473, 'colsample_bylevel': 0.6679733711664113, 'colsample_bynode': 0.7853534968481758, 'min_child_weight': 4.098343256715235, 'gamma': 0.10053082101659926, 'reg_alpha': 1.6195596965804382e-05, 'reg_lambda': 0.004895117038606064, 'max_delta_step': 5.934516177806866, 'booster': 'dart'}. Best is trial 47 with value: 0.6220440534441585.[0m
[32m[I 2026-08-06 15:14:15,083][0m Trial 57 finished with value: 0.6453008438558072 and parameters: {'n_estimators': 962, 'max_depth': 8, 'learning_rate': 0.012093854514203754, 'subsample': 0.8344099729049356, 'colsample_bytree': 0.30829900500789587, 'colsample_bylevel': 0.34152592508701834, 'colsample_bynode': 0.9016599815149239, 'min_child_weight': 6.594610667211124, 'gamma': 0.1169940631725786, 'reg_alpha': 1.609969735625874e-08, 'reg_lambda': 1.3806601092745271e-07, 'max_delta_step': 3.8413351725770637, 'booster': 'dart'}. Best is trial 47 with value: 0.6220440534441585.[0m
