[32m[I 2026-08-05 18:08:22,486][0m Trial 20 finished with value: 1.1015200272732728 and parameters: {'boosting_type': 'gbdt', 'max_depth': 9, 'num_leaves': 187, 'learning_rate': 0.13995420670982156, 'n_estimators': 2051, 'subsample': 0.7244278109981884, 'subsample_freq': 1, 'colsample_bytree': 0.8096177712966243, 'reg_alpha': 1.8382256948277592e-07, 'reg_lambda': 0.018488016147772388, 'min_child_samples': 19, 'min_child_weight': 0.011025275373538774, 'min_split_gain': 0.1512967559959651, 'cat_smooth': 0.7390602587342983, 'cat_l2': 16.497209182929307}. Best is trial 16 with value: 1.096474735387548.[0m
Training until validation scores don't improve for 30 rounds
Early stopping, best iteration is:
[405]	valid_0's rmse: 1.24958	valid_0's l2: 1.56146
Training until validation scores don't improve for 30 rounds
Early stopping, best iteration is:
[134]	valid_0's rmse: 0.854113	valid_0's l2: 0.729509
Training until validation scores don't improve for 30 rounds
Early stopping, best iteration is:
[186]	valid_0's rmse: 0.824172	valid_0's l2: 0.67926
Training until validation scores don't improve for 30 rounds
Early stopping, best iteration is:
[324]	valid_0's rmse: 1.01358	valid_0's l2: 1.02735
Training until validation scores don't improve for 30 rounds
Early stopping, best iteration is:
[582]	valid_0's rmse: 1.54597	valid_0's l2: 2.39004
[32m[I 2026-08-05 18:08:23,528][0m Trial 21 finished with value: 1.0974850163991074 and parameters: {'boosting_type': 'gbdt', 'max_depth': 7, 'num_leaves': 117, 'learning_rate': 0.08845224907987494, 'n_estimators': 2966, 'subsample': 0.7615436458378084, 'subsample_freq': 1, 'colsample_bytree': 0.9942730338963112, 'reg_alpha': 8.949149514717717e-05, 'reg_lambda': 6.340641853085031e-05, 'min_child_samples': 28, 'min_child_weight': 0.03770358266944567, 'min_split_gain': 0.005079886983433701, 'cat_smooth': 41.99192280908066, 'cat_l2': 19.625059318650298}. Best is trial 16 with value: 1.096474735387548.[0m
Training until validation scores don't improve for 30 rounds
Early stopping, best iteration is:
[547]	valid_0's rmse: 1.27457	valid_0's l2: 1.62454
Training until validation scores don't improve for 30 rounds
Early stopping, best iteration is:
[125]	valid_0's rmse: 0.904934	valid_0's l2: 0.818905
Training until validation scores don't improve for 30 rounds
Early stopping, best iteration is:
[65]	valid_0's rmse: 0.866243	valid_0's l2: 0.750376
[32m[I 2026-08-05 18:08:23,921][0m Trial 22 pruned. [0m
Training until validation scores don't improve for 30 rounds
Early stopping, best iteration is:
[249]	valid_0's rmse: 1.26436	valid_0's l2: 1.59862
Training until validation scores don't improve for 30 rounds
Early stopping, best iteration is:
[150]	valid_0's rmse: 0.865842	valid_0's l2: 0.749683
Training until validation scores don't improve for 30 rounds
Early stopping, best iteration is:
[37]	valid_0's rmse: 0.829676	valid_0's l2: 0.688362
Training until validation scores don't improve for 30 rounds
Early stopping, best iteration is:
[175]	valid_0's rmse: 1.07492	valid_0's l2: 1.15544
Training until validation scores don't improve for 30 rounds
Early stopping, best iteration is:
[651]	valid_0's rmse: 1.60476	valid_0's l2: 2.57526
[32m[I 2026-08-05 18:08:24,534][0m Trial 23 finished with value: 1.1279117928644322 and parameters: {'boosting_type': 'gbdt', 'max_depth': 6, 'num_leaves': 26, 'learning_rate': 0.07933027011216644, 'n_estimators': 2850, 'subsample': 0.6681903311418118, 'subsample_freq': 1, 'colsample_bytree': 0.9415252716162845, 'reg_alpha': 1.613284781580433e-06, 'reg_lambda': 1.4923658090892365e-05, 'min_child_samples': 28, 'min_child_weight': 0.00773802956639431, 'min_split_gain': 0.20634701620186813, 'cat_smooth': 49.59456895412946, 'cat_l2': 15.5236453483252}. Best is trial 16 with value: 1.096474735387548.[0m
Training until validation scores don't improve for 30 rounds
Early stopping, best iteration is:
[214]	valid_0's rmse: 1.20758	valid_0's l2: 1.45826
Training until validation scores don't improve for 30 rounds
Early stopping, best iteration is:
[12]	valid_0's rmse: 0.932271	valid_0's l2: 0.86913
Training until validation scores don't improve for 30 rounds
Early stopping, best iteration is:
[11]	valid_0's rmse: 0.844986	valid_0's l2: 0.714002
Training until validation scores don't improve for 30 rounds
Early stopping, best iteration is:
[102]	valid_0's rmse: 1.05877	valid_0's l2: 1.121
Training until validation scores don't improve for 30 rounds
Early stopping, best iteration is:
[138]	valid_0's rmse: 1.49036	valid_0's l2: 2.22116
[32m[I 2026-08-05 18:08:25,033][0m Trial 24 finished with value: 1.1067934672093231 and parameters: {'boosting_type': 'gbdt', 'max_depth': 7, 'num_leaves': 182, 'learning_rate': 0.17362595401762906, 'n_estimators': 2998, 'subsample': 0.7834253193294518, 'subsample_freq': 3, 'colsample_bytree': 0.836579867861458, 'reg_alpha': 7.861376060648176e-05, 'reg_lambda': 0.0009248221213693971, 'min_child_samples': 14, 'min_child_weight': 0.03564193855915256, 'min_split_gain': 0.02061848614014045, 'cat_smooth': 29.33151808939193, 'cat_l2': 27.724585308949905}. Best is trial 16 with value: 1.096474735387548.[0m
Training until validation scores don't improve for 30 rounds
Early stopping, best iteration is:
[862]	valid_0's rmse: 1.25819	valid_0's l2: 1.58303
Training until validation scores don't improve for 30 rounds
Early stopping, best iteration is:
[204]	valid_0's rmse: 0.865016	valid_0's l2: 0.748252
Training until validation scores don't improve for 30 rounds
Early stopping, best iteration is:
[77]	valid_0's rmse: 0.84159	valid_0's l2: 0.708274
Training until validation scores don't improve for 30 rounds
Early stopping, best iteration is:
[333]	valid_0's rmse: 1.06585	valid_0's l2: 1.13604
Training until validation scores don't improve for 30 rounds
Early stopping, best iteration is:
[672]	valid_0's rmse: 1.66785	valid_0's l2: 2.78172
[32m[I 2026-08-05 18:08:26,193][0m Trial 25 finished with value: 1.1396993101235737 and parameters: {'boosting_type': 'gbdt', 'max_depth': 10, 'num_leaves': 140, 'learning_rate': 0.029141193458984947, 'n_estimators': 2579, 'subsample': 0.7568564231857045, 'subsample_freq': 2, 'colsample_bytree': 0.9422871495529225, 'reg_alpha': 7.65321888916174e-08, 'reg_lambda': 8.272767057938339e-06, 'min_child_samples': 29, 'min_child_weight': 0.00541388110726104, 'min_split_gain': 0.12753624075025333, 'cat_smooth': 40.46161604120251, 'cat_l2': 17.335263513565263}. Best is trial 16 with value: 1.096474735387548.[0m
[32m[I 2026-08-05 18:08:31,997][0m Trial 26 pruned. [0m
Training until validation scores don't improve for 30 rounds
Early stopping, best iteration is:
[325]	valid_0's rmse: 1.24716	valid_0's l2: 1.55541
Training until validation scores don't improve for 30 rounds
Early stopping, best iteration is:
[24]	valid_0's rmse: 0.941603	valid_0's l2: 0.886617
[32m[I 2026-08-05 18:08:32,285][0m Trial 27 pruned. [0m
Training until validation scores don't improve for 30 rounds
Early stopping, best iteration is:
[529]	valid_0's rmse: 1.25043	valid_0's l2: 1.56357
Training until validation scores don't improve for 30 rounds
Early stopping, best iteration is:
[188]	valid_0's rmse: 0.883271	valid_0's l2: 0.780168
Training until validation scores don't improve for 30 rounds
Early stopping, best iteration is:
[73]	valid_0's rmse: 0.804567	valid_0's l2: 0.647328
Training until validation scores don't improve for 30 rounds
Early stopping, best iteration is:
[293]	valid_0's rmse: 1.04182	valid_0's l2: 1.08539
Training until validation scores don't improve for 30 rounds
Early stopping, best iteration is:
[574]	valid_0's rmse: 1.58715	valid_0's l2: 2.51904
[32m[I 2026-08-05 18:08:33,128][0m Trial 28 finished with value: 1.1134466981315974 and parameters: {'boosting_type': 'gbdt', 'max_depth': 10, 'num_leaves': 43, 'learning_rate': 0.06004198330684274, 'n_estimators': 2758, 'subsample': 0.7297941645661415, 'subsample_freq': 2, 'colsample_bytree': 0.920874004540803, 'reg_alpha': 0.0013876673459018675, 'reg_lambda': 0.004769934911591878, 'min_child_samples': 27, 'min_child_weight': 0.01264726882157363, 'min_split_gain': 0.1588355137064109, 'cat_smooth': 35.07612540371271, 'cat_l2': 28.3903905308147}. Best is trial 16 with value: 1.096474735387548.[0m
[32m[I 2026-08-05 18:08:48,649][0m Trial 29 pruned. [0m
Training until validation scores don't improve for 30 rounds
Early stopping, best iteration is:
[337]	valid_0's rmse: 1.23369	valid_0's l2: 1.52198
Training until validation scores don't improve for 30 rounds
Early stopping, best iteration is:
[68]	valid_0's rmse: 0.91662	valid_0's l2: 0.840192
Training until validation scores don't improve for 30 rounds
Early stopping, best iteration is:
[33]	valid_0's rmse: 0.825876	valid_0's l2: 0.68207
Training until validation scores don't improve for 30 rounds
Early stopping, best iteration is:
[119]	valid_0's rmse: 1.07293	valid_0's l2: 1.15119
Training until validation scores don't improve for 30 rounds
Early stopping, best iteration is:
[204]	valid_0's rmse: 1.68168	valid_0's l2: 2.82805
[32m[I 2026-08-05 18:08:49,177][0m Trial 30 finished with value: 1.146159751206898 and parameters: {'boosting_type': 'gbdt', 'max_depth': 7, 'num_leaves': 175, 'learning_rate': 0.24385313592137722, 'n_estimators': 2473, 'subsample': 0.8138161130402685, 'subsample_freq': 1, 'colsample_bytree': 0.9900616150760317, 'reg_alpha': 1.089412821525953e-06, 'reg_lambda': 0.0005761355802400696, 'min_child_samples': 50, 'min_child_weight': 0.09417352111885059, 'min_split_gain': 0.06965579644672344, 'cat_smooth': 21.130747969930628, 'cat_l2': 10.230904196213706}. Best is trial 16 with value: 1.096474735387548.[0m
Training until validation scores don't improve for 30 rounds
Early stopping, best iteration is:
[255]	valid_0's rmse: 1.27038	valid_0's l2: 1.61388
Training until validation scores don't improve for 30 rounds
Early stopping, best iteration is:
[90]	valid_0's rmse: 0.849606	valid_0's l2: 0.72183
Training until validation scores don't improve for 30 rounds
Early stopping, best iteration is:
[37]	valid_0's rmse: 0.83942	valid_0's l2: 0.704627
Training until validation scores don't improve for 30 rounds
Early stopping, best iteration is:
[255]	valid_0's rmse: 1.00856	valid_0's l2: 1.01718
Training until validation scores don't improve for 30 rounds
Early stopping, best iteration is:
[463]	valid_0's rmse: 1.52776	valid_0's l2: 2.33404
[32m[I 2026-08-05 18:08:50,178][0m Trial 31 finished with value: 1.0991447296195287 and parameters: {'boosting_type': 'gbdt', 'max_depth': 8, 'num_leaves': 120, 'learning_rate': 0.10323653209180646, 'n_estimators': 2728, 'subsample': 0.7677623478824881, 'subsample_freq': 1, 'colsample_bytree': 0.9975373331636674, 'reg_alpha': 0.0001988494718526918, 'reg_lambda': 2.908779058824801e-05, 'min_child_samples': 28, 'min_child_weight': 0.023325316933187932, 'min_split_gain': 0.023670203871090114, 'cat_smooth': 47.05377578781035, 'cat_l2': 21.533527592707404}. Best is trial 16 with value: 1.096474735387548.[0m
Training until validation scores don't improve for 30 rounds
Early stopping, best iteration is:
[216]	valid_0's rmse: 1.24301	valid_0's l2: 1.54507
Training until validation scores don't improve for 30 rounds
Early stopping, best iteration is:
[38]	valid_0's rmse: 0.875676	valid_0's l2: 0.766808
Training until validation scores don't improve for 30 rounds
Early stopping, best iteration is:
[28]	valid_0's rmse: 0.816981	valid_0's l2: 0.667458
Training until validation scores don't improve for 30 rounds
Early stopping, best iteration is:
[96]	valid_0's rmse: 1.1171	valid_0's l2: 1.24792
Training until validation scores don't improve for 30 rounds
Early stopping, best iteration is:
[292]	valid_0's rmse: 1.55644	valid_0's l2: 2.42252
[32m[I 2026-08-05 18:08:50,903][0m Trial 32 finished with value: 1.1218421352854464 and parameters: {'boosting_type': 'gbdt', 'max_depth': 8, 'num_leaves': 91, 'learning_rate': 0.0909773808823306, 'n_estimators': 2804, 'subsample': 0.7601823164087086, 'subsample_freq': 2, 'colsample_bytree': 0.8662034362731029, 'reg_alpha': 0.000505939226793796, 'reg_lambda': 7.865949881679479e-05, 'min_child_samples': 22, 'min_child_weight': 0.02827468374445778, 'min_split_gain': 0.05538231933812554, 'cat_smooth': 43.56976690324331, 'cat_l2': 24.7386374209403}. Best is trial 16 with value: 1.096474735387548.[0m
Training until validation scores don't improve for 30 rounds
Early stopping, best iteration is:
[288]	valid_0's rmse: 1.26625	valid_0's l2: 1.60338
Training until validation scores don't improve for 30 rounds
Early stopping, best iteration is:
[95]	valid_0's rmse: 0.899798	valid_0's l2: 0.809637
[32m[I 2026-08-05 18:08:51,229][0m Trial 33 pruned. [0m
[32m[I 2026-08-05 18:08:53,302][0m Trial 34 pruned. [0m
Training until validation scores don't improve for 30 rounds
Early stopping, best iteration is:
[378]	valid_0's rmse: 1.25639	valid_0's l2: 1.5785
Training until validation scores don't improve for 30 rounds
Early stopping, best iteration is:
[85]	valid_0's rmse: 0.868365	valid_0's l2: 0.754057
Training until validation scores don't improve for 30 rounds
Early stopping, best iteration is:
[152]	valid_0's rmse: 0.808212	valid_0's l2: 0.653207
Training until validation scores don't improve for 30 rounds
Early stopping, best iteration is:
[234]	valid_0's rmse: 1.04961	valid_0's l2: 1.10169
Training until validation scores don't improve for 30 rounds
Early stopping, best iteration is:
[723]	valid_0's rmse: 1.51999	valid_0's l2: 2.31036
[32m[I 2026-08-05 18:08:54,338][0m Trial 35 finished with value: 1.1005120057258089 and parameters: {'boosting_type': 'gbdt', 'max_depth': 11, 'num_leaves': 145, 'learning_rate': 0.0645062380035791, 'n_estimators': 2998, 'subsample': 0.8896612351944133, 'subsample_freq': 3, 'colsample_bytree': 0.842804923282351, 'reg_alpha': 5.130330374321736e-06, 'reg_lambda': 4.812875019260239e-07, 'min_child_samples': 32, 'min_child_weight': 0.005433796267558423, 'min_split_gain': 0.07188179304815222, 'cat_smooth': 41.0546015428838, 'cat_l2': 26.093631987307322}. Best is trial 16 with value: 1.096474735387548.[0m
Training until validation scores don't improve for 30 rounds
Early stopping, best iteration is:
[400]	valid_0's rmse: 1.25141	valid_0's l2: 1.56602
Training until validation scores don't improve for 30 rounds
Early stopping, best iteration is:
[119]	valid_0's rmse: 0.902395	valid_0's l2: 0.814317
Training until validation scores don't improve for 30 rounds
Early stopping, best iteration is:
[80]	valid_0's rmse: 0.84607	valid_0's l2: 0.715835
Training until validation scores don't improve for 30 rounds
Early stopping, best iteration is:
[30]	valid_0's rmse: 1.17252	valid_0's l2: 1.37481
Training until validation scores don't improve for 30 rounds
Early stopping, best iteration is:
[601]	valid_0's rmse: 1.51641	valid_0's l2: 2.29949
[32m[I 2026-08-05 18:08:55,177][0m Trial 36 finished with value: 1.1377607622303472 and parameters: {'boosting_type': 'gbdt', 'max_depth': 5, 'num_leaves': 111, 'learning_rate': 0.05175504007352375, 'n_estimators': 2501, 'subsample': 0.7336214248768923, 'subsample_freq': 1, 'colsample_bytree': 0.6652958486186767, 'reg_alpha': 6.267799441529853e-08, 'reg_lambda': 2.095599468900248e-05, 'min_child_samples': 15, 'min_child_weight': 0.01773607060770097, 'min_split_gain': 0.07560104121207105, 'cat_smooth': 49.52867367412647, 'cat_l2': 14.033733793650791}. Best is trial 16 with value: 1.096474735387548.[0m
Training until validation scores don't improve for 30 rounds
Early stopping, best iteration is:
[657]	valid_0's rmse: 1.34487	valid_0's l2: 1.80869
Training until validation scores don't improve for 30 rounds
Early stopping, best iteration is:
[309]	valid_0's rmse: 0.965001	valid_0's l2: 0.931227
[32m[I 2026-08-05 18:08:55,653][0m Trial 37 pruned. [0m
[32m[I 2026-08-05 18:09:00,333][0m Trial 38 pruned. [0m
Training until validation scores don't improve for 30 rounds
Early stopping, best iteration is:
[174]	valid_0's rmse: 1.23956	valid_0's l2: 1.53651
Training until validation scores don't improve for 30 rounds
Early stopping, best iteration is:
[55]	valid_0's rmse: 0.89727	valid_0's l2: 0.805094
Training until validation scores don't improve for 30 rounds
Early stopping, best iteration is:
[21]	valid_0's rmse: 0.827387	valid_0's l2: 0.684569
Training until validation scores don't improve for 30 rounds
Early stopping, best iteration is:
[105]	valid_0's rmse: 1.04754	valid_0's l2: 1.09734
Training until validation scores don't improve for 30 rounds
Early stopping, best iteration is:
[95]	valid_0's rmse: 1.70594	valid_0's l2: 2.91022
[32m[I 2026-08-05 18:09:00,876][0m Trial 39 finished with value: 1.143538421137726 and parameters: {'boosting_type': 'gbdt', 'max_depth': 13, 'num_leaves': 239, 'learning_rate': 0.17886610313362292, 'n_estimators': 2855, 'subsample': 0.6212818029183123, 'subsample_freq': 3, 'colsample_bytree': 0.7139253655976486, 'reg_alpha': 0.01568577164097, 'reg_lambda': 1.0552414539585036e-08, 'min_child_samples': 26, 'min_child_weight': 0.05301473667620194, 'min_split_gain': 0.11279909182754688, 'cat_smooth': 29.498439217147617, 'cat_l2': 19.49840791072143}. Best is trial 16 with value: 1.096474735387548.[0m
[32m[I 2026-08-05 18:09:04,230][0m Trial 40 pruned. [0m
Training until validation scores don't improve for 30 rounds
Early stopping, best iteration is:
[255]	valid_0's rmse: 1.25444	valid_0's l2: 1.57363
Training until validation scores don't improve for 30 rounds
Early stopping, best iteration is:
[56]	valid_0's rmse: 0.83599	valid_0's l2: 0.698879
Training until validation scores don't improve for 30 rounds
Early stopping, best iteration is:
[40]	valid_0's rmse: 0.791479	valid_0's l2: 0.626439
Training until validation scores don't improve for 30 rounds
Early stopping, best iteration is:
[268]	valid_0's rmse: 1.05154	valid_0's l2: 1.10574
Training until validation scores don't improve for 30 rounds
Early stopping, best iteration is:
[463]	valid_0's rmse: 1.49888	valid_0's l2: 2.24664
[32m[I 2026-08-05 18:09:05,185][0m Trial 41 finished with value: 1.0864663909464547 and parameters: {'boosting_type': 'gbdt', 'max_depth': 8, 'num_leaves': 126, 'learning_rate': 0.09445940046890143, 'n_estimators': 2736, 'subsample': 0.7720438365825305, 'subsample_freq': 1, 'colsample_bytree': 0.9812723909363967, 'reg_alpha': 0.0003334442223559278, 'reg_lambda': 2.9234418208278888e-05, 'min_child_samples': 25, 'min_child_weight': 0.02378328694617151, 'min_split_gain': 0.048300856136155035, 'cat_smooth': 47.28237971898103, 'cat_l2': 21.699865130582026}. Best is trial 41 with value: 1.0864663909464547.[0m
Training until validation scores don't improve for 30 rounds
Early stopping, best iteration is:
[312]	valid_0's rmse: 1.26441	valid_0's l2: 1.59873
Training until validation scores don't improve for 30 rounds
Early stopping, best iteration is:
[32]	valid_0's rmse: 0.984234	valid_0's l2: 0.968717
[32m[I 2026-08-05 18:09:05,621][0m Trial 42 pruned. [0m
Training until validation scores don't improve for 30 rounds
Early stopping, best iteration is:
[176]	valid_0's rmse: 1.3025	valid_0's l2: 1.69651
Training until validation scores don't improve for 30 rounds
Early stopping, best iteration is:
[64]	valid_0's rmse: 0.898711	valid_0's l2: 0.807681
[32m[I 2026-08-05 18:09:05,936][0m Trial 43 pruned. [0m
Training until validation scores don't improve for 30 rounds
Early stopping, best iteration is:
[219]	valid_0's rmse: 1.26782	valid_0's l2: 1.60737
Training until validation scores don't improve for 30 rounds
Early stopping, best iteration is:
[49]	valid_0's rmse: 0.873937	valid_0's l2: 0.763766
Training until validation scores don't improve for 30 rounds
Early stopping, best iteration is:
[28]	valid_0's rmse: 0.785233	valid_0's l2: 0.616591
Training until validation scores don't improve for 30 rounds
Early stopping, best iteration is:
[218]	valid_0's rmse: 1.04255	valid_0's l2: 1.0869
Training until validation scores don't improve for 30 rounds
Early stopping, best iteration is:
[448]	valid_0's rmse: 1.51033	valid_0's l2: 2.28109
[32m[I 2026-08-05 18:09:06,698][0m Trial 44 finished with value: 1.0959735571800882 and parameters: {'boosting_type': 'gbdt', 'max_depth': 9, 'num_leaves': 151, 'learning_rate': 0.1231681948357338, 'n_estimators': 2392, 'subsample': 0.7718047492375901, 'subsample_freq': 2, 'colsample_bytree': 0.9751987358609565, 'reg_alpha': 0.004590871310633516, 'reg_lambda': 4.4829902770213e-05, 'min_child_samples': 25, 'min_child_weight': 0.06398083087818034, 'min_split_gain': 0.06174922676564267, 'cat_smooth': 48.1583731565419, 'cat_l2': 25.103867979702304}. Best is trial 41 with value: 1.0864663909464547.[0m
Training until validation scores don't improve for 30 rounds
Early stopping, best iteration is:
[175]	valid_0's rmse: 1.23197	valid_0's l2: 1.51776
Training until validation scores don't improve for 30 rounds
Early stopping, best iteration is:
[93]	valid_0's rmse: 0.893953	valid_0's l2: 0.799152
Training until validation scores don't improve for 30 rounds
Early stopping, best iteration is:
[53]	valid_0's rmse: 0.826758	valid_0's l2: 0.683529
Training until validation scores don't improve for 30 rounds
Early stopping, best iteration is:
[144]	valid_0's rmse: 1.06614	valid_0's l2: 1.13665
Training until validation scores don't improve for 30 rounds
Early stopping, best iteration is:
[280]	valid_0's rmse: 1.55478	valid_0's l2: 2.41735
