============================================================
lightgbm — 运行开始  20260805_180756
  输出目录:  runs\Gamma_max\Gamma_max_lightgbm_20260805_180756
============================================================
============================================================
LightGBM + PharmHGT-style Featurization for Gamma_max Prediction
============================================================
[Cache HIT] Loading features from data\features\surfpro\Gamma_max
  Train features: (628, 522)
  Test features:  (70, 522)

Split: Train 549, Val 79, Test 70

============================================================
Optuna Hyperparameter Tuning (50 trials, 5-Fold CV)
============================================================
[32m[I 2026-08-05 18:07:58,397][0m Trial 0 finished with value: 2.009971272597043 and parameters: {'boosting_type': 'dart', 'max_depth': 12, 'num_leaves': 159, 'learning_rate': 0.009470976192691145, 'n_estimators': 890, 'subsample': 0.5290418060840998, 'subsample_freq': 9, 'colsample_bytree': 0.7207805082202461, 'reg_alpha': 0.023585940584142682, 'reg_lambda': 1.5320059381854043e-08, 'min_child_samples': 98, 'min_child_weight': 0.021368329072358756, 'min_split_gain': 0.21233911067827616, 'cat_smooth': 9.091248360355031, 'cat_l2': 9.17022549267169, 'drop_rate': 0.09823025045826593, 'max_drop': 27, 'skip_drop': 0.13526405540621358}. Best is trial 0 with value: 2.009971272597043.[0m
[32m[I 2026-08-05 18:08:04,416][0m Trial 1 finished with value: 1.4151086003695774 and parameters: {'boosting_type': 'dart', 'max_depth': 4, 'num_leaves': 85, 'learning_rate': 0.02240870575939826, 'n_estimators': 1640, 'subsample': 0.8925879806965068, 'subsample_freq': 2, 'colsample_bytree': 0.6599641068895281, 'reg_alpha': 0.0021465011216654484, 'reg_lambda': 2.6185068507773707e-08, 'min_child_samples': 63, 'min_child_weight': 4.809461967501571e-05, 'min_split_gain': 0.06505159298527952, 'cat_smooth': 47.44427686266666, 'cat_l2': 48.28160165372797, 'drop_rate': 0.24443523095377373, 'max_drop': 16, 'skip_drop': 0.03832491306185132}. Best is trial 1 with value: 1.4151086003695774.[0m
Training until validation scores don't improve for 30 rounds
Early stopping, best iteration is:
[1085]	valid_0's rmse: 1.42358	valid_0's l2: 2.02659
Training until validation scores don't improve for 30 rounds
Early stopping, best iteration is:
[785]	valid_0's rmse: 0.889356	valid_0's l2: 0.790955
Training until validation scores don't improve for 30 rounds
Early stopping, best iteration is:
[283]	valid_0's rmse: 0.852184	valid_0's l2: 0.726217
Training until validation scores don't improve for 30 rounds
Early stopping, best iteration is:
[379]	valid_0's rmse: 1.16875	valid_0's l2: 1.36597
Training until validation scores don't improve for 30 rounds
Early stopping, best iteration is:
[1056]	valid_0's rmse: 1.78427	valid_0's l2: 3.18362
[32m[I 2026-08-05 18:08:06,173][0m Trial 2 finished with value: 1.223628279228481 and parameters: {'boosting_type': 'gbdt', 'max_depth': 4, 'num_leaves': 134, 'learning_rate': 0.005755963034165359, 'n_estimators': 2774, 'subsample': 0.6293899908000085, 'subsample_freq': 7, 'colsample_bytree': 0.5181977532625877, 'reg_alpha': 0.0004793052550782129, 'reg_lambda': 0.0008325158565947976, 'min_child_samples': 22, 'min_child_weight': 0.07556810141274425, 'min_split_gain': 0.7751328233611146, 'cat_smooth': 46.97494707820945, 'cat_l2': 44.74136752138244}. Best is trial 2 with value: 1.223628279228481.[0m
[32m[I 2026-08-05 18:08:09,434][0m Trial 3 finished with value: 1.947906327567291 and parameters: {'boosting_type': 'dart', 'max_depth': 4, 'num_leaves': 62, 'learning_rate': 0.006017151754328819, 'n_estimators': 1313, 'subsample': 0.6943386448447411, 'subsample_freq': 3, 'colsample_bytree': 0.8801162564063505, 'reg_alpha': 1.6247252885719427e-05, 'reg_lambda': 3.376063348877853e-06, 'min_child_samples': 57, 'min_child_weight': 3.661819220392426e-05, 'min_split_gain': 0.8021969807540397, 'cat_smooth': 3.727532183988541, 'cat_l2': 49.34434683002586, 'drop_rate': 0.23395098309603066, 'max_drop': 10, 'skip_drop': 0.011601413965844696}. Best is trial 2 with value: 1.223628279228481.[0m
Training until validation scores don't improve for 30 rounds
Early stopping, best iteration is:
[531]	valid_0's rmse: 1.5935	valid_0's l2: 2.53925
Training until validation scores don't improve for 30 rounds
Early stopping, best iteration is:
[261]	valid_0's rmse: 1.00441	valid_0's l2: 1.00884
Training until validation scores don't improve for 30 rounds
Early stopping, best iteration is:
[198]	valid_0's rmse: 0.873464	valid_0's l2: 0.762939
Training until validation scores don't improve for 30 rounds
Early stopping, best iteration is:
[434]	valid_0's rmse: 1.12747	valid_0's l2: 1.27119
Training until validation scores don't improve for 30 rounds
Early stopping, best iteration is:
[504]	valid_0's rmse: 1.96926	valid_0's l2: 3.87799
[32m[I 2026-08-05 18:08:10,318][0m Trial 4 finished with value: 1.3136212435626438 and parameters: {'boosting_type': 'gbdt', 'max_depth': 12, 'num_leaves': 200, 'learning_rate': 0.006770684770701556, 'n_estimators': 1396, 'subsample': 0.5579345297625649, 'subsample_freq': 9, 'colsample_bytree': 0.7363086887792905, 'reg_alpha': 9.507847858536042e-06, 'reg_lambda': 3.732717755563729e-08, 'min_child_samples': 34, 'min_child_weight': 0.00019986340778528852, 'min_split_gain': 0.7296061783380641, 'cat_smooth': 31.877873567760656, 'cat_l2': 44.36063712881633}. Best is trial 2 with value: 1.223628279228481.[0m
Training until validation scores don't improve for 30 rounds
Early stopping, best iteration is:
[126]	valid_0's rmse: 1.32978	valid_0's l2: 1.76831
Training until validation scores don't improve for 30 rounds
Early stopping, best iteration is:
[23]	valid_0's rmse: 0.999103	valid_0's l2: 0.998208
Training until validation scores don't improve for 30 rounds
Early stopping, best iteration is:
[86]	valid_0's rmse: 0.788055	valid_0's l2: 0.62103
Training until validation scores don't improve for 30 rounds
Early stopping, best iteration is:
[102]	valid_0's rmse: 1.01999	valid_0's l2: 1.04039
Training until validation scores don't improve for 30 rounds
Early stopping, best iteration is:
[184]	valid_0's rmse: 1.50773	valid_0's l2: 2.27323
[32m[I 2026-08-05 18:08:11,012][0m Trial 5 finished with value: 1.1289308020366535 and parameters: {'boosting_type': 'gbdt', 'max_depth': 12, 'num_leaves': 198, 'learning_rate': 0.04977436807314311, 'n_estimators': 2428, 'subsample': 0.7468977981821954, 'subsample_freq': 6, 'colsample_bytree': 0.5992787128509847, 'reg_alpha': 1.6934490731313353e-08, 'reg_lambda': 9.354548757337708e-08, 'min_child_samples': 8, 'min_child_weight': 0.003512704726270845, 'min_split_gain': 0.3143559810763267, 'cat_smooth': 25.42853455823514, 'cat_l2': 45.37832369630465}. Best is trial 5 with value: 1.1289308020366535.[0m
[32m[I 2026-08-05 18:08:12,007][0m Trial 6 pruned. [0m
[32m[I 2026-08-05 18:08:14,465][0m Trial 7 pruned. [0m
Training until validation scores don't improve for 30 rounds
Early stopping, best iteration is:
[70]	valid_0's rmse: 1.76165	valid_0's l2: 3.10339
Training until validation scores don't improve for 30 rounds
Early stopping, best iteration is:
[192]	valid_0's rmse: 1.06469	valid_0's l2: 1.13356
[32m[I 2026-08-05 18:08:14,602][0m Trial 8 pruned. [0m
Training until validation scores don't improve for 30 rounds
Did not meet early stopping. Best iteration is:
[725]	valid_0's rmse: 1.30038	valid_0's l2: 1.691
Training until validation scores don't improve for 30 rounds
Early stopping, best iteration is:
[286]	valid_0's rmse: 0.930495	valid_0's l2: 0.865821
Training until validation scores don't improve for 30 rounds
Early stopping, best iteration is:
[88]	valid_0's rmse: 0.827737	valid_0's l2: 0.685149
Training until validation scores don't improve for 30 rounds
Early stopping, best iteration is:
[440]	valid_0's rmse: 1.04496	valid_0's l2: 1.09195
Training until validation scores don't improve for 30 rounds
Did not meet early stopping. Best iteration is:
[725]	valid_0's rmse: 1.70993	valid_0's l2: 2.92385
[32m[I 2026-08-05 18:08:15,508][0m Trial 9 finished with value: 1.1627009717577952 and parameters: {'boosting_type': 'gbdt', 'max_depth': 11, 'num_leaves': 167, 'learning_rate': 0.044839259184207204, 'n_estimators': 725, 'subsample': 0.917651247794619, 'subsample_freq': 4, 'colsample_bytree': 0.4305629572798979, 'reg_alpha': 2.3279640748356466e-08, 'reg_lambda': 0.0020798714270728416, 'min_child_samples': 70, 'min_child_weight': 1.1650681118986128e-05, 'min_split_gain': 0.512093058299281, 'cat_smooth': 11.324788759896897, 'cat_l2': 32.25863952047249}. Best is trial 5 with value: 1.1289308020366535.[0m
Training until validation scores don't improve for 30 rounds
Early stopping, best iteration is:
[77]	valid_0's rmse: 1.33032	valid_0's l2: 1.76974
Training until validation scores don't improve for 30 rounds
Early stopping, best iteration is:
[36]	valid_0's rmse: 0.960506	valid_0's l2: 0.922572
Training until validation scores don't improve for 30 rounds
Early stopping, best iteration is:
[5]	valid_0's rmse: 0.860045	valid_0's l2: 0.739678
Training until validation scores don't improve for 30 rounds
Early stopping, best iteration is:
[32]	valid_0's rmse: 1.09901	valid_0's l2: 1.20783
Training until validation scores don't improve for 30 rounds
Early stopping, best iteration is:
[29]	valid_0's rmse: 1.63031	valid_0's l2: 2.65791
[32m[I 2026-08-05 18:08:15,813][0m Trial 10 finished with value: 1.1760381281748766 and parameters: {'boosting_type': 'gbdt', 'max_depth': 8, 'num_leaves': 16, 'learning_rate': 0.227364806419381, 'n_estimators': 2938, 'subsample': 0.8139601740123973, 'subsample_freq': 6, 'colsample_bytree': 0.31464890149101077, 'reg_alpha': 3.331630946893803, 'reg_lambda': 0.04422317327084487, 'min_child_samples': 7, 'min_child_weight': 0.002949971987301989, 'min_split_gain': 0.34052523698531706, 'cat_smooth': 21.71781358782057, 'cat_l2': 23.63570033289743}. Best is trial 5 with value: 1.1289308020366535.[0m
Training until validation scores don't improve for 30 rounds
Early stopping, best iteration is:
[913]	valid_0's rmse: 1.27431	valid_0's l2: 1.62386
Training until validation scores don't improve for 30 rounds
Early stopping, best iteration is:
[99]	valid_0's rmse: 0.93182	valid_0's l2: 0.868289
Training until validation scores don't improve for 30 rounds
Early stopping, best iteration is:
[83]	valid_0's rmse: 0.80195	valid_0's l2: 0.643124
Training until validation scores don't improve for 30 rounds
Early stopping, best iteration is:
[191]	valid_0's rmse: 1.05119	valid_0's l2: 1.105
Training until validation scores don't improve for 30 rounds
Early stopping, best iteration is:
[491]	valid_0's rmse: 1.70453	valid_0's l2: 2.90543
[32m[I 2026-08-05 18:08:16,623][0m Trial 11 finished with value: 1.1527597941771677 and parameters: {'boosting_type': 'gbdt', 'max_depth': 15, 'num_leaves': 254, 'learning_rate': 0.0669365638060914, 'n_estimators': 2131, 'subsample': 0.9604928097340352, 'subsample_freq': 6, 'colsample_bytree': 0.5207027051636285, 'reg_alpha': 1.7078320824761015e-08, 'reg_lambda': 1.344933695762981e-05, 'min_child_samples': 53, 'min_child_weight': 1.0656069868777885e-05, 'min_split_gain': 0.46411592902568627, 'cat_smooth': 13.489280199192706, 'cat_l2': 33.04278626461432}. Best is trial 5 with value: 1.1289308020366535.[0m
Training until validation scores don't improve for 30 rounds
Early stopping, best iteration is:
[356]	valid_0's rmse: 1.25952	valid_0's l2: 1.58639
Training until validation scores don't improve for 30 rounds
Early stopping, best iteration is:
[129]	valid_0's rmse: 0.908504	valid_0's l2: 0.82538
Training until validation scores don't improve for 30 rounds
Early stopping, best iteration is:
[85]	valid_0's rmse: 0.852083	valid_0's l2: 0.726046
Training until validation scores don't improve for 30 rounds
Early stopping, best iteration is:
[240]	valid_0's rmse: 1.06067	valid_0's l2: 1.12503
Training until validation scores don't improve for 30 rounds
Early stopping, best iteration is:
[235]	valid_0's rmse: 1.67803	valid_0's l2: 2.81579
[32m[I 2026-08-05 18:08:17,189][0m Trial 12 finished with value: 1.151780672380728 and parameters: {'boosting_type': 'gbdt', 'max_depth': 15, 'num_leaves': 245, 'learning_rate': 0.1080375976904851, 'n_estimators': 2307, 'subsample': 0.998996888200635, 'subsample_freq': 6, 'colsample_bytree': 0.6092013066027581, 'reg_alpha': 1.355606026860332e-08, 'reg_lambda': 2.1848726848077133e-06, 'min_child_samples': 46, 'min_child_weight': 0.0007498857860465357, 'min_split_gain': 0.44650767394664004, 'cat_smooth': 16.578428387640336, 'cat_l2': 32.89807306389363}. Best is trial 5 with value: 1.1289308020366535.[0m
Training until validation scores don't improve for 30 rounds
Early stopping, best iteration is:
[38]	valid_0's rmse: 1.34477	valid_0's l2: 1.80841
Training until validation scores don't improve for 30 rounds
Early stopping, best iteration is:
[86]	valid_0's rmse: 0.890315	valid_0's l2: 0.792662
Training until validation scores don't improve for 30 rounds
Early stopping, best iteration is:
[71]	valid_0's rmse: 0.793759	valid_0's l2: 0.630053
Training until validation scores don't improve for 30 rounds
Early stopping, best iteration is:
[46]	valid_0's rmse: 1.04484	valid_0's l2: 1.09169
Training until validation scores don't improve for 30 rounds
Early stopping, best iteration is:
[81]	valid_0's rmse: 1.46039	valid_0's l2: 2.13273
[32m[I 2026-08-05 18:08:17,639][0m Trial 13 finished with value: 1.106814117635032 and parameters: {'boosting_type': 'gbdt', 'max_depth': 15, 'num_leaves': 248, 'learning_rate': 0.13204410541008788, 'n_estimators': 2341, 'subsample': 0.7939852208855429, 'subsample_freq': 5, 'colsample_bytree': 0.6744218832163392, 'reg_alpha': 4.1410674388289514e-07, 'reg_lambda': 1.218856151345206e-06, 'min_child_samples': 5, 'min_child_weight': 0.002512261296443226, 'min_split_gain': 0.316810411084425, 'cat_smooth': 24.082818508135386, 'cat_l2': 34.034852522690116}. Best is trial 13 with value: 1.106814117635032.[0m
Training until validation scores don't improve for 30 rounds
Early stopping, best iteration is:
[21]	valid_0's rmse: 1.47807	valid_0's l2: 2.18468
Training until validation scores don't improve for 30 rounds
Early stopping, best iteration is:
[7]	valid_0's rmse: 1.07967	valid_0's l2: 1.16569
[32m[I 2026-08-05 18:08:17,784][0m Trial 14 pruned. [0m
Training until validation scores don't improve for 30 rounds
Early stopping, best iteration is:
[255]	valid_0's rmse: 1.25138	valid_0's l2: 1.56596
Training until validation scores don't improve for 30 rounds
Early stopping, best iteration is:
[28]	valid_0's rmse: 0.857568	valid_0's l2: 0.735424
Training until validation scores don't improve for 30 rounds
Early stopping, best iteration is:
[34]	valid_0's rmse: 0.861761	valid_0's l2: 0.742632
Training until validation scores don't improve for 30 rounds
Early stopping, best iteration is:
[145]	valid_0's rmse: 1.03769	valid_0's l2: 1.07679
Training until validation scores don't improve for 30 rounds
Early stopping, best iteration is:
[413]	valid_0's rmse: 1.47994	valid_0's l2: 2.19021
[32m[I 2026-08-05 18:08:18,603][0m Trial 15 finished with value: 1.0976665845906308 and parameters: {'boosting_type': 'gbdt', 'max_depth': 9, 'num_leaves': 214, 'learning_rate': 0.11768646761723055, 'n_estimators': 2540, 'subsample': 0.7883815452729152, 'subsample_freq': 1, 'colsample_bytree': 0.6003195309450419, 'reg_alpha': 6.490416817830982e-07, 'reg_lambda': 3.984531156188375e-05, 'min_child_samples': 21, 'min_child_weight': 0.009182380300848954, 'min_split_gain': 0.04641537155386216, 'cat_smooth': 25.54788203195316, 'cat_l2': 38.85836400379442}. Best is trial 15 with value: 1.0976665845906308.[0m
Training until validation scores don't improve for 30 rounds
Early stopping, best iteration is:
[184]	valid_0's rmse: 1.27401	valid_0's l2: 1.62311
Training until validation scores don't improve for 30 rounds
Early stopping, best iteration is:
[28]	valid_0's rmse: 0.894653	valid_0's l2: 0.800403
Training until validation scores don't improve for 30 rounds
Early stopping, best iteration is:
[65]	valid_0's rmse: 0.848192	valid_0's l2: 0.719429
Training until validation scores don't improve for 30 rounds
Early stopping, best iteration is:
[226]	valid_0's rmse: 1.00847	valid_0's l2: 1.017
Training until validation scores don't improve for 30 rounds
Early stopping, best iteration is:
[449]	valid_0's rmse: 1.45705	valid_0's l2: 2.123
[32m[I 2026-08-05 18:08:19,350][0m Trial 16 finished with value: 1.096474735387548 and parameters: {'boosting_type': 'gbdt', 'max_depth': 9, 'num_leaves': 222, 'learning_rate': 0.12608852159459644, 'n_estimators': 2722, 'subsample': 0.8199212859905153, 'subsample_freq': 1, 'colsample_bytree': 0.9869191607308052, 'reg_alpha': 7.018523265563109e-07, 'reg_lambda': 4.949215004078341e-05, 'min_child_samples': 23, 'min_child_weight': 0.015712332090527314, 'min_split_gain': 0.052325323692680115, 'cat_smooth': 41.57276842014331, 'cat_l2': 26.558613140800777}. Best is trial 16 with value: 1.096474735387548.[0m
Training until validation scores don't improve for 30 rounds
Early stopping, best iteration is:
[197]	valid_0's rmse: 1.26082	valid_0's l2: 1.58967
Training until validation scores don't improve for 30 rounds
Early stopping, best iteration is:
[58]	valid_0's rmse: 0.842722	valid_0's l2: 0.71018
Training until validation scores don't improve for 30 rounds
Early stopping, best iteration is:
[40]	valid_0's rmse: 0.854465	valid_0's l2: 0.73011
Training until validation scores don't improve for 30 rounds
Early stopping, best iteration is:
[209]	valid_0's rmse: 1.06114	valid_0's l2: 1.12601
Training until validation scores don't improve for 30 rounds
Early stopping, best iteration is:
[583]	valid_0's rmse: 1.47158	valid_0's l2: 2.16555
[32m[I 2026-08-05 18:08:20,183][0m Trial 17 finished with value: 1.0981444843999677 and parameters: {'boosting_type': 'gbdt', 'max_depth': 8, 'num_leaves': 128, 'learning_rate': 0.10127831702728052, 'n_estimators': 2760, 'subsample': 0.7689086107869237, 'subsample_freq': 1, 'colsample_bytree': 0.9884288829283739, 'reg_alpha': 0.00011606078277570822, 'reg_lambda': 4.891971998318658e-05, 'min_child_samples': 23, 'min_child_weight': 0.019672338595629956, 'min_split_gain': 0.02873721860276618, 'cat_smooth': 42.99349295192011, 'cat_l2': 22.79184656887043}. Best is trial 16 with value: 1.096474735387548.[0m
Training until validation scores don't improve for 30 rounds
Early stopping, best iteration is:
[96]	valid_0's rmse: 1.21119	valid_0's l2: 1.46698
Training until validation scores don't improve for 30 rounds
Early stopping, best iteration is:
[7]	valid_0's rmse: 0.948907	valid_0's l2: 0.900424
Training until validation scores don't improve for 30 rounds
Early stopping, best iteration is:
[47]	valid_0's rmse: 0.875267	valid_0's l2: 0.766092
Training until validation scores don't improve for 30 rounds
Early stopping, best iteration is:
[25]	valid_0's rmse: 1.09463	valid_0's l2: 1.19822
Training until validation scores don't improve for 30 rounds
Early stopping, best iteration is:
[146]	valid_0's rmse: 1.50967	valid_0's l2: 2.27911
[32m[I 2026-08-05 18:08:20,586][0m Trial 18 finished with value: 1.1279337856319835 and parameters: {'boosting_type': 'gbdt', 'max_depth': 10, 'num_leaves': 210, 'learning_rate': 0.288927388760013, 'n_estimators': 1924, 'subsample': 0.8679182226497293, 'subsample_freq': 1, 'colsample_bytree': 0.9995894458613797, 'reg_alpha': 3.0683488003551443e-06, 'reg_lambda': 0.00763752363614158, 'min_child_samples': 22, 'min_child_weight': 0.07446735313978974, 'min_split_gain': 0.1320108215872673, 'cat_smooth': 39.62283414269845, 'cat_l2': 2.2102917393250863}. Best is trial 16 with value: 1.096474735387548.[0m
Training until validation scores don't improve for 30 rounds
Early stopping, best iteration is:
[837]	valid_0's rmse: 1.26646	valid_0's l2: 1.60393
Training until validation scores don't improve for 30 rounds
Early stopping, best iteration is:
[281]	valid_0's rmse: 0.868164	valid_0's l2: 0.753709
Training until validation scores don't improve for 30 rounds
Early stopping, best iteration is:
[74]	valid_0's rmse: 0.862847	valid_0's l2: 0.744504
Training until validation scores don't improve for 30 rounds
Early stopping, best iteration is:
[636]	valid_0's rmse: 1.03834	valid_0's l2: 1.07815
Training until validation scores don't improve for 30 rounds
Early stopping, best iteration is:
[926]	valid_0's rmse: 1.66045	valid_0's l2: 2.75711
[32m[I 2026-08-05 18:08:21,932][0m Trial 19 finished with value: 1.1392537759435315 and parameters: {'boosting_type': 'gbdt', 'max_depth': 6, 'num_leaves': 226, 'learning_rate': 0.021066700551865273, 'n_estimators': 2656, 'subsample': 0.8364173367413743, 'subsample_freq': 2, 'colsample_bytree': 0.8984097291415221, 'reg_alpha': 0.00012689638644289332, 'reg_lambda': 5.2595155496259844e-05, 'min_child_samples': 34, 'min_child_weight': 0.016658229736046408, 'min_split_gain': 0.003416854595539802, 'cat_smooth': 33.25873147129732, 'cat_l2': 27.03133490972184}. Best is trial 16 with value: 1.096474735387548.[0m
Training until validation scores don't improve for 30 rounds
Early stopping, best iteration is:
[252]	valid_0's rmse: 1.22539	valid_0's l2: 1.50158
Training until validation scores don't improve for 30 rounds
Early stopping, best iteration is:
[37]	valid_0's rmse: 0.916882	valid_0's l2: 0.840673
Training until validation scores don't improve for 30 rounds
Early stopping, best iteration is:
[164]	valid_0's rmse: 0.750258	valid_0's l2: 0.562887
Training until validation scores don't improve for 30 rounds
Early stopping, best iteration is:
[94]	valid_0's rmse: 1.09059	valid_0's l2: 1.18938
Training until validation scores don't improve for 30 rounds
Early stopping, best iteration is:
[271]	valid_0's rmse: 1.52448	valid_0's l2: 2.32405
