[32m[I 2026-08-05 18:09:07,280][0m Trial 45 finished with value: 1.1147215438298967 and parameters: {'boosting_type': 'gbdt', 'max_depth': 9, 'num_leaves': 151, 'learning_rate': 0.13333714783530803, 'n_estimators': 2383, 'subsample': 0.8773836043416899, 'subsample_freq': 4, 'colsample_bytree': 0.6225945160251977, 'reg_alpha': 0.39389753294526314, 'reg_lambda': 1.705940071997028e-05, 'min_child_samples': 32, 'min_child_weight': 0.06899579334491525, 'min_split_gain': 0.27146635247594475, 'cat_smooth': 47.58578605402118, 'cat_l2': 42.67069285377991}. Best is trial 41 with value: 1.0864663909464547.[0m
Training until validation scores don't improve for 30 rounds
Early stopping, best iteration is:
[111]	valid_0's rmse: 1.30463	valid_0's l2: 1.70207
Training until validation scores don't improve for 30 rounds
Early stopping, best iteration is:
[20]	valid_0's rmse: 0.907787	valid_0's l2: 0.824077
[32m[I 2026-08-05 18:09:07,481][0m Trial 46 pruned. [0m
Training until validation scores don't improve for 30 rounds
Early stopping, best iteration is:
[67]	valid_0's rmse: 1.34624	valid_0's l2: 1.81237
Training until validation scores don't improve for 30 rounds
Early stopping, best iteration is:
[9]	valid_0's rmse: 0.971241	valid_0's l2: 0.943309
[32m[I 2026-08-05 18:09:07,684][0m Trial 47 pruned. [0m
Training until validation scores don't improve for 30 rounds
Early stopping, best iteration is:
[147]	valid_0's rmse: 1.23802	valid_0's l2: 1.5327
Training until validation scores don't improve for 30 rounds
Early stopping, best iteration is:
[52]	valid_0's rmse: 0.907523	valid_0's l2: 0.823599
[32m[I 2026-08-05 18:09:07,964][0m Trial 48 pruned. [0m
Training until validation scores don't improve for 30 rounds
Early stopping, best iteration is:
[313]	valid_0's rmse: 1.25567	valid_0's l2: 1.57672
Training until validation scores don't improve for 30 rounds
Early stopping, best iteration is:
[44]	valid_0's rmse: 0.887514	valid_0's l2: 0.787682
[32m[I 2026-08-05 18:09:08,335][0m Trial 49 pruned. [0m

=== Best Trial ===
  CV RMSE: 0.000001
  Params:  {'boosting_type': 'gbdt', 'max_depth': 8, 'num_leaves': 126, 'learning_rate': 0.09445940046890143, 'n_estimators': 2736, 'subsample': 0.7720438365825305, 'subsample_freq': 1, 'colsample_bytree': 0.9812723909363967, 'reg_alpha': 0.0003334442223559278, 'reg_lambda': 2.9234418208278888e-05, 'min_child_samples': 25, 'min_child_weight': 0.02378328694617151, 'min_split_gain': 0.048300856136155035, 'cat_smooth': 47.28237971898103, 'cat_l2': 21.699865130582026}

============================================================
Training Final Model with Best Hyperparameters
============================================================
Training until validation scores don't improve for 50 rounds
[50]	valid_0's rmse: 1.69366	valid_0's l2: 2.86848
[100]	valid_0's rmse: 1.55795	valid_0's l2: 2.42722
[150]	valid_0's rmse: 1.48869	valid_0's l2: 2.21621
[200]	valid_0's rmse: 1.48281	valid_0's l2: 2.19871
Early stopping, best iteration is:
[158]	valid_0's rmse: 1.4654	valid_0's l2: 2.1474

============================================================
Test Evaluation
============================================================
  Test MSE:  0.0000
  Test RMSE: 0.0000
  Test MAE:  0.0000
  Test R²:   0.3413

============================================================
Top 20 Feature Importances
============================================================
   1. atom_std_25                92.0
   2. head_ratio                 82.0
   3. atom_mean_35               69.0
   4. LogP                       55.0
   5. atom_mean_17               53.0
   6. MolWt                      50.0
   7. tail_ratio                 48.0
   8. atom_mean_26               43.0
   9. atom_std_35                41.0
  10. atom_std_39                39.0
  11. atom_mean_40               39.0
  12. TPSA                       39.0
  13. atom_mean_54               29.0
  14. atom_mean_18               28.0
  15. RotBonds                   28.0
  16. brics_3                    28.0
  17. atom_std_38                28.0
  18. atom_mean_51               27.0
  19. atom_mean_4                27.0
  20. atom_mean_23               27.0

Plot saved to runs\Gamma_max\Gamma_max_lightgbm_20260805_180756\pred_vs_true.png
Model saved to runs\Gamma_max\Gamma_max_lightgbm_20260805_180756\model.pkl

============================================================
SUMMARY — LightGBM + PharmHGT Features
============================================================
  Features:  522-dim (atom_agg + bond_agg + MACCS + BRICS + surfactant + descriptors)
  Train:     549 (val 79)
  Test:      70
  Optuna:    50 trials, 5-fold CV
  Best CV RMSE: 0.0000
  Test RMSE: 0.0000
  Test MAE:  0.0000
  Test R²:   0.3413

指标已保存: runs\Gamma_max\Gamma_max_lightgbm_20260805_180756\metrics.json
索引已更新: runs\Gamma_max\_runs_index.csv
索引已更新: runs\_runs_index.csv
