[32m[I 2026-08-07 10:21:42,454][0m Trial 73 finished with value: 0.5029228553510005 and parameters: {'n_estimators': 2464, 'max_depth': 5, 'learning_rate': 0.039826082631653346, 'subsample': 0.7569645248971024, 'colsample_bytree': 0.7654617062990396, 'colsample_bylevel': 0.6827116391320347, 'colsample_bynode': 0.39024353830201225, 'min_child_weight': 1.04364830300092, 'gamma': 0.1604348394200306, 'reg_alpha': 2.0378354070459905e-06, 'reg_lambda': 0.00018876745177729437, 'max_delta_step': 2.057325440160415, 'booster': 'gbtree'}. Best is trial 40 with value: 0.4871527147719707.[0m
[32m[I 2026-08-07 10:21:51,001][0m Trial 74 finished with value: 0.494095075619743 and parameters: {'n_estimators': 2422, 'max_depth': 6, 'learning_rate': 0.017439045661005365, 'subsample': 0.6566859594689036, 'colsample_bytree': 0.8611999716722426, 'colsample_bylevel': 0.5670963880176864, 'colsample_bynode': 0.9125885427883332, 'min_child_weight': 1.6479270095177958, 'gamma': 0.011975575654081562, 'reg_alpha': 2.3308394483460852e-08, 'reg_lambda': 1.658707660709987e-06, 'max_delta_step': 7.946090750498152, 'booster': 'gbtree'}. Best is trial 40 with value: 0.4871527147719707.[0m
[32m[I 2026-08-07 10:21:58,075][0m Trial 75 finished with value: 0.490085079536843 and parameters: {'n_estimators': 2936, 'max_depth': 5, 'learning_rate': 0.013100544472285432, 'subsample': 0.8854733941447857, 'colsample_bytree': 0.7671917614021023, 'colsample_bylevel': 0.6184109866963582, 'colsample_bynode': 0.6110767692829723, 'min_child_weight': 2.218160207931436, 'gamma': 0.03695191524052774, 'reg_alpha': 3.297859916608113e-07, 'reg_lambda': 0.03348566402232903, 'max_delta_step': 4.558500251258202, 'booster': 'dart'}. Best is trial 40 with value: 0.4871527147719707.[0m
[32m[I 2026-08-07 10:22:07,137][0m Trial 76 finished with value: 0.4923781443373606 and parameters: {'n_estimators': 2755, 'max_depth': 4, 'learning_rate': 0.012107703875851118, 'subsample': 0.9107323367373406, 'colsample_bytree': 0.928488085268868, 'colsample_bylevel': 0.7539841607395399, 'colsample_bynode': 0.8023745753374816, 'min_child_weight': 2.361531440653817, 'gamma': 0.09830582283661382, 'reg_alpha': 8.42612617016555e-08, 'reg_lambda': 0.2918389449483655, 'max_delta_step': 3.0335513948148116, 'booster': 'dart'}. Best is trial 40 with value: 0.4871527147719707.[0m
[32m[I 2026-08-07 10:22:09,210][0m Trial 77 pruned. [0m
[32m[I 2026-08-07 10:22:15,324][0m Trial 78 finished with value: 0.5069279973397456 and parameters: {'n_estimators': 2589, 'max_depth': 9, 'learning_rate': 0.013757190278607891, 'subsample': 0.7363859927669403, 'colsample_bytree': 0.5304201369885647, 'colsample_bylevel': 0.5599766388527052, 'colsample_bynode': 0.49371121034134235, 'min_child_weight': 3.3632753607031174, 'gamma': 0.05110808403450286, 'reg_alpha': 2.341973707930556e-06, 'reg_lambda': 3.549945944156541e-05, 'max_delta_step': 3.233439686421142, 'booster': 'dart'}. Best is trial 40 with value: 0.4871527147719707.[0m
[32m[I 2026-08-07 10:22:20,980][0m Trial 79 finished with value: 0.5054050673234897 and parameters: {'n_estimators': 2586, 'max_depth': 4, 'learning_rate': 0.017405880356426144, 'subsample': 0.8577376495417242, 'colsample_bytree': 0.8798643150449295, 'colsample_bylevel': 0.780431983319241, 'colsample_bynode': 0.7525104811346582, 'min_child_weight': 5.1579365121091065, 'gamma': 0.35212400911261243, 'reg_alpha': 1.0464561192409748e-07, 'reg_lambda': 0.003239183833892844, 'max_delta_step': 4.782325858788848, 'booster': 'dart'}. Best is trial 40 with value: 0.4871527147719707.[0m
[32m[I 2026-08-07 10:22:30,356][0m Trial 80 finished with value: 0.4963885571903111 and parameters: {'n_estimators': 2506, 'max_depth': 6, 'learning_rate': 0.01305414154238651, 'subsample': 0.9992554300940399, 'colsample_bytree': 0.7752750242137797, 'colsample_bylevel': 0.5674492925966558, 'colsample_bynode': 0.4628128774681236, 'min_child_weight': 1.133480966108421, 'gamma': 0.014198200359218607, 'reg_alpha': 5.100732991763937e-06, 'reg_lambda': 5.873772505949901, 'max_delta_step': 3.4528759566820257, 'booster': 'dart'}. Best is trial 40 with value: 0.4871527147719707.[0m
[32m[I 2026-08-07 10:22:36,679][0m Trial 81 finished with value: 0.5031334372816079 and parameters: {'n_estimators': 2789, 'max_depth': 4, 'learning_rate': 0.015051896374456147, 'subsample': 0.8756610917214525, 'colsample_bytree': 0.6549148967142785, 'colsample_bylevel': 0.6997487579772039, 'colsample_bynode': 0.7069200136651186, 'min_child_weight': 1.6954120271974116, 'gamma': 0.16942572467632025, 'reg_alpha': 2.1395315407112846e-06, 'reg_lambda': 0.00031387086962571053, 'max_delta_step': 6.951671071443464, 'booster': 'dart'}. Best is trial 40 with value: 0.4871527147719707.[0m
[32m[I 2026-08-07 10:22:41,734][0m Trial 82 finished with value: 0.5138424395941379 and parameters: {'n_estimators': 2666, 'max_depth': 9, 'learning_rate': 0.016919630063280768, 'subsample': 0.848962645688157, 'colsample_bytree': 0.9229736667073194, 'colsample_bylevel': 0.7291869524921892, 'colsample_bynode': 0.7433783873754921, 'min_child_weight': 2.9449433983461195, 'gamma': 0.35016619264866916, 'reg_alpha': 3.2103799971929796e-07, 'reg_lambda': 0.4919446830459455, 'max_delta_step': 2.943722689736264, 'booster': 'dart'}. Best is trial 40 with value: 0.4871527147719707.[0m
[32m[I 2026-08-07 10:22:47,826][0m Trial 83 finished with value: 0.49071481152775237 and parameters: {'n_estimators': 1766, 'max_depth': 5, 'learning_rate': 0.014470869618085249, 'subsample': 0.9216238470896171, 'colsample_bytree': 0.7933895991455646, 'colsample_bylevel': 0.5400582375062344, 'colsample_bynode': 0.9204244597181063, 'min_child_weight': 3.7519093366883833, 'gamma': 0.09688666097775545, 'reg_alpha': 1.7450501717224584e-07, 'reg_lambda': 0.06532358141346725, 'max_delta_step': 1.5933739325797076, 'booster': 'gbtree'}. Best is trial 40 with value: 0.4871527147719707.[0m
[32m[I 2026-08-07 10:22:52,195][0m Trial 84 finished with value: 0.49818424419077034 and parameters: {'n_estimators': 1745, 'max_depth': 5, 'learning_rate': 0.018684054246694115, 'subsample': 0.9072013194917822, 'colsample_bytree': 0.7093712882014167, 'colsample_bylevel': 0.5324711471245894, 'colsample_bynode': 0.9919711601993282, 'min_child_weight': 3.712211514853276, 'gamma': 0.11648414499148033, 'reg_alpha': 3.4694454894678734e-08, 'reg_lambda': 0.1835323843122389, 'max_delta_step': 3.1046936241607828, 'booster': 'gbtree'}. Best is trial 40 with value: 0.4871527147719707.[0m
[32m[I 2026-08-07 10:22:55,363][0m Trial 85 finished with value: 0.5185799985784387 and parameters: {'n_estimators': 2915, 'max_depth': 5, 'learning_rate': 0.0183767296382617, 'subsample': 0.9223013459191474, 'colsample_bytree': 0.9798368476884025, 'colsample_bylevel': 0.5270136483766632, 'colsample_bynode': 0.7667210823212482, 'min_child_weight': 2.3060023361934836, 'gamma': 0.42679546127036144, 'reg_alpha': 1.9464471911893413e-08, 'reg_lambda': 0.027329907355519403, 'max_delta_step': 2.7847689867190164, 'booster': 'dart'}. Best is trial 40 with value: 0.4871527147719707.[0m
[32m[I 2026-08-07 10:23:02,181][0m Trial 86 finished with value: 0.5088187061190951 and parameters: {'n_estimators': 1637, 'max_depth': 6, 'learning_rate': 0.021287655377393612, 'subsample': 0.865449622953559, 'colsample_bytree': 0.9028636992387182, 'colsample_bylevel': 0.4116617936034749, 'colsample_bynode': 0.789163441102796, 'min_child_weight': 3.2022686538266303, 'gamma': 0.40428852278144084, 'reg_alpha': 2.6502408681969924e-06, 'reg_lambda': 1.0077100536348682, 'max_delta_step': 0.2641748407183939, 'booster': 'gbtree'}. Best is trial 40 with value: 0.4871527147719707.[0m
[32m[I 2026-08-07 10:23:06,892][0m Trial 87 finished with value: 0.5023465256201227 and parameters: {'n_estimators': 2604, 'max_depth': 7, 'learning_rate': 0.014011691123297509, 'subsample': 0.775595618373817, 'colsample_bytree': 0.6881935102434937, 'colsample_bylevel': 0.4342906571010283, 'colsample_bynode': 0.5528430091967483, 'min_child_weight': 1.8818092613424324, 'gamma': 0.18169196638505758, 'reg_alpha': 3.155101446954531e-08, 'reg_lambda': 1.1331703135802265e-06, 'max_delta_step': 4.473500119940424, 'booster': 'dart'}. Best is trial 40 with value: 0.4871527147719707.[0m
[32m[I 2026-08-07 10:23:13,530][0m Trial 88 finished with value: 0.5046046219801241 and parameters: {'n_estimators': 2379, 'max_depth': 9, 'learning_rate': 0.015052318747398643, 'subsample': 0.6551211487109094, 'colsample_bytree': 0.47733116496334593, 'colsample_bylevel': 0.7529324202239416, 'colsample_bynode': 0.9850619068727627, 'min_child_weight': 3.0853596598748987, 'gamma': 0.10496946092458796, 'reg_alpha': 0.00011947243661208772, 'reg_lambda': 1.111041479773403e-06, 'max_delta_step': 5.613525798855969, 'booster': 'dart'}. Best is trial 40 with value: 0.4871527147719707.[0m
[32m[I 2026-08-07 10:23:29,520][0m Trial 89 finished with value: 0.4894069591664635 and parameters: {'n_estimators': 2773, 'max_depth': 5, 'learning_rate': 0.011603990829235142, 'subsample': 0.855264644178362, 'colsample_bytree': 0.9594651354011968, 'colsample_bylevel': 0.9100287518422693, 'colsample_bynode': 0.9008190319547695, 'min_child_weight': 1.5191335234133307, 'gamma': 0.004095310806621552, 'reg_alpha': 4.3329615595307685e-06, 'reg_lambda': 1.117505218311987, 'max_delta_step': 2.7862617910446397, 'booster': 'dart'}. Best is trial 40 with value: 0.4871527147719707.[0m
[32m[I 2026-08-07 10:23:33,350][0m Trial 90 finished with value: 0.5171700462459368 and parameters: {'n_estimators': 2381, 'max_depth': 10, 'learning_rate': 0.022805978030796006, 'subsample': 0.8430507166979776, 'colsample_bytree': 0.755337642883076, 'colsample_bylevel': 0.37768425072946543, 'colsample_bynode': 0.9342089838792244, 'min_child_weight': 3.9448729518541934, 'gamma': 0.40819784066027437, 'reg_alpha': 0.6091697894722008, 'reg_lambda': 0.0002666122456442167, 'max_delta_step': 4.871649464526368, 'booster': 'dart'}. Best is trial 40 with value: 0.4871527147719707.[0m
[32m[I 2026-08-07 10:23:42,963][0m Trial 91 finished with value: 0.5021361286103477 and parameters: {'n_estimators': 2895, 'max_depth': 6, 'learning_rate': 0.010239498636648428, 'subsample': 0.7013860934635375, 'colsample_bytree': 0.5871503003662902, 'colsample_bylevel': 0.6315830981332514, 'colsample_bynode': 0.8351618073128271, 'min_child_weight': 6.002129507389539, 'gamma': 0.13597712067363693, 'reg_alpha': 3.966421300760595e-08, 'reg_lambda': 2.909108078963522e-07, 'max_delta_step': 4.101534751493473, 'booster': 'dart'}. Best is trial 40 with value: 0.4871527147719707.[0m
[32m[I 2026-08-07 10:23:50,737][0m Trial 92 finished with value: 0.49520506278152265 and parameters: {'n_estimators': 1931, 'max_depth': 5, 'learning_rate': 0.013278308957935936, 'subsample': 0.8773745787504302, 'colsample_bytree': 0.9300227811670247, 'colsample_bylevel': 0.8373119109041999, 'colsample_bynode': 0.8355237357118548, 'min_child_weight': 2.4847387957927904, 'gamma': 0.14719856660923336, 'reg_alpha': 0.0005695694796134521, 'reg_lambda': 1.1744368003589047, 'max_delta_step': 2.9864780173787313, 'booster': 'dart'}. Best is trial 40 with value: 0.4871527147719707.[0m
[32m[I 2026-08-07 10:23:54,393][0m Trial 93 finished with value: 0.5123288434329816 and parameters: {'n_estimators': 1613, 'max_depth': 6, 'learning_rate': 0.015169947154786213, 'subsample': 0.9555049039432123, 'colsample_bytree': 0.8912070360869934, 'colsample_bylevel': 0.4665283394277559, 'colsample_bynode': 0.6715777673469536, 'min_child_weight': 3.2960703957696986, 'gamma': 0.38921491618252996, 'reg_alpha': 3.1692065824091584e-08, 'reg_lambda': 1.4972946511456254e-05, 'max_delta_step': 2.524612868786883, 'booster': 'gbtree'}. Best is trial 40 with value: 0.4871527147719707.[0m
[32m[I 2026-08-07 10:24:01,055][0m Trial 94 finished with value: 0.5060157790835852 and parameters: {'n_estimators': 2129, 'max_depth': 5, 'learning_rate': 0.0168068533984319, 'subsample': 0.7896521066247666, 'colsample_bytree': 0.9019242699522161, 'colsample_bylevel': 0.9515298543014629, 'colsample_bynode': 0.8902690440466083, 'min_child_weight': 1.1240441902812561, 'gamma': 0.29704567334651155, 'reg_alpha': 4.3141070842201473e-07, 'reg_lambda': 0.38232615647144413, 'max_delta_step': 1.8534812923594686, 'booster': 'dart'}. Best is trial 40 with value: 0.4871527147719707.[0m
[32m[I 2026-08-07 10:24:05,416][0m Trial 95 finished with value: 0.5304585387665671 and parameters: {'n_estimators': 2617, 'max_depth': 4, 'learning_rate': 0.02062514383758032, 'subsample': 0.8308164751899244, 'colsample_bytree': 0.834474626917342, 'colsample_bylevel': 0.5432726458723237, 'colsample_bynode': 0.4732097839124694, 'min_child_weight': 1.2451140795894224, 'gamma': 0.5053079588686942, 'reg_alpha': 0.3476839119845881, 'reg_lambda': 5.091766526045646, 'max_delta_step': 1.356731060944006, 'booster': 'dart'}. Best is trial 40 with value: 0.4871527147719707.[0m
[32m[I 2026-08-07 10:24:13,803][0m Trial 96 finished with value: 0.5005968297947619 and parameters: {'n_estimators': 2958, 'max_depth': 4, 'learning_rate': 0.011512712257203484, 'subsample': 0.8180660577085009, 'colsample_bytree': 0.7555059280581835, 'colsample_bylevel': 0.5057289393276445, 'colsample_bynode': 0.4216137864212909, 'min_child_weight': 5.646020377572933, 'gamma': 0.09671390069757896, 'reg_alpha': 0.004198825926788849, 'reg_lambda': 0.047874077875951895, 'max_delta_step': 3.521037374741474, 'booster': 'dart'}. Best is trial 40 with value: 0.4871527147719707.[0m
[32m[I 2026-08-07 10:24:19,480][0m Trial 97 finished with value: 0.492207883122947 and parameters: {'n_estimators': 2741, 'max_depth': 7, 'learning_rate': 0.012555098812184855, 'subsample': 0.7351206685530063, 'colsample_bytree': 0.4513386272737556, 'colsample_bylevel': 0.44479382318105576, 'colsample_bynode': 0.6792475108789776, 'min_child_weight': 1.2096886769457151, 'gamma': 0.0468463260462728, 'reg_alpha': 3.960508470502824e-05, 'reg_lambda': 0.00033293214669478417, 'max_delta_step': 3.9320918760701096, 'booster': 'gbtree'}. Best is trial 40 with value: 0.4871527147719707.[0m
[32m[I 2026-08-07 10:24:23,445][0m Trial 98 finished with value: 0.5235319298519223 and parameters: {'n_estimators': 2494, 'max_depth': 8, 'learning_rate': 0.016499683482571813, 'subsample': 0.6984609236216303, 'colsample_bytree': 0.39839739851171274, 'colsample_bylevel': 0.49478321208497683, 'colsample_bynode': 0.7617131593200197, 'min_child_weight': 1.6231429141059088, 'gamma': 0.6062061104953438, 'reg_alpha': 4.36112061964837e-06, 'reg_lambda': 0.0011228893857064177, 'max_delta_step': 4.246909676679763, 'booster': 'gbtree'}. Best is trial 40 with value: 0.4871527147719707.[0m
[32m[I 2026-08-07 10:24:36,079][0m Trial 99 finished with value: 0.4880146403787893 and parameters: {'n_estimators': 2677, 'max_depth': 4, 'learning_rate': 0.010602008798231807, 'subsample': 0.7688192955249517, 'colsample_bytree': 0.8755183315396351, 'colsample_bylevel': 0.6101993604497435, 'colsample_bynode': 0.5920304552881691, 'min_child_weight': 2.180437963052728, 'gamma': 0.016057625667734877, 'reg_alpha': 6.456465491438725e-07, 'reg_lambda': 0.8530442528441725, 'max_delta_step': 4.663212124670936, 'booster': 'dart'}. Best is trial 40 with value: 0.4871527147719707.[0m
[32m[I 2026-08-07 10:24:44,328][0m Trial 100 finished with value: 0.4969344235457851 and parameters: {'n_estimators': 2745, 'max_depth': 4, 'learning_rate': 0.017077788588703326, 'subsample': 0.7006419408932778, 'colsample_bytree': 0.8670915671973864, 'colsample_bylevel': 0.7646298055808995, 'colsample_bynode': 0.5832595297859092, 'min_child_weight': 1.4056085749085756, 'gamma': 0.09028152564500734, 'reg_alpha': 1.87293668557811e-07, 'reg_lambda': 7.3267172733291694, 'max_delta_step': 2.4014087484272397, 'booster': 'dart'}. Best is trial 40 with value: 0.4871527147719707.[0m
[32m[I 2026-08-07 10:24:50,507][0m Trial 101 finished with value: 0.48886490880137456 and parameters: {'n_estimators': 2754, 'max_depth': 6, 'learning_rate': 0.014627947109212872, 'subsample': 0.7636454545951937, 'colsample_bytree': 0.39675283521026167, 'colsample_bylevel': 0.49171430839379016, 'colsample_bynode': 0.5153460581167179, 'min_child_weight': 2.141292276546456, 'gamma': 0.03208076345252381, 'reg_alpha': 0.0004914674282710375, 'reg_lambda': 0.0017719441972499034, 'max_delta_step': 2.01725977067756, 'booster': 'gbtree'}. Best is trial 40 with value: 0.4871527147719707.[0m
[32m[I 2026-08-07 10:24:58,886][0m Trial 102 finished with value: 0.5075919659003796 and parameters: {'n_estimators': 2625, 'max_depth': 6, 'learning_rate': 0.012763972618087647, 'subsample': 0.8861636150561366, 'colsample_bytree': 0.9807805864998, 'colsample_bylevel': 0.9648153608143869, 'colsample_bynode': 0.8021397898617727, 'min_child_weight': 1.4345538344424942, 'gamma': 0.18477432134094746, 'reg_alpha': 4.788361594399055e-06, 'reg_lambda': 0.904952160753301, 'max_delta_step': 4.719088343016788, 'booster': 'gbtree'}. Best is trial 40 with value: 0.4871527147719707.[0m
[32m[I 2026-08-07 10:25:02,209][0m Trial 103 finished with value: 0.5288618326645758 and parameters: {'n_estimators': 2615, 'max_depth': 6, 'learning_rate': 0.016938350341088062, 'subsample': 0.8809788912008409, 'colsample_bytree': 0.49193300866026973, 'colsample_bylevel': 0.4633065199678041, 'colsample_bynode': 0.5482481185542322, 'min_child_weight': 2.2989974071577515, 'gamma': 0.566725117022187, 'reg_alpha': 0.0033771349316713546, 'reg_lambda': 0.000499706839421223, 'max_delta_step': 2.1402898996604667, 'booster': 'gbtree'}. Best is trial 40 with value: 0.4871527147719707.[0m
[32m[I 2026-08-07 10:25:18,677][0m Trial 104 finished with value: 0.5029866636840935 and parameters: {'n_estimators': 2838, 'max_depth': 6, 'learning_rate': 0.016092682225863665, 'subsample': 0.8014421081018458, 'colsample_bytree': 0.9568549951346945, 'colsample_bylevel': 0.9850505971049365, 'colsample_bynode': 0.7409586222001341, 'min_child_weight': 1.634520507749043, 'gamma': 0.015087710601750765, 'reg_alpha': 0.0004881831299888617, 'reg_lambda': 6.036720196137879e-05, 'max_delta_step': 0.22516479255709587, 'booster': 'dart'}. Best is trial 40 with value: 0.4871527147719707.[0m
[32m[I 2026-08-07 10:25:23,971][0m Trial 105 finished with value: 0.5176695738066398 and parameters: {'n_estimators': 2359, 'max_depth': 5, 'learning_rate': 0.010975011958175278, 'subsample': 0.7881819359631149, 'colsample_bytree': 0.6297240840684715, 'colsample_bylevel': 0.6581239525638805, 'colsample_bynode': 0.4526376077970711, 'min_child_weight': 1.7268653431634287, 'gamma': 0.37580395951790585, 'reg_alpha': 3.820978543070808e-07, 'reg_lambda': 0.4947061268603427, 'max_delta_step': 5.131120453349808, 'booster': 'dart'}. Best is trial 40 with value: 0.4871527147719707.[0m
[32m[I 2026-08-07 10:25:33,328][0m Trial 106 finished with value: 0.504035065145962 and parameters: {'n_estimators': 2627, 'max_depth': 6, 'learning_rate': 0.010965529709366036, 'subsample': 0.9245723566222552, 'colsample_bytree': 0.9200085975067764, 'colsample_bylevel': 0.9944921073217697, 'colsample_bynode': 0.9603337081388376, 'min_child_weight': 1.7552074986280224, 'gamma': 0.1007658589469474, 'reg_alpha': 6.342527014221087e-05, 'reg_lambda': 0.4378168234109461, 'max_delta_step': 3.3594928760822484, 'booster': 'dart'}. Best is trial 40 with value: 0.4871527147719707.[0m
[32m[I 2026-08-07 10:25:39,143][0m Trial 107 finished with value: 0.5103128947302881 and parameters: {'n_estimators': 2914, 'max_depth': 6, 'learning_rate': 0.014908826505340584, 'subsample': 0.6620736299616812, 'colsample_bytree': 0.4803928757684788, 'colsample_bylevel': 0.49391188179206985, 'colsample_bynode': 0.4045116050162254, 'min_child_weight': 1.122348933672364, 'gamma': 0.20900907947712777, 'reg_alpha': 1.845937545237935e-06, 'reg_lambda': 0.2913168023055027, 'max_delta_step': 0.7001964423352274, 'booster': 'gbtree'}. Best is trial 40 with value: 0.4871527147719707.[0m
[32m[I 2026-08-07 10:25:44,120][0m Trial 108 finished with value: 0.5058017170702819 and parameters: {'n_estimators': 2994, 'max_depth': 8, 'learning_rate': 0.019114025122020643, 'subsample': 0.7102686267427704, 'colsample_bytree': 0.3364407572887145, 'colsample_bylevel': 0.37996311818543904, 'colsample_bynode': 0.6006187254919804, 'min_child_weight': 1.5968446747287615, 'gamma': 0.12664519989302653, 'reg_alpha': 0.20915912818779955, 'reg_lambda': 0.04248278477390688, 'max_delta_step': 7.368046048161339, 'booster': 'gbtree'}. Best is trial 40 with value: 0.4871527147719707.[0m
[32m[I 2026-08-07 10:25:48,102][0m Trial 109 finished with value: 0.5065608902055915 and parameters: {'n_estimators': 2753, 'max_depth': 7, 'learning_rate': 0.016772076956865944, 'subsample': 0.7759733711965052, 'colsample_bytree': 0.3467223842942988, 'colsample_bylevel': 0.5574734863971218, 'colsample_bynode': 0.6503211893707781, 'min_child_weight': 1.0660729914243106, 'gamma': 0.2007444776290509, 'reg_alpha': 0.0007563251626755145, 'reg_lambda': 4.4830786570843375e-07, 'max_delta_step': 3.610852111543566, 'booster': 'gbtree'}. Best is trial 40 with value: 0.4871527147719707.[0m
[32m[I 2026-08-07 10:25:52,229][0m Trial 110 finished with value: 0.5059016964575134 and parameters: {'n_estimators': 2742, 'max_depth': 4, 'learning_rate': 0.01840061483956357, 'subsample': 0.7016354069922718, 'colsample_bytree': 0.9233592324303828, 'colsample_bylevel': 0.5892777377426827, 'colsample_bynode': 0.5913591050135684, 'min_child_weight': 1.922256070679454, 'gamma': 0.28429113478139717, 'reg_alpha': 1.404400038608886e-08, 'reg_lambda': 0.019394053399597343, 'max_delta_step': 5.022195282234172, 'booster': 'gbtree'}. Best is trial 40 with value: 0.4871527147719707.[0m
