============================================================
xgboost — 运行开始  20260807_101507
  输出目录:  runs\Area_min\Area_min_xgboost_20260807_101507
============================================================
============================================================
XGBoost + PharmHGT-style Featurization for Area_min Prediction
============================================================
[Cache HIT] Loading features from data\features\surfpro\Area_min
  Train features: (607, 522)
  Test features:  (70, 522)

Split: Train 531, Val 76, Test 70
  CV (Optuna): 546, Holdout (Top-K filter): 61

============================================================
Optuna Hyperparameter Tuning (200 trials, 5-Fold CV)
============================================================
[32m[I 2026-08-07 10:15:09,493][0m Trial 0 finished with value: 0.5799369572804837 and parameters: {'n_estimators': 1624, 'max_depth': 12, 'learning_rate': 0.08960785365368121, 'subsample': 0.8394633936788146, 'colsample_bytree': 0.40921304830970556, 'colsample_bylevel': 0.40919616423534183, 'colsample_bynode': 0.3406585285177396, 'min_child_weight': 19.030368381735816, 'gamma': 1.2022300234864176, 'reg_alpha': 0.023585940584142682, 'reg_lambda': 1.5320059381854043e-08, 'max_delta_step': 7.759278817295955, 'booster': 'gbtree'}. Best is trial 0 with value: 0.5799369572804837.[0m
[32m[I 2026-08-07 10:15:11,288][0m Trial 1 finished with value: 0.5276530016600628 and parameters: {'n_estimators': 1200, 'max_depth': 5, 'learning_rate': 0.024878734419814436, 'subsample': 0.8099025726528951, 'colsample_bytree': 0.602361513049481, 'colsample_bylevel': 0.5038603981386294, 'colsample_bynode': 0.7282970263056656, 'min_child_weight': 1.6071238512039876, 'gamma': 0.5842892970704363, 'reg_alpha': 1.9826980964985924e-05, 'reg_lambda': 0.00012724181576752517, 'max_delta_step': 6.281407691144109, 'booster': 'dart'}. Best is trial 1 with value: 0.5276530016600628.[0m
[32m[I 2026-08-07 10:15:13,679][0m Trial 2 finished with value: 0.536764101470018 and parameters: {'n_estimators': 2103, 'max_depth': 4, 'learning_rate': 0.061721159481070736, 'subsample': 0.6682096494749166, 'colsample_bytree': 0.3455361150896956, 'colsample_bylevel': 0.9642198760773333, 'colsample_bynode': 0.9759424231521916, 'min_child_weight': 15.635108708133458, 'gamma': 0.6092275383467414, 'reg_alpha': 7.569183361880229e-08, 'reg_lambda': 0.014391207615728067, 'max_delta_step': 3.5212199499168104, 'booster': 'dart'}. Best is trial 1 with value: 0.5276530016600628.[0m
[32m[I 2026-08-07 10:15:16,185][0m Trial 3 finished with value: 0.567106630889613 and parameters: {'n_estimators': 875, 'max_depth': 12, 'learning_rate': 0.02171103454376615, 'subsample': 0.8650089137415928, 'colsample_bytree': 0.5181977532625877, 'colsample_bylevel': 0.6640476148244676, 'colsample_bynode': 0.6826971955402957, 'min_child_weight': 1.8752209455786402, 'gamma': 1.9391692555291171, 'reg_alpha': 0.09466630153726856, 'reg_lambda': 2.854239907497756, 'max_delta_step': 7.158618803421191, 'booster': 'dart'}. Best is trial 1 with value: 0.5276530016600628.[0m
[32m[I 2026-08-07 10:15:20,200][0m Trial 4 finished with value: 0.523161782254052 and parameters: {'n_estimators': 994, 'max_depth': 5, 'learning_rate': 0.011450964268326641, 'subsample': 0.7301321323053057, 'colsample_bytree': 0.5720741027826374, 'colsample_bylevel': 0.4899443222417271, 'colsample_bynode': 0.8801162564063505, 'min_child_weight': 3.3648671441879534, 'gamma': 0.5618690193747615, 'reg_alpha': 0.0007660634613082914, 'reg_lambda': 1.8548894229694903e-07, 'max_delta_step': 6.417575846032317, 'booster': 'dart'}. Best is trial 4 with value: 0.523161782254052.[0m
[32m[I 2026-08-07 10:15:24,663][0m Trial 5 finished with value: 0.5366407474656418 and parameters: {'n_estimators': 2499, 'max_depth': 5, 'learning_rate': 0.010166803740022877, 'subsample': 0.9261845713819337, 'colsample_bytree': 0.7948001406933319, 'colsample_bylevel': 0.810305017628691, 'colsample_bynode': 0.8398892426801621, 'min_child_weight': 1.286390810198991, 'gamma': 0.7169314570885452, 'reg_alpha': 1.1036250149900698e-07, 'reg_lambda': 0.5860448217200517, 'max_delta_step': 4.986385014620463, 'booster': 'gbtree'}. Best is trial 4 with value: 0.523161782254052.[0m
[32m[I 2026-08-07 10:15:26,079][0m Trial 6 finished with value: 0.575140360084809 and parameters: {'n_estimators': 1484, 'max_depth': 6, 'learning_rate': 0.08896916672592671, 'subsample': 0.8550229885420852, 'colsample_bytree': 0.9210489198034286, 'colsample_bylevel': 0.6305504476133645, 'colsample_bynode': 0.3837159721568112, 'min_child_weight': 11.312251057160324, 'gamma': 1.5215700972337949, 'reg_alpha': 0.0011258869313624915, 'reg_lambda': 0.08683696167603723, 'max_delta_step': 3.950364770915126, 'booster': 'gbtree'}. Best is trial 4 with value: 0.523161782254052.[0m
[32m[I 2026-08-07 10:15:30,519][0m Trial 7 finished with value: 0.541328744863719 and parameters: {'n_estimators': 855, 'max_depth': 4, 'learning_rate': 0.010987283063579408, 'subsample': 0.8545641645055122, 'colsample_bytree': 0.5200491867534287, 'colsample_bylevel': 0.6559994838152918, 'colsample_bynode': 0.9352965317482651, 'min_child_weight': 2.3347202509035236, 'gamma': 0.8207658460712595, 'reg_alpha': 0.06308995924905789, 'reg_lambda': 1.1459970229341322e-06, 'max_delta_step': 0.6158392786303439, 'booster': 'gbtree'}. Best is trial 4 with value: 0.523161782254052.[0m
[32m[I 2026-08-07 10:15:31,878][0m Trial 8 finished with value: 0.5548091478573698 and parameters: {'n_estimators': 2846, 'max_depth': 11, 'learning_rate': 0.06669254439997736, 'subsample': 0.9485842360750871, 'colsample_bytree': 0.8625704538293801, 'colsample_bylevel': 0.4305990412202251, 'colsample_bynode': 0.9247912989429843, 'min_child_weight': 6.261435181296005, 'gamma': 1.614880310328125, 'reg_alpha': 1.16097187606918, 'reg_lambda': 7.278322158604965e-06, 'max_delta_step': 0.8804153962214141, 'booster': 'dart'}. Best is trial 4 with value: 0.523161782254052.[0m
[32m[I 2026-08-07 10:15:35,595][0m Trial 9 finished with value: 0.5642547079071232 and parameters: {'n_estimators': 2600, 'max_depth': 11, 'learning_rate': 0.010210451114512976, 'subsample': 0.8042989210310263, 'colsample_bytree': 0.5921877022041453, 'colsample_bylevel': 0.45547546732951116, 'colsample_bynode': 0.38390575713357794, 'min_child_weight': 3.1528154175096095, 'gamma': 1.8858194078250383, 'reg_alpha': 8.106369361161699e-06, 'reg_lambda': 0.0004667836070663388, 'max_delta_step': 5.624151671161423, 'booster': 'dart'}. Best is trial 4 with value: 0.523161782254052.[0m
[32m[I 2026-08-07 10:15:39,133][0m Trial 10 finished with value: 0.5661248680921696 and parameters: {'n_estimators': 989, 'max_depth': 4, 'learning_rate': 0.0139083241033721, 'subsample': 0.7693834487025166, 'colsample_bytree': 0.49253920992995115, 'colsample_bylevel': 0.7341790372058417, 'colsample_bynode': 0.8858311668157662, 'min_child_weight': 8.83279730694527, 'gamma': 1.5966997258840536, 'reg_alpha': 0.012670128041993056, 'reg_lambda': 5.9741033337095555e-06, 'max_delta_step': 7.588210863296524, 'booster': 'dart'}. Best is trial 4 with value: 0.523161782254052.[0m
[32m[I 2026-08-07 10:15:45,398][0m Trial 11 finished with value: 0.5078716844507432 and parameters: {'n_estimators': 1245, 'max_depth': 7, 'learning_rate': 0.016533299688492164, 'subsample': 0.6365947042022191, 'colsample_bytree': 0.38180186499966196, 'colsample_bylevel': 0.4370541119944715, 'colsample_bynode': 0.7569997133644708, 'min_child_weight': 9.205175929278184, 'gamma': 0.10304389888704435, 'reg_alpha': 7.13565343844229e-06, 'reg_lambda': 8.594858757777225e-07, 'max_delta_step': 7.557654811435774, 'booster': 'dart'}. Best is trial 11 with value: 0.5078716844507432.[0m
[32m[I 2026-08-07 10:15:54,123][0m Trial 12 finished with value: 0.5138012909899803 and parameters: {'n_estimators': 1450, 'max_depth': 5, 'learning_rate': 0.010971299417485671, 'subsample': 0.7206175126310708, 'colsample_bytree': 0.3353290144548863, 'colsample_bylevel': 0.3291780474899833, 'colsample_bynode': 0.6919272255733547, 'min_child_weight': 13.195638545778207, 'gamma': 0.013447817283792879, 'reg_alpha': 1.0493076203561789e-07, 'reg_lambda': 2.0853925757951582e-07, 'max_delta_step': 5.04683086920639, 'booster': 'gbtree'}. Best is trial 11 with value: 0.5078716844507432.[0m
[32m[I 2026-08-07 10:15:59,489][0m Trial 13 finished with value: 0.5266136613952883 and parameters: {'n_estimators': 1678, 'max_depth': 4, 'learning_rate': 0.0220461882120811, 'subsample': 0.6546826601928994, 'colsample_bytree': 0.3444796346163434, 'colsample_bylevel': 0.4020006428965137, 'colsample_bynode': 0.4649820840867551, 'min_child_weight': 14.137122299250752, 'gamma': 0.1687192780465728, 'reg_alpha': 1.4605595695570422e-08, 'reg_lambda': 3.004336586600213e-08, 'max_delta_step': 2.5363171638147115, 'booster': 'gbtree'}. Best is trial 11 with value: 0.5078716844507432.[0m
[32m[I 2026-08-07 10:16:04,285][0m Trial 14 finished with value: 0.55430868020138 and parameters: {'n_estimators': 964, 'max_depth': 6, 'learning_rate': 0.016748716442793583, 'subsample': 0.8184764834193512, 'colsample_bytree': 0.4538687195520488, 'colsample_bylevel': 0.42220934934298904, 'colsample_bynode': 0.8628078574415654, 'min_child_weight': 21.596694896130348, 'gamma': 0.5973699403042383, 'reg_alpha': 1.7697956138649294e-08, 'reg_lambda': 2.5523455012158644e-05, 'max_delta_step': 3.6544095693149807, 'booster': 'gbtree'}. Best is trial 11 with value: 0.5078716844507432.[0m
[32m[I 2026-08-07 10:16:12,686][0m Trial 15 finished with value: 0.542837476842216 and parameters: {'n_estimators': 1137, 'max_depth': 8, 'learning_rate': 0.017478631591897262, 'subsample': 0.6110555609685621, 'colsample_bytree': 0.4579422938356092, 'colsample_bylevel': 0.4557067620639054, 'colsample_bynode': 0.6884797984753488, 'min_child_weight': 29.451540653145816, 'gamma': 0.2170497328921684, 'reg_alpha': 1.0592840953155788e-07, 'reg_lambda': 5.880001489232029e-08, 'max_delta_step': 7.953848404702152, 'booster': 'gbtree'}. Best is trial 11 with value: 0.5078716844507432.[0m
[32m[I 2026-08-07 10:16:21,340][0m Trial 16 finished with value: 0.5331410486797661 and parameters: {'n_estimators': 1397, 'max_depth': 6, 'learning_rate': 0.013947558065777672, 'subsample': 0.6017395975859409, 'colsample_bytree': 0.4629486012725701, 'colsample_bylevel': 0.4842706957172487, 'colsample_bynode': 0.9837604738242391, 'min_child_weight': 16.86387790632727, 'gamma': 0.2567190232737396, 'reg_alpha': 3.2041396155224605e-05, 'reg_lambda': 0.009007426404134527, 'max_delta_step': 7.755477587378273, 'booster': 'dart'}. Best is trial 11 with value: 0.5078716844507432.[0m
[32m[I 2026-08-07 10:16:25,543][0m Trial 17 finished with value: 0.5081052235900245 and parameters: {'n_estimators': 2036, 'max_depth': 4, 'learning_rate': 0.020327730561457508, 'subsample': 0.6064799865360607, 'colsample_bytree': 0.4023606870461419, 'colsample_bylevel': 0.3077690808396162, 'colsample_bynode': 0.8018546757139061, 'min_child_weight': 3.540580325417723, 'gamma': 0.18630214530479594, 'reg_alpha': 9.217315682658662e-06, 'reg_lambda': 8.546593957038998e-08, 'max_delta_step': 6.108313871985454, 'booster': 'dart'}. Best is trial 11 with value: 0.5078716844507432.[0m
[32m[I 2026-08-07 10:16:27,402][0m Trial 18 finished with value: 0.5363680360516747 and parameters: {'n_estimators': 2232, 'max_depth': 4, 'learning_rate': 0.062197110336238655, 'subsample': 0.6916177982395908, 'colsample_bytree': 0.36754968677988503, 'colsample_bylevel': 0.3171754531297718, 'colsample_bynode': 0.7535079265252261, 'min_child_weight': 2.1449918595754043, 'gamma': 0.552448439088169, 'reg_alpha': 0.00019087206201445577, 'reg_lambda': 0.003643554168559571, 'max_delta_step': 4.000775774355845, 'booster': 'dart'}. Best is trial 11 with value: 0.5078716844507432.[0m
[32m[I 2026-08-07 10:16:31,729][0m Trial 19 finished with value: 0.49988567096268904 and parameters: {'n_estimators': 2429, 'max_depth': 6, 'learning_rate': 0.01612317552787115, 'subsample': 0.6582166129739072, 'colsample_bytree': 0.5062457445557689, 'colsample_bylevel': 0.30349799557409507, 'colsample_bynode': 0.6621987597716539, 'min_child_weight': 1.7347334676110389, 'gamma': 0.2407383739461303, 'reg_alpha': 1.9905036212373506e-06, 'reg_lambda': 9.853429695612671e-07, 'max_delta_step': 6.718419672557927, 'booster': 'dart'}. Best is trial 19 with value: 0.49988567096268904.[0m
[32m[I 2026-08-07 10:16:35,339][0m Trial 20 finished with value: 0.5378393520611181 and parameters: {'n_estimators': 2684, 'max_depth': 8, 'learning_rate': 0.017590720317936532, 'subsample': 0.7070329376183395, 'colsample_bytree': 0.3981369178478676, 'colsample_bylevel': 0.4563895198678569, 'colsample_bynode': 0.7243937743069683, 'min_child_weight': 1.4112149628352515, 'gamma': 0.9419832624795671, 'reg_alpha': 2.0008729180639028e-08, 'reg_lambda': 3.4000443560748773e-06, 'max_delta_step': 7.215186089165772, 'booster': 'dart'}. Best is trial 19 with value: 0.49988567096268904.[0m
[32m[I 2026-08-07 10:16:38,448][0m Trial 21 finished with value: 0.5123513784329609 and parameters: {'n_estimators': 2504, 'max_depth': 4, 'learning_rate': 0.03814433353949093, 'subsample': 0.6167199250351025, 'colsample_bytree': 0.43201384271788956, 'colsample_bylevel': 0.3535678292917563, 'colsample_bynode': 0.776326275678323, 'min_child_weight': 2.0305011510856055, 'gamma': 0.21311100116811488, 'reg_alpha': 5.740447619091799e-06, 'reg_lambda': 3.318121143471848e-08, 'max_delta_step': 4.729244771424231, 'booster': 'dart'}. Best is trial 19 with value: 0.49988567096268904.[0m
[32m[I 2026-08-07 10:16:42,449][0m Trial 22 finished with value: 0.5358728555494705 and parameters: {'n_estimators': 993, 'max_depth': 7, 'learning_rate': 0.021393448921307213, 'subsample': 0.6835443517269071, 'colsample_bytree': 0.37922117442242, 'colsample_bylevel': 0.5283025666870086, 'colsample_bynode': 0.6770987321701274, 'min_child_weight': 10.212747951304113, 'gamma': 0.4796939007149012, 'reg_alpha': 1.9274899972902193e-07, 'reg_lambda': 3.791635792233807e-06, 'max_delta_step': 7.6280415861436905, 'booster': 'dart'}. Best is trial 19 with value: 0.49988567096268904.[0m
[32m[I 2026-08-07 10:16:47,407][0m Trial 23 finished with value: 0.5221252166303729 and parameters: {'n_estimators': 2096, 'max_depth': 5, 'learning_rate': 0.013157364479329546, 'subsample': 0.6252517907235093, 'colsample_bytree': 0.6969167156162408, 'colsample_bylevel': 0.41918173790726393, 'colsample_bynode': 0.5358636694381138, 'min_child_weight': 2.313222738031692, 'gamma': 0.5882681874630213, 'reg_alpha': 4.669688554539599e-05, 'reg_lambda': 1.3907266446998732e-06, 'max_delta_step': 5.183709153097417, 'booster': 'dart'}. Best is trial 19 with value: 0.49988567096268904.[0m
[32m[I 2026-08-07 10:16:53,620][0m Trial 24 finished with value: 0.5303540377081403 and parameters: {'n_estimators': 1136, 'max_depth': 5, 'learning_rate': 0.016169813752962798, 'subsample': 0.6237298057723809, 'colsample_bytree': 0.5779844802431049, 'colsample_bylevel': 0.30327097730823643, 'colsample_bynode': 0.6779418032034594, 'min_child_weight': 13.991744428054755, 'gamma': 0.21511540909327756, 'reg_alpha': 0.00010701800382346566, 'reg_lambda': 8.002244688941945e-08, 'max_delta_step': 6.167563913706565, 'booster': 'dart'}. Best is trial 19 with value: 0.49988567096268904.[0m
[32m[I 2026-08-07 10:16:55,624][0m Trial 25 finished with value: 0.533407681672603 and parameters: {'n_estimators': 2599, 'max_depth': 6, 'learning_rate': 0.04187174916703561, 'subsample': 0.6395215004310946, 'colsample_bytree': 0.6765583044444471, 'colsample_bylevel': 0.3476841117478239, 'colsample_bynode': 0.856755830455904, 'min_child_weight': 2.1145115940741923, 'gamma': 0.6259773151170357, 'reg_alpha': 0.0037923198546360973, 'reg_lambda': 3.828524947384435e-06, 'max_delta_step': 7.063217200012139, 'booster': 'gbtree'}. Best is trial 19 with value: 0.49988567096268904.[0m
[32m[I 2026-08-07 10:17:04,085][0m Trial 26 finished with value: 0.4912389341537822 and parameters: {'n_estimators': 2836, 'max_depth': 7, 'learning_rate': 0.01055431172047698, 'subsample': 0.6975474294735031, 'colsample_bytree': 0.5856916642623905, 'colsample_bylevel': 0.45173419022500383, 'colsample_bynode': 0.6306089125207789, 'min_child_weight': 2.738047325844326, 'gamma': 0.04330786440385237, 'reg_alpha': 3.9115150953025324e-07, 'reg_lambda': 2.4637213758504395e-05, 'max_delta_step': 4.729943742555452, 'booster': 'dart'}. Best is trial 26 with value: 0.4912389341537822.[0m
[32m[I 2026-08-07 10:17:08,574][0m Trial 27 finished with value: 0.5022313689574942 and parameters: {'n_estimators': 2924, 'max_depth': 8, 'learning_rate': 0.016744684194232022, 'subsample': 0.7946885540301487, 'colsample_bytree': 0.5704445083686723, 'colsample_bylevel': 0.5499078449761883, 'colsample_bynode': 0.9016665483817435, 'min_child_weight': 1.869304571822866, 'gamma': 0.12951936827750743, 'reg_alpha': 3.1987842453796675e-05, 'reg_lambda': 2.91658003335089e-05, 'max_delta_step': 3.3231471742383842, 'booster': 'dart'}. Best is trial 26 with value: 0.4912389341537822.[0m
[32m[I 2026-08-07 10:17:14,921][0m Trial 28 finished with value: 0.49085774913320834 and parameters: {'n_estimators': 2970, 'max_depth': 9, 'learning_rate': 0.014182206877185228, 'subsample': 0.7860884243632265, 'colsample_bytree': 0.6185486916349331, 'colsample_bylevel': 0.5057918084694641, 'colsample_bynode': 0.9403154934691558, 'min_child_weight': 1.6514525470697872, 'gamma': 0.03563864549065281, 'reg_alpha': 0.000404713784751787, 'reg_lambda': 2.2324118358010525e-06, 'max_delta_step': 4.674773175621435, 'booster': 'dart'}. Best is trial 28 with value: 0.49085774913320834.[0m
[32m[I 2026-08-07 10:17:22,819][0m Trial 29 finished with value: 0.49315872765152025 and parameters: {'n_estimators': 2285, 'max_depth': 7, 'learning_rate': 0.011209453845609146, 'subsample': 0.6630124829118066, 'colsample_bytree': 0.7418271815723779, 'colsample_bylevel': 0.32263356358587103, 'colsample_bynode': 0.8816831399691898, 'min_child_weight': 1.2407345284177422, 'gamma': 0.04426758560479874, 'reg_alpha': 2.734484929205376e-07, 'reg_lambda': 3.305643908874911e-06, 'max_delta_step': 7.103989830179037, 'booster': 'dart'}. Best is trial 28 with value: 0.49085774913320834.[0m
[32m[I 2026-08-07 10:17:28,773][0m Trial 30 finished with value: 0.5076004575185986 and parameters: {'n_estimators': 2874, 'max_depth': 8, 'learning_rate': 0.011810773103769845, 'subsample': 0.7064212946866506, 'colsample_bytree': 0.7812664228067696, 'colsample_bylevel': 0.6250571199032724, 'colsample_bynode': 0.5656676436029804, 'min_child_weight': 1.0330654999288162, 'gamma': 0.15123423622415488, 'reg_alpha': 7.061951956696114e-08, 'reg_lambda': 2.676450695728312e-05, 'max_delta_step': 2.139941880639986, 'booster': 'gbtree'}. Best is trial 28 with value: 0.49085774913320834.[0m
[32m[I 2026-08-07 10:17:32,611][0m Trial 31 finished with value: 0.5209555069821513 and parameters: {'n_estimators': 2647, 'max_depth': 8, 'learning_rate': 0.011065377231970432, 'subsample': 0.79645258106001, 'colsample_bytree': 0.7447189311853025, 'colsample_bylevel': 0.333017874792001, 'colsample_bynode': 0.8350251326042242, 'min_child_weight': 1.1164717242591609, 'gamma': 0.4664938229560656, 'reg_alpha': 1.1479417941323068e-06, 'reg_lambda': 2.7397621821206724e-06, 'max_delta_step': 7.2972144002796275, 'booster': 'dart'}. Best is trial 28 with value: 0.49085774913320834.[0m
[32m[I 2026-08-07 10:17:36,286][0m Trial 32 finished with value: 0.5202751060591726 and parameters: {'n_estimators': 1634, 'max_depth': 6, 'learning_rate': 0.016614534366570465, 'subsample': 0.6068816232910317, 'colsample_bytree': 0.8710008943171581, 'colsample_bylevel': 0.40881682904674665, 'colsample_bynode': 0.9388104654763534, 'min_child_weight': 1.2825063761798747, 'gamma': 0.48361398496960106, 'reg_alpha': 9.131322156804412e-06, 'reg_lambda': 5.124889765979002e-05, 'max_delta_step': 7.752379931557732, 'booster': 'dart'}. Best is trial 28 with value: 0.49085774913320834.[0m
[32m[I 2026-08-07 10:17:42,230][0m Trial 33 finished with value: 0.506003937727693 and parameters: {'n_estimators': 2502, 'max_depth': 9, 'learning_rate': 0.015934831229070023, 'subsample': 0.6240699284373714, 'colsample_bytree': 0.6108001528561945, 'colsample_bylevel': 0.3638018746098336, 'colsample_bynode': 0.7650486592022406, 'min_child_weight': 3.168470248796047, 'gamma': 0.06915991915771155, 'reg_alpha': 2.6458600124536674e-08, 'reg_lambda': 0.0001416833252513678, 'max_delta_step': 5.170678628862668, 'booster': 'dart'}. Best is trial 28 with value: 0.49085774913320834.[0m
[32m[I 2026-08-07 10:17:45,651][0m Trial 34 finished with value: 0.5238966242910815 and parameters: {'n_estimators': 2700, 'max_depth': 10, 'learning_rate': 0.01505263494966645, 'subsample': 0.8172336037160972, 'colsample_bytree': 0.4164105486736408, 'colsample_bylevel': 0.40508624511857777, 'colsample_bynode': 0.9199547830762895, 'min_child_weight': 1.81431428078083, 'gamma': 0.5847773365035632, 'reg_alpha': 0.008059867914053224, 'reg_lambda': 2.810503881266523e-08, 'max_delta_step': 5.132266129760416, 'booster': 'dart'}. Best is trial 28 with value: 0.49085774913320834.[0m
[32m[I 2026-08-07 10:17:51,909][0m Trial 35 finished with value: 0.5069509753662946 and parameters: {'n_estimators': 2907, 'max_depth': 9, 'learning_rate': 0.015343007272338985, 'subsample': 0.8174783114085372, 'colsample_bytree': 0.9341761715148338, 'colsample_bylevel': 0.3807891737084913, 'colsample_bynode': 0.8729559667699789, 'min_child_weight': 5.236196882032502, 'gamma': 0.23437328663708518, 'reg_alpha': 0.0006742597836678355, 'reg_lambda': 2.517060488515097e-07, 'max_delta_step': 4.463989297932158, 'booster': 'gbtree'}. Best is trial 28 with value: 0.49085774913320834.[0m
