[32m[I 2026-08-07 10:25:58,084][0m Trial 111 finished with value: 0.5024018451128633 and parameters: {'n_estimators': 2684, 'max_depth': 4, 'learning_rate': 0.013815813783852614, 'subsample': 0.7464640714280918, 'colsample_bytree': 0.8810009446066919, 'colsample_bylevel': 0.5533186467126712, 'colsample_bynode': 0.6369707671885357, 'min_child_weight': 3.496681013603199, 'gamma': 0.2548505271704994, 'reg_alpha': 1.3086852633161906e-05, 'reg_lambda': 0.05195789005128294, 'max_delta_step': 4.697787660970749, 'booster': 'dart'}. Best is trial 40 with value: 0.4871527147719707.[0m
[32m[I 2026-08-07 10:26:02,945][0m Trial 112 finished with value: 0.5156013575159575 and parameters: {'n_estimators': 2973, 'max_depth': 8, 'learning_rate': 0.013233701160644254, 'subsample': 0.6673889438307218, 'colsample_bytree': 0.6242374503186142, 'colsample_bylevel': 0.5306130284735051, 'colsample_bynode': 0.6951378850347929, 'min_child_weight': 2.735336969078133, 'gamma': 0.39665787353637527, 'reg_alpha': 1.2657586925990027e-05, 'reg_lambda': 0.00025275995859723514, 'max_delta_step': 6.067288340756079, 'booster': 'dart'}. Best is trial 40 with value: 0.4871527147719707.[0m
[32m[I 2026-08-07 10:26:10,005][0m Trial 113 finished with value: 0.512031783570859 and parameters: {'n_estimators': 2023, 'max_depth': 6, 'learning_rate': 0.02387423765000862, 'subsample': 0.9147205289710777, 'colsample_bytree': 0.8402607854922878, 'colsample_bylevel': 0.6627727699898834, 'colsample_bynode': 0.7345747602403412, 'min_child_weight': 16.71682083262299, 'gamma': 0.047092804021912994, 'reg_alpha': 1.7482374693994368e-05, 'reg_lambda': 0.025563269066178874, 'max_delta_step': 2.551068468334, 'booster': 'gbtree'}. Best is trial 40 with value: 0.4871527147719707.[0m
[32m[I 2026-08-07 10:26:13,518][0m Trial 114 finished with value: 0.5185711351294671 and parameters: {'n_estimators': 2462, 'max_depth': 4, 'learning_rate': 0.02063374230990476, 'subsample': 0.8518466494410691, 'colsample_bytree': 0.361412378006949, 'colsample_bylevel': 0.4525648883879807, 'colsample_bynode': 0.6998591002417838, 'min_child_weight': 1.8484276740545045, 'gamma': 0.31868007356567946, 'reg_alpha': 3.427518153331489e-07, 'reg_lambda': 0.003932341324039052, 'max_delta_step': 4.334345119913931, 'booster': 'gbtree'}. Best is trial 40 with value: 0.4871527147719707.[0m
[32m[I 2026-08-07 10:26:18,296][0m Trial 115 finished with value: 0.5070665875001821 and parameters: {'n_estimators': 2839, 'max_depth': 6, 'learning_rate': 0.010882114874293459, 'subsample': 0.7153501806790018, 'colsample_bytree': 0.5010461898327241, 'colsample_bylevel': 0.32136222579701706, 'colsample_bynode': 0.6775164315871534, 'min_child_weight': 1.1054772023463753, 'gamma': 0.2243719483268779, 'reg_alpha': 4.018175320396262e-05, 'reg_lambda': 0.0010848000741877824, 'max_delta_step': 3.3924392891128687, 'booster': 'gbtree'}. Best is trial 40 with value: 0.4871527147719707.[0m
[32m[I 2026-08-07 10:26:20,273][0m Trial 116 finished with value: 0.5191977701990174 and parameters: {'n_estimators': 2058, 'max_depth': 8, 'learning_rate': 0.04034106341699849, 'subsample': 0.7733924029991845, 'colsample_bytree': 0.374901121308452, 'colsample_bylevel': 0.548643762984983, 'colsample_bynode': 0.5423994729186586, 'min_child_weight': 1.2899278063714887, 'gamma': 0.30664744230472174, 'reg_alpha': 0.004135199311741771, 'reg_lambda': 0.07161623181448885, 'max_delta_step': 0.8249456432234781, 'booster': 'gbtree'}. Best is trial 40 with value: 0.4871527147719707.[0m
[32m[I 2026-08-07 10:26:25,548][0m Trial 117 finished with value: 0.5000966021052525 and parameters: {'n_estimators': 2889, 'max_depth': 6, 'learning_rate': 0.0198807193578913, 'subsample': 0.7799634676443892, 'colsample_bytree': 0.3617536058749823, 'colsample_bylevel': 0.4481514870627983, 'colsample_bynode': 0.5275428458589285, 'min_child_weight': 4.042693933653187, 'gamma': 0.03413858149519895, 'reg_alpha': 9.794536414107916e-06, 'reg_lambda': 0.010399724179084047, 'max_delta_step': 2.189514070298647, 'booster': 'gbtree'}. Best is trial 40 with value: 0.4871527147719707.[0m
[32m[I 2026-08-07 10:26:33,745][0m Trial 118 finished with value: 0.49318576935470065 and parameters: {'n_estimators': 1960, 'max_depth': 8, 'learning_rate': 0.010651144812037036, 'subsample': 0.6446927364280635, 'colsample_bytree': 0.6153481384989216, 'colsample_bylevel': 0.38146619803300946, 'colsample_bynode': 0.7620816346805761, 'min_child_weight': 1.2701784719836766, 'gamma': 0.01208332172356455, 'reg_alpha': 4.885176533992156e-06, 'reg_lambda': 1.62151093249674e-05, 'max_delta_step': 6.195502994320942, 'booster': 'dart'}. Best is trial 40 with value: 0.4871527147719707.[0m
[32m[I 2026-08-07 10:26:44,210][0m Trial 119 finished with value: 0.4893292646007401 and parameters: {'n_estimators': 2930, 'max_depth': 4, 'learning_rate': 0.011214250987862107, 'subsample': 0.9051814037763725, 'colsample_bytree': 0.7845243505663875, 'colsample_bylevel': 0.6830523290903749, 'colsample_bynode': 0.6719988054983133, 'min_child_weight': 2.3826270706336903, 'gamma': 0.030699771732916645, 'reg_alpha': 2.551126019154322e-05, 'reg_lambda': 0.2659078492413197, 'max_delta_step': 5.142122903575562, 'booster': 'dart'}. Best is trial 40 with value: 0.4871527147719707.[0m
[32m[I 2026-08-07 10:26:47,442][0m Trial 120 finished with value: 0.5069720417131566 and parameters: {'n_estimators': 1301, 'max_depth': 5, 'learning_rate': 0.0416858643763463, 'subsample': 0.987447888497065, 'colsample_bytree': 0.9064776294507567, 'colsample_bylevel': 0.6864325019393839, 'colsample_bynode': 0.983306348329213, 'min_child_weight': 2.8706650446800626, 'gamma': 0.10020865798886511, 'reg_alpha': 0.0002012094067693659, 'reg_lambda': 0.09118331834463889, 'max_delta_step': 2.031051552722895, 'booster': 'gbtree'}. Best is trial 40 with value: 0.4871527147719707.[0m
[32m[I 2026-08-07 10:26:57,544][0m Trial 121 finished with value: 0.4940632277017444 and parameters: {'n_estimators': 2786, 'max_depth': 4, 'learning_rate': 0.012787966758443946, 'subsample': 0.9218302922486242, 'colsample_bytree': 0.7324794269184878, 'colsample_bylevel': 0.5581739909139839, 'colsample_bynode': 0.618423087720946, 'min_child_weight': 1.4726677090746858, 'gamma': 0.03938518410539367, 'reg_alpha': 5.50592703370537e-08, 'reg_lambda': 3.6048086469572906, 'max_delta_step': 5.570740226805457, 'booster': 'dart'}. Best is trial 40 with value: 0.4871527147719707.[0m
[32m[I 2026-08-07 10:27:05,045][0m Trial 122 finished with value: 0.5037924481352907 and parameters: {'n_estimators': 2811, 'max_depth': 4, 'learning_rate': 0.013201185177285173, 'subsample': 0.8700742711963723, 'colsample_bytree': 0.7708715412938226, 'colsample_bylevel': 0.8567581857237114, 'colsample_bynode': 0.7467160830041898, 'min_child_weight': 2.979216457817753, 'gamma': 0.1970166655366154, 'reg_alpha': 7.397311640724308e-05, 'reg_lambda': 0.002557689381038673, 'max_delta_step': 3.58748337759595, 'booster': 'dart'}. Best is trial 40 with value: 0.4871527147719707.[0m
[32m[I 2026-08-07 10:27:11,747][0m Trial 123 finished with value: 0.49974875750740166 and parameters: {'n_estimators': 2676, 'max_depth': 6, 'learning_rate': 0.01365207486948893, 'subsample': 0.7812166310833768, 'colsample_bytree': 0.6595254888042487, 'colsample_bylevel': 0.6377223803755381, 'colsample_bynode': 0.827293419438381, 'min_child_weight': 1.7955481649216085, 'gamma': 0.126611563861111, 'reg_alpha': 0.0524137275920509, 'reg_lambda': 7.520753814001891e-07, 'max_delta_step': 6.452449592614163, 'booster': 'dart'}. Best is trial 40 with value: 0.4871527147719707.[0m
[32m[I 2026-08-07 10:27:23,552][0m Trial 124 finished with value: 0.4861149496788636 and parameters: {'n_estimators': 2224, 'max_depth': 4, 'learning_rate': 0.01150119097405912, 'subsample': 0.8610907159154555, 'colsample_bytree': 0.6840955362028376, 'colsample_bylevel': 0.7544504979576214, 'colsample_bynode': 0.824778975469411, 'min_child_weight': 4.5296689653240865, 'gamma': 0.019213876922545267, 'reg_alpha': 1.8113562759671642e-08, 'reg_lambda': 0.005251972794949606, 'max_delta_step': 2.1488636113727626, 'booster': 'dart'}. Best is trial 124 with value: 0.4861149496788636.[0m
[32m[I 2026-08-07 10:27:31,386][0m Trial 125 finished with value: 0.507274696869175 and parameters: {'n_estimators': 2380, 'max_depth': 5, 'learning_rate': 0.016479360427833458, 'subsample': 0.9149943048058575, 'colsample_bytree': 0.7430810894454268, 'colsample_bylevel': 0.9074646881947157, 'colsample_bynode': 0.9815478775264052, 'min_child_weight': 10.094754165680353, 'gamma': 0.10379270791318027, 'reg_alpha': 1.0672111599387229e-07, 'reg_lambda': 0.0006535217816872323, 'max_delta_step': 1.0700555649581964, 'booster': 'dart'}. Best is trial 124 with value: 0.4861149496788636.[0m
[32m[I 2026-08-07 10:27:42,184][0m Trial 126 finished with value: 0.49224393327898885 and parameters: {'n_estimators': 1432, 'max_depth': 4, 'learning_rate': 0.012828061921926138, 'subsample': 0.9789389877381304, 'colsample_bytree': 0.9399107025347694, 'colsample_bylevel': 0.7463087507487256, 'colsample_bynode': 0.9570933685641402, 'min_child_weight': 6.1920137299536195, 'gamma': 0.04888212754402277, 'reg_alpha': 1.2760862245724428e-08, 'reg_lambda': 6.130935799150197e-05, 'max_delta_step': 1.7964369659407036, 'booster': 'gbtree'}. Best is trial 124 with value: 0.4861149496788636.[0m
[32m[I 2026-08-07 10:27:49,497][0m Trial 127 finished with value: 0.4992966384682124 and parameters: {'n_estimators': 1951, 'max_depth': 4, 'learning_rate': 0.010099753037183, 'subsample': 0.824132433529609, 'colsample_bytree': 0.5451934875278768, 'colsample_bylevel': 0.7389939654013321, 'colsample_bynode': 0.7234686731642604, 'min_child_weight': 2.0924483260855062, 'gamma': 0.17208942251286474, 'reg_alpha': 1.9812673248798435e-07, 'reg_lambda': 0.0033416084052822373, 'max_delta_step': 2.1045031551951094, 'booster': 'dart'}. Best is trial 124 with value: 0.4861149496788636.[0m
[32m[I 2026-08-07 10:27:59,933][0m Trial 128 finished with value: 0.5187315774814966 and parameters: {'n_estimators': 1407, 'max_depth': 6, 'learning_rate': 0.010964960516997085, 'subsample': 0.861517012322808, 'colsample_bytree': 0.8021187105120708, 'colsample_bylevel': 0.6907363201329997, 'colsample_bynode': 0.7964008187061203, 'min_child_weight': 14.729640205577109, 'gamma': 0.1432594125390264, 'reg_alpha': 3.26117198862704e-08, 'reg_lambda': 0.0006608546736164541, 'max_delta_step': 1.8166212160167612, 'booster': 'gbtree'}. Best is trial 124 with value: 0.4861149496788636.[0m
[32m[I 2026-08-07 10:28:03,615][0m Trial 129 finished with value: 0.5391331751665216 and parameters: {'n_estimators': 2516, 'max_depth': 4, 'learning_rate': 0.016291257509979465, 'subsample': 0.9823643274018468, 'colsample_bytree': 0.6880029807389418, 'colsample_bylevel': 0.5001068656088214, 'colsample_bynode': 0.649670086500061, 'min_child_weight': 6.721191556897365, 'gamma': 0.6280842349299574, 'reg_alpha': 7.583276620608038e-05, 'reg_lambda': 0.22201030117030757, 'max_delta_step': 6.436919212665849, 'booster': 'dart'}. Best is trial 124 with value: 0.4861149496788636.[0m
[32m[I 2026-08-07 10:28:08,267][0m Trial 130 finished with value: 0.5086269296610257 and parameters: {'n_estimators': 2292, 'max_depth': 5, 'learning_rate': 0.024066974476714326, 'subsample': 0.8139367439108633, 'colsample_bytree': 0.6466456201700869, 'colsample_bylevel': 0.6527589502176071, 'colsample_bynode': 0.8593087910329463, 'min_child_weight': 4.259329061289644, 'gamma': 0.23451746014515823, 'reg_alpha': 7.807743341777823e-07, 'reg_lambda': 0.00034044194312277717, 'max_delta_step': 0.44284931294522467, 'booster': 'dart'}. Best is trial 124 with value: 0.4861149496788636.[0m
[32m[I 2026-08-07 10:28:16,640][0m Trial 131 finished with value: 0.5092268618631449 and parameters: {'n_estimators': 1241, 'max_depth': 7, 'learning_rate': 0.021969439173571775, 'subsample': 0.9798680631134663, 'colsample_bytree': 0.8601352131126908, 'colsample_bylevel': 0.7543909491625902, 'colsample_bynode': 0.9990219650981268, 'min_child_weight': 5.628695645299531, 'gamma': 0.18169252844879186, 'reg_alpha': 2.253134853053365e-08, 'reg_lambda': 0.00031103668472970907, 'max_delta_step': 0.22782859234268082, 'booster': 'gbtree'}. Best is trial 124 with value: 0.4861149496788636.[0m
[32m[I 2026-08-07 10:28:18,937][0m Trial 132 pruned. [0m
[32m[I 2026-08-07 10:28:25,888][0m Trial 133 finished with value: 0.5023829383781385 and parameters: {'n_estimators': 1606, 'max_depth': 5, 'learning_rate': 0.012043421652908446, 'subsample': 0.9622236361565869, 'colsample_bytree': 0.9044844940928082, 'colsample_bylevel': 0.7370995929143609, 'colsample_bynode': 0.8892262511914063, 'min_child_weight': 7.865609918694214, 'gamma': 0.17507053811967752, 'reg_alpha': 4.739916741602364e-06, 'reg_lambda': 1.7276659977659246e-05, 'max_delta_step': 1.8238510474243972, 'booster': 'gbtree'}. Best is trial 124 with value: 0.4861149496788636.[0m
[32m[I 2026-08-07 10:28:32,116][0m Trial 134 finished with value: 0.5202350634338355 and parameters: {'n_estimators': 1223, 'max_depth': 5, 'learning_rate': 0.012612592621637584, 'subsample': 0.9878746129280672, 'colsample_bytree': 0.9028756681593277, 'colsample_bylevel': 0.7588869381343297, 'colsample_bynode': 0.873676194884996, 'min_child_weight': 7.568064767211684, 'gamma': 0.5196294149331026, 'reg_alpha': 1.9192016648159385e-07, 'reg_lambda': 0.005035591194364247, 'max_delta_step': 2.568546981285777, 'booster': 'dart'}. Best is trial 124 with value: 0.4861149496788636.[0m
[32m[I 2026-08-07 10:28:36,455][0m Trial 135 finished with value: 0.4988940694293523 and parameters: {'n_estimators': 2878, 'max_depth': 9, 'learning_rate': 0.018709100756969955, 'subsample': 0.7292115320121776, 'colsample_bytree': 0.6873507617034174, 'colsample_bylevel': 0.43423402797072946, 'colsample_bynode': 0.9674466422788759, 'min_child_weight': 1.8994043477892202, 'gamma': 0.10117870850708628, 'reg_alpha': 5.131087679632345e-05, 'reg_lambda': 6.376660967901143e-07, 'max_delta_step': 3.5277210993802015, 'booster': 'dart'}. Best is trial 124 with value: 0.4861149496788636.[0m
[32m[I 2026-08-07 10:28:45,737][0m Trial 136 finished with value: 0.5022853010293655 and parameters: {'n_estimators': 2823, 'max_depth': 6, 'learning_rate': 0.01001977062266849, 'subsample': 0.969296712434342, 'colsample_bytree': 0.958580245450008, 'colsample_bylevel': 0.7761013285430923, 'colsample_bynode': 0.7896163640723705, 'min_child_weight': 5.921489442573908, 'gamma': 0.12562124846234615, 'reg_alpha': 7.39002776210283e-08, 'reg_lambda': 0.11338424525072249, 'max_delta_step': 4.267383094004362, 'booster': 'dart'}. Best is trial 124 with value: 0.4861149496788636.[0m
[32m[I 2026-08-07 10:28:49,766][0m Trial 137 finished with value: 0.5111930536174772 and parameters: {'n_estimators': 2572, 'max_depth': 4, 'learning_rate': 0.02207458545435443, 'subsample': 0.7464588427602802, 'colsample_bytree': 0.5977360974859767, 'colsample_bylevel': 0.35222649275703743, 'colsample_bynode': 0.49337682929138205, 'min_child_weight': 2.530413937129177, 'gamma': 0.23771760111131343, 'reg_alpha': 0.0003637993877594677, 'reg_lambda': 0.3346992003925322, 'max_delta_step': 5.199402076239016, 'booster': 'dart'}. Best is trial 124 with value: 0.4861149496788636.[0m
[32m[I 2026-08-07 10:28:53,171][0m Trial 138 finished with value: 0.5095907636405851 and parameters: {'n_estimators': 2685, 'max_depth': 10, 'learning_rate': 0.026661419203040774, 'subsample': 0.8316252735969708, 'colsample_bytree': 0.5438883040698621, 'colsample_bylevel': 0.5374216425131256, 'colsample_bynode': 0.9813820075969628, 'min_child_weight': 1.1204926640117878, 'gamma': 0.21755568911098622, 'reg_alpha': 0.0031606170100231088, 'reg_lambda': 7.615989988139282e-05, 'max_delta_step': 4.776507620489992, 'booster': 'dart'}. Best is trial 124 with value: 0.4861149496788636.[0m
[32m[I 2026-08-07 10:28:57,996][0m Trial 139 finished with value: 0.5234302230653667 and parameters: {'n_estimators': 1103, 'max_depth': 4, 'learning_rate': 0.01083177744771897, 'subsample': 0.9076658012658241, 'colsample_bytree': 0.9508635517604577, 'colsample_bylevel': 0.36988022681734073, 'colsample_bynode': 0.9787537591951436, 'min_child_weight': 2.3859731776035265, 'gamma': 0.5135349710138917, 'reg_alpha': 1.543728654339134e-05, 'reg_lambda': 0.0038996004023827135, 'max_delta_step': 2.8099373931212592, 'booster': 'gbtree'}. Best is trial 124 with value: 0.4861149496788636.[0m
[32m[I 2026-08-07 10:29:02,335][0m Trial 140 finished with value: 0.5070680339032603 and parameters: {'n_estimators': 1949, 'max_depth': 8, 'learning_rate': 0.02104074102987088, 'subsample': 0.6222755141225341, 'colsample_bytree': 0.7934811185646243, 'colsample_bylevel': 0.6741277853694329, 'colsample_bynode': 0.7883170496272041, 'min_child_weight': 1.101168359454855, 'gamma': 0.2614924433596406, 'reg_alpha': 1.1166754023220224e-06, 'reg_lambda': 6.48859459038803e-07, 'max_delta_step': 7.137669350202074, 'booster': 'gbtree'}. Best is trial 124 with value: 0.4861149496788636.[0m
[32m[I 2026-08-07 10:29:11,297][0m Trial 141 finished with value: 0.5061686074976839 and parameters: {'n_estimators': 2980, 'max_depth': 4, 'learning_rate': 0.014734433115128646, 'subsample': 0.8794274038997398, 'colsample_bytree': 0.9681730390996917, 'colsample_bylevel': 0.665497221247987, 'colsample_bynode': 0.7221795875819068, 'min_child_weight': 1.2280059396398184, 'gamma': 0.11890811246212386, 'reg_alpha': 1.4347019780621978e-07, 'reg_lambda': 6.7381005182463305, 'max_delta_step': 2.423606888773814, 'booster': 'dart'}. Best is trial 124 with value: 0.4861149496788636.[0m
[32m[I 2026-08-07 10:29:20,493][0m Trial 142 finished with value: 0.48656370263411874 and parameters: {'n_estimators': 2346, 'max_depth': 4, 'learning_rate': 0.010622777553339027, 'subsample': 0.8949060599428443, 'colsample_bytree': 0.750153024929753, 'colsample_bylevel': 0.5800839966455336, 'colsample_bynode': 0.6341002118214816, 'min_child_weight': 2.0243243970295905, 'gamma': 0.07180040529384307, 'reg_alpha': 0.0005679648093965412, 'reg_lambda': 0.004739183653500723, 'max_delta_step': 4.666265248819233, 'booster': 'dart'}. Best is trial 124 with value: 0.4861149496788636.[0m
[32m[I 2026-08-07 10:29:28,524][0m Trial 143 finished with value: 0.49806650278320674 and parameters: {'n_estimators': 2249, 'max_depth': 5, 'learning_rate': 0.010524666968387348, 'subsample': 0.9243808846077552, 'colsample_bytree': 0.6595424831877968, 'colsample_bylevel': 0.8918916126442729, 'colsample_bynode': 0.7198347825249274, 'min_child_weight': 3.7217397393157685, 'gamma': 0.1332299719256647, 'reg_alpha': 1.0095320068304247e-08, 'reg_lambda': 0.0004277466216847453, 'max_delta_step': 2.838986775815706, 'booster': 'dart'}. Best is trial 124 with value: 0.4861149496788636.[0m
[32m[I 2026-08-07 10:29:33,986][0m Trial 144 finished with value: 0.49987614980171086 and parameters: {'n_estimators': 2185, 'max_depth': 8, 'learning_rate': 0.014941743832334415, 'subsample': 0.827962196540916, 'colsample_bytree': 0.9820700957020377, 'colsample_bylevel': 0.44427371692027373, 'colsample_bynode': 0.6830421638168636, 'min_child_weight': 1.818201081557949, 'gamma': 0.1899241786295956, 'reg_alpha': 1.0282784882085094e-05, 'reg_lambda': 0.21024873344320277, 'max_delta_step': 6.576062390904264, 'booster': 'dart'}. Best is trial 124 with value: 0.4861149496788636.[0m
[32m[I 2026-08-07 10:29:38,822][0m Trial 145 finished with value: 0.5106686419111569 and parameters: {'n_estimators': 2871, 'max_depth': 4, 'learning_rate': 0.020225623458336065, 'subsample': 0.9010359821708401, 'colsample_bytree': 0.6153144459766751, 'colsample_bylevel': 0.7991858153868506, 'colsample_bynode': 0.7123679409773451, 'min_child_weight': 2.63799538815922, 'gamma': 0.2575936702425309, 'reg_alpha': 3.621882100650665e-05, 'reg_lambda': 1.4149932559069587, 'max_delta_step': 6.289219241707582, 'booster': 'dart'}. Best is trial 124 with value: 0.4861149496788636.[0m
[32m[I 2026-08-07 10:29:44,077][0m Trial 146 finished with value: 0.5067116664743467 and parameters: {'n_estimators': 2470, 'max_depth': 6, 'learning_rate': 0.012832126609485135, 'subsample': 0.916483111196652, 'colsample_bytree': 0.8996690868684, 'colsample_bylevel': 0.5589739911380238, 'colsample_bynode': 0.618995402950179, 'min_child_weight': 1.130025528640593, 'gamma': 0.26604521848777796, 'reg_alpha': 1.8221109160210016e-05, 'reg_lambda': 0.00011481247461282628, 'max_delta_step': 4.682074103464589, 'booster': 'dart'}. Best is trial 124 with value: 0.4861149496788636.[0m
[32m[I 2026-08-07 10:29:49,388][0m Trial 147 finished with value: 0.5009605029545823 and parameters: {'n_estimators': 2877, 'max_depth': 9, 'learning_rate': 0.015254842604226819, 'subsample': 0.6803236504187388, 'colsample_bytree': 0.34096037536797996, 'colsample_bylevel': 0.4037520547401457, 'colsample_bynode': 0.523634492964151, 'min_child_weight': 1.1612837118891326, 'gamma': 0.0670391182691489, 'reg_alpha': 6.768485635590749e-08, 'reg_lambda': 1.4487863938099853e-05, 'max_delta_step': 5.614932835506055, 'booster': 'gbtree'}. Best is trial 124 with value: 0.4861149496788636.[0m
[32m[I 2026-08-07 10:29:57,886][0m Trial 148 finished with value: 0.49954009358344276 and parameters: {'n_estimators': 2569, 'max_depth': 7, 'learning_rate': 0.011267260847985329, 'subsample': 0.772857146708442, 'colsample_bytree': 0.893413581150805, 'colsample_bylevel': 0.6458609228511444, 'colsample_bynode': 0.5218483521426334, 'min_child_weight': 2.0085603512309667, 'gamma': 0.1387204257474596, 'reg_alpha': 1.9313804459641934e-07, 'reg_lambda': 1.5692635440024059, 'max_delta_step': 5.99979717996938, 'booster': 'dart'}. Best is trial 124 with value: 0.4861149496788636.[0m
