[32m[I 2026-08-07 10:30:05,432][0m Trial 149 finished with value: 0.5102281222612095 and parameters: {'n_estimators': 2576, 'max_depth': 4, 'learning_rate': 0.012188928601500594, 'subsample': 0.9387167024561992, 'colsample_bytree': 0.649670894244898, 'colsample_bylevel': 0.474650728016178, 'colsample_bynode': 0.5769219645391248, 'min_child_weight': 1.6436635027377846, 'gamma': 0.20635642337019822, 'reg_alpha': 0.0020780067554367907, 'reg_lambda': 0.0008042802635558455, 'max_delta_step': 3.351222654280325, 'booster': 'dart'}. Best is trial 124 with value: 0.4861149496788636.[0m
[32m[I 2026-08-07 10:30:11,928][0m Trial 150 finished with value: 0.4999848956233852 and parameters: {'n_estimators': 2542, 'max_depth': 7, 'learning_rate': 0.011262332712564719, 'subsample': 0.6973208676947252, 'colsample_bytree': 0.340789051661741, 'colsample_bylevel': 0.6027631822009197, 'colsample_bynode': 0.6270434530705411, 'min_child_weight': 1.8210437608260974, 'gamma': 0.11003105320595685, 'reg_alpha': 0.02454650648680222, 'reg_lambda': 0.15385153164141532, 'max_delta_step': 2.519081297304773, 'booster': 'gbtree'}. Best is trial 124 with value: 0.4861149496788636.[0m
[32m[I 2026-08-07 10:30:18,602][0m Trial 151 finished with value: 0.519598398447348 and parameters: {'n_estimators': 1986, 'max_depth': 4, 'learning_rate': 0.011181381349188151, 'subsample': 0.8375667656290706, 'colsample_bytree': 0.5700478165749407, 'colsample_bylevel': 0.7701389023189814, 'colsample_bynode': 0.6458772335439407, 'min_child_weight': 1.1166853470412756, 'gamma': 0.3509930101246173, 'reg_alpha': 0.005997073394677221, 'reg_lambda': 0.0020594893430537203, 'max_delta_step': 4.037762814065547, 'booster': 'dart'}. Best is trial 124 with value: 0.4861149496788636.[0m
[32m[I 2026-08-07 10:30:24,602][0m Trial 152 finished with value: 0.4955488271193576 and parameters: {'n_estimators': 805, 'max_depth': 4, 'learning_rate': 0.021985901463086672, 'subsample': 0.9034623805624653, 'colsample_bytree': 0.9349042051068581, 'colsample_bylevel': 0.7686151780514578, 'colsample_bynode': 0.9280128994733768, 'min_child_weight': 7.132230583038964, 'gamma': 0.10407613605430828, 'reg_alpha': 2.268685418178147e-08, 'reg_lambda': 1.806626423199441e-05, 'max_delta_step': 2.486694273197859, 'booster': 'gbtree'}. Best is trial 124 with value: 0.4861149496788636.[0m
[32m[I 2026-08-07 10:30:28,605][0m Trial 153 finished with value: 0.5235994303493227 and parameters: {'n_estimators': 2157, 'max_depth': 4, 'learning_rate': 0.014500055648963252, 'subsample': 0.6387534122797466, 'colsample_bytree': 0.7188980117777345, 'colsample_bylevel': 0.320299547181727, 'colsample_bynode': 0.7635436077262325, 'min_child_weight': 1.3206202188456508, 'gamma': 0.4833045127325827, 'reg_alpha': 1.4983828503098502e-07, 'reg_lambda': 1.2324098968085854e-06, 'max_delta_step': 6.847030214682034, 'booster': 'dart'}. Best is trial 124 with value: 0.4861149496788636.[0m
[32m[I 2026-08-07 10:30:36,846][0m Trial 154 finished with value: 0.5107310252967875 and parameters: {'n_estimators': 2944, 'max_depth': 7, 'learning_rate': 0.010790333319756453, 'subsample': 0.8438950807574478, 'colsample_bytree': 0.8532579001083208, 'colsample_bylevel': 0.9920123911891214, 'colsample_bynode': 0.7144572821893844, 'min_child_weight': 1.9234652986315235, 'gamma': 0.2868935327504188, 'reg_alpha': 1.4410183373877918e-07, 'reg_lambda': 1.3905300995951408, 'max_delta_step': 2.4537569832862047, 'booster': 'dart'}. Best is trial 124 with value: 0.4861149496788636.[0m
[32m[I 2026-08-07 10:30:41,413][0m Trial 155 finished with value: 0.5018987609391433 and parameters: {'n_estimators': 2820, 'max_depth': 7, 'learning_rate': 0.014316510481197902, 'subsample': 0.8741081890273618, 'colsample_bytree': 0.6868325385951247, 'colsample_bylevel': 0.5718621682261821, 'colsample_bynode': 0.5704351093609168, 'min_child_weight': 1.703307852139068, 'gamma': 0.19201600458535178, 'reg_alpha': 2.003964480009598e-08, 'reg_lambda': 0.047797923027601386, 'max_delta_step': 5.107117119649549, 'booster': 'gbtree'}. Best is trial 124 with value: 0.4861149496788636.[0m
[32m[I 2026-08-07 10:30:45,100][0m Trial 156 finished with value: 0.5017629074853758 and parameters: {'n_estimators': 2535, 'max_depth': 5, 'learning_rate': 0.023311731827378647, 'subsample': 0.6658275173758544, 'colsample_bytree': 0.46778207606410405, 'colsample_bylevel': 0.6092888594336536, 'colsample_bynode': 0.4533884252207868, 'min_child_weight': 1.6415330383301643, 'gamma': 0.11844058888622142, 'reg_alpha': 0.0036631857347452406, 'reg_lambda': 0.0005010954716814643, 'max_delta_step': 3.105274724061163, 'booster': 'gbtree'}. Best is trial 124 with value: 0.4861149496788636.[0m
[32m[I 2026-08-07 10:31:00,438][0m Trial 157 pruned. [0m
[32m[I 2026-08-07 10:31:07,245][0m Trial 158 finished with value: 0.5108683142977944 and parameters: {'n_estimators': 2689, 'max_depth': 5, 'learning_rate': 0.013589576720394249, 'subsample': 0.8915135105847783, 'colsample_bytree': 0.9381297828612182, 'colsample_bylevel': 0.7625651362011937, 'colsample_bynode': 0.700443454706553, 'min_child_weight': 2.595042027211567, 'gamma': 0.29803931650442655, 'reg_alpha': 0.0001818891300090687, 'reg_lambda': 2.6066761342008435, 'max_delta_step': 5.414067463400838, 'booster': 'dart'}. Best is trial 124 with value: 0.4861149496788636.[0m
[32m[I 2026-08-07 10:31:15,979][0m Trial 159 finished with value: 0.49229678779483665 and parameters: {'n_estimators': 2884, 'max_depth': 4, 'learning_rate': 0.013843062845137434, 'subsample': 0.8701260861762046, 'colsample_bytree': 0.876253067172378, 'colsample_bylevel': 0.8875021232250054, 'colsample_bynode': 0.8324266900241369, 'min_child_weight': 3.8826569385932554, 'gamma': 0.12649316140627515, 'reg_alpha': 2.986690494079071e-08, 'reg_lambda': 0.29738204397988705, 'max_delta_step': 1.4890540593609944, 'booster': 'dart'}. Best is trial 124 with value: 0.4861149496788636.[0m
[32m[I 2026-08-07 10:31:21,856][0m Trial 160 finished with value: 0.5144208000209459 and parameters: {'n_estimators': 2944, 'max_depth': 9, 'learning_rate': 0.013130180569781696, 'subsample': 0.8009322101131784, 'colsample_bytree': 0.7875584277704728, 'colsample_bylevel': 0.46552294666098015, 'colsample_bynode': 0.8818658065968776, 'min_child_weight': 6.089276520061412, 'gamma': 0.3919248245915272, 'reg_alpha': 0.0003765679076305646, 'reg_lambda': 1.125455174392685e-06, 'max_delta_step': 6.4193288594387905, 'booster': 'dart'}. Best is trial 124 with value: 0.4861149496788636.[0m
[32m[I 2026-08-07 10:31:26,702][0m Trial 161 finished with value: 0.5137478670885136 and parameters: {'n_estimators': 2536, 'max_depth': 4, 'learning_rate': 0.02175366592358821, 'subsample': 0.8860884599258898, 'colsample_bytree': 0.8913378605486841, 'colsample_bylevel': 0.734642221698049, 'colsample_bynode': 0.9482191119550387, 'min_child_weight': 3.352300510182678, 'gamma': 0.34377508966436676, 'reg_alpha': 2.8228277306476692e-06, 'reg_lambda': 0.4116296319532082, 'max_delta_step': 1.2937476222144244, 'booster': 'dart'}. Best is trial 124 with value: 0.4861149496788636.[0m
[32m[I 2026-08-07 10:31:35,805][0m Trial 162 finished with value: 0.4963111240313201 and parameters: {'n_estimators': 2526, 'max_depth': 5, 'learning_rate': 0.011640642302591979, 'subsample': 0.9319242955750345, 'colsample_bytree': 0.7585748340133002, 'colsample_bylevel': 0.726465259846656, 'colsample_bynode': 0.6995525477578731, 'min_child_weight': 4.1811951602401285, 'gamma': 0.07119075393088281, 'reg_alpha': 0.04477436693978368, 'reg_lambda': 2.345685111652415e-05, 'max_delta_step': 5.641118123480136, 'booster': 'dart'}. Best is trial 124 with value: 0.4861149496788636.[0m
[32m[I 2026-08-07 10:31:43,618][0m Trial 163 finished with value: 0.5121762535169014 and parameters: {'n_estimators': 2130, 'max_depth': 4, 'learning_rate': 0.010664786371744716, 'subsample': 0.843307361592419, 'colsample_bytree': 0.8345460654549817, 'colsample_bylevel': 0.6900759241273058, 'colsample_bynode': 0.5368308916359578, 'min_child_weight': 1.380000603366212, 'gamma': 0.30735705035387223, 'reg_alpha': 0.0005426121862814422, 'reg_lambda': 0.007955542803079632, 'max_delta_step': 6.663781821436568, 'booster': 'dart'}. Best is trial 124 with value: 0.4861149496788636.[0m
[32m[I 2026-08-07 10:31:47,714][0m Trial 164 finished with value: 0.5131765060155731 and parameters: {'n_estimators': 2542, 'max_depth': 5, 'learning_rate': 0.015422415180159004, 'subsample': 0.8195186941714789, 'colsample_bytree': 0.6240497640036202, 'colsample_bylevel': 0.5663786550989318, 'colsample_bynode': 0.8985999027070954, 'min_child_weight': 3.5020745828920004, 'gamma': 0.35740536001001705, 'reg_alpha': 8.679915573305704e-08, 'reg_lambda': 0.005723548354587567, 'max_delta_step': 3.8757060925852986, 'booster': 'dart'}. Best is trial 124 with value: 0.4861149496788636.[0m
[32m[I 2026-08-07 10:31:56,830][0m Trial 165 finished with value: 0.5143071876099718 and parameters: {'n_estimators': 1407, 'max_depth': 5, 'learning_rate': 0.015151751128790568, 'subsample': 0.9910144527116944, 'colsample_bytree': 0.942636643342677, 'colsample_bylevel': 0.9993084841609864, 'colsample_bynode': 0.9752108583276253, 'min_child_weight': 12.598371048268726, 'gamma': 0.1093009004720992, 'reg_alpha': 2.715769498142812e-08, 'reg_lambda': 5.853658396104388e-07, 'max_delta_step': 0.8966337697509915, 'booster': 'gbtree'}. Best is trial 124 with value: 0.4861149496788636.[0m
[32m[I 2026-08-07 10:32:06,266][0m Trial 166 finished with value: 0.4855502131873739 and parameters: {'n_estimators': 2784, 'max_depth': 6, 'learning_rate': 0.011395579624736607, 'subsample': 0.8718650922604059, 'colsample_bytree': 0.7385757710700569, 'colsample_bylevel': 0.6072411217210275, 'colsample_bynode': 0.6770182563245579, 'min_child_weight': 3.8334902519117087, 'gamma': 0.0040249277825922525, 'reg_alpha': 0.00038595017399661175, 'reg_lambda': 0.06070799352465615, 'max_delta_step': 4.9599478431228325, 'booster': 'gbtree'}. Best is trial 166 with value: 0.4855502131873739.[0m
[32m[I 2026-08-07 10:32:10,419][0m Trial 167 finished with value: 0.5066698889201053 and parameters: {'n_estimators': 2577, 'max_depth': 6, 'learning_rate': 0.01748559427221817, 'subsample': 0.9110575382919661, 'colsample_bytree': 0.7574001486858754, 'colsample_bylevel': 0.6841371020348066, 'colsample_bynode': 0.7055154824769913, 'min_child_weight': 3.8523107012209112, 'gamma': 0.27547969538621686, 'reg_alpha': 0.06268216297218579, 'reg_lambda': 0.1946054933971032, 'max_delta_step': 5.2163093344658975, 'booster': 'gbtree'}. Best is trial 166 with value: 0.4855502131873739.[0m
[32m[I 2026-08-07 10:32:20,033][0m Trial 168 finished with value: 0.5188651391963528 and parameters: {'n_estimators': 2486, 'max_depth': 4, 'learning_rate': 0.014958201133046556, 'subsample': 0.9442759676227056, 'colsample_bytree': 0.7140201406000795, 'colsample_bylevel': 0.5865793801234092, 'colsample_bynode': 0.7496168965631167, 'min_child_weight': 1.1322131918889355, 'gamma': 0.03602023020685098, 'reg_alpha': 3.7380173774053373, 'reg_lambda': 0.02086869542774911, 'max_delta_step': 6.835948031663963, 'booster': 'dart'}. Best is trial 166 with value: 0.4855502131873739.[0m
[32m[I 2026-08-07 10:32:31,887][0m Trial 169 finished with value: 0.5026521037463582 and parameters: {'n_estimators': 2667, 'max_depth': 6, 'learning_rate': 0.011186986592581622, 'subsample': 0.8756834196218681, 'colsample_bytree': 0.927768953334479, 'colsample_bylevel': 0.9763486915664145, 'colsample_bynode': 0.9420736259496357, 'min_child_weight': 4.7302262859919875, 'gamma': 0.15363487135108028, 'reg_alpha': 5.112394631405081e-08, 'reg_lambda': 0.23135346702130266, 'max_delta_step': 0.8374410761067416, 'booster': 'dart'}. Best is trial 166 with value: 0.4855502131873739.[0m
[32m[I 2026-08-07 10:32:40,982][0m Trial 170 finished with value: 0.502137157678745 and parameters: {'n_estimators': 2935, 'max_depth': 8, 'learning_rate': 0.01033542914900516, 'subsample': 0.8167553132533966, 'colsample_bytree': 0.9080234375380607, 'colsample_bylevel': 0.6026739440217402, 'colsample_bynode': 0.5045931691698035, 'min_child_weight': 7.61002904817969, 'gamma': 0.13995933103382968, 'reg_alpha': 0.061981893897920616, 'reg_lambda': 0.005852451969095197, 'max_delta_step': 5.891383169230277, 'booster': 'gbtree'}. Best is trial 166 with value: 0.4855502131873739.[0m
[32m[I 2026-08-07 10:32:46,513][0m Trial 171 pruned. [0m
[32m[I 2026-08-07 10:32:53,685][0m Trial 172 finished with value: 0.502002284926794 and parameters: {'n_estimators': 2906, 'max_depth': 4, 'learning_rate': 0.01149228479183944, 'subsample': 0.9221380148113144, 'colsample_bytree': 0.8411550483769945, 'colsample_bylevel': 0.7385736309698018, 'colsample_bynode': 0.785627782669985, 'min_child_weight': 2.850961502045493, 'gamma': 0.17461740477072285, 'reg_alpha': 7.175119905817733e-06, 'reg_lambda': 0.00922453718634321, 'max_delta_step': 5.1536207232274265, 'booster': 'gbtree'}. Best is trial 166 with value: 0.4855502131873739.[0m
[32m[I 2026-08-07 10:33:02,141][0m Trial 173 finished with value: 0.49202366636296535 and parameters: {'n_estimators': 2673, 'max_depth': 8, 'learning_rate': 0.012392643525491708, 'subsample': 0.7462503157544914, 'colsample_bytree': 0.7136332519649911, 'colsample_bylevel': 0.39301355573870816, 'colsample_bynode': 0.6774705390633335, 'min_child_weight': 1.2819360050237172, 'gamma': 0.005583842394942071, 'reg_alpha': 4.728584150949489e-06, 'reg_lambda': 2.2362201953890164e-06, 'max_delta_step': 6.5632789918589545, 'booster': 'gbtree'}. Best is trial 166 with value: 0.4855502131873739.[0m
[32m[I 2026-08-07 10:33:07,397][0m Trial 174 finished with value: 0.5301671961583571 and parameters: {'n_estimators': 2208, 'max_depth': 7, 'learning_rate': 0.02014007016168012, 'subsample': 0.9025617197393409, 'colsample_bytree': 0.8535030645382005, 'colsample_bylevel': 0.587967374030717, 'colsample_bynode': 0.9893566268298521, 'min_child_weight': 9.435639846878216, 'gamma': 0.4183030001292649, 'reg_alpha': 8.275999863920117e-08, 'reg_lambda': 0.07719391365075501, 'max_delta_step': 0.7226242559337189, 'booster': 'gbtree'}. Best is trial 166 with value: 0.4855502131873739.[0m
[32m[I 2026-08-07 10:33:10,457][0m Trial 175 finished with value: 0.5204264392200091 and parameters: {'n_estimators': 2129, 'max_depth': 5, 'learning_rate': 0.02410103492020905, 'subsample': 0.8618679986016222, 'colsample_bytree': 0.6618072638274974, 'colsample_bylevel': 0.40352895848224557, 'colsample_bynode': 0.6913385403743173, 'min_child_weight': 1.5278875933685048, 'gamma': 0.3621136812888828, 'reg_alpha': 0.007843380439181747, 'reg_lambda': 1.1906062161579736e-05, 'max_delta_step': 6.305064915488813, 'booster': 'gbtree'}. Best is trial 166 with value: 0.4855502131873739.[0m
[32m[I 2026-08-07 10:33:21,116][0m Trial 176 finished with value: 0.524470786958219 and parameters: {'n_estimators': 2966, 'max_depth': 4, 'learning_rate': 0.012524656918395652, 'subsample': 0.8269740144009959, 'colsample_bytree': 0.7054224868828816, 'colsample_bylevel': 0.7334904070974468, 'colsample_bynode': 0.6236135744769257, 'min_child_weight': 5.5618973778438345, 'gamma': 0.7241168657649315, 'reg_alpha': 1.279362035589615e-07, 'reg_lambda': 0.2751457049906881, 'max_delta_step': 0.23527984285624193, 'booster': 'dart'}. Best is trial 166 with value: 0.4855502131873739.[0m
[32m[I 2026-08-07 10:33:28,172][0m Trial 177 finished with value: 0.5227991804651413 and parameters: {'n_estimators': 2980, 'max_depth': 5, 'learning_rate': 0.010901757667889908, 'subsample': 0.925752280160457, 'colsample_bytree': 0.6643866745037968, 'colsample_bylevel': 0.5601134522829866, 'colsample_bynode': 0.70680016233756, 'min_child_weight': 8.717248772331025, 'gamma': 0.30729447795328135, 'reg_alpha': 4.14784430737162e-06, 'reg_lambda': 3.5527955441353853, 'max_delta_step': 5.361013131380545, 'booster': 'gbtree'}. Best is trial 166 with value: 0.4855502131873739.[0m
[32m[I 2026-08-07 10:33:31,720][0m Trial 178 finished with value: 0.5059800512837909 and parameters: {'n_estimators': 2352, 'max_depth': 8, 'learning_rate': 0.02029847208614692, 'subsample': 0.7385375175352802, 'colsample_bytree': 0.811141102790502, 'colsample_bylevel': 0.3823642528389843, 'colsample_bynode': 0.47960646608843926, 'min_child_weight': 1.4770289201565003, 'gamma': 0.23157414547192195, 'reg_alpha': 2.5987071285671375e-06, 'reg_lambda': 1.5652006853884222e-05, 'max_delta_step': 7.672084861510659, 'booster': 'gbtree'}. Best is trial 166 with value: 0.4855502131873739.[0m
[32m[I 2026-08-07 10:33:37,420][0m Trial 179 finished with value: 0.5234776969593282 and parameters: {'n_estimators': 1855, 'max_depth': 4, 'learning_rate': 0.010328983997781553, 'subsample': 0.8713420317177666, 'colsample_bytree': 0.6944306045045194, 'colsample_bylevel': 0.515522462909439, 'colsample_bynode': 0.8483120598459246, 'min_child_weight': 2.1706568194037974, 'gamma': 0.5002407326374771, 'reg_alpha': 0.0002957266726583836, 'reg_lambda': 0.023049084415411487, 'max_delta_step': 5.731049186011431, 'booster': 'dart'}. Best is trial 166 with value: 0.4855502131873739.[0m
[32m[I 2026-08-07 10:33:44,688][0m Trial 180 finished with value: 0.489750350688969 and parameters: {'n_estimators': 2610, 'max_depth': 5, 'learning_rate': 0.011114768302666951, 'subsample': 0.8820802913262948, 'colsample_bytree': 0.6781379350965248, 'colsample_bylevel': 0.6313044254644395, 'colsample_bynode': 0.5286668287296351, 'min_child_weight': 2.831180465468086, 'gamma': 0.07252821736345154, 'reg_alpha': 0.00010721348475387213, 'reg_lambda': 0.1461390743698783, 'max_delta_step': 3.2319061323274356, 'booster': 'dart'}. Best is trial 166 with value: 0.4855502131873739.[0m
[32m[I 2026-08-07 10:33:56,134][0m Trial 181 finished with value: 0.5006864822170218 and parameters: {'n_estimators': 2812, 'max_depth': 7, 'learning_rate': 0.012419895102252507, 'subsample': 0.9589398349893689, 'colsample_bytree': 0.5538102319478942, 'colsample_bylevel': 0.707097437386443, 'colsample_bynode': 0.3900471818252917, 'min_child_weight': 6.1548063109284525, 'gamma': 0.04653254064428028, 'reg_alpha': 0.00012766141893130457, 'reg_lambda': 9.467634452104699, 'max_delta_step': 5.556584814080047, 'booster': 'dart'}. Best is trial 166 with value: 0.4855502131873739.[0m
[32m[I 2026-08-07 10:34:01,141][0m Trial 182 finished with value: 0.4974190714706821 and parameters: {'n_estimators': 2924, 'max_depth': 7, 'learning_rate': 0.01609498258278122, 'subsample': 0.6783403444951618, 'colsample_bytree': 0.860949159322952, 'colsample_bylevel': 0.3068113386174452, 'colsample_bynode': 0.7152443119460811, 'min_child_weight': 1.3066711099596253, 'gamma': 0.16850140181094542, 'reg_alpha': 5.311532635557998e-06, 'reg_lambda': 1.9152523772106008e-05, 'max_delta_step': 6.637110201808079, 'booster': 'gbtree'}. Best is trial 166 with value: 0.4855502131873739.[0m
[32m[I 2026-08-07 10:34:06,904][0m Trial 183 finished with value: 0.5115152968035594 and parameters: {'n_estimators': 2371, 'max_depth': 6, 'learning_rate': 0.01169367429858054, 'subsample': 0.6991795904271233, 'colsample_bytree': 0.4713273335774606, 'colsample_bylevel': 0.5071816907025907, 'colsample_bynode': 0.6235568145187312, 'min_child_weight': 5.028862760899738, 'gamma': 0.30222035159078037, 'reg_alpha': 1.5701853766701184e-06, 'reg_lambda': 0.00012250212688037998, 'max_delta_step': 5.262857588687581, 'booster': 'dart'}. Best is trial 166 with value: 0.4855502131873739.[0m
[32m[I 2026-08-07 10:34:12,671][0m Trial 184 finished with value: 0.5063008309536414 and parameters: {'n_estimators': 1642, 'max_depth': 7, 'learning_rate': 0.011030383643760518, 'subsample': 0.9600808058492503, 'colsample_bytree': 0.7480561285637819, 'colsample_bylevel': 0.6606819627044356, 'colsample_bynode': 0.8509118616974999, 'min_child_weight': 2.1190894667879916, 'gamma': 0.17392581468089485, 'reg_alpha': 3.747565520572544e-05, 'reg_lambda': 0.008707029494784664, 'max_delta_step': 1.5974919508822003, 'booster': 'gbtree'}. Best is trial 166 with value: 0.4855502131873739.[0m
[32m[I 2026-08-07 10:34:17,592][0m Trial 185 finished with value: 0.49117734808500835 and parameters: {'n_estimators': 2847, 'max_depth': 4, 'learning_rate': 0.027826651971172844, 'subsample': 0.9625135740945016, 'colsample_bytree': 0.852653313360466, 'colsample_bylevel': 0.8203526004124385, 'colsample_bynode': 0.9337852714276509, 'min_child_weight': 1.0104167802970923, 'gamma': 0.036448632928517265, 'reg_alpha': 2.951315271768165e-06, 'reg_lambda': 0.18145608569577948, 'max_delta_step': 3.967334718498824, 'booster': 'dart'}. Best is trial 166 with value: 0.4855502131873739.[0m
[32m[I 2026-08-07 10:34:19,054][0m Trial 186 finished with value: 0.5166055019625189 and parameters: {'n_estimators': 2634, 'max_depth': 5, 'learning_rate': 0.05811249262965714, 'subsample': 0.947772303400475, 'colsample_bytree': 0.8132442994743306, 'colsample_bylevel': 0.7519508153565817, 'colsample_bynode': 0.811035559294643, 'min_child_weight': 1.1074902365824033, 'gamma': 0.368293439211867, 'reg_alpha': 2.2443934093294184e-07, 'reg_lambda': 0.018023797743319837, 'max_delta_step': 6.274059985463157, 'booster': 'dart'}. Best is trial 166 with value: 0.4855502131873739.[0m
[32m[I 2026-08-07 10:34:25,392][0m Trial 187 finished with value: 0.49407022710875725 and parameters: {'n_estimators': 2244, 'max_depth': 9, 'learning_rate': 0.01767630871735608, 'subsample': 0.8166395060808005, 'colsample_bytree': 0.6932115139344197, 'colsample_bylevel': 0.4094259386374147, 'colsample_bynode': 0.7624242862400658, 'min_child_weight': 1.191710436354871, 'gamma': 0.009688898064492961, 'reg_alpha': 0.00041265950853790933, 'reg_lambda': 0.3271398556633252, 'max_delta_step': 4.128859604527491, 'booster': 'gbtree'}. Best is trial 166 with value: 0.4855502131873739.[0m
