============================================================
lightgbm — 运行开始  20260802_155314
  输出目录:  runs\pCMC\pCMC_lightgbm_20260802_155314
============================================================
============================================================
LightGBM + PharmHGT-style Featurization for LogCMC (pCMC) Prediction
============================================================
[Cache HIT] Loading features from data\features\surfpro\pCMC
  Train features: (1204, 522)
  Test features:  (140, 522)

Split: Train 1053, Val 151, Test 140

============================================================
Optuna Hyperparameter Tuning (50 trials, 5-Fold CV)
============================================================
[32m[I 2026-08-02 15:53:17,570][0m Trial 0 finished with value: 2.072033613059076 and parameters: {'boosting_type': 'dart', 'max_depth': 12, 'num_leaves': 159, 'learning_rate': 0.009470976192691145, 'n_estimators': 890, 'subsample': 0.5290418060840998, 'subsample_freq': 9, 'colsample_bytree': 0.7207805082202461, 'reg_alpha': 0.023585940584142682, 'reg_lambda': 1.5320059381854043e-08, 'min_child_samples': 98, 'min_child_weight': 0.021368329072358756, 'min_split_gain': 0.21233911067827616, 'cat_smooth': 9.091248360355031, 'cat_l2': 9.17022549267169, 'drop_rate': 0.09823025045826593, 'max_drop': 27, 'skip_drop': 0.13526405540621358}. Best is trial 0 with value: 2.072033613059076.[0m
[32m[I 2026-08-02 15:53:26,829][0m Trial 1 finished with value: 0.9602706425507211 and parameters: {'boosting_type': 'dart', 'max_depth': 4, 'num_leaves': 85, 'learning_rate': 0.02240870575939826, 'n_estimators': 1640, 'subsample': 0.8925879806965068, 'subsample_freq': 2, 'colsample_bytree': 0.6599641068895281, 'reg_alpha': 0.0021465011216654484, 'reg_lambda': 2.6185068507773707e-08, 'min_child_samples': 63, 'min_child_weight': 4.809461967501571e-05, 'min_split_gain': 0.06505159298527952, 'cat_smooth': 47.44427686266666, 'cat_l2': 48.28160165372797, 'drop_rate': 0.24443523095377373, 'max_drop': 16, 'skip_drop': 0.03832491306185132}. Best is trial 1 with value: 0.9602706425507211.[0m
Training until validation scores don't improve for 30 rounds
Early stopping, best iteration is:
[1570]	valid_0's rmse: 0.510785	valid_0's l2: 0.260901
Training until validation scores don't improve for 30 rounds
Early stopping, best iteration is:
[1492]	valid_0's rmse: 0.571983	valid_0's l2: 0.327164
Training until validation scores don't improve for 30 rounds
Early stopping, best iteration is:
[1478]	valid_0's rmse: 0.598119	valid_0's l2: 0.357746
Training until validation scores don't improve for 30 rounds
Early stopping, best iteration is:
[1238]	valid_0's rmse: 0.597602	valid_0's l2: 0.357128
Training until validation scores don't improve for 30 rounds
Early stopping, best iteration is:
[1820]	valid_0's rmse: 0.525364	valid_0's l2: 0.276008
[32m[I 2026-08-02 15:53:31,247][0m Trial 2 finished with value: 0.5608145622032877 and parameters: {'boosting_type': 'gbdt', 'max_depth': 4, 'num_leaves': 134, 'learning_rate': 0.005755963034165359, 'n_estimators': 2774, 'subsample': 0.6293899908000085, 'subsample_freq': 7, 'colsample_bytree': 0.5181977532625877, 'reg_alpha': 0.0004793052550782129, 'reg_lambda': 0.0008325158565947976, 'min_child_samples': 22, 'min_child_weight': 0.07556810141274425, 'min_split_gain': 0.7751328233611146, 'cat_smooth': 46.97494707820945, 'cat_l2': 44.74136752138244}. Best is trial 2 with value: 0.5608145622032877.[0m
[32m[I 2026-08-02 15:53:37,008][0m Trial 3 finished with value: 2.007165102847506 and parameters: {'boosting_type': 'dart', 'max_depth': 4, 'num_leaves': 62, 'learning_rate': 0.006017151754328819, 'n_estimators': 1313, 'subsample': 0.6943386448447411, 'subsample_freq': 3, 'colsample_bytree': 0.8801162564063505, 'reg_alpha': 1.6247252885719427e-05, 'reg_lambda': 3.376063348877853e-06, 'min_child_samples': 57, 'min_child_weight': 3.661819220392426e-05, 'min_split_gain': 0.8021969807540397, 'cat_smooth': 3.727532183988541, 'cat_l2': 49.34434683002586, 'drop_rate': 0.23395098309603066, 'max_drop': 10, 'skip_drop': 0.011601413965844696}. Best is trial 2 with value: 0.5608145622032877.[0m
Training until validation scores don't improve for 30 rounds
Did not meet early stopping. Best iteration is:
[1396]	valid_0's rmse: 0.518703	valid_0's l2: 0.269052
Training until validation scores don't improve for 30 rounds
Early stopping, best iteration is:
[918]	valid_0's rmse: 0.578552	valid_0's l2: 0.334722
Training until validation scores don't improve for 30 rounds
Early stopping, best iteration is:
[1224]	valid_0's rmse: 0.614641	valid_0's l2: 0.377783
Training until validation scores don't improve for 30 rounds
Early stopping, best iteration is:
[795]	valid_0's rmse: 0.605113	valid_0's l2: 0.366162
Training until validation scores don't improve for 30 rounds
Did not meet early stopping. Best iteration is:
[1386]	valid_0's rmse: 0.534776	valid_0's l2: 0.285985
[32m[I 2026-08-02 15:53:39,386][0m Trial 4 finished with value: 0.57035686897977 and parameters: {'boosting_type': 'gbdt', 'max_depth': 12, 'num_leaves': 200, 'learning_rate': 0.006770684770701556, 'n_estimators': 1396, 'subsample': 0.5579345297625649, 'subsample_freq': 9, 'colsample_bytree': 0.7363086887792905, 'reg_alpha': 9.507847858536042e-06, 'reg_lambda': 3.732717755563729e-08, 'min_child_samples': 34, 'min_child_weight': 0.00019986340778528852, 'min_split_gain': 0.7296061783380641, 'cat_smooth': 31.877873567760656, 'cat_l2': 44.36063712881633}. Best is trial 2 with value: 0.5608145622032877.[0m
Training until validation scores don't improve for 30 rounds
Early stopping, best iteration is:
[131]	valid_0's rmse: 0.483734	valid_0's l2: 0.233998
Training until validation scores don't improve for 30 rounds
Early stopping, best iteration is:
[175]	valid_0's rmse: 0.525289	valid_0's l2: 0.275929
Training until validation scores don't improve for 30 rounds
Early stopping, best iteration is:
[140]	valid_0's rmse: 0.522121	valid_0's l2: 0.27261
Training until validation scores don't improve for 30 rounds
Early stopping, best iteration is:
[114]	valid_0's rmse: 0.5333	valid_0's l2: 0.284409
Training until validation scores don't improve for 30 rounds
Early stopping, best iteration is:
[116]	valid_0's rmse: 0.487707	valid_0's l2: 0.237858
[32m[I 2026-08-02 15:53:40,220][0m Trial 5 finished with value: 0.510439958348177 and parameters: {'boosting_type': 'gbdt', 'max_depth': 12, 'num_leaves': 198, 'learning_rate': 0.04977436807314311, 'n_estimators': 2428, 'subsample': 0.7468977981821954, 'subsample_freq': 6, 'colsample_bytree': 0.5992787128509847, 'reg_alpha': 1.6934490731313353e-08, 'reg_lambda': 9.354548757337708e-08, 'min_child_samples': 8, 'min_child_weight': 0.003512704726270845, 'min_split_gain': 0.3143559810763267, 'cat_smooth': 25.42853455823514, 'cat_l2': 45.37832369630465}. Best is trial 5 with value: 0.510439958348177.[0m
[32m[I 2026-08-02 15:53:42,222][0m Trial 6 pruned. [0m
[32m[I 2026-08-02 15:53:45,880][0m Trial 7 pruned. [0m
Training until validation scores don't improve for 30 rounds
Early stopping, best iteration is:
[509]	valid_0's rmse: 0.551595	valid_0's l2: 0.304257
Training until validation scores don't improve for 30 rounds
Early stopping, best iteration is:
[422]	valid_0's rmse: 0.631168	valid_0's l2: 0.398373
Training until validation scores don't improve for 30 rounds
Early stopping, best iteration is:
[340]	valid_0's rmse: 0.668858	valid_0's l2: 0.447371
Training until validation scores don't improve for 30 rounds
Early stopping, best iteration is:
[561]	valid_0's rmse: 0.614562	valid_0's l2: 0.377687
Training until validation scores don't improve for 30 rounds
Early stopping, best iteration is:
[416]	valid_0's rmse: 0.5828	valid_0's l2: 0.339656
[32m[I 2026-08-02 15:53:47,002][0m Trial 8 finished with value: 0.6097964879365863 and parameters: {'boosting_type': 'gbdt', 'max_depth': 3, 'num_leaves': 161, 'learning_rate': 0.03915699341344363, 'n_estimators': 628, 'subsample': 0.6393232321183058, 'subsample_freq': 10, 'colsample_bytree': 0.46769332346688064, 'reg_alpha': 2.0139739500176936e-07, 'reg_lambda': 0.0002541410632209718, 'min_child_samples': 99, 'min_child_weight': 9.294394155644992e-05, 'min_split_gain': 0.6721355474058786, 'cat_smooth': 38.08098076643588, 'cat_l2': 11.881877199619984}. Best is trial 5 with value: 0.510439958348177.[0m
Training until validation scores don't improve for 30 rounds
Early stopping, best iteration is:
[334]	valid_0's rmse: 0.525973	valid_0's l2: 0.276647
Training until validation scores don't improve for 30 rounds
Early stopping, best iteration is:
[254]	valid_0's rmse: 0.576429	valid_0's l2: 0.332271
Training until validation scores don't improve for 30 rounds
Early stopping, best iteration is:
[276]	valid_0's rmse: 0.619756	valid_0's l2: 0.384098
Training until validation scores don't improve for 30 rounds
Early stopping, best iteration is:
[304]	valid_0's rmse: 0.588399	valid_0's l2: 0.346214
Training until validation scores don't improve for 30 rounds
Early stopping, best iteration is:
[301]	valid_0's rmse: 0.548088	valid_0's l2: 0.300401
[32m[I 2026-08-02 15:53:48,020][0m Trial 9 finished with value: 0.5718754767214098 and parameters: {'boosting_type': 'gbdt', 'max_depth': 11, 'num_leaves': 167, 'learning_rate': 0.044839259184207204, 'n_estimators': 725, 'subsample': 0.917651247794619, 'subsample_freq': 4, 'colsample_bytree': 0.4305629572798979, 'reg_alpha': 2.3279640748356466e-08, 'reg_lambda': 0.0020798714270728416, 'min_child_samples': 70, 'min_child_weight': 1.1650681118986128e-05, 'min_split_gain': 0.512093058299281, 'cat_smooth': 11.324788759896897, 'cat_l2': 32.25863952047249}. Best is trial 5 with value: 0.510439958348177.[0m
Training until validation scores don't improve for 30 rounds
Early stopping, best iteration is:
[52]	valid_0's rmse: 0.530814	valid_0's l2: 0.281763
Training until validation scores don't improve for 30 rounds
Early stopping, best iteration is:
[49]	valid_0's rmse: 0.591582	valid_0's l2: 0.349969
Training until validation scores don't improve for 30 rounds
Early stopping, best iteration is:
[38]	valid_0's rmse: 0.608863	valid_0's l2: 0.370714
Training until validation scores don't improve for 30 rounds
Early stopping, best iteration is:
[37]	valid_0's rmse: 0.581316	valid_0's l2: 0.337929
Training until validation scores don't improve for 30 rounds
Early stopping, best iteration is:
[48]	valid_0's rmse: 0.538247	valid_0's l2: 0.289709
[32m[I 2026-08-02 15:53:48,425][0m Trial 10 finished with value: 0.5703091991430279 and parameters: {'boosting_type': 'gbdt', 'max_depth': 8, 'num_leaves': 16, 'learning_rate': 0.227364806419381, 'n_estimators': 2938, 'subsample': 0.8139601740123973, 'subsample_freq': 6, 'colsample_bytree': 0.31464890149101077, 'reg_alpha': 3.331630946893803, 'reg_lambda': 0.04422317327084487, 'min_child_samples': 7, 'min_child_weight': 0.002949971987301989, 'min_split_gain': 0.34052523698531706, 'cat_smooth': 21.71781358782057, 'cat_l2': 23.63570033289743}. Best is trial 5 with value: 0.510439958348177.[0m
Training until validation scores don't improve for 30 rounds
Early stopping, best iteration is:
[23]	valid_0's rmse: 0.533146	valid_0's l2: 0.284244
Training until validation scores don't improve for 30 rounds
Early stopping, best iteration is:
[27]	valid_0's rmse: 0.603847	valid_0's l2: 0.364631
Training until validation scores don't improve for 30 rounds
Early stopping, best iteration is:
[27]	valid_0's rmse: 0.575227	valid_0's l2: 0.330887
Training until validation scores don't improve for 30 rounds
Early stopping, best iteration is:
[27]	valid_0's rmse: 0.594442	valid_0's l2: 0.353361
Training until validation scores don't improve for 30 rounds
Early stopping, best iteration is:
[28]	valid_0's rmse: 0.557394	valid_0's l2: 0.310688
[32m[I 2026-08-02 15:53:48,807][0m Trial 11 finished with value: 0.5728111436585148 and parameters: {'boosting_type': 'gbdt', 'max_depth': 15, 'num_leaves': 255, 'learning_rate': 0.18630559631838284, 'n_estimators': 2732, 'subsample': 0.7745246291075554, 'subsample_freq': 6, 'colsample_bytree': 0.572142222452941, 'reg_alpha': 0.7020808204379202, 'reg_lambda': 1.344933695762981e-05, 'min_child_samples': 8, 'min_child_weight': 0.09464585795213397, 'min_split_gain': 0.9960165317474352, 'cat_smooth': 49.099456007709705, 'cat_l2': 35.02533859293253}. Best is trial 5 with value: 0.510439958348177.[0m
Training until validation scores don't improve for 30 rounds
Early stopping, best iteration is:
[57]	valid_0's rmse: 0.520425	valid_0's l2: 0.270842
Training until validation scores don't improve for 30 rounds
Early stopping, best iteration is:
[57]	valid_0's rmse: 0.577937	valid_0's l2: 0.334011
Training until validation scores don't improve for 30 rounds
Early stopping, best iteration is:
[57]	valid_0's rmse: 0.575479	valid_0's l2: 0.331176
Training until validation scores don't improve for 30 rounds
Early stopping, best iteration is:
[59]	valid_0's rmse: 0.586003	valid_0's l2: 0.3434
Training until validation scores don't improve for 30 rounds
Early stopping, best iteration is:
[53]	valid_0's rmse: 0.504231	valid_0's l2: 0.254249
[32m[I 2026-08-02 15:53:49,265][0m Trial 12 finished with value: 0.5528151085306365 and parameters: {'boosting_type': 'gbdt', 'max_depth': 7, 'num_leaves': 123, 'learning_rate': 0.09691896534971756, 'n_estimators': 2357, 'subsample': 0.992763962381443, 'subsample_freq': 6, 'colsample_bytree': 0.5875673080585329, 'reg_alpha': 0.00014422243561457965, 'reg_lambda': 1.842274116420653e-06, 'min_child_samples': 26, 'min_child_weight': 0.00718220732407314, 'min_split_gain': 0.48531019619746185, 'cat_smooth': 39.49828442656664, 'cat_l2': 35.55778837110738}. Best is trial 5 with value: 0.510439958348177.[0m
Training until validation scores don't improve for 30 rounds
Early stopping, best iteration is:
[54]	valid_0's rmse: 0.529639	valid_0's l2: 0.280517
Training until validation scores don't improve for 30 rounds
Early stopping, best iteration is:
[66]	valid_0's rmse: 0.565558	valid_0's l2: 0.319856
Training until validation scores don't improve for 30 rounds
Early stopping, best iteration is:
[56]	valid_0's rmse: 0.574176	valid_0's l2: 0.329678
Training until validation scores don't improve for 30 rounds
Early stopping, best iteration is:
[58]	valid_0's rmse: 0.574645	valid_0's l2: 0.330217
Training until validation scores don't improve for 30 rounds
Early stopping, best iteration is:
[53]	valid_0's rmse: 0.504697	valid_0's l2: 0.254719
[32m[I 2026-08-02 15:53:49,713][0m Trial 13 finished with value: 0.5497928625162556 and parameters: {'boosting_type': 'gbdt', 'max_depth': 8, 'num_leaves': 123, 'learning_rate': 0.09163130297670326, 'n_estimators': 2194, 'subsample': 0.9913430783889022, 'subsample_freq': 5, 'colsample_bytree': 0.6744218832163392, 'reg_alpha': 2.1924173805689023e-07, 'reg_lambda': 1.0975723398726735e-06, 'min_child_samples': 25, 'min_child_weight': 0.006341796182561882, 'min_split_gain': 0.44770429113037885, 'cat_smooth': 38.18736974574263, 'cat_l2': 25.801431934226038}. Best is trial 5 with value: 0.510439958348177.[0m
Training until validation scores don't improve for 30 rounds
Early stopping, best iteration is:
[74]	valid_0's rmse: 0.525834	valid_0's l2: 0.276502
Training until validation scores don't improve for 30 rounds
Early stopping, best iteration is:
[71]	valid_0's rmse: 0.557062	valid_0's l2: 0.310318
Training until validation scores don't improve for 30 rounds
Early stopping, best iteration is:
[83]	valid_0's rmse: 0.57982	valid_0's l2: 0.336192
Training until validation scores don't improve for 30 rounds
Early stopping, best iteration is:
[83]	valid_0's rmse: 0.579586	valid_0's l2: 0.33592
Training until validation scores don't improve for 30 rounds
Early stopping, best iteration is:
[67]	valid_0's rmse: 0.530743	valid_0's l2: 0.281688
[32m[I 2026-08-02 15:53:50,146][0m Trial 14 finished with value: 0.554609219077833 and parameters: {'boosting_type': 'gbdt', 'max_depth': 8, 'num_leaves': 205, 'learning_rate': 0.1004264024195482, 'n_estimators': 2314, 'subsample': 0.9780219661639153, 'subsample_freq': 5, 'colsample_bytree': 0.7827720976482371, 'reg_alpha': 2.9959272818257276e-07, 'reg_lambda': 2.995710376987626e-07, 'min_child_samples': 46, 'min_child_weight': 0.0005770328661424418, 'min_split_gain': 0.36722238041438304, 'cat_smooth': 33.389622479204625, 'cat_l2': 18.84979853831891}. Best is trial 5 with value: 0.510439958348177.[0m
Training until validation scores don't improve for 30 rounds
Early stopping, best iteration is:
[119]	valid_0's rmse: 0.481161	valid_0's l2: 0.231516
Training until validation scores don't improve for 30 rounds
Early stopping, best iteration is:
[110]	valid_0's rmse: 0.525953	valid_0's l2: 0.276627
Training until validation scores don't improve for 30 rounds
Early stopping, best iteration is:
[167]	valid_0's rmse: 0.515584	valid_0's l2: 0.265827
Training until validation scores don't improve for 30 rounds
Early stopping, best iteration is:
[102]	valid_0's rmse: 0.52141	valid_0's l2: 0.271868
Training until validation scores don't improve for 30 rounds
Early stopping, best iteration is:
[250]	valid_0's rmse: 0.478326	valid_0's l2: 0.228796
[32m[I 2026-08-02 15:53:50,902][0m Trial 15 finished with value: 0.5046906604865389 and parameters: {'boosting_type': 'gbdt', 'max_depth': 10, 'num_leaves': 105, 'learning_rate': 0.07242653284133035, 'n_estimators': 2129, 'subsample': 0.8410730986310979, 'subsample_freq': 1, 'colsample_bytree': 0.9519813620575733, 'reg_alpha': 1.276489533536395e-08, 'reg_lambda': 3.984531156188375e-05, 'min_child_samples': 14, 'min_child_weight': 0.009182380300848954, 'min_split_gain': 0.1768114809517768, 'cat_smooth': 22.683026787514358, 'cat_l2': 2.16785479616793}. Best is trial 15 with value: 0.5046906604865389.[0m
Training until validation scores don't improve for 30 rounds
Early stopping, best iteration is:
[177]	valid_0's rmse: 0.468924	valid_0's l2: 0.21989
Training until validation scores don't improve for 30 rounds
Early stopping, best iteration is:
[220]	valid_0's rmse: 0.496867	valid_0's l2: 0.246876
Training until validation scores don't improve for 30 rounds
Early stopping, best iteration is:
[278]	valid_0's rmse: 0.492485	valid_0's l2: 0.242542
Training until validation scores don't improve for 30 rounds
Early stopping, best iteration is:
[236]	valid_0's rmse: 0.505602	valid_0's l2: 0.255633
Training until validation scores don't improve for 30 rounds
Early stopping, best iteration is:
[235]	valid_0's rmse: 0.445175	valid_0's l2: 0.198181
[32m[I 2026-08-02 15:53:52,491][0m Trial 16 finished with value: 0.48181047134764343 and parameters: {'boosting_type': 'gbdt', 'max_depth': 10, 'num_leaves': 31, 'learning_rate': 0.03839452164203378, 'n_estimators': 1972, 'subsample': 0.8199212859905153, 'subsample_freq': 1, 'colsample_bytree': 0.9869191607308052, 'reg_alpha': 1.2710603265392387e-08, 'reg_lambda': 5.9518082534861874e-05, 'min_child_samples': 13, 'min_child_weight': 0.01852224764070393, 'min_split_gain': 0.05372119777160883, 'cat_smooth': 21.49872794581777, 'cat_l2': 1.735176073565559}. Best is trial 16 with value: 0.48181047134764343.[0m
Training until validation scores don't improve for 30 rounds
Early stopping, best iteration is:
[543]	valid_0's rmse: 0.479175	valid_0's l2: 0.229609
Training until validation scores don't improve for 30 rounds
Early stopping, best iteration is:
[597]	valid_0's rmse: 0.49578	valid_0's l2: 0.245798
Training until validation scores don't improve for 30 rounds
Early stopping, best iteration is:
[728]	valid_0's rmse: 0.497473	valid_0's l2: 0.24748
Training until validation scores don't improve for 30 rounds
Early stopping, best iteration is:
[658]	valid_0's rmse: 0.517869	valid_0's l2: 0.268189
Training until validation scores don't improve for 30 rounds
Early stopping, best iteration is:
[500]	valid_0's rmse: 0.459112	valid_0's l2: 0.210784
[32m[I 2026-08-02 15:53:55,781][0m Trial 17 finished with value: 0.48988212305058443 and parameters: {'boosting_type': 'gbdt', 'max_depth': 10, 'num_leaves': 17, 'learning_rate': 0.019501002200285413, 'n_estimators': 1959, 'subsample': 0.8476535744829614, 'subsample_freq': 1, 'colsample_bytree': 0.9941581571828402, 'reg_alpha': 9.848328068957097e-07, 'reg_lambda': 4.891971998318658e-05, 'min_child_samples': 18, 'min_child_weight': 0.021318738679347547, 'min_split_gain': 0.02873721860276618, 'cat_smooth': 15.70887852919771, 'cat_l2': 1.918213740782981}. Best is trial 16 with value: 0.48181047134764343.[0m
Training until validation scores don't improve for 30 rounds
Early stopping, best iteration is:
[965]	valid_0's rmse: 0.477963	valid_0's l2: 0.228449
Training until validation scores don't improve for 30 rounds
Early stopping, best iteration is:
[852]	valid_0's rmse: 0.515724	valid_0's l2: 0.265971
Training until validation scores don't improve for 30 rounds
Early stopping, best iteration is:
[1370]	valid_0's rmse: 0.511466	valid_0's l2: 0.261598
Training until validation scores don't improve for 30 rounds
Early stopping, best iteration is:
[1044]	valid_0's rmse: 0.533508	valid_0's l2: 0.28463
Training until validation scores don't improve for 30 rounds
Early stopping, best iteration is:
[1141]	valid_0's rmse: 0.476731	valid_0's l2: 0.227273
