[32m[I 2026-08-02 15:54:00,233][0m Trial 18 finished with value: 0.5030785220341368 and parameters: {'boosting_type': 'gbdt', 'max_depth': 10, 'num_leaves': 25, 'learning_rate': 0.01688202428984101, 'n_estimators': 1918, 'subsample': 0.874075316054234, 'subsample_freq': 1, 'colsample_bytree': 0.9995894458613797, 'reg_alpha': 9.174652028847484e-07, 'reg_lambda': 0.01072233628266338, 'min_child_samples': 46, 'min_child_weight': 0.026443196469032874, 'min_split_gain': 0.013533446219975265, 'cat_smooth': 15.193951827302929, 'cat_l2': 0.9680192990369606}. Best is trial 16 with value: 0.48181047134764343.[0m
Training until validation scores don't improve for 30 rounds
Early stopping, best iteration is:
[390]	valid_0's rmse: 0.486104	valid_0's l2: 0.236297
Training until validation scores don't improve for 30 rounds
Early stopping, best iteration is:
[434]	valid_0's rmse: 0.51215	valid_0's l2: 0.262297
Training until validation scores don't improve for 30 rounds
Early stopping, best iteration is:
[620]	valid_0's rmse: 0.512485	valid_0's l2: 0.26264
Training until validation scores don't improve for 30 rounds
Early stopping, best iteration is:
[610]	valid_0's rmse: 0.519962	valid_0's l2: 0.27036
Training until validation scores don't improve for 30 rounds
Early stopping, best iteration is:
[456]	valid_0's rmse: 0.458531	valid_0's l2: 0.210251
[32m[I 2026-08-02 15:54:02,171][0m Trial 19 finished with value: 0.4978462219525179 and parameters: {'boosting_type': 'gbdt', 'max_depth': 6, 'num_leaves': 44, 'learning_rate': 0.021066700551865273, 'n_estimators': 1601, 'subsample': 0.7943072503368426, 'subsample_freq': 2, 'colsample_bytree': 0.9037820293596805, 'reg_alpha': 2.1950933129673403e-06, 'reg_lambda': 7.36181133166995e-05, 'min_child_samples': 18, 'min_child_weight': 0.03363391843066247, 'min_split_gain': 0.12433125206200203, 'cat_smooth': 6.6614107447837725, 'cat_l2': 7.374026488241032}. Best is trial 16 with value: 0.48181047134764343.[0m
Training until validation scores don't improve for 30 rounds
Early stopping, best iteration is:
[791]	valid_0's rmse: 0.481558	valid_0's l2: 0.231898
Training until validation scores don't improve for 30 rounds
Early stopping, best iteration is:
[1131]	valid_0's rmse: 0.497334	valid_0's l2: 0.247341
Training until validation scores don't improve for 30 rounds
Early stopping, best iteration is:
[1369]	valid_0's rmse: 0.504254	valid_0's l2: 0.254272
Training until validation scores don't improve for 30 rounds
Early stopping, best iteration is:
[1243]	valid_0's rmse: 0.525255	valid_0's l2: 0.275893
Training until validation scores don't improve for 30 rounds
Early stopping, best iteration is:
[1391]	valid_0's rmse: 0.462228	valid_0's l2: 0.213655
[32m[I 2026-08-02 15:54:08,034][0m Trial 20 finished with value: 0.49412609314712236 and parameters: {'boosting_type': 'gbdt', 'max_depth': 15, 'num_leaves': 47, 'learning_rate': 0.013170867264271543, 'n_estimators': 1894, 'subsample': 0.932275184634352, 'subsample_freq': 1, 'colsample_bytree': 0.8170697909819759, 'reg_alpha': 9.212514599899718e-05, 'reg_lambda': 0.025792137776440602, 'min_child_samples': 37, 'min_child_weight': 0.016500161439051118, 'min_split_gain': 0.007186938250158623, 'cat_smooth': 0.5075678090460816, 'cat_l2': 17.11033912638911}. Best is trial 16 with value: 0.48181047134764343.[0m
Training until validation scores don't improve for 30 rounds
Early stopping, best iteration is:
[731]	valid_0's rmse: 0.477312	valid_0's l2: 0.227826
Training until validation scores don't improve for 30 rounds
Early stopping, best iteration is:
[1120]	valid_0's rmse: 0.500807	valid_0's l2: 0.250808
Training until validation scores don't improve for 30 rounds
Early stopping, best iteration is:
[1101]	valid_0's rmse: 0.50795	valid_0's l2: 0.258013
Training until validation scores don't improve for 30 rounds
Early stopping, best iteration is:
[984]	valid_0's rmse: 0.523888	valid_0's l2: 0.274458
Training until validation scores don't improve for 30 rounds
Early stopping, best iteration is:
[975]	valid_0's rmse: 0.464841	valid_0's l2: 0.216077
[32m[I 2026-08-02 15:54:13,333][0m Trial 21 finished with value: 0.49495958265800705 and parameters: {'boosting_type': 'gbdt', 'max_depth': 15, 'num_leaves': 41, 'learning_rate': 0.016466282393774363, 'n_estimators': 1996, 'subsample': 0.9202553354368582, 'subsample_freq': 1, 'colsample_bytree': 0.8389718757635525, 'reg_alpha': 8.719243945150462e-05, 'reg_lambda': 0.058078354316686655, 'min_child_samples': 35, 'min_child_weight': 0.01183010471638366, 'min_split_gain': 0.0046509970036738395, 'cat_smooth': 0.5174219484548352, 'cat_l2': 15.900134105420221}. Best is trial 16 with value: 0.48181047134764343.[0m
Training until validation scores don't improve for 30 rounds
Early stopping, best iteration is:
[966]	valid_0's rmse: 0.485497	valid_0's l2: 0.235707
Training until validation scores don't improve for 30 rounds
Early stopping, best iteration is:
[1294]	valid_0's rmse: 0.524218	valid_0's l2: 0.274804
Training until validation scores don't improve for 30 rounds
Early stopping, best iteration is:
[1320]	valid_0's rmse: 0.531655	valid_0's l2: 0.282657
Training until validation scores don't improve for 30 rounds
Early stopping, best iteration is:
[1248]	valid_0's rmse: 0.53799	valid_0's l2: 0.289434
Training until validation scores don't improve for 30 rounds
Early stopping, best iteration is:
[1019]	valid_0's rmse: 0.489806	valid_0's l2: 0.23991
[32m[I 2026-08-02 15:54:17,180][0m Trial 22 finished with value: 0.5138333226639973 and parameters: {'boosting_type': 'gbdt', 'max_depth': 14, 'num_leaves': 47, 'learning_rate': 0.011479384479559786, 'n_estimators': 1859, 'subsample': 0.8492552228859346, 'subsample_freq': 2, 'colsample_bytree': 0.9843215654020396, 'reg_alpha': 1.008568572370676e-07, 'reg_lambda': 0.004721960326937602, 'min_child_samples': 44, 'min_child_weight': 0.04276480052536848, 'min_split_gain': 0.13002645771848675, 'cat_smooth': 14.218630795001467, 'cat_l2': 5.025710547788733}. Best is trial 16 with value: 0.48181047134764343.[0m
Training until validation scores don't improve for 30 rounds
Early stopping, best iteration is:
[345]	valid_0's rmse: 0.499744	valid_0's l2: 0.249744
Training until validation scores don't improve for 30 rounds
Early stopping, best iteration is:
[316]	valid_0's rmse: 0.542707	valid_0's l2: 0.294531
Training until validation scores don't improve for 30 rounds
Early stopping, best iteration is:
[475]	valid_0's rmse: 0.539051	valid_0's l2: 0.290576
Training until validation scores don't improve for 30 rounds
Early stopping, best iteration is:
[623]	valid_0's rmse: 0.558415	valid_0's l2: 0.311827
Training until validation scores don't improve for 30 rounds
Early stopping, best iteration is:
[470]	valid_0's rmse: 0.487647	valid_0's l2: 0.2378
[32m[I 2026-08-02 15:54:18,597][0m Trial 23 finished with value: 0.5256579352466243 and parameters: {'boosting_type': 'gbdt', 'max_depth': 10, 'num_leaves': 15, 'learning_rate': 0.02632487601698028, 'n_estimators': 1604, 'subsample': 0.9320722980614805, 'subsample_freq': 1, 'colsample_bytree': 0.9323869689283429, 'reg_alpha': 2.067933415202458e-06, 'reg_lambda': 0.00028058021371507786, 'min_child_samples': 27, 'min_child_weight': 0.0025327579930230436, 'min_split_gain': 0.24268858997831758, 'cat_smooth': 18.46827454030246, 'cat_l2': 13.287150254591268}. Best is trial 16 with value: 0.48181047134764343.[0m
Training until validation scores don't improve for 30 rounds
Early stopping, best iteration is:
[236]	valid_0's rmse: 0.476941	valid_0's l2: 0.227473
Training until validation scores don't improve for 30 rounds
Early stopping, best iteration is:
[180]	valid_0's rmse: 0.510206	valid_0's l2: 0.26031
Training until validation scores don't improve for 30 rounds
Early stopping, best iteration is:
[411]	valid_0's rmse: 0.508745	valid_0's l2: 0.258821
Training until validation scores don't improve for 30 rounds
Early stopping, best iteration is:
[234]	valid_0's rmse: 0.514911	valid_0's l2: 0.265133
Training until validation scores don't improve for 30 rounds
Early stopping, best iteration is:
[263]	valid_0's rmse: 0.456727	valid_0's l2: 0.2086
[32m[I 2026-08-02 15:54:20,075][0m Trial 24 finished with value: 0.4935059522047259 and parameters: {'boosting_type': 'gbdt', 'max_depth': 9, 'num_leaves': 81, 'learning_rate': 0.03198592465517392, 'n_estimators': 2533, 'subsample': 0.824130293469259, 'subsample_freq': 3, 'colsample_bytree': 0.804592414015199, 'reg_alpha': 4.752527522491796e-05, 'reg_lambda': 0.24207618393166272, 'min_child_samples': 14, 'min_child_weight': 0.014755597852214, 'min_split_gain': 0.09132898106539006, 'cat_smooth': 0.8136307830905807, 'cat_l2': 0.12746524110966484}. Best is trial 16 with value: 0.48181047134764343.[0m
Training until validation scores don't improve for 30 rounds
Early stopping, best iteration is:
[276]	valid_0's rmse: 0.48098	valid_0's l2: 0.231341
Training until validation scores don't improve for 30 rounds
Early stopping, best iteration is:
[246]	valid_0's rmse: 0.508961	valid_0's l2: 0.259042
Training until validation scores don't improve for 30 rounds
Early stopping, best iteration is:
[387]	valid_0's rmse: 0.507374	valid_0's l2: 0.257428
Training until validation scores don't improve for 30 rounds
Early stopping, best iteration is:
[243]	valid_0's rmse: 0.516258	valid_0's l2: 0.266523
Training until validation scores don't improve for 30 rounds
Early stopping, best iteration is:
[231]	valid_0's rmse: 0.463094	valid_0's l2: 0.214456
[32m[I 2026-08-02 15:54:21,597][0m Trial 25 finished with value: 0.4953334346030657 and parameters: {'boosting_type': 'gbdt', 'max_depth': 9, 'num_leaves': 88, 'learning_rate': 0.031584732152574284, 'n_estimators': 2573, 'subsample': 0.7551454482364612, 'subsample_freq': 3, 'colsample_bytree': 0.9247781122082177, 'reg_alpha': 8.523636709278411e-08, 'reg_lambda': 0.2752279449011062, 'min_child_samples': 15, 'min_child_weight': 0.05167655104369533, 'min_split_gain': 0.11394888015974855, 'cat_smooth': 12.123499518045163, 'cat_l2': 0.6151321452335785}. Best is trial 16 with value: 0.48181047134764343.[0m
[32m[I 2026-08-02 15:54:52,075][0m Trial 26 finished with value: 0.5095896652696007 and parameters: {'boosting_type': 'dart', 'max_depth': 6, 'num_leaves': 77, 'learning_rate': 0.058957374649931435, 'n_estimators': 2529, 'subsample': 0.8229827921732414, 'subsample_freq': 2, 'colsample_bytree': 0.7796189403496308, 'reg_alpha': 1.4965892422460994e-06, 'reg_lambda': 1.0294796067362032e-05, 'min_child_samples': 12, 'min_child_weight': 0.0015270736956748722, 'min_split_gain': 0.25202253212668246, 'cat_smooth': 5.4554671093507245, 'cat_l2': 4.8416913799631365, 'drop_rate': 0.022296881451710965, 'max_drop': 50, 'skip_drop': 0.2727733879694574}. Best is trial 16 with value: 0.48181047134764343.[0m
Training until validation scores don't improve for 30 rounds
Early stopping, best iteration is:
[206]	valid_0's rmse: 0.491069	valid_0's l2: 0.241149
Training until validation scores don't improve for 30 rounds
Early stopping, best iteration is:
[157]	valid_0's rmse: 0.515689	valid_0's l2: 0.265936
Training until validation scores don't improve for 30 rounds
Early stopping, best iteration is:
[172]	valid_0's rmse: 0.506728	valid_0's l2: 0.256773
Training until validation scores don't improve for 30 rounds
Early stopping, best iteration is:
[175]	valid_0's rmse: 0.521323	valid_0's l2: 0.271778
Training until validation scores don't improve for 30 rounds
Early stopping, best iteration is:
[224]	valid_0's rmse: 0.468553	valid_0's l2: 0.219542
[32m[I 2026-08-02 15:54:53,650][0m Trial 27 finished with value: 0.5006725625286984 and parameters: {'boosting_type': 'gbdt', 'max_depth': 9, 'num_leaves': 35, 'learning_rate': 0.03435980596658572, 'n_estimators': 2130, 'subsample': 0.7175786676758649, 'subsample_freq': 4, 'colsample_bytree': 0.9696677009765873, 'reg_alpha': 2.1713178255130505e-05, 'reg_lambda': 1.8713932913985813, 'min_child_samples': 5, 'min_child_weight': 0.005331493180109488, 'min_split_gain': 0.10569424969860158, 'cat_smooth': 19.372194427336304, 'cat_l2': 8.879795169414212}. Best is trial 16 with value: 0.48181047134764343.[0m
Training until validation scores don't improve for 30 rounds
Early stopping, best iteration is:
[327]	valid_0's rmse: 0.485356	valid_0's l2: 0.23557
Training until validation scores don't improve for 30 rounds
Early stopping, best iteration is:
[339]	valid_0's rmse: 0.511882	valid_0's l2: 0.262024
Training until validation scores don't improve for 30 rounds
Early stopping, best iteration is:
[412]	valid_0's rmse: 0.511602	valid_0's l2: 0.261737
Training until validation scores don't improve for 30 rounds
Early stopping, best iteration is:
[413]	valid_0's rmse: 0.525137	valid_0's l2: 0.275768
Training until validation scores don't improve for 30 rounds
Early stopping, best iteration is:
[418]	valid_0's rmse: 0.463803	valid_0's l2: 0.215113
[32m[I 2026-08-02 15:54:55,597][0m Trial 28 finished with value: 0.4995560741571971 and parameters: {'boosting_type': 'gbdt', 'max_depth': 9, 'num_leaves': 57, 'learning_rate': 0.026560916068715437, 'n_estimators': 1065, 'subsample': 0.8696371386543733, 'subsample_freq': 3, 'colsample_bytree': 0.8868174103435382, 'reg_alpha': 5.096999909814122e-08, 'reg_lambda': 0.00013145314314808525, 'min_child_samples': 20, 'min_child_weight': 0.015251266762136218, 'min_split_gain': 0.06745068580358528, 'cat_smooth': 28.9338421262204, 'cat_l2': 4.243943237734726}. Best is trial 16 with value: 0.48181047134764343.[0m
[32m[I 2026-08-02 15:55:22,218][0m Trial 29 pruned. [0m
Training until validation scores don't improve for 30 rounds
Early stopping, best iteration is:
[752]	valid_0's rmse: 0.489377	valid_0's l2: 0.239489
Training until validation scores don't improve for 30 rounds
Early stopping, best iteration is:
[652]	valid_0's rmse: 0.550707	valid_0's l2: 0.303278
Training until validation scores don't improve for 30 rounds
Early stopping, best iteration is:
[903]	valid_0's rmse: 0.549102	valid_0's l2: 0.301513
Training until validation scores don't improve for 30 rounds
Early stopping, best iteration is:
[825]	valid_0's rmse: 0.559486	valid_0's l2: 0.313025
Training until validation scores don't improve for 30 rounds
Early stopping, best iteration is:
[731]	valid_0's rmse: 0.497112	valid_0's l2: 0.247121
[32m[I 2026-08-02 15:55:24,579][0m Trial 30 finished with value: 0.5291983729927441 and parameters: {'boosting_type': 'gbdt', 'max_depth': 10, 'num_leaves': 34, 'learning_rate': 0.015152462902208612, 'n_estimators': 2662, 'subsample': 0.8119280759981847, 'subsample_freq': 2, 'colsample_bytree': 0.8253414466698196, 'reg_alpha': 0.06582082034521083, 'reg_lambda': 9.753499429471779, 'min_child_samples': 29, 'min_child_weight': 0.0005360856395886085, 'min_split_gain': 0.26560548596459477, 'cat_smooth': 15.650661121408909, 'cat_l2': 5.685740515948417}. Best is trial 16 with value: 0.48181047134764343.[0m
Training until validation scores don't improve for 30 rounds
Early stopping, best iteration is:
[848]	valid_0's rmse: 0.483631	valid_0's l2: 0.233899
Training until validation scores don't improve for 30 rounds
Early stopping, best iteration is:
[993]	valid_0's rmse: 0.511713	valid_0's l2: 0.26185
Training until validation scores don't improve for 30 rounds
Early stopping, best iteration is:
[1136]	valid_0's rmse: 0.513564	valid_0's l2: 0.263748
Training until validation scores don't improve for 30 rounds
Early stopping, best iteration is:
[1053]	valid_0's rmse: 0.533497	valid_0's l2: 0.284619
Training until validation scores don't improve for 30 rounds
Early stopping, best iteration is:
[1034]	valid_0's rmse: 0.469969	valid_0's l2: 0.220871
[32m[I 2026-08-02 15:55:29,050][0m Trial 31 finished with value: 0.5024747646930349 and parameters: {'boosting_type': 'gbdt', 'max_depth': 11, 'num_leaves': 56, 'learning_rate': 0.013774937678466279, 'n_estimators': 2024, 'subsample': 0.9488798458425631, 'subsample_freq': 1, 'colsample_bytree': 0.8058971189045675, 'reg_alpha': 0.00012258394599984414, 'reg_lambda': 0.08490048802688717, 'min_child_samples': 39, 'min_child_weight': 0.018867690523090806, 'min_split_gain': 0.03604863644904959, 'cat_smooth': 0.2682068821708104, 'cat_l2': 19.08284087907096}. Best is trial 16 with value: 0.48181047134764343.[0m
Training until validation scores don't improve for 30 rounds
Early stopping, best iteration is:
[672]	valid_0's rmse: 0.487633	valid_0's l2: 0.237786
Training until validation scores don't improve for 30 rounds
Early stopping, best iteration is:
[656]	valid_0's rmse: 0.542205	valid_0's l2: 0.293986
Training until validation scores don't improve for 30 rounds
Early stopping, best iteration is:
[792]	valid_0's rmse: 0.552414	valid_0's l2: 0.305161
Training until validation scores don't improve for 30 rounds
Early stopping, best iteration is:
[785]	valid_0's rmse: 0.543301	valid_0's l2: 0.295176
Training until validation scores don't improve for 30 rounds
Early stopping, best iteration is:
[656]	valid_0's rmse: 0.50095	valid_0's l2: 0.250951
[32m[I 2026-08-02 15:55:31,271][0m Trial 32 finished with value: 0.52540734622792 and parameters: {'boosting_type': 'gbdt', 'max_depth': 14, 'num_leaves': 93, 'learning_rate': 0.023338736230236346, 'n_estimators': 1690, 'subsample': 0.8940147233698802, 'subsample_freq': 2, 'colsample_bytree': 0.6621150886911976, 'reg_alpha': 0.0007480511913779806, 'reg_lambda': 0.0151431087736978, 'min_child_samples': 52, 'min_child_weight': 0.011272251077905915, 'min_split_gain': 0.1698131572666058, 'cat_smooth': 3.2765143242847623, 'cat_l2': 0.3313169337669788}. Best is trial 16 with value: 0.48181047134764343.[0m
Training until validation scores don't improve for 30 rounds
Early stopping, best iteration is:
[440]	valid_0's rmse: 0.48342	valid_0's l2: 0.233695
Training until validation scores don't improve for 30 rounds
Early stopping, best iteration is:
[607]	valid_0's rmse: 0.521023	valid_0's l2: 0.271465
Training until validation scores don't improve for 30 rounds
Early stopping, best iteration is:
[960]	valid_0's rmse: 0.518557	valid_0's l2: 0.268902
Training until validation scores don't improve for 30 rounds
Early stopping, best iteration is:
[655]	valid_0's rmse: 0.534255	valid_0's l2: 0.285428
Training until validation scores don't improve for 30 rounds
Early stopping, best iteration is:
[640]	valid_0's rmse: 0.471346	valid_0's l2: 0.222167
[32m[I 2026-08-02 15:55:34,018][0m Trial 33 finished with value: 0.5057287918712206 and parameters: {'boosting_type': 'gbdt', 'max_depth': 11, 'num_leaves': 71, 'learning_rate': 0.019396685040855628, 'n_estimators': 1514, 'subsample': 0.8865855490957069, 'subsample_freq': 1, 'colsample_bytree': 0.6946565075394948, 'reg_alpha': 4.233571065485951e-05, 'reg_lambda': 0.24606728819656268, 'min_child_samples': 31, 'min_child_weight': 0.04554998114268833, 'min_split_gain': 0.07195898532660755, 'cat_smooth': 9.027097433609557, 'cat_l2': 13.26178105489316}. Best is trial 16 with value: 0.48181047134764343.[0m
[32m[I 2026-08-02 15:55:49,311][0m Trial 34 finished with value: 0.5130142279711861 and parameters: {'boosting_type': 'dart', 'max_depth': 13, 'num_leaves': 24, 'learning_rate': 0.00792827954320591, 'n_estimators': 2242, 'subsample': 0.8380281780293097, 'subsample_freq': 2, 'colsample_bytree': 0.8494993005939449, 'reg_alpha': 0.000526063106906578, 'reg_lambda': 3.244159646349042e-05, 'min_child_samples': 22, 'min_child_weight': 0.026304480679438927, 'min_split_gain': 0.009116594709248763, 'cat_smooth': 2.8822874305364747, 'cat_l2': 10.372817972362695, 'drop_rate': 0.15525870591280835, 'max_drop': 1, 'skip_drop': 0.18792572659193343}. Best is trial 16 with value: 0.48181047134764343.[0m
Training until validation scores don't improve for 30 rounds
Early stopping, best iteration is:
[1693]	valid_0's rmse: 0.491726	valid_0's l2: 0.241794
Training until validation scores don't improve for 30 rounds
Early stopping, best iteration is:
[1550]	valid_0's rmse: 0.546904	valid_0's l2: 0.299104
Training until validation scores don't improve for 30 rounds
Did not meet early stopping. Best iteration is:
[1794]	valid_0's rmse: 0.550669	valid_0's l2: 0.303237
Training until validation scores don't improve for 30 rounds
Early stopping, best iteration is:
[1314]	valid_0's rmse: 0.542396	valid_0's l2: 0.294194
Training until validation scores don't improve for 30 rounds
Did not meet early stopping. Best iteration is:
[1778]	valid_0's rmse: 0.494695	valid_0's l2: 0.244723
[32m[I 2026-08-02 15:55:53,723][0m Trial 35 finished with value: 0.5252780402723161 and parameters: {'boosting_type': 'gbdt', 'max_depth': 13, 'num_leaves': 55, 'learning_rate': 0.012712024759219093, 'n_estimators': 1794, 'subsample': 0.9588132514755513, 'subsample_freq': 3, 'colsample_bytree': 0.7237985603045939, 'reg_alpha': 4.7152175586701646e-06, 'reg_lambda': 0.0007162326757242872, 'min_child_samples': 90, 'min_child_weight': 0.05697793137737731, 'min_split_gain': 0.07935589440892091, 'cat_smooth': 7.050449964751968, 'cat_l2': 26.093631987307322}. Best is trial 16 with value: 0.48181047134764343.[0m
Training until validation scores don't improve for 30 rounds
Early stopping, best iteration is:
[1859]	valid_0's rmse: 0.494029	valid_0's l2: 0.244065
Training until validation scores don't improve for 30 rounds
Early stopping, best iteration is:
[1915]	valid_0's rmse: 0.54746	valid_0's l2: 0.299713
Training until validation scores don't improve for 30 rounds
Did not meet early stopping. Best iteration is:
[2012]	valid_0's rmse: 0.553417	valid_0's l2: 0.30627
Training until validation scores don't improve for 30 rounds
Did not meet early stopping. Best iteration is:
[2007]	valid_0's rmse: 0.549381	valid_0's l2: 0.301819
Training until validation scores don't improve for 30 rounds
Did not meet early stopping. Best iteration is:
[2011]	valid_0's rmse: 0.503829	valid_0's l2: 0.253844
