[32m[I 2026-08-02 15:55:58,664][0m Trial 36 finished with value: 0.5296232759800981 and parameters: {'boosting_type': 'gbdt', 'max_depth': 5, 'num_leaves': 31, 'learning_rate': 0.008416966238364154, 'n_estimators': 2013, 'subsample': 0.9019972702108546, 'subsample_freq': 1, 'colsample_bytree': 0.9175348589361344, 'reg_alpha': 6.181368615285346e-07, 'reg_lambda': 0.013106720515314594, 'min_child_samples': 64, 'min_child_weight': 0.005001138448429587, 'min_split_gain': 0.169222099412198, 'cat_smooth': 22.45160312766658, 'cat_l2': 3.3106668014046488}. Best is trial 16 with value: 0.48181047134764343.[0m
Training until validation scores don't improve for 30 rounds
Early stopping, best iteration is:
[405]	valid_0's rmse: 0.48098	valid_0's l2: 0.231342
Training until validation scores don't improve for 30 rounds
Early stopping, best iteration is:
[479]	valid_0's rmse: 0.508938	valid_0's l2: 0.259018
Training until validation scores don't improve for 30 rounds
Early stopping, best iteration is:
[510]	valid_0's rmse: 0.532327	valid_0's l2: 0.283372
Training until validation scores don't improve for 30 rounds
Early stopping, best iteration is:
[360]	valid_0's rmse: 0.540064	valid_0's l2: 0.291669
Training until validation scores don't improve for 30 rounds
Early stopping, best iteration is:
[374]	valid_0's rmse: 0.486453	valid_0's l2: 0.236637
[32m[I 2026-08-02 15:56:00,687][0m Trial 37 finished with value: 0.5097526276867507 and parameters: {'boosting_type': 'gbdt', 'max_depth': 11, 'num_leaves': 68, 'learning_rate': 0.033787574380653086, 'n_estimators': 1427, 'subsample': 0.8605850789569341, 'subsample_freq': 8, 'colsample_bytree': 0.8749784223523019, 'reg_alpha': 0.002923486620055491, 'reg_lambda': 4.173824998113465e-06, 'min_child_samples': 41, 'min_child_weight': 0.017532886441663093, 'min_split_gain': 0.05583338549013683, 'cat_smooth': 11.432885685185067, 'cat_l2': 6.145137329803057}. Best is trial 16 with value: 0.48181047134764343.[0m
[32m[I 2026-08-02 15:56:20,941][0m Trial 38 pruned. [0m
Training until validation scores don't improve for 30 rounds
Early stopping, best iteration is:
[148]	valid_0's rmse: 0.504745	valid_0's l2: 0.254767
Training until validation scores don't improve for 30 rounds
Early stopping, best iteration is:
[106]	valid_0's rmse: 0.535618	valid_0's l2: 0.286887
Training until validation scores don't improve for 30 rounds
Early stopping, best iteration is:
[139]	valid_0's rmse: 0.535689	valid_0's l2: 0.286962
Training until validation scores don't improve for 30 rounds
Early stopping, best iteration is:
[112]	valid_0's rmse: 0.544122	valid_0's l2: 0.296069
Training until validation scores don't improve for 30 rounds
Early stopping, best iteration is:
[153]	valid_0's rmse: 0.49007	valid_0's l2: 0.240169
[32m[I 2026-08-02 15:56:21,754][0m Trial 39 finished with value: 0.5220487288818003 and parameters: {'boosting_type': 'gbdt', 'max_depth': 12, 'num_leaves': 47, 'learning_rate': 0.06113959423648746, 'n_estimators': 1237, 'subsample': 0.7397752725564863, 'subsample_freq': 4, 'colsample_bytree': 0.9999476735785355, 'reg_alpha': 3.8288222345699507e-05, 'reg_lambda': 4.643226328114808e-07, 'min_child_samples': 23, 'min_child_weight': 0.011448043378719682, 'min_split_gain': 0.23188184253494568, 'cat_smooth': 30.17916761303622, 'cat_l2': 7.703353885952323}. Best is trial 16 with value: 0.48181047134764343.[0m
[32m[I 2026-08-02 15:56:30,197][0m Trial 40 pruned. [0m
Training until validation scores don't improve for 30 rounds
Early stopping, best iteration is:
[310]	valid_0's rmse: 0.483079	valid_0's l2: 0.233365
Training until validation scores don't improve for 30 rounds
Early stopping, best iteration is:
[370]	valid_0's rmse: 0.499964	valid_0's l2: 0.249964
Training until validation scores don't improve for 30 rounds
Early stopping, best iteration is:
[423]	valid_0's rmse: 0.513277	valid_0's l2: 0.263454
Training until validation scores don't improve for 30 rounds
Early stopping, best iteration is:
[330]	valid_0's rmse: 0.529392	valid_0's l2: 0.280255
Training until validation scores don't improve for 30 rounds
Early stopping, best iteration is:
[293]	valid_0's rmse: 0.464428	valid_0's l2: 0.215693
[32m[I 2026-08-02 15:56:32,359][0m Trial 41 finished with value: 0.4980279987460013 and parameters: {'boosting_type': 'gbdt', 'max_depth': 15, 'num_leaves': 41, 'learning_rate': 0.043602561588622586, 'n_estimators': 1968, 'subsample': 0.9268956585433697, 'subsample_freq': 1, 'colsample_bytree': 0.8525555612936937, 'reg_alpha': 0.0002648795789147915, 'reg_lambda': 0.06354036901621157, 'min_child_samples': 35, 'min_child_weight': 0.012742926338310534, 'min_split_gain': 0.004086119381813863, 'cat_smooth': 0.543267988553589, 'cat_l2': 17.297600961836313}. Best is trial 16 with value: 0.48181047134764343.[0m
Training until validation scores don't improve for 30 rounds
Early stopping, best iteration is:
[1290]	valid_0's rmse: 0.475037	valid_0's l2: 0.22566
Training until validation scores don't improve for 30 rounds
Early stopping, best iteration is:
[1354]	valid_0's rmse: 0.517829	valid_0's l2: 0.268147
Training until validation scores don't improve for 30 rounds
Early stopping, best iteration is:
[1271]	valid_0's rmse: 0.518131	valid_0's l2: 0.26846
Training until validation scores don't improve for 30 rounds
Early stopping, best iteration is:
[1224]	valid_0's rmse: 0.520625	valid_0's l2: 0.27105
Training until validation scores don't improve for 30 rounds
Early stopping, best iteration is:
[1296]	valid_0's rmse: 0.482528	valid_0's l2: 0.232833
[32m[I 2026-08-02 15:56:37,498][0m Trial 42 finished with value: 0.5028299708389343 and parameters: {'boosting_type': 'gbdt', 'max_depth': 14, 'num_leaves': 25, 'learning_rate': 0.015677995231893546, 'n_estimators': 2061, 'subsample': 0.9097641122083927, 'subsample_freq': 1, 'colsample_bytree': 0.8300444586950351, 'reg_alpha': 6.281620173783273e-05, 'reg_lambda': 0.15235681445925575, 'min_child_samples': 55, 'min_child_weight': 0.003647815810905496, 'min_split_gain': 0.003249888250689486, 'cat_smooth': 5.4435445024221645, 'cat_l2': 14.851753798271533}. Best is trial 16 with value: 0.48181047134764343.[0m
Training until validation scores don't improve for 30 rounds
Early stopping, best iteration is:
[482]	valid_0's rmse: 0.491948	valid_0's l2: 0.242013
Training until validation scores don't improve for 30 rounds
Early stopping, best iteration is:
[444]	valid_0's rmse: 0.521463	valid_0's l2: 0.271924
Training until validation scores don't improve for 30 rounds
Early stopping, best iteration is:
[640]	valid_0's rmse: 0.52789	valid_0's l2: 0.278668
Training until validation scores don't improve for 30 rounds
Early stopping, best iteration is:
[615]	valid_0's rmse: 0.542043	valid_0's l2: 0.293811
Training until validation scores don't improve for 30 rounds
Early stopping, best iteration is:
[500]	valid_0's rmse: 0.484351	valid_0's l2: 0.234596
[32m[I 2026-08-02 15:56:39,460][0m Trial 43 finished with value: 0.5136088662026742 and parameters: {'boosting_type': 'gbdt', 'max_depth': 15, 'num_leaves': 59, 'learning_rate': 0.022517840703825332, 'n_estimators': 1853, 'subsample': 0.9563544612105798, 'subsample_freq': 1, 'colsample_bytree': 0.73390712554254, 'reg_alpha': 1.3069452405790852e-05, 'reg_lambda': 0.0023997893984348986, 'min_child_samples': 38, 'min_child_weight': 0.00857415795800438, 'min_split_gain': 0.09747421984848488, 'cat_smooth': 0.1810054895808637, 'cat_l2': 20.421985768676382}. Best is trial 16 with value: 0.48181047134764343.[0m
Training until validation scores don't improve for 30 rounds
Early stopping, best iteration is:
[683]	valid_0's rmse: 0.479843	valid_0's l2: 0.230249
Training until validation scores don't improve for 30 rounds
Early stopping, best iteration is:
[769]	valid_0's rmse: 0.510811	valid_0's l2: 0.260927
Training until validation scores don't improve for 30 rounds
Early stopping, best iteration is:
[1034]	valid_0's rmse: 0.508749	valid_0's l2: 0.258825
Training until validation scores don't improve for 30 rounds
Early stopping, best iteration is:
[686]	valid_0's rmse: 0.526121	valid_0's l2: 0.276804
Training until validation scores don't improve for 30 rounds
Early stopping, best iteration is:
[742]	valid_0's rmse: 0.461091	valid_0's l2: 0.212605
[32m[I 2026-08-02 15:56:44,362][0m Trial 44 finished with value: 0.4973228815867537 and parameters: {'boosting_type': 'gbdt', 'max_depth': 13, 'num_leaves': 42, 'learning_rate': 0.011502972564133363, 'n_estimators': 2354, 'subsample': 0.8101080408140753, 'subsample_freq': 2, 'colsample_bytree': 0.7653820395235863, 'reg_alpha': 0.00015217697421468157, 'reg_lambda': 0.039364002175318054, 'min_child_samples': 20, 'min_child_weight': 0.03133795507729984, 'min_split_gain': 0.056835639450498465, 'cat_smooth': 2.2077808806846377, 'cat_l2': 29.789146016430056}. Best is trial 16 with value: 0.48181047134764343.[0m
Training until validation scores don't improve for 30 rounds
Early stopping, best iteration is:
[456]	valid_0's rmse: 0.469781	valid_0's l2: 0.220694
Training until validation scores don't improve for 30 rounds
Early stopping, best iteration is:
[439]	valid_0's rmse: 0.520204	valid_0's l2: 0.270612
Training until validation scores don't improve for 30 rounds
Early stopping, best iteration is:
[664]	valid_0's rmse: 0.515379	valid_0's l2: 0.265616
Training until validation scores don't improve for 30 rounds
Early stopping, best iteration is:
[508]	valid_0's rmse: 0.531876	valid_0's l2: 0.282893
Training until validation scores don't improve for 30 rounds
Early stopping, best iteration is:
[510]	valid_0's rmse: 0.478176	valid_0's l2: 0.228652
[32m[I 2026-08-02 15:56:46,218][0m Trial 45 finished with value: 0.5030832537100037 and parameters: {'boosting_type': 'gbdt', 'max_depth': 14, 'num_leaves': 16, 'learning_rate': 0.038949751133332225, 'n_estimators': 2209, 'subsample': 0.8785280964480172, 'subsample_freq': 2, 'colsample_bytree': 0.8969074637321858, 'reg_alpha': 0.007417204070698081, 'reg_lambda': 0.7462095111211817, 'min_child_samples': 51, 'min_child_weight': 0.06566253033504264, 'min_split_gain': 0.054401087872667, 'cat_smooth': 24.453068006323345, 'cat_l2': 11.253713452006114}. Best is trial 16 with value: 0.48181047134764343.[0m
Training until validation scores don't improve for 30 rounds
Early stopping, best iteration is:
[196]	valid_0's rmse: 0.504412	valid_0's l2: 0.254431
Training until validation scores don't improve for 30 rounds
Early stopping, best iteration is:
[211]	valid_0's rmse: 0.543297	valid_0's l2: 0.295171
Training until validation scores don't improve for 30 rounds
Early stopping, best iteration is:
[197]	valid_0's rmse: 0.549998	valid_0's l2: 0.302498
Training until validation scores don't improve for 30 rounds
Early stopping, best iteration is:
[187]	valid_0's rmse: 0.56238	valid_0's l2: 0.316271
Training until validation scores don't improve for 30 rounds
Early stopping, best iteration is:
[169]	valid_0's rmse: 0.493929	valid_0's l2: 0.243966
[32m[I 2026-08-02 15:56:47,073][0m Trial 46 finished with value: 0.530836322142166 and parameters: {'boosting_type': 'gbdt', 'max_depth': 15, 'num_leaves': 68, 'learning_rate': 0.05303072588798977, 'n_estimators': 1485, 'subsample': 0.9253897157132113, 'subsample_freq': 3, 'colsample_bytree': 0.8427980501703747, 'reg_alpha': 0.04653859348872576, 'reg_lambda': 4.616640982299886, 'min_child_samples': 30, 'min_child_weight': 0.015459264191041761, 'min_split_gain': 0.2067946381934627, 'cat_smooth': 34.940360769120375, 'cat_l2': 2.356834489182299}. Best is trial 16 with value: 0.48181047134764343.[0m
Training until validation scores don't improve for 30 rounds
Early stopping, best iteration is:
[559]	valid_0's rmse: 0.489733	valid_0's l2: 0.239838
Training until validation scores don't improve for 30 rounds
Early stopping, best iteration is:
[604]	valid_0's rmse: 0.537993	valid_0's l2: 0.289436
Training until validation scores don't improve for 30 rounds
Early stopping, best iteration is:
[660]	valid_0's rmse: 0.537881	valid_0's l2: 0.289316
Training until validation scores don't improve for 30 rounds
Early stopping, best iteration is:
[496]	valid_0's rmse: 0.540176	valid_0's l2: 0.29179
Training until validation scores don't improve for 30 rounds
Early stopping, best iteration is:
[664]	valid_0's rmse: 0.483786	valid_0's l2: 0.234049
[32m[I 2026-08-02 15:56:48,780][0m Trial 47 finished with value: 0.5182830674301375 and parameters: {'boosting_type': 'gbdt', 'max_depth': 12, 'num_leaves': 53, 'learning_rate': 0.01786644761277013, 'n_estimators': 2838, 'subsample': 0.5050269761741197, 'subsample_freq': 1, 'colsample_bytree': 0.9309500128838815, 'reg_alpha': 4.571650048155485e-06, 'reg_lambda': 5.703001908746438e-08, 'min_child_samples': 11, 'min_child_weight': 0.004882824458548968, 'min_split_gain': 0.6280163896539241, 'cat_smooth': 45.555287890673924, 'cat_l2': 21.127321278032824}. Best is trial 16 with value: 0.48181047134764343.[0m
Training until validation scores don't improve for 30 rounds
Early stopping, best iteration is:
[1184]	valid_0's rmse: 0.486493	valid_0's l2: 0.236675
Training until validation scores don't improve for 30 rounds
Early stopping, best iteration is:
[1125]	valid_0's rmse: 0.53814	valid_0's l2: 0.289595
Training until validation scores don't improve for 30 rounds
Early stopping, best iteration is:
[1594]	valid_0's rmse: 0.532091	valid_0's l2: 0.283121
Training until validation scores don't improve for 30 rounds
Early stopping, best iteration is:
[979]	valid_0's rmse: 0.543577	valid_0's l2: 0.295476
Training until validation scores don't improve for 30 rounds
Early stopping, best iteration is:
[1041]	valid_0's rmse: 0.487235	valid_0's l2: 0.237398
[32m[I 2026-08-02 15:56:53,890][0m Trial 48 finished with value: 0.5175211049509676 and parameters: {'boosting_type': 'gbdt', 'max_depth': 8, 'num_leaves': 35, 'learning_rate': 0.009466083053345424, 'n_estimators': 1894, 'subsample': 0.8474844089163691, 'subsample_freq': 5, 'colsample_bytree': 0.5359888229485967, 'reg_alpha': 3.192002813285644e-08, 'reg_lambda': 0.0057464070361530565, 'min_child_samples': 34, 'min_child_weight': 0.007452664517871029, 'min_split_gain': 0.13380229119309817, 'cat_smooth': 7.933774213616773, 'cat_l2': 15.299803437598722}. Best is trial 16 with value: 0.48181047134764343.[0m
Training until validation scores don't improve for 30 rounds
Early stopping, best iteration is:
[49]	valid_0's rmse: 0.47191	valid_0's l2: 0.222699
Training until validation scores don't improve for 30 rounds
Early stopping, best iteration is:
[77]	valid_0's rmse: 0.544076	valid_0's l2: 0.296018
Training until validation scores don't improve for 30 rounds
Early stopping, best iteration is:
[68]	valid_0's rmse: 0.524304	valid_0's l2: 0.274894
Training until validation scores don't improve for 30 rounds
Early stopping, best iteration is:
[24]	valid_0's rmse: 0.523659	valid_0's l2: 0.274219
Training until validation scores don't improve for 30 rounds
Early stopping, best iteration is:
[57]	valid_0's rmse: 0.471978	valid_0's l2: 0.222763
[32m[I 2026-08-02 15:56:55,135][0m Trial 49 finished with value: 0.5071852740682177 and parameters: {'boosting_type': 'gbdt', 'max_depth': 10, 'num_leaves': 117, 'learning_rate': 0.1372563629276816, 'n_estimators': 2109, 'subsample': 0.827014224000593, 'subsample_freq': 7, 'colsample_bytree': 0.6260291068577709, 'reg_alpha': 1.0019649166576247e-08, 'reg_lambda': 0.02397814135776312, 'min_child_samples': 5, 'min_child_weight': 0.0330642657391296, 'min_split_gain': 0.0005470465598013795, 'cat_smooth': 20.16252940491361, 'cat_l2': 39.912351001646755}. Best is trial 16 with value: 0.48181047134764343.[0m

=== Best Trial ===
  CV RMSE: 0.481810
  Params:  {'boosting_type': 'gbdt', 'max_depth': 10, 'num_leaves': 31, 'learning_rate': 0.03839452164203378, 'n_estimators': 1972, 'subsample': 0.8199212859905153, 'subsample_freq': 1, 'colsample_bytree': 0.9869191607308052, 'reg_alpha': 1.2710603265392387e-08, 'reg_lambda': 5.9518082534861874e-05, 'min_child_samples': 13, 'min_child_weight': 0.01852224764070393, 'min_split_gain': 0.05372119777160883, 'cat_smooth': 21.49872794581777, 'cat_l2': 1.735176073565559}

============================================================
Training Final Model with Best Hyperparameters
============================================================
Training until validation scores don't improve for 50 rounds
[50]	valid_0's rmse: 0.581475	valid_0's l2: 0.338113
[100]	valid_0's rmse: 0.516454	valid_0's l2: 0.266724
[150]	valid_0's rmse: 0.507618	valid_0's l2: 0.257676
[200]	valid_0's rmse: 0.507757	valid_0's l2: 0.257817
Early stopping, best iteration is:
[190]	valid_0's rmse: 0.507176	valid_0's l2: 0.257227

============================================================
Test Evaluation
============================================================
  Test MSE:  0.1859
  Test RMSE: 0.4311
  Test MAE:  0.2862
  Test R²:   0.8495

============================================================
Top 20 Feature Importances
============================================================
   1. tail_ratio                 339.0
   2. LogP                       313.0
   3. MolWt                      262.0
   4. head_ratio                 184.0
   5. HeavyAtoms                 140.0
   6. atom_std_54                137.0
   7. atom_std_35                133.0
   8. atom_mean_35               122.0
   9. RotBonds                   115.0
  10. TPSA                       103.0
  11. atom_mean_23               102.0
  12. atom_std_25                101.0
  13. atom_mean_17               100.0
  14. atom_mean_47               99.0
  15. atom_mean_54               97.0
  16. atom_mean_25               93.0
  17. atom_mean_19               92.0
  18. atom_std_47                80.0
  19. atom_mean_39               79.0
  20. atom_std_18                78.0

Plot saved to runs\pCMC\pCMC_lightgbm_20260802_155314\pred_vs_true.png
Model saved to runs\pCMC\pCMC_lightgbm_20260802_155314\model.pkl

============================================================
SUMMARY — LightGBM + PharmHGT Features
============================================================
  Features:  522-dim (atom_agg + bond_agg + MACCS + BRICS + surfactant + descriptors)
  Train:     1053 (val 151)
  Test:      140
  Optuna:    50 trials, 5-fold CV
  Best CV RMSE: 0.4818
  Test RMSE: 0.4311
  Test MAE:  0.2862
  Test R²:   0.8495

指标已保存: runs\pCMC\pCMC_lightgbm_20260802_155314\metrics.json
索引已更新: runs\pCMC\_runs_index.csv
索引已更新: runs\_runs_index.csv
