[32m[I 2026-08-05 16:06:02,167][0m Trial 166 finished with value: 4.200844379330967 and parameters: {'n_estimators': 1341, 'max_depth': 9, 'learning_rate': 0.013424408366787152, 'subsample': 0.6922813463365022, 'colsample_bytree': 0.9249594711479651, 'colsample_bylevel': 0.684978943381801, 'colsample_bynode': 0.5015470381064772, 'min_child_weight': 1.3743525616885817, 'gamma': 0.6419786718619281, 'reg_alpha': 0.01784898213302725, 'reg_lambda': 1.9750478693737459, 'max_delta_step': 2.1179689339894763, 'booster': 'dart'}. Best is trial 138 with value: 4.15064292025359.[0m
[32m[I 2026-08-05 16:06:37,344][0m Trial 167 pruned. [0m
[32m[I 2026-08-05 16:06:47,385][0m Trial 168 finished with value: 4.2096178979015 and parameters: {'n_estimators': 1294, 'max_depth': 10, 'learning_rate': 0.03717040712644563, 'subsample': 0.6194494326875779, 'colsample_bytree': 0.460760174420527, 'colsample_bylevel': 0.7415562690065376, 'colsample_bynode': 0.8287154506692226, 'min_child_weight': 1.8229598800323095, 'gamma': 0.2876175710987322, 'reg_alpha': 0.022891355080847036, 'reg_lambda': 0.04737390142778246, 'max_delta_step': 3.562657717538114, 'booster': 'dart'}. Best is trial 138 with value: 4.15064292025359.[0m
[32m[I 2026-08-05 16:07:06,721][0m Trial 169 finished with value: 4.211832918816006 and parameters: {'n_estimators': 837, 'max_depth': 9, 'learning_rate': 0.02480000922875413, 'subsample': 0.797732235190498, 'colsample_bytree': 0.7582125527564342, 'colsample_bylevel': 0.8227839497525599, 'colsample_bynode': 0.6974578978847642, 'min_child_weight': 1.2731677818466651, 'gamma': 0.21342314916903346, 'reg_alpha': 7.357242539934964e-06, 'reg_lambda': 8.72870181151943, 'max_delta_step': 2.6242102505516978, 'booster': 'gbtree'}. Best is trial 138 with value: 4.15064292025359.[0m
[32m[I 2026-08-05 16:07:16,137][0m Trial 170 pruned. [0m
[32m[I 2026-08-05 16:07:25,050][0m Trial 171 pruned. [0m
[32m[I 2026-08-05 16:07:46,278][0m Trial 172 pruned. [0m
[32m[I 2026-08-05 16:08:04,048][0m Trial 173 finished with value: 4.131578271280344 and parameters: {'n_estimators': 1807, 'max_depth': 10, 'learning_rate': 0.030505631526338013, 'subsample': 0.6512204252982893, 'colsample_bytree': 0.9343413038101472, 'colsample_bylevel': 0.7815491891254127, 'colsample_bynode': 0.8012707226374989, 'min_child_weight': 3.497412105020527, 'gamma': 0.13821805586519675, 'reg_alpha': 1.1498303713267268e-07, 'reg_lambda': 0.8036056631444111, 'max_delta_step': 3.5148425261439122, 'booster': 'dart'}. Best is trial 173 with value: 4.131578271280344.[0m
[32m[I 2026-08-05 16:08:14,798][0m Trial 174 finished with value: 4.220852021324415 and parameters: {'n_estimators': 877, 'max_depth': 10, 'learning_rate': 0.02880806438426836, 'subsample': 0.723213195127505, 'colsample_bytree': 0.6369686750147633, 'colsample_bylevel': 0.6896743802955425, 'colsample_bynode': 0.6629654145621361, 'min_child_weight': 7.389881485500808, 'gamma': 0.5325789392496172, 'reg_alpha': 1.6318644120969868e-07, 'reg_lambda': 3.7099001567211637e-07, 'max_delta_step': 3.169347916184936, 'booster': 'dart'}. Best is trial 173 with value: 4.131578271280344.[0m
[32m[I 2026-08-05 16:08:25,256][0m Trial 175 finished with value: 4.271456097801267 and parameters: {'n_estimators': 1495, 'max_depth': 12, 'learning_rate': 0.05262016461743828, 'subsample': 0.7143771598986972, 'colsample_bytree': 0.8983684341551719, 'colsample_bylevel': 0.5798947776115074, 'colsample_bynode': 0.7028547175865528, 'min_child_weight': 9.21112156471393, 'gamma': 0.791710441090504, 'reg_alpha': 1.9731603645418523e-06, 'reg_lambda': 7.738151214614404e-06, 'max_delta_step': 1.4573580776075075, 'booster': 'dart'}. Best is trial 173 with value: 4.131578271280344.[0m
[32m[I 2026-08-05 16:08:34,497][0m Trial 176 pruned. [0m
[32m[I 2026-08-05 16:08:46,521][0m Trial 177 pruned. [0m
[32m[I 2026-08-05 16:08:50,352][0m Trial 178 pruned. [0m
[32m[I 2026-08-05 16:08:59,047][0m Trial 179 pruned. [0m
[32m[I 2026-08-05 16:09:22,400][0m Trial 180 finished with value: 4.168355479800583 and parameters: {'n_estimators': 889, 'max_depth': 10, 'learning_rate': 0.014051187404785254, 'subsample': 0.7789884974710535, 'colsample_bytree': 0.6528736410843723, 'colsample_bylevel': 0.8636850455433682, 'colsample_bynode': 0.8289818780383137, 'min_child_weight': 1.1278566122551636, 'gamma': 0.5923614190807218, 'reg_alpha': 0.00044336487596029135, 'reg_lambda': 1.108264643352326, 'max_delta_step': 2.8232272770912537, 'booster': 'dart'}. Best is trial 173 with value: 4.131578271280344.[0m
[32m[I 2026-08-05 16:09:29,475][0m Trial 181 pruned. [0m
[32m[I 2026-08-05 16:09:54,526][0m Trial 182 finished with value: 4.17880414696513 and parameters: {'n_estimators': 854, 'max_depth': 11, 'learning_rate': 0.015548892041740793, 'subsample': 0.7290095834739807, 'colsample_bytree': 0.5373697803592622, 'colsample_bylevel': 0.8927019754562416, 'colsample_bynode': 0.9395203141202052, 'min_child_weight': 1.7593240053801162, 'gamma': 0.36140976763020716, 'reg_alpha': 1.5140792370618621e-05, 'reg_lambda': 0.13628224534307112, 'max_delta_step': 2.6671826450992757, 'booster': 'dart'}. Best is trial 173 with value: 4.131578271280344.[0m
[32m[I 2026-08-05 16:10:03,395][0m Trial 183 pruned. [0m
[32m[I 2026-08-05 16:10:47,104][0m Trial 184 finished with value: 4.156879710752898 and parameters: {'n_estimators': 1993, 'max_depth': 10, 'learning_rate': 0.011200253288442957, 'subsample': 0.6924534439204101, 'colsample_bytree': 0.8599120481290373, 'colsample_bylevel': 0.6734343241863961, 'colsample_bynode': 0.819590493241824, 'min_child_weight': 2.167353982337214, 'gamma': 0.28600046277076563, 'reg_alpha': 0.0037209171487994986, 'reg_lambda': 4.0562326301214234e-05, 'max_delta_step': 1.5239268142950912, 'booster': 'dart'}. Best is trial 173 with value: 4.131578271280344.[0m
[32m[I 2026-08-05 16:11:30,498][0m Trial 185 finished with value: 4.1837167104583 and parameters: {'n_estimators': 2245, 'max_depth': 10, 'learning_rate': 0.011222211030435105, 'subsample': 0.666217422805246, 'colsample_bytree': 0.9189593310506139, 'colsample_bylevel': 0.7158701716619051, 'colsample_bynode': 0.8542434388309662, 'min_child_weight': 2.22299713147909, 'gamma': 0.6398063469018069, 'reg_alpha': 0.0007948652414958697, 'reg_lambda': 5.37819145173639e-07, 'max_delta_step': 1.7052010661020214, 'booster': 'dart'}. Best is trial 173 with value: 4.131578271280344.[0m
[32m[I 2026-08-05 16:11:47,967][0m Trial 186 finished with value: 4.15682408101639 and parameters: {'n_estimators': 2194, 'max_depth': 9, 'learning_rate': 0.03159720664573929, 'subsample': 0.6040670103841819, 'colsample_bytree': 0.9072397630881425, 'colsample_bylevel': 0.6032650548479184, 'colsample_bynode': 0.8202332139910677, 'min_child_weight': 3.297872181714556, 'gamma': 0.20098107315294905, 'reg_alpha': 1.1606410785201304e-06, 'reg_lambda': 3.204268943978123, 'max_delta_step': 2.017988722769272, 'booster': 'dart'}. Best is trial 173 with value: 4.131578271280344.[0m
[32m[I 2026-08-05 16:12:04,554][0m Trial 187 finished with value: 4.173928954695642 and parameters: {'n_estimators': 2155, 'max_depth': 9, 'learning_rate': 0.027398192551801318, 'subsample': 0.6034987871142337, 'colsample_bytree': 0.779131168178031, 'colsample_bylevel': 0.44043226628044374, 'colsample_bynode': 0.9392102021715488, 'min_child_weight': 2.3216623084269328, 'gamma': 0.3641783373590761, 'reg_alpha': 8.688836545785267e-06, 'reg_lambda': 3.2674164619394412, 'max_delta_step': 2.0340836271001272, 'booster': 'dart'}. Best is trial 173 with value: 4.131578271280344.[0m
[32m[I 2026-08-05 16:12:13,930][0m Trial 188 finished with value: 4.260082438739241 and parameters: {'n_estimators': 1887, 'max_depth': 10, 'learning_rate': 0.054574803914995876, 'subsample': 0.6159469230823991, 'colsample_bytree': 0.6109962051813167, 'colsample_bylevel': 0.3142707282332052, 'colsample_bynode': 0.847070948099067, 'min_child_weight': 2.154311031975859, 'gamma': 0.45516841989593637, 'reg_alpha': 8.906501113126504e-07, 'reg_lambda': 6.693464048126922, 'max_delta_step': 1.9785133123311065, 'booster': 'dart'}. Best is trial 173 with value: 4.131578271280344.[0m
[32m[I 2026-08-05 16:12:29,298][0m Trial 189 finished with value: 4.215872410246403 and parameters: {'n_estimators': 2373, 'max_depth': 7, 'learning_rate': 0.022798635960174327, 'subsample': 0.7106683246606691, 'colsample_bytree': 0.8250469857721819, 'colsample_bylevel': 0.6006163316944442, 'colsample_bynode': 0.7132143424653284, 'min_child_weight': 2.018073916071987, 'gamma': 0.28871103359477335, 'reg_alpha': 7.102874438853037e-06, 'reg_lambda': 2.3884076680454394, 'max_delta_step': 2.410403271850034, 'booster': 'dart'}. Best is trial 173 with value: 4.131578271280344.[0m
[32m[I 2026-08-05 16:12:50,519][0m Trial 190 finished with value: 4.1887460976187745 and parameters: {'n_estimators': 2081, 'max_depth': 11, 'learning_rate': 0.0234733391556908, 'subsample': 0.6365081509079217, 'colsample_bytree': 0.7166204988332339, 'colsample_bylevel': 0.8520272819376206, 'colsample_bynode': 0.7783301624936522, 'min_child_weight': 2.111063209133001, 'gamma': 0.21607954111275737, 'reg_alpha': 4.5878096937736843e-07, 'reg_lambda': 3.5878173887061355, 'max_delta_step': 4.7881186761169925, 'booster': 'gbtree'}. Best is trial 173 with value: 4.131578271280344.[0m
[32m[I 2026-08-05 16:13:27,161][0m Trial 191 finished with value: 4.186369727719876 and parameters: {'n_estimators': 1896, 'max_depth': 10, 'learning_rate': 0.014102758755446122, 'subsample': 0.7795484121409296, 'colsample_bytree': 0.9548838047775785, 'colsample_bylevel': 0.6636234794637832, 'colsample_bynode': 0.7766619533351767, 'min_child_weight': 1.9909219361425257, 'gamma': 0.2185868144181274, 'reg_alpha': 0.28248218473862236, 'reg_lambda': 8.961259969639504e-06, 'max_delta_step': 1.9201761514709974, 'booster': 'dart'}. Best is trial 173 with value: 4.131578271280344.[0m
[32m[I 2026-08-05 16:13:36,004][0m Trial 192 pruned. [0m
[32m[I 2026-08-05 16:13:55,229][0m Trial 193 finished with value: 4.175642018751521 and parameters: {'n_estimators': 2613, 'max_depth': 9, 'learning_rate': 0.012998913192221996, 'subsample': 0.8563027215196186, 'colsample_bytree': 0.7426316988542233, 'colsample_bylevel': 0.5449218810942731, 'colsample_bynode': 0.6802382852317703, 'min_child_weight': 4.443662525736793, 'gamma': 0.9810362958894479, 'reg_alpha': 1.318017464395634e-07, 'reg_lambda': 0.003492470528530959, 'max_delta_step': 2.685144270629833, 'booster': 'dart'}. Best is trial 173 with value: 4.131578271280344.[0m
[32m[I 2026-08-05 16:14:39,066][0m Trial 194 finished with value: 4.196474756591003 and parameters: {'n_estimators': 1468, 'max_depth': 12, 'learning_rate': 0.012654741445445148, 'subsample': 0.8277480440536458, 'colsample_bytree': 0.6680129807548258, 'colsample_bylevel': 0.9389340586267587, 'colsample_bynode': 0.7032494529306319, 'min_child_weight': 1.870260238757569, 'gamma': 0.6913054908000928, 'reg_alpha': 0.0002840206157537428, 'reg_lambda': 0.0908235728774202, 'max_delta_step': 1.292292158680887, 'booster': 'dart'}. Best is trial 173 with value: 4.131578271280344.[0m
[32m[I 2026-08-05 16:15:12,098][0m Trial 195 finished with value: 4.163462212878003 and parameters: {'n_estimators': 1323, 'max_depth': 11, 'learning_rate': 0.01061052748089725, 'subsample': 0.6096654859642736, 'colsample_bytree': 0.774362919206575, 'colsample_bylevel': 0.8304837329607412, 'colsample_bynode': 0.7736507076780228, 'min_child_weight': 1.5975671579815782, 'gamma': 0.588231250728813, 'reg_alpha': 1.8258533157273422e-07, 'reg_lambda': 0.0005431935758741545, 'max_delta_step': 4.034373831193555, 'booster': 'gbtree'}. Best is trial 173 with value: 4.131578271280344.[0m
[32m[I 2026-08-05 16:15:33,199][0m Trial 196 finished with value: 4.227178256374556 and parameters: {'n_estimators': 1873, 'max_depth': 8, 'learning_rate': 0.01571591269725672, 'subsample': 0.6272469329130383, 'colsample_bytree': 0.7649913961171322, 'colsample_bylevel': 0.35117881795057665, 'colsample_bynode': 0.938208632339045, 'min_child_weight': 5.472190767677249, 'gamma': 0.5783529294619176, 'reg_alpha': 2.3187017267006134e-05, 'reg_lambda': 5.835137207925073, 'max_delta_step': 4.017871132816229, 'booster': 'dart'}. Best is trial 173 with value: 4.131578271280344.[0m
[32m[I 2026-08-05 16:16:02,233][0m Trial 197 finished with value: 4.183161989824212 and parameters: {'n_estimators': 1737, 'max_depth': 10, 'learning_rate': 0.010935148343572483, 'subsample': 0.6308840515015484, 'colsample_bytree': 0.8226558982781565, 'colsample_bylevel': 0.4102798811001318, 'colsample_bynode': 0.9555463825978451, 'min_child_weight': 5.922034089028637, 'gamma': 0.35251940772893425, 'reg_alpha': 3.56182313364882e-05, 'reg_lambda': 0.00026965570133872233, 'max_delta_step': 1.9915567532191214, 'booster': 'dart'}. Best is trial 173 with value: 4.131578271280344.[0m
[32m[I 2026-08-05 16:16:32,525][0m Trial 198 finished with value: 4.247919311771758 and parameters: {'n_estimators': 2597, 'max_depth': 8, 'learning_rate': 0.014524716658000095, 'subsample': 0.781077516134009, 'colsample_bytree': 0.7345548009148142, 'colsample_bylevel': 0.3809446066598911, 'colsample_bynode': 0.6664050017217801, 'min_child_weight': 5.280625040374593, 'gamma': 0.8617457034032827, 'reg_alpha': 4.541931830974378e-08, 'reg_lambda': 0.004078939115564981, 'max_delta_step': 0.7503090375283468, 'booster': 'dart'}. Best is trial 173 with value: 4.131578271280344.[0m
[32m[I 2026-08-05 16:17:04,365][0m Trial 199 finished with value: 4.2220051754950365 and parameters: {'n_estimators': 1905, 'max_depth': 11, 'learning_rate': 0.017393223563935783, 'subsample': 0.6052999110807031, 'colsample_bytree': 0.8279091589304186, 'colsample_bylevel': 0.6166173522629782, 'colsample_bynode': 0.8487622101592291, 'min_child_weight': 6.141515499575601, 'gamma': 0.08085302019448716, 'reg_alpha': 2.3208367985939497e-07, 'reg_lambda': 1.810453783657071, 'max_delta_step': 2.2364885074313934, 'booster': 'dart'}. Best is trial 173 with value: 4.131578271280344.[0m

------------------------------------------------------------
All Trial CV Results:
Trial  Mean RMSE  Std RMSE  CV Scores
------------------------------------------------------------
    0     4.4980
    1     4.2750
    2     4.5237
    3     4.2867
    4     4.3156
    5     4.2674
    6     4.4076
    7     5.4527
    8     4.2808
    9     4.2122
   10     4.1924
   11     4.2416
   12     4.1842
   13     4.2556
   14     4.3049
   15     4.1927
   16     4.3644
   17     4.2234
   18     4.3255
   19     4.2485
   20     4.1897
   21     4.2522
   22     4.2112
   23     4.2935
   24     4.2316
   25     4.1557
   26     4.2385
   27     4.1976
   28     4.4025
   29     4.1496
   30     4.1722
   31     4.1896
   32     4.3361
   33     4.1319
   34     4.2643
   35     4.2933
   36     4.3003
   37     4.2125
   38     4.2083
   39     4.3145
   40     4.2978
   41     4.2826
   42     4.2118
   43     4.3522
   44     4.2146
   45     4.2797
   46     4.2306
   47     4.2962
   48     4.2529
   49     4.2597
   50     4.2163
   51     4.3427
   52     4.1918
   53     4.1903
   54     4.2350
   55     4.2936
   56     4.1931
   57     4.1922
   58     4.2467
   59     4.2149
   60     4.2165
   61     4.2234
   62     4.2242
   63     4.2180
   64     4.2242
   65     4.3306
   66     4.3023
   67     4.1394
   68     4.2229
   69     4.2229
   70     4.1949
   71     4.1473
   72     4.2332
   73     4.1932
   74     4.3452
   75     4.1980
   76     4.1727
   77     4.2574
   78     4.2103
   79     4.2983
   80     4.2251
   81     4.2313
   82     4.1781
   83     4.2376
   84     4.2272
   85     4.2134
   86     4.2196
   87     4.2401
   88     4.2185
   89     4.2597
   90     4.2067
   91     4.2203
   92     4.4033
   93     4.2537
   94     4.2466
   95     4.2484
   96     4.3616
   97     4.2304
   98     4.2270
   99     4.1611
  100     4.2454
  101     4.1905
  102     4.1350
  103     4.2025
  104     4.1833
  105     4.1865
  106     4.1717
  107     4.1837
  108     4.2054
  109     4.2243
  110     4.1826
  111     4.2067
  112     4.1759
  113     4.1815
  114     4.2047
  115     4.2053
  116     4.2035
  117     4.2588
  118     4.2143
  119     4.1717
  120     4.1768
  121     4.2133
  122     4.1797
  123     4.1823
  124     4.2103
  125     4.1853
  126     4.1980
  127     4.1972
  128     4.1731
  129     4.1727
  130     4.1909
  131     4.2190
  132     4.1921
  133     4.1677
  134     4.1116
  135     4.1987
  136     4.2132
  137     4.2050
  138     4.1506
  139     6.8748
  140     4.2232
  141     4.1717
  142     4.1513
  143     4.1971
  144     4.2201
  145     4.1808
  146     6.4055
  147     4.3610
  148     4.1980
  149     4.2062
  150     4.1780
  151     4.1983
  152     4.3063
  153     4.1930
  154     4.1640
  155     4.3467
  156     4.1801
  157     4.2598
  158     4.1552
  159     4.1642
  160     4.2142
  161     4.1909
  162     4.2082
  163     4.1985
  164     4.1890
  165     4.2335
  166     4.2008
  167     4.2021
  168     4.2096
  169     4.2118
  170     4.1022
  171     4.1543
  172     4.1163
  173     4.1316
  174     4.2209
  175     4.2715
  176     4.1404
  177     4.1218
  178     4.2200
  179     4.2087
  180     4.1684
  181     4.1897
  182     4.1788
  183     4.1545
  184     4.1569
  185     4.1837
  186     4.1568
  187     4.1739
  188     4.2601
  189     4.2159
  190     4.1887
  191     4.1864
  192     4.0933
  193     4.1756
  194     4.1965
  195     4.1635
  196     4.2272
  197     4.1832
  198     4.2479
  199     4.2220
------------------------------------------------------------

=== Best Trial ===
  CV RMSE: 4.131578
  Params:  {'n_estimators': 1807, 'max_depth': 10, 'learning_rate': 0.030505631526338013, 'subsample': 0.6512204252982893, 'colsample_bytree': 0.9343413038101472, 'colsample_bylevel': 0.7815491891254127, 'colsample_bynode': 0.8012707226374989, 'min_child_weight': 3.497412105020527, 'gamma': 0.13821805586519675, 'reg_alpha': 1.1498303713267268e-07, 'reg_lambda': 0.8036056631444111, 'max_delta_step': 3.5148425261439122, 'booster': 'dart'}

Parameter Importance:
  min_child_weight: 0.4253
  colsample_bytree: 0.3547
  max_delta_step: 0.0942
  max_depth: 0.0687
  learning_rate: 0.0199
  subsample: 0.0117
  colsample_bylevel: 0.0111
  gamma: 0.0066
  colsample_bynode: 0.0035
  booster: 0.0030
  n_estimators: 0.0010
  reg_lambda: 0.0002
  reg_alpha: 0.0001

============================================================
Top-5 Holdout Validation — selecting most generalizable params
============================================================
 Rank    CV RMSE   Holdout RMSE   Holdout R²
------------------------------------------------------------
    1     4.0933         4.3671       0.6391
    2     4.1022         4.2491       0.6583
    3     4.1116         4.3321       0.6448
    4     4.1163         4.3793       0.6370
    5     4.1218         4.1431       0.6751

  → Selected params (holdout RMSE=4.1431):
    n_estimators: 1313
    max_depth: 9
    learning_rate: 0.011765015335479906
    subsample: 0.7431271560357264
    colsample_bytree: 0.8163779373260582
    colsample_bylevel: 0.7758685088750483
    colsample_bynode: 0.8547018246901196
    min_child_weight: 2.211251199148393
    gamma: 0.0933525687494875
    reg_alpha: 3.326511897896488e-08
    reg_lambda: 0.046749924734893575
    max_delta_step: 4.379696478612437
    booster: gbtree

============================================================
Training Final Model with Best Hyperparameters (X_cv: 758 samples)
============================================================

============================================================
Test Evaluation
============================================================
  Test MSE:  16.1116
  Test RMSE: 4.0139
  Test MAE:  3.0172
  Test R虏:   0.6852

============================================================
Top 20 Feature Importances
============================================================
   1. surf_cationic              0.1
   2. maccs_125                  0.1
   3. bond_mean_12               0.1
   4. bond_mean_3                0.0
   5. AroRings                   0.0
   6. bond_std_3                 0.0
   7. NumRings                   0.0
   8. maccs_65                   0.0
   9. maccs_166                  0.0
  10. atom_std_44                0.0
  11. maccs_107                  0.0
  12. bond_std_12                0.0
  13. maccs_100                  0.0
  14. atom_std_6                 0.0
  15. maccs_28                   0.0
  16. atom_mean_44               0.0
  17. atom_min_22                0.0
  18. atom_max_8                 0.0
  19. maccs_30                   0.0
  20. atom_std_33                0.0

Plot saved to runs\AW_ST_CMC\AW_ST_CMC_xgboost_20260805_152638\pred_vs_true.png
Model saved to runs\AW_ST_CMC\AW_ST_CMC_xgboost_20260805_152638\model.pkl

============================================================
SUMMARY - XGBoost + PharmHGT Features
============================================================
  Features:  522-dim (atom_agg + bond_agg + MACCS + BRICS + surfactant + descriptors)
  Train:     758 (holdout 85)
  Test:      70
  Optuna:    200 trials, 5-fold CV, multivariate TPE, gap penalty
  Top-K:     5 candidates re-evaluated on holdout (85 samples)
  Best CV RMSE: 4.1316
  Holdout RMSE: 4.1431
  Test RMSE: 4.0139
  Test MAE:  3.0172
  Test R²:   0.6852

指标已保存: runs\AW_ST_CMC\AW_ST_CMC_xgboost_20260805_152638\metrics.json
索引已更新: runs\AW_ST_CMC\_runs_index.csv
索引已更新: runs\_runs_index.csv
