[32m[I 2026-08-05 15:49:32,164][0m Trial 119 finished with value: 4.1717266024541955 and parameters: {'n_estimators': 1678, 'max_depth': 12, 'learning_rate': 0.02127400670999285, 'subsample': 0.6647059921801999, 'colsample_bytree': 0.9779361310922097, 'colsample_bylevel': 0.6120592432647124, 'colsample_bynode': 0.7637168790433259, 'min_child_weight': 3.4054867143930885, 'gamma': 0.535855943031692, 'reg_alpha': 3.5613294971804423e-07, 'reg_lambda': 5.364495056480015e-06, 'max_delta_step': 2.7343646603476275, 'booster': 'dart'}. Best is trial 99 with value: 4.161096256768273.[0m
[32m[I 2026-08-05 15:50:03,429][0m Trial 120 finished with value: 4.176810082353633 and parameters: {'n_estimators': 2123, 'max_depth': 9, 'learning_rate': 0.015574190703044364, 'subsample': 0.6055220019293411, 'colsample_bytree': 0.9368677291258152, 'colsample_bylevel': 0.5532083961313492, 'colsample_bynode': 0.876098742083903, 'min_child_weight': 3.846192229409505, 'gamma': 0.33941256514799556, 'reg_alpha': 2.579953044896594e-05, 'reg_lambda': 0.00023952810827976997, 'max_delta_step': 1.489239549634924, 'booster': 'dart'}. Best is trial 99 with value: 4.161096256768273.[0m
[32m[I 2026-08-05 15:50:20,517][0m Trial 121 finished with value: 4.213293131557944 and parameters: {'n_estimators': 2199, 'max_depth': 8, 'learning_rate': 0.024261457001585735, 'subsample': 0.6237079883777302, 'colsample_bytree': 0.9897604167501873, 'colsample_bylevel': 0.3084484430535188, 'colsample_bynode': 0.8386057291690721, 'min_child_weight': 1.559860984651318, 'gamma': 0.22233970681397602, 'reg_alpha': 0.0016630883601717666, 'reg_lambda': 0.00027365989314629893, 'max_delta_step': 1.4530559220784385, 'booster': 'dart'}. Best is trial 99 with value: 4.161096256768273.[0m
[32m[I 2026-08-05 15:50:43,010][0m Trial 122 finished with value: 4.179745752932494 and parameters: {'n_estimators': 1417, 'max_depth': 10, 'learning_rate': 0.01644392720680341, 'subsample': 0.6927709252200693, 'colsample_bytree': 0.9993057880306593, 'colsample_bylevel': 0.7347475877842413, 'colsample_bynode': 0.6582803261034018, 'min_child_weight': 2.6922696791554914, 'gamma': 0.26161617840019724, 'reg_alpha': 1.7531178750395316e-08, 'reg_lambda': 0.0007916701632187805, 'max_delta_step': 3.588072910746185, 'booster': 'dart'}. Best is trial 99 with value: 4.161096256768273.[0m
[32m[I 2026-08-05 15:51:01,322][0m Trial 123 finished with value: 4.182272710855338 and parameters: {'n_estimators': 979, 'max_depth': 10, 'learning_rate': 0.02794160719225017, 'subsample': 0.6441254357501991, 'colsample_bytree': 0.8527066520662734, 'colsample_bylevel': 0.6211030831430245, 'colsample_bynode': 0.7911765557958219, 'min_child_weight': 1.5727562911084343, 'gamma': 0.11649675067123799, 'reg_alpha': 1.4271718276842608e-07, 'reg_lambda': 1.5656831869517043e-06, 'max_delta_step': 1.947023411178779, 'booster': 'dart'}. Best is trial 99 with value: 4.161096256768273.[0m
[32m[I 2026-08-05 15:51:24,752][0m Trial 124 finished with value: 4.210327790738468 and parameters: {'n_estimators': 1012, 'max_depth': 12, 'learning_rate': 0.0310937017639779, 'subsample': 0.6046517751296269, 'colsample_bytree': 0.7659579947373779, 'colsample_bylevel': 0.46602435888888494, 'colsample_bynode': 0.7099643888033177, 'min_child_weight': 1.5559203049982842, 'gamma': 0.3779407770704665, 'reg_alpha': 3.2439987153543506e-08, 'reg_lambda': 2.0262283611168408e-05, 'max_delta_step': 1.0495708005256446, 'booster': 'dart'}. Best is trial 99 with value: 4.161096256768273.[0m
[32m[I 2026-08-05 15:51:34,494][0m Trial 125 pruned. [0m
[32m[I 2026-08-05 15:51:52,128][0m Trial 126 finished with value: 4.198008341300204 and parameters: {'n_estimators': 1544, 'max_depth': 10, 'learning_rate': 0.0183373417902857, 'subsample': 0.6858176982489814, 'colsample_bytree': 0.948904734544421, 'colsample_bylevel': 0.4979063328835041, 'colsample_bynode': 0.4927297828942184, 'min_child_weight': 2.1325006153127597, 'gamma': 0.12801773727850832, 'reg_alpha': 1.3898271897083592e-07, 'reg_lambda': 0.00011336568335354169, 'max_delta_step': 3.284336684427318, 'booster': 'dart'}. Best is trial 99 with value: 4.161096256768273.[0m
[32m[I 2026-08-05 15:52:00,879][0m Trial 127 pruned. [0m
[32m[I 2026-08-05 15:52:08,993][0m Trial 128 pruned. [0m
[32m[I 2026-08-05 15:52:43,063][0m Trial 129 finished with value: 4.172668163993406 and parameters: {'n_estimators': 2035, 'max_depth': 10, 'learning_rate': 0.013087491990916933, 'subsample': 0.6606049685739989, 'colsample_bytree': 0.7781529087520992, 'colsample_bylevel': 0.6736601383743388, 'colsample_bynode': 0.8219673337002095, 'min_child_weight': 2.89662774406367, 'gamma': 0.09649983254076802, 'reg_alpha': 1.8369299824914134e-07, 'reg_lambda': 4.906963633068234e-06, 'max_delta_step': 1.9815478620444005, 'booster': 'gbtree'}. Best is trial 99 with value: 4.161096256768273.[0m
[32m[I 2026-08-05 15:53:17,266][0m Trial 130 finished with value: 4.190908220748272 and parameters: {'n_estimators': 2148, 'max_depth': 10, 'learning_rate': 0.010590905369541107, 'subsample': 0.6615742836753685, 'colsample_bytree': 0.9936635389388291, 'colsample_bylevel': 0.5475699610143576, 'colsample_bynode': 0.8304591677170651, 'min_child_weight': 7.020056896093886, 'gamma': 0.24696043483622723, 'reg_alpha': 6.320887463077495e-07, 'reg_lambda': 0.000268416951353385, 'max_delta_step': 3.1398213901990193, 'booster': 'gbtree'}. Best is trial 99 with value: 4.161096256768273.[0m
[32m[I 2026-08-05 15:53:51,276][0m Trial 131 finished with value: 4.2189960875280095 and parameters: {'n_estimators': 2199, 'max_depth': 11, 'learning_rate': 0.015161773551856498, 'subsample': 0.6754673032022182, 'colsample_bytree': 0.5796360560497635, 'colsample_bylevel': 0.6956458654285755, 'colsample_bynode': 0.7095641638585378, 'min_child_weight': 7.954555936832383, 'gamma': 0.20644197288320215, 'reg_alpha': 3.6495282001679147e-06, 'reg_lambda': 9.152430251578648e-08, 'max_delta_step': 1.0766465584794433, 'booster': 'gbtree'}. Best is trial 99 with value: 4.161096256768273.[0m
[32m[I 2026-08-05 15:54:16,339][0m Trial 132 finished with value: 4.192126319550206 and parameters: {'n_estimators': 1361, 'max_depth': 10, 'learning_rate': 0.0329783748551033, 'subsample': 0.7808131966928902, 'colsample_bytree': 0.9426692737795065, 'colsample_bylevel': 0.9174189058460592, 'colsample_bynode': 0.6715999667758688, 'min_child_weight': 2.6436673722977093, 'gamma': 0.0873958189402892, 'reg_alpha': 3.1226691720323254e-08, 'reg_lambda': 4.953329705209984e-07, 'max_delta_step': 1.1177764527089948, 'booster': 'dart'}. Best is trial 99 with value: 4.161096256768273.[0m
[32m[I 2026-08-05 15:54:29,191][0m Trial 133 finished with value: 4.167688320404588 and parameters: {'n_estimators': 1121, 'max_depth': 7, 'learning_rate': 0.030224838496876377, 'subsample': 0.7032860888322541, 'colsample_bytree': 0.6938292688659907, 'colsample_bylevel': 0.6984076038805411, 'colsample_bynode': 0.8122800936915048, 'min_child_weight': 3.78818968186076, 'gamma': 0.25948904886974744, 'reg_alpha': 5.450403578671629e-07, 'reg_lambda': 1.1538297537281472e-07, 'max_delta_step': 2.15104386124429, 'booster': 'dart'}. Best is trial 99 with value: 4.161096256768273.[0m
[32m[I 2026-08-05 15:54:33,032][0m Trial 134 pruned. [0m
[32m[I 2026-08-05 15:54:45,579][0m Trial 135 pruned. [0m
[32m[I 2026-08-05 15:55:03,069][0m Trial 136 finished with value: 4.213236426779666 and parameters: {'n_estimators': 1136, 'max_depth': 7, 'learning_rate': 0.018311211881135627, 'subsample': 0.750847559322294, 'colsample_bytree': 0.6092485697775714, 'colsample_bylevel': 0.677663628700787, 'colsample_bynode': 0.9883362355451795, 'min_child_weight': 5.192833669506389, 'gamma': 0.19644545631187327, 'reg_alpha': 2.486067923534006e-05, 'reg_lambda': 1.3597524975107607e-06, 'max_delta_step': 1.549084686255998, 'booster': 'dart'}. Best is trial 99 with value: 4.161096256768273.[0m
[32m[I 2026-08-05 15:55:17,798][0m Trial 137 finished with value: 4.204962430148681 and parameters: {'n_estimators': 821, 'max_depth': 8, 'learning_rate': 0.03169778954656678, 'subsample': 0.648329567435774, 'colsample_bytree': 0.9456074308248863, 'colsample_bylevel': 0.4518521275657082, 'colsample_bynode': 0.9150351486532097, 'min_child_weight': 2.016565588391929, 'gamma': 0.25196374320884485, 'reg_alpha': 1.1483211811479902e-07, 'reg_lambda': 2.011990710346194e-08, 'max_delta_step': 1.4117643120100691, 'booster': 'gbtree'}. Best is trial 99 with value: 4.161096256768273.[0m
[32m[I 2026-08-05 15:55:46,697][0m Trial 138 finished with value: 4.15064292025359 and parameters: {'n_estimators': 1510, 'max_depth': 10, 'learning_rate': 0.018884480307292614, 'subsample': 0.6256345736680538, 'colsample_bytree': 0.7555489208204682, 'colsample_bylevel': 0.8510695802577339, 'colsample_bynode': 0.8280664087951702, 'min_child_weight': 1.101378138753475, 'gamma': 0.20477997549811083, 'reg_alpha': 2.4377872150094907e-08, 'reg_lambda': 0.0001776836496593753, 'max_delta_step': 1.8586110007147703, 'booster': 'gbtree'}. Best is trial 138 with value: 4.15064292025359.[0m
[32m[I 2026-08-05 15:55:54,573][0m Trial 139 pruned. [0m
[32m[I 2026-08-05 15:56:09,861][0m Trial 140 finished with value: 4.223189548772258 and parameters: {'n_estimators': 1268, 'max_depth': 5, 'learning_rate': 0.01998455328925635, 'subsample': 0.6195595420151493, 'colsample_bytree': 0.8935683054157926, 'colsample_bylevel': 0.7472168163347608, 'colsample_bynode': 0.7619516478931384, 'min_child_weight': 1.4075743723337242, 'gamma': 0.09737891764565446, 'reg_alpha': 5.399475102109739e-06, 'reg_lambda': 3.5081797220220637e-07, 'max_delta_step': 1.8668545505068552, 'booster': 'dart'}. Best is trial 138 with value: 4.15064292025359.[0m
[32m[I 2026-08-05 15:56:31,587][0m Trial 141 finished with value: 4.171660981246761 and parameters: {'n_estimators': 1231, 'max_depth': 10, 'learning_rate': 0.01830876111366082, 'subsample': 0.6187568050303628, 'colsample_bytree': 0.7463625859306453, 'colsample_bylevel': 0.9083529660729965, 'colsample_bynode': 0.7384469183800393, 'min_child_weight': 1.1569460854986755, 'gamma': 0.3069391273584974, 'reg_alpha': 1.569731581138876e-07, 'reg_lambda': 0.008285777100359614, 'max_delta_step': 3.3867872137118464, 'booster': 'gbtree'}. Best is trial 138 with value: 4.15064292025359.[0m
[32m[I 2026-08-05 15:56:56,975][0m Trial 142 finished with value: 4.151265914962596 and parameters: {'n_estimators': 1308, 'max_depth': 12, 'learning_rate': 0.021422893205649093, 'subsample': 0.6124492076768623, 'colsample_bytree': 0.7237828995183521, 'colsample_bylevel': 0.9825347617087863, 'colsample_bynode': 0.8162737069618808, 'min_child_weight': 2.58068346604471, 'gamma': 0.027898165832761446, 'reg_alpha': 1.2738475452085579e-07, 'reg_lambda': 0.17928959129293848, 'max_delta_step': 3.2466138470454364, 'booster': 'gbtree'}. Best is trial 138 with value: 4.15064292025359.[0m
[32m[I 2026-08-05 15:57:06,757][0m Trial 143 finished with value: 4.1971053089448915 and parameters: {'n_estimators': 1767, 'max_depth': 12, 'learning_rate': 0.07148545339620213, 'subsample': 0.605775478521921, 'colsample_bytree': 0.7997687531635977, 'colsample_bylevel': 0.9582535132119301, 'colsample_bynode': 0.7348895721954417, 'min_child_weight': 3.4751538019741757, 'gamma': 0.17153193394168986, 'reg_alpha': 5.969373743131114e-08, 'reg_lambda': 0.11925930396273389, 'max_delta_step': 2.3651148905838224, 'booster': 'gbtree'}. Best is trial 138 with value: 4.15064292025359.[0m
[32m[I 2026-08-05 15:57:16,556][0m Trial 144 finished with value: 4.220069807667487 and parameters: {'n_estimators': 1208, 'max_depth': 8, 'learning_rate': 0.04646172767445332, 'subsample': 0.6825466560222487, 'colsample_bytree': 0.9482724747657254, 'colsample_bylevel': 0.8951110562886377, 'colsample_bynode': 0.710204215236614, 'min_child_weight': 1.1092877563413768, 'gamma': 0.20182744899098462, 'reg_alpha': 1.6741131551060707e-07, 'reg_lambda': 0.0003750444327627111, 'max_delta_step': 3.3670210161196783, 'booster': 'gbtree'}. Best is trial 138 with value: 4.15064292025359.[0m
[32m[I 2026-08-05 15:57:52,570][0m Trial 145 finished with value: 4.180787804826856 and parameters: {'n_estimators': 1603, 'max_depth': 12, 'learning_rate': 0.01836709993795321, 'subsample': 0.7387269194113312, 'colsample_bytree': 0.7622550189652889, 'colsample_bylevel': 0.7607469330641734, 'colsample_bynode': 0.9517818078276474, 'min_child_weight': 1.674729415624354, 'gamma': 0.3721804852801517, 'reg_alpha': 1.6595633635164595e-07, 'reg_lambda': 0.00032598920401305596, 'max_delta_step': 1.4729548655381781, 'booster': 'gbtree'}. Best is trial 138 with value: 4.15064292025359.[0m
[32m[I 2026-08-05 15:58:03,454][0m Trial 146 pruned. [0m
[32m[I 2026-08-05 15:58:51,955][0m Trial 147 finished with value: 4.361032336741923 and parameters: {'n_estimators': 1601, 'max_depth': 11, 'learning_rate': 0.03156861617164454, 'subsample': 0.7225362444034529, 'colsample_bytree': 0.8881522053326658, 'colsample_bylevel': 0.8118686249554449, 'colsample_bynode': 0.9998624783522214, 'min_child_weight': 3.894218693316979, 'gamma': 1.0303597248918965, 'reg_alpha': 1.810933042018271e-07, 'reg_lambda': 3.2230586772759316e-05, 'max_delta_step': 0.3325570953525938, 'booster': 'gbtree'}. Best is trial 138 with value: 4.15064292025359.[0m
[32m[I 2026-08-05 15:59:25,096][0m Trial 148 finished with value: 4.197972944015379 and parameters: {'n_estimators': 1599, 'max_depth': 11, 'learning_rate': 0.011612841907791471, 'subsample': 0.6064327524232717, 'colsample_bytree': 0.587567669894412, 'colsample_bylevel': 0.8618970867803493, 'colsample_bynode': 0.8856075231897752, 'min_child_weight': 3.2157694094653104, 'gamma': 0.7221565379034622, 'reg_alpha': 4.702706295425901e-06, 'reg_lambda': 1.094645186817736, 'max_delta_step': 2.2481808340306277, 'booster': 'gbtree'}. Best is trial 138 with value: 4.15064292025359.[0m
[32m[I 2026-08-05 15:59:49,477][0m Trial 149 finished with value: 4.206224552447292 and parameters: {'n_estimators': 1007, 'max_depth': 12, 'learning_rate': 0.02079083236410222, 'subsample': 0.6053991259818384, 'colsample_bytree': 0.7107072386362505, 'colsample_bylevel': 0.863834272886402, 'colsample_bynode': 0.7450414735064165, 'min_child_weight': 4.2653065654824545, 'gamma': 0.03785883590575339, 'reg_alpha': 1.230457123600698e-08, 'reg_lambda': 0.5463843057037646, 'max_delta_step': 1.6124115509067778, 'booster': 'gbtree'}. Best is trial 138 with value: 4.15064292025359.[0m
[32m[I 2026-08-05 16:00:15,264][0m Trial 150 finished with value: 4.178030300650207 and parameters: {'n_estimators': 1157, 'max_depth': 9, 'learning_rate': 0.011541195558421773, 'subsample': 0.6573448522423081, 'colsample_bytree': 0.6944872524099487, 'colsample_bylevel': 0.9294697632122546, 'colsample_bynode': 0.70830069150344, 'min_child_weight': 1.0173291399550244, 'gamma': 0.4796427009387976, 'reg_alpha': 2.2646822971226031e-07, 'reg_lambda': 0.007822356079689435, 'max_delta_step': 3.4166356484184095, 'booster': 'gbtree'}. Best is trial 138 with value: 4.15064292025359.[0m
[32m[I 2026-08-05 16:00:32,254][0m Trial 151 finished with value: 4.198295329833475 and parameters: {'n_estimators': 977, 'max_depth': 7, 'learning_rate': 0.011345826502475448, 'subsample': 0.6346863636200424, 'colsample_bytree': 0.5154947647451628, 'colsample_bylevel': 0.986223456886543, 'colsample_bynode': 0.7188009519523039, 'min_child_weight': 1.0343529660815214, 'gamma': 0.6343231280983128, 'reg_alpha': 4.2291790562447836e-06, 'reg_lambda': 0.003319965380290719, 'max_delta_step': 2.810844089792785, 'booster': 'gbtree'}. Best is trial 138 with value: 4.15064292025359.[0m
[32m[I 2026-08-05 16:01:02,320][0m Trial 152 finished with value: 4.3062514232102185 and parameters: {'n_estimators': 916, 'max_depth': 9, 'learning_rate': 0.01299872790031409, 'subsample': 0.741198372756977, 'colsample_bytree': 0.8318894449952206, 'colsample_bylevel': 0.9159340421672295, 'colsample_bynode': 0.7853162608513478, 'min_child_weight': 1.2274423055128596, 'gamma': 0.7348139922034704, 'reg_alpha': 4.908633884353023e-07, 'reg_lambda': 2.8829160647845757e-07, 'max_delta_step': 1.451740777825312, 'booster': 'gbtree'}. Best is trial 138 with value: 4.15064292025359.[0m
[32m[I 2026-08-05 16:01:31,703][0m Trial 153 finished with value: 4.193036666601957 and parameters: {'n_estimators': 1393, 'max_depth': 12, 'learning_rate': 0.028768842445684343, 'subsample': 0.6016441630443673, 'colsample_bytree': 0.6695072778618046, 'colsample_bylevel': 0.9191455718459423, 'colsample_bynode': 0.964668293343806, 'min_child_weight': 2.4390283930998455, 'gamma': 0.16022616197376097, 'reg_alpha': 1.4523666843452504e-08, 'reg_lambda': 3.904175275509384e-06, 'max_delta_step': 1.299789237873001, 'booster': 'gbtree'}. Best is trial 138 with value: 4.15064292025359.[0m
[32m[I 2026-08-05 16:01:51,259][0m Trial 154 finished with value: 4.163957101498731 and parameters: {'n_estimators': 866, 'max_depth': 9, 'learning_rate': 0.01806282541639672, 'subsample': 0.7382957132937067, 'colsample_bytree': 0.5881494278153081, 'colsample_bylevel': 0.7680394905309751, 'colsample_bynode': 0.7077317753934119, 'min_child_weight': 1.2061294522657477, 'gamma': 0.1310114550982291, 'reg_alpha': 4.020078889092518e-05, 'reg_lambda': 0.566729722446201, 'max_delta_step': 3.7423779584500343, 'booster': 'dart'}. Best is trial 138 with value: 4.15064292025359.[0m
[32m[I 2026-08-05 16:02:47,998][0m Trial 155 finished with value: 4.346677459460923 and parameters: {'n_estimators': 1524, 'max_depth': 10, 'learning_rate': 0.016494667513684252, 'subsample': 0.6933451175876367, 'colsample_bytree': 0.7769586275948499, 'colsample_bylevel': 0.8983498693009846, 'colsample_bynode': 0.6575692030238695, 'min_child_weight': 1.0950333777879233, 'gamma': 0.11729535882495012, 'reg_alpha': 4.069786715149256e-08, 'reg_lambda': 0.0003595310266520367, 'max_delta_step': 0.644976853005637, 'booster': 'gbtree'}. Best is trial 138 with value: 4.15064292025359.[0m
[32m[I 2026-08-05 16:03:31,754][0m Trial 156 finished with value: 4.180051164030995 and parameters: {'n_estimators': 2353, 'max_depth': 11, 'learning_rate': 0.010039245653461365, 'subsample': 0.7955239822132602, 'colsample_bytree': 0.6412948427984346, 'colsample_bylevel': 0.6477620448995286, 'colsample_bynode': 0.9773985941855338, 'min_child_weight': 2.613028410963617, 'gamma': 0.33404337836646614, 'reg_alpha': 3.3453517565980294e-05, 'reg_lambda': 2.054539521704983e-05, 'max_delta_step': 1.9059042121606806, 'booster': 'gbtree'}. Best is trial 138 with value: 4.15064292025359.[0m
[32m[I 2026-08-05 16:03:35,211][0m Trial 157 pruned. [0m
[32m[I 2026-08-05 16:03:44,560][0m Trial 158 pruned. [0m
[32m[I 2026-08-05 16:03:59,261][0m Trial 159 finished with value: 4.164211654790418 and parameters: {'n_estimators': 884, 'max_depth': 9, 'learning_rate': 0.017815139070950472, 'subsample': 0.7409987808227521, 'colsample_bytree': 0.7316563393996974, 'colsample_bylevel': 0.5714222574753809, 'colsample_bynode': 0.6490472145757149, 'min_child_weight': 1.2263583696247902, 'gamma': 0.4282146139561894, 'reg_alpha': 0.019701100624232123, 'reg_lambda': 1.34014229575151, 'max_delta_step': 3.3199413089373775, 'booster': 'dart'}. Best is trial 138 with value: 4.15064292025359.[0m
[32m[I 2026-08-05 16:04:02,726][0m Trial 160 pruned. [0m
[32m[I 2026-08-05 16:04:13,256][0m Trial 161 finished with value: 4.190880059187518 and parameters: {'n_estimators': 956, 'max_depth': 7, 'learning_rate': 0.02635530356415164, 'subsample': 0.7611908379406256, 'colsample_bytree': 0.7737817071866532, 'colsample_bylevel': 0.43714015630614717, 'colsample_bynode': 0.804970597122652, 'min_child_weight': 1.4467817128965352, 'gamma': 0.5478147059518985, 'reg_alpha': 0.4374201072004161, 'reg_lambda': 0.9180351757586366, 'max_delta_step': 2.832976314729064, 'booster': 'dart'}. Best is trial 138 with value: 4.15064292025359.[0m
[32m[I 2026-08-05 16:04:49,346][0m Trial 162 finished with value: 4.208177091492553 and parameters: {'n_estimators': 2078, 'max_depth': 12, 'learning_rate': 0.01479984966657395, 'subsample': 0.8773383782476798, 'colsample_bytree': 0.4825670593648714, 'colsample_bylevel': 0.7846441257404202, 'colsample_bynode': 0.9914440816816119, 'min_child_weight': 1.5343866615301005, 'gamma': 0.5269484228614212, 'reg_alpha': 0.0001708675474152167, 'reg_lambda': 8.953963404821635e-05, 'max_delta_step': 1.3015238906394977, 'booster': 'gbtree'}. Best is trial 138 with value: 4.15064292025359.[0m
[32m[I 2026-08-05 16:05:25,192][0m Trial 163 finished with value: 4.19846112020961 and parameters: {'n_estimators': 1163, 'max_depth': 11, 'learning_rate': 0.03253253086123031, 'subsample': 0.6124226948479276, 'colsample_bytree': 0.8424251230053278, 'colsample_bylevel': 0.9969482222376025, 'colsample_bynode': 0.9221234156254271, 'min_child_weight': 1.0020566482151876, 'gamma': 0.0699037690886872, 'reg_alpha': 0.0011840563869583774, 'reg_lambda': 9.713791149079258, 'max_delta_step': 4.407296209361657, 'booster': 'gbtree'}. Best is trial 138 with value: 4.15064292025359.[0m
[32m[I 2026-08-05 16:05:29,958][0m Trial 164 pruned. [0m
[32m[I 2026-08-05 16:05:37,007][0m Trial 165 finished with value: 4.233493295058102 and parameters: {'n_estimators': 1455, 'max_depth': 6, 'learning_rate': 0.061849280820590956, 'subsample': 0.6425750081882803, 'colsample_bytree': 0.7034488946003505, 'colsample_bylevel': 0.8082948268599939, 'colsample_bynode': 0.8359786739541424, 'min_child_weight': 4.2533949372977, 'gamma': 0.47342857934092564, 'reg_alpha': 5.970173283367592e-07, 'reg_lambda': 2.6658047870801186e-08, 'max_delta_step': 1.754489361923843, 'booster': 'dart'}. Best is trial 138 with value: 4.15064292025359.[0m
