[32m[I 2026-08-05 15:37:33,910][0m Trial 61 finished with value: 4.223389735444567 and parameters: {'n_estimators': 2969, 'max_depth': 10, 'learning_rate': 0.015047718486977118, 'subsample': 0.997194259017168, 'colsample_bytree': 0.832620979783903, 'colsample_bylevel': 0.411130014358351, 'colsample_bynode': 0.9593832533994354, 'min_child_weight': 1.2679950205745907, 'gamma': 1.720222704898194, 'reg_alpha': 1.504492926652793e-08, 'reg_lambda': 4.289944657644783e-08, 'max_delta_step': 0.8867967596856604, 'booster': 'gbtree'}. Best is trial 30 with value: 4.172215623047451.[0m
[32m[I 2026-08-05 15:37:37,702][0m Trial 62 pruned. [0m
[32m[I 2026-08-05 15:37:46,837][0m Trial 63 finished with value: 4.218027077869484 and parameters: {'n_estimators': 2892, 'max_depth': 8, 'learning_rate': 0.028917310267130524, 'subsample': 0.8616695486517176, 'colsample_bytree': 0.7008613898687842, 'colsample_bylevel': 0.3148890690803162, 'colsample_bynode': 0.7751190842294582, 'min_child_weight': 3.6028335052605223, 'gamma': 1.7735269010069428, 'reg_alpha': 7.829939040264291e-08, 'reg_lambda': 2.123222845110833e-07, 'max_delta_step': 1.9251489075315753, 'booster': 'gbtree'}. Best is trial 30 with value: 4.172215623047451.[0m
[32m[I 2026-08-05 15:38:00,359][0m Trial 64 finished with value: 4.224243172877846 and parameters: {'n_estimators': 2811, 'max_depth': 10, 'learning_rate': 0.01545160579824481, 'subsample': 0.6754345845509109, 'colsample_bytree': 0.7133378138719582, 'colsample_bylevel': 0.419197800094745, 'colsample_bynode': 0.3089464544188425, 'min_child_weight': 3.4290538605503142, 'gamma': 1.8448026517997842, 'reg_alpha': 0.01690085942571189, 'reg_lambda': 0.00327920050496631, 'max_delta_step': 3.2279910228275113, 'booster': 'gbtree'}. Best is trial 30 with value: 4.172215623047451.[0m
[32m[I 2026-08-05 15:38:02,346][0m Trial 65 pruned. [0m
[32m[I 2026-08-05 15:38:08,358][0m Trial 66 pruned. [0m
[32m[I 2026-08-05 15:38:15,784][0m Trial 67 pruned. [0m
[32m[I 2026-08-05 15:38:32,073][0m Trial 68 finished with value: 4.222855672947908 and parameters: {'n_estimators': 2646, 'max_depth': 10, 'learning_rate': 0.0116614923352908, 'subsample': 0.8916349098552229, 'colsample_bytree': 0.846189892772584, 'colsample_bylevel': 0.4608758312232471, 'colsample_bynode': 0.946923570618414, 'min_child_weight': 5.594517436527964, 'gamma': 1.542369866891737, 'reg_alpha': 8.135275329991623e-08, 'reg_lambda': 2.010713979310166e-08, 'max_delta_step': 4.213936411397205, 'booster': 'gbtree'}. Best is trial 30 with value: 4.172215623047451.[0m
[32m[I 2026-08-05 15:38:37,421][0m Trial 69 pruned. [0m
[32m[I 2026-08-05 15:38:50,507][0m Trial 70 finished with value: 4.1949449057413775 and parameters: {'n_estimators': 2176, 'max_depth': 10, 'learning_rate': 0.01726037655408522, 'subsample': 0.8374219811396308, 'colsample_bytree': 0.6961282329888093, 'colsample_bylevel': 0.7914592825207346, 'colsample_bynode': 0.4429859248898239, 'min_child_weight': 1.5328027393104382, 'gamma': 1.2986777179795173, 'reg_alpha': 1.1917713777231362e-06, 'reg_lambda': 0.0007113795170819405, 'max_delta_step': 4.110655167404969, 'booster': 'gbtree'}. Best is trial 30 with value: 4.172215623047451.[0m
[32m[I 2026-08-05 15:39:02,025][0m Trial 71 pruned. [0m
[32m[I 2026-08-05 15:39:09,425][0m Trial 72 pruned. [0m
[32m[I 2026-08-05 15:39:14,973][0m Trial 73 pruned. [0m
[32m[I 2026-08-05 15:39:17,691][0m Trial 74 pruned. [0m
[32m[I 2026-08-05 15:39:27,238][0m Trial 75 finished with value: 4.198017431704826 and parameters: {'n_estimators': 2219, 'max_depth': 8, 'learning_rate': 0.018792198861501158, 'subsample': 0.9762581024950994, 'colsample_bytree': 0.7672408468944459, 'colsample_bylevel': 0.36744517441168106, 'colsample_bynode': 0.7543292258913167, 'min_child_weight': 1.4983572996741776, 'gamma': 1.974631249156503, 'reg_alpha': 1.7168592223170218e-07, 'reg_lambda': 2.1843260301782035e-07, 'max_delta_step': 3.601791148552235, 'booster': 'dart'}. Best is trial 30 with value: 4.172215623047451.[0m
[32m[I 2026-08-05 15:39:45,061][0m Trial 76 finished with value: 4.172686510531908 and parameters: {'n_estimators': 2810, 'max_depth': 10, 'learning_rate': 0.016992626628925464, 'subsample': 0.8682579262335186, 'colsample_bytree': 0.5927082836174136, 'colsample_bylevel': 0.5427958619587752, 'colsample_bynode': 0.8309001729552259, 'min_child_weight': 1.4620567493766368, 'gamma': 1.1945304838204693, 'reg_alpha': 1.999734338494834e-07, 'reg_lambda': 7.288957107037793e-06, 'max_delta_step': 2.0464258405191886, 'booster': 'dart'}. Best is trial 30 with value: 4.172215623047451.[0m
[32m[I 2026-08-05 15:39:49,841][0m Trial 77 pruned. [0m
[32m[I 2026-08-05 15:39:51,944][0m Trial 78 pruned. [0m
[32m[I 2026-08-05 15:39:54,537][0m Trial 79 pruned. [0m
[32m[I 2026-08-05 15:40:54,635][0m Trial 80 finished with value: 4.2250881395800395 and parameters: {'n_estimators': 2782, 'max_depth': 9, 'learning_rate': 0.013779715966913391, 'subsample': 0.8600977457039113, 'colsample_bytree': 0.846580584003797, 'colsample_bylevel': 0.7009128522299322, 'colsample_bynode': 0.855120403153088, 'min_child_weight': 1.4432250414230203, 'gamma': 1.1027881157190067, 'reg_alpha': 1.5283598908648505e-07, 'reg_lambda': 0.00010774792880175336, 'max_delta_step': 0.6003389888582271, 'booster': 'dart'}. Best is trial 30 with value: 4.172215623047451.[0m
[32m[I 2026-08-05 15:41:08,285][0m Trial 81 finished with value: 4.231296445974849 and parameters: {'n_estimators': 2666, 'max_depth': 10, 'learning_rate': 0.023647250985386874, 'subsample': 0.97919299959864, 'colsample_bytree': 0.5863899640096811, 'colsample_bylevel': 0.4878754194006209, 'colsample_bynode': 0.6669553267591235, 'min_child_weight': 1.740548748104355, 'gamma': 1.0153289182842036, 'reg_alpha': 1.224319239481017e-07, 'reg_lambda': 3.029302651348166e-07, 'max_delta_step': 1.8668439095865985, 'booster': 'dart'}. Best is trial 30 with value: 4.172215623047451.[0m
[32m[I 2026-08-05 15:41:24,502][0m Trial 82 finished with value: 4.1781217434578615 and parameters: {'n_estimators': 2694, 'max_depth': 12, 'learning_rate': 0.020968035867370255, 'subsample': 0.8103330429449519, 'colsample_bytree': 0.6477330476179677, 'colsample_bylevel': 0.5253498567069388, 'colsample_bynode': 0.768347989316467, 'min_child_weight': 2.0574069092939102, 'gamma': 1.2883735102894602, 'reg_alpha': 5.363598047240929e-07, 'reg_lambda': 3.9816894074258056e-05, 'max_delta_step': 2.0647179828493445, 'booster': 'dart'}. Best is trial 30 with value: 4.172215623047451.[0m
[32m[I 2026-08-05 15:41:38,029][0m Trial 83 finished with value: 4.237592990583261 and parameters: {'n_estimators': 2611, 'max_depth': 10, 'learning_rate': 0.03110613680835009, 'subsample': 0.779398981991315, 'colsample_bytree': 0.4743976819069639, 'colsample_bylevel': 0.6440295129652364, 'colsample_bynode': 0.6008695674307342, 'min_child_weight': 1.49836473958091, 'gamma': 1.1336550517714623, 'reg_alpha': 3.0156949911337517e-05, 'reg_lambda': 0.00012212773984405161, 'max_delta_step': 1.3830180751137884, 'booster': 'dart'}. Best is trial 30 with value: 4.172215623047451.[0m
[32m[I 2026-08-05 15:42:05,458][0m Trial 84 finished with value: 4.2272283691696355 and parameters: {'n_estimators': 2500, 'max_depth': 12, 'learning_rate': 0.014911941078712455, 'subsample': 0.8140619002336378, 'colsample_bytree': 0.41415319947093465, 'colsample_bylevel': 0.5642887537420048, 'colsample_bynode': 0.7200606467002069, 'min_child_weight': 1.783149516572333, 'gamma': 0.7268325511588192, 'reg_alpha': 1.034187980255736e-08, 'reg_lambda': 0.003960813965162549, 'max_delta_step': 1.6358161208510629, 'booster': 'dart'}. Best is trial 30 with value: 4.172215623047451.[0m
[32m[I 2026-08-05 15:42:23,497][0m Trial 85 finished with value: 4.21342217267099 and parameters: {'n_estimators': 2526, 'max_depth': 10, 'learning_rate': 0.017153998658028306, 'subsample': 0.8434287495521539, 'colsample_bytree': 0.6518855600729626, 'colsample_bylevel': 0.5128647548426208, 'colsample_bynode': 0.6852943112997658, 'min_child_weight': 2.568518287413778, 'gamma': 1.610631091164755, 'reg_alpha': 7.327000260476283e-07, 'reg_lambda': 9.651302634667919e-06, 'max_delta_step': 1.6242249786346323, 'booster': 'dart'}. Best is trial 30 with value: 4.172215623047451.[0m
[32m[I 2026-08-05 15:42:45,351][0m Trial 86 finished with value: 4.219587042275534 and parameters: {'n_estimators': 2714, 'max_depth': 11, 'learning_rate': 0.023113062166925557, 'subsample': 0.7383713133251095, 'colsample_bytree': 0.6421593498909716, 'colsample_bylevel': 0.5636171415672507, 'colsample_bynode': 0.636675987103022, 'min_child_weight': 1.8304779697371858, 'gamma': 1.2679216877091244, 'reg_alpha': 5.422386682680288e-08, 'reg_lambda': 5.738685210616966e-05, 'max_delta_step': 1.1321342803431649, 'booster': 'gbtree'}. Best is trial 30 with value: 4.172215623047451.[0m
[32m[I 2026-08-05 15:42:56,207][0m Trial 87 pruned. [0m
[32m[I 2026-08-05 15:43:04,216][0m Trial 88 finished with value: 4.218473998004564 and parameters: {'n_estimators': 1533, 'max_depth': 8, 'learning_rate': 0.028090918507370687, 'subsample': 0.7954483038183979, 'colsample_bytree': 0.9615931760092724, 'colsample_bylevel': 0.7690320808014932, 'colsample_bynode': 0.3702178342159446, 'min_child_weight': 1.4031318177786956, 'gamma': 1.7684520342383048, 'reg_alpha': 0.036992236531570945, 'reg_lambda': 0.086109054310931, 'max_delta_step': 3.170635363007279, 'booster': 'gbtree'}. Best is trial 30 with value: 4.172215623047451.[0m
[32m[I 2026-08-05 15:43:21,804][0m Trial 89 finished with value: 4.259736823523193 and parameters: {'n_estimators': 2247, 'max_depth': 12, 'learning_rate': 0.03665254181742428, 'subsample': 0.8606600061707104, 'colsample_bytree': 0.49734520767933044, 'colsample_bylevel': 0.5280944820971774, 'colsample_bynode': 0.8756123101052676, 'min_child_weight': 1.8189909240548545, 'gamma': 1.2763871048190485, 'reg_alpha': 1.6274547239996665e-05, 'reg_lambda': 1.2564479420259e-06, 'max_delta_step': 0.8902364423275229, 'booster': 'dart'}. Best is trial 30 with value: 4.172215623047451.[0m
[32m[I 2026-08-05 15:43:25,605][0m Trial 90 pruned. [0m
[32m[I 2026-08-05 15:43:31,326][0m Trial 91 pruned. [0m
[32m[I 2026-08-05 15:43:33,313][0m Trial 92 pruned. [0m
[32m[I 2026-08-05 15:43:36,110][0m Trial 93 pruned. [0m
[32m[I 2026-08-05 15:44:03,927][0m Trial 94 finished with value: 4.246558399381035 and parameters: {'n_estimators': 2976, 'max_depth': 9, 'learning_rate': 0.014034114682882723, 'subsample': 0.8824536303776139, 'colsample_bytree': 0.5938274236309172, 'colsample_bylevel': 0.3299213255300581, 'colsample_bynode': 0.8453931765462761, 'min_child_weight': 3.052833775963643, 'gamma': 1.9430074114437952, 'reg_alpha': 4.324843905728438e-08, 'reg_lambda': 4.9640862318173464e-08, 'max_delta_step': 0.9207345637121065, 'booster': 'dart'}. Best is trial 30 with value: 4.172215623047451.[0m
[32m[I 2026-08-05 15:44:09,788][0m Trial 95 finished with value: 4.248417292928253 and parameters: {'n_estimators': 2548, 'max_depth': 6, 'learning_rate': 0.05909151734612934, 'subsample': 0.69797922908873, 'colsample_bytree': 0.8235868018925185, 'colsample_bylevel': 0.7386932373460295, 'colsample_bynode': 0.4631702150907156, 'min_child_weight': 4.476911492727569, 'gamma': 1.5077302669611528, 'reg_alpha': 0.00037139133812467864, 'reg_lambda': 5.53044973616823e-06, 'max_delta_step': 2.052852109478549, 'booster': 'gbtree'}. Best is trial 30 with value: 4.172215623047451.[0m
[32m[I 2026-08-05 15:44:12,600][0m Trial 96 pruned. [0m
[32m[I 2026-08-05 15:44:32,914][0m Trial 97 finished with value: 4.23044590025565 and parameters: {'n_estimators': 2766, 'max_depth': 12, 'learning_rate': 0.02092389588510055, 'subsample': 0.9278736828571008, 'colsample_bytree': 0.6984257313835132, 'colsample_bylevel': 0.39919409361033587, 'colsample_bynode': 0.9849561713235404, 'min_child_weight': 2.6924969448907095, 'gamma': 1.0580962422691318, 'reg_alpha': 9.591737014873266e-06, 'reg_lambda': 3.980498648852524e-05, 'max_delta_step': 1.6381624549511264, 'booster': 'dart'}. Best is trial 30 with value: 4.172215623047451.[0m
[32m[I 2026-08-05 15:44:46,415][0m Trial 98 finished with value: 4.226962852247438 and parameters: {'n_estimators': 2462, 'max_depth': 12, 'learning_rate': 0.023466907038726857, 'subsample': 0.7697820559389428, 'colsample_bytree': 0.566395106321982, 'colsample_bylevel': 0.5644876253474818, 'colsample_bynode': 0.8437044865078627, 'min_child_weight': 2.2494301020096956, 'gamma': 1.7031629830112405, 'reg_alpha': 1.5082235179568224e-07, 'reg_lambda': 0.00014024765308362537, 'max_delta_step': 2.483626434076581, 'booster': 'dart'}. Best is trial 30 with value: 4.172215623047451.[0m
[32m[I 2026-08-05 15:45:03,740][0m Trial 99 finished with value: 4.161096256768273 and parameters: {'n_estimators': 2966, 'max_depth': 10, 'learning_rate': 0.01236040976807864, 'subsample': 0.8725000986719474, 'colsample_bytree': 0.6444457223484689, 'colsample_bylevel': 0.5236846214993994, 'colsample_bynode': 0.7472291874546922, 'min_child_weight': 3.7508277940978654, 'gamma': 1.2005825880659595, 'reg_alpha': 1.771685743741956e-08, 'reg_lambda': 0.00023352004706164695, 'max_delta_step': 3.110874832704578, 'booster': 'dart'}. Best is trial 99 with value: 4.161096256768273.[0m
[32m[I 2026-08-05 15:45:22,014][0m Trial 100 finished with value: 4.245401842213797 and parameters: {'n_estimators': 2882, 'max_depth': 11, 'learning_rate': 0.017840796714179787, 'subsample': 0.974721968132104, 'colsample_bytree': 0.5524773823189015, 'colsample_bylevel': 0.43988402883989947, 'colsample_bynode': 0.7881407196030301, 'min_child_weight': 4.048622875771626, 'gamma': 1.1703790128933833, 'reg_alpha': 2.084415738500219e-08, 'reg_lambda': 0.015383350746986777, 'max_delta_step': 1.4611071226991748, 'booster': 'dart'}. Best is trial 99 with value: 4.161096256768273.[0m
[32m[I 2026-08-05 15:45:48,261][0m Trial 101 finished with value: 4.190540343853859 and parameters: {'n_estimators': 2420, 'max_depth': 12, 'learning_rate': 0.015587818722210808, 'subsample': 0.7304316215563109, 'colsample_bytree': 0.8578865144619493, 'colsample_bylevel': 0.5452515962121326, 'colsample_bynode': 0.8246210200160417, 'min_child_weight': 1.4322034791332956, 'gamma': 0.9428499548655247, 'reg_alpha': 8.898843590914228e-07, 'reg_lambda': 8.944270232081743e-05, 'max_delta_step': 2.2081871899608543, 'booster': 'dart'}. Best is trial 99 with value: 4.161096256768273.[0m
[32m[I 2026-08-05 15:45:56,967][0m Trial 102 pruned. [0m
[32m[I 2026-08-05 15:45:59,967][0m Trial 103 pruned. [0m
[32m[I 2026-08-05 15:46:12,542][0m Trial 104 finished with value: 4.1832574228797705 and parameters: {'n_estimators': 2402, 'max_depth': 12, 'learning_rate': 0.028595714743348516, 'subsample': 0.6637674411471537, 'colsample_bytree': 0.7304871599566891, 'colsample_bylevel': 0.5551823563351537, 'colsample_bynode': 0.77930863556388, 'min_child_weight': 1.4432155347624858, 'gamma': 0.7515231377856074, 'reg_alpha': 3.530473188316618e-08, 'reg_lambda': 5.1350837800740954e-05, 'max_delta_step': 2.740075847524206, 'booster': 'dart'}. Best is trial 99 with value: 4.161096256768273.[0m
[32m[I 2026-08-05 15:46:33,538][0m Trial 105 finished with value: 4.186455979820639 and parameters: {'n_estimators': 2752, 'max_depth': 12, 'learning_rate': 0.048968077607634886, 'subsample': 0.6385461106607346, 'colsample_bytree': 0.7671827974958748, 'colsample_bylevel': 0.6657603707881872, 'colsample_bynode': 0.949996868845496, 'min_child_weight': 3.0181649604813567, 'gamma': 0.18952901045190285, 'reg_alpha': 1.287292696540119e-05, 'reg_lambda': 0.00013915818382344503, 'max_delta_step': 0.7935555559391871, 'booster': 'dart'}. Best is trial 99 with value: 4.161096256768273.[0m
[32m[I 2026-08-05 15:46:56,151][0m Trial 106 finished with value: 4.171698523942265 and parameters: {'n_estimators': 2175, 'max_depth': 11, 'learning_rate': 0.01735501468869104, 'subsample': 0.6414209284068454, 'colsample_bytree': 0.908071947046847, 'colsample_bylevel': 0.6077303138408165, 'colsample_bynode': 0.9198014652126374, 'min_child_weight': 2.3661842351556315, 'gamma': 0.7001405564346928, 'reg_alpha': 5.908833951739527e-07, 'reg_lambda': 0.00010910479190436292, 'max_delta_step': 2.7692591844398597, 'booster': 'dart'}. Best is trial 99 with value: 4.161096256768273.[0m
[32m[I 2026-08-05 15:47:04,864][0m Trial 107 finished with value: 4.183730233535704 and parameters: {'n_estimators': 2846, 'max_depth': 11, 'learning_rate': 0.08722281201596627, 'subsample': 0.7354534073111836, 'colsample_bytree': 0.9244258468652822, 'colsample_bylevel': 0.5758516229155853, 'colsample_bynode': 0.7367127298568534, 'min_child_weight': 4.301238010650478, 'gamma': 0.502932295925672, 'reg_alpha': 2.9666201821910913e-07, 'reg_lambda': 0.00011717010513322773, 'max_delta_step': 0.9719907645695183, 'booster': 'dart'}. Best is trial 99 with value: 4.161096256768273.[0m
[32m[I 2026-08-05 15:47:38,873][0m Trial 108 finished with value: 4.205378217493339 and parameters: {'n_estimators': 2640, 'max_depth': 10, 'learning_rate': 0.04414690446624715, 'subsample': 0.6384325371608471, 'colsample_bytree': 0.7122971201794028, 'colsample_bylevel': 0.6458864862083868, 'colsample_bynode': 0.8780338494930789, 'min_child_weight': 2.2589194578330227, 'gamma': 0.20347774219736087, 'reg_alpha': 5.494555671575308e-07, 'reg_lambda': 8.267869229942993e-06, 'max_delta_step': 0.41651919183904323, 'booster': 'dart'}. Best is trial 99 with value: 4.161096256768273.[0m
[32m[I 2026-08-05 15:47:42,853][0m Trial 109 finished with value: 4.224274697284112 and parameters: {'n_estimators': 2804, 'max_depth': 9, 'learning_rate': 0.1027782456756613, 'subsample': 0.740160372708635, 'colsample_bytree': 0.9826345271657079, 'colsample_bylevel': 0.5437453310503778, 'colsample_bynode': 0.5505116514098383, 'min_child_weight': 2.6430695001251445, 'gamma': 0.8172365150287986, 'reg_alpha': 2.850679647795335e-07, 'reg_lambda': 2.406233506251493e-05, 'max_delta_step': 2.7044686481850446, 'booster': 'dart'}. Best is trial 99 with value: 4.161096256768273.[0m
[32m[I 2026-08-05 15:47:55,751][0m Trial 110 finished with value: 4.182594170378377 and parameters: {'n_estimators': 2373, 'max_depth': 8, 'learning_rate': 0.02561634607846665, 'subsample': 0.6223409199296521, 'colsample_bytree': 0.9381304977024985, 'colsample_bylevel': 0.5868714663371274, 'colsample_bynode': 0.8788270440362329, 'min_child_weight': 2.0433612978121283, 'gamma': 0.7746188053488183, 'reg_alpha': 1.3897898310305316e-08, 'reg_lambda': 5.171115526242607e-06, 'max_delta_step': 3.178345983124982, 'booster': 'gbtree'}. Best is trial 99 with value: 4.161096256768273.[0m
[32m[I 2026-08-05 15:48:02,661][0m Trial 111 finished with value: 4.206651943316066 and parameters: {'n_estimators': 2407, 'max_depth': 8, 'learning_rate': 0.04822953005835722, 'subsample': 0.7068876495385908, 'colsample_bytree': 0.861795447562923, 'colsample_bylevel': 0.7871758214202949, 'colsample_bynode': 0.8738628010796764, 'min_child_weight': 2.193045047479507, 'gamma': 1.05178426966529, 'reg_alpha': 6.728611051522546e-08, 'reg_lambda': 3.624180135835857e-06, 'max_delta_step': 3.518278168150748, 'booster': 'gbtree'}. Best is trial 99 with value: 4.161096256768273.[0m
[32m[I 2026-08-05 15:48:05,242][0m Trial 112 pruned. [0m
[32m[I 2026-08-05 15:48:14,922][0m Trial 113 finished with value: 4.1814611852970405 and parameters: {'n_estimators': 2210, 'max_depth': 8, 'learning_rate': 0.030978822482833564, 'subsample': 0.63303161073764, 'colsample_bytree': 0.8988907246345209, 'colsample_bylevel': 0.4065875228137712, 'colsample_bynode': 0.7599271423196023, 'min_child_weight': 4.191757447634248, 'gamma': 0.8117957672877526, 'reg_alpha': 2.3770696953356066e-07, 'reg_lambda': 4.728597835184259e-06, 'max_delta_step': 3.3009202539750566, 'booster': 'gbtree'}. Best is trial 99 with value: 4.161096256768273.[0m
[32m[I 2026-08-05 15:48:17,530][0m Trial 114 pruned. [0m
[32m[I 2026-08-05 15:48:31,335][0m Trial 115 finished with value: 4.205286231445907 and parameters: {'n_estimators': 2262, 'max_depth': 7, 'learning_rate': 0.015199611040939896, 'subsample': 0.6440854019214005, 'colsample_bytree': 0.9561159258669345, 'colsample_bylevel': 0.33613353921480393, 'colsample_bynode': 0.7431372998524723, 'min_child_weight': 2.6447101596739855, 'gamma': 0.7963115990535115, 'reg_alpha': 6.467601510128688e-05, 'reg_lambda': 5.350171747935482e-08, 'max_delta_step': 3.618081553466135, 'booster': 'gbtree'}. Best is trial 99 with value: 4.161096256768273.[0m
[32m[I 2026-08-05 15:48:55,999][0m Trial 116 finished with value: 4.203474376315235 and parameters: {'n_estimators': 2315, 'max_depth': 11, 'learning_rate': 0.027059443492250746, 'subsample': 0.6844413258320046, 'colsample_bytree': 0.8402442488426852, 'colsample_bylevel': 0.7630380755380184, 'colsample_bynode': 0.9248332704057958, 'min_child_weight': 6.777269048684403, 'gamma': 0.35077500203809214, 'reg_alpha': 0.01667730552655962, 'reg_lambda': 0.1361338920540854, 'max_delta_step': 1.3885947754203123, 'booster': 'dart'}. Best is trial 99 with value: 4.161096256768273.[0m
[32m[I 2026-08-05 15:49:01,138][0m Trial 117 pruned. [0m
[32m[I 2026-08-05 15:49:11,869][0m Trial 118 finished with value: 4.214334455268204 and parameters: {'n_estimators': 2220, 'max_depth': 7, 'learning_rate': 0.023891801648490477, 'subsample': 0.7920066536968786, 'colsample_bytree': 0.8158507174690794, 'colsample_bylevel': 0.6684293406176129, 'colsample_bynode': 0.5463840739749951, 'min_child_weight': 1.6763293533015504, 'gamma': 1.5873879648771319, 'reg_alpha': 1.1998193667447566e-06, 'reg_lambda': 0.0003254745221963672, 'max_delta_step': 2.037184294550924, 'booster': 'gbtree'}. Best is trial 99 with value: 4.161096256768273.[0m
