============================================================
xgboost — 运行开始  20260805_152638
  输出目录:  runs\AW_ST_CMC\AW_ST_CMC_xgboost_20260805_152638
============================================================
============================================================
XGBoost + PharmHGT-style Featurization for AW_ST_CMC Prediction
============================================================
[Cache HIT] Loading features from data\features\surfpro\AW_ST_CMC
  Train features: (843, 522)
  Test features:  (70, 522)

Split: Train 737, Val 106, Test 70
  CV (Optuna): 758, Holdout (Top-K filter): 85

============================================================
Optuna Hyperparameter Tuning (200 trials, 5-Fold CV)
============================================================
[32m[I 2026-08-05 15:26:41,698][0m Trial 0 finished with value: 4.497980336453547 and parameters: {'n_estimators': 1624, 'max_depth': 12, 'learning_rate': 0.08960785365368121, 'subsample': 0.8394633936788146, 'colsample_bytree': 0.40921304830970556, 'colsample_bylevel': 0.40919616423534183, 'colsample_bynode': 0.3406585285177396, 'min_child_weight': 19.030368381735816, 'gamma': 1.2022300234864176, 'reg_alpha': 0.023585940584142682, 'reg_lambda': 1.5320059381854043e-08, 'max_delta_step': 7.759278817295955, 'booster': 'gbtree'}. Best is trial 0 with value: 4.497980336453547.[0m
[32m[I 2026-08-05 15:26:48,288][0m Trial 1 finished with value: 4.275007095574775 and parameters: {'n_estimators': 1200, 'max_depth': 5, 'learning_rate': 0.024878734419814436, 'subsample': 0.8099025726528951, 'colsample_bytree': 0.602361513049481, 'colsample_bylevel': 0.5038603981386294, 'colsample_bynode': 0.7282970263056656, 'min_child_weight': 1.6071238512039876, 'gamma': 0.5842892970704363, 'reg_alpha': 1.9826980964985924e-05, 'reg_lambda': 0.00012724181576752517, 'max_delta_step': 6.281407691144109, 'booster': 'dart'}. Best is trial 1 with value: 4.275007095574775.[0m
[32m[I 2026-08-05 15:26:52,101][0m Trial 2 finished with value: 4.523685705005889 and parameters: {'n_estimators': 2103, 'max_depth': 4, 'learning_rate': 0.061721159481070736, 'subsample': 0.6682096494749166, 'colsample_bytree': 0.3455361150896956, 'colsample_bylevel': 0.9642198760773333, 'colsample_bynode': 0.9759424231521916, 'min_child_weight': 15.635108708133458, 'gamma': 0.6092275383467414, 'reg_alpha': 7.569183361880229e-08, 'reg_lambda': 0.014391207615728067, 'max_delta_step': 3.5212199499168104, 'booster': 'dart'}. Best is trial 1 with value: 4.275007095574775.[0m
[32m[I 2026-08-05 15:27:01,461][0m Trial 3 finished with value: 4.286653224002647 and parameters: {'n_estimators': 875, 'max_depth': 12, 'learning_rate': 0.02171103454376615, 'subsample': 0.8650089137415928, 'colsample_bytree': 0.5181977532625877, 'colsample_bylevel': 0.6640476148244676, 'colsample_bynode': 0.6826971955402957, 'min_child_weight': 1.8752209455786402, 'gamma': 1.9391692555291171, 'reg_alpha': 0.09466630153726856, 'reg_lambda': 2.854239907497756, 'max_delta_step': 7.158618803421191, 'booster': 'dart'}. Best is trial 1 with value: 4.275007095574775.[0m
[32m[I 2026-08-05 15:27:10,666][0m Trial 4 finished with value: 4.315569333056068 and parameters: {'n_estimators': 994, 'max_depth': 5, 'learning_rate': 0.011450964268326641, 'subsample': 0.7301321323053057, 'colsample_bytree': 0.5720741027826374, 'colsample_bylevel': 0.4899443222417271, 'colsample_bynode': 0.8801162564063505, 'min_child_weight': 3.3648671441879534, 'gamma': 0.5618690193747615, 'reg_alpha': 0.0007660634613082914, 'reg_lambda': 1.8548894229694903e-07, 'max_delta_step': 6.417575846032317, 'booster': 'dart'}. Best is trial 1 with value: 4.275007095574775.[0m
[32m[I 2026-08-05 15:27:36,726][0m Trial 5 finished with value: 4.267421513529109 and parameters: {'n_estimators': 2499, 'max_depth': 5, 'learning_rate': 0.010166803740022877, 'subsample': 0.9261845713819337, 'colsample_bytree': 0.7948001406933319, 'colsample_bylevel': 0.810305017628691, 'colsample_bynode': 0.8398892426801621, 'min_child_weight': 1.286390810198991, 'gamma': 0.7169314570885452, 'reg_alpha': 1.1036250149900698e-07, 'reg_lambda': 0.5860448217200517, 'max_delta_step': 4.986385014620463, 'booster': 'gbtree'}. Best is trial 5 with value: 4.267421513529109.[0m
[32m[I 2026-08-05 15:27:38,931][0m Trial 6 pruned. [0m
[32m[I 2026-08-05 15:27:42,532][0m Trial 7 pruned. [0m
[32m[I 2026-08-05 15:27:52,463][0m Trial 8 finished with value: 4.280776641915229 and parameters: {'n_estimators': 2846, 'max_depth': 11, 'learning_rate': 0.06669254439997736, 'subsample': 0.9485842360750871, 'colsample_bytree': 0.8625704538293801, 'colsample_bylevel': 0.4305990412202251, 'colsample_bynode': 0.9247912989429843, 'min_child_weight': 6.261435181296005, 'gamma': 1.614880310328125, 'reg_alpha': 1.16097187606918, 'reg_lambda': 7.278322158604965e-06, 'max_delta_step': 0.8804153962214141, 'booster': 'dart'}. Best is trial 5 with value: 4.267421513529109.[0m
[32m[I 2026-08-05 15:28:10,570][0m Trial 9 finished with value: 4.212217444879871 and parameters: {'n_estimators': 2600, 'max_depth': 11, 'learning_rate': 0.010210451114512976, 'subsample': 0.8042989210310263, 'colsample_bytree': 0.5921877022041453, 'colsample_bylevel': 0.45547546732951116, 'colsample_bynode': 0.38390575713357794, 'min_child_weight': 3.1528154175096095, 'gamma': 1.8858194078250383, 'reg_alpha': 8.106369361161699e-06, 'reg_lambda': 0.0004667836070663388, 'max_delta_step': 5.624151671161423, 'booster': 'dart'}. Best is trial 9 with value: 4.212217444879871.[0m
[32m[I 2026-08-05 15:28:18,403][0m Trial 10 finished with value: 4.19238985566299 and parameters: {'n_estimators': 2426, 'max_depth': 10, 'learning_rate': 0.024789266725592653, 'subsample': 0.7604291659783494, 'colsample_bytree': 0.6798882787936844, 'colsample_bylevel': 0.3696776943920066, 'colsample_bynode': 0.346116247243465, 'min_child_weight': 1.831036180515998, 'gamma': 1.3436277815966708, 'reg_alpha': 4.935238832609153e-06, 'reg_lambda': 0.0005251713477530264, 'max_delta_step': 6.782689996725036, 'booster': 'gbtree'}. Best is trial 10 with value: 4.19238985566299.[0m
[32m[I 2026-08-05 15:28:27,317][0m Trial 11 finished with value: 4.24159807652873 and parameters: {'n_estimators': 2616, 'max_depth': 10, 'learning_rate': 0.021888759631368264, 'subsample': 0.7196240825130578, 'colsample_bytree': 0.5690342796217913, 'colsample_bylevel': 0.4321610033615318, 'colsample_bynode': 0.4084739108735759, 'min_child_weight': 2.8230459476689918, 'gamma': 1.0308494483824262, 'reg_alpha': 3.0750776394196884e-07, 'reg_lambda': 1.474866844271965e-06, 'max_delta_step': 6.912571156444468, 'booster': 'gbtree'}. Best is trial 10 with value: 4.19238985566299.[0m
[32m[I 2026-08-05 15:28:39,719][0m Trial 12 finished with value: 4.184167372583484 and parameters: {'n_estimators': 2465, 'max_depth': 9, 'learning_rate': 0.014316335318385288, 'subsample': 0.8426161036275458, 'colsample_bytree': 0.864884406642259, 'colsample_bylevel': 0.42543285040060613, 'colsample_bynode': 0.4785055252755239, 'min_child_weight': 2.7315118392551363, 'gamma': 1.9405671947949208, 'reg_alpha': 3.023675666039116e-08, 'reg_lambda': 0.016506946651043033, 'max_delta_step': 5.12472186907994, 'booster': 'dart'}. Best is trial 12 with value: 4.184167372583484.[0m
[32m[I 2026-08-05 15:28:44,149][0m Trial 13 pruned. [0m
[32m[I 2026-08-05 15:28:47,950][0m Trial 14 pruned. [0m
[32m[I 2026-08-05 15:29:06,268][0m Trial 15 finished with value: 4.192726676338841 and parameters: {'n_estimators': 2489, 'max_depth': 10, 'learning_rate': 0.010611253693290674, 'subsample': 0.8979168490650438, 'colsample_bytree': 0.7170373126809223, 'colsample_bylevel': 0.41241406620530285, 'colsample_bynode': 0.8315707305679775, 'min_child_weight': 2.3562456450548748, 'gamma': 1.507797361282267, 'reg_alpha': 3.071328746197067e-07, 'reg_lambda': 6.069007487556154e-07, 'max_delta_step': 3.8875771525936034, 'booster': 'dart'}. Best is trial 12 with value: 4.184167372583484.[0m
[32m[I 2026-08-05 15:29:08,043][0m Trial 16 pruned. [0m
[32m[I 2026-08-05 15:29:20,226][0m Trial 17 finished with value: 4.223437750060171 and parameters: {'n_estimators': 1471, 'max_depth': 7, 'learning_rate': 0.012058804114495229, 'subsample': 0.6605113987268184, 'colsample_bytree': 0.7278785157167698, 'colsample_bylevel': 0.4496311495890868, 'colsample_bynode': 0.4496739518115752, 'min_child_weight': 2.381082959885895, 'gamma': 1.2675361652541228, 'reg_alpha': 5.0750820457120924e-05, 'reg_lambda': 0.017239238983122213, 'max_delta_step': 6.972073556267654, 'booster': 'gbtree'}. Best is trial 12 with value: 4.184167372583484.[0m
[32m[I 2026-08-05 15:29:27,588][0m Trial 18 pruned. [0m
[32m[I 2026-08-05 15:29:29,636][0m Trial 19 pruned. [0m
[32m[I 2026-08-05 15:29:38,995][0m Trial 20 finished with value: 4.189696381216746 and parameters: {'n_estimators': 2747, 'max_depth': 12, 'learning_rate': 0.02611392710321624, 'subsample': 0.6145279474228696, 'colsample_bytree': 0.7620147541603599, 'colsample_bylevel': 0.48814853269997344, 'colsample_bynode': 0.31448753914317923, 'min_child_weight': 2.720898305182463, 'gamma': 1.7691878560361138, 'reg_alpha': 0.006395691747066643, 'reg_lambda': 0.00022715422649420157, 'max_delta_step': 4.363071918397502, 'booster': 'gbtree'}. Best is trial 12 with value: 4.184167372583484.[0m
[32m[I 2026-08-05 15:29:53,533][0m Trial 21 finished with value: 4.252209002247996 and parameters: {'n_estimators': 2719, 'max_depth': 11, 'learning_rate': 0.02419443786582539, 'subsample': 0.634384312856506, 'colsample_bytree': 0.8712278870216957, 'colsample_bylevel': 0.42917039212973424, 'colsample_bynode': 0.43966958207488605, 'min_child_weight': 4.80500577100084, 'gamma': 1.598846313614997, 'reg_alpha': 3.6093638360309677, 'reg_lambda': 0.00021350876145664508, 'max_delta_step': 1.6418756933124223, 'booster': 'gbtree'}. Best is trial 12 with value: 4.184167372583484.[0m
[32m[I 2026-08-05 15:30:04,919][0m Trial 22 finished with value: 4.211186195956039 and parameters: {'n_estimators': 2492, 'max_depth': 11, 'learning_rate': 0.020814335806572472, 'subsample': 0.6737297814459393, 'colsample_bytree': 0.4617790028783831, 'colsample_bylevel': 0.5387737216728947, 'colsample_bynode': 0.40008900846022316, 'min_child_weight': 3.7550494980828173, 'gamma': 1.67428630049623, 'reg_alpha': 0.012549764689183137, 'reg_lambda': 0.9437874010974046, 'max_delta_step': 4.510102023583266, 'booster': 'gbtree'}. Best is trial 12 with value: 4.184167372583484.[0m
[32m[I 2026-08-05 15:30:08,152][0m Trial 23 pruned. [0m
[32m[I 2026-08-05 15:30:24,842][0m Trial 24 finished with value: 4.231646072480219 and parameters: {'n_estimators': 2448, 'max_depth': 9, 'learning_rate': 0.01436321904904199, 'subsample': 0.8528861792412171, 'colsample_bytree': 0.9624854112604578, 'colsample_bylevel': 0.524639701504226, 'colsample_bynode': 0.33653702216912545, 'min_child_weight': 6.967205798581783, 'gamma': 1.9749641458645177, 'reg_alpha': 3.740466407166337e-07, 'reg_lambda': 0.0003212364258147399, 'max_delta_step': 1.991370465366805, 'booster': 'dart'}. Best is trial 12 with value: 4.184167372583484.[0m
[32m[I 2026-08-05 15:30:33,012][0m Trial 25 pruned. [0m
[32m[I 2026-08-05 15:30:39,749][0m Trial 26 pruned. [0m
[32m[I 2026-08-05 15:30:54,043][0m Trial 27 finished with value: 4.197592707796515 and parameters: {'n_estimators': 2905, 'max_depth': 9, 'learning_rate': 0.01655353771115093, 'subsample': 0.7832119018297152, 'colsample_bytree': 0.8591450133366411, 'colsample_bylevel': 0.630434324774604, 'colsample_bynode': 0.6792912445880283, 'min_child_weight': 1.7894176651033935, 'gamma': 1.3803606281721141, 'reg_alpha': 1.0953348427219856e-08, 'reg_lambda': 0.0008597229158930448, 'max_delta_step': 4.863635418119596, 'booster': 'dart'}. Best is trial 12 with value: 4.184167372583484.[0m
[32m[I 2026-08-05 15:31:00,421][0m Trial 28 pruned. [0m
[32m[I 2026-08-05 15:31:11,466][0m Trial 29 pruned. [0m
[32m[I 2026-08-05 15:31:18,569][0m Trial 30 finished with value: 4.172215623047451 and parameters: {'n_estimators': 2057, 'max_depth': 8, 'learning_rate': 0.030388953159705582, 'subsample': 0.8692914663051463, 'colsample_bytree': 0.7281000306146639, 'colsample_bylevel': 0.7580451491193516, 'colsample_bynode': 0.4044141024582824, 'min_child_weight': 1.528713706155578, 'gamma': 1.4838532988346, 'reg_alpha': 3.6778076418682233e-05, 'reg_lambda': 0.002816245274535151, 'max_delta_step': 4.3265839999455356, 'booster': 'gbtree'}. Best is trial 30 with value: 4.172215623047451.[0m
[32m[I 2026-08-05 15:31:32,665][0m Trial 31 finished with value: 4.1896370441605715 and parameters: {'n_estimators': 2212, 'max_depth': 7, 'learning_rate': 0.021349480961860713, 'subsample': 0.852080372375024, 'colsample_bytree': 0.8097987051722337, 'colsample_bylevel': 0.7475042171141966, 'colsample_bynode': 0.47125376160945864, 'min_child_weight': 1.8489529785656238, 'gamma': 1.6817526521627113, 'reg_alpha': 1.4768496059255437e-05, 'reg_lambda': 0.0007728025211793133, 'max_delta_step': 1.877098029509399, 'booster': 'gbtree'}. Best is trial 30 with value: 4.172215623047451.[0m
[32m[I 2026-08-05 15:32:07,490][0m Trial 32 finished with value: 4.336131747251278 and parameters: {'n_estimators': 2324, 'max_depth': 7, 'learning_rate': 0.03206924593073366, 'subsample': 0.7715885614559675, 'colsample_bytree': 0.8473571534642033, 'colsample_bylevel': 0.9136423225040267, 'colsample_bynode': 0.41803937983844675, 'min_child_weight': 1.8394489793952769, 'gamma': 1.759385987482447, 'reg_alpha': 2.1008553377305584e-07, 'reg_lambda': 0.010469211466492375, 'max_delta_step': 0.2659622965420496, 'booster': 'gbtree'}. Best is trial 30 with value: 4.172215623047451.[0m
[32m[I 2026-08-05 15:32:12,422][0m Trial 33 pruned. [0m
[32m[I 2026-08-05 15:32:16,054][0m Trial 34 pruned. [0m
[32m[I 2026-08-05 15:32:18,462][0m Trial 35 pruned. [0m
[32m[I 2026-08-05 15:32:20,711][0m Trial 36 pruned. [0m
[32m[I 2026-08-05 15:32:28,323][0m Trial 37 pruned. [0m
[32m[I 2026-08-05 15:32:57,507][0m Trial 38 finished with value: 4.208311631766471 and parameters: {'n_estimators': 1929, 'max_depth': 8, 'learning_rate': 0.012950172999570408, 'subsample': 0.7708971704417579, 'colsample_bytree': 0.7299398483871902, 'colsample_bylevel': 0.8030467217133197, 'colsample_bynode': 0.6430938214116584, 'min_child_weight': 1.0988268824199645, 'gamma': 1.4806167733650697, 'reg_alpha': 0.007709714622919101, 'reg_lambda': 0.014012356338521959, 'max_delta_step': 1.3006689258900446, 'booster': 'gbtree'}. Best is trial 30 with value: 4.172215623047451.[0m
[32m[I 2026-08-05 15:33:11,422][0m Trial 39 finished with value: 4.314467085754356 and parameters: {'n_estimators': 2344, 'max_depth': 6, 'learning_rate': 0.04570426524738019, 'subsample': 0.9783218957987501, 'colsample_bytree': 0.8965931146439852, 'colsample_bylevel': 0.807610975732707, 'colsample_bynode': 0.5935765772459273, 'min_child_weight': 4.550424034821097, 'gamma': 1.8217471969922467, 'reg_alpha': 0.05930188668079352, 'reg_lambda': 0.0006071522565683361, 'max_delta_step': 0.6312692876696941, 'booster': 'gbtree'}. Best is trial 30 with value: 4.172215623047451.[0m
[32m[I 2026-08-05 15:33:14,476][0m Trial 40 pruned. [0m
[32m[I 2026-08-05 15:33:16,430][0m Trial 41 pruned. [0m
[32m[I 2026-08-05 15:33:27,174][0m Trial 42 finished with value: 4.211825263322595 and parameters: {'n_estimators': 2263, 'max_depth': 8, 'learning_rate': 0.027735065948116065, 'subsample': 0.9422890678973832, 'colsample_bytree': 0.8159117568318458, 'colsample_bylevel': 0.7031144029773049, 'colsample_bynode': 0.364121194874799, 'min_child_weight': 1.9570749179694926, 'gamma': 1.9320341366671632, 'reg_alpha': 1.4495237717848323e-05, 'reg_lambda': 0.0002565443251621778, 'max_delta_step': 1.7947216966657027, 'booster': 'gbtree'}. Best is trial 30 with value: 4.172215623047451.[0m
[32m[I 2026-08-05 15:33:29,375][0m Trial 43 pruned. [0m
[32m[I 2026-08-05 15:33:32,954][0m Trial 44 pruned. [0m
[32m[I 2026-08-05 15:33:37,570][0m Trial 45 pruned. [0m
[32m[I 2026-08-05 15:33:54,133][0m Trial 46 finished with value: 4.230646416940978 and parameters: {'n_estimators': 2733, 'max_depth': 12, 'learning_rate': 0.013992276501737497, 'subsample': 0.6227161369523319, 'colsample_bytree': 0.8607316263690958, 'colsample_bylevel': 0.37641865157901533, 'colsample_bynode': 0.30685778345731474, 'min_child_weight': 2.5185939261181662, 'gamma': 1.1892248164957115, 'reg_alpha': 0.015560740954359461, 'reg_lambda': 0.14402686041765053, 'max_delta_step': 4.759636447195195, 'booster': 'gbtree'}. Best is trial 30 with value: 4.172215623047451.[0m
[32m[I 2026-08-05 15:33:57,314][0m Trial 47 pruned. [0m
[32m[I 2026-08-05 15:34:01,851][0m Trial 48 pruned. [0m
[32m[I 2026-08-05 15:34:08,377][0m Trial 49 finished with value: 4.259714694098928 and parameters: {'n_estimators': 2643, 'max_depth': 11, 'learning_rate': 0.037041919789186376, 'subsample': 0.7218846367236526, 'colsample_bytree': 0.7743094501932569, 'colsample_bylevel': 0.4193019900024314, 'colsample_bynode': 0.35233220216011707, 'min_child_weight': 3.1525393265763375, 'gamma': 1.5821026422777233, 'reg_alpha': 0.2369010529959416, 'reg_lambda': 6.164639610000114e-07, 'max_delta_step': 5.160619634513726, 'booster': 'gbtree'}. Best is trial 30 with value: 4.172215623047451.[0m
[32m[I 2026-08-05 15:34:21,291][0m Trial 50 finished with value: 4.216337770086211 and parameters: {'n_estimators': 1357, 'max_depth': 8, 'learning_rate': 0.02733596811464924, 'subsample': 0.9838607257162671, 'colsample_bytree': 0.742192838788044, 'colsample_bylevel': 0.8207016643361771, 'colsample_bynode': 0.5584765291811282, 'min_child_weight': 1.4390645301843314, 'gamma': 0.7855159241791018, 'reg_alpha': 2.079151615106295e-06, 'reg_lambda': 0.1602026094213704, 'max_delta_step': 1.6854539933128527, 'booster': 'gbtree'}. Best is trial 30 with value: 4.172215623047451.[0m
[32m[I 2026-08-05 15:34:29,272][0m Trial 51 pruned. [0m
[32m[I 2026-08-05 15:34:44,146][0m Trial 52 finished with value: 4.191753627811467 and parameters: {'n_estimators': 2749, 'max_depth': 9, 'learning_rate': 0.015682453467482926, 'subsample': 0.8902938995285999, 'colsample_bytree': 0.7817807503909027, 'colsample_bylevel': 0.4025139084033486, 'colsample_bynode': 0.9315668191389841, 'min_child_weight': 2.357673240536811, 'gamma': 1.8620058596692783, 'reg_alpha': 1.767268641465393e-08, 'reg_lambda': 3.470157547455642e-08, 'max_delta_step': 2.5900913438220927, 'booster': 'gbtree'}. Best is trial 30 with value: 4.172215623047451.[0m
[32m[I 2026-08-05 15:35:05,929][0m Trial 53 finished with value: 4.190257469927962 and parameters: {'n_estimators': 2724, 'max_depth': 9, 'learning_rate': 0.014042601005806524, 'subsample': 0.9543196767703381, 'colsample_bytree': 0.7466468243513344, 'colsample_bylevel': 0.4007240652418971, 'colsample_bynode': 0.9955040157485148, 'min_child_weight': 1.128390751748287, 'gamma': 1.4773269103085551, 'reg_alpha': 3.757230524657805e-08, 'reg_lambda': 2.9456803235840794e-07, 'max_delta_step': 1.846173246057098, 'booster': 'gbtree'}. Best is trial 30 with value: 4.172215623047451.[0m
[32m[I 2026-08-05 15:35:39,627][0m Trial 54 finished with value: 4.235026407331398 and parameters: {'n_estimators': 2836, 'max_depth': 10, 'learning_rate': 0.02319927233305218, 'subsample': 0.9184009143436772, 'colsample_bytree': 0.7332377896058292, 'colsample_bylevel': 0.4556574867460365, 'colsample_bynode': 0.895311958732656, 'min_child_weight': 1.1652117624546023, 'gamma': 1.0351672300564603, 'reg_alpha': 1.449644130183022e-07, 'reg_lambda': 3.33732852640594e-08, 'max_delta_step': 0.5995444013877045, 'booster': 'gbtree'}. Best is trial 30 with value: 4.172215623047451.[0m
[32m[I 2026-08-05 15:35:42,978][0m Trial 55 pruned. [0m
[32m[I 2026-08-05 15:35:56,227][0m Trial 56 finished with value: 4.193144697327935 and parameters: {'n_estimators': 2174, 'max_depth': 10, 'learning_rate': 0.01897053695436094, 'subsample': 0.9094194781234539, 'colsample_bytree': 0.6499962119440229, 'colsample_bylevel': 0.3022441130948824, 'colsample_bynode': 0.9401331128919321, 'min_child_weight': 1.691866487623048, 'gamma': 1.825770552233084, 'reg_alpha': 3.879280774755862e-08, 'reg_lambda': 1.9178112293639404e-08, 'max_delta_step': 2.5175379178774744, 'booster': 'gbtree'}. Best is trial 30 with value: 4.172215623047451.[0m
[32m[I 2026-08-05 15:36:03,375][0m Trial 57 pruned. [0m
[32m[I 2026-08-05 15:36:37,335][0m Trial 58 finished with value: 4.246657460257252 and parameters: {'n_estimators': 1984, 'max_depth': 9, 'learning_rate': 0.014044534297442717, 'subsample': 0.888740504434148, 'colsample_bytree': 0.6791927842886283, 'colsample_bylevel': 0.7281376357744876, 'colsample_bynode': 0.9968471014229783, 'min_child_weight': 2.6414801854533505, 'gamma': 1.9109060279496908, 'reg_alpha': 7.065053901003141e-08, 'reg_lambda': 1.497851310341855e-07, 'max_delta_step': 0.9822487223364317, 'booster': 'gbtree'}. Best is trial 30 with value: 4.172215623047451.[0m
[32m[I 2026-08-05 15:36:42,697][0m Trial 59 pruned. [0m
[32m[I 2026-08-05 15:36:59,817][0m Trial 60 finished with value: 4.216470107124561 and parameters: {'n_estimators': 2634, 'max_depth': 7, 'learning_rate': 0.011781700394402735, 'subsample': 0.9632598439333734, 'colsample_bytree': 0.7322174996409141, 'colsample_bylevel': 0.40431911876813303, 'colsample_bynode': 0.9643553614785703, 'min_child_weight': 1.3029590139381373, 'gamma': 1.4121962854464047, 'reg_alpha': 2.3018493522326435e-07, 'reg_lambda': 5.217965213389385e-05, 'max_delta_step': 2.562546600253044, 'booster': 'gbtree'}. Best is trial 30 with value: 4.172215623047451.[0m
