[32m[I 2026-07-24 11:10:57,724][0m Trial 18 finished with value: 4.563796915959744 and parameters: {'boosting_type': 'gbdt', 'max_depth': 7, 'num_leaves': 201, 'learning_rate': 0.06423117231057557, 'n_estimators': 2525, 'subsample': 0.7491540174256828, 'subsample_freq': 4, 'colsample_bytree': 0.5174932093152108, 'reg_alpha': 1.1675000281136075e-08, 'reg_lambda': 6.227228812074839e-07, 'min_child_samples': 46, 'min_child_weight': 0.08103720002258531, 'min_split_gain': 0.015275097637941222, 'cat_smooth': 39.40479437544058, 'cat_l2': 15.652222174383638}. Best is trial 5 with value: 4.297216683113826.[0m
Training until validation scores don't improve for 30 rounds
Early stopping, best iteration is:
[77]	valid_0's rmse: 4.32614	valid_0's l2: 18.7155
Training until validation scores don't improve for 30 rounds
Early stopping, best iteration is:
[104]	valid_0's rmse: 4.57195	valid_0's l2: 20.9028
Training until validation scores don't improve for 30 rounds
Early stopping, best iteration is:
[69]	valid_0's rmse: 4.25734	valid_0's l2: 18.125
Training until validation scores don't improve for 30 rounds
Early stopping, best iteration is:
[42]	valid_0's rmse: 5.12645	valid_0's l2: 26.2805
Training until validation scores don't improve for 30 rounds
Early stopping, best iteration is:
[64]	valid_0's rmse: 4.46816	valid_0's l2: 19.9645
[32m[I 2026-07-24 11:10:58,860][0m Trial 19 finished with value: 4.550009199877296 and parameters: {'boosting_type': 'gbdt', 'max_depth': 6, 'num_leaves': 239, 'learning_rate': 0.16762005100562177, 'n_estimators': 1980, 'subsample': 0.6555230826661727, 'subsample_freq': 8, 'colsample_bytree': 0.6481152720029172, 'reg_alpha': 4.3918560358086856e-07, 'reg_lambda': 0.000109643496455972, 'min_child_samples': 16, 'min_child_weight': 0.027646024422762983, 'min_split_gain': 0.11661632701787483, 'cat_smooth': 42.670722215089164, 'cat_l2': 37.42899083388926}. Best is trial 5 with value: 4.297216683113826.[0m
Training until validation scores don't improve for 30 rounds
Early stopping, best iteration is:
[80]	valid_0's rmse: 4.48678	valid_0's l2: 20.1312
Training until validation scores don't improve for 30 rounds
Early stopping, best iteration is:
[76]	valid_0's rmse: 4.22174	valid_0's l2: 17.8231
Training until validation scores don't improve for 30 rounds
Early stopping, best iteration is:
[225]	valid_0's rmse: 3.73809	valid_0's l2: 13.9733
Training until validation scores don't improve for 30 rounds
Early stopping, best iteration is:
[81]	valid_0's rmse: 4.65053	valid_0's l2: 21.6275
Training until validation scores don't improve for 30 rounds
Early stopping, best iteration is:
[200]	valid_0's rmse: 4.28752	valid_0's l2: 18.3828
[32m[I 2026-07-24 11:11:02,636][0m Trial 20 finished with value: 4.276932054392963 and parameters: {'boosting_type': 'gbdt', 'max_depth': 10, 'num_leaves': 191, 'learning_rate': 0.06630427692127172, 'n_estimators': 2246, 'subsample': 0.8567441880400792, 'subsample_freq': 5, 'colsample_bytree': 0.7592802509115789, 'reg_alpha': 1.6344535462585371e-06, 'reg_lambda': 2.264467523958057e-07, 'min_child_samples': 5, 'min_child_weight': 0.0321058839377235, 'min_split_gain': 0.26455318783752513, 'cat_smooth': 29.487850005602965, 'cat_l2': 0.2808827541758987}. Best is trial 20 with value: 4.276932054392963.[0m
Training until validation scores don't improve for 30 rounds
Early stopping, best iteration is:
[57]	valid_0's rmse: 4.38234	valid_0's l2: 19.2049
Training until validation scores don't improve for 30 rounds
Early stopping, best iteration is:
[81]	valid_0's rmse: 4.24043	valid_0's l2: 17.9813
Training until validation scores don't improve for 30 rounds
Early stopping, best iteration is:
[267]	valid_0's rmse: 3.87607	valid_0's l2: 15.0239
Training until validation scores don't improve for 30 rounds
Early stopping, best iteration is:
[124]	valid_0's rmse: 4.71884	valid_0's l2: 22.2674
Training until validation scores don't improve for 30 rounds
Early stopping, best iteration is:
[201]	valid_0's rmse: 4.22126	valid_0's l2: 17.8191
[32m[I 2026-07-24 11:11:07,255][0m Trial 21 finished with value: 4.2878356949760805 and parameters: {'boosting_type': 'gbdt', 'max_depth': 10, 'num_leaves': 197, 'learning_rate': 0.060840037198964914, 'n_estimators': 2263, 'subsample': 0.8591984592078709, 'subsample_freq': 5, 'colsample_bytree': 0.8008410834065427, 'reg_alpha': 1.5346929166063795e-06, 'reg_lambda': 4.043348229982824e-07, 'min_child_samples': 5, 'min_child_weight': 0.02960505134981987, 'min_split_gain': 0.26419015166769444, 'cat_smooth': 28.292450998595505, 'cat_l2': 0.2964520830783916}. Best is trial 20 with value: 4.276932054392963.[0m
Training until validation scores don't improve for 30 rounds
Early stopping, best iteration is:
[143]	valid_0's rmse: 4.31303	valid_0's l2: 18.6022
Training until validation scores don't improve for 30 rounds
Early stopping, best iteration is:
[83]	valid_0's rmse: 4.25118	valid_0's l2: 18.0725
Training until validation scores don't improve for 30 rounds
Early stopping, best iteration is:
[311]	valid_0's rmse: 3.99075	valid_0's l2: 15.9261
Training until validation scores don't improve for 30 rounds
Early stopping, best iteration is:
[170]	valid_0's rmse: 4.778	valid_0's l2: 22.8293
Training until validation scores don't improve for 30 rounds
Early stopping, best iteration is:
[216]	valid_0's rmse: 4.30361	valid_0's l2: 18.521
[32m[I 2026-07-24 11:11:10,945][0m Trial 22 finished with value: 4.327313225241566 and parameters: {'boosting_type': 'gbdt', 'max_depth': 10, 'num_leaves': 181, 'learning_rate': 0.05859179368632154, 'n_estimators': 2256, 'subsample': 0.944832254476198, 'subsample_freq': 5, 'colsample_bytree': 0.8126215336090237, 'reg_alpha': 2.235626356725155e-06, 'reg_lambda': 2.401947530525129e-07, 'min_child_samples': 15, 'min_child_weight': 0.010523974901401504, 'min_split_gain': 0.2826532062604397, 'cat_smooth': 28.012186774559183, 'cat_l2': 3.2514599657577734}. Best is trial 20 with value: 4.276932054392963.[0m
Training until validation scores don't improve for 30 rounds
Early stopping, best iteration is:
[241]	valid_0's rmse: 4.35196	valid_0's l2: 18.9396
Training until validation scores don't improve for 30 rounds
Early stopping, best iteration is:
[259]	valid_0's rmse: 4.50696	valid_0's l2: 20.3127
Training until validation scores don't improve for 30 rounds
Early stopping, best iteration is:
[476]	valid_0's rmse: 4.04312	valid_0's l2: 16.3468
Training until validation scores don't improve for 30 rounds
Early stopping, best iteration is:
[352]	valid_0's rmse: 4.66271	valid_0's l2: 21.7408
Training until validation scores don't improve for 30 rounds
Early stopping, best iteration is:
[396]	valid_0's rmse: 4.24118	valid_0's l2: 17.9876
[32m[I 2026-07-24 11:11:15,848][0m Trial 23 finished with value: 4.361186607586619 and parameters: {'boosting_type': 'gbdt', 'max_depth': 10, 'num_leaves': 221, 'learning_rate': 0.03145954003371757, 'n_estimators': 1870, 'subsample': 0.856340352003517, 'subsample_freq': 4, 'colsample_bytree': 0.7749441343018648, 'reg_alpha': 7.144573918629452e-08, 'reg_lambda': 1.4788350684374574e-06, 'min_child_samples': 24, 'min_child_weight': 0.04495239272882036, 'min_split_gain': 0.1368212299877024, 'cat_smooth': 29.334332428481027, 'cat_l2': 0.4837441651463801}. Best is trial 20 with value: 4.276932054392963.[0m
Training until validation scores don't improve for 30 rounds
Early stopping, best iteration is:
[75]	valid_0's rmse: 4.47022	valid_0's l2: 19.9829
Training until validation scores don't improve for 30 rounds
Early stopping, best iteration is:
[160]	valid_0's rmse: 4.16017	valid_0's l2: 17.307
Training until validation scores don't improve for 30 rounds
Early stopping, best iteration is:
[129]	valid_0's rmse: 4.02593	valid_0's l2: 16.2081
Training until validation scores don't improve for 30 rounds
Early stopping, best iteration is:
[120]	valid_0's rmse: 4.57437	valid_0's l2: 20.9249
Training until validation scores don't improve for 30 rounds
Early stopping, best iteration is:
[183]	valid_0's rmse: 4.45203	valid_0's l2: 19.8206
[32m[I 2026-07-24 11:11:18,780][0m Trial 24 finished with value: 4.33654615797956 and parameters: {'boosting_type': 'gbdt', 'max_depth': 14, 'num_leaves': 138, 'learning_rate': 0.07549237993194743, 'n_estimators': 2384, 'subsample': 0.8441811834021302, 'subsample_freq': 5, 'colsample_bytree': 0.9642728775539076, 'reg_alpha': 1.6544088246014548e-06, 'reg_lambda': 9.998638355585925e-08, 'min_child_samples': 14, 'min_child_weight': 0.0016692568977469012, 'min_split_gain': 0.4976410049895919, 'cat_smooth': 24.347719884536072, 'cat_l2': 6.506509561756232}. Best is trial 20 with value: 4.276932054392963.[0m
Training until validation scores don't improve for 30 rounds
Early stopping, best iteration is:
[453]	valid_0's rmse: 4.47771	valid_0's l2: 20.0499
Training until validation scores don't improve for 30 rounds
Early stopping, best iteration is:
[402]	valid_0's rmse: 4.52003	valid_0's l2: 20.4307
[32m[I 2026-07-24 11:11:21,013][0m Trial 25 pruned. [0m
[32m[I 2026-07-24 11:11:36,640][0m Trial 26 pruned. [0m
Training until validation scores don't improve for 30 rounds
Early stopping, best iteration is:
[352]	valid_0's rmse: 4.3343	valid_0's l2: 18.7862
Training until validation scores don't improve for 30 rounds
Early stopping, best iteration is:
[383]	valid_0's rmse: 4.09289	valid_0's l2: 16.7518
Training until validation scores don't improve for 30 rounds
Early stopping, best iteration is:
[497]	valid_0's rmse: 3.83891	valid_0's l2: 14.7372
Training until validation scores don't improve for 30 rounds
Early stopping, best iteration is:
[334]	valid_0's rmse: 4.82777	valid_0's l2: 23.3074
Training until validation scores don't improve for 30 rounds
Early stopping, best iteration is:
[399]	valid_0's rmse: 4.03671	valid_0's l2: 16.2951
[32m[I 2026-07-24 11:11:50,483][0m Trial 27 finished with value: 4.226117376255748 and parameters: {'boosting_type': 'gbdt', 'max_depth': 13, 'num_leaves': 184, 'learning_rate': 0.014033561477742575, 'n_estimators': 2673, 'subsample': 0.8387367699572772, 'subsample_freq': 8, 'colsample_bytree': 0.8020789338477624, 'reg_alpha': 2.693605101548633e-06, 'reg_lambda': 1.2491428268099701e-06, 'min_child_samples': 5, 'min_child_weight': 0.0991927233514845, 'min_split_gain': 0.3796109619730875, 'cat_smooth': 24.02246016961098, 'cat_l2': 0.05257299566305046}. Best is trial 27 with value: 4.226117376255748.[0m
Training until validation scores don't improve for 30 rounds
Early stopping, best iteration is:
[784]	valid_0's rmse: 4.43986	valid_0's l2: 19.7123
Training until validation scores don't improve for 30 rounds
Early stopping, best iteration is:
[512]	valid_0's rmse: 4.58672	valid_0's l2: 21.038
Training until validation scores don't improve for 30 rounds
Early stopping, best iteration is:
[878]	valid_0's rmse: 4.26517	valid_0's l2: 18.1917
[32m[I 2026-07-24 11:11:55,239][0m Trial 28 pruned. [0m
[32m[I 2026-07-24 11:12:02,920][0m Trial 29 pruned. [0m
Training until validation scores don't improve for 30 rounds
Early stopping, best iteration is:
[393]	valid_0's rmse: 4.36069	valid_0's l2: 19.0156
Training until validation scores don't improve for 30 rounds
Early stopping, best iteration is:
[330]	valid_0's rmse: 4.25767	valid_0's l2: 18.1278
Training until validation scores don't improve for 30 rounds
Early stopping, best iteration is:
[419]	valid_0's rmse: 4.01252	valid_0's l2: 16.1003
Training until validation scores don't improve for 30 rounds
Early stopping, best iteration is:
[325]	valid_0's rmse: 4.93715	valid_0's l2: 24.3755
Training until validation scores don't improve for 30 rounds
Early stopping, best iteration is:
[226]	valid_0's rmse: 4.09779	valid_0's l2: 16.7919
[32m[I 2026-07-24 11:12:08,771][0m Trial 30 finished with value: 4.333164061835402 and parameters: {'boosting_type': 'gbdt', 'max_depth': 11, 'num_leaves': 178, 'learning_rate': 0.02910295202573123, 'n_estimators': 2788, 'subsample': 0.9998742124489957, 'subsample_freq': 9, 'colsample_bytree': 0.9297358309465046, 'reg_alpha': 0.00036114972447454617, 'reg_lambda': 3.570086147175627e-05, 'min_child_samples': 12, 'min_child_weight': 0.04756432750755505, 'min_split_gain': 0.20788890039097763, 'cat_smooth': 1.2824085415017237, 'cat_l2': 4.762961629599653}. Best is trial 27 with value: 4.226117376255748.[0m
Training until validation scores don't improve for 30 rounds
Early stopping, best iteration is:
[90]	valid_0's rmse: 4.21466	valid_0's l2: 17.7634
Training until validation scores don't improve for 30 rounds
Early stopping, best iteration is:
[51]	valid_0's rmse: 4.14693	valid_0's l2: 17.1971
Training until validation scores don't improve for 30 rounds
Early stopping, best iteration is:
[105]	valid_0's rmse: 3.91541	valid_0's l2: 15.3304
Training until validation scores don't improve for 30 rounds
Early stopping, best iteration is:
[76]	valid_0's rmse: 4.50433	valid_0's l2: 20.289
Training until validation scores don't improve for 30 rounds
Early stopping, best iteration is:
[114]	valid_0's rmse: 4.18504	valid_0's l2: 17.5145
[32m[I 2026-07-24 11:12:11,370][0m Trial 31 finished with value: 4.193275123349019 and parameters: {'boosting_type': 'gbdt', 'max_depth': 13, 'num_leaves': 207, 'learning_rate': 0.07972853697737219, 'n_estimators': 2528, 'subsample': 0.7687144407189006, 'subsample_freq': 7, 'colsample_bytree': 0.8086225090939069, 'reg_alpha': 7.755813775235473e-08, 'reg_lambda': 8.693640448011097e-08, 'min_child_samples': 5, 'min_child_weight': 0.018507434686991182, 'min_split_gain': 0.33666075222263486, 'cat_smooth': 24.624194552982143, 'cat_l2': 9.879759171368914}. Best is trial 31 with value: 4.193275123349019.[0m
Training until validation scores don't improve for 30 rounds
Early stopping, best iteration is:
[72]	valid_0's rmse: 4.3561	valid_0's l2: 18.9756
Training until validation scores don't improve for 30 rounds
Early stopping, best iteration is:
[51]	valid_0's rmse: 4.29037	valid_0's l2: 18.4073
Training until validation scores don't improve for 30 rounds
Early stopping, best iteration is:
[84]	valid_0's rmse: 3.81802	valid_0's l2: 14.5772
Training until validation scores don't improve for 30 rounds
Early stopping, best iteration is:
[49]	valid_0's rmse: 4.5931	valid_0's l2: 21.0965
Training until validation scores don't improve for 30 rounds
Early stopping, best iteration is:
[78]	valid_0's rmse: 4.3893	valid_0's l2: 19.266
[32m[I 2026-07-24 11:12:13,956][0m Trial 32 finished with value: 4.289376013931767 and parameters: {'boosting_type': 'gbdt', 'max_depth': 13, 'num_leaves': 233, 'learning_rate': 0.08582076027919937, 'n_estimators': 2590, 'subsample': 0.7778189651077828, 'subsample_freq': 7, 'colsample_bytree': 0.8269988313304001, 'reg_alpha': 9.200063202524119e-08, 'reg_lambda': 6.926296663120378e-07, 'min_child_samples': 5, 'min_child_weight': 0.01997290597340329, 'min_split_gain': 0.3821393949065767, 'cat_smooth': 22.880048370636583, 'cat_l2': 11.322471757116183}. Best is trial 31 with value: 4.193275123349019.[0m
Training until validation scores don't improve for 30 rounds
Early stopping, best iteration is:
[328]	valid_0's rmse: 4.57318	valid_0's l2: 20.9139
Training until validation scores don't improve for 30 rounds
Early stopping, best iteration is:
[363]	valid_0's rmse: 4.34662	valid_0's l2: 18.8931
[32m[I 2026-07-24 11:12:15,694][0m Trial 33 pruned. [0m
[32m[I 2026-07-24 11:12:46,943][0m Trial 34 finished with value: 4.220529300973462 and parameters: {'boosting_type': 'dart', 'max_depth': 11, 'num_leaves': 190, 'learning_rate': 0.030252373987271593, 'n_estimators': 2806, 'subsample': 0.8348134979782805, 'subsample_freq': 8, 'colsample_bytree': 0.7007327833677982, 'reg_alpha': 5.343611414487081e-06, 'reg_lambda': 4.243028948593482e-06, 'min_child_samples': 12, 'min_child_weight': 0.09805966672593529, 'min_split_gain': 0.4549074649806149, 'cat_smooth': 16.827223634994958, 'cat_l2': 3.2989375452102596, 'drop_rate': 0.15525870591280835, 'max_drop': 1, 'skip_drop': 0.18792572659193343}. Best is trial 31 with value: 4.193275123349019.[0m
[32m[I 2026-07-24 11:13:19,696][0m Trial 35 finished with value: 4.21991127139548 and parameters: {'boosting_type': 'dart', 'max_depth': 11, 'num_leaves': 155, 'learning_rate': 0.02711121988037711, 'n_estimators': 2998, 'subsample': 0.8226940754256984, 'subsample_freq': 8, 'colsample_bytree': 0.6649621934569596, 'reg_alpha': 6.548062852566303e-06, 'reg_lambda': 3.7177028391843044e-06, 'min_child_samples': 13, 'min_child_weight': 0.059380844566714115, 'min_split_gain': 0.4715081998964914, 'cat_smooth': 15.589217346411232, 'cat_l2': 3.182283631406268, 'drop_rate': 0.16536309623454618, 'max_drop': 1, 'skip_drop': 0.18987457479896916}. Best is trial 31 with value: 4.193275123349019.[0m
[32m[I 2026-07-24 11:13:40,171][0m Trial 36 finished with value: 4.322553519166581 and parameters: {'boosting_type': 'dart', 'max_depth': 12, 'num_leaves': 149, 'learning_rate': 0.03271215241414484, 'n_estimators': 3000, 'subsample': 0.6768338121862589, 'subsample_freq': 8, 'colsample_bytree': 0.6931661833678018, 'reg_alpha': 3.639607240742156e-05, 'reg_lambda': 6.035364849705492e-06, 'min_child_samples': 28, 'min_child_weight': 0.0947090818982481, 'min_split_gain': 0.58645922369598, 'cat_smooth': 6.434221923956178, 'cat_l2': 4.762871524707952, 'drop_rate': 0.16672604200312427, 'max_drop': 1, 'skip_drop': 0.19212852125009405}. Best is trial 31 with value: 4.193275123349019.[0m
[32m[I 2026-07-24 11:13:59,500][0m Trial 37 pruned. [0m
[32m[I 2026-07-24 11:14:04,072][0m Trial 38 pruned. [0m
[32m[I 2026-07-24 11:14:19,049][0m Trial 39 pruned. [0m
[32m[I 2026-07-24 11:14:56,641][0m Trial 40 pruned. [0m
[32m[I 2026-07-24 11:15:26,863][0m Trial 41 pruned. [0m
[32m[I 2026-07-24 11:15:45,041][0m Trial 42 pruned. [0m
[32m[I 2026-07-24 11:16:15,988][0m Trial 43 finished with value: 4.296789037562671 and parameters: {'boosting_type': 'dart', 'max_depth': 9, 'num_leaves': 172, 'learning_rate': 0.05215168456520633, 'n_estimators': 3000, 'subsample': 0.8791046018200599, 'subsample_freq': 8, 'colsample_bytree': 0.7782869815880883, 'reg_alpha': 4.2513420386399576e-08, 'reg_lambda': 1.2021122476106285e-06, 'min_child_samples': 28, 'min_child_weight': 0.05385034179486787, 'min_split_gain': 0.5486989050581258, 'cat_smooth': 19.339826121448617, 'cat_l2': 4.365603401790642, 'drop_rate': 0.1267464539495952, 'max_drop': 6, 'skip_drop': 0.17970834968109947}. Best is trial 31 with value: 4.193275123349019.[0m
[32m[I 2026-07-24 11:16:53,651][0m Trial 44 pruned. [0m
[32m[I 2026-07-24 11:17:09,260][0m Trial 45 pruned. [0m
[32m[I 2026-07-24 11:17:51,538][0m Trial 46 finished with value: 4.220016857947771 and parameters: {'boosting_type': 'dart', 'max_depth': 12, 'num_leaves': 236, 'learning_rate': 0.1379284693309781, 'n_estimators': 2475, 'subsample': 0.7988122984972191, 'subsample_freq': 6, 'colsample_bytree': 0.8432682415416217, 'reg_alpha': 1.937785684224826e-05, 'reg_lambda': 5.5161058685337725e-08, 'min_child_samples': 10, 'min_child_weight': 0.037115470370489415, 'min_split_gain': 0.1919092756190009, 'cat_smooth': 13.789767800043437, 'cat_l2': 1.7303703465876556, 'drop_rate': 0.1404791570387697, 'max_drop': 6, 'skip_drop': 0.13036479304403625}. Best is trial 31 with value: 4.193275123349019.[0m
[32m[I 2026-07-24 11:18:01,064][0m Trial 47 pruned. [0m
[32m[I 2026-07-24 11:18:24,590][0m Trial 48 pruned. [0m
