============================================================
lightgbm — 运行开始  20260724_110941
  输出目录:  runs\AW_ST_CMC\AW_ST_CMC_lightgbm_20260724_110941
============================================================
============================================================
LightGBM + PharmHGT-style Featurization for AW_ST_CMC Prediction
============================================================
[Cache HIT] Loading features from data\features\surfpro\AW_ST_CMC
  Train features: (843, 522)
  Test features:  (70, 522)

Split: Train 737, Val 106, Test 70

============================================================
Optuna Hyperparameter Tuning (50 trials, 5-Fold CV)
============================================================
[32m[I 2026-07-24 11:09:47,210][0m Trial 0 finished with value: 22.216519168918445 and parameters: {'boosting_type': 'dart', 'max_depth': 12, 'num_leaves': 159, 'learning_rate': 0.009470976192691145, 'n_estimators': 890, 'subsample': 0.5290418060840998, 'subsample_freq': 9, 'colsample_bytree': 0.7207805082202461, 'reg_alpha': 0.023585940584142682, 'reg_lambda': 1.5320059381854043e-08, 'min_child_samples': 98, 'min_child_weight': 0.021368329072358756, 'min_split_gain': 0.21233911067827616, 'cat_smooth': 9.091248360355031, 'cat_l2': 9.17022549267169, 'drop_rate': 0.09823025045826593, 'max_drop': 27, 'skip_drop': 0.13526405540621358}. Best is trial 0 with value: 22.216519168918445.[0m
[32m[I 2026-07-24 11:10:01,249][0m Trial 1 finished with value: 9.322695858963433 and parameters: {'boosting_type': 'dart', 'max_depth': 4, 'num_leaves': 85, 'learning_rate': 0.02240870575939826, 'n_estimators': 1640, 'subsample': 0.8925879806965068, 'subsample_freq': 2, 'colsample_bytree': 0.6599641068895281, 'reg_alpha': 0.0021465011216654484, 'reg_lambda': 2.6185068507773707e-08, 'min_child_samples': 63, 'min_child_weight': 4.809461967501571e-05, 'min_split_gain': 0.06505159298527952, 'cat_smooth': 47.44427686266666, 'cat_l2': 48.28160165372797, 'drop_rate': 0.24443523095377373, 'max_drop': 16, 'skip_drop': 0.03832491306185132}. Best is trial 1 with value: 9.322695858963433.[0m
Training until validation scores don't improve for 30 rounds
Early stopping, best iteration is:
[1033]	valid_0's rmse: 4.72271	valid_0's l2: 22.304
Training until validation scores don't improve for 30 rounds
Early stopping, best iteration is:
[1491]	valid_0's rmse: 4.72466	valid_0's l2: 22.3224
Training until validation scores don't improve for 30 rounds
Early stopping, best iteration is:
[1168]	valid_0's rmse: 4.65993	valid_0's l2: 21.715
Training until validation scores don't improve for 30 rounds
Early stopping, best iteration is:
[1403]	valid_0's rmse: 4.74215	valid_0's l2: 22.488
Training until validation scores don't improve for 30 rounds
Early stopping, best iteration is:
[1295]	valid_0's rmse: 4.52636	valid_0's l2: 20.4879
[32m[I 2026-07-24 11:10:09,769][0m Trial 2 finished with value: 4.6751630182480595 and parameters: {'boosting_type': 'gbdt', 'max_depth': 4, 'num_leaves': 134, 'learning_rate': 0.005755963034165359, 'n_estimators': 2774, 'subsample': 0.6293899908000085, 'subsample_freq': 7, 'colsample_bytree': 0.5181977532625877, 'reg_alpha': 0.0004793052550782129, 'reg_lambda': 0.0008325158565947976, 'min_child_samples': 22, 'min_child_weight': 0.07556810141274425, 'min_split_gain': 0.7751328233611146, 'cat_smooth': 46.97494707820945, 'cat_l2': 44.74136752138244}. Best is trial 2 with value: 4.6751630182480595.[0m
[32m[I 2026-07-24 11:10:17,761][0m Trial 3 finished with value: 21.655966273574677 and parameters: {'boosting_type': 'dart', 'max_depth': 4, 'num_leaves': 62, 'learning_rate': 0.006017151754328819, 'n_estimators': 1313, 'subsample': 0.6943386448447411, 'subsample_freq': 3, 'colsample_bytree': 0.8801162564063505, 'reg_alpha': 1.6247252885719427e-05, 'reg_lambda': 3.376063348877853e-06, 'min_child_samples': 57, 'min_child_weight': 3.661819220392426e-05, 'min_split_gain': 0.8021969807540397, 'cat_smooth': 3.727532183988541, 'cat_l2': 49.34434683002586, 'drop_rate': 0.23395098309603066, 'max_drop': 10, 'skip_drop': 0.011601413965844696}. Best is trial 2 with value: 4.6751630182480595.[0m
Training until validation scores don't improve for 30 rounds
Early stopping, best iteration is:
[791]	valid_0's rmse: 4.7377	valid_0's l2: 22.4458
Training until validation scores don't improve for 30 rounds
Early stopping, best iteration is:
[597]	valid_0's rmse: 5.08037	valid_0's l2: 25.8102
Training until validation scores don't improve for 30 rounds
Did not meet early stopping. Best iteration is:
[1391]	valid_0's rmse: 4.51696	valid_0's l2: 20.403
Training until validation scores don't improve for 30 rounds
Early stopping, best iteration is:
[802]	valid_0's rmse: 4.78375	valid_0's l2: 22.8843
Training until validation scores don't improve for 30 rounds
Early stopping, best iteration is:
[1314]	valid_0's rmse: 4.56172	valid_0's l2: 20.8092
[32m[I 2026-07-24 11:10:22,891][0m Trial 4 finished with value: 4.736101020927594 and parameters: {'boosting_type': 'gbdt', 'max_depth': 12, 'num_leaves': 200, 'learning_rate': 0.006770684770701556, 'n_estimators': 1396, 'subsample': 0.5579345297625649, 'subsample_freq': 9, 'colsample_bytree': 0.7363086887792905, 'reg_alpha': 9.507847858536042e-06, 'reg_lambda': 3.732717755563729e-08, 'min_child_samples': 34, 'min_child_weight': 0.00019986340778528852, 'min_split_gain': 0.7296061783380641, 'cat_smooth': 31.877873567760656, 'cat_l2': 44.36063712881633}. Best is trial 2 with value: 4.6751630182480595.[0m
Training until validation scores don't improve for 30 rounds
Early stopping, best iteration is:
[128]	valid_0's rmse: 4.3833	valid_0's l2: 19.2133
Training until validation scores don't improve for 30 rounds
Early stopping, best iteration is:
[124]	valid_0's rmse: 4.264	valid_0's l2: 18.1817
Training until validation scores don't improve for 30 rounds
Early stopping, best iteration is:
[318]	valid_0's rmse: 3.95791	valid_0's l2: 15.6651
Training until validation scores don't improve for 30 rounds
Early stopping, best iteration is:
[185]	valid_0's rmse: 4.66305	valid_0's l2: 21.744
Training until validation scores don't improve for 30 rounds
Early stopping, best iteration is:
[230]	valid_0's rmse: 4.21782	valid_0's l2: 17.79
[32m[I 2026-07-24 11:10:26,648][0m Trial 5 finished with value: 4.297216683113826 and parameters: {'boosting_type': 'gbdt', 'max_depth': 12, 'num_leaves': 198, 'learning_rate': 0.04977436807314311, 'n_estimators': 2428, 'subsample': 0.7468977981821954, 'subsample_freq': 6, 'colsample_bytree': 0.5992787128509847, 'reg_alpha': 1.6934490731313353e-08, 'reg_lambda': 9.354548757337708e-08, 'min_child_samples': 8, 'min_child_weight': 0.003512704726270845, 'min_split_gain': 0.3143559810763267, 'cat_smooth': 25.42853455823514, 'cat_l2': 45.37832369630465}. Best is trial 5 with value: 4.297216683113826.[0m
[32m[I 2026-07-24 11:10:29,102][0m Trial 6 pruned. [0m
[32m[I 2026-07-24 11:10:34,460][0m Trial 7 pruned. [0m
Training until validation scores don't improve for 30 rounds
Early stopping, best iteration is:
[333]	valid_0's rmse: 5.02473	valid_0's l2: 25.2479
Training until validation scores don't improve for 30 rounds
Early stopping, best iteration is:
[370]	valid_0's rmse: 5.47583	valid_0's l2: 29.9847
Training until validation scores don't improve for 30 rounds
Early stopping, best iteration is:
[410]	valid_0's rmse: 5.1447	valid_0's l2: 26.468
Training until validation scores don't improve for 30 rounds
Early stopping, best iteration is:
[467]	valid_0's rmse: 5.10154	valid_0's l2: 26.0258
Training until validation scores don't improve for 30 rounds
Early stopping, best iteration is:
[590]	valid_0's rmse: 5.05545	valid_0's l2: 25.5576
[32m[I 2026-07-24 11:10:36,037][0m Trial 8 finished with value: 5.160451063365968 and parameters: {'boosting_type': 'gbdt', 'max_depth': 3, 'num_leaves': 161, 'learning_rate': 0.03915699341344363, 'n_estimators': 628, 'subsample': 0.6393232321183058, 'subsample_freq': 10, 'colsample_bytree': 0.46769332346688064, 'reg_alpha': 2.0139739500176936e-07, 'reg_lambda': 0.0002541410632209718, 'min_child_samples': 99, 'min_child_weight': 9.294394155644992e-05, 'min_split_gain': 0.6721355474058786, 'cat_smooth': 38.08098076643588, 'cat_l2': 11.881877199619984}. Best is trial 5 with value: 4.297216683113826.[0m
Training until validation scores don't improve for 30 rounds
Early stopping, best iteration is:
[347]	valid_0's rmse: 4.73485	valid_0's l2: 22.4188
Training until validation scores don't improve for 30 rounds
Early stopping, best iteration is:
[380]	valid_0's rmse: 4.8969	valid_0's l2: 23.9796
Training until validation scores don't improve for 30 rounds
Did not meet early stopping. Best iteration is:
[717]	valid_0's rmse: 4.32885	valid_0's l2: 18.7389
Training until validation scores don't improve for 30 rounds
Early stopping, best iteration is:
[225]	valid_0's rmse: 4.77929	valid_0's l2: 22.8416
Training until validation scores don't improve for 30 rounds
Early stopping, best iteration is:
[574]	valid_0's rmse: 4.45437	valid_0's l2: 19.8415
[32m[I 2026-07-24 11:10:38,434][0m Trial 9 finished with value: 4.6388512862920255 and parameters: {'boosting_type': 'gbdt', 'max_depth': 11, 'num_leaves': 167, 'learning_rate': 0.044839259184207204, 'n_estimators': 725, 'subsample': 0.917651247794619, 'subsample_freq': 4, 'colsample_bytree': 0.4305629572798979, 'reg_alpha': 2.3279640748356466e-08, 'reg_lambda': 0.0020798714270728416, 'min_child_samples': 70, 'min_child_weight': 1.1650681118986128e-05, 'min_split_gain': 0.512093058299281, 'cat_smooth': 11.324788759896897, 'cat_l2': 32.25863952047249}. Best is trial 5 with value: 4.297216683113826.[0m
Training until validation scores don't improve for 30 rounds
Early stopping, best iteration is:
[59]	valid_0's rmse: 4.44996	valid_0's l2: 19.8021
Training until validation scores don't improve for 30 rounds
Early stopping, best iteration is:
[79]	valid_0's rmse: 4.50108	valid_0's l2: 20.2597
Training until validation scores don't improve for 30 rounds
Early stopping, best iteration is:
[70]	valid_0's rmse: 4.09276	valid_0's l2: 16.7507
Training until validation scores don't improve for 30 rounds
Early stopping, best iteration is:
[32]	valid_0's rmse: 4.76685	valid_0's l2: 22.7229
Training until validation scores don't improve for 30 rounds
Early stopping, best iteration is:
[68]	valid_0's rmse: 4.17391	valid_0's l2: 17.4216
[32m[I 2026-07-24 11:10:39,452][0m Trial 10 finished with value: 4.396914081466045 and parameters: {'boosting_type': 'gbdt', 'max_depth': 8, 'num_leaves': 16, 'learning_rate': 0.227364806419381, 'n_estimators': 2938, 'subsample': 0.8139601740123973, 'subsample_freq': 6, 'colsample_bytree': 0.31464890149101077, 'reg_alpha': 3.331630946893803, 'reg_lambda': 0.04422317327084487, 'min_child_samples': 7, 'min_child_weight': 0.002949971987301989, 'min_split_gain': 0.34052523698531706, 'cat_smooth': 21.71781358782057, 'cat_l2': 23.63570033289743}. Best is trial 5 with value: 4.297216683113826.[0m
Training until validation scores don't improve for 30 rounds
Early stopping, best iteration is:
[36]	valid_0's rmse: 4.40556	valid_0's l2: 19.409
Training until validation scores don't improve for 30 rounds
Early stopping, best iteration is:
[37]	valid_0's rmse: 4.42963	valid_0's l2: 19.6216
Training until validation scores don't improve for 30 rounds
Early stopping, best iteration is:
[94]	valid_0's rmse: 3.97504	valid_0's l2: 15.801
Training until validation scores don't improve for 30 rounds
Early stopping, best iteration is:
[28]	valid_0's rmse: 4.50573	valid_0's l2: 20.3016
Training until validation scores don't improve for 30 rounds
Early stopping, best iteration is:
[13]	valid_0's rmse: 4.30038	valid_0's l2: 18.4932
[32m[I 2026-07-24 11:10:40,433][0m Trial 11 finished with value: 4.323267967080149 and parameters: {'boosting_type': 'gbdt', 'max_depth': 8, 'num_leaves': 17, 'learning_rate': 0.23953129153336494, 'n_estimators': 2928, 'subsample': 0.8078766364822536, 'subsample_freq': 6, 'colsample_bytree': 0.32115714350578634, 'reg_alpha': 0.9465205392725847, 'reg_lambda': 0.03437860194381641, 'min_child_samples': 8, 'min_child_weight': 0.003605373423410191, 'min_split_gain': 0.34279928826631645, 'cat_smooth': 20.552612036841047, 'cat_l2': 23.885061810240234}. Best is trial 5 with value: 4.297216683113826.[0m
Training until validation scores don't improve for 30 rounds
Early stopping, best iteration is:
[19]	valid_0's rmse: 4.38897	valid_0's l2: 19.2631
Training until validation scores don't improve for 30 rounds
Early stopping, best iteration is:
[73]	valid_0's rmse: 4.49719	valid_0's l2: 20.2247
Training until validation scores don't improve for 30 rounds
Early stopping, best iteration is:
[43]	valid_0's rmse: 4.125	valid_0's l2: 17.0156
Training until validation scores don't improve for 30 rounds
Early stopping, best iteration is:
[48]	valid_0's rmse: 4.81228	valid_0's l2: 23.1581
Training until validation scores don't improve for 30 rounds
Early stopping, best iteration is:
[63]	valid_0's rmse: 4.36426	valid_0's l2: 19.0468
[32m[I 2026-07-24 11:10:41,355][0m Trial 12 finished with value: 4.438802915767097 and parameters: {'boosting_type': 'gbdt', 'max_depth': 8, 'num_leaves': 21, 'learning_rate': 0.28964577784645223, 'n_estimators': 2445, 'subsample': 0.8079907687060501, 'subsample_freq': 6, 'colsample_bytree': 0.5710827928315942, 'reg_alpha': 7.58060067585804, 'reg_lambda': 1.431047124586851e-05, 'min_child_samples': 7, 'min_child_weight': 0.004026351853278354, 'min_split_gain': 0.3944273631737266, 'cat_smooth': 19.24839515611932, 'cat_l2': 22.61631564388042}. Best is trial 5 with value: 4.297216683113826.[0m
Training until validation scores don't improve for 30 rounds
Early stopping, best iteration is:
[145]	valid_0's rmse: 4.54079	valid_0's l2: 20.6188
Training until validation scores don't improve for 30 rounds
Early stopping, best iteration is:
[149]	valid_0's rmse: 4.39212	valid_0's l2: 19.2907
Training until validation scores don't improve for 30 rounds
Early stopping, best iteration is:
[240]	valid_0's rmse: 4.05425	valid_0's l2: 16.4369
Training until validation scores don't improve for 30 rounds
Early stopping, best iteration is:
[123]	valid_0's rmse: 4.7254	valid_0's l2: 22.3294
Training until validation scores don't improve for 30 rounds
Early stopping, best iteration is:
[84]	valid_0's rmse: 4.3211	valid_0's l2: 18.6719
[32m[I 2026-07-24 11:10:44,474][0m Trial 13 finished with value: 4.406733071539012 and parameters: {'boosting_type': 'gbdt', 'max_depth': 15, 'num_leaves': 248, 'learning_rate': 0.10111586840788142, 'n_estimators': 2325, 'subsample': 0.9913430783889022, 'subsample_freq': 5, 'colsample_bytree': 0.9966650076393592, 'reg_alpha': 0.3779696518023393, 'reg_lambda': 7.565770484313319e-06, 'min_child_samples': 23, 'min_child_weight': 0.0006897395462103529, 'min_split_gain': 0.17676135789481792, 'cat_smooth': 33.0299622914229, 'cat_l2': 2.5465222846645155}. Best is trial 5 with value: 4.297216683113826.[0m
Training until validation scores don't improve for 30 rounds
Early stopping, best iteration is:
[90]	valid_0's rmse: 4.45085	valid_0's l2: 19.8101
Training until validation scores don't improve for 30 rounds
Early stopping, best iteration is:
[93]	valid_0's rmse: 4.43994	valid_0's l2: 19.7131
Training until validation scores don't improve for 30 rounds
Early stopping, best iteration is:
[105]	valid_0's rmse: 4.19223	valid_0's l2: 17.5748
Training until validation scores don't improve for 30 rounds
Early stopping, best iteration is:
[70]	valid_0's rmse: 4.60034	valid_0's l2: 21.1632
Training until validation scores don't improve for 30 rounds
Early stopping, best iteration is:
[123]	valid_0's rmse: 4.34613	valid_0's l2: 18.8888
[32m[I 2026-07-24 11:10:46,191][0m Trial 14 finished with value: 4.4058983309539865 and parameters: {'boosting_type': 'gbdt', 'max_depth': 8, 'num_leaves': 101, 'learning_rate': 0.12660527974546876, 'n_estimators': 2157, 'subsample': 0.7857877046452318, 'subsample_freq': 7, 'colsample_bytree': 0.30662184218780936, 'reg_alpha': 3.306264329049814e-07, 'reg_lambda': 0.018352158240070957, 'min_child_samples': 15, 'min_child_weight': 0.01197635766406829, 'min_split_gain': 0.44016315543372253, 'cat_smooth': 24.907990432451598, 'cat_l2': 33.819406609702725}. Best is trial 5 with value: 4.297216683113826.[0m
Training until validation scores don't improve for 30 rounds
Early stopping, best iteration is:
[175]	valid_0's rmse: 4.37465	valid_0's l2: 19.1375
Training until validation scores don't improve for 30 rounds
Early stopping, best iteration is:
[111]	valid_0's rmse: 4.68513	valid_0's l2: 21.9505
Training until validation scores don't improve for 30 rounds
Early stopping, best iteration is:
[184]	valid_0's rmse: 4.40954	valid_0's l2: 19.4441
Training until validation scores don't improve for 30 rounds
Early stopping, best iteration is:
[91]	valid_0's rmse: 4.59293	valid_0's l2: 21.095
Training until validation scores don't improve for 30 rounds
Early stopping, best iteration is:
[172]	valid_0's rmse: 4.2658	valid_0's l2: 18.197
[32m[I 2026-07-24 11:10:47,990][0m Trial 15 finished with value: 4.465609040636809 and parameters: {'boosting_type': 'gbdt', 'max_depth': 10, 'num_leaves': 128, 'learning_rate': 0.09752032437592352, 'n_estimators': 2687, 'subsample': 0.723004607732685, 'subsample_freq': 1, 'colsample_bytree': 0.6003195309450419, 'reg_alpha': 0.07538599268773487, 'reg_lambda': 4.3662991548241424e-07, 'min_child_samples': 37, 'min_child_weight': 0.0006099412898103844, 'min_split_gain': 0.5425773205460362, 'cat_smooth': 11.39898907056787, 'cat_l2': 21.715177543184666}. Best is trial 5 with value: 4.297216683113826.[0m
Training until validation scores don't improve for 30 rounds
Early stopping, best iteration is:
[507]	valid_0's rmse: 4.38146	valid_0's l2: 19.1972
Training until validation scores don't improve for 30 rounds
Early stopping, best iteration is:
[336]	valid_0's rmse: 4.45081	valid_0's l2: 19.8097
Training until validation scores don't improve for 30 rounds
Early stopping, best iteration is:
[670]	valid_0's rmse: 4.0597	valid_0's l2: 16.4812
Training until validation scores don't improve for 30 rounds
Early stopping, best iteration is:
[421]	valid_0's rmse: 4.50843	valid_0's l2: 20.3259
Training until validation scores don't improve for 30 rounds
Early stopping, best iteration is:
[327]	valid_0's rmse: 4.22769	valid_0's l2: 17.8733
[32m[I 2026-07-24 11:10:53,337][0m Trial 16 finished with value: 4.325618241976107 and parameters: {'boosting_type': 'gbdt', 'max_depth': 15, 'num_leaves': 48, 'learning_rate': 0.020029619409435772, 'n_estimators': 2066, 'subsample': 0.8717887378779443, 'subsample_freq': 7, 'colsample_bytree': 0.3914724172006782, 'reg_alpha': 0.000104133116311454, 'reg_lambda': 0.09485375159633139, 'min_child_samples': 22, 'min_child_weight': 0.008531419848138537, 'min_split_gain': 0.2572802768252839, 'cat_smooth': 35.014391662489714, 'cat_l2': 31.852322745132227}. Best is trial 5 with value: 4.297216683113826.[0m
Training until validation scores don't improve for 30 rounds
Early stopping, best iteration is:
[43]	valid_0's rmse: 4.30709	valid_0's l2: 18.551
Training until validation scores don't improve for 30 rounds
Early stopping, best iteration is:
[144]	valid_0's rmse: 4.31434	valid_0's l2: 18.6135
Training until validation scores don't improve for 30 rounds
Early stopping, best iteration is:
[250]	valid_0's rmse: 3.91097	valid_0's l2: 15.2957
Training until validation scores don't improve for 30 rounds
Early stopping, best iteration is:
[21]	valid_0's rmse: 4.92813	valid_0's l2: 24.2865
Training until validation scores don't improve for 30 rounds
Early stopping, best iteration is:
[163]	valid_0's rmse: 4.1396	valid_0's l2: 17.1363
[32m[I 2026-07-24 11:10:55,439][0m Trial 17 finished with value: 4.320024945935837 and parameters: {'boosting_type': 'gbdt', 'max_depth': 6, 'num_leaves': 198, 'learning_rate': 0.17084075956337222, 'n_estimators': 2564, 'subsample': 0.7499972938777936, 'subsample_freq': 5, 'colsample_bytree': 0.5042416534218429, 'reg_alpha': 6.11242651240966e-07, 'reg_lambda': 0.00012289668202678354, 'min_child_samples': 5, 'min_child_weight': 0.03448291711965682, 'min_split_gain': 0.02873721860276618, 'cat_smooth': 41.06306244734352, 'cat_l2': 15.848378617117591}. Best is trial 5 with value: 4.297216683113826.[0m
Training until validation scores don't improve for 30 rounds
Early stopping, best iteration is:
[413]	valid_0's rmse: 4.37013	valid_0's l2: 19.098
Training until validation scores don't improve for 30 rounds
Early stopping, best iteration is:
[156]	valid_0's rmse: 4.86612	valid_0's l2: 23.6792
Training until validation scores don't improve for 30 rounds
Early stopping, best iteration is:
[192]	valid_0's rmse: 4.43739	valid_0's l2: 19.6904
Training until validation scores don't improve for 30 rounds
Early stopping, best iteration is:
[236]	valid_0's rmse: 4.66907	valid_0's l2: 21.8002
Training until validation scores don't improve for 30 rounds
Early stopping, best iteration is:
[187]	valid_0's rmse: 4.47627	valid_0's l2: 20.037
