[32m[I 2026-07-24 11:18:30,453][0m Trial 49 pruned. [0m

=== Best Trial ===
  CV RMSE: 4.193275
  Params:  {'boosting_type': 'gbdt', 'max_depth': 13, 'num_leaves': 207, 'learning_rate': 0.07972853697737219, 'n_estimators': 2528, 'subsample': 0.7687144407189006, 'subsample_freq': 7, 'colsample_bytree': 0.8086225090939069, 'reg_alpha': 7.755813775235473e-08, 'reg_lambda': 8.693640448011097e-08, 'min_child_samples': 5, 'min_child_weight': 0.018507434686991182, 'min_split_gain': 0.33666075222263486, 'cat_smooth': 24.624194552982143, 'cat_l2': 9.879759171368914}

============================================================
Training Final Model with Best Hyperparameters
============================================================
Training until validation scores don't improve for 50 rounds
[50]	valid_0's rmse: 1.18547	valid_0's l2: 1.40534
[100]	valid_0's rmse: 0.756419	valid_0's l2: 0.57217
[150]	valid_0's rmse: 0.589532	valid_0's l2: 0.347548
Early stopping, best iteration is:
[147]	valid_0's rmse: 0.583521	valid_0's l2: 0.340497

============================================================
Test Evaluation
============================================================
  Test MSE:  18.9811
  Test RMSE: 4.3567
  Test MAE:  3.2794
  Test R²:   0.6291

============================================================
Top 20 Feature Importances
============================================================
   1. tail_ratio                 415.0
   2. LogP                       327.0
   3. atom_mean_35               286.0
   4. MolWt                      281.0
   5. atom_std_25                227.0
   6. RotBonds                   203.0
   7. atom_std_54                189.0
   8. atom_mean_23               171.0
   9. atom_mean_47               153.0
  10. atom_std_35                144.0
  11. atom_mean_48               144.0
  12. atom_std_47                143.0
  13. atom_mean_17               138.0
  14. atom_mean_39               132.0
  15. atom_mean_3                131.0
  16. atom_std_39                128.0
  17. atom_mean_26               124.0
  18. atom_mean_54               120.0
  19. HeavyAtoms                 119.0
  20. atom_mean_38               114.0

Plot saved to runs\AW_ST_CMC\AW_ST_CMC_lightgbm_20260724_110941\pred_vs_true.png
Model saved to runs\AW_ST_CMC\AW_ST_CMC_lightgbm_20260724_110941\model.pkl

============================================================
SUMMARY — LightGBM + PharmHGT Features
============================================================
  Features:  522-dim (atom_agg + bond_agg + MACCS + BRICS + surfactant + descriptors)
  Train:     843 (split 737 train + 106 val)
  Test:      70
  Optuna:    50 trials, 5-fold CV
  Best CV RMSE: 4.1933
  Test RMSE: 4.3567
  Test MAE:  3.2794
  Test R²:   0.6291

指标已保存: runs\AW_ST_CMC\AW_ST_CMC_lightgbm_20260724_110941\metrics.json
索引已更新: runs\AW_ST_CMC\_runs_index.csv
索引已更新: runs\_runs_index.csv
