============================================================
cif — 运行开始  20260806_171025
  输出目录:  runs\Pi_CMC\Pi_CMC_cif_20260806_171025
============================================================
============================================================
Conditional Inference Forest + PharmHGT-style Featurization for Pi_CMC Prediction
============================================================
[Cache HIT] Loading features from data\features\surfpro\Pi_CMC
  Train features: (631, 522)
  Test features:  (70, 522)

Split: Train 552, Val 79, Test 70

============================================================
Optuna Hyperparameter Tuning (50 trials, 5-Fold CV)
============================================================
[32m[I 2026-08-06 17:10:29,310][0m Trial 0 finished with value: 6.06859157314811 and parameters: {'n_estimators': 874, 'max_depth': 29, 'min_samples_split': 37, 'min_samples_leaf': 30, 'max_features': 'sqrt', 'bootstrap': True, 'max_samples': 0.8540362888980227}. Best is trial 0 with value: 6.06859157314811.[0m
[32m[I 2026-08-06 17:10:30,594][0m Trial 1 finished with value: 5.208528284498563 and parameters: {'n_estimators': 237, 'max_depth': 30, 'min_samples_split': 42, 'min_samples_leaf': 11, 'max_features': None, 'bootstrap': True, 'max_samples': 0.645614570099021}. Best is trial 1 with value: 5.208528284498563.[0m
[32m[I 2026-08-06 17:10:34,408][0m Trial 2 finished with value: 5.776011426908548 and parameters: {'n_estimators': 1301, 'max_depth': 6, 'min_samples_split': 16, 'min_samples_leaf': 19, 'max_features': 'log2', 'bootstrap': False}. Best is trial 1 with value: 5.208528284498563.[0m
[32m[I 2026-08-06 17:10:35,800][0m Trial 3 finished with value: 5.055164144100695 and parameters: {'n_estimators': 283, 'max_depth': 20, 'min_samples_split': 10, 'min_samples_leaf': 4, 'max_features': 'log2', 'bootstrap': True, 'max_samples': 0.8421165132560784}. Best is trial 3 with value: 5.055164144100695.[0m
[32m[I 2026-08-06 17:10:38,816][0m Trial 4 finished with value: 4.883043985943571 and parameters: {'n_estimators': 992, 'max_depth': 6, 'min_samples_split': 26, 'min_samples_leaf': 2, 'max_features': 'sqrt', 'bootstrap': False}. Best is trial 4 with value: 4.883043985943571.[0m
[32m[I 2026-08-06 17:10:40,900][0m Trial 5 pruned. [0m
[32m[I 2026-08-06 17:10:41,443][0m Trial 6 pruned. [0m
[32m[I 2026-08-06 17:10:41,894][0m Trial 7 pruned. [0m
[32m[I 2026-08-06 17:10:42,316][0m Trial 8 pruned. [0m
[32m[I 2026-08-06 17:10:47,846][0m Trial 9 finished with value: 5.038293314234528 and parameters: {'n_estimators': 1514, 'max_depth': 20, 'min_samples_split': 45, 'min_samples_leaf': 24, 'max_features': None, 'bootstrap': False}. Best is trial 4 with value: 4.883043985943571.[0m
[32m[I 2026-08-06 17:10:50,030][0m Trial 10 pruned. [0m
[32m[I 2026-08-06 17:10:56,411][0m Trial 11 finished with value: 5.116518406528941 and parameters: {'n_estimators': 1771, 'max_depth': 21, 'min_samples_split': 29, 'min_samples_leaf': 26, 'max_features': None, 'bootstrap': False}. Best is trial 4 with value: 4.883043985943571.[0m
[32m[I 2026-08-06 17:10:58,645][0m Trial 12 pruned. [0m
[32m[I 2026-08-06 17:10:59,754][0m Trial 13 pruned. [0m
[32m[I 2026-08-06 17:11:03,151][0m Trial 14 finished with value: 5.034314234355479 and parameters: {'n_estimators': 880, 'max_depth': 24, 'min_samples_split': 20, 'min_samples_leaf': 24, 'max_features': None, 'bootstrap': False}. Best is trial 4 with value: 4.883043985943571.[0m
[32m[I 2026-08-06 17:11:04,108][0m Trial 15 pruned. [0m
[32m[I 2026-08-06 17:11:08,042][0m Trial 16 finished with value: 4.840286542913495 and parameters: {'n_estimators': 981, 'max_depth': 25, 'min_samples_split': 14, 'min_samples_leaf': 19, 'max_features': None, 'bootstrap': False}. Best is trial 16 with value: 4.840286542913495.[0m
[32m[I 2026-08-06 17:11:13,640][0m Trial 17 finished with value: 4.145896604463745 and parameters: {'n_estimators': 1074, 'max_depth': 16, 'min_samples_split': 13, 'min_samples_leaf': 6, 'max_features': None, 'bootstrap': False}. Best is trial 17 with value: 4.145896604463745.[0m
[32m[I 2026-08-06 17:11:16,129][0m Trial 18 finished with value: 4.707524913327986 and parameters: {'n_estimators': 578, 'max_depth': 15, 'min_samples_split': 12, 'min_samples_leaf': 16, 'max_features': None, 'bootstrap': False}. Best is trial 17 with value: 4.145896604463745.[0m
[32m[I 2026-08-06 17:11:19,140][0m Trial 19 finished with value: 4.20823720978872 and parameters: {'n_estimators': 580, 'max_depth': 15, 'min_samples_split': 2, 'min_samples_leaf': 7, 'max_features': None, 'bootstrap': False}. Best is trial 17 with value: 4.145896604463745.[0m
[32m[I 2026-08-06 17:11:22,024][0m Trial 20 finished with value: 4.206095957148544 and parameters: {'n_estimators': 547, 'max_depth': 16, 'min_samples_split': 2, 'min_samples_leaf': 7, 'max_features': None, 'bootstrap': False}. Best is trial 17 with value: 4.145896604463745.[0m
[32m[I 2026-08-06 17:11:24,905][0m Trial 21 finished with value: 4.281452430592733 and parameters: {'n_estimators': 563, 'max_depth': 17, 'min_samples_split': 2, 'min_samples_leaf': 8, 'max_features': None, 'bootstrap': False}. Best is trial 17 with value: 4.145896604463745.[0m
[32m[I 2026-08-06 17:11:27,915][0m Trial 22 finished with value: 4.193947357678735 and parameters: {'n_estimators': 568, 'max_depth': 11, 'min_samples_split': 3, 'min_samples_leaf': 6, 'max_features': None, 'bootstrap': False}. Best is trial 17 with value: 4.145896604463745.[0m
[32m[I 2026-08-06 17:11:30,473][0m Trial 23 finished with value: 4.236674002803431 and parameters: {'n_estimators': 492, 'max_depth': 10, 'min_samples_split': 7, 'min_samples_leaf': 6, 'max_features': None, 'bootstrap': False}. Best is trial 17 with value: 4.145896604463745.[0m
[32m[I 2026-08-06 17:11:35,783][0m Trial 24 finished with value: 4.55032903473537 and parameters: {'n_estimators': 1202, 'max_depth': 17, 'min_samples_split': 6, 'min_samples_leaf': 13, 'max_features': None, 'bootstrap': False}. Best is trial 17 with value: 4.145896604463745.[0m
[32m[I 2026-08-06 17:11:39,527][0m Trial 25 finished with value: 4.11241257569583 and parameters: {'n_estimators': 679, 'max_depth': 11, 'min_samples_split': 4, 'min_samples_leaf': 5, 'max_features': None, 'bootstrap': False}. Best is trial 25 with value: 4.11241257569583.[0m
[32m[I 2026-08-06 17:11:42,825][0m Trial 26 finished with value: 4.719469123209416 and parameters: {'n_estimators': 713, 'max_depth': 11, 'min_samples_split': 9, 'min_samples_leaf': 1, 'max_features': 'log2', 'bootstrap': True, 'max_samples': 0.5266320477783109}. Best is trial 25 with value: 4.11241257569583.[0m
[32m[I 2026-08-06 17:11:44,551][0m Trial 27 pruned. [0m
[32m[I 2026-08-06 17:11:47,767][0m Trial 28 finished with value: 4.4090371637225845 and parameters: {'n_estimators': 677, 'max_depth': 13, 'min_samples_split': 5, 'min_samples_leaf': 10, 'max_features': None, 'bootstrap': False}. Best is trial 25 with value: 4.11241257569583.[0m
[32m[I 2026-08-06 17:11:52,984][0m Trial 29 finished with value: 4.584652345302368 and parameters: {'n_estimators': 1094, 'max_depth': 7, 'min_samples_split': 12, 'min_samples_leaf': 5, 'max_features': None, 'bootstrap': True, 'max_samples': 0.7173742395750812}. Best is trial 25 with value: 4.11241257569583.[0m
[32m[I 2026-08-06 17:11:53,563][0m Trial 30 pruned. [0m
[32m[I 2026-08-06 17:11:58,777][0m Trial 31 finished with value: 4.033489811609583 and parameters: {'n_estimators': 895, 'max_depth': 17, 'min_samples_split': 2, 'min_samples_leaf': 5, 'max_features': None, 'bootstrap': False}. Best is trial 31 with value: 4.033489811609583.[0m
[32m[I 2026-08-06 17:12:03,916][0m Trial 32 finished with value: 3.9904846077023004 and parameters: {'n_estimators': 857, 'max_depth': 13, 'min_samples_split': 4, 'min_samples_leaf': 4, 'max_features': None, 'bootstrap': False}. Best is trial 32 with value: 3.9904846077023004.[0m
[32m[I 2026-08-06 17:12:09,491][0m Trial 33 finished with value: 3.866522242177001 and parameters: {'n_estimators': 845, 'max_depth': 14, 'min_samples_split': 5, 'min_samples_leaf': 3, 'max_features': None, 'bootstrap': False}. Best is trial 33 with value: 3.866522242177001.[0m
[32m[I 2026-08-06 17:12:15,005][0m Trial 34 finished with value: 4.110372823658618 and parameters: {'n_estimators': 890, 'max_depth': 13, 'min_samples_split': 5, 'min_samples_leaf': 3, 'max_features': None, 'bootstrap': True, 'max_samples': 0.970004177669914}. Best is trial 33 with value: 3.866522242177001.[0m
[32m[I 2026-08-06 17:12:20,407][0m Trial 35 finished with value: 4.1507824868351815 and parameters: {'n_estimators': 871, 'max_depth': 13, 'min_samples_split': 8, 'min_samples_leaf': 3, 'max_features': None, 'bootstrap': True, 'max_samples': 0.9809752147751409}. Best is trial 33 with value: 3.866522242177001.[0m
[32m[I 2026-08-06 17:12:22,896][0m Trial 36 pruned. [0m
[32m[I 2026-08-06 17:12:28,493][0m Trial 37 finished with value: 4.158527461890908 and parameters: {'n_estimators': 938, 'max_depth': 18, 'min_samples_split': 9, 'min_samples_leaf': 3, 'max_features': None, 'bootstrap': True, 'max_samples': 0.9861862563529836}. Best is trial 33 with value: 3.866522242177001.[0m
[32m[I 2026-08-06 17:12:30,755][0m Trial 38 pruned. [0m
[32m[I 2026-08-06 17:12:34,772][0m Trial 39 finished with value: 4.2944136315202694 and parameters: {'n_estimators': 844, 'max_depth': 22, 'min_samples_split': 5, 'min_samples_leaf': 1, 'max_features': 'log2', 'bootstrap': True, 'max_samples': 0.7483323238164874}. Best is trial 33 with value: 3.866522242177001.[0m
[32m[I 2026-08-06 17:12:37,315][0m Trial 40 pruned. [0m
[32m[I 2026-08-06 17:12:38,616][0m Trial 41 pruned. [0m
[32m[I 2026-08-06 17:12:43,708][0m Trial 42 finished with value: 3.9221850752307317 and parameters: {'n_estimators': 751, 'max_depth': 12, 'min_samples_split': 7, 'min_samples_leaf': 3, 'max_features': None, 'bootstrap': False}. Best is trial 33 with value: 3.866522242177001.[0m
[32m[I 2026-08-06 17:12:45,499][0m Trial 43 pruned. [0m
[32m[I 2026-08-06 17:12:47,037][0m Trial 44 pruned. [0m
[32m[I 2026-08-06 17:12:55,190][0m Trial 45 finished with value: 4.029751973664873 and parameters: {'n_estimators': 1100, 'max_depth': 9, 'min_samples_split': 2, 'min_samples_leaf': 1, 'max_features': None, 'bootstrap': False}. Best is trial 33 with value: 3.866522242177001.[0m
[32m[I 2026-08-06 17:12:57,383][0m Trial 46 pruned. [0m
[32m[I 2026-08-06 17:12:59,228][0m Trial 47 pruned. [0m
[32m[I 2026-08-06 17:13:00,929][0m Trial 48 pruned. [0m
[32m[I 2026-08-06 17:13:06,224][0m Trial 49 finished with value: 3.952398813667768 and parameters: {'n_estimators': 778, 'max_depth': 19, 'min_samples_split': 7, 'min_samples_leaf': 4, 'max_features': None, 'bootstrap': False}. Best is trial 33 with value: 3.866522242177001.[0m

=== Best Trial ===
  CV RMSE: 3.866522
  Params:  {'n_estimators': 845, 'max_depth': 14, 'min_samples_split': 5, 'min_samples_leaf': 3, 'max_features': None, 'bootstrap': False}

============================================================
Training Final Model with Best Hyperparameters
============================================================

============================================================
Test Evaluation
============================================================
  Test MSE:  20.1321
  Test RMSE: 4.4869
  Test MAE:  2.9857
  Test R²:   0.6119

============================================================
Top 20 Feature Importances
============================================================
   1. atom_mean_44               0.1
   2. maccs_28                   0.0
   3. bond_mean_3                0.0
   4. maccs_111                  0.0
   5. atom_std_44                0.0
   6. bond_mean_12               0.0
   7. atom_mean_33               0.0
   8. brics_30                   0.0
   9. atom_mean_11               0.0
  10. surf_nonionic              0.0
  11. atom_mean_52               0.0
  12. bond_std_12                0.0
  13. atom_std_11                0.0
  14. HBD                        0.0
  15. bond_std_3                 0.0
  16. atom_std_52                0.0
  17. atom_std_54                0.0
  18. maccs_125                  0.0
  19. atom_min_22                0.0
  20. atom_mean_38               0.0

Plot saved to runs\Pi_CMC\Pi_CMC_cif_20260806_171025\pred_vs_true.png
Model saved to runs\Pi_CMC\Pi_CMC_cif_20260806_171025\model.pkl

============================================================
SUMMARY — Conditional Inference Forest + PharmHGT Features
============================================================
  Features:  522-dim (atom_agg + bond_agg + MACCS + BRICS + surfactant + descriptors)
  Train:     631 (split 552 train + 79 val)
  Test:      70
  Optuna:    50 trials, 5-fold CV
  Best CV RMSE: 3.8665
  Test RMSE: 4.4869
  Test MAE:  2.9857
  Test R²:   0.6119

指标已保存: runs\Pi_CMC\Pi_CMC_cif_20260806_171025\metrics.json
索引已更新: runs\Pi_CMC\_runs_index.csv
索引已更新: runs\_runs_index.csv
