============================================================
cif — 运行开始  20260807_075623
  输出目录:  runs\Area_min\Area_min_cif_20260807_075623
============================================================
============================================================
Conditional Inference Forest + PharmHGT-style Featurization for Area_min Prediction
============================================================
[Cache HIT] Loading features from data\features\surfpro\Area_min
  Train features: (607, 522)
  Test features:  (70, 522)

Split: Train 531, Val 76, Test 70

============================================================
Optuna Hyperparameter Tuning (50 trials, 5-Fold CV)
============================================================
[32m[I 2026-08-07 07:56:27,409][0m Trial 0 finished with value: 0.7356342358726706 and parameters: {'n_estimators': 874, 'max_depth': 29, 'min_samples_split': 37, 'min_samples_leaf': 30, 'max_features': 'sqrt', 'bootstrap': True, 'max_samples': 0.8540362888980227}. Best is trial 0 with value: 0.7356342358726706.[0m
[32m[I 2026-08-07 07:56:28,852][0m Trial 1 finished with value: 0.6525159308215835 and parameters: {'n_estimators': 237, 'max_depth': 30, 'min_samples_split': 42, 'min_samples_leaf': 11, 'max_features': None, 'bootstrap': True, 'max_samples': 0.645614570099021}. Best is trial 1 with value: 0.6525159308215835.[0m
[32m[I 2026-08-07 07:56:32,679][0m Trial 2 finished with value: 0.7056138385078744 and parameters: {'n_estimators': 1301, 'max_depth': 6, 'min_samples_split': 16, 'min_samples_leaf': 19, 'max_features': 'log2', 'bootstrap': False}. Best is trial 1 with value: 0.6525159308215835.[0m
[32m[I 2026-08-07 07:56:33,973][0m Trial 3 finished with value: 0.6102430319979641 and parameters: {'n_estimators': 283, 'max_depth': 20, 'min_samples_split': 10, 'min_samples_leaf': 4, 'max_features': 'log2', 'bootstrap': True, 'max_samples': 0.8421165132560784}. Best is trial 3 with value: 0.6102430319979641.[0m
[32m[I 2026-08-07 07:56:36,964][0m Trial 4 finished with value: 0.5818669162383402 and parameters: {'n_estimators': 992, 'max_depth': 6, 'min_samples_split': 26, 'min_samples_leaf': 2, 'max_features': 'sqrt', 'bootstrap': False}. Best is trial 4 with value: 0.5818669162383402.[0m
[32m[I 2026-08-07 07:56:38,943][0m Trial 5 pruned. [0m
[32m[I 2026-08-07 07:56:40,226][0m Trial 6 finished with value: 0.6875022896603201 and parameters: {'n_estimators': 281, 'max_depth': 12, 'min_samples_split': 21, 'min_samples_leaf': 14, 'max_features': 'sqrt', 'bootstrap': True, 'max_samples': 0.9010984903770198}. Best is trial 4 with value: 0.5818669162383402.[0m
[32m[I 2026-08-07 07:56:41,308][0m Trial 7 finished with value: 0.6652672239904389 and parameters: {'n_estimators': 334, 'max_depth': 30, 'min_samples_split': 39, 'min_samples_leaf': 10, 'max_features': 'log2', 'bootstrap': False}. Best is trial 4 with value: 0.5818669162383402.[0m
[32m[I 2026-08-07 07:56:41,943][0m Trial 8 pruned. [0m
[32m[I 2026-08-07 07:56:47,431][0m Trial 9 finished with value: 0.6584405157718869 and parameters: {'n_estimators': 1514, 'max_depth': 20, 'min_samples_split': 45, 'min_samples_leaf': 24, 'max_features': None, 'bootstrap': False}. Best is trial 4 with value: 0.5818669162383402.[0m
[32m[I 2026-08-07 07:56:52,880][0m Trial 10 finished with value: 0.6732392466037015 and parameters: {'n_estimators': 1915, 'max_depth': 3, 'min_samples_split': 27, 'min_samples_leaf': 1, 'max_features': 'sqrt', 'bootstrap': False}. Best is trial 4 with value: 0.5818669162383402.[0m
[32m[I 2026-08-07 07:56:55,909][0m Trial 11 finished with value: 0.4553869091014128 and parameters: {'n_estimators': 680, 'max_depth': 20, 'min_samples_split': 3, 'min_samples_leaf': 1, 'max_features': 'log2', 'bootstrap': True, 'max_samples': 0.7516400374040881}. Best is trial 11 with value: 0.4553869091014128.[0m
[32m[I 2026-08-07 07:56:59,339][0m Trial 12 finished with value: 0.44857434105549104 and parameters: {'n_estimators': 759, 'max_depth': 22, 'min_samples_split': 2, 'min_samples_leaf': 1, 'max_features': 'log2', 'bootstrap': True, 'max_samples': 0.7157007399204262}. Best is trial 12 with value: 0.44857434105549104.[0m
[32m[I 2026-08-07 07:57:02,260][0m Trial 13 finished with value: 0.6939837665422219 and parameters: {'n_estimators': 678, 'max_depth': 22, 'min_samples_split': 2, 'min_samples_leaf': 9, 'max_features': 'log2', 'bootstrap': True, 'max_samples': 0.7201875794162571}. Best is trial 12 with value: 0.44857434105549104.[0m
[32m[I 2026-08-07 07:57:05,022][0m Trial 14 finished with value: 0.4490551214986474 and parameters: {'n_estimators': 609, 'max_depth': 25, 'min_samples_split': 2, 'min_samples_leaf': 1, 'max_features': 'log2', 'bootstrap': True, 'max_samples': 0.7409994019071536}. Best is trial 12 with value: 0.44857434105549104.[0m
[32m[I 2026-08-07 07:57:06,618][0m Trial 15 pruned. [0m
[32m[I 2026-08-07 07:57:09,127][0m Trial 16 finished with value: 0.6850068086565845 and parameters: {'n_estimators': 573, 'max_depth': 25, 'min_samples_split': 16, 'min_samples_leaf': 6, 'max_features': 'log2', 'bootstrap': True, 'max_samples': 0.5068998398220526}. Best is trial 12 with value: 0.44857434105549104.[0m
[32m[I 2026-08-07 07:57:10,664][0m Trial 17 pruned. [0m
[32m[I 2026-08-07 07:57:13,202][0m Trial 18 finished with value: 0.5644472916636636 and parameters: {'n_estimators': 514, 'max_depth': 25, 'min_samples_split': 2, 'min_samples_leaf': 8, 'max_features': None, 'bootstrap': True, 'max_samples': 0.7798079465483917}. Best is trial 12 with value: 0.44857434105549104.[0m
[32m[I 2026-08-07 07:57:15,127][0m Trial 19 pruned. [0m
[32m[I 2026-08-07 07:57:17,088][0m Trial 20 pruned. [0m
[32m[I 2026-08-07 07:57:19,495][0m Trial 21 finished with value: 0.5237777063315022 and parameters: {'n_estimators': 526, 'max_depth': 17, 'min_samples_split': 2, 'min_samples_leaf': 2, 'max_features': 'log2', 'bootstrap': True, 'max_samples': 0.7523594782378045}. Best is trial 12 with value: 0.44857434105549104.[0m
[32m[I 2026-08-07 07:57:23,003][0m Trial 22 finished with value: 0.6495089533720914 and parameters: {'n_estimators': 813, 'max_depth': 27, 'min_samples_split': 6, 'min_samples_leaf': 6, 'max_features': 'log2', 'bootstrap': True, 'max_samples': 0.7995267225160303}. Best is trial 12 with value: 0.44857434105549104.[0m
[32m[I 2026-08-07 07:57:27,504][0m Trial 23 finished with value: 0.5000705785696884 and parameters: {'n_estimators': 1034, 'max_depth': 22, 'min_samples_split': 6, 'min_samples_leaf': 1, 'max_features': 'log2', 'bootstrap': True, 'max_samples': 0.6757582228467287}. Best is trial 12 with value: 0.44857434105549104.[0m
[32m[I 2026-08-07 07:57:29,498][0m Trial 24 finished with value: 0.6597339455026696 and parameters: {'n_estimators': 444, 'max_depth': 18, 'min_samples_split': 13, 'min_samples_leaf': 6, 'max_features': 'log2', 'bootstrap': True, 'max_samples': 0.7149872794581776}. Best is trial 12 with value: 0.44857434105549104.[0m
[32m[I 2026-08-07 07:57:33,170][0m Trial 25 finished with value: 0.5098570949412431 and parameters: {'n_estimators': 731, 'max_depth': 27, 'min_samples_split': 5, 'min_samples_leaf': 5, 'max_features': None, 'bootstrap': True, 'max_samples': 0.8368709056781178}. Best is trial 12 with value: 0.44857434105549104.[0m
[32m[I 2026-08-07 07:57:36,885][0m Trial 26 pruned. [0m
[32m[I 2026-08-07 07:57:39,018][0m Trial 27 finished with value: 0.4372596865138475 and parameters: {'n_estimators': 451, 'max_depth': 23, 'min_samples_split': 2, 'min_samples_leaf': 1, 'max_features': 'log2', 'bootstrap': True, 'max_samples': 0.9074136202529426}. Best is trial 27 with value: 0.4372596865138475.[0m
[32m[I 2026-08-07 07:57:39,810][0m Trial 28 pruned. [0m
[32m[I 2026-08-07 07:57:43,873][0m Trial 29 finished with value: 0.6001694134084115 and parameters: {'n_estimators': 856, 'max_depth': 23, 'min_samples_split': 33, 'min_samples_leaf': 10, 'max_features': None, 'bootstrap': True, 'max_samples': 0.8998892026135178}. Best is trial 27 with value: 0.4372596865138475.[0m
[32m[I 2026-08-07 07:57:45,722][0m Trial 30 finished with value: 0.6692944911573045 and parameters: {'n_estimators': 418, 'max_depth': 28, 'min_samples_split': 13, 'min_samples_leaf': 5, 'max_features': 'log2', 'bootstrap': True, 'max_samples': 0.5001310561523566}. Best is trial 27 with value: 0.4372596865138475.[0m
[32m[I 2026-08-07 07:57:48,655][0m Trial 31 finished with value: 0.5340563200952018 and parameters: {'n_estimators': 664, 'max_depth': 24, 'min_samples_split': 4, 'min_samples_leaf': 2, 'max_features': 'log2', 'bootstrap': True, 'max_samples': 0.6808750565360016}. Best is trial 27 with value: 0.4372596865138475.[0m
[32m[I 2026-08-07 07:57:51,889][0m Trial 32 finished with value: 0.4399515434466629 and parameters: {'n_estimators': 715, 'max_depth': 21, 'min_samples_split': 2, 'min_samples_leaf': 1, 'max_features': 'log2', 'bootstrap': True, 'max_samples': 0.8149265624063259}. Best is trial 27 with value: 0.4372596865138475.[0m
[32m[I 2026-08-07 07:57:52,483][0m Trial 33 pruned. [0m
[32m[I 2026-08-07 07:57:56,297][0m Trial 34 finished with value: 0.607925400676147 and parameters: {'n_estimators': 882, 'max_depth': 16, 'min_samples_split': 5, 'min_samples_leaf': 4, 'max_features': 'log2', 'bootstrap': True, 'max_samples': 0.8092443217074275}. Best is trial 27 with value: 0.4372596865138475.[0m
[32m[I 2026-08-07 07:57:58,118][0m Trial 35 pruned. [0m
[32m[I 2026-08-07 07:58:00,006][0m Trial 36 finished with value: 0.5505661032024778 and parameters: {'n_estimators': 575, 'max_depth': 26, 'min_samples_split': 10, 'min_samples_leaf': 4, 'max_features': 'log2', 'bootstrap': False}. Best is trial 27 with value: 0.4372596865138475.[0m
[32m[I 2026-08-07 07:58:02,182][0m Trial 37 pruned. [0m
[32m[I 2026-08-07 07:58:06,260][0m Trial 38 finished with value: 0.6281724248524612 and parameters: {'n_estimators': 943, 'max_depth': 19, 'min_samples_split': 18, 'min_samples_leaf': 7, 'max_features': 'sqrt', 'bootstrap': True, 'max_samples': 0.8193009560425797}. Best is trial 27 with value: 0.4372596865138475.[0m
[32m[I 2026-08-07 07:58:07,579][0m Trial 39 finished with value: 0.5321818659640101 and parameters: {'n_estimators': 390, 'max_depth': 14, 'min_samples_split': 12, 'min_samples_leaf': 3, 'max_features': 'log2', 'bootstrap': False}. Best is trial 27 with value: 0.4372596865138475.[0m
[32m[I 2026-08-07 07:58:08,882][0m Trial 40 pruned. [0m
[32m[I 2026-08-07 07:58:12,008][0m Trial 41 finished with value: 0.5244909029075779 and parameters: {'n_estimators': 710, 'max_depth': 21, 'min_samples_split': 4, 'min_samples_leaf': 2, 'max_features': 'log2', 'bootstrap': True, 'max_samples': 0.7569699454062044}. Best is trial 27 with value: 0.4372596865138475.[0m
[32m[I 2026-08-07 07:58:14,778][0m Trial 42 finished with value: 0.4485150722990968 and parameters: {'n_estimators': 610, 'max_depth': 24, 'min_samples_split': 2, 'min_samples_leaf': 1, 'max_features': 'log2', 'bootstrap': True, 'max_samples': 0.7396036725164276}. Best is trial 27 with value: 0.4372596865138475.[0m
[32m[I 2026-08-07 07:58:17,510][0m Trial 43 finished with value: 0.45061648470770876 and parameters: {'n_estimators': 596, 'max_depth': 24, 'min_samples_split': 2, 'min_samples_leaf': 1, 'max_features': 'log2', 'bootstrap': True, 'max_samples': 0.6946915760137313}. Best is trial 27 with value: 0.4372596865138475.[0m
[32m[I 2026-08-07 07:58:18,580][0m Trial 44 finished with value: 0.6217989881713128 and parameters: {'n_estimators': 307, 'max_depth': 23, 'min_samples_split': 7, 'min_samples_leaf': 8, 'max_features': 'log2', 'bootstrap': False}. Best is trial 27 with value: 0.4372596865138475.[0m
[32m[I 2026-08-07 07:58:20,270][0m Trial 45 finished with value: 0.6281876900518066 and parameters: {'n_estimators': 373, 'max_depth': 30, 'min_samples_split': 4, 'min_samples_leaf': 4, 'max_features': 'log2', 'bootstrap': True, 'max_samples': 0.6289279473644842}. Best is trial 27 with value: 0.4372596865138475.[0m
[32m[I 2026-08-07 07:58:23,875][0m Trial 46 finished with value: 0.6153662478482348 and parameters: {'n_estimators': 829, 'max_depth': 24, 'min_samples_split': 9, 'min_samples_leaf': 4, 'max_features': 'log2', 'bootstrap': True, 'max_samples': 0.7369878127468459}. Best is trial 27 with value: 0.4372596865138475.[0m
[32m[I 2026-08-07 07:58:26,657][0m Trial 47 finished with value: 0.622031672721403 and parameters: {'n_estimators': 626, 'max_depth': 26, 'min_samples_split': 4, 'min_samples_leaf': 7, 'max_features': 'sqrt', 'bootstrap': True, 'max_samples': 0.8001464081820545}. Best is trial 27 with value: 0.4372596865138475.[0m
[32m[I 2026-08-07 07:58:32,357][0m Trial 48 finished with value: 0.43668808467313924 and parameters: {'n_estimators': 1827, 'max_depth': 21, 'min_samples_split': 7, 'min_samples_leaf': 1, 'max_features': 'log2', 'bootstrap': False}. Best is trial 48 with value: 0.43668808467313924.[0m
[32m[I 2026-08-07 07:58:37,849][0m Trial 49 finished with value: 0.6477372678213049 and parameters: {'n_estimators': 1817, 'max_depth': 19, 'min_samples_split': 7, 'min_samples_leaf': 10, 'max_features': 'log2', 'bootstrap': False}. Best is trial 48 with value: 0.43668808467313924.[0m

=== Best Trial ===
  CV RMSE: 0.436688
  Params:  {'n_estimators': 1827, 'max_depth': 21, 'min_samples_split': 7, 'min_samples_leaf': 1, 'max_features': 'log2', 'bootstrap': False}

============================================================
Training Final Model with Best Hyperparameters
============================================================

============================================================
Test Evaluation
============================================================
  Test MSE:  0.2361
  Test RMSE: 0.4859
  Test MAE:  0.2926
  Test R²:   0.6377

============================================================
Top 20 Feature Importances
============================================================
   1. maccs_105                  0.0
   2. maccs_101                  0.0
   3. brics_10                   0.0
   4. NumRings                   0.0
   5. maccs_140                  0.0
   6. atom_std_48                0.0
   7. atom_max_20                0.0
   8. maccs_145                  0.0
   9. AroRings                   0.0
  10. maccs_126                  0.0
  11. maccs_113                  0.0
  12. maccs_112                  0.0
  13. atom_std_26                0.0
  14. atom_mean_54               0.0
  15. maccs_149                  0.0
  16. atom_std_20                0.0
  17. atom_mean_26               0.0
  18. maccs_123                  0.0
  19. maccs_146                  0.0
  20. maccs_142                  0.0

Plot saved to runs\Area_min\Area_min_cif_20260807_075623\pred_vs_true.png
Model saved to runs\Area_min\Area_min_cif_20260807_075623\model.pkl

============================================================
SUMMARY — Conditional Inference Forest + PharmHGT Features
============================================================
  Features:  522-dim (atom_agg + bond_agg + MACCS + BRICS + surfactant + descriptors)
  Train:     607 (split 531 train + 76 val)
  Test:      70
  Optuna:    50 trials, 5-fold CV
  Best CV RMSE: 0.4367
  Test RMSE: 0.4859
  Test MAE:  0.2926
  Test R²:   0.6377

指标已保存: runs\Area_min\Area_min_cif_20260807_075623\metrics.json
索引已更新: runs\Area_min\_runs_index.csv
索引已更新: runs\_runs_index.csv
