============================================================
mlp_tuning — 运行开始  20260724_112506
  输出目录:  runs\AW_ST_CMC\AW_ST_CMC_mlp_tuning_20260724_112506
============================================================

============================================================
Optuna Hyperparameter Tuning (50 trials, 5-Fold CV)
============================================================
[32m[I 2026-07-24 11:28:12,972][0m Trial 0 finished with value: 22.07902897448355 and parameters: {'n_layers': 3, 'hidden_dim': 980, 'dropout': 0.36599697090570255, 'activation': 'relu', 'lr': 1.493656855461762e-05, 'weight_decay': 0.00021423021757741048, 'batch_size': 83}. Best is trial 0 with value: 22.07902897448355.[0m
[32m[I 2026-07-24 11:29:55,498][0m Trial 1 finished with value: 34.3339853659195 and parameters: {'n_layers': 5, 'hidden_dim': 146, 'dropout': 0.48495492608099716, 'activation': 'relu', 'lr': 3.5498788321965036e-05, 'weight_decay': 3.3205591037519537e-07, 'batch_size': 75}. Best is trial 0 with value: 22.07902897448355.[0m
[32m[I 2026-07-24 11:32:12,114][0m Trial 2 finished with value: 3.8712123736936257 and parameters: {'n_layers': 4, 'hidden_dim': 389, 'dropout': 0.30592644736118974, 'activation': 'leaky_relu', 'lr': 0.00023345864076016249, 'weight_decay': 8.431013932082453e-05, 'batch_size': 38}. Best is trial 2 with value: 3.8712123736936257.[0m
[32m[I 2026-07-24 11:33:25,894][0m Trial 3 finished with value: 3.7880980866107565 and parameters: {'n_layers': 4, 'hidden_dim': 659, 'dropout': 0.023225206359998862, 'activation': 'relu', 'lr': 0.007025166339242158, 'weight_decay': 0.0006732248920775337, 'batch_size': 107}. Best is trial 3 with value: 3.7880980866107565.[0m
[32m[I 2026-07-24 11:37:02,369][0m Trial 4 finished with value: 32.56878906495582 and parameters: {'n_layers': 3, 'hidden_dim': 215, 'dropout': 0.34211651325607845, 'activation': 'leaky_relu', 'lr': 1.2681352169084594e-05, 'weight_decay': 0.000352048104552604, 'batch_size': 45}. Best is trial 3 with value: 3.7880980866107565.[0m
[32m[I 2026-07-24 11:38:26,188][0m Trial 5 finished with value: 3.77231384144745 and parameters: {'n_layers': 5, 'hidden_dim': 407, 'dropout': 0.2600340105889054, 'activation': 'leaky_relu', 'lr': 0.002115429079726122, 'weight_decay': 0.0004983043837494911, 'batch_size': 117}. Best is trial 5 with value: 3.77231384144745.[0m
[32m[I 2026-07-24 11:40:11,021][0m Trial 6 finished with value: 3.8442070119737677 and parameters: {'n_layers': 4, 'hidden_dim': 954, 'dropout': 0.04424625102595975, 'activation': 'leaky_relu', 'lr': 0.00014656553886225324, 'weight_decay': 2.2737628102536842e-07, 'batch_size': 109}. Best is trial 5 with value: 3.77231384144745.[0m
[32m[I 2026-07-24 11:43:36,426][0m Trial 7 finished with value: 3.694029918859117 and parameters: {'n_layers': 3, 'hidden_dim': 379, 'dropout': 0.27134804157912423, 'activation': 'gelu', 'lr': 0.009133995846860976, 'weight_decay': 7.26480307482672e-05, 'batch_size': 38}. Best is trial 7 with value: 3.694029918859117.[0m
[32m[I 2026-07-24 11:44:04,776][0m Trial 8 pruned. [0m
[32m[I 2026-07-24 11:46:06,347][0m Trial 9 finished with value: 3.8141274791884627 and parameters: {'n_layers': 5, 'hidden_dim': 424, 'dropout': 0.03177917514301182, 'activation': 'leaky_relu', 'lr': 0.0008178476574339542, 'weight_decay': 0.0002729378165037473, 'batch_size': 69}. Best is trial 7 with value: 3.694029918859117.[0m
[32m[I 2026-07-24 11:57:39,401][0m Trial 10 finished with value: 3.725471873231278 and parameters: {'n_layers': 6, 'hidden_dim': 650, 'dropout': 0.17603446295912234, 'activation': 'gelu', 'lr': 0.008522491616092205, 'weight_decay': 7.516927024644895e-06, 'batch_size': 17}. Best is trial 7 with value: 3.694029918859117.[0m
[32m[I 2026-07-24 12:09:15,598][0m Trial 11 finished with value: 3.813495324234565 and parameters: {'n_layers': 6, 'hidden_dim': 639, 'dropout': 0.18980212171011174, 'activation': 'gelu', 'lr': 0.008001450337974614, 'weight_decay': 1.5916604182379784e-05, 'batch_size': 19}. Best is trial 7 with value: 3.694029918859117.[0m
[32m[I 2026-07-24 12:19:26,501][0m Trial 12 finished with value: 3.843280785075849 and parameters: {'n_layers': 6, 'hidden_dim': 651, 'dropout': 0.18946042360904006, 'activation': 'gelu', 'lr': 0.002400901113102664, 'weight_decay': 8.27072880290515e-06, 'batch_size': 22}. Best is trial 7 with value: 3.694029918859117.[0m
[32m[I 2026-07-24 12:20:55,809][0m Trial 13 pruned. [0m
[32m[I 2026-07-24 12:22:58,609][0m Trial 14 finished with value: 3.798017482956795 and parameters: {'n_layers': 3, 'hidden_dim': 267, 'dropout': 0.13678038097301373, 'activation': 'gelu', 'lr': 0.0025528424458740357, 'weight_decay': 3.426321245423121e-05, 'batch_size': 51}. Best is trial 7 with value: 3.694029918859117.[0m
[32m[I 2026-07-24 12:33:06,522][0m Trial 15 finished with value: 3.7234264099180825 and parameters: {'n_layers': 6, 'hidden_dim': 782, 'dropout': 0.23630032516894778, 'activation': 'gelu', 'lr': 0.0007527239718105523, 'weight_decay': 1.7513987755828298e-06, 'batch_size': 25}. Best is trial 7 with value: 3.694029918859117.[0m
[32m[I 2026-07-24 12:34:17,357][0m Trial 16 pruned. [0m
[32m[I 2026-07-24 12:41:30,712][0m Trial 17 finished with value: 3.7875742831475874 and parameters: {'n_layers': 5, 'hidden_dim': 760, 'dropout': 0.43146366092662647, 'activation': 'gelu', 'lr': 0.00072474462125081, 'weight_decay': 1.056089192446199e-08, 'batch_size': 31}. Best is trial 7 with value: 3.694029918859117.[0m
[32m[I 2026-07-24 12:45:58,243][0m Trial 18 finished with value: 3.7987013177100453 and parameters: {'n_layers': 4, 'hidden_dim': 518, 'dropout': 0.2812564285126708, 'activation': 'gelu', 'lr': 0.0003519366413977898, 'weight_decay': 1.5347744400150708e-06, 'batch_size': 29}. Best is trial 7 with value: 3.694029918859117.[0m
[32m[I 2026-07-24 12:46:46,747][0m Trial 19 pruned. [0m
[32m[I 2026-07-24 12:51:21,923][0m Trial 20 finished with value: 3.7788398581991176 and parameters: {'n_layers': 6, 'hidden_dim': 772, 'dropout': 0.10229598185734817, 'activation': 'relu', 'lr': 0.0015083248862513077, 'weight_decay': 5.996778359355095e-05, 'batch_size': 84}. Best is trial 7 with value: 3.694029918859117.[0m
[32m[I 2026-07-24 12:57:03,321][0m Trial 21 pruned. [0m
[32m[I 2026-07-24 13:01:48,783][0m Trial 22 finished with value: 3.7728934826851144 and parameters: {'n_layers': 6, 'hidden_dim': 730, 'dropout': 0.22304788063210024, 'activation': 'gelu', 'lr': 0.004263867469852598, 'weight_decay': 4.189478599845479e-06, 'batch_size': 33}. Best is trial 7 with value: 3.694029918859117.[0m
[32m[I 2026-07-24 13:07:44,351][0m Trial 23 finished with value: 3.7364558564032335 and parameters: {'n_layers': 5, 'hidden_dim': 891, 'dropout': 0.12742229903997526, 'activation': 'gelu', 'lr': 0.00513483751717772, 'weight_decay': 4.006253433766759e-07, 'batch_size': 27}. Best is trial 7 with value: 3.694029918859117.[0m
[32m[I 2026-07-24 13:12:32,489][0m Trial 24 pruned. [0m
[32m[I 2026-07-24 13:15:08,291][0m Trial 25 finished with value: 3.6946019622467587 and parameters: {'n_layers': 5, 'hidden_dim': 466, 'dropout': 0.0796463903128149, 'activation': 'gelu', 'lr': 0.0049402800715577, 'weight_decay': 3.048508094549839e-05, 'batch_size': 48}. Best is trial 7 with value: 3.694029918859117.[0m
[32m[I 2026-07-24 13:16:57,358][0m Trial 26 finished with value: 3.694474842779413 and parameters: {'n_layers': 5, 'hidden_dim': 339, 'dropout': 0.07331213963692904, 'activation': 'gelu', 'lr': 0.0012349779049411781, 'weight_decay': 2.2834605575503282e-05, 'batch_size': 51}. Best is trial 7 with value: 3.694029918859117.[0m
[32m[I 2026-07-24 13:17:36,948][0m Trial 27 pruned. [0m
[32m[I 2026-07-24 13:19:39,062][0m Trial 28 finished with value: 3.777490722577233 and parameters: {'n_layers': 5, 'hidden_dim': 352, 'dropout': 0.09003131701973902, 'activation': 'relu', 'lr': 0.0013509207993845104, 'weight_decay': 4.8004475599359425e-05, 'batch_size': 49}. Best is trial 7 with value: 3.694029918859117.[0m
[32m[I 2026-07-24 13:20:47,510][0m Trial 29 finished with value: 3.76009067435988 and parameters: {'n_layers': 3, 'hidden_dim': 226, 'dropout': 0.008337248899470129, 'activation': 'gelu', 'lr': 0.0036579585482246313, 'weight_decay': 0.0001903928722320897, 'batch_size': 65}. Best is trial 7 with value: 3.694029918859117.[0m
[32m[I 2026-07-24 13:21:13,327][0m Trial 30 pruned. [0m
[32m[I 2026-07-24 13:23:44,622][0m Trial 31 finished with value: 3.800849159312601 and parameters: {'n_layers': 5, 'hidden_dim': 461, 'dropout': 0.23435590761275948, 'activation': 'gelu', 'lr': 0.0010203791139044962, 'weight_decay': 1.703565190020314e-05, 'batch_size': 39}. Best is trial 7 with value: 3.694029918859117.[0m
[32m[I 2026-07-24 13:25:46,914][0m Trial 32 finished with value: 3.753589440481367 and parameters: {'n_layers': 5, 'hidden_dim': 139, 'dropout': 0.162619092616759, 'activation': 'gelu', 'lr': 0.0018035814555919137, 'weight_decay': 2.706382320074744e-06, 'batch_size': 43}. Best is trial 7 with value: 3.694029918859117.[0m
[32m[I 2026-07-24 13:31:02,420][0m Trial 33 finished with value: 3.7514951255034044 and parameters: {'n_layers': 5, 'hidden_dim': 1011, 'dropout': 0.39457970735098064, 'activation': 'gelu', 'lr': 0.00037887827021708447, 'weight_decay': 7.321077385932195e-07, 'batch_size': 36}. Best is trial 7 with value: 3.694029918859117.[0m
[32m[I 2026-07-24 13:32:39,273][0m Trial 34 finished with value: 3.7689970042415686 and parameters: {'n_layers': 4, 'hidden_dim': 207, 'dropout': 0.30623174772663203, 'activation': 'gelu', 'lr': 0.005828318433729393, 'weight_decay': 8.674434739136048e-08, 'batch_size': 65}. Best is trial 7 with value: 3.694029918859117.[0m
[32m[I 2026-07-24 13:33:36,498][0m Trial 35 pruned. [0m
[32m[I 2026-07-24 13:35:02,584][0m Trial 36 pruned. [0m
[32m[I 2026-07-24 13:35:29,361][0m Trial 37 pruned. [0m
[32m[I 2026-07-24 13:36:19,037][0m Trial 38 pruned. [0m
[32m[I 2026-07-24 13:37:06,471][0m Trial 39 pruned. [0m
[32m[I 2026-07-24 13:38:17,423][0m Trial 40 pruned. [0m
[32m[I 2026-07-24 13:42:56,023][0m Trial 41 finished with value: 3.779060602080584 and parameters: {'n_layers': 6, 'hidden_dim': 716, 'dropout': 0.218196722996012, 'activation': 'gelu', 'lr': 0.009459526454484259, 'weight_decay': 6.842258745140463e-06, 'batch_size': 27}. Best is trial 7 with value: 3.694029918859117.[0m
[32m[I 2026-07-24 13:51:19,913][0m Trial 42 finished with value: 3.812114574889807 and parameters: {'n_layers': 6, 'hidden_dim': 706, 'dropout': 0.15752060728052808, 'activation': 'gelu', 'lr': 0.006730261789078113, 'weight_decay': 1.1032974550962369e-05, 'batch_size': 16}. Best is trial 7 with value: 3.694029918859117.[0m
[32m[I 2026-07-24 13:53:30,198][0m Trial 43 pruned. [0m
[32m[I 2026-07-24 13:57:04,742][0m Trial 44 pruned. [0m
[32m[I 2026-07-24 13:59:17,614][0m Trial 45 finished with value: 3.7775969450571716 and parameters: {'n_layers': 5, 'hidden_dim': 498, 'dropout': 0.03507684171054402, 'activation': 'leaky_relu', 'lr': 0.002285883637350774, 'weight_decay': 6.531458818249783e-07, 'batch_size': 55}. Best is trial 7 with value: 3.694029918859117.[0m
[32m[I 2026-07-24 14:00:34,911][0m Trial 46 pruned. [0m
[32m[I 2026-07-24 14:03:25,948][0m Trial 47 finished with value: 3.789662918415201 and parameters: {'n_layers': 5, 'hidden_dim': 615, 'dropout': 0.190946699722793, 'activation': 'gelu', 'lr': 0.00021558824327136308, 'weight_decay': 4.414573955421241e-06, 'batch_size': 39}. Best is trial 7 with value: 3.694029918859117.[0m
[32m[I 2026-07-24 14:04:29,591][0m Trial 48 pruned. [0m
[32m[I 2026-07-24 14:05:40,416][0m Trial 49 finished with value: 3.719567977911918 and parameters: {'n_layers': 3, 'hidden_dim': 190, 'dropout': 0.363205244485687, 'activation': 'gelu', 'lr': 0.0017458318057898801, 'weight_decay': 1.2750641819099925e-05, 'batch_size': 62}. Best is trial 7 with value: 3.694029918859117.[0m

=== Best Trial ===
  CV RMSE: 3.694030
  Params:  {'n_layers': 3, 'hidden_dim': 379, 'dropout': 0.27134804157912423, 'activation': 'gelu', 'lr': 0.009133995846860976, 'weight_decay': 7.26480307482672e-05, 'batch_size': 38}
============================================================
mlp — 运行开始  20260724_140540
  输出目录:  runs\AW_ST_CMC\AW_ST_CMC_mlp_20260724_140540
============================================================
============================================================
MLP + PharmHGT-style Featurization for AW_ST_CMC Prediction
============================================================

============================================================
Training Final Model
============================================================
    Epoch 300/3000 — Val RMSE: 2.0037 (best: 1.2760)
    Early stopping at epoch 550

============================================================
Test Evaluation
============================================================
  Test MSE:  14.4377
  Test RMSE: 3.7997
  Test MAE:  2.7545
  Test R²:   0.7179
Model saved to runs\AW_ST_CMC\AW_ST_CMC_mlp_20260724_140540\model.pkl

============================================================
SUMMARY — MLP + PharmHGT Features
============================================================
  Features:  522-dim (atom_agg + bond_agg + MACCS + BRICS + surfactant + descriptors)
  Train:     843 (split 737 train + 106 val)
  Test:      70
  Optuna:    50 trials, 5-fold CV
  Best CV RMSE: 3.6940
  Best val RMSE: 0.8740
  Test RMSE: 3.7997
  Test MAE:  2.7545
  Test R²:   0.7179

指标已保存: runs\AW_ST_CMC\AW_ST_CMC_mlp_20260724_140540\metrics.json
索引已更新: runs\AW_ST_CMC\_runs_index.csv
索引已更新: runs\_runs_index.csv
