============================================================
ngboost — 运行开始  20260806_182509
  输出目录:  runs\Pi_CMC\Pi_CMC_ngboost_20260806_182509
============================================================
============================================================
NGBoost + PharmHGT-style Featurization for Pi_CMC Prediction
============================================================
[Cache HIT] Loading features from data\features\surfpro\Pi_CMC
  Train features: (631, 522)
  Test features:  (70, 522)

Split: Train 552, Val 79, Test 70

============================================================
Optuna Hyperparameter Tuning (50 trials, 5-Fold CV)
============================================================
[32m[I 2026-08-06 18:26:49,934][0m Trial 0 finished with value: 4.354343547395094 and parameters: {'n_estimators': 874, 'learning_rate': 0.36808608148776095, 'minibatch_frac': 0.8123957592679836, 'max_depth': 6, 'min_samples_leaf': 19, 'score_rule': 'LogScore'}. Best is trial 0 with value: 4.354343547395094.[0m
[32m[I 2026-08-06 18:28:27,851][0m Trial 1 finished with value: 4.506819774651149 and parameters: {'n_estimators': 1759, 'learning_rate': 0.041917115166952006, 'minibatch_frac': 0.7956508044572318, 'max_depth': 2, 'min_samples_leaf': 98, 'score_rule': 'LogScore'}. Best is trial 0 with value: 4.354343547395094.[0m
[32m[I 2026-08-06 18:29:01,689][0m Trial 2 finished with value: 5.627800873838933 and parameters: {'n_estimators': 527, 'learning_rate': 0.0031261029103110596, 'minibatch_frac': 0.5129695700716763, 'max_depth': 5, 'min_samples_leaf': 46, 'score_rule': 'CRPScore'}. Best is trial 0 with value: 4.354343547395094.[0m
[32m[I 2026-08-06 18:29:27,930][0m Trial 3 finished with value: 5.738864266986875 and parameters: {'n_estimators': 451, 'learning_rate': 0.00614454378558747, 'minibatch_frac': 0.5564532903055841, 'max_depth': 5, 'min_samples_leaf': 80, 'score_rule': 'CRPScore'}. Best is trial 0 with value: 4.354343547395094.[0m
[32m[I 2026-08-06 18:31:15,752][0m Trial 4 finished with value: 4.974928582805849 and parameters: {'n_estimators': 1266, 'learning_rate': 0.0013346527038305934, 'minibatch_frac': 0.7252813963310067, 'max_depth': 3, 'min_samples_leaf': 11, 'score_rule': 'CRPScore'}. Best is trial 0 with value: 4.354343547395094.[0m
[32m[I 2026-08-06 18:31:48,091][0m Trial 5 pruned. [0m
[32m[I 2026-08-06 18:32:04,203][0m Trial 6 finished with value: 4.646154631345877 and parameters: {'n_estimators': 261, 'learning_rate': 0.2845958019429146, 'minibatch_frac': 0.48114598712001183, 'max_depth': 6, 'min_samples_leaf': 34, 'score_rule': 'CRPScore'}. Best is trial 0 with value: 4.354343547395094.[0m
[32m[I 2026-08-06 18:32:47,644][0m Trial 7 finished with value: 4.686507021626353 and parameters: {'n_estimators': 532, 'learning_rate': 0.4138851334163266, 'minibatch_frac': 0.8425929763527802, 'max_depth': 8, 'min_samples_leaf': 90, 'score_rule': 'CRPScore'}. Best is trial 0 with value: 4.354343547395094.[0m
[32m[I 2026-08-06 18:32:54,781][0m Trial 8 pruned. [0m
[32m[I 2026-08-06 18:33:15,980][0m Trial 9 pruned. [0m
[32m[I 2026-08-06 18:36:34,553][0m Trial 10 finished with value: 4.180209990400831 and parameters: {'n_estimators': 1125, 'learning_rate': 0.06471846507238901, 'minibatch_frac': 0.978675977551506, 'max_depth': 8, 'min_samples_leaf': 7, 'score_rule': 'LogScore'}. Best is trial 10 with value: 4.180209990400831.[0m
[32m[I 2026-08-06 18:39:58,657][0m Trial 11 finished with value: 4.223247944971728 and parameters: {'n_estimators': 1126, 'learning_rate': 0.10227171900952085, 'minibatch_frac': 0.9695256021614991, 'max_depth': 8, 'min_samples_leaf': 5, 'score_rule': 'LogScore'}. Best is trial 10 with value: 4.180209990400831.[0m
[32m[I 2026-08-06 18:43:53,403][0m Trial 12 finished with value: 4.158927329458672 and parameters: {'n_estimators': 1261, 'learning_rate': 0.0736412452865339, 'minibatch_frac': 0.997568633074886, 'max_depth': 8, 'min_samples_leaf': 5, 'score_rule': 'LogScore'}. Best is trial 12 with value: 4.158927329458672.[0m
[32m[I 2026-08-06 18:47:15,886][0m Trial 13 finished with value: 4.2411054944086946 and parameters: {'n_estimators': 1419, 'learning_rate': 0.030896000507581595, 'minibatch_frac': 0.9879799185471897, 'max_depth': 8, 'min_samples_leaf': 25, 'score_rule': 'LogScore'}. Best is trial 12 with value: 4.158927329458672.[0m
[32m[I 2026-08-06 18:49:27,392][0m Trial 14 finished with value: 4.1518008708825445 and parameters: {'n_estimators': 951, 'learning_rate': 0.0372120190892223, 'minibatch_frac': 0.9060521437014785, 'max_depth': 8, 'min_samples_leaf': 19, 'score_rule': 'LogScore'}. Best is trial 14 with value: 4.1518008708825445.[0m
[32m[I 2026-08-06 18:53:34,691][0m Trial 15 finished with value: 4.214468007263704 and parameters: {'n_estimators': 1999, 'learning_rate': 0.019727811451668138, 'minibatch_frac': 0.8929910188736532, 'max_depth': 7, 'min_samples_leaf': 23, 'score_rule': 'LogScore'}. Best is trial 14 with value: 4.1518008708825445.[0m
[32m[I 2026-08-06 18:54:02,814][0m Trial 16 pruned. [0m
[32m[I 2026-08-06 18:56:14,871][0m Trial 17 finished with value: 4.23120318510885 and parameters: {'n_estimators': 1465, 'learning_rate': 0.014430495947259323, 'minibatch_frac': 0.7107541409637292, 'max_depth': 7, 'min_samples_leaf': 28, 'score_rule': 'LogScore'}. Best is trial 14 with value: 4.1518008708825445.[0m
[32m[I 2026-08-06 18:58:27,305][0m Trial 18 finished with value: 4.234030154084334 and parameters: {'n_estimators': 959, 'learning_rate': 0.15796261807789624, 'minibatch_frac': 0.8923674745777769, 'max_depth': 7, 'min_samples_leaf': 15, 'score_rule': 'LogScore'}. Best is trial 14 with value: 4.1518008708825445.[0m
[32m[I 2026-08-06 18:58:43,571][0m Trial 19 pruned. [0m
[32m[I 2026-08-06 18:59:33,915][0m Trial 20 pruned. [0m
[32m[I 2026-08-06 19:03:23,526][0m Trial 21 finished with value: 4.209944425818714 and parameters: {'n_estimators': 1258, 'learning_rate': 0.06753893821187404, 'minibatch_frac': 0.9994986934471286, 'max_depth': 8, 'min_samples_leaf': 7, 'score_rule': 'LogScore'}. Best is trial 14 with value: 4.1518008708825445.[0m
[32m[I 2026-08-06 19:06:11,003][0m Trial 22 pruned. [0m
[32m[I 2026-08-06 19:07:50,755][0m Trial 23 finished with value: 4.071378145874953 and parameters: {'n_estimators': 683, 'learning_rate': 0.03200151878102724, 'minibatch_frac': 0.8603137662085357, 'max_depth': 7, 'min_samples_leaf': 5, 'score_rule': 'LogScore'}. Best is trial 23 with value: 4.071378145874953.[0m
[32m[I 2026-08-06 19:09:10,342][0m Trial 24 finished with value: 4.165847778743841 and parameters: {'n_estimators': 742, 'learning_rate': 0.03149207060014196, 'minibatch_frac': 0.7834500335286854, 'max_depth': 6, 'min_samples_leaf': 18, 'score_rule': 'LogScore'}. Best is trial 23 with value: 4.071378145874953.[0m
[32m[I 2026-08-06 19:09:40,199][0m Trial 25 pruned. [0m
[32m[I 2026-08-06 19:12:15,047][0m Trial 26 finished with value: 4.118924446746245 and parameters: {'n_estimators': 1339, 'learning_rate': 0.009622799169974838, 'minibatch_frac': 0.7454674359963451, 'max_depth': 7, 'min_samples_leaf': 13, 'score_rule': 'LogScore'}. Best is trial 23 with value: 4.071378145874953.[0m
[32m[I 2026-08-06 19:13:39,286][0m Trial 27 pruned. [0m
[32m[I 2026-08-06 19:14:38,382][0m Trial 28 finished with value: 4.157324194516608 and parameters: {'n_estimators': 603, 'learning_rate': 0.04326871029234352, 'minibatch_frac': 0.6596325009190775, 'max_depth': 6, 'min_samples_leaf': 13, 'score_rule': 'LogScore'}. Best is trial 23 with value: 4.071378145874953.[0m
[32m[I 2026-08-06 19:16:31,677][0m Trial 29 finished with value: 4.1746879275905995 and parameters: {'n_estimators': 972, 'learning_rate': 0.009432242414806015, 'minibatch_frac': 0.8166517442157333, 'max_depth': 7, 'min_samples_leaf': 20, 'score_rule': 'LogScore'}. Best is trial 23 with value: 4.071378145874953.[0m
[32m[I 2026-08-06 19:17:32,473][0m Trial 30 pruned. [0m
[32m[I 2026-08-06 19:18:29,020][0m Trial 31 finished with value: 4.213957882934169 and parameters: {'n_estimators': 583, 'learning_rate': 0.040916148470498036, 'minibatch_frac': 0.659693466469748, 'max_depth': 6, 'min_samples_leaf': 13, 'score_rule': 'LogScore'}. Best is trial 23 with value: 4.071378145874953.[0m
[32m[I 2026-08-06 19:19:40,113][0m Trial 32 finished with value: 4.1419001859172315 and parameters: {'n_estimators': 656, 'learning_rate': 0.01953009421116088, 'minibatch_frac': 0.8260794306857383, 'max_depth': 5, 'min_samples_leaf': 12, 'score_rule': 'LogScore'}. Best is trial 23 with value: 4.071378145874953.[0m
[32m[I 2026-08-06 19:19:54,574][0m Trial 33 pruned. [0m
[32m[I 2026-08-06 19:20:49,081][0m Trial 34 pruned. [0m
[32m[I 2026-08-06 19:22:11,605][0m Trial 35 finished with value: 4.155865401148111 and parameters: {'n_estimators': 786, 'learning_rate': 0.021975616155652924, 'minibatch_frac': 0.7871551539761998, 'max_depth': 5, 'min_samples_leaf': 10, 'score_rule': 'LogScore'}. Best is trial 23 with value: 4.071378145874953.[0m
[32m[I 2026-08-06 19:22:28,257][0m Trial 36 pruned. [0m
[32m[I 2026-08-06 19:22:37,070][0m Trial 37 pruned. [0m
[32m[I 2026-08-06 19:22:56,347][0m Trial 38 pruned. [0m
[32m[I 2026-08-06 19:23:49,345][0m Trial 39 pruned. [0m
[32m[I 2026-08-06 19:25:21,164][0m Trial 40 pruned. [0m
[32m[I 2026-08-06 19:26:08,648][0m Trial 41 pruned. [0m
[32m[I 2026-08-06 19:26:47,435][0m Trial 42 pruned. [0m
[32m[I 2026-08-06 19:27:45,982][0m Trial 43 finished with value: 4.094256175157999 and parameters: {'n_estimators': 475, 'learning_rate': 0.008579324470111449, 'minibatch_frac': 0.7954950674215038, 'max_depth': 6, 'min_samples_leaf': 5, 'score_rule': 'LogScore'}. Best is trial 23 with value: 4.071378145874953.[0m
[32m[I 2026-08-06 19:28:49,688][0m Trial 44 finished with value: 4.17934835711218 and parameters: {'n_estimators': 506, 'learning_rate': 0.004255322290346879, 'minibatch_frac': 0.8016896606312742, 'max_depth': 6, 'min_samples_leaf': 5, 'score_rule': 'LogScore'}. Best is trial 23 with value: 4.071378145874953.[0m
[32m[I 2026-08-06 19:29:02,306][0m Trial 45 pruned. [0m
[32m[I 2026-08-06 19:29:16,269][0m Trial 46 pruned. [0m
[32m[I 2026-08-06 19:31:51,899][0m Trial 47 finished with value: 4.0594800440473815 and parameters: {'n_estimators': 1191, 'learning_rate': 0.008397642406399754, 'minibatch_frac': 0.8949196833560688, 'max_depth': 6, 'min_samples_leaf': 9, 'score_rule': 'LogScore'}. Best is trial 47 with value: 4.0594800440473815.[0m
[32m[I 2026-08-06 19:34:26,613][0m Trial 48 finished with value: 4.121041628592545 and parameters: {'n_estimators': 1203, 'learning_rate': 0.0019484059333349612, 'minibatch_frac': 0.8383044727636936, 'max_depth': 6, 'min_samples_leaf': 5, 'score_rule': 'LogScore'}. Best is trial 47 with value: 4.0594800440473815.[0m
[32m[I 2026-08-06 19:36:04,580][0m Trial 49 pruned. [0m

=== Best Trial ===
  CV RMSE: 4.059480
  Params:  {'n_estimators': 1191, 'learning_rate': 0.008397642406399754, 'minibatch_frac': 0.8949196833560688, 'max_depth': 6, 'min_samples_leaf': 9, 'score_rule': 'LogScore'}

============================================================
Training Final Model with Best Hyperparameters
============================================================
[iter 0] loss=3.4075 val_loss=0.0000 scale=1.0000 norm=5.7791
[iter 100] loss=2.9264 val_loss=0.0000 scale=1.0000 norm=3.6117
[iter 200] loss=2.5332 val_loss=0.0000 scale=1.0000 norm=2.4494
[iter 300] loss=2.2236 val_loss=0.0000 scale=1.0000 norm=1.9604
[iter 400] loss=2.0338 val_loss=0.0000 scale=1.0000 norm=1.7621
[iter 500] loss=1.8418 val_loss=0.0000 scale=1.0000 norm=1.5336
[iter 600] loss=1.7020 val_loss=0.0000 scale=1.0000 norm=1.4186
[iter 700] loss=1.5871 val_loss=0.0000 scale=1.0000 norm=1.3277
[iter 800] loss=1.4665 val_loss=0.0000 scale=1.0000 norm=1.2316
[iter 900] loss=1.3733 val_loss=0.0000 scale=0.5000 norm=0.5773
[iter 1000] loss=1.3038 val_loss=0.0000 scale=1.0000 norm=1.0921
[iter 1100] loss=1.2480 val_loss=0.0000 scale=1.0000 norm=1.0654

============================================================
Test Evaluation
============================================================
  Test MSE:  19.3103
  Test RMSE: 4.3943
  Test MAE:  3.1303
  Test R²:   0.6277
  Distribution: Normal (mean ± std)
  Avg pred std: 1.0070

============================================================
Feature Importance
============================================================
  (unexpected shape (2, 522), skipping)

Plot saved to runs\Pi_CMC\Pi_CMC_ngboost_20260806_182509\pred_vs_true.png
Model saved to runs\Pi_CMC\Pi_CMC_ngboost_20260806_182509\model.pkl

============================================================
SUMMARY — NGBoost + PharmHGT Features
============================================================
  Features:      522-dim
  Train:         631 (split 552 train + 79 val)
  Test:          70
  Optuna:    50 trials, 5-fold CV
  Best CV RMSE: 4.0595
  Test RMSE:     4.3943
  Test MAE:      3.1303
  Test R²:       0.6277
  Distribution:  Normal (probabilistic output)

指标已保存: runs\Pi_CMC\Pi_CMC_ngboost_20260806_182509\metrics.json
索引已更新: runs\Pi_CMC\_runs_index.csv
索引已更新: runs\_runs_index.csv
