[32m[I 2026-08-05 20:50:29,911][0m Trial 74 finished with value: 1.0811353181545786 and parameters: {'n_estimators': 1580, 'max_depth': 8, 'learning_rate': 0.010094749932621393, 'subsample': 0.866832558014492, 'colsample_bytree': 0.6794317675723252, 'colsample_bylevel': 0.6711908850300089, 'colsample_bynode': 0.5393622376512106, 'min_child_weight': 1.0734772847732303, 'gamma': 0.060180334593133065, 'reg_alpha': 0.0012100381266838792, 'reg_lambda': 3.100272183430928e-07, 'max_delta_step': 3.1587116757474645, 'booster': 'gbtree'}. Best is trial 53 with value: 1.0256565779972144.[0m
[32m[I 2026-08-05 20:50:36,670][0m Trial 75 finished with value: 1.0480782896270309 and parameters: {'n_estimators': 1860, 'max_depth': 7, 'learning_rate': 0.018651409937782647, 'subsample': 0.8952401725724113, 'colsample_bytree': 0.8018070585747576, 'colsample_bylevel': 0.8319208320145227, 'colsample_bynode': 0.8710326425460321, 'min_child_weight': 1.3623274693746608, 'gamma': 0.25808763464186335, 'reg_alpha': 0.00029700835987197383, 'reg_lambda': 1.729743314383004e-07, 'max_delta_step': 1.548392235060002, 'booster': 'dart'}. Best is trial 53 with value: 1.0256565779972144.[0m
[32m[I 2026-08-05 20:50:50,621][0m Trial 76 finished with value: 1.0449410479055463 and parameters: {'n_estimators': 1927, 'max_depth': 4, 'learning_rate': 0.013946285458961084, 'subsample': 0.9183895602013467, 'colsample_bytree': 0.9476890132689528, 'colsample_bylevel': 0.9308913964946274, 'colsample_bynode': 0.9749822519357435, 'min_child_weight': 1.712519901709674, 'gamma': 0.15856636419785727, 'reg_alpha': 1.8378885507812867e-05, 'reg_lambda': 4.913344312379225e-06, 'max_delta_step': 0.6328553519216978, 'booster': 'dart'}. Best is trial 53 with value: 1.0256565779972144.[0m
[32m[I 2026-08-05 20:51:02,408][0m Trial 77 finished with value: 1.062992524013377 and parameters: {'n_estimators': 2249, 'max_depth': 4, 'learning_rate': 0.013842374579574044, 'subsample': 0.9843815807175215, 'colsample_bytree': 0.8114575097752859, 'colsample_bylevel': 0.8961728013615319, 'colsample_bynode': 0.9397627923727074, 'min_child_weight': 1.2437452232053412, 'gamma': 0.7673104724198124, 'reg_alpha': 1.2488187021323524e-05, 'reg_lambda': 0.000129516684100461, 'max_delta_step': 0.3900171839137166, 'booster': 'dart'}. Best is trial 53 with value: 1.0256565779972144.[0m
[32m[I 2026-08-05 20:51:14,212][0m Trial 78 finished with value: 1.0469520309762892 and parameters: {'n_estimators': 2289, 'max_depth': 10, 'learning_rate': 0.010034500586175187, 'subsample': 0.9800379655051356, 'colsample_bytree': 0.6696786454538731, 'colsample_bylevel': 0.8394245051582403, 'colsample_bynode': 0.9001074430305938, 'min_child_weight': 1.1107034248154, 'gamma': 0.10786729706521919, 'reg_alpha': 0.05253531821689292, 'reg_lambda': 4.944505761625386e-08, 'max_delta_step': 2.988579569946345, 'booster': 'dart'}. Best is trial 53 with value: 1.0256565779972144.[0m
[32m[I 2026-08-05 20:51:19,546][0m Trial 79 finished with value: 1.1124984528479995 and parameters: {'n_estimators': 1751, 'max_depth': 4, 'learning_rate': 0.01805691735320715, 'subsample': 0.8855379209800515, 'colsample_bytree': 0.9663811100309324, 'colsample_bylevel': 0.9766021481037633, 'colsample_bynode': 0.9769901722112444, 'min_child_weight': 4.1224198407583446, 'gamma': 0.4179029277821198, 'reg_alpha': 1.8261967433961557e-06, 'reg_lambda': 8.111846831230744e-07, 'max_delta_step': 1.4107337179574935, 'booster': 'dart'}. Best is trial 53 with value: 1.0256565779972144.[0m
[32m[I 2026-08-05 20:51:24,711][0m Trial 80 finished with value: 1.1696059443507658 and parameters: {'n_estimators': 2034, 'max_depth': 10, 'learning_rate': 0.021763571341671832, 'subsample': 0.8451650755226809, 'colsample_bytree': 0.657267272079113, 'colsample_bylevel': 0.7624153445788285, 'colsample_bynode': 0.6978325557129774, 'min_child_weight': 2.277923244489695, 'gamma': 0.25479380440970717, 'reg_alpha': 5.8609937119410915, 'reg_lambda': 4.096039423210608e-08, 'max_delta_step': 3.8273642645163557, 'booster': 'dart'}. Best is trial 53 with value: 1.0256565779972144.[0m
[32m[I 2026-08-05 20:51:30,509][0m Trial 81 finished with value: 1.046625970196596 and parameters: {'n_estimators': 2288, 'max_depth': 10, 'learning_rate': 0.017010598350454976, 'subsample': 0.9969137864320076, 'colsample_bytree': 0.6617054335732517, 'colsample_bylevel': 0.7681476648646332, 'colsample_bynode': 0.7263961103526267, 'min_child_weight': 1.5258034857428968, 'gamma': 0.17052478561348436, 'reg_alpha': 0.006332739739226975, 'reg_lambda': 2.8198172881208745e-08, 'max_delta_step': 2.689768437612404, 'booster': 'dart'}. Best is trial 53 with value: 1.0256565779972144.[0m
[32m[I 2026-08-05 20:51:33,144][0m Trial 82 finished with value: 1.1019032244403049 and parameters: {'n_estimators': 2142, 'max_depth': 11, 'learning_rate': 0.05119268442712258, 'subsample': 0.9929673337760306, 'colsample_bytree': 0.6713220854599043, 'colsample_bylevel': 0.6131242869836946, 'colsample_bynode': 0.5367412223027406, 'min_child_weight': 3.2646701024168228, 'gamma': 0.12475678312912768, 'reg_alpha': 0.0033755490403640635, 'reg_lambda': 7.069994197123083e-07, 'max_delta_step': 3.4397538640040723, 'booster': 'dart'}. Best is trial 53 with value: 1.0256565779972144.[0m
[32m[I 2026-08-05 20:51:35,539][0m Trial 83 finished with value: 1.119840205608455 and parameters: {'n_estimators': 2830, 'max_depth': 11, 'learning_rate': 0.10255481860165055, 'subsample': 0.9825333957353978, 'colsample_bytree': 0.4446661490151766, 'colsample_bylevel': 0.7248236028878475, 'colsample_bynode': 0.9327304521267414, 'min_child_weight': 2.501099464442466, 'gamma': 0.04728337946389513, 'reg_alpha': 1.4644815470806052, 'reg_lambda': 0.0008757683973599785, 'max_delta_step': 3.7529385282951053, 'booster': 'dart'}. Best is trial 53 with value: 1.0256565779972144.[0m
[32m[I 2026-08-05 20:51:44,344][0m Trial 84 finished with value: 1.0678201830184744 and parameters: {'n_estimators': 2294, 'max_depth': 12, 'learning_rate': 0.010712146358531481, 'subsample': 0.8271413254497871, 'colsample_bytree': 0.6923130997362448, 'colsample_bylevel': 0.7529079500611628, 'colsample_bynode': 0.9088763361112412, 'min_child_weight': 1.1530717321001256, 'gamma': 0.28357925165701553, 'reg_alpha': 0.0010648133168249683, 'reg_lambda': 1.3746215746818172e-08, 'max_delta_step': 2.920694325807853, 'booster': 'dart'}. Best is trial 53 with value: 1.0256565779972144.[0m
[32m[I 2026-08-05 20:51:49,595][0m Trial 85 finished with value: 1.1172429087200813 and parameters: {'n_estimators': 2199, 'max_depth': 9, 'learning_rate': 0.01499849173465881, 'subsample': 0.970484921937539, 'colsample_bytree': 0.6656106807333683, 'colsample_bylevel': 0.7457617834611907, 'colsample_bynode': 0.6450629487940992, 'min_child_weight': 2.070799238652124, 'gamma': 0.5999214255369654, 'reg_alpha': 0.004015656011988123, 'reg_lambda': 6.882971206987708e-08, 'max_delta_step': 2.1407693251674718, 'booster': 'dart'}. Best is trial 53 with value: 1.0256565779972144.[0m
[32m[I 2026-08-05 20:51:59,256][0m Trial 86 finished with value: 1.0651356679505446 and parameters: {'n_estimators': 1672, 'max_depth': 5, 'learning_rate': 0.015423799824750126, 'subsample': 0.9497343422569152, 'colsample_bytree': 0.9790667297274467, 'colsample_bylevel': 0.8629562484385689, 'colsample_bynode': 0.6934346982784381, 'min_child_weight': 2.4887746556425054, 'gamma': 0.06564598317882563, 'reg_alpha': 9.52209510609281e-06, 'reg_lambda': 7.988550033215138e-07, 'max_delta_step': 0.8180484128328339, 'booster': 'dart'}. Best is trial 53 with value: 1.0256565779972144.[0m
[32m[I 2026-08-05 20:52:11,450][0m Trial 87 finished with value: 1.029225089564809 and parameters: {'n_estimators': 1725, 'max_depth': 12, 'learning_rate': 0.014428615106919158, 'subsample': 0.9529228557661475, 'colsample_bytree': 0.6444788835102742, 'colsample_bylevel': 0.740949896601692, 'colsample_bynode': 0.9256399764094391, 'min_child_weight': 1.2964577678194618, 'gamma': 0.05095806942420139, 'reg_alpha': 0.23714966176206792, 'reg_lambda': 9.637606522732822e-07, 'max_delta_step': 2.098533499093662, 'booster': 'gbtree'}. Best is trial 53 with value: 1.0256565779972144.[0m
[32m[I 2026-08-05 20:52:21,438][0m Trial 88 finished with value: 1.069305789812351 and parameters: {'n_estimators': 1349, 'max_depth': 11, 'learning_rate': 0.011000751826766202, 'subsample': 0.8863585388910823, 'colsample_bytree': 0.5870471138126575, 'colsample_bylevel': 0.7308880383329782, 'colsample_bynode': 0.9217631081749836, 'min_child_weight': 1.4041258728029749, 'gamma': 0.09663211865436963, 'reg_alpha': 0.14263729795320765, 'reg_lambda': 6.662330910931399e-08, 'max_delta_step': 2.810769381179707, 'booster': 'gbtree'}. Best is trial 53 with value: 1.0256565779972144.[0m
[32m[I 2026-08-05 20:52:38,920][0m Trial 89 finished with value: 1.032764487610229 and parameters: {'n_estimators': 2469, 'max_depth': 10, 'learning_rate': 0.012917775969060212, 'subsample': 0.9156811705591048, 'colsample_bytree': 0.7795302288251916, 'colsample_bylevel': 0.9198687564835062, 'colsample_bynode': 0.8401500475719119, 'min_child_weight': 1.2457675037764926, 'gamma': 0.00497346207767968, 'reg_alpha': 0.11771892480435778, 'reg_lambda': 1.4513682973634295e-06, 'max_delta_step': 2.4682916249919695, 'booster': 'dart'}. Best is trial 53 with value: 1.0256565779972144.[0m
[32m[I 2026-08-05 20:52:45,808][0m Trial 90 finished with value: 1.1099518384099756 and parameters: {'n_estimators': 1899, 'max_depth': 12, 'learning_rate': 0.012706945886193737, 'subsample': 0.9609370407433233, 'colsample_bytree': 0.7205175213189414, 'colsample_bylevel': 0.6149697873949235, 'colsample_bynode': 0.8450027428182427, 'min_child_weight': 2.053468424677147, 'gamma': 0.7606466040747153, 'reg_alpha': 0.42572660458886746, 'reg_lambda': 2.1715768876052565e-06, 'max_delta_step': 1.732973582670954, 'booster': 'gbtree'}. Best is trial 53 with value: 1.0256565779972144.[0m
[32m[I 2026-08-05 20:52:52,828][0m Trial 91 finished with value: 1.0631886928862915 and parameters: {'n_estimators': 2080, 'max_depth': 11, 'learning_rate': 0.01458527806440311, 'subsample': 0.9872119349985202, 'colsample_bytree': 0.6096954758273126, 'colsample_bylevel': 0.7339164322354205, 'colsample_bynode': 0.8059960589518327, 'min_child_weight': 1.8214146584947508, 'gamma': 0.27254205449757696, 'reg_alpha': 0.07424175817518251, 'reg_lambda': 1.0524072831525328e-07, 'max_delta_step': 2.777136110849415, 'booster': 'dart'}. Best is trial 53 with value: 1.0256565779972144.[0m
[32m[I 2026-08-05 20:53:00,937][0m Trial 92 finished with value: 1.0723875913282641 and parameters: {'n_estimators': 2126, 'max_depth': 12, 'learning_rate': 0.016053595435675146, 'subsample': 0.9286724747374154, 'colsample_bytree': 0.6262385823894485, 'colsample_bylevel': 0.8949299723489083, 'colsample_bynode': 0.6236119470313821, 'min_child_weight': 1.5590683343683978, 'gamma': 0.08205318415133023, 'reg_alpha': 1.3004363945883466, 'reg_lambda': 7.162064845995313e-08, 'max_delta_step': 3.388289423868885, 'booster': 'gbtree'}. Best is trial 53 with value: 1.0256565779972144.[0m
[32m[I 2026-08-05 20:53:13,010][0m Trial 93 finished with value: 1.138841337092567 and parameters: {'n_estimators': 2102, 'max_depth': 10, 'learning_rate': 0.01197392255848308, 'subsample': 0.9074860573856031, 'colsample_bytree': 0.6269666171377437, 'colsample_bylevel': 0.8853060624173484, 'colsample_bynode': 0.921958746283408, 'min_child_weight': 1.9882716556182674, 'gamma': 0.22681996762922207, 'reg_alpha': 5.0196432582735095, 'reg_lambda': 1.7692438060716984e-06, 'max_delta_step': 3.903677019023962, 'booster': 'dart'}. Best is trial 53 with value: 1.0256565779972144.[0m
[32m[I 2026-08-05 20:53:23,107][0m Trial 94 finished with value: 1.051800932806 and parameters: {'n_estimators': 2082, 'max_depth': 8, 'learning_rate': 0.01453512634902974, 'subsample': 0.9555380360575105, 'colsample_bytree': 0.5533730220294131, 'colsample_bylevel': 0.6461298571524989, 'colsample_bynode': 0.7564973858009236, 'min_child_weight': 1.0683148319400666, 'gamma': 0.45857784614910785, 'reg_alpha': 0.0014172326660584508, 'reg_lambda': 3.407095293223701e-08, 'max_delta_step': 0.5932807626421315, 'booster': 'dart'}. Best is trial 53 with value: 1.0256565779972144.[0m
[32m[I 2026-08-05 20:53:29,508][0m Trial 95 finished with value: 1.0598090800459772 and parameters: {'n_estimators': 2486, 'max_depth': 10, 'learning_rate': 0.02349682684396366, 'subsample': 0.8968104942027741, 'colsample_bytree': 0.8911611143725755, 'colsample_bylevel': 0.8059567829910306, 'colsample_bynode': 0.9223612692954779, 'min_child_weight': 1.8771404414750663, 'gamma': 0.2372524676773094, 'reg_alpha': 0.6539123879855764, 'reg_lambda': 3.6354706178861026e-07, 'max_delta_step': 2.0291434341841392, 'booster': 'dart'}. Best is trial 53 with value: 1.0256565779972144.[0m
[32m[I 2026-08-05 20:53:40,597][0m Trial 96 finished with value: 1.0799801490925227 and parameters: {'n_estimators': 2426, 'max_depth': 12, 'learning_rate': 0.011477414504260366, 'subsample': 0.9993315541374731, 'colsample_bytree': 0.7772736919968741, 'colsample_bylevel': 0.947667482760205, 'colsample_bynode': 0.9465036592030276, 'min_child_weight': 1.2472324641434651, 'gamma': 0.17763743207926688, 'reg_alpha': 0.01180339176574539, 'reg_lambda': 2.522670390770945e-08, 'max_delta_step': 4.40893576565615, 'booster': 'dart'}. Best is trial 53 with value: 1.0256565779972144.[0m
[32m[I 2026-08-05 20:53:51,264][0m Trial 97 finished with value: 1.0274564697782769 and parameters: {'n_estimators': 1664, 'max_depth': 4, 'learning_rate': 0.017539254380171364, 'subsample': 0.8326417107650959, 'colsample_bytree': 0.8081894702775645, 'colsample_bylevel': 0.9206389686214075, 'colsample_bynode': 0.9205484611003801, 'min_child_weight': 1.295389928712188, 'gamma': 0.17268366061951138, 'reg_alpha': 1.751611804791326e-05, 'reg_lambda': 0.0014041287375325222, 'max_delta_step': 0.669035248041045, 'booster': 'gbtree'}. Best is trial 53 with value: 1.0256565779972144.[0m
[32m[I 2026-08-05 20:53:56,387][0m Trial 98 finished with value: 1.0665283757964925 and parameters: {'n_estimators': 1521, 'max_depth': 6, 'learning_rate': 0.020397235509175868, 'subsample': 0.791670300234288, 'colsample_bytree': 0.7206876249530881, 'colsample_bylevel': 0.9067320667037386, 'colsample_bynode': 0.9386433714932064, 'min_child_weight': 1.6780014467781514, 'gamma': 0.6931923054287893, 'reg_alpha': 2.0655096670746265e-06, 'reg_lambda': 0.004572466428454751, 'max_delta_step': 1.4793796028163997, 'booster': 'gbtree'}. Best is trial 53 with value: 1.0256565779972144.[0m
[32m[I 2026-08-05 20:54:04,893][0m Trial 99 finished with value: 1.1014592005888475 and parameters: {'n_estimators': 2908, 'max_depth': 10, 'learning_rate': 0.011418522304496694, 'subsample': 0.9119607108119036, 'colsample_bytree': 0.8226365848575625, 'colsample_bylevel': 0.8612111537424411, 'colsample_bynode': 0.7551997354253931, 'min_child_weight': 3.325776637624188, 'gamma': 0.2442484539652858, 'reg_alpha': 0.00034144530461817043, 'reg_lambda': 5.289538417294888e-05, 'max_delta_step': 3.496040996809344, 'booster': 'dart'}. Best is trial 53 with value: 1.0256565779972144.[0m
[32m[I 2026-08-05 20:54:09,170][0m Trial 100 finished with value: 1.060289442429767 and parameters: {'n_estimators': 1728, 'max_depth': 6, 'learning_rate': 0.03870550601882155, 'subsample': 0.8857517707190892, 'colsample_bytree': 0.9289808553844259, 'colsample_bylevel': 0.9777538690001324, 'colsample_bynode': 0.8292267685721125, 'min_child_weight': 1.1849362827169627, 'gamma': 0.06967670789594138, 'reg_alpha': 5.495912383208892e-05, 'reg_lambda': 0.0013769424515306555, 'max_delta_step': 3.050747117525201, 'booster': 'gbtree'}. Best is trial 53 with value: 1.0256565779972144.[0m
[32m[I 2026-08-05 20:54:20,804][0m Trial 101 finished with value: 1.0577488808846898 and parameters: {'n_estimators': 2593, 'max_depth': 8, 'learning_rate': 0.014822380930757297, 'subsample': 0.9292064926045359, 'colsample_bytree': 0.6928013747159657, 'colsample_bylevel': 0.9045859217189043, 'colsample_bynode': 0.669344221180825, 'min_child_weight': 2.1796171117615435, 'gamma': 0.02919816880739543, 'reg_alpha': 0.5938079775372272, 'reg_lambda': 1.023843699980579e-05, 'max_delta_step': 0.8133466939296476, 'booster': 'dart'}. Best is trial 53 with value: 1.0256565779972144.[0m
[32m[I 2026-08-05 20:54:24,508][0m Trial 102 finished with value: 1.0655247435323252 and parameters: {'n_estimators': 1871, 'max_depth': 12, 'learning_rate': 0.0503240247760918, 'subsample': 0.9904766723540743, 'colsample_bytree': 0.6254670957308716, 'colsample_bylevel': 0.6351226539339767, 'colsample_bynode': 0.9702381022430908, 'min_child_weight': 3.2120945166121713, 'gamma': 0.11282499948804908, 'reg_alpha': 0.053666938714531584, 'reg_lambda': 1.8040990564113577e-06, 'max_delta_step': 1.9567974022126169, 'booster': 'gbtree'}. Best is trial 53 with value: 1.0256565779972144.[0m
[32m[I 2026-08-05 20:54:36,857][0m Trial 103 finished with value: 1.094899982538818 and parameters: {'n_estimators': 1595, 'max_depth': 11, 'learning_rate': 0.01127515981638139, 'subsample': 0.9957545747498399, 'colsample_bytree': 0.7228968378039917, 'colsample_bylevel': 0.8541392245969074, 'colsample_bynode': 0.9483526651437467, 'min_child_weight': 1.5644402315273338, 'gamma': 0.459123133411296, 'reg_alpha': 2.9001176380220035, 'reg_lambda': 0.00012063446020278159, 'max_delta_step': 1.0359639414110193, 'booster': 'gbtree'}. Best is trial 53 with value: 1.0256565779972144.[0m
[32m[I 2026-08-05 20:54:46,160][0m Trial 104 finished with value: 1.01767345030837 and parameters: {'n_estimators': 1490, 'max_depth': 5, 'learning_rate': 0.020834456042115597, 'subsample': 0.9191822675701319, 'colsample_bytree': 0.7632182497212671, 'colsample_bylevel': 0.9972468817964993, 'colsample_bynode': 0.8404884898727596, 'min_child_weight': 1.448452222864296, 'gamma': 0.28606822180709374, 'reg_alpha': 0.01512971936952151, 'reg_lambda': 0.15720489961114326, 'max_delta_step': 0.5591213170729636, 'booster': 'gbtree'}. Best is trial 104 with value: 1.01767345030837.[0m
[32m[I 2026-08-05 20:55:02,852][0m Trial 105 finished with value: 1.1141742585470247 and parameters: {'n_estimators': 1932, 'max_depth': 6, 'learning_rate': 0.03640688950025253, 'subsample': 0.8585400083632072, 'colsample_bytree': 0.797423387766735, 'colsample_bylevel': 0.971139362837257, 'colsample_bynode': 0.9732824520616815, 'min_child_weight': 3.0262750835871657, 'gamma': 0.03561763526627648, 'reg_alpha': 1.1984266733840476, 'reg_lambda': 0.2071290677745864, 'max_delta_step': 0.14043819980318556, 'booster': 'gbtree'}. Best is trial 104 with value: 1.01767345030837.[0m
[32m[I 2026-08-05 20:55:08,598][0m Trial 106 finished with value: 1.0595617028275517 and parameters: {'n_estimators': 1113, 'max_depth': 4, 'learning_rate': 0.024292441817987166, 'subsample': 0.6598928918596396, 'colsample_bytree': 0.9196623411778633, 'colsample_bylevel': 0.9625250334217533, 'colsample_bynode': 0.988595306327078, 'min_child_weight': 1.697992208246842, 'gamma': 0.28356617749606994, 'reg_alpha': 1.579472188532723e-05, 'reg_lambda': 0.03751648642853836, 'max_delta_step': 1.4772394735019547, 'booster': 'gbtree'}. Best is trial 104 with value: 1.01767345030837.[0m
[32m[I 2026-08-05 20:55:23,060][0m Trial 107 finished with value: 1.122973263731371 and parameters: {'n_estimators': 1977, 'max_depth': 6, 'learning_rate': 0.018698907928157107, 'subsample': 0.8084545114829833, 'colsample_bytree': 0.8167143282483599, 'colsample_bylevel': 0.912507610464021, 'colsample_bynode': 0.7060104898918252, 'min_child_weight': 1.0563678309485964, 'gamma': 0.32793178956045727, 'reg_alpha': 5.1562234740334916e-05, 'reg_lambda': 3.903131086065113, 'max_delta_step': 0.2548324494528686, 'booster': 'gbtree'}. Best is trial 104 with value: 1.01767345030837.[0m
[32m[I 2026-08-05 20:55:43,618][0m Trial 108 finished with value: 1.1869259549868076 and parameters: {'n_estimators': 1487, 'max_depth': 5, 'learning_rate': 0.01022463857322224, 'subsample': 0.8535927447106274, 'colsample_bytree': 0.9426237516266399, 'colsample_bylevel': 0.9255033353828981, 'colsample_bynode': 0.9344225997702325, 'min_child_weight': 1.2195441167650354, 'gamma': 0.2207877768287798, 'reg_alpha': 0.00036668357206860307, 'reg_lambda': 1.3562366560766737e-05, 'max_delta_step': 0.22541394923539304, 'booster': 'dart'}. Best is trial 104 with value: 1.01767345030837.[0m
[32m[I 2026-08-05 20:55:53,091][0m Trial 109 finished with value: 1.1510602612850398 and parameters: {'n_estimators': 1093, 'max_depth': 5, 'learning_rate': 0.020301351277123965, 'subsample': 0.8743198268396315, 'colsample_bytree': 0.7934814089657101, 'colsample_bylevel': 0.7488418505949688, 'colsample_bynode': 0.6844660625779588, 'min_child_weight': 1.0118704002857033, 'gamma': 0.24729941285006463, 'reg_alpha': 0.011103041181080254, 'reg_lambda': 0.2673428006027772, 'max_delta_step': 0.26780859479746866, 'booster': 'dart'}. Best is trial 104 with value: 1.01767345030837.[0m
[32m[I 2026-08-05 20:55:59,065][0m Trial 110 finished with value: 1.083247816029724 and parameters: {'n_estimators': 921, 'max_depth': 5, 'learning_rate': 0.01857688546459198, 'subsample': 0.9769831863223207, 'colsample_bytree': 0.7086321159144576, 'colsample_bylevel': 0.8555174189504333, 'colsample_bynode': 0.6779479158813926, 'min_child_weight': 1.9129604424298259, 'gamma': 0.5275860715603967, 'reg_alpha': 0.01747402873079844, 'reg_lambda': 1.2526404639301738, 'max_delta_step': 0.6777567017288975, 'booster': 'gbtree'}. Best is trial 104 with value: 1.01767345030837.[0m
