[32m[I 2026-08-05 20:45:51,983][0m Trial 36 finished with value: 1.0631696069534111 and parameters: {'n_estimators': 2662, 'max_depth': 11, 'learning_rate': 0.10079993368027293, 'subsample': 0.9397715859678982, 'colsample_bytree': 0.31773324156767124, 'colsample_bylevel': 0.7703176798963557, 'colsample_bynode': 0.8647224896018701, 'min_child_weight': 1.1135687792955207, 'gamma': 0.003629900125739577, 'reg_alpha': 0.44169125200328047, 'reg_lambda': 0.004855737957061016, 'max_delta_step': 0.15679857672211783, 'booster': 'dart'}. Best is trial 34 with value: 1.037055767555187.[0m
[32m[I 2026-08-05 20:46:01,017][0m Trial 37 finished with value: 1.0355020147818936 and parameters: {'n_estimators': 1912, 'max_depth': 7, 'learning_rate': 0.012435725188425242, 'subsample': 0.9054930864974096, 'colsample_bytree': 0.7127934329866157, 'colsample_bylevel': 0.7907524237295434, 'colsample_bynode': 0.80320975698197, 'min_child_weight': 1.615383425009508, 'gamma': 0.11315702944058803, 'reg_alpha': 0.0010038813748769148, 'reg_lambda': 1.992227916707594e-07, 'max_delta_step': 1.7561619518553742, 'booster': 'dart'}. Best is trial 37 with value: 1.0355020147818936.[0m
[32m[I 2026-08-05 20:46:12,284][0m Trial 38 finished with value: 1.0594994850334665 and parameters: {'n_estimators': 1639, 'max_depth': 8, 'learning_rate': 0.011067051630830636, 'subsample': 0.8204805031556409, 'colsample_bytree': 0.639475683683903, 'colsample_bylevel': 0.8397305648385421, 'colsample_bynode': 0.932620022225672, 'min_child_weight': 1.077474605508087, 'gamma': 0.21113944681561603, 'reg_alpha': 0.3880814796569642, 'reg_lambda': 7.429589833852359e-06, 'max_delta_step': 1.2238528360940564, 'booster': 'dart'}. Best is trial 37 with value: 1.0355020147818936.[0m
[32m[I 2026-08-05 20:46:16,721][0m Trial 39 finished with value: 1.0672361903874887 and parameters: {'n_estimators': 2278, 'max_depth': 6, 'learning_rate': 0.01944073327579151, 'subsample': 0.9219812291980212, 'colsample_bytree': 0.7120039470027312, 'colsample_bylevel': 0.6772704374997954, 'colsample_bynode': 0.8867369406250704, 'min_child_weight': 1.2214663074172678, 'gamma': 0.12210416712172234, 'reg_alpha': 6.692092015297256e-05, 'reg_lambda': 3.5959090954208403e-08, 'max_delta_step': 3.5270804608170616, 'booster': 'dart'}. Best is trial 37 with value: 1.0355020147818936.[0m
[32m[I 2026-08-05 20:46:38,883][0m Trial 40 finished with value: 1.230460071298584 and parameters: {'n_estimators': 2154, 'max_depth': 6, 'learning_rate': 0.020941934580963086, 'subsample': 0.9465916307478135, 'colsample_bytree': 0.554345925150201, 'colsample_bylevel': 0.690974258884969, 'colsample_bynode': 0.6338677946373594, 'min_child_weight': 1.3465284411049614, 'gamma': 0.19107084343880534, 'reg_alpha': 0.0007801964199016364, 'reg_lambda': 9.413408279039579e-06, 'max_delta_step': 0.04635116887929758, 'booster': 'dart'}. Best is trial 37 with value: 1.0355020147818936.[0m
[32m[I 2026-08-05 20:46:41,363][0m Trial 41 finished with value: 1.104968909009036 and parameters: {'n_estimators': 2799, 'max_depth': 8, 'learning_rate': 0.03321455413964334, 'subsample': 0.9227155423316253, 'colsample_bytree': 0.6582133948116174, 'colsample_bylevel': 0.6533316379203855, 'colsample_bynode': 0.8628456287057655, 'min_child_weight': 2.059059994468047, 'gamma': 0.6698758349482103, 'reg_alpha': 0.0009653989297300348, 'reg_lambda': 5.730864926976059e-06, 'max_delta_step': 2.0050141030859505, 'booster': 'dart'}. Best is trial 37 with value: 1.0355020147818936.[0m
[32m[I 2026-08-05 20:46:43,912][0m Trial 42 finished with value: 1.0957996280243354 and parameters: {'n_estimators': 2961, 'max_depth': 10, 'learning_rate': 0.06153949551607001, 'subsample': 0.9186368618088194, 'colsample_bytree': 0.543461730713913, 'colsample_bylevel': 0.9859061996207563, 'colsample_bynode': 0.9706550555265261, 'min_child_weight': 1.3849963243782304, 'gamma': 0.23364448060994011, 'reg_alpha': 0.4659832162405115, 'reg_lambda': 0.000462292349732872, 'max_delta_step': 3.8755236103649824, 'booster': 'dart'}. Best is trial 37 with value: 1.0355020147818936.[0m
[32m[I 2026-08-05 20:46:47,192][0m Trial 43 finished with value: 1.1345523956731476 and parameters: {'n_estimators': 1545, 'max_depth': 8, 'learning_rate': 0.02651245098834906, 'subsample': 0.8794004938373379, 'colsample_bytree': 0.7498144296986307, 'colsample_bylevel': 0.8354229940443847, 'colsample_bynode': 0.6249106342900717, 'min_child_weight': 4.850021135785755, 'gamma': 0.41093159025454723, 'reg_alpha': 0.0004985617135404936, 'reg_lambda': 4.802718473877991e-07, 'max_delta_step': 3.679819174918239, 'booster': 'dart'}. Best is trial 37 with value: 1.0355020147818936.[0m
[32m[I 2026-08-05 20:47:01,694][0m Trial 44 finished with value: 1.1197649930912212 and parameters: {'n_estimators': 2459, 'max_depth': 11, 'learning_rate': 0.01062791809700494, 'subsample': 0.9299242881489752, 'colsample_bytree': 0.581747121140635, 'colsample_bylevel': 0.5517781741912281, 'colsample_bynode': 0.9137715808186002, 'min_child_weight': 1.329223159632141, 'gamma': 0.4243050879379971, 'reg_alpha': 7.225711370333502, 'reg_lambda': 5.243243874491285e-06, 'max_delta_step': 0.6219605497090833, 'booster': 'dart'}. Best is trial 37 with value: 1.0355020147818936.[0m
[32m[I 2026-08-05 20:47:20,442][0m Trial 45 finished with value: 1.0646674480097524 and parameters: {'n_estimators': 2672, 'max_depth': 9, 'learning_rate': 0.01020453156079521, 'subsample': 0.8356004736310422, 'colsample_bytree': 0.8426521471553686, 'colsample_bylevel': 0.8811174125616547, 'colsample_bynode': 0.6488189752344433, 'min_child_weight': 1.5338477448978431, 'gamma': 0.2412603061408369, 'reg_alpha': 1.744495664552097, 'reg_lambda': 2.911930962547489e-07, 'max_delta_step': 0.6826691717111844, 'booster': 'gbtree'}. Best is trial 37 with value: 1.0355020147818936.[0m
[32m[I 2026-08-05 20:47:25,588][0m Trial 46 finished with value: 1.0474423498322203 and parameters: {'n_estimators': 1492, 'max_depth': 8, 'learning_rate': 0.02162225255727573, 'subsample': 0.9948681965297147, 'colsample_bytree': 0.7542417651076044, 'colsample_bylevel': 0.906196204235029, 'colsample_bynode': 0.8214716097322681, 'min_child_weight': 1.58234184044485, 'gamma': 0.19175463073049553, 'reg_alpha': 0.0009819178767051975, 'reg_lambda': 1.529367710036221e-08, 'max_delta_step': 2.9342340426752327, 'booster': 'dart'}. Best is trial 37 with value: 1.0355020147818936.[0m
[32m[I 2026-08-05 20:47:33,406][0m Trial 47 finished with value: 1.134118034662395 and parameters: {'n_estimators': 1756, 'max_depth': 12, 'learning_rate': 0.011001630472680622, 'subsample': 0.9616197492898327, 'colsample_bytree': 0.807360697943918, 'colsample_bylevel': 0.9539902171515919, 'colsample_bynode': 0.7797197766686266, 'min_child_weight': 2.7479676678655887, 'gamma': 0.5978764569410906, 'reg_alpha': 1.0205384139352798e-05, 'reg_lambda': 9.413615964131125e-07, 'max_delta_step': 3.4495769911849434, 'booster': 'dart'}. Best is trial 37 with value: 1.0355020147818936.[0m
[32m[I 2026-08-05 20:47:37,163][0m Trial 48 finished with value: 1.0576116232543997 and parameters: {'n_estimators': 814, 'max_depth': 5, 'learning_rate': 0.03534116892522294, 'subsample': 0.856683941904418, 'colsample_bytree': 0.8535457614113898, 'colsample_bylevel': 0.8470610259500628, 'colsample_bynode': 0.8453170339783775, 'min_child_weight': 1.0269684796275895, 'gamma': 0.40059592206220673, 'reg_alpha': 0.0011330315703249163, 'reg_lambda': 1.9840881170054936e-07, 'max_delta_step': 2.203257906890964, 'booster': 'dart'}. Best is trial 37 with value: 1.0355020147818936.[0m
[32m[I 2026-08-05 20:47:46,976][0m Trial 49 pruned. [0m
[32m[I 2026-08-05 20:48:07,722][0m Trial 50 finished with value: 1.1847395268706153 and parameters: {'n_estimators': 1221, 'max_depth': 7, 'learning_rate': 0.01456115076130806, 'subsample': 0.9920475140853591, 'colsample_bytree': 0.7276834852192943, 'colsample_bylevel': 0.8479718923688866, 'colsample_bynode': 0.912682053157928, 'min_child_weight': 1.475082022317016, 'gamma': 0.01760858022643917, 'reg_alpha': 4.854481210729352e-05, 'reg_lambda': 2.4306872674776342e-05, 'max_delta_step': 0.20670531889767663, 'booster': 'gbtree'}. Best is trial 37 with value: 1.0355020147818936.[0m
[32m[I 2026-08-05 20:48:13,572][0m Trial 51 finished with value: 1.0898983303653103 and parameters: {'n_estimators': 1113, 'max_depth': 8, 'learning_rate': 0.01556626165830388, 'subsample': 0.9608907119691334, 'colsample_bytree': 0.8127420460448956, 'colsample_bylevel': 0.8583568020477114, 'colsample_bynode': 0.7499253857971763, 'min_child_weight': 1.329714650026146, 'gamma': 0.29342889140363865, 'reg_alpha': 0.0007490260956710921, 'reg_lambda': 4.2609893433650883e-08, 'max_delta_step': 5.080427127809022, 'booster': 'dart'}. Best is trial 37 with value: 1.0355020147818936.[0m
[32m[I 2026-08-05 20:48:15,654][0m Trial 52 finished with value: 1.1056512411098833 and parameters: {'n_estimators': 2271, 'max_depth': 9, 'learning_rate': 0.045130061505979646, 'subsample': 0.9736575785909024, 'colsample_bytree': 0.35135459842732575, 'colsample_bylevel': 0.4657990145695909, 'colsample_bynode': 0.8128093122270044, 'min_child_weight': 1.1276233346321074, 'gamma': 0.8764394817169636, 'reg_alpha': 0.007624511567465382, 'reg_lambda': 1.8812980232381122e-06, 'max_delta_step': 1.508861272465427, 'booster': 'gbtree'}. Best is trial 37 with value: 1.0355020147818936.[0m
[32m[I 2026-08-05 20:48:22,845][0m Trial 53 finished with value: 1.0256565779972144 and parameters: {'n_estimators': 1654, 'max_depth': 8, 'learning_rate': 0.01698846325032322, 'subsample': 0.9874389912458813, 'colsample_bytree': 0.7212701978274043, 'colsample_bylevel': 0.8324030114714005, 'colsample_bynode': 0.9870254859924409, 'min_child_weight': 1.0574040259176525, 'gamma': 0.14791222441971066, 'reg_alpha': 7.952302553787485e-05, 'reg_lambda': 2.0106827552430493e-07, 'max_delta_step': 2.144306356013452, 'booster': 'dart'}. Best is trial 53 with value: 1.0256565779972144.[0m
[32m[I 2026-08-05 20:48:29,276][0m Trial 54 finished with value: 1.1137141581834136 and parameters: {'n_estimators': 1578, 'max_depth': 8, 'learning_rate': 0.01591243739113326, 'subsample': 0.9735759410664722, 'colsample_bytree': 0.5334888858151223, 'colsample_bylevel': 0.9924914188834679, 'colsample_bynode': 0.891771710716707, 'min_child_weight': 2.4878365983777897, 'gamma': 0.3151188794138855, 'reg_alpha': 6.103367485285897e-06, 'reg_lambda': 3.4155444897088564e-08, 'max_delta_step': 1.6960168972255227, 'booster': 'dart'}. Best is trial 53 with value: 1.0256565779972144.[0m
[32m[I 2026-08-05 20:48:32,733][0m Trial 55 finished with value: 1.1462857939349642 and parameters: {'n_estimators': 1985, 'max_depth': 8, 'learning_rate': 0.023838733583874012, 'subsample': 0.998916047573053, 'colsample_bytree': 0.7111891649340821, 'colsample_bylevel': 0.7835826549266857, 'colsample_bynode': 0.9233748609218085, 'min_child_weight': 2.139495600572163, 'gamma': 0.4545579863755216, 'reg_alpha': 0.2172640924390077, 'reg_lambda': 3.3810491129983357e-06, 'max_delta_step': 4.447103144413918, 'booster': 'dart'}. Best is trial 53 with value: 1.0256565779972144.[0m
[32m[I 2026-08-05 20:48:34,521][0m Trial 56 finished with value: 1.0485976633341545 and parameters: {'n_estimators': 2910, 'max_depth': 11, 'learning_rate': 0.11822882070199954, 'subsample': 0.9374503777166786, 'colsample_bytree': 0.43631536942778526, 'colsample_bylevel': 0.9954496646330124, 'colsample_bynode': 0.9453067968342518, 'min_child_weight': 3.976113111902869, 'gamma': 0.47501657283112175, 'reg_alpha': 0.22231416191549863, 'reg_lambda': 0.004063871889061256, 'max_delta_step': 1.3994669442238652, 'booster': 'gbtree'}. Best is trial 53 with value: 1.0256565779972144.[0m
[32m[I 2026-08-05 20:48:37,037][0m Trial 57 finished with value: 1.063204803989387 and parameters: {'n_estimators': 2867, 'max_depth': 12, 'learning_rate': 0.042295658020173245, 'subsample': 0.9133499313444616, 'colsample_bytree': 0.33042088066062264, 'colsample_bylevel': 0.7298876684412108, 'colsample_bynode': 0.9608586390769415, 'min_child_weight': 1.067704801987781, 'gamma': 0.527920468687976, 'reg_alpha': 0.052338226864330345, 'reg_lambda': 0.0001241857203522307, 'max_delta_step': 3.169821276755539, 'booster': 'gbtree'}. Best is trial 53 with value: 1.0256565779972144.[0m
[32m[I 2026-08-05 20:48:43,678][0m Trial 58 finished with value: 1.0497760931549724 and parameters: {'n_estimators': 1512, 'max_depth': 8, 'learning_rate': 0.01303223071821606, 'subsample': 0.9716311633526363, 'colsample_bytree': 0.7830676611404838, 'colsample_bylevel': 0.6512260243259514, 'colsample_bynode': 0.8512545519804783, 'min_child_weight': 1.0154979769048729, 'gamma': 0.4649554354036246, 'reg_alpha': 0.0020996247459486466, 'reg_lambda': 6.380360888606439e-07, 'max_delta_step': 2.4101983210136324, 'booster': 'dart'}. Best is trial 53 with value: 1.0256565779972144.[0m
[32m[I 2026-08-05 20:48:51,001][0m Trial 59 finished with value: 1.0628352010014506 and parameters: {'n_estimators': 1537, 'max_depth': 9, 'learning_rate': 0.02071008828211973, 'subsample': 0.9695361466982765, 'colsample_bytree': 0.846113716542301, 'colsample_bylevel': 0.9761864945906963, 'colsample_bynode': 0.9937758019645964, 'min_child_weight': 1.516145741044189, 'gamma': 0.47339995494264764, 'reg_alpha': 0.00010311222749425778, 'reg_lambda': 8.997852193898971e-07, 'max_delta_step': 1.6727967891988578, 'booster': 'dart'}. Best is trial 53 with value: 1.0256565779972144.[0m
[32m[I 2026-08-05 20:48:54,199][0m Trial 60 finished with value: 1.1392725227060172 and parameters: {'n_estimators': 2945, 'max_depth': 10, 'learning_rate': 0.06319961336166736, 'subsample': 0.997393425078672, 'colsample_bytree': 0.7154594347804811, 'colsample_bylevel': 0.8374745128842412, 'colsample_bynode': 0.9422434614957858, 'min_child_weight': 5.666384607351757, 'gamma': 0.18481435030396304, 'reg_alpha': 1.0373407805780817, 'reg_lambda': 0.018451575729185557, 'max_delta_step': 0.953289810710273, 'booster': 'dart'}. Best is trial 53 with value: 1.0256565779972144.[0m
[32m[I 2026-08-05 20:48:56,567][0m Trial 61 finished with value: 1.0820531575356054 and parameters: {'n_estimators': 2980, 'max_depth': 11, 'learning_rate': 0.09319327173335838, 'subsample': 0.996357501667083, 'colsample_bytree': 0.5424196771878135, 'colsample_bylevel': 0.894996418812829, 'colsample_bynode': 0.9460956407400621, 'min_child_weight': 2.7730570823988434, 'gamma': 0.8115740326575194, 'reg_alpha': 0.0006208255689472428, 'reg_lambda': 8.172360473457718e-05, 'max_delta_step': 0.6719685583897443, 'booster': 'gbtree'}. Best is trial 53 with value: 1.0256565779972144.[0m
[32m[I 2026-08-05 20:48:58,900][0m Trial 62 finished with value: 1.171626408540747 and parameters: {'n_estimators': 2849, 'max_depth': 11, 'learning_rate': 0.12324367383202883, 'subsample': 0.912432759220861, 'colsample_bytree': 0.4582541236450512, 'colsample_bylevel': 0.9076209395517357, 'colsample_bynode': 0.8562202091376558, 'min_child_weight': 6.444085346546472, 'gamma': 0.034644653363940014, 'reg_alpha': 0.00226925657096629, 'reg_lambda': 0.00047586543659024487, 'max_delta_step': 1.9051720615260854, 'booster': 'gbtree'}. Best is trial 53 with value: 1.0256565779972144.[0m
[32m[I 2026-08-05 20:49:00,302][0m Trial 63 finished with value: 1.1745439551080357 and parameters: {'n_estimators': 2638, 'max_depth': 11, 'learning_rate': 0.09807624586058064, 'subsample': 0.9195341119801228, 'colsample_bytree': 0.34373954852251054, 'colsample_bylevel': 0.7797066100170581, 'colsample_bynode': 0.855945782285193, 'min_child_weight': 6.79408119255864, 'gamma': 1.1342830231481884, 'reg_alpha': 0.46184974253975475, 'reg_lambda': 4.3746238623517014e-05, 'max_delta_step': 1.5534897578430076, 'booster': 'dart'}. Best is trial 53 with value: 1.0256565779972144.[0m
[32m[I 2026-08-05 20:49:01,878][0m Trial 64 finished with value: 1.1625079167156427 and parameters: {'n_estimators': 1916, 'max_depth': 12, 'learning_rate': 0.16371929052870327, 'subsample': 0.971388482512666, 'colsample_bytree': 0.34106255023529963, 'colsample_bylevel': 0.9544189905677278, 'colsample_bynode': 0.9120261735986138, 'min_child_weight': 15.868587416573762, 'gamma': 0.7102024513314327, 'reg_alpha': 0.4801891983742557, 'reg_lambda': 0.002208938162841346, 'max_delta_step': 0.6801934078063447, 'booster': 'gbtree'}. Best is trial 53 with value: 1.0256565779972144.[0m
[32m[I 2026-08-05 20:49:08,953][0m Trial 65 finished with value: 1.1075480575457846 and parameters: {'n_estimators': 1997, 'max_depth': 8, 'learning_rate': 0.013602390202102216, 'subsample': 0.9562374379169795, 'colsample_bytree': 0.6597224247830726, 'colsample_bylevel': 0.7278688285053674, 'colsample_bynode': 0.9990078768488564, 'min_child_weight': 2.049048598099776, 'gamma': 0.40436660287767734, 'reg_alpha': 2.304024288197885e-05, 'reg_lambda': 6.779280835539551e-06, 'max_delta_step': 1.4358906931561184, 'booster': 'dart'}. Best is trial 53 with value: 1.0256565779972144.[0m
[32m[I 2026-08-05 20:49:12,595][0m Trial 66 finished with value: 1.0888214189338872 and parameters: {'n_estimators': 2432, 'max_depth': 9, 'learning_rate': 0.07647028012789066, 'subsample': 0.9780019280195401, 'colsample_bytree': 0.3209249970118886, 'colsample_bylevel': 0.9854143204819686, 'colsample_bynode': 0.8866472691492079, 'min_child_weight': 4.072698935196349, 'gamma': 0.7085421114437855, 'reg_alpha': 1.225175512768488, 'reg_lambda': 0.002701907323368569, 'max_delta_step': 0.26588666360953184, 'booster': 'gbtree'}. Best is trial 53 with value: 1.0256565779972144.[0m
[32m[I 2026-08-05 20:49:29,494][0m Trial 67 finished with value: 1.1456873035459694 and parameters: {'n_estimators': 2499, 'max_depth': 8, 'learning_rate': 0.03200184994806258, 'subsample': 0.9290331263802993, 'colsample_bytree': 0.5481783521300923, 'colsample_bylevel': 0.42120460941160376, 'colsample_bynode': 0.8308702205098333, 'min_child_weight': 2.006031024868933, 'gamma': 0.41678521218519815, 'reg_alpha': 0.008205666457131609, 'reg_lambda': 2.698959692855746e-07, 'max_delta_step': 0.05966833720079345, 'booster': 'dart'}. Best is trial 53 with value: 1.0256565779972144.[0m
[32m[I 2026-08-05 20:49:51,280][0m Trial 68 finished with value: 1.1632642396217128 and parameters: {'n_estimators': 2355, 'max_depth': 8, 'learning_rate': 0.012529578091413482, 'subsample': 0.9740643726011504, 'colsample_bytree': 0.6617866877524563, 'colsample_bylevel': 0.6527131128722305, 'colsample_bynode': 0.9507079410742852, 'min_child_weight': 1.5979110598429909, 'gamma': 0.35551743355186527, 'reg_alpha': 0.0017885221117951743, 'reg_lambda': 1.0078669395563796e-05, 'max_delta_step': 0.16998360369683796, 'booster': 'gbtree'}. Best is trial 53 with value: 1.0256565779972144.[0m
[32m[I 2026-08-05 20:50:01,442][0m Trial 69 finished with value: 1.0573005140399743 and parameters: {'n_estimators': 2698, 'max_depth': 6, 'learning_rate': 0.011752648821696045, 'subsample': 0.9913075169738921, 'colsample_bytree': 0.5018247465590806, 'colsample_bylevel': 0.706698806442843, 'colsample_bynode': 0.7791399715156972, 'min_child_weight': 1.03446598731144, 'gamma': 0.14908777992243888, 'reg_alpha': 0.4632448328129279, 'reg_lambda': 0.002085041348605619, 'max_delta_step': 0.768723126436017, 'booster': 'dart'}. Best is trial 53 with value: 1.0256565779972144.[0m
[32m[I 2026-08-05 20:50:07,756][0m Trial 70 finished with value: 1.0633154755281518 and parameters: {'n_estimators': 2810, 'max_depth': 6, 'learning_rate': 0.017135076905281307, 'subsample': 0.9968310132144326, 'colsample_bytree': 0.6754024016062808, 'colsample_bylevel': 0.5379850504249439, 'colsample_bynode': 0.9298130614620178, 'min_child_weight': 1.0288964728273742, 'gamma': 0.8046414738092602, 'reg_alpha': 0.00017727571192101683, 'reg_lambda': 3.951033645363419e-07, 'max_delta_step': 0.8564548442154021, 'booster': 'dart'}. Best is trial 53 with value: 1.0256565779972144.[0m
[32m[I 2026-08-05 20:50:10,668][0m Trial 71 finished with value: 1.0770335640006592 and parameters: {'n_estimators': 2660, 'max_depth': 12, 'learning_rate': 0.051107493564362796, 'subsample': 0.9846009420591917, 'colsample_bytree': 0.4721480168203316, 'colsample_bylevel': 0.757174161143093, 'colsample_bynode': 0.9659903287755094, 'min_child_weight': 1.057787490839793, 'gamma': 0.7216997828855637, 'reg_alpha': 0.2353248807790974, 'reg_lambda': 0.3384963067556353, 'max_delta_step': 2.4356519285624656, 'booster': 'dart'}. Best is trial 53 with value: 1.0256565779972144.[0m
[32m[I 2026-08-05 20:50:20,704][0m Trial 72 finished with value: 1.1497971040243105 and parameters: {'n_estimators': 1124, 'max_depth': 7, 'learning_rate': 0.012622837589585182, 'subsample': 0.9433355069347326, 'colsample_bytree': 0.7372995838540397, 'colsample_bylevel': 0.7840862920446449, 'colsample_bynode': 0.8398266452236005, 'min_child_weight': 1.3534487406099698, 'gamma': 0.852393196179048, 'reg_alpha': 0.0035363143073148047, 'reg_lambda': 7.580311463020287e-06, 'max_delta_step': 0.4220878401273003, 'booster': 'dart'}. Best is trial 53 with value: 1.0256565779972144.[0m
[32m[I 2026-08-05 20:50:22,312][0m Trial 73 finished with value: 1.138843961188158 and parameters: {'n_estimators': 2884, 'max_depth': 11, 'learning_rate': 0.11825201101331176, 'subsample': 0.9845408896002769, 'colsample_bytree': 0.5698985422404318, 'colsample_bylevel': 0.8814735344352445, 'colsample_bynode': 0.8451612286808137, 'min_child_weight': 2.542751021273654, 'gamma': 0.47880161049496917, 'reg_alpha': 0.03309766287394046, 'reg_lambda': 0.8946355917404357, 'max_delta_step': 1.8138426684650528, 'booster': 'gbtree'}. Best is trial 53 with value: 1.0256565779972144.[0m
