[32m[I 2026-08-05 20:56:02,605][0m Trial 111 finished with value: 1.0555664808676668 and parameters: {'n_estimators': 1565, 'max_depth': 5, 'learning_rate': 0.03977826469810961, 'subsample': 0.9602327891261203, 'colsample_bytree': 0.7231020114994686, 'colsample_bylevel': 0.9924353181338822, 'colsample_bynode': 0.8467820172824436, 'min_child_weight': 1.7477705634477667, 'gamma': 0.6155496050985447, 'reg_alpha': 0.004697006849084675, 'reg_lambda': 0.0545717148513183, 'max_delta_step': 1.4167714996367502, 'booster': 'gbtree'}. Best is trial 104 with value: 1.01767345030837.[0m
[32m[I 2026-08-05 20:56:14,807][0m Trial 112 finished with value: 1.1742580757970444 and parameters: {'n_estimators': 1320, 'max_depth': 5, 'learning_rate': 0.012533044724399136, 'subsample': 0.7566280586698495, 'colsample_bytree': 0.7370238742687033, 'colsample_bylevel': 0.5716910714179316, 'colsample_bynode': 0.951412894512249, 'min_child_weight': 2.4894903652497122, 'gamma': 0.09859540257396904, 'reg_alpha': 4.059084627786288e-06, 'reg_lambda': 0.13969107237784548, 'max_delta_step': 0.26988876066023937, 'booster': 'gbtree'}. Best is trial 104 with value: 1.01767345030837.[0m
[32m[I 2026-08-05 20:56:27,298][0m Trial 113 finished with value: 1.1432768899685208 and parameters: {'n_estimators': 1716, 'max_depth': 5, 'learning_rate': 0.01191010435301814, 'subsample': 0.8735007234771229, 'colsample_bytree': 0.5373354810398325, 'colsample_bylevel': 0.8443380553828226, 'colsample_bynode': 0.7692190783917063, 'min_child_weight': 1.1415052089436266, 'gamma': 0.36263721314507796, 'reg_alpha': 0.0004644187153137104, 'reg_lambda': 0.03060127387501957, 'max_delta_step': 0.3058651251750887, 'booster': 'gbtree'}. Best is trial 104 with value: 1.01767345030837.[0m
[32m[I 2026-08-05 20:56:37,441][0m Trial 114 finished with value: 1.0691327770623684 and parameters: {'n_estimators': 2178, 'max_depth': 12, 'learning_rate': 0.01145294582036035, 'subsample': 0.9994042565591241, 'colsample_bytree': 0.9429305198362102, 'colsample_bylevel': 0.9067579902974404, 'colsample_bynode': 0.635077944379489, 'min_child_weight': 1.0162058267035745, 'gamma': 0.3016163161494696, 'reg_alpha': 0.6744082525162634, 'reg_lambda': 3.968846803186645e-05, 'max_delta_step': 3.0402983156870573, 'booster': 'dart'}. Best is trial 104 with value: 1.01767345030837.[0m
[32m[I 2026-08-05 20:56:46,802][0m Trial 115 finished with value: 1.077633352573475 and parameters: {'n_estimators': 1567, 'max_depth': 5, 'learning_rate': 0.012009479868291484, 'subsample': 0.8864168186516597, 'colsample_bytree': 0.879912470954759, 'colsample_bylevel': 0.806221506807314, 'colsample_bynode': 0.8138532281304871, 'min_child_weight': 1.2852173374721179, 'gamma': 0.35931726746562187, 'reg_alpha': 1.3549888967138464, 'reg_lambda': 0.0005543266189766679, 'max_delta_step': 1.401767165332835, 'booster': 'gbtree'}. Best is trial 104 with value: 1.01767345030837.[0m
[32m[I 2026-08-05 20:56:55,469][0m Trial 116 finished with value: 1.0853675324858179 and parameters: {'n_estimators': 1979, 'max_depth': 4, 'learning_rate': 0.011555866179175221, 'subsample': 0.7507181734418199, 'colsample_bytree': 0.8804492041172107, 'colsample_bylevel': 0.7897189738506334, 'colsample_bynode': 0.8030269805006087, 'min_child_weight': 1.8728754065448567, 'gamma': 0.18479291678562407, 'reg_alpha': 6.400876114248703e-08, 'reg_lambda': 3.5497461497308836e-05, 'max_delta_step': 2.7779011270138, 'booster': 'gbtree'}. Best is trial 104 with value: 1.01767345030837.[0m
[32m[I 2026-08-05 20:56:58,334][0m Trial 117 finished with value: 1.1350926408416013 and parameters: {'n_estimators': 2613, 'max_depth': 12, 'learning_rate': 0.04456104498431606, 'subsample': 0.8175029920191271, 'colsample_bytree': 0.41065282835462263, 'colsample_bylevel': 0.9536107144497324, 'colsample_bynode': 0.861167633318797, 'min_child_weight': 5.678530446347412, 'gamma': 0.48671742268475715, 'reg_alpha': 0.03231078945872766, 'reg_lambda': 0.07455339487021154, 'max_delta_step': 1.1667522902458671, 'booster': 'dart'}. Best is trial 104 with value: 1.01767345030837.[0m
[32m[I 2026-08-05 20:57:05,123][0m Trial 118 finished with value: 1.0372807776808353 and parameters: {'n_estimators': 2017, 'max_depth': 10, 'learning_rate': 0.01708180681901548, 'subsample': 0.9979340448962056, 'colsample_bytree': 0.5837951851966592, 'colsample_bylevel': 0.8232876505695306, 'colsample_bynode': 0.9439037526813641, 'min_child_weight': 1.2178354343352662, 'gamma': 0.4492072216274071, 'reg_alpha': 0.00010441852645537543, 'reg_lambda': 1.3160896714252913e-07, 'max_delta_step': 1.262591606182239, 'booster': 'dart'}. Best is trial 104 with value: 1.01767345030837.[0m
[32m[I 2026-08-05 20:57:07,858][0m Trial 119 finished with value: 0.9929118927863367 and parameters: {'n_estimators': 2737, 'max_depth': 11, 'learning_rate': 0.155123155722967, 'subsample': 0.9773105978621129, 'colsample_bytree': 0.5885536573100035, 'colsample_bylevel': 0.8042054218170143, 'colsample_bynode': 0.9178686592562224, 'min_child_weight': 1.2810507525596542, 'gamma': 0.10055892592435595, 'reg_alpha': 0.05764048329487502, 'reg_lambda': 1.2682159847674406, 'max_delta_step': 0.7083034459458921, 'booster': 'dart'}. Best is trial 119 with value: 0.9929118927863367.[0m
[32m[I 2026-08-05 20:57:12,246][0m Trial 120 finished with value: 1.0638246126933875 and parameters: {'n_estimators': 2897, 'max_depth': 8, 'learning_rate': 0.09054482139360182, 'subsample': 0.8295072664327928, 'colsample_bytree': 0.6332846708005002, 'colsample_bylevel': 0.7385866042997813, 'colsample_bynode': 0.9596055619457481, 'min_child_weight': 1.7967864671760532, 'gamma': 0.12855863060001174, 'reg_alpha': 1.138279238493378, 'reg_lambda': 3.448132013413463, 'max_delta_step': 0.42284748903148384, 'booster': 'dart'}. Best is trial 119 with value: 0.9929118927863367.[0m
[32m[I 2026-08-05 20:57:37,337][0m Trial 121 finished with value: 1.2360076013679777 and parameters: {'n_estimators': 1468, 'max_depth': 6, 'learning_rate': 0.012590989525301877, 'subsample': 0.835184583100122, 'colsample_bytree': 0.9008095084226251, 'colsample_bylevel': 0.9496983835390301, 'colsample_bynode': 0.9727568246801022, 'min_child_weight': 1.5412815031411442, 'gamma': 0.3161771489733177, 'reg_alpha': 6.632017790963809e-05, 'reg_lambda': 0.0012146358963867595, 'max_delta_step': 0.11149571734528174, 'booster': 'gbtree'}. Best is trial 119 with value: 0.9929118927863367.[0m
[32m[I 2026-08-05 20:57:39,172][0m Trial 122 finished with value: 1.0376196459805365 and parameters: {'n_estimators': 2166, 'max_depth': 11, 'learning_rate': 0.1648527358147744, 'subsample': 0.9830530857881585, 'colsample_bytree': 0.4555044988226875, 'colsample_bylevel': 0.8667732495380683, 'colsample_bynode': 0.9259195301883681, 'min_child_weight': 1.3246932902502528, 'gamma': 0.09893599642232469, 'reg_alpha': 0.0031635864038767154, 'reg_lambda': 0.01381948146175258, 'max_delta_step': 0.8639665101910887, 'booster': 'dart'}. Best is trial 119 with value: 0.9929118927863367.[0m
[32m[I 2026-08-05 20:57:40,733][0m Trial 123 finished with value: 1.0510194262461412 and parameters: {'n_estimators': 1786, 'max_depth': 11, 'learning_rate': 0.17264582481648136, 'subsample': 0.9515386371126068, 'colsample_bytree': 0.45126284801783245, 'colsample_bylevel': 0.7628292938626261, 'colsample_bynode': 0.6648793065972332, 'min_child_weight': 1.2169699972685584, 'gamma': 0.3881723073271067, 'reg_alpha': 0.0029449957345093637, 'reg_lambda': 1.1586928498211404, 'max_delta_step': 1.6007811690889011, 'booster': 'dart'}. Best is trial 119 with value: 0.9929118927863367.[0m
[32m[I 2026-08-05 20:57:42,254][0m Trial 124 finished with value: 1.1250130225336243 and parameters: {'n_estimators': 2708, 'max_depth': 11, 'learning_rate': 0.17038727365639905, 'subsample': 0.9249025873988849, 'colsample_bytree': 0.5438211682079461, 'colsample_bylevel': 0.6039592490155765, 'colsample_bynode': 0.857501686576312, 'min_child_weight': 2.5755156361709903, 'gamma': 0.2242967373850634, 'reg_alpha': 0.005200324651218839, 'reg_lambda': 5.438232423165352, 'max_delta_step': 2.3098029086602914, 'booster': 'dart'}. Best is trial 119 with value: 0.9929118927863367.[0m
[32m[I 2026-08-05 20:57:45,295][0m Trial 125 finished with value: 1.0356128419395132 and parameters: {'n_estimators': 2326, 'max_depth': 11, 'learning_rate': 0.1423643556754737, 'subsample': 0.9793035642461451, 'colsample_bytree': 0.526060763574033, 'colsample_bylevel': 0.965539524297611, 'colsample_bynode': 0.9933125352415533, 'min_child_weight': 3.3165799502501714, 'gamma': 0.12222115135827794, 'reg_alpha': 0.0019905101002839322, 'reg_lambda': 0.0016409815103714787, 'max_delta_step': 0.47223679110016215, 'booster': 'dart'}. Best is trial 119 with value: 0.9929118927863367.[0m
[32m[I 2026-08-05 20:57:51,297][0m Trial 126 finished with value: 1.1046194405480951 and parameters: {'n_estimators': 2205, 'max_depth': 12, 'learning_rate': 0.12634207048477206, 'subsample': 0.8918735487475247, 'colsample_bytree': 0.6507599512077391, 'colsample_bylevel': 0.9856406057020126, 'colsample_bynode': 0.8602086392203638, 'min_child_weight': 4.182890090001778, 'gamma': 0.07906143652149979, 'reg_alpha': 2.8282333272731113, 'reg_lambda': 0.0007950555967362611, 'max_delta_step': 0.15969763171075718, 'booster': 'dart'}. Best is trial 119 with value: 0.9929118927863367.[0m
[32m[I 2026-08-05 20:57:53,990][0m Trial 127 finished with value: 1.0526674567480743 and parameters: {'n_estimators': 1833, 'max_depth': 10, 'learning_rate': 0.041829258046716625, 'subsample': 0.9627017157891921, 'colsample_bytree': 0.3425511609166628, 'colsample_bylevel': 0.9809059265539931, 'colsample_bynode': 0.7813746723420126, 'min_child_weight': 1.8918615331943214, 'gamma': 0.30252139696134583, 'reg_alpha': 0.008854329476981747, 'reg_lambda': 9.268226714358592e-06, 'max_delta_step': 1.807825229888628, 'booster': 'dart'}. Best is trial 119 with value: 0.9929118927863367.[0m
[32m[I 2026-08-05 20:57:56,971][0m Trial 128 finished with value: 1.0388454761160888 and parameters: {'n_estimators': 1903, 'max_depth': 11, 'learning_rate': 0.05434299021259614, 'subsample': 0.9890337435261028, 'colsample_bytree': 0.45993419277027237, 'colsample_bylevel': 0.6675777955059373, 'colsample_bynode': 0.9141549408554375, 'min_child_weight': 1.1067225546818436, 'gamma': 0.4611290122082564, 'reg_alpha': 9.476699436635923e-05, 'reg_lambda': 2.99417541348463e-08, 'max_delta_step': 0.9672329096495267, 'booster': 'dart'}. Best is trial 119 with value: 0.9929118927863367.[0m
[32m[I 2026-08-05 20:57:58,655][0m Trial 129 finished with value: 1.0871557909059297 and parameters: {'n_estimators': 2212, 'max_depth': 12, 'learning_rate': 0.17103659345719568, 'subsample': 0.9483219325768854, 'colsample_bytree': 0.4601855400565353, 'colsample_bylevel': 0.7623716311398372, 'colsample_bynode': 0.8423119917877357, 'min_child_weight': 1.9476977492270582, 'gamma': 0.47864550314094834, 'reg_alpha': 0.0052584981305435355, 'reg_lambda': 1.8181873115212804e-05, 'max_delta_step': 0.7564655891924209, 'booster': 'dart'}. Best is trial 119 with value: 0.9929118927863367.[0m
[32m[I 2026-08-05 20:58:01,356][0m Trial 130 finished with value: 1.0431635249587798 and parameters: {'n_estimators': 2008, 'max_depth': 12, 'learning_rate': 0.1836054582471431, 'subsample': 0.9618154658873906, 'colsample_bytree': 0.58297096724561, 'colsample_bylevel': 0.9058560590809371, 'colsample_bynode': 0.950476311933002, 'min_child_weight': 2.316228237173708, 'gamma': 0.022781231106553376, 'reg_alpha': 0.000628863863530697, 'reg_lambda': 9.494268127050107e-05, 'max_delta_step': 0.9519524888797428, 'booster': 'dart'}. Best is trial 119 with value: 0.9929118927863367.[0m
[32m[I 2026-08-05 20:58:03,939][0m Trial 131 finished with value: 1.0684766914445554 and parameters: {'n_estimators': 1565, 'max_depth': 9, 'learning_rate': 0.08581309514724297, 'subsample': 0.9507848365890296, 'colsample_bytree': 0.3461060293295205, 'colsample_bylevel': 0.513856746338361, 'colsample_bynode': 0.8760704789028195, 'min_child_weight': 1.2616855559535243, 'gamma': 0.7250480514605717, 'reg_alpha': 1.960089324458667e-05, 'reg_lambda': 5.239237340479067e-08, 'max_delta_step': 0.5194064821974496, 'booster': 'dart'}. Best is trial 119 with value: 0.9929118927863367.[0m
[32m[I 2026-08-05 20:58:07,610][0m Trial 132 finished with value: 1.0425219004716506 and parameters: {'n_estimators': 2251, 'max_depth': 11, 'learning_rate': 0.16154765651811395, 'subsample': 0.9528497086865787, 'colsample_bytree': 0.5108719448842365, 'colsample_bylevel': 0.9597788123520448, 'colsample_bynode': 0.9931829596378936, 'min_child_weight': 1.9152074294835586, 'gamma': 0.32981461232578924, 'reg_alpha': 0.05877574460997614, 'reg_lambda': 0.004086442939210432, 'max_delta_step': 0.2193910681686958, 'booster': 'dart'}. Best is trial 119 with value: 0.9929118927863367.[0m
[32m[I 2026-08-05 20:58:09,118][0m Trial 133 finished with value: 1.0883635871665915 and parameters: {'n_estimators': 2085, 'max_depth': 10, 'learning_rate': 0.18355856654640704, 'subsample': 0.9656868421839229, 'colsample_bytree': 0.4357641761377583, 'colsample_bylevel': 0.7339507357075502, 'colsample_bynode': 0.9561313619861389, 'min_child_weight': 2.834179030164784, 'gamma': 0.14883896202411384, 'reg_alpha': 0.047070772738159676, 'reg_lambda': 0.004615651444876485, 'max_delta_step': 1.866252484644198, 'booster': 'dart'}. Best is trial 119 with value: 0.9929118927863367.[0m
[32m[I 2026-08-05 20:58:13,681][0m Trial 134 finished with value: 1.027753617158354 and parameters: {'n_estimators': 2451, 'max_depth': 10, 'learning_rate': 0.11674228103625665, 'subsample': 0.9797461831346014, 'colsample_bytree': 0.7831177951832271, 'colsample_bylevel': 0.9022840028046814, 'colsample_bynode': 0.9076448949227591, 'min_child_weight': 1.91889111521326, 'gamma': 0.0016986125030157978, 'reg_alpha': 0.022249226807352473, 'reg_lambda': 1.288214703437679, 'max_delta_step': 1.2230912192018766, 'booster': 'dart'}. Best is trial 119 with value: 0.9929118927863367.[0m
[32m[I 2026-08-05 20:58:16,051][0m Trial 135 finished with value: 1.0810254829241956 and parameters: {'n_estimators': 1979, 'max_depth': 11, 'learning_rate': 0.09826779422173308, 'subsample': 0.9720934140636093, 'colsample_bytree': 0.684534815842233, 'colsample_bylevel': 0.9978081366523934, 'colsample_bynode': 0.9177682973511575, 'min_child_weight': 3.1367032471154577, 'gamma': 0.2544688045412262, 'reg_alpha': 0.0004792079217436274, 'reg_lambda': 0.9791528081726413, 'max_delta_step': 1.410986825224961, 'booster': 'dart'}. Best is trial 119 with value: 0.9929118927863367.[0m
[32m[I 2026-08-05 20:58:18,797][0m Trial 136 finished with value: 1.1186643290186409 and parameters: {'n_estimators': 2179, 'max_depth': 8, 'learning_rate': 0.08850819209561812, 'subsample': 0.8860002533376797, 'colsample_bytree': 0.9384744981334974, 'colsample_bylevel': 0.9446916233682904, 'colsample_bynode': 0.844629790567641, 'min_child_weight': 1.6277911222084345, 'gamma': 0.47495756255663146, 'reg_alpha': 0.4585490783071442, 'reg_lambda': 6.196980499356367, 'max_delta_step': 3.54021377246118, 'booster': 'dart'}. Best is trial 119 with value: 0.9929118927863367.[0m
[32m[I 2026-08-05 20:58:23,328][0m Trial 137 finished with value: 1.0541100461166852 and parameters: {'n_estimators': 1834, 'max_depth': 12, 'learning_rate': 0.026173196968855457, 'subsample': 0.9387542954058244, 'colsample_bytree': 0.6936118662239938, 'colsample_bylevel': 0.8647716027116749, 'colsample_bynode': 0.9213207741215048, 'min_child_weight': 1.929401081019403, 'gamma': 0.8578936779420503, 'reg_alpha': 0.000561119258870789, 'reg_lambda': 2.1299180441274204e-07, 'max_delta_step': 2.0408955410774663, 'booster': 'dart'}. Best is trial 119 with value: 0.9929118927863367.[0m
[32m[I 2026-08-05 20:58:25,829][0m Trial 138 finished with value: 1.0399154954868854 and parameters: {'n_estimators': 1382, 'max_depth': 11, 'learning_rate': 0.06690675693605437, 'subsample': 0.8932555667508305, 'colsample_bytree': 0.4570363770855297, 'colsample_bylevel': 0.8453879462674647, 'colsample_bynode': 0.8918865437974308, 'min_child_weight': 1.01272722063828, 'gamma': 0.40896109110884027, 'reg_alpha': 1.0737519120236926e-06, 'reg_lambda': 2.7745019236752968e-06, 'max_delta_step': 1.175184078317815, 'booster': 'dart'}. Best is trial 119 with value: 0.9929118927863367.[0m
[32m[I 2026-08-05 20:58:27,970][0m Trial 139 finished with value: 1.0601386260480665 and parameters: {'n_estimators': 1892, 'max_depth': 10, 'learning_rate': 0.04825414016863841, 'subsample': 0.8325217434827719, 'colsample_bytree': 0.3827614496033363, 'colsample_bylevel': 0.7334518418874242, 'colsample_bynode': 0.9667311896752105, 'min_child_weight': 1.13901321444187, 'gamma': 0.6126824403179408, 'reg_alpha': 6.0786938929839315e-06, 'reg_lambda': 7.406478229751238e-07, 'max_delta_step': 3.3561712951240956, 'booster': 'dart'}. Best is trial 119 with value: 0.9929118927863367.[0m
[32m[I 2026-08-05 20:58:30,517][0m Trial 140 finished with value: 1.0734995935161147 and parameters: {'n_estimators': 2743, 'max_depth': 11, 'learning_rate': 0.1508516698315242, 'subsample': 0.9558894883511283, 'colsample_bytree': 0.6623422983652916, 'colsample_bylevel': 0.9132764611206794, 'colsample_bynode': 0.9884458038631043, 'min_child_weight': 1.3369694795396536, 'gamma': 0.2849416550246847, 'reg_alpha': 2.795180313642276, 'reg_lambda': 1.4930599907659932, 'max_delta_step': 0.6284350198262151, 'booster': 'dart'}. Best is trial 119 with value: 0.9929118927863367.[0m
[32m[I 2026-08-05 20:58:32,523][0m Trial 141 finished with value: 1.0468026684357006 and parameters: {'n_estimators': 1133, 'max_depth': 11, 'learning_rate': 0.059302960880608865, 'subsample': 0.8239326014809996, 'colsample_bytree': 0.4654494837823295, 'colsample_bylevel': 0.904856378592359, 'colsample_bynode': 0.7914389629335356, 'min_child_weight': 1.1403927962653246, 'gamma': 0.4381142059084272, 'reg_alpha': 1.6361329585596186e-06, 'reg_lambda': 0.00014778291671407854, 'max_delta_step': 2.8071902395974893, 'booster': 'dart'}. Best is trial 119 with value: 0.9929118927863367.[0m
[32m[I 2026-08-05 20:58:35,387][0m Trial 142 finished with value: 1.0536538045037227 and parameters: {'n_estimators': 1817, 'max_depth': 12, 'learning_rate': 0.06404788124941255, 'subsample': 0.8966006406091954, 'colsample_bytree': 0.43182551210294506, 'colsample_bylevel': 0.6268593812421765, 'colsample_bynode': 0.7504383813526699, 'min_child_weight': 1.8194564135841147, 'gamma': 0.17571745676169975, 'reg_alpha': 6.6219036380587146e-06, 'reg_lambda': 3.469625865923308e-08, 'max_delta_step': 1.6865658455367187, 'booster': 'dart'}. Best is trial 119 with value: 0.9929118927863367.[0m
[32m[I 2026-08-05 20:58:40,090][0m Trial 143 finished with value: 1.0497669139173047 and parameters: {'n_estimators': 1938, 'max_depth': 11, 'learning_rate': 0.02498298500518332, 'subsample': 0.9845961176366204, 'colsample_bytree': 0.4516006995365961, 'colsample_bylevel': 0.8144015388539068, 'colsample_bynode': 0.7934530959659097, 'min_child_weight': 1.3588737570743554, 'gamma': 0.3350805159996934, 'reg_alpha': 1.4997769982167957e-08, 'reg_lambda': 3.8789544561233614e-08, 'max_delta_step': 1.89851894819776, 'booster': 'dart'}. Best is trial 119 with value: 0.9929118927863367.[0m
[32m[I 2026-08-05 20:58:42,499][0m Trial 144 finished with value: 1.080175210277588 and parameters: {'n_estimators': 2664, 'max_depth': 9, 'learning_rate': 0.14562741716393604, 'subsample': 0.9248235894209308, 'colsample_bytree': 0.7724233138557228, 'colsample_bylevel': 0.9367537543743202, 'colsample_bynode': 0.7597076762527941, 'min_child_weight': 2.0293745524044398, 'gamma': 0.03077455210897852, 'reg_alpha': 0.001900702496851386, 'reg_lambda': 0.2847418059545866, 'max_delta_step': 1.1799003907466437, 'booster': 'dart'}. Best is trial 119 with value: 0.9929118927863367.[0m
[32m[I 2026-08-05 20:58:45,562][0m Trial 145 finished with value: 1.067579905473704 and parameters: {'n_estimators': 1984, 'max_depth': 12, 'learning_rate': 0.048636391592430675, 'subsample': 0.9926937780807812, 'colsample_bytree': 0.48259839060695425, 'colsample_bylevel': 0.5875881620478371, 'colsample_bynode': 0.9774166385394805, 'min_child_weight': 1.6785418033690385, 'gamma': 0.5549271061203296, 'reg_alpha': 0.00010561959124222038, 'reg_lambda': 2.6414605272664894e-07, 'max_delta_step': 0.9359688044894736, 'booster': 'dart'}. Best is trial 119 with value: 0.9929118927863367.[0m
[32m[I 2026-08-05 20:58:53,656][0m Trial 146 finished with value: 1.187938341181566 and parameters: {'n_estimators': 941, 'max_depth': 10, 'learning_rate': 0.04926736363882562, 'subsample': 0.9292870802649368, 'colsample_bytree': 0.5011098632454015, 'colsample_bylevel': 0.7826035312019541, 'colsample_bynode': 0.8886590825715748, 'min_child_weight': 1.2620612038584416, 'gamma': 0.7904399930983352, 'reg_alpha': 0.00016371089639507635, 'reg_lambda': 0.0003751274013751053, 'max_delta_step': 0.07063762349530012, 'booster': 'dart'}. Best is trial 119 with value: 0.9929118927863367.[0m
[32m[I 2026-08-05 20:58:55,584][0m Trial 147 finished with value: 1.0614460342284142 and parameters: {'n_estimators': 2075, 'max_depth': 10, 'learning_rate': 0.16018192245231871, 'subsample': 0.9597089525829101, 'colsample_bytree': 0.38535435088804126, 'colsample_bylevel': 0.8376338748403332, 'colsample_bynode': 0.9456475412873043, 'min_child_weight': 1.4627263161804869, 'gamma': 0.03365341756631897, 'reg_alpha': 0.0003096873574884496, 'reg_lambda': 1.0330463224288977, 'max_delta_step': 0.9437893661631311, 'booster': 'dart'}. Best is trial 119 with value: 0.9929118927863367.[0m
