[32m[I 2026-08-07 09:05:47,579][0m Trial 18 finished with value: 0.48085298574101853 and parameters: {'boosting_type': 'gbdt', 'max_depth': 10, 'num_leaves': 210, 'learning_rate': 0.07305053053434543, 'n_estimators': 2047, 'subsample': 0.8755441254912064, 'subsample_freq': 1, 'colsample_bytree': 0.9995894458613797, 'reg_alpha': 9.174652028847484e-07, 'reg_lambda': 4.4459158583756626e-07, 'min_child_samples': 45, 'min_child_weight': 1.338093994016873e-05, 'min_split_gain': 0.01300910370469914, 'cat_smooth': 41.943098918478796, 'cat_l2': 30.551107427467866}. Best is trial 15 with value: 0.4796567190509854.[0m
Training until validation scores don't improve for 30 rounds
Early stopping, best iteration is:
[159]	valid_0's rmse: 0.390169	valid_0's l2: 0.152232
Training until validation scores don't improve for 30 rounds
Early stopping, best iteration is:
[229]	valid_0's rmse: 0.55996	valid_0's l2: 0.313556
Training until validation scores don't improve for 30 rounds
Early stopping, best iteration is:
[197]	valid_0's rmse: 0.396008	valid_0's l2: 0.156822
Training until validation scores don't improve for 30 rounds
Early stopping, best iteration is:
[225]	valid_0's rmse: 0.525678	valid_0's l2: 0.276337
Training until validation scores don't improve for 30 rounds
Early stopping, best iteration is:
[225]	valid_0's rmse: 0.706286	valid_0's l2: 0.498841
[32m[I 2026-08-07 09:05:48,010][0m Trial 19 finished with value: 0.5156204002877229 and parameters: {'boosting_type': 'gbdt', 'max_depth': 10, 'num_leaves': 203, 'learning_rate': 0.07107503887254572, 'n_estimators': 2133, 'subsample': 0.8697389997601633, 'subsample_freq': 2, 'colsample_bytree': 0.9800619246014517, 'reg_alpha': 0.00015568652317800088, 'reg_lambda': 2.7513458826689365e-07, 'min_child_samples': 44, 'min_child_weight': 1.2246651174215772e-05, 'min_split_gain': 0.2126791876184757, 'cat_smooth': 43.77365087998325, 'cat_l2': 16.444121808235657}. Best is trial 15 with value: 0.4796567190509854.[0m
Training until validation scores don't improve for 30 rounds
Early stopping, best iteration is:
[1197]	valid_0's rmse: 0.396555	valid_0's l2: 0.157256
Training until validation scores don't improve for 30 rounds
Did not meet early stopping. Best iteration is:
[1646]	valid_0's rmse: 0.552796	valid_0's l2: 0.305583
Training until validation scores don't improve for 30 rounds
Early stopping, best iteration is:
[1060]	valid_0's rmse: 0.412917	valid_0's l2: 0.170501
Training until validation scores don't improve for 30 rounds
Early stopping, best iteration is:
[1428]	valid_0's rmse: 0.511224	valid_0's l2: 0.26135
Training until validation scores don't improve for 30 rounds
Did not meet early stopping. Best iteration is:
[1630]	valid_0's rmse: 0.684493	valid_0's l2: 0.468531
[32m[I 2026-08-07 09:05:49,596][0m Trial 20 finished with value: 0.5115970588663636 and parameters: {'boosting_type': 'gbdt', 'max_depth': 6, 'num_leaves': 217, 'learning_rate': 0.022583652284533802, 'n_estimators': 1654, 'subsample': 0.8498062723035743, 'subsample_freq': 1, 'colsample_bytree': 0.9373227409285396, 'reg_alpha': 2.279641686417766e-06, 'reg_lambda': 5.386270739645598e-05, 'min_child_samples': 78, 'min_child_weight': 0.015219348619243043, 'min_split_gain': 0.10489055943626426, 'cat_smooth': 32.89226643965917, 'cat_l2': 29.70103158339895}. Best is trial 15 with value: 0.4796567190509854.[0m
Training until validation scores don't improve for 30 rounds
Early stopping, best iteration is:
[85]	valid_0's rmse: 0.390986	valid_0's l2: 0.15287
Training until validation scores don't improve for 30 rounds
Early stopping, best iteration is:
[464]	valid_0's rmse: 0.496445	valid_0's l2: 0.246457
Training until validation scores don't improve for 30 rounds
Early stopping, best iteration is:
[68]	valid_0's rmse: 0.393877	valid_0's l2: 0.155139
Training until validation scores don't improve for 30 rounds
Early stopping, best iteration is:
[159]	valid_0's rmse: 0.490175	valid_0's l2: 0.240271
Training until validation scores don't improve for 30 rounds
Early stopping, best iteration is:
[268]	valid_0's rmse: 0.633254	valid_0's l2: 0.40101
[32m[I 2026-08-07 09:05:50,108][0m Trial 21 finished with value: 0.48094716335169085 and parameters: {'boosting_type': 'gbdt', 'max_depth': 14, 'num_leaves': 254, 'learning_rate': 0.13818106684132753, 'n_estimators': 1991, 'subsample': 0.9567189294403328, 'subsample_freq': 1, 'colsample_bytree': 0.818377940574387, 'reg_alpha': 4.884657654745279e-07, 'reg_lambda': 6.891798892579238e-07, 'min_child_samples': 46, 'min_child_weight': 0.0003021700896475232, 'min_split_gain': 0.004761196240239622, 'cat_smooth': 41.99192280908066, 'cat_l2': 36.961308901559974}. Best is trial 15 with value: 0.4796567190509854.[0m
Training until validation scores don't improve for 30 rounds
Early stopping, best iteration is:
[79]	valid_0's rmse: 0.376704	valid_0's l2: 0.141906
Training until validation scores don't improve for 30 rounds
Early stopping, best iteration is:
[260]	valid_0's rmse: 0.487534	valid_0's l2: 0.23769
Training until validation scores don't improve for 30 rounds
Early stopping, best iteration is:
[68]	valid_0's rmse: 0.409743	valid_0's l2: 0.167889
Training until validation scores don't improve for 30 rounds
Early stopping, best iteration is:
[249]	valid_0's rmse: 0.477603	valid_0's l2: 0.228104
Training until validation scores don't improve for 30 rounds
Early stopping, best iteration is:
[128]	valid_0's rmse: 0.667358	valid_0's l2: 0.445367
[32m[I 2026-08-07 09:05:50,547][0m Trial 22 finished with value: 0.4837884874784706 and parameters: {'boosting_type': 'gbdt', 'max_depth': 10, 'num_leaves': 181, 'learning_rate': 0.17742619515306732, 'n_estimators': 2221, 'subsample': 0.9457261433079845, 'subsample_freq': 2, 'colsample_bytree': 0.809357236035648, 'reg_alpha': 8.86017465871371e-08, 'reg_lambda': 1.2888529737656882e-06, 'min_child_samples': 39, 'min_child_weight': 2.491944117068803e-05, 'min_split_gain': 0.011171162508531913, 'cat_smooth': 48.66528154806728, 'cat_l2': 38.10684879487552}. Best is trial 15 with value: 0.4796567190509854.[0m
Training until validation scores don't improve for 30 rounds
Early stopping, best iteration is:
[169]	valid_0's rmse: 0.407655	valid_0's l2: 0.166183
Training until validation scores don't improve for 30 rounds
Early stopping, best iteration is:
[472]	valid_0's rmse: 0.525727	valid_0's l2: 0.276388
Training until validation scores don't improve for 30 rounds
Early stopping, best iteration is:
[308]	valid_0's rmse: 0.395173	valid_0's l2: 0.156162
Training until validation scores don't improve for 30 rounds
Early stopping, best iteration is:
[474]	valid_0's rmse: 0.524808	valid_0's l2: 0.275423
Training until validation scores don't improve for 30 rounds
Early stopping, best iteration is:
[493]	valid_0's rmse: 0.682478	valid_0's l2: 0.465776
[32m[I 2026-08-07 09:05:51,127][0m Trial 23 finished with value: 0.5075382673381361 and parameters: {'boosting_type': 'gbdt', 'max_depth': 14, 'num_leaves': 231, 'learning_rate': 0.06584213893438014, 'n_estimators': 1862, 'subsample': 0.9427198548342345, 'subsample_freq': 1, 'colsample_bytree': 0.9377157959567162, 'reg_alpha': 6.609317633115774e-05, 'reg_lambda': 3.4049373246621237e-07, 'min_child_samples': 55, 'min_child_weight': 0.00010827196265727241, 'min_split_gain': 0.11916150527010344, 'cat_smooth': 43.85436250106823, 'cat_l2': 28.821278078507166}. Best is trial 15 with value: 0.4796567190509854.[0m
Training until validation scores don't improve for 30 rounds
Early stopping, best iteration is:
[89]	valid_0's rmse: 0.403886	valid_0's l2: 0.163124
Training until validation scores don't improve for 30 rounds
Early stopping, best iteration is:
[138]	valid_0's rmse: 0.565289	valid_0's l2: 0.319552
Training until validation scores don't improve for 30 rounds
Early stopping, best iteration is:
[111]	valid_0's rmse: 0.419287	valid_0's l2: 0.175802
Training until validation scores don't improve for 30 rounds
Early stopping, best iteration is:
[113]	valid_0's rmse: 0.509063	valid_0's l2: 0.259145
Training until validation scores don't improve for 30 rounds
Early stopping, best iteration is:
[98]	valid_0's rmse: 0.714783	valid_0's l2: 0.510915
[32m[I 2026-08-07 09:05:51,437][0m Trial 24 finished with value: 0.522461729215267 and parameters: {'boosting_type': 'gbdt', 'max_depth': 14, 'num_leaves': 235, 'learning_rate': 0.16263864367815603, 'n_estimators': 2609, 'subsample': 0.8471706866705704, 'subsample_freq': 3, 'colsample_bytree': 0.7666848365769031, 'reg_alpha': 1.655154454649152e-06, 'reg_lambda': 9.998638355585925e-08, 'min_child_samples': 61, 'min_child_weight': 0.0015781826085204103, 'min_split_gain': 0.25817164861415626, 'cat_smooth': 36.37311941825723, 'cat_l2': 38.90749876897637}. Best is trial 15 with value: 0.4796567190509854.[0m
Training until validation scores don't improve for 30 rounds
Early stopping, best iteration is:
[161]	valid_0's rmse: 0.397666	valid_0's l2: 0.158138
Training until validation scores don't improve for 30 rounds
Early stopping, best iteration is:
[266]	valid_0's rmse: 0.533746	valid_0's l2: 0.284885
Training until validation scores don't improve for 30 rounds
Early stopping, best iteration is:
[193]	valid_0's rmse: 0.394819	valid_0's l2: 0.155882
Training until validation scores don't improve for 30 rounds
Early stopping, best iteration is:
[247]	valid_0's rmse: 0.49792	valid_0's l2: 0.247925
Training until validation scores don't improve for 30 rounds
Early stopping, best iteration is:
[299]	valid_0's rmse: 0.658831	valid_0's l2: 0.434058
[32m[I 2026-08-07 09:05:51,986][0m Trial 25 finished with value: 0.49659646854274164 and parameters: {'boosting_type': 'gbdt', 'max_depth': 10, 'num_leaves': 214, 'learning_rate': 0.07527643969899873, 'n_estimators': 2161, 'subsample': 0.949505708295669, 'subsample_freq': 2, 'colsample_bytree': 0.6728192855187279, 'reg_alpha': 5.539540618975277e-08, 'reg_lambda': 3.16397878514332e-06, 'min_child_samples': 44, 'min_child_weight': 0.0004783187585918392, 'min_split_gain': 0.08271025056110044, 'cat_smooth': 43.000196580690755, 'cat_l2': 27.295794482782203}. Best is trial 15 with value: 0.4796567190509854.[0m
[32m[I 2026-08-07 09:06:00,771][0m Trial 26 finished with value: 0.5841702850635839 and parameters: {'boosting_type': 'dart', 'max_depth': 13, 'num_leaves': 135, 'learning_rate': 0.028684174142564304, 'n_estimators': 1637, 'subsample': 0.8869530833032699, 'subsample_freq': 1, 'colsample_bytree': 0.8388112619196791, 'reg_alpha': 2.959573619421416e-06, 'reg_lambda': 1.0615947080782477e-08, 'min_child_samples': 31, 'min_child_weight': 0.0001170289844948081, 'min_split_gain': 0.4649693151174252, 'cat_smooth': 29.482311384552183, 'cat_l2': 18.25554180890277, 'drop_rate': 0.022296881451710965, 'max_drop': 50, 'skip_drop': 0.2727733879694574}. Best is trial 15 with value: 0.4796567190509854.[0m
Training until validation scores don't improve for 30 rounds
Early stopping, best iteration is:
[114]	valid_0's rmse: 0.406449	valid_0's l2: 0.165201
Training until validation scores don't improve for 30 rounds
Early stopping, best iteration is:
[503]	valid_0's rmse: 0.476603	valid_0's l2: 0.22715
Training until validation scores don't improve for 30 rounds
Early stopping, best iteration is:
[201]	valid_0's rmse: 0.415548	valid_0's l2: 0.17268
Training until validation scores don't improve for 30 rounds
Early stopping, best iteration is:
[280]	valid_0's rmse: 0.487945	valid_0's l2: 0.23809
Training until validation scores don't improve for 30 rounds
Early stopping, best iteration is:
[453]	valid_0's rmse: 0.665448	valid_0's l2: 0.442821
[32m[I 2026-08-07 09:06:01,422][0m Trial 27 finished with value: 0.49039846488902006 and parameters: {'boosting_type': 'gbdt', 'max_depth': 7, 'num_leaves': 184, 'learning_rate': 0.13407086196480145, 'n_estimators': 2608, 'subsample': 0.9633258230774204, 'subsample_freq': 3, 'colsample_bytree': 0.9251846160330776, 'reg_alpha': 3.027056222266514e-07, 'reg_lambda': 1.2141671403657147e-07, 'min_child_samples': 68, 'min_child_weight': 0.0009976522025487004, 'min_split_gain': 0.0016401718745041767, 'cat_smooth': 49.95738625232819, 'cat_l2': 35.34091002839298}. Best is trial 15 with value: 0.4796567190509854.[0m
Training until validation scores don't improve for 30 rounds
Early stopping, best iteration is:
[114]	valid_0's rmse: 0.364471	valid_0's l2: 0.132839
Training until validation scores don't improve for 30 rounds
Early stopping, best iteration is:
[200]	valid_0's rmse: 0.549005	valid_0's l2: 0.301406
Training until validation scores don't improve for 30 rounds
Early stopping, best iteration is:
[142]	valid_0's rmse: 0.374957	valid_0's l2: 0.140593
Training until validation scores don't improve for 30 rounds
Early stopping, best iteration is:
[198]	valid_0's rmse: 0.485064	valid_0's l2: 0.235287
Training until validation scores don't improve for 30 rounds
Early stopping, best iteration is:
[124]	valid_0's rmse: 0.690738	valid_0's l2: 0.47712
[32m[I 2026-08-07 09:06:01,906][0m Trial 28 finished with value: 0.4928470785372777 and parameters: {'boosting_type': 'gbdt', 'max_depth': 13, 'num_leaves': 235, 'learning_rate': 0.08548464368448111, 'n_estimators': 2040, 'subsample': 0.7783292389251367, 'subsample_freq': 2, 'colsample_bytree': 0.9955041829581962, 'reg_alpha': 4.6966834899306785e-05, 'reg_lambda': 2.8034672955123968e-05, 'min_child_samples': 29, 'min_child_weight': 0.009955294926931776, 'min_split_gain': 0.1588355137064109, 'cat_smooth': 36.894076380633145, 'cat_l2': 41.891904855285155}. Best is trial 15 with value: 0.4796567190509854.[0m
[32m[I 2026-08-07 09:06:04,089][0m Trial 29 pruned. [0m
Training until validation scores don't improve for 30 rounds
Early stopping, best iteration is:
[188]	valid_0's rmse: 0.397749	valid_0's l2: 0.158204
Training until validation scores don't improve for 30 rounds
Early stopping, best iteration is:
[500]	valid_0's rmse: 0.531155	valid_0's l2: 0.282125
Training until validation scores don't improve for 30 rounds
Early stopping, best iteration is:
[271]	valid_0's rmse: 0.388785	valid_0's l2: 0.151154
Training until validation scores don't improve for 30 rounds
Early stopping, best iteration is:
[558]	valid_0's rmse: 0.495195	valid_0's l2: 0.245218
Training until validation scores don't improve for 30 rounds
Early stopping, best iteration is:
[443]	valid_0's rmse: 0.662451	valid_0's l2: 0.438841
[32m[I 2026-08-07 09:06:04,991][0m Trial 30 finished with value: 0.4952164817963592 and parameters: {'boosting_type': 'gbdt', 'max_depth': 9, 'num_leaves': 140, 'learning_rate': 0.05211666835916281, 'n_estimators': 1449, 'subsample': 0.9159465934244732, 'subsample_freq': 1, 'colsample_bytree': 0.7336540130144611, 'reg_alpha': 1.1448977981567978e-08, 'reg_lambda': 2.43524332038619e-06, 'min_child_samples': 43, 'min_child_weight': 0.09417352111885059, 'min_split_gain': 0.08118057965988423, 'cat_smooth': 34.99375595062485, 'cat_l2': 26.56043779034966}. Best is trial 15 with value: 0.4796567190509854.[0m
Training until validation scores don't improve for 30 rounds
Early stopping, best iteration is:
[84]	valid_0's rmse: 0.391951	valid_0's l2: 0.153626
Training until validation scores don't improve for 30 rounds
Early stopping, best iteration is:
[143]	valid_0's rmse: 0.512702	valid_0's l2: 0.262863
Training until validation scores don't improve for 30 rounds
Early stopping, best iteration is:
[67]	valid_0's rmse: 0.400427	valid_0's l2: 0.160342
Training until validation scores don't improve for 30 rounds
Early stopping, best iteration is:
[132]	valid_0's rmse: 0.485928	valid_0's l2: 0.236126
Training until validation scores don't improve for 30 rounds
Early stopping, best iteration is:
[137]	valid_0's rmse: 0.657048	valid_0's l2: 0.431712
[32m[I 2026-08-07 09:06:05,421][0m Trial 31 finished with value: 0.48971516880860533 and parameters: {'boosting_type': 'gbdt', 'max_depth': 10, 'num_leaves': 182, 'learning_rate': 0.18078816992645114, 'n_estimators': 2178, 'subsample': 0.9488798458425631, 'subsample_freq': 2, 'colsample_bytree': 0.7902965709802395, 'reg_alpha': 1.0972236213105864e-07, 'reg_lambda': 1.1369590905069345e-06, 'min_child_samples': 39, 'min_child_weight': 2.2516468261587863e-05, 'min_split_gain': 0.046005288327754745, 'cat_smooth': 49.91021688674154, 'cat_l2': 38.09524272404293}. Best is trial 15 with value: 0.4796567190509854.[0m
Training until validation scores don't improve for 30 rounds
Early stopping, best iteration is:
[71]	valid_0's rmse: 0.406265	valid_0's l2: 0.165051
Training until validation scores don't improve for 30 rounds
Early stopping, best iteration is:
[90]	valid_0's rmse: 0.572774	valid_0's l2: 0.32807
Training until validation scores don't improve for 30 rounds
Early stopping, best iteration is:
[81]	valid_0's rmse: 0.414736	valid_0's l2: 0.172006
Training until validation scores don't improve for 30 rounds
Early stopping, best iteration is:
[87]	valid_0's rmse: 0.526814	valid_0's l2: 0.277533
Training until validation scores don't improve for 30 rounds
Early stopping, best iteration is:
[103]	valid_0's rmse: 0.708395	valid_0's l2: 0.501823
[32m[I 2026-08-07 09:06:05,763][0m Trial 32 finished with value: 0.5257966338106067 and parameters: {'boosting_type': 'gbdt', 'max_depth': 11, 'num_leaves': 211, 'learning_rate': 0.16584159801000928, 'n_estimators': 1804, 'subsample': 0.9178983076236334, 'subsample_freq': 2, 'colsample_bytree': 0.818475758570742, 'reg_alpha': 1.3827393992557984e-06, 'reg_lambda': 2.6274364803389645e-08, 'min_child_samples': 50, 'min_child_weight': 2.4781918722879232e-05, 'min_split_gain': 0.19084709268960787, 'cat_smooth': 41.21982665529941, 'cat_l2': 33.25634070759807}. Best is trial 15 with value: 0.4796567190509854.[0m
Training until validation scores don't improve for 30 rounds
Early stopping, best iteration is:
[127]	valid_0's rmse: 0.384938	valid_0's l2: 0.148177
Training until validation scores don't improve for 30 rounds
Early stopping, best iteration is:
[360]	valid_0's rmse: 0.473904	valid_0's l2: 0.224585
Training until validation scores don't improve for 30 rounds
Early stopping, best iteration is:
[126]	valid_0's rmse: 0.401963	valid_0's l2: 0.161574
Training until validation scores don't improve for 30 rounds
Early stopping, best iteration is:
[176]	valid_0's rmse: 0.51972	valid_0's l2: 0.270109
Training until validation scores don't improve for 30 rounds
Early stopping, best iteration is:
[417]	valid_0's rmse: 0.654334	valid_0's l2: 0.428153
[32m[I 2026-08-07 09:06:06,459][0m Trial 33 finished with value: 0.4869719088516079 and parameters: {'boosting_type': 'gbdt', 'max_depth': 6, 'num_leaves': 242, 'learning_rate': 0.14029526056575392, 'n_estimators': 2251, 'subsample': 0.9977656482483387, 'subsample_freq': 2, 'colsample_bytree': 0.615804153739115, 'reg_alpha': 4.690992389390842e-08, 'reg_lambda': 2.0255270315412964e-07, 'min_child_samples': 59, 'min_child_weight': 5.779124918061901e-05, 'min_split_gain': 0.004319769309425375, 'cat_smooth': 46.564390039811684, 'cat_l2': 30.630676517020596}. Best is trial 15 with value: 0.4796567190509854.[0m
[32m[I 2026-08-07 09:06:10,599][0m Trial 34 finished with value: 0.5018516811329994 and parameters: {'boosting_type': 'dart', 'max_depth': 14, 'num_leaves': 192, 'learning_rate': 0.09434769230987593, 'n_estimators': 2623, 'subsample': 0.8544783626976711, 'subsample_freq': 1, 'colsample_bytree': 0.877811235904382, 'reg_alpha': 5.343611414487081e-06, 'reg_lambda': 5.936177973686304e-06, 'min_child_samples': 39, 'min_child_weight': 0.00038414382825812537, 'min_split_gain': 0.07229214625410069, 'cat_smooth': 48.012447324675385, 'cat_l2': 37.301668686561634, 'drop_rate': 0.15525870591280835, 'max_drop': 1, 'skip_drop': 0.18792572659193343}. Best is trial 15 with value: 0.4796567190509854.[0m
Training until validation scores don't improve for 30 rounds
Early stopping, best iteration is:
[34]	valid_0's rmse: 0.378547	valid_0's l2: 0.143298
Training until validation scores don't improve for 30 rounds
Early stopping, best iteration is:
[50]	valid_0's rmse: 0.553637	valid_0's l2: 0.306514
Training until validation scores don't improve for 30 rounds
Early stopping, best iteration is:
[22]	valid_0's rmse: 0.383866	valid_0's l2: 0.147353
Training until validation scores don't improve for 30 rounds
Early stopping, best iteration is:
[32]	valid_0's rmse: 0.492697	valid_0's l2: 0.24275
Training until validation scores don't improve for 30 rounds
Early stopping, best iteration is:
[67]	valid_0's rmse: 0.661809	valid_0's l2: 0.437992
[32m[I 2026-08-07 09:06:10,930][0m Trial 35 finished with value: 0.49430827565028634 and parameters: {'boosting_type': 'gbdt', 'max_depth': 9, 'num_leaves': 168, 'learning_rate': 0.1772292602235106, 'n_estimators': 1945, 'subsample': 0.9606933925027685, 'subsample_freq': 3, 'colsample_bytree': 0.8075463172092675, 'reg_alpha': 2.1135870934907825e-07, 'reg_lambda': 1.1348092192620345e-06, 'min_child_samples': 16, 'min_child_weight': 1.0345615528344235e-05, 'min_split_gain': 0.1372025435643058, 'cat_smooth': 41.0546015428838, 'cat_l2': 41.38478358954382}. Best is trial 15 with value: 0.4796567190509854.[0m
Training until validation scores don't improve for 30 rounds
Early stopping, best iteration is:
[406]	valid_0's rmse: 0.409218	valid_0's l2: 0.16746
Training until validation scores don't improve for 30 rounds
Early stopping, best iteration is:
[561]	valid_0's rmse: 0.523172	valid_0's l2: 0.273709
Training until validation scores don't improve for 30 rounds
Early stopping, best iteration is:
[269]	valid_0's rmse: 0.412084	valid_0's l2: 0.169813
Training until validation scores don't improve for 30 rounds
Early stopping, best iteration is:
[377]	valid_0's rmse: 0.494584	valid_0's l2: 0.244614
Training until validation scores don't improve for 30 rounds
Early stopping, best iteration is:
[445]	valid_0's rmse: 0.695578	valid_0's l2: 0.483829
