============================================================
lightgbm — 运行开始  20260807_090524
  输出目录:  runs\Area_min\Area_min_lightgbm_20260807_090524
============================================================
============================================================
LightGBM + PharmHGT-style Featurization for Area_min Prediction
============================================================
[Cache HIT] Loading features from data\features\surfpro\Area_min
  Train features: (607, 522)
  Test features:  (70, 522)

Split: Train 531, Val 76, Test 70

============================================================
Optuna Hyperparameter Tuning (50 trials, 5-Fold CV)
============================================================
[32m[I 2026-08-07 09:05:26,016][0m Trial 0 finished with value: 1.0295713775224793 and parameters: {'boosting_type': 'dart', 'max_depth': 12, 'num_leaves': 159, 'learning_rate': 0.009470976192691145, 'n_estimators': 890, 'subsample': 0.5290418060840998, 'subsample_freq': 9, 'colsample_bytree': 0.7207805082202461, 'reg_alpha': 0.023585940584142682, 'reg_lambda': 1.5320059381854043e-08, 'min_child_samples': 98, 'min_child_weight': 0.021368329072358756, 'min_split_gain': 0.21233911067827616, 'cat_smooth': 9.091248360355031, 'cat_l2': 9.17022549267169, 'drop_rate': 0.09823025045826593, 'max_drop': 27, 'skip_drop': 0.13526405540621358}. Best is trial 0 with value: 1.0295713775224793.[0m
[32m[I 2026-08-07 09:05:32,924][0m Trial 1 finished with value: 0.7082735343092166 and parameters: {'boosting_type': 'dart', 'max_depth': 4, 'num_leaves': 85, 'learning_rate': 0.02240870575939826, 'n_estimators': 1640, 'subsample': 0.8925879806965068, 'subsample_freq': 2, 'colsample_bytree': 0.6599641068895281, 'reg_alpha': 0.0021465011216654484, 'reg_lambda': 2.6185068507773707e-08, 'min_child_samples': 63, 'min_child_weight': 4.809461967501571e-05, 'min_split_gain': 0.06505159298527952, 'cat_smooth': 47.44427686266666, 'cat_l2': 48.28160165372797, 'drop_rate': 0.24443523095377373, 'max_drop': 16, 'skip_drop': 0.03832491306185132}. Best is trial 1 with value: 0.7082735343092166.[0m
Training until validation scores don't improve for 30 rounds
Early stopping, best iteration is:
[1425]	valid_0's rmse: 0.417053	valid_0's l2: 0.173933
Training until validation scores don't improve for 30 rounds
Early stopping, best iteration is:
[1411]	valid_0's rmse: 0.633518	valid_0's l2: 0.401345
Training until validation scores don't improve for 30 rounds
Early stopping, best iteration is:
[931]	valid_0's rmse: 0.430175	valid_0's l2: 0.185051
Training until validation scores don't improve for 30 rounds
Early stopping, best iteration is:
[1441]	valid_0's rmse: 0.542072	valid_0's l2: 0.293842
Training until validation scores don't improve for 30 rounds
Early stopping, best iteration is:
[819]	valid_0's rmse: 0.768263	valid_0's l2: 0.590228
[32m[I 2026-08-07 09:05:34,999][0m Trial 2 finished with value: 0.5584680802032507 and parameters: {'boosting_type': 'gbdt', 'max_depth': 4, 'num_leaves': 134, 'learning_rate': 0.005755963034165359, 'n_estimators': 2774, 'subsample': 0.6293899908000085, 'subsample_freq': 7, 'colsample_bytree': 0.5181977532625877, 'reg_alpha': 0.0004793052550782129, 'reg_lambda': 0.0008325158565947976, 'min_child_samples': 22, 'min_child_weight': 0.07556810141274425, 'min_split_gain': 0.7751328233611146, 'cat_smooth': 46.97494707820945, 'cat_l2': 44.74136752138244}. Best is trial 2 with value: 0.5584680802032507.[0m
[32m[I 2026-08-07 09:05:37,963][0m Trial 3 finished with value: 0.984022297873614 and parameters: {'boosting_type': 'dart', 'max_depth': 4, 'num_leaves': 62, 'learning_rate': 0.006017151754328819, 'n_estimators': 1313, 'subsample': 0.6943386448447411, 'subsample_freq': 3, 'colsample_bytree': 0.8801162564063505, 'reg_alpha': 1.6247252885719427e-05, 'reg_lambda': 3.376063348877853e-06, 'min_child_samples': 57, 'min_child_weight': 3.661819220392426e-05, 'min_split_gain': 0.8021969807540397, 'cat_smooth': 3.727532183988541, 'cat_l2': 49.34434683002586, 'drop_rate': 0.23395098309603066, 'max_drop': 10, 'skip_drop': 0.011601413965844696}. Best is trial 2 with value: 0.5584680802032507.[0m
Training until validation scores don't improve for 30 rounds
Early stopping, best iteration is:
[1026]	valid_0's rmse: 0.467833	valid_0's l2: 0.218868
Training until validation scores don't improve for 30 rounds
Early stopping, best iteration is:
[837]	valid_0's rmse: 0.677513	valid_0's l2: 0.459024
Training until validation scores don't improve for 30 rounds
Early stopping, best iteration is:
[423]	valid_0's rmse: 0.511715	valid_0's l2: 0.261852
Training until validation scores don't improve for 30 rounds
Early stopping, best iteration is:
[805]	valid_0's rmse: 0.591832	valid_0's l2: 0.350265
Training until validation scores don't improve for 30 rounds
Early stopping, best iteration is:
[1053]	valid_0's rmse: 0.770295	valid_0's l2: 0.593354
[32m[I 2026-08-07 09:05:39,065][0m Trial 4 finished with value: 0.6038376410892684 and parameters: {'boosting_type': 'gbdt', 'max_depth': 12, 'num_leaves': 200, 'learning_rate': 0.006770684770701556, 'n_estimators': 1396, 'subsample': 0.5579345297625649, 'subsample_freq': 9, 'colsample_bytree': 0.7363086887792905, 'reg_alpha': 9.507847858536042e-06, 'reg_lambda': 3.732717755563729e-08, 'min_child_samples': 34, 'min_child_weight': 0.00019986340778528852, 'min_split_gain': 0.7296061783380641, 'cat_smooth': 31.877873567760656, 'cat_l2': 44.36063712881633}. Best is trial 2 with value: 0.5584680802032507.[0m
Training until validation scores don't improve for 30 rounds
Early stopping, best iteration is:
[79]	valid_0's rmse: 0.357713	valid_0's l2: 0.127959
Training until validation scores don't improve for 30 rounds
Early stopping, best iteration is:
[154]	valid_0's rmse: 0.551845	valid_0's l2: 0.304533
Training until validation scores don't improve for 30 rounds
Early stopping, best iteration is:
[102]	valid_0's rmse: 0.379711	valid_0's l2: 0.14418
Training until validation scores don't improve for 30 rounds
Early stopping, best iteration is:
[102]	valid_0's rmse: 0.463512	valid_0's l2: 0.214844
Training until validation scores don't improve for 30 rounds
Early stopping, best iteration is:
[121]	valid_0's rmse: 0.695824	valid_0's l2: 0.484171
[32m[I 2026-08-07 09:05:39,553][0m Trial 5 finished with value: 0.48972122715124033 and parameters: {'boosting_type': 'gbdt', 'max_depth': 12, 'num_leaves': 198, 'learning_rate': 0.04977436807314311, 'n_estimators': 2428, 'subsample': 0.7468977981821954, 'subsample_freq': 6, 'colsample_bytree': 0.5992787128509847, 'reg_alpha': 1.6934490731313353e-08, 'reg_lambda': 9.354548757337708e-08, 'min_child_samples': 8, 'min_child_weight': 0.003512704726270845, 'min_split_gain': 0.3143559810763267, 'cat_smooth': 25.42853455823514, 'cat_l2': 45.37832369630465}. Best is trial 5 with value: 0.48972122715124033.[0m
[32m[I 2026-08-07 09:05:40,354][0m Trial 6 pruned. [0m
[32m[I 2026-08-07 09:05:42,694][0m Trial 7 pruned. [0m
Training until validation scores don't improve for 30 rounds
Early stopping, best iteration is:
[530]	valid_0's rmse: 0.543966	valid_0's l2: 0.295899
Training until validation scores don't improve for 30 rounds
Early stopping, best iteration is:
[306]	valid_0's rmse: 0.79038	valid_0's l2: 0.6247
Training until validation scores don't improve for 30 rounds
Early stopping, best iteration is:
[50]	valid_0's rmse: 0.640891	valid_0's l2: 0.410741
Training until validation scores don't improve for 30 rounds
Early stopping, best iteration is:
[315]	valid_0's rmse: 0.666765	valid_0's l2: 0.444575
Training until validation scores don't improve for 30 rounds
Early stopping, best iteration is:
[310]	valid_0's rmse: 0.838754	valid_0's l2: 0.703509
[32m[I 2026-08-07 09:05:43,120][0m Trial 8 finished with value: 0.6961510094023482 and parameters: {'boosting_type': 'gbdt', 'max_depth': 3, 'num_leaves': 161, 'learning_rate': 0.03915699341344363, 'n_estimators': 628, 'subsample': 0.6393232321183058, 'subsample_freq': 10, 'colsample_bytree': 0.46769332346688064, 'reg_alpha': 2.0139739500176936e-07, 'reg_lambda': 0.0002541410632209718, 'min_child_samples': 99, 'min_child_weight': 9.294394155644992e-05, 'min_split_gain': 0.6721355474058786, 'cat_smooth': 38.08098076643588, 'cat_l2': 11.881877199619984}. Best is trial 5 with value: 0.48972122715124033.[0m
Training until validation scores don't improve for 30 rounds
Early stopping, best iteration is:
[286]	valid_0's rmse: 0.442987	valid_0's l2: 0.196238
Training until validation scores don't improve for 30 rounds
Early stopping, best iteration is:
[252]	valid_0's rmse: 0.649463	valid_0's l2: 0.421802
Training until validation scores don't improve for 30 rounds
Early stopping, best iteration is:
[288]	valid_0's rmse: 0.421241	valid_0's l2: 0.177444
Training until validation scores don't improve for 30 rounds
Early stopping, best iteration is:
[246]	valid_0's rmse: 0.549218	valid_0's l2: 0.30164
Training until validation scores don't improve for 30 rounds
Early stopping, best iteration is:
[261]	valid_0's rmse: 0.76029	valid_0's l2: 0.57804
[32m[I 2026-08-07 09:05:43,632][0m Trial 9 finished with value: 0.5648648348613216 and parameters: {'boosting_type': 'gbdt', 'max_depth': 11, 'num_leaves': 167, 'learning_rate': 0.044839259184207204, 'n_estimators': 725, 'subsample': 0.917651247794619, 'subsample_freq': 4, 'colsample_bytree': 0.4305629572798979, 'reg_alpha': 2.3279640748356466e-08, 'reg_lambda': 0.0020798714270728416, 'min_child_samples': 70, 'min_child_weight': 1.1650681118986128e-05, 'min_split_gain': 0.512093058299281, 'cat_smooth': 11.324788759896897, 'cat_l2': 32.25863952047249}. Best is trial 5 with value: 0.48972122715124033.[0m
Training until validation scores don't improve for 30 rounds
Early stopping, best iteration is:
[38]	valid_0's rmse: 0.377767	valid_0's l2: 0.142708
Training until validation scores don't improve for 30 rounds
Early stopping, best iteration is:
[45]	valid_0's rmse: 0.653232	valid_0's l2: 0.426712
Training until validation scores don't improve for 30 rounds
Early stopping, best iteration is:
[29]	valid_0's rmse: 0.39148	valid_0's l2: 0.153257
Training until validation scores don't improve for 30 rounds
Early stopping, best iteration is:
[22]	valid_0's rmse: 0.509244	valid_0's l2: 0.259329
Training until validation scores don't improve for 30 rounds
Early stopping, best iteration is:
[36]	valid_0's rmse: 0.753468	valid_0's l2: 0.567714
[32m[I 2026-08-07 09:05:43,851][0m Trial 10 finished with value: 0.5370382611993003 and parameters: {'boosting_type': 'gbdt', 'max_depth': 8, 'num_leaves': 16, 'learning_rate': 0.227364806419381, 'n_estimators': 2938, 'subsample': 0.8139601740123973, 'subsample_freq': 6, 'colsample_bytree': 0.31464890149101077, 'reg_alpha': 3.331630946893803, 'reg_lambda': 0.04422317327084487, 'min_child_samples': 7, 'min_child_weight': 0.002949971987301989, 'min_split_gain': 0.34052523698531706, 'cat_smooth': 21.71781358782057, 'cat_l2': 23.63570033289743}. Best is trial 5 with value: 0.48972122715124033.[0m
Training until validation scores don't improve for 30 rounds
Early stopping, best iteration is:
[18]	valid_0's rmse: 0.397957	valid_0's l2: 0.15837
Training until validation scores don't improve for 30 rounds
Early stopping, best iteration is:
[18]	valid_0's rmse: 0.623681	valid_0's l2: 0.388978
Training until validation scores don't improve for 30 rounds
Early stopping, best iteration is:
[24]	valid_0's rmse: 0.393529	valid_0's l2: 0.154865
Training until validation scores don't improve for 30 rounds
Early stopping, best iteration is:
[26]	valid_0's rmse: 0.491133	valid_0's l2: 0.241212
Training until validation scores don't improve for 30 rounds
Early stopping, best iteration is:
[29]	valid_0's rmse: 0.682046	valid_0's l2: 0.465187
[32m[I 2026-08-07 09:05:44,089][0m Trial 11 finished with value: 0.5176693043259781 and parameters: {'boosting_type': 'gbdt', 'max_depth': 8, 'num_leaves': 17, 'learning_rate': 0.23953129153336494, 'n_estimators': 2928, 'subsample': 0.8078766364822536, 'subsample_freq': 6, 'colsample_bytree': 0.32115714350578634, 'reg_alpha': 0.9465205392725847, 'reg_lambda': 0.03437860194381641, 'min_child_samples': 8, 'min_child_weight': 0.003605373423410191, 'min_split_gain': 0.34279928826631645, 'cat_smooth': 20.552612036841047, 'cat_l2': 23.885061810240234}. Best is trial 5 with value: 0.48972122715124033.[0m
Training until validation scores don't improve for 30 rounds
Early stopping, best iteration is:
[15]	valid_0's rmse: 0.506325	valid_0's l2: 0.256365
Training until validation scores don't improve for 30 rounds
Early stopping, best iteration is:
[11]	valid_0's rmse: 0.746308	valid_0's l2: 0.556975
Training until validation scores don't improve for 30 rounds
Early stopping, best iteration is:
[17]	valid_0's rmse: 0.446813	valid_0's l2: 0.199642
Training until validation scores don't improve for 30 rounds
Early stopping, best iteration is:
[12]	valid_0's rmse: 0.583254	valid_0's l2: 0.340185
Training until validation scores don't improve for 30 rounds
Early stopping, best iteration is:
[15]	valid_0's rmse: 0.802581	valid_0's l2: 0.644136
[32m[I 2026-08-07 09:05:44,289][0m Trial 12 finished with value: 0.6170560136721589 and parameters: {'boosting_type': 'gbdt', 'max_depth': 8, 'num_leaves': 21, 'learning_rate': 0.28964577784645223, 'n_estimators': 2445, 'subsample': 0.8079907687060501, 'subsample_freq': 6, 'colsample_bytree': 0.5710827928315942, 'reg_alpha': 7.58060067585804, 'reg_lambda': 1.431047124586851e-05, 'min_child_samples': 7, 'min_child_weight': 0.004026351853278354, 'min_split_gain': 0.3944273631737266, 'cat_smooth': 19.24839515611932, 'cat_l2': 22.61631564388042}. Best is trial 5 with value: 0.48972122715124033.[0m
Training until validation scores don't improve for 30 rounds
Early stopping, best iteration is:
[86]	valid_0's rmse: 0.375069	valid_0's l2: 0.140677
Training until validation scores don't improve for 30 rounds
Early stopping, best iteration is:
[77]	valid_0's rmse: 0.603829	valid_0's l2: 0.364609
Training until validation scores don't improve for 30 rounds
Early stopping, best iteration is:
[76]	valid_0's rmse: 0.362977	valid_0's l2: 0.131752
Training until validation scores don't improve for 30 rounds
Early stopping, best iteration is:
[67]	valid_0's rmse: 0.49056	valid_0's l2: 0.240649
Training until validation scores don't improve for 30 rounds
Early stopping, best iteration is:
[79]	valid_0's rmse: 0.673546	valid_0's l2: 0.453664
[32m[I 2026-08-07 09:05:44,661][0m Trial 13 finished with value: 0.5011961000918344 and parameters: {'boosting_type': 'gbdt', 'max_depth': 15, 'num_leaves': 248, 'learning_rate': 0.10111586840788142, 'n_estimators': 2325, 'subsample': 0.9913430783889022, 'subsample_freq': 5, 'colsample_bytree': 0.9966650076393592, 'reg_alpha': 0.3779696518023393, 'reg_lambda': 7.565770484313319e-06, 'min_child_samples': 23, 'min_child_weight': 0.0006897395462103529, 'min_split_gain': 0.17676135789481792, 'cat_smooth': 33.0299622914229, 'cat_l2': 2.5465222846645155}. Best is trial 5 with value: 0.48972122715124033.[0m
Training until validation scores don't improve for 30 rounds
Early stopping, best iteration is:
[72]	valid_0's rmse: 0.380913	valid_0's l2: 0.145095
Training until validation scores don't improve for 30 rounds
Early stopping, best iteration is:
[232]	valid_0's rmse: 0.567641	valid_0's l2: 0.322216
Training until validation scores don't improve for 30 rounds
Early stopping, best iteration is:
[61]	valid_0's rmse: 0.39163	valid_0's l2: 0.153374
Training until validation scores don't improve for 30 rounds
Early stopping, best iteration is:
[187]	valid_0's rmse: 0.470596	valid_0's l2: 0.22146
Training until validation scores don't improve for 30 rounds
Early stopping, best iteration is:
[225]	valid_0's rmse: 0.629107	valid_0's l2: 0.395775
[32m[I 2026-08-07 09:05:45,232][0m Trial 14 finished with value: 0.4879774038873849 and parameters: {'boosting_type': 'gbdt', 'max_depth': 15, 'num_leaves': 233, 'learning_rate': 0.10721165904029384, 'n_estimators': 2402, 'subsample': 0.9780219661639153, 'subsample_freq': 5, 'colsample_bytree': 0.904700442419023, 'reg_alpha': 0.14551139103143435, 'reg_lambda': 1.0131207604151506e-06, 'min_child_samples': 24, 'min_child_weight': 0.0005079409298861233, 'min_split_gain': 0.01790917317588045, 'cat_smooth': 38.18026070748337, 'cat_l2': 5.275925083151691}. Best is trial 14 with value: 0.4879774038873849.[0m
Training until validation scores don't improve for 30 rounds
Early stopping, best iteration is:
[151]	valid_0's rmse: 0.391786	valid_0's l2: 0.153496
Training until validation scores don't improve for 30 rounds
Early stopping, best iteration is:
[543]	valid_0's rmse: 0.490398	valid_0's l2: 0.24049
Training until validation scores don't improve for 30 rounds
Early stopping, best iteration is:
[93]	valid_0's rmse: 0.395314	valid_0's l2: 0.156273
Training until validation scores don't improve for 30 rounds
Early stopping, best iteration is:
[364]	valid_0's rmse: 0.489849	valid_0's l2: 0.239953
Training until validation scores don't improve for 30 rounds
Early stopping, best iteration is:
[348]	valid_0's rmse: 0.630139	valid_0's l2: 0.397076
[32m[I 2026-08-07 09:05:45,841][0m Trial 15 finished with value: 0.4796567190509854 and parameters: {'boosting_type': 'gbdt', 'max_depth': 15, 'num_leaves': 249, 'learning_rate': 0.10360097303488726, 'n_estimators': 2129, 'subsample': 0.9873868784310907, 'subsample_freq': 1, 'colsample_bytree': 0.8455997416181751, 'reg_alpha': 6.490416817830982e-07, 'reg_lambda': 3.141623469100965e-07, 'min_child_samples': 44, 'min_child_weight': 0.000385014120276839, 'min_split_gain': 0.01618909226365203, 'cat_smooth': 39.52837897848916, 'cat_l2': 34.347933606129274}. Best is trial 15 with value: 0.4796567190509854.[0m
Training until validation scores don't improve for 30 rounds
Early stopping, best iteration is:
[138]	valid_0's rmse: 0.390405	valid_0's l2: 0.152416
Training until validation scores don't improve for 30 rounds
Early stopping, best iteration is:
[288]	valid_0's rmse: 0.492554	valid_0's l2: 0.24261
Training until validation scores don't improve for 30 rounds
Early stopping, best iteration is:
[67]	valid_0's rmse: 0.401642	valid_0's l2: 0.161316
Training until validation scores don't improve for 30 rounds
Early stopping, best iteration is:
[291]	valid_0's rmse: 0.495386	valid_0's l2: 0.245407
Training until validation scores don't improve for 30 rounds
Early stopping, best iteration is:
[286]	valid_0's rmse: 0.656475	valid_0's l2: 0.43096
[32m[I 2026-08-07 09:05:46,337][0m Trial 16 finished with value: 0.48729259187274876 and parameters: {'boosting_type': 'gbdt', 'max_depth': 15, 'num_leaves': 255, 'learning_rate': 0.11809135490841463, 'n_estimators': 1953, 'subsample': 0.9937952913448677, 'subsample_freq': 1, 'colsample_bytree': 0.8415524022052576, 'reg_alpha': 5.357545470669226e-07, 'reg_lambda': 5.691318929182572e-07, 'min_child_samples': 48, 'min_child_weight': 0.00023954698620108628, 'min_split_gain': 0.016444556369117423, 'cat_smooth': 39.73461901455538, 'cat_l2': 32.924041545133775}. Best is trial 15 with value: 0.4796567190509854.[0m
Training until validation scores don't improve for 30 rounds
Early stopping, best iteration is:
[105]	valid_0's rmse: 0.402371	valid_0's l2: 0.161903
Training until validation scores don't improve for 30 rounds
Early stopping, best iteration is:
[246]	valid_0's rmse: 0.544999	valid_0's l2: 0.297024
Training until validation scores don't improve for 30 rounds
Early stopping, best iteration is:
[160]	valid_0's rmse: 0.397307	valid_0's l2: 0.157853
Training until validation scores don't improve for 30 rounds
Early stopping, best iteration is:
[320]	valid_0's rmse: 0.509714	valid_0's l2: 0.259808
Training until validation scores don't improve for 30 rounds
Early stopping, best iteration is:
[325]	valid_0's rmse: 0.667344	valid_0's l2: 0.445348
[32m[I 2026-08-07 09:05:46,793][0m Trial 17 finished with value: 0.5046819684330138 and parameters: {'boosting_type': 'gbdt', 'max_depth': 14, 'num_leaves': 254, 'learning_rate': 0.11506865382503674, 'n_estimators': 1998, 'subsample': 0.9203414610194578, 'subsample_freq': 1, 'colsample_bytree': 0.7829724551772006, 'reg_alpha': 6.009362447296794e-07, 'reg_lambda': 4.075669969228683e-05, 'min_child_samples': 52, 'min_child_weight': 0.00023044102403200093, 'min_split_gain': 0.13305026213449422, 'cat_smooth': 40.9806433718511, 'cat_l2': 34.68781873475359}. Best is trial 15 with value: 0.4796567190509854.[0m
Training until validation scores don't improve for 30 rounds
Early stopping, best iteration is:
[254]	valid_0's rmse: 0.386712	valid_0's l2: 0.149546
Training until validation scores don't improve for 30 rounds
Early stopping, best iteration is:
[539]	valid_0's rmse: 0.491457	valid_0's l2: 0.24153
Training until validation scores don't improve for 30 rounds
Early stopping, best iteration is:
[269]	valid_0's rmse: 0.390921	valid_0's l2: 0.152819
Training until validation scores don't improve for 30 rounds
Early stopping, best iteration is:
[468]	valid_0's rmse: 0.488258	valid_0's l2: 0.238396
Training until validation scores don't improve for 30 rounds
Early stopping, best iteration is:
[384]	valid_0's rmse: 0.646917	valid_0's l2: 0.418502
