[32m[I 2026-08-07 09:06:11,744][0m Trial 36 finished with value: 0.5069273418545277 and parameters: {'boosting_type': 'gbdt', 'max_depth': 12, 'num_leaves': 111, 'learning_rate': 0.06016103021852432, 'n_estimators': 2296, 'subsample': 0.9019838607602683, 'subsample_freq': 1, 'colsample_bytree': 0.7622144216668151, 'reg_alpha': 9.840859968500611e-07, 'reg_lambda': 5.362867323808441e-08, 'min_child_samples': 66, 'min_child_weight': 3.5612942515161834e-05, 'min_split_gain': 0.06556897403254042, 'cat_smooth': 46.703700878370555, 'cat_l2': 43.89953910345906}. Best is trial 15 with value: 0.4796567190509854.[0m
Training until validation scores don't improve for 30 rounds
Early stopping, best iteration is:
[62]	valid_0's rmse: 0.421808	valid_0's l2: 0.177922
Training until validation scores don't improve for 30 rounds
Early stopping, best iteration is:
[79]	valid_0's rmse: 0.579642	valid_0's l2: 0.335985
Training until validation scores don't improve for 30 rounds
Early stopping, best iteration is:
[68]	valid_0's rmse: 0.409793	valid_0's l2: 0.167931
Training until validation scores don't improve for 30 rounds
Early stopping, best iteration is:
[57]	valid_0's rmse: 0.519235	valid_0's l2: 0.269605
Training until validation scores don't improve for 30 rounds
Early stopping, best iteration is:
[59]	valid_0's rmse: 0.709625	valid_0's l2: 0.503567
[32m[I 2026-08-07 09:06:12,085][0m Trial 37 finished with value: 0.5281829233828388 and parameters: {'boosting_type': 'gbdt', 'max_depth': 9, 'num_leaves': 224, 'learning_rate': 0.21552449282901656, 'n_estimators': 1627, 'subsample': 0.937844948503135, 'subsample_freq': 4, 'colsample_bytree': 0.8954173199836697, 'reg_alpha': 2.533489953588812e-05, 'reg_lambda': 1.9109244053092095e-06, 'min_child_samples': 48, 'min_child_weight': 0.042724255748089524, 'min_split_gain': 0.25239756100365096, 'cat_smooth': 42.65028234777653, 'cat_l2': 47.04801547548069}. Best is trial 15 with value: 0.4796567190509854.[0m
[32m[I 2026-08-07 09:06:23,188][0m Trial 38 pruned. [0m
Training until validation scores don't improve for 30 rounds
Early stopping, best iteration is:
[36]	valid_0's rmse: 0.402443	valid_0's l2: 0.16196
Training until validation scores don't improve for 30 rounds
Early stopping, best iteration is:
[72]	valid_0's rmse: 0.575124	valid_0's l2: 0.330768
Training until validation scores don't improve for 30 rounds
Early stopping, best iteration is:
[61]	valid_0's rmse: 0.411437	valid_0's l2: 0.16928
Training until validation scores don't improve for 30 rounds
Early stopping, best iteration is:
[60]	valid_0's rmse: 0.524852	valid_0's l2: 0.275469
Training until validation scores don't improve for 30 rounds
Early stopping, best iteration is:
[68]	valid_0's rmse: 0.681838	valid_0's l2: 0.464903
[32m[I 2026-08-07 09:06:23,489][0m Trial 39 finished with value: 0.5191386743204076 and parameters: {'boosting_type': 'gbdt', 'max_depth': 6, 'num_leaves': 208, 'learning_rate': 0.2771162077984337, 'n_estimators': 2504, 'subsample': 0.8803112140513851, 'subsample_freq': 2, 'colsample_bytree': 0.7139253655976486, 'reg_alpha': 3.202920742344552e-08, 'reg_lambda': 1.1533955077498589e-05, 'min_child_samples': 36, 'min_child_weight': 3.768771717096352e-05, 'min_split_gain': 0.14125752887295992, 'cat_smooth': 28.794699451278806, 'cat_l2': 42.949273161651575}. Best is trial 15 with value: 0.4796567190509854.[0m
[32m[I 2026-08-07 09:06:28,799][0m Trial 40 pruned. [0m
Training until validation scores don't improve for 30 rounds
Early stopping, best iteration is:
[156]	valid_0's rmse: 0.396699	valid_0's l2: 0.15737
Training until validation scores don't improve for 30 rounds
Early stopping, best iteration is:
[420]	valid_0's rmse: 0.468603	valid_0's l2: 0.219589
Training until validation scores don't improve for 30 rounds
Early stopping, best iteration is:
[133]	valid_0's rmse: 0.40747	valid_0's l2: 0.166032
Training until validation scores don't improve for 30 rounds
Early stopping, best iteration is:
[231]	valid_0's rmse: 0.509381	valid_0's l2: 0.259469
Training until validation scores don't improve for 30 rounds
Early stopping, best iteration is:
[347]	valid_0's rmse: 0.662179	valid_0's l2: 0.438481
[32m[I 2026-08-07 09:06:29,538][0m Trial 41 finished with value: 0.4888663929150948 and parameters: {'boosting_type': 'gbdt', 'max_depth': 5, 'num_leaves': 246, 'learning_rate': 0.13059856650778506, 'n_estimators': 2261, 'subsample': 0.9935245282369738, 'subsample_freq': 2, 'colsample_bytree': 0.627395753512953, 'reg_alpha': 1.189954254586875e-07, 'reg_lambda': 1.6698676172284335e-07, 'min_child_samples': 59, 'min_child_weight': 4.945309041814817e-05, 'min_split_gain': 0.0040310697459592796, 'cat_smooth': 46.09499319806544, 'cat_l2': 30.32708881219319}. Best is trial 15 with value: 0.4796567190509854.[0m
Training until validation scores don't improve for 30 rounds
Early stopping, best iteration is:
[124]	valid_0's rmse: 0.394973	valid_0's l2: 0.156003
Training until validation scores don't improve for 30 rounds
Early stopping, best iteration is:
[441]	valid_0's rmse: 0.499091	valid_0's l2: 0.249091
Training until validation scores don't improve for 30 rounds
Early stopping, best iteration is:
[86]	valid_0's rmse: 0.396882	valid_0's l2: 0.157516
Training until validation scores don't improve for 30 rounds
Early stopping, best iteration is:
[408]	valid_0's rmse: 0.471007	valid_0's l2: 0.221848
Training until validation scores don't improve for 30 rounds
Early stopping, best iteration is:
[294]	valid_0's rmse: 0.651304	valid_0's l2: 0.424197
[32m[I 2026-08-07 09:06:30,388][0m Trial 42 finished with value: 0.48265137370430444 and parameters: {'boosting_type': 'gbdt', 'max_depth': 5, 'num_leaves': 241, 'learning_rate': 0.14476046705623183, 'n_estimators': 1755, 'subsample': 0.9984290595078937, 'subsample_freq': 2, 'colsample_bytree': 0.5540821862283757, 'reg_alpha': 4.001889727237356e-07, 'reg_lambda': 7.200367584574955e-07, 'min_child_samples': 41, 'min_child_weight': 0.0001535825317556223, 'min_split_gain': 0.002962355640245197, 'cat_smooth': 47.57008706954956, 'cat_l2': 34.36476811842572}. Best is trial 15 with value: 0.4796567190509854.[0m
Training until validation scores don't improve for 30 rounds
Early stopping, best iteration is:
[127]	valid_0's rmse: 0.409185	valid_0's l2: 0.167433
Training until validation scores don't improve for 30 rounds
Early stopping, best iteration is:
[163]	valid_0's rmse: 0.535073	valid_0's l2: 0.286303
Training until validation scores don't improve for 30 rounds
Early stopping, best iteration is:
[104]	valid_0's rmse: 0.410098	valid_0's l2: 0.168181
Training until validation scores don't improve for 30 rounds
Early stopping, best iteration is:
[107]	valid_0's rmse: 0.502272	valid_0's l2: 0.252277
Training until validation scores don't improve for 30 rounds
Early stopping, best iteration is:
[251]	valid_0's rmse: 0.698614	valid_0's l2: 0.488062
[32m[I 2026-08-07 09:06:30,913][0m Trial 43 finished with value: 0.5120832943020334 and parameters: {'boosting_type': 'gbdt', 'max_depth': 3, 'num_leaves': 222, 'learning_rate': 0.19632118223553677, 'n_estimators': 1465, 'subsample': 0.9707572872546996, 'subsample_freq': 1, 'colsample_bytree': 0.5194275953346068, 'reg_alpha': 5.479694932414874e-07, 'reg_lambda': 5.651660313314417e-08, 'min_child_samples': 39, 'min_child_weight': 0.00032893812024056677, 'min_split_gain': 0.0981482421333134, 'cat_smooth': 39.186380023192356, 'cat_l2': 34.69733221326599}. Best is trial 15 with value: 0.4796567190509854.[0m
Training until validation scores don't improve for 30 rounds
Early stopping, best iteration is:
[119]	valid_0's rmse: 0.385846	valid_0's l2: 0.148877
Training until validation scores don't improve for 30 rounds
Early stopping, best iteration is:
[189]	valid_0's rmse: 0.506861	valid_0's l2: 0.256908
Training until validation scores don't improve for 30 rounds
Early stopping, best iteration is:
[89]	valid_0's rmse: 0.387139	valid_0's l2: 0.149877
Training until validation scores don't improve for 30 rounds
Early stopping, best iteration is:
[184]	valid_0's rmse: 0.467646	valid_0's l2: 0.218693
Training until validation scores don't improve for 30 rounds
Early stopping, best iteration is:
[178]	valid_0's rmse: 0.687369	valid_0's l2: 0.472476
[32m[I 2026-08-07 09:06:31,422][0m Trial 44 finished with value: 0.48697220188880347 and parameters: {'boosting_type': 'gbdt', 'max_depth': 4, 'num_leaves': 192, 'learning_rate': 0.14860172170790556, 'n_estimators': 1756, 'subsample': 0.910387322660581, 'subsample_freq': 2, 'colsample_bytree': 0.6505502743509126, 'reg_alpha': 3.820004875268279e-06, 'reg_lambda': 8.38217031707078e-07, 'min_child_samples': 33, 'min_child_weight': 0.00013118451947339335, 'min_split_gain': 0.049710514968465666, 'cat_smooth': 47.86773395848004, 'cat_l2': 26.300018059507778}. Best is trial 15 with value: 0.4796567190509854.[0m
Training until validation scores don't improve for 30 rounds
Early stopping, best iteration is:
[119]	valid_0's rmse: 0.393576	valid_0's l2: 0.154902
Training until validation scores don't improve for 30 rounds
Early stopping, best iteration is:
[150]	valid_0's rmse: 0.559495	valid_0's l2: 0.313035
Training until validation scores don't improve for 30 rounds
Early stopping, best iteration is:
[113]	valid_0's rmse: 0.395906	valid_0's l2: 0.156742
Training until validation scores don't improve for 30 rounds
Early stopping, best iteration is:
[148]	valid_0's rmse: 0.51713	valid_0's l2: 0.267423
Training until validation scores don't improve for 30 rounds
Early stopping, best iteration is:
[149]	valid_0's rmse: 0.707448	valid_0's l2: 0.500483
[32m[I 2026-08-07 09:06:31,919][0m Trial 45 finished with value: 0.514711049698062 and parameters: {'boosting_type': 'gbdt', 'max_depth': 5, 'num_leaves': 240, 'learning_rate': 0.10241856243172008, 'n_estimators': 1881, 'subsample': 0.9408552829193784, 'subsample_freq': 3, 'colsample_bytree': 0.5608018772958591, 'reg_alpha': 2.699460310714319e-07, 'reg_lambda': 3.294438934220519e-06, 'min_child_samples': 45, 'min_child_weight': 0.000176011749998899, 'min_split_gain': 0.18521093357757776, 'cat_smooth': 44.66277894716876, 'cat_l2': 37.90154979657913}. Best is trial 15 with value: 0.4796567190509854.[0m
Training until validation scores don't improve for 30 rounds
Early stopping, best iteration is:
[112]	valid_0's rmse: 0.35682	valid_0's l2: 0.127321
Training until validation scores don't improve for 30 rounds
Early stopping, best iteration is:
[378]	valid_0's rmse: 0.529161	valid_0's l2: 0.280011
Training until validation scores don't improve for 30 rounds
Early stopping, best iteration is:
[132]	valid_0's rmse: 0.352702	valid_0's l2: 0.124399
Training until validation scores don't improve for 30 rounds
Early stopping, best iteration is:
[346]	valid_0's rmse: 0.448549	valid_0's l2: 0.201196
Training until validation scores don't improve for 30 rounds
Early stopping, best iteration is:
[327]	valid_0's rmse: 0.638166	valid_0's l2: 0.407255
[32m[I 2026-08-07 09:06:32,850][0m Trial 46 finished with value: 0.4650794628647856 and parameters: {'boosting_type': 'gbdt', 'max_depth': 7, 'num_leaves': 227, 'learning_rate': 0.05782228803089206, 'n_estimators': 2073, 'subsample': 0.8346970023093537, 'subsample_freq': 1, 'colsample_bytree': 0.746385955565516, 'reg_alpha': 2.2321406833365414e-08, 'reg_lambda': 0.0010516275515952147, 'min_child_samples': 18, 'min_child_weight': 0.0007850652247475094, 'min_split_gain': 0.03531662153379547, 'cat_smooth': 48.86029204268815, 'cat_l2': 33.65990783317201}. Best is trial 46 with value: 0.4650794628647856.[0m
Training until validation scores don't improve for 30 rounds
Early stopping, best iteration is:
[234]	valid_0's rmse: 0.390975	valid_0's l2: 0.152861
Training until validation scores don't improve for 30 rounds
Early stopping, best iteration is:
[329]	valid_0's rmse: 0.602782	valid_0's l2: 0.363346
Training until validation scores don't improve for 30 rounds
Early stopping, best iteration is:
[194]	valid_0's rmse: 0.415931	valid_0's l2: 0.172999
Training until validation scores don't improve for 30 rounds
Early stopping, best iteration is:
[348]	valid_0's rmse: 0.510154	valid_0's l2: 0.260258
Training until validation scores don't improve for 30 rounds
Early stopping, best iteration is:
[156]	valid_0's rmse: 0.739476	valid_0's l2: 0.546825
[32m[I 2026-08-07 09:06:33,613][0m Trial 47 finished with value: 0.5339611027727099 and parameters: {'boosting_type': 'gbdt', 'max_depth': 7, 'num_leaves': 228, 'learning_rate': 0.05769398499735525, 'n_estimators': 1529, 'subsample': 0.5050269761741197, 'subsample_freq': 1, 'colsample_bytree': 0.48103326752595843, 'reg_alpha': 1.0230684055374504e-08, 'reg_lambda': 0.006769325566473962, 'min_child_samples': 15, 'min_child_weight': 0.0018045342171143371, 'min_split_gain': 0.6280163896539241, 'cat_smooth': 42.32718257121738, 'cat_l2': 21.35098955417739}. Best is trial 46 with value: 0.4650794628647856.[0m
Training until validation scores don't improve for 30 rounds
Early stopping, best iteration is:
[194]	valid_0's rmse: 0.374081	valid_0's l2: 0.139937
Training until validation scores don't improve for 30 rounds
Early stopping, best iteration is:
[519]	valid_0's rmse: 0.530365	valid_0's l2: 0.281287
Training until validation scores don't improve for 30 rounds
Early stopping, best iteration is:
[211]	valid_0's rmse: 0.371783	valid_0's l2: 0.138223
Training until validation scores don't improve for 30 rounds
Early stopping, best iteration is:
[291]	valid_0's rmse: 0.454073	valid_0's l2: 0.206182
Training until validation scores don't improve for 30 rounds
Early stopping, best iteration is:
[458]	valid_0's rmse: 0.648617	valid_0's l2: 0.420704
[32m[I 2026-08-07 09:06:34,723][0m Trial 48 finished with value: 0.47602217848760053 and parameters: {'boosting_type': 'gbdt', 'max_depth': 5, 'num_leaves': 255, 'learning_rate': 0.04329491041735428, 'n_estimators': 1302, 'subsample': 0.7392730296494314, 'subsample_freq': 1, 'colsample_bytree': 0.41555788538416294, 'reg_alpha': 2.7799356817179738e-08, 'reg_lambda': 0.26381299640298905, 'min_child_samples': 17, 'min_child_weight': 0.0008601230830763613, 'min_split_gain': 0.11045630254017777, 'cat_smooth': 38.87234038762641, 'cat_l2': 27.90973005914695}. Best is trial 46 with value: 0.4650794628647856.[0m
Training until validation scores don't improve for 30 rounds
Early stopping, best iteration is:
[311]	valid_0's rmse: 0.370842	valid_0's l2: 0.137524
Training until validation scores don't improve for 30 rounds
Early stopping, best iteration is:
[359]	valid_0's rmse: 0.585314	valid_0's l2: 0.342593
Training until validation scores don't improve for 30 rounds
Early stopping, best iteration is:
[251]	valid_0's rmse: 0.376268	valid_0's l2: 0.141578
Training until validation scores don't improve for 30 rounds
Early stopping, best iteration is:
[273]	valid_0's rmse: 0.473786	valid_0's l2: 0.224473
Training until validation scores don't improve for 30 rounds
Early stopping, best iteration is:
[599]	valid_0's rmse: 0.673765	valid_0's l2: 0.453959
[32m[I 2026-08-07 09:06:35,765][0m Trial 49 finished with value: 0.4964415254717789 and parameters: {'boosting_type': 'gbdt', 'max_depth': 7, 'num_leaves': 249, 'learning_rate': 0.040267554917347174, 'n_estimators': 1133, 'subsample': 0.7140202584730022, 'subsample_freq': 1, 'colsample_bytree': 0.3670973139430343, 'reg_alpha': 2.453618611593215e-08, 'reg_lambda': 0.3372201442190569, 'min_child_samples': 16, 'min_child_weight': 0.0007323179064023636, 'min_split_gain': 0.29264351312830217, 'cat_smooth': 30.559339412035797, 'cat_l2': 27.988010526641485}. Best is trial 46 with value: 0.4650794628647856.[0m

=== Best Trial ===
  CV RMSE: 0.465079
  Params:  {'boosting_type': 'gbdt', 'max_depth': 7, 'num_leaves': 227, 'learning_rate': 0.05782228803089206, 'n_estimators': 2073, 'subsample': 0.8346970023093537, 'subsample_freq': 1, 'colsample_bytree': 0.746385955565516, 'reg_alpha': 2.2321406833365414e-08, 'reg_lambda': 0.0010516275515952147, 'min_child_samples': 18, 'min_child_weight': 0.0007850652247475094, 'min_split_gain': 0.03531662153379547, 'cat_smooth': 48.86029204268815, 'cat_l2': 33.65990783317201}

============================================================
Training Final Model with Best Hyperparameters
============================================================
Training until validation scores don't improve for 50 rounds
[50]	valid_0's rmse: 0.385042	valid_0's l2: 0.148258
[100]	valid_0's rmse: 0.328504	valid_0's l2: 0.107915
[150]	valid_0's rmse: 0.325053	valid_0's l2: 0.10566
Early stopping, best iteration is:
[138]	valid_0's rmse: 0.322106	valid_0's l2: 0.103753

============================================================
Test Evaluation
============================================================
  Test MSE:  0.2659
  Test RMSE: 0.5157
  Test MAE:  0.3206
  Test R²:   0.5919

============================================================
Top 20 Feature Importances
============================================================
   1. LogP                       79.0
   2. tail_ratio                 58.0
   3. atom_mean_26               56.0
   4. atom_std_25                47.0
   5. MolWt                      47.0
   6. atom_mean_35               47.0
   7. atom_std_35                41.0
   8. TPSA                       38.0
   9. atom_mean_20               37.0
  10. atom_std_39                36.0
  11. head_ratio                 36.0
  12. atom_std_54                36.0
  13. atom_mean_54               31.0
  14. RotBonds                   31.0
  15. atom_std_26                31.0
  16. atom_mean_39               31.0
  17. atom_mean_48               31.0
  18. atom_std_3                 30.0
  19. atom_mean_23               30.0
  20. atom_mean_5                28.0

Plot saved to runs\Area_min\Area_min_lightgbm_20260807_090524\pred_vs_true.png
Model saved to runs\Area_min\Area_min_lightgbm_20260807_090524\model.pkl

============================================================
SUMMARY — LightGBM + PharmHGT Features
============================================================
  Features:  522-dim (atom_agg + bond_agg + MACCS + BRICS + surfactant + descriptors)
  Train:     531 (val 76)
  Test:      70
  Optuna:    50 trials, 5-fold CV
  Best CV RMSE: 0.4651
  Test RMSE: 0.5157
  Test MAE:  0.3206
  Test R²:   0.5919

指标已保存: runs\Area_min\Area_min_lightgbm_20260807_090524\metrics.json
索引已更新: runs\Area_min\_runs_index.csv
索引已更新: runs\_runs_index.csv
