============================================================
ngboost — 运行开始  20260806_133537
  输出目录:  runs\pC20\pC20_ngboost_20260806_133537
============================================================
============================================================
NGBoost + PharmHGT-style Featurization for pC20 Prediction
============================================================
[Cache HIT] Loading features from data\features\surfpro\pC20
  Train features: (564, 522)
  Test features:  (70, 522)

Split: Train 493, Val 71, Test 70

============================================================
Optuna Hyperparameter Tuning (50 trials, 5-Fold CV)
============================================================
[32m[I 2026-08-06 13:37:08,516][0m Trial 0 finished with value: 0.6351945465402786 and parameters: {'n_estimators': 874, 'learning_rate': 0.36808608148776095, 'minibatch_frac': 0.8123957592679836, 'max_depth': 6, 'min_samples_leaf': 19, 'score_rule': 'LogScore'}. Best is trial 0 with value: 0.6351945465402786.[0m
[32m[I 2026-08-06 13:38:34,489][0m Trial 1 finished with value: 0.7671061442197814 and parameters: {'n_estimators': 1759, 'learning_rate': 0.041917115166952006, 'minibatch_frac': 0.7956508044572318, 'max_depth': 2, 'min_samples_leaf': 98, 'score_rule': 'LogScore'}. Best is trial 0 with value: 0.6351945465402786.[0m
[32m[I 2026-08-06 13:39:00,004][0m Trial 2 finished with value: 0.908815710760881 and parameters: {'n_estimators': 527, 'learning_rate': 0.0031261029103110596, 'minibatch_frac': 0.5129695700716763, 'max_depth': 5, 'min_samples_leaf': 46, 'score_rule': 'CRPScore'}. Best is trial 0 with value: 0.6351945465402786.[0m
[32m[I 2026-08-06 13:39:18,888][0m Trial 3 finished with value: 0.9197779811090184 and parameters: {'n_estimators': 451, 'learning_rate': 0.00614454378558747, 'minibatch_frac': 0.5564532903055841, 'max_depth': 5, 'min_samples_leaf': 80, 'score_rule': 'CRPScore'}. Best is trial 0 with value: 0.6351945465402786.[0m
[32m[I 2026-08-06 13:40:47,075][0m Trial 4 finished with value: 0.8331293083098228 and parameters: {'n_estimators': 1266, 'learning_rate': 0.0013346527038305934, 'minibatch_frac': 0.7252813963310067, 'max_depth': 3, 'min_samples_leaf': 11, 'score_rule': 'CRPScore'}. Best is trial 0 with value: 0.6351945465402786.[0m
[32m[I 2026-08-06 13:41:35,759][0m Trial 5 pruned. [0m
[32m[I 2026-08-06 13:41:50,770][0m Trial 6 finished with value: 0.7789871229133377 and parameters: {'n_estimators': 261, 'learning_rate': 0.2845958019429146, 'minibatch_frac': 0.48114598712001183, 'max_depth': 6, 'min_samples_leaf': 34, 'score_rule': 'CRPScore'}. Best is trial 0 with value: 0.6351945465402786.[0m
[32m[I 2026-08-06 13:42:21,459][0m Trial 7 pruned. [0m
[32m[I 2026-08-06 13:42:26,842][0m Trial 8 pruned. [0m
[32m[I 2026-08-06 13:42:43,109][0m Trial 9 pruned. [0m
[32m[I 2026-08-06 13:45:44,726][0m Trial 10 finished with value: 0.5838788230106984 and parameters: {'n_estimators': 1125, 'learning_rate': 0.06471846507238901, 'minibatch_frac': 0.978675977551506, 'max_depth': 8, 'min_samples_leaf': 7, 'score_rule': 'LogScore'}. Best is trial 10 with value: 0.5838788230106984.[0m
[32m[I 2026-08-06 13:48:49,335][0m Trial 11 finished with value: 0.5979523144716746 and parameters: {'n_estimators': 1126, 'learning_rate': 0.10227171900952085, 'minibatch_frac': 0.9695256021614991, 'max_depth': 8, 'min_samples_leaf': 5, 'score_rule': 'LogScore'}. Best is trial 10 with value: 0.5838788230106984.[0m
[32m[I 2026-08-06 13:52:19,392][0m Trial 12 finished with value: 0.6008172139847099 and parameters: {'n_estimators': 1261, 'learning_rate': 0.0736412452865339, 'minibatch_frac': 0.997568633074886, 'max_depth': 8, 'min_samples_leaf': 5, 'score_rule': 'LogScore'}. Best is trial 10 with value: 0.5838788230106984.[0m
[32m[I 2026-08-06 13:55:01,853][0m Trial 13 finished with value: 0.6058945848196075 and parameters: {'n_estimators': 1308, 'learning_rate': 0.05535376435186284, 'minibatch_frac': 0.9879799185471897, 'max_depth': 8, 'min_samples_leaf': 25, 'score_rule': 'LogScore'}. Best is trial 10 with value: 0.5838788230106984.[0m
[32m[I 2026-08-06 13:56:55,091][0m Trial 14 finished with value: 0.6068800949218695 and parameters: {'n_estimators': 951, 'learning_rate': 0.02281159970413019, 'minibatch_frac': 0.9060521437014785, 'max_depth': 8, 'min_samples_leaf': 19, 'score_rule': 'LogScore'}. Best is trial 10 with value: 0.5838788230106984.[0m
[32m[I 2026-08-06 14:01:42,568][0m Trial 15 finished with value: 0.6185546946019389 and parameters: {'n_estimators': 1999, 'learning_rate': 0.1556978695206274, 'minibatch_frac': 0.916038441000123, 'max_depth': 7, 'min_samples_leaf': 7, 'score_rule': 'LogScore'}. Best is trial 10 with value: 0.5838788230106984.[0m
[32m[I 2026-08-06 14:02:12,691][0m Trial 16 pruned. [0m
[32m[I 2026-08-06 14:02:59,392][0m Trial 17 pruned. [0m
[32m[I 2026-08-06 14:05:18,162][0m Trial 18 finished with value: 0.6042972905155913 and parameters: {'n_estimators': 1075, 'learning_rate': 0.01941788662614346, 'minibatch_frac': 0.9893489896733269, 'max_depth': 7, 'min_samples_leaf': 16, 'score_rule': 'LogScore'}. Best is trial 10 with value: 0.5838788230106984.[0m
[32m[I 2026-08-06 14:05:37,455][0m Trial 19 pruned. [0m
[32m[I 2026-08-06 14:08:35,895][0m Trial 20 finished with value: 0.5874957833853829 and parameters: {'n_estimators': 1488, 'learning_rate': 0.03238817740320272, 'minibatch_frac': 0.7665749475154032, 'max_depth': 7, 'min_samples_leaf': 5, 'score_rule': 'LogScore'}. Best is trial 10 with value: 0.5838788230106984.[0m
[32m[I 2026-08-06 14:10:56,447][0m Trial 21 finished with value: 0.5828360325605321 and parameters: {'n_estimators': 1475, 'learning_rate': 0.03607972390833735, 'minibatch_frac': 0.6092575557834603, 'max_depth': 7, 'min_samples_leaf': 7, 'score_rule': 'LogScore'}. Best is trial 21 with value: 0.5828360325605321.[0m
[32m[I 2026-08-06 14:13:00,256][0m Trial 22 finished with value: 0.6017901212492172 and parameters: {'n_estimators': 1503, 'learning_rate': 0.03224696030346266, 'minibatch_frac': 0.6099991566016688, 'max_depth': 7, 'min_samples_leaf': 15, 'score_rule': 'LogScore'}. Best is trial 21 with value: 0.5828360325605321.[0m
[32m[I 2026-08-06 14:13:41,790][0m Trial 23 pruned. [0m
[32m[I 2026-08-06 14:14:56,767][0m Trial 24 pruned. [0m
[32m[I 2026-08-06 14:15:18,875][0m Trial 25 pruned. [0m
[32m[I 2026-08-06 14:16:18,055][0m Trial 26 pruned. [0m
[32m[I 2026-08-06 14:17:34,113][0m Trial 27 pruned. [0m
[32m[I 2026-08-06 14:18:01,604][0m Trial 28 pruned. [0m
[32m[I 2026-08-06 14:18:21,098][0m Trial 29 pruned. [0m
[32m[I 2026-08-06 14:21:11,273][0m Trial 30 finished with value: 0.5825679211680589 and parameters: {'n_estimators': 1337, 'learning_rate': 0.01281295075549663, 'minibatch_frac': 0.8362249724958748, 'max_depth': 7, 'min_samples_leaf': 5, 'score_rule': 'LogScore'}. Best is trial 30 with value: 0.5825679211680589.[0m
[32m[I 2026-08-06 14:23:52,869][0m Trial 31 finished with value: 0.5888939517149498 and parameters: {'n_estimators': 1353, 'learning_rate': 0.013101962699508677, 'minibatch_frac': 0.8431059843640417, 'max_depth': 7, 'min_samples_leaf': 10, 'score_rule': 'LogScore'}. Best is trial 30 with value: 0.5825679211680589.[0m
[32m[I 2026-08-06 14:27:10,736][0m Trial 32 finished with value: 0.57751673574071 and parameters: {'n_estimators': 1592, 'learning_rate': 0.0384611746457056, 'minibatch_frac': 0.7947830500969751, 'max_depth': 7, 'min_samples_leaf': 5, 'score_rule': 'LogScore'}. Best is trial 32 with value: 0.57751673574071.[0m
[32m[I 2026-08-06 14:30:32,200][0m Trial 33 finished with value: 0.5937484242309197 and parameters: {'n_estimators': 1640, 'learning_rate': 0.04586851759802281, 'minibatch_frac': 0.8804319633270552, 'max_depth': 8, 'min_samples_leaf': 17, 'score_rule': 'LogScore'}. Best is trial 32 with value: 0.57751673574071.[0m
[32m[I 2026-08-06 14:31:40,843][0m Trial 34 pruned. [0m
[32m[I 2026-08-06 14:32:49,837][0m Trial 35 pruned. [0m
[32m[I 2026-08-06 14:33:51,015][0m Trial 36 pruned. [0m
[32m[I 2026-08-06 14:35:23,808][0m Trial 37 pruned. [0m
[32m[I 2026-08-06 14:36:08,135][0m Trial 38 pruned. [0m
[32m[I 2026-08-06 14:36:37,377][0m Trial 39 pruned. [0m
[32m[I 2026-08-06 14:37:44,537][0m Trial 40 pruned. [0m
[32m[I 2026-08-06 14:40:36,129][0m Trial 41 finished with value: 0.5921449349276406 and parameters: {'n_estimators': 1526, 'learning_rate': 0.027854324287703087, 'minibatch_frac': 0.7551140842293754, 'max_depth': 7, 'min_samples_leaf': 8, 'score_rule': 'LogScore'}. Best is trial 32 with value: 0.57751673574071.[0m
[32m[I 2026-08-06 14:43:19,574][0m Trial 42 finished with value: 0.5841855158334944 and parameters: {'n_estimators': 1440, 'learning_rate': 0.036222128920148124, 'minibatch_frac': 0.7097630535826489, 'max_depth': 7, 'min_samples_leaf': 5, 'score_rule': 'LogScore'}. Best is trial 32 with value: 0.57751673574071.[0m
[32m[I 2026-08-06 14:44:11,690][0m Trial 43 pruned. [0m
[32m[I 2026-08-06 14:45:02,923][0m Trial 44 pruned. [0m
[32m[I 2026-08-06 14:46:20,347][0m Trial 45 pruned. [0m
[32m[I 2026-08-06 14:47:45,003][0m Trial 46 pruned. [0m
[32m[I 2026-08-06 14:48:36,517][0m Trial 47 pruned. [0m
[32m[I 2026-08-06 14:48:54,995][0m Trial 48 pruned. [0m
[32m[I 2026-08-06 14:49:35,347][0m Trial 49 pruned. [0m

=== Best Trial ===
  CV RMSE: 0.577517
  Params:  {'n_estimators': 1592, 'learning_rate': 0.0384611746457056, 'minibatch_frac': 0.7947830500969751, 'max_depth': 7, 'min_samples_leaf': 5, 'score_rule': 'LogScore'}

============================================================
Training Final Model with Best Hyperparameters
============================================================
[iter 0] loss=1.5808 val_loss=0.0000 scale=1.0000 norm=1.1238
[iter 100] loss=-0.7577 val_loss=0.0000 scale=1.0000 norm=0.3735
[iter 200] loss=-1.4528 val_loss=0.0000 scale=1.0000 norm=0.3043
[iter 300] loss=-1.7996 val_loss=0.0000 scale=0.5000 norm=0.1335
[iter 400] loss=-2.0098 val_loss=0.0000 scale=0.2500 norm=0.0605
[iter 500] loss=-2.1742 val_loss=0.0000 scale=0.5000 norm=0.1174
[iter 600] loss=-2.3341 val_loss=0.0000 scale=0.2500 norm=0.0574
[iter 700] loss=-2.4388 val_loss=0.0000 scale=0.2500 norm=0.0592
[iter 800] loss=-2.5374 val_loss=0.0000 scale=0.2500 norm=0.0563
[iter 900] loss=-2.6143 val_loss=0.0000 scale=0.2500 norm=0.0543
[iter 1000] loss=-2.6652 val_loss=0.0000 scale=0.1250 norm=0.0266
[iter 1100] loss=-2.6771 val_loss=0.0000 scale=0.1250 norm=0.0262
[iter 1200] loss=-2.7675 val_loss=0.0000 scale=0.2500 norm=0.0521
[iter 1300] loss=-2.8452 val_loss=0.0000 scale=0.0625 norm=0.0132
[iter 1400] loss=-2.8895 val_loss=0.0000 scale=0.1250 norm=0.0259
[iter 1500] loss=-2.9181 val_loss=0.0000 scale=0.2500 norm=0.0507

============================================================
Test Evaluation
============================================================
  Test MSE:  0.4425
  Test RMSE: 0.6652
  Test MAE:  0.4741
  Test R²:   0.6897
  Distribution: Normal (mean ± std)
  Avg pred std: 0.0172

============================================================
Feature Importance
============================================================
  (unexpected shape (2, 522), skipping)

Plot saved to runs\pC20\pC20_ngboost_20260806_133537\pred_vs_true.png
Model saved to runs\pC20\pC20_ngboost_20260806_133537\model.pkl

============================================================
SUMMARY — NGBoost + PharmHGT Features
============================================================
  Features:      522-dim
  Train:         564 (split 493 train + 71 val)
  Test:          70
  Optuna:    50 trials, 5-fold CV
  Best CV RMSE: 0.5775
  Test RMSE:     0.6652
  Test MAE:      0.4741
  Test R²:       0.6897
  Distribution:  Normal (probabilistic output)

指标已保存: runs\pC20\pC20_ngboost_20260806_133537\metrics.json
索引已更新: runs\pC20\_runs_index.csv
索引已更新: runs\_runs_index.csv
