============================================================
xgboost — 运行开始  20260806_202114
  输出目录:  runs\Pi_CMC\Pi_CMC_xgboost_20260806_202114
============================================================
============================================================
XGBoost + PharmHGT-style Featurization for Pi_CMC Prediction
============================================================
[Cache HIT] Loading features from data\features\surfpro\Pi_CMC
  Train features: (631, 522)
  Test features:  (70, 522)

Split: Train 552, Val 79, Test 70
  CV (Optuna): 567, Holdout (Top-K filter): 64

============================================================
Optuna Hyperparameter Tuning (200 trials, 5-Fold CV)
============================================================
[32m[I 2026-08-06 20:21:16,804][0m Trial 0 finished with value: 4.276451670309241 and parameters: {'n_estimators': 1624, 'max_depth': 12, 'learning_rate': 0.08960785365368121, 'subsample': 0.8394633936788146, 'colsample_bytree': 0.40921304830970556, 'colsample_bylevel': 0.40919616423534183, 'colsample_bynode': 0.3406585285177396, 'min_child_weight': 19.030368381735816, 'gamma': 1.2022300234864176, 'reg_alpha': 0.023585940584142682, 'reg_lambda': 1.5320059381854043e-08, 'max_delta_step': 7.759278817295955, 'booster': 'gbtree'}. Best is trial 0 with value: 4.276451670309241.[0m
[32m[I 2026-08-06 20:21:21,810][0m Trial 1 finished with value: 4.109415091415874 and parameters: {'n_estimators': 1200, 'max_depth': 5, 'learning_rate': 0.024878734419814436, 'subsample': 0.8099025726528951, 'colsample_bytree': 0.602361513049481, 'colsample_bylevel': 0.5038603981386294, 'colsample_bynode': 0.7282970263056656, 'min_child_weight': 1.6071238512039876, 'gamma': 0.5842892970704363, 'reg_alpha': 1.9826980964985924e-05, 'reg_lambda': 0.00012724181576752517, 'max_delta_step': 6.281407691144109, 'booster': 'dart'}. Best is trial 1 with value: 4.109415091415874.[0m
[32m[I 2026-08-06 20:21:24,824][0m Trial 2 finished with value: 4.425417667437282 and parameters: {'n_estimators': 2103, 'max_depth': 4, 'learning_rate': 0.061721159481070736, 'subsample': 0.6682096494749166, 'colsample_bytree': 0.3455361150896956, 'colsample_bylevel': 0.9642198760773333, 'colsample_bynode': 0.9759424231521916, 'min_child_weight': 15.635108708133458, 'gamma': 0.6092275383467414, 'reg_alpha': 7.569183361880229e-08, 'reg_lambda': 0.014391207615728067, 'max_delta_step': 3.5212199499168104, 'booster': 'dart'}. Best is trial 1 with value: 4.109415091415874.[0m
[32m[I 2026-08-06 20:21:31,714][0m Trial 3 finished with value: 4.146724175607635 and parameters: {'n_estimators': 875, 'max_depth': 12, 'learning_rate': 0.02171103454376615, 'subsample': 0.8650089137415928, 'colsample_bytree': 0.5181977532625877, 'colsample_bylevel': 0.6640476148244676, 'colsample_bynode': 0.6826971955402957, 'min_child_weight': 1.8752209455786402, 'gamma': 1.9391692555291171, 'reg_alpha': 0.09466630153726856, 'reg_lambda': 2.854239907497756, 'max_delta_step': 7.158618803421191, 'booster': 'dart'}. Best is trial 1 with value: 4.109415091415874.[0m
[32m[I 2026-08-06 20:21:38,907][0m Trial 4 finished with value: 4.1366674821122 and parameters: {'n_estimators': 994, 'max_depth': 5, 'learning_rate': 0.011450964268326641, 'subsample': 0.7301321323053057, 'colsample_bytree': 0.5720741027826374, 'colsample_bylevel': 0.4899443222417271, 'colsample_bynode': 0.8801162564063505, 'min_child_weight': 3.3648671441879534, 'gamma': 0.5618690193747615, 'reg_alpha': 0.0007660634613082914, 'reg_lambda': 1.8548894229694903e-07, 'max_delta_step': 6.417575846032317, 'booster': 'dart'}. Best is trial 1 with value: 4.109415091415874.[0m
[32m[I 2026-08-06 20:21:54,281][0m Trial 5 finished with value: 4.115234002988233 and parameters: {'n_estimators': 2499, 'max_depth': 5, 'learning_rate': 0.010166803740022877, 'subsample': 0.9261845713819337, 'colsample_bytree': 0.7948001406933319, 'colsample_bylevel': 0.810305017628691, 'colsample_bynode': 0.8398892426801621, 'min_child_weight': 1.286390810198991, 'gamma': 0.7169314570885452, 'reg_alpha': 1.1036250149900698e-07, 'reg_lambda': 0.5860448217200517, 'max_delta_step': 4.986385014620463, 'booster': 'gbtree'}. Best is trial 1 with value: 4.109415091415874.[0m
[32m[I 2026-08-06 20:21:55,070][0m Trial 6 pruned. [0m
[32m[I 2026-08-06 20:21:57,913][0m Trial 7 pruned. [0m
[32m[I 2026-08-06 20:22:00,208][0m Trial 8 pruned. [0m
[32m[I 2026-08-06 20:22:11,502][0m Trial 9 finished with value: 4.1193404862324075 and parameters: {'n_estimators': 2600, 'max_depth': 11, 'learning_rate': 0.010210451114512976, 'subsample': 0.8042989210310263, 'colsample_bytree': 0.5921877022041453, 'colsample_bylevel': 0.45547546732951116, 'colsample_bynode': 0.38390575713357794, 'min_child_weight': 3.1528154175096095, 'gamma': 1.8858194078250383, 'reg_alpha': 8.106369361161699e-06, 'reg_lambda': 0.0004667836070663388, 'max_delta_step': 5.624151671161423, 'booster': 'dart'}. Best is trial 1 with value: 4.109415091415874.[0m
[32m[I 2026-08-06 20:22:13,170][0m Trial 10 pruned. [0m
[32m[I 2026-08-06 20:22:15,373][0m Trial 11 pruned. [0m
[32m[I 2026-08-06 20:22:32,251][0m Trial 12 finished with value: 4.122366285328948 and parameters: {'n_estimators': 2433, 'max_depth': 4, 'learning_rate': 0.010537119647954462, 'subsample': 0.9337360650272457, 'colsample_bytree': 0.5699179755400605, 'colsample_bylevel': 0.5365851485350881, 'colsample_bynode': 0.7557705989142444, 'min_child_weight': 2.883069194588044, 'gamma': 0.05402217530894615, 'reg_alpha': 3.0257023401317654e-08, 'reg_lambda': 0.0045254047024347556, 'max_delta_step': 3.089884980063248, 'booster': 'gbtree'}. Best is trial 1 with value: 4.109415091415874.[0m
[32m[I 2026-08-06 20:22:35,838][0m Trial 13 finished with value: 4.094295075084825 and parameters: {'n_estimators': 1042, 'max_depth': 5, 'learning_rate': 0.05289452515650949, 'subsample': 0.8473423103403527, 'colsample_bytree': 0.4864352092732446, 'colsample_bylevel': 0.49991279004614414, 'colsample_bynode': 0.988536611837429, 'min_child_weight': 1.413535545953584, 'gamma': 1.1411047645650199, 'reg_alpha': 0.0001304556259820446, 'reg_lambda': 0.0021866775909682797, 'max_delta_step': 3.514561378445695, 'booster': 'dart'}. Best is trial 13 with value: 4.094295075084825.[0m
[32m[I 2026-08-06 20:22:37,331][0m Trial 14 pruned. [0m
[32m[I 2026-08-06 20:22:38,402][0m Trial 15 pruned. [0m
[32m[I 2026-08-06 20:22:39,128][0m Trial 16 pruned. [0m
[32m[I 2026-08-06 20:22:41,340][0m Trial 17 pruned. [0m
[32m[I 2026-08-06 20:22:49,156][0m Trial 18 finished with value: 4.106920465776857 and parameters: {'n_estimators': 1626, 'max_depth': 8, 'learning_rate': 0.018046347046245477, 'subsample': 0.7676728149303756, 'colsample_bytree': 0.46837207990157786, 'colsample_bylevel': 0.6019068373304073, 'colsample_bynode': 0.6888433129453535, 'min_child_weight': 1.6205370489477569, 'gamma': 0.3447103815651743, 'reg_alpha': 6.460311496976071e-05, 'reg_lambda': 0.009083690039331871, 'max_delta_step': 7.705996686193341, 'booster': 'dart'}. Best is trial 13 with value: 4.094295075084825.[0m
[32m[I 2026-08-06 20:22:59,196][0m Trial 19 finished with value: 4.059720638927675 and parameters: {'n_estimators': 1746, 'max_depth': 9, 'learning_rate': 0.015493561750592546, 'subsample': 0.80993747137106, 'colsample_bytree': 0.49004807731572403, 'colsample_bylevel': 0.7924069235512647, 'colsample_bynode': 0.655605403915244, 'min_child_weight': 3.149792107633778, 'gamma': 0.6787562715818014, 'reg_alpha': 0.024198469104147115, 'reg_lambda': 0.03594534089124417, 'max_delta_step': 6.5544989506225315, 'booster': 'dart'}. Best is trial 19 with value: 4.059720638927675.[0m
[32m[I 2026-08-06 20:23:03,684][0m Trial 20 pruned. [0m
[32m[I 2026-08-06 20:23:11,248][0m Trial 21 finished with value: 4.118224044833349 and parameters: {'n_estimators': 1287, 'max_depth': 9, 'learning_rate': 0.01967948505239304, 'subsample': 0.88252732341081, 'colsample_bytree': 0.3359184157931705, 'colsample_bylevel': 0.859544455240479, 'colsample_bynode': 0.48291337282805247, 'min_child_weight': 1.6042823010661524, 'gamma': 0.5898286096672453, 'reg_alpha': 0.02678916841946384, 'reg_lambda': 0.48655534975477127, 'max_delta_step': 6.949602980825259, 'booster': 'dart'}. Best is trial 19 with value: 4.059720638927675.[0m
[32m[I 2026-08-06 20:23:13,298][0m Trial 22 pruned. [0m
[32m[I 2026-08-06 20:23:15,997][0m Trial 23 pruned. [0m
[32m[I 2026-08-06 20:23:22,289][0m Trial 24 pruned. [0m
[32m[I 2026-08-06 20:23:25,290][0m Trial 25 pruned. [0m
[32m[I 2026-08-06 20:23:26,670][0m Trial 26 pruned. [0m
[32m[I 2026-08-06 20:23:30,024][0m Trial 27 pruned. [0m
[32m[I 2026-08-06 20:23:43,352][0m Trial 28 finished with value: 4.077313733735018 and parameters: {'n_estimators': 2472, 'max_depth': 10, 'learning_rate': 0.013713783346376544, 'subsample': 0.8006606758775839, 'colsample_bytree': 0.5469311384547513, 'colsample_bylevel': 0.7301704269539979, 'colsample_bynode': 0.7723336636365352, 'min_child_weight': 2.3565756761296024, 'gamma': 0.15898069772227397, 'reg_alpha': 0.15110739539722165, 'reg_lambda': 0.0015913040430845463, 'max_delta_step': 7.180628122692052, 'booster': 'dart'}. Best is trial 19 with value: 4.059720638927675.[0m
[32m[I 2026-08-06 20:23:54,176][0m Trial 29 finished with value: 4.095284087888018 and parameters: {'n_estimators': 2665, 'max_depth': 9, 'learning_rate': 0.017161143513063627, 'subsample': 0.8440368120201183, 'colsample_bytree': 0.5100244464561932, 'colsample_bylevel': 0.5158246836073939, 'colsample_bynode': 0.8129032114567382, 'min_child_weight': 1.5939936191185018, 'gamma': 0.15217267101377757, 'reg_alpha': 2.6146912184988182, 'reg_lambda': 0.002287693026953057, 'max_delta_step': 6.194648084821041, 'booster': 'dart'}. Best is trial 19 with value: 4.059720638927675.[0m
[32m[I 2026-08-06 20:24:05,314][0m Trial 30 finished with value: 4.088720959807266 and parameters: {'n_estimators': 2190, 'max_depth': 9, 'learning_rate': 0.018563992716203206, 'subsample': 0.8169633817541292, 'colsample_bytree': 0.7701116301720559, 'colsample_bylevel': 0.757036256077293, 'colsample_bynode': 0.4780564183551016, 'min_child_weight': 4.393725174296152, 'gamma': 0.6206702938869076, 'reg_alpha': 3.010132414727299, 'reg_lambda': 0.02379069990600517, 'max_delta_step': 6.156132161497055, 'booster': 'dart'}. Best is trial 19 with value: 4.059720638927675.[0m
[32m[I 2026-08-06 20:24:17,784][0m Trial 31 finished with value: 4.071319338761991 and parameters: {'n_estimators': 2335, 'max_depth': 8, 'learning_rate': 0.014869177809671532, 'subsample': 0.8024501296476084, 'colsample_bytree': 0.8459770159874797, 'colsample_bylevel': 0.7465797952757953, 'colsample_bynode': 0.5277169698661545, 'min_child_weight': 4.372146892165102, 'gamma': 0.9014852004736177, 'reg_alpha': 0.22078299770215848, 'reg_lambda': 0.005573745597550187, 'max_delta_step': 3.609687763475361, 'booster': 'dart'}. Best is trial 19 with value: 4.059720638927675.[0m
[32m[I 2026-08-06 20:24:29,089][0m Trial 32 finished with value: 4.088390585196373 and parameters: {'n_estimators': 2270, 'max_depth': 7, 'learning_rate': 0.01948988164370238, 'subsample': 0.9230402930637011, 'colsample_bytree': 0.9439019806447175, 'colsample_bylevel': 0.7219148156900381, 'colsample_bynode': 0.3742069445166991, 'min_child_weight': 5.623677630314148, 'gamma': 0.4205093426946786, 'reg_alpha': 0.5549033653430915, 'reg_lambda': 0.10401938568791168, 'max_delta_step': 6.680655753953718, 'booster': 'dart'}. Best is trial 19 with value: 4.059720638927675.[0m
[32m[I 2026-08-06 20:24:43,938][0m Trial 33 finished with value: 4.06888316234176 and parameters: {'n_estimators': 1919, 'max_depth': 7, 'learning_rate': 0.012395222289156922, 'subsample': 0.989934220377584, 'colsample_bytree': 0.9127729230896993, 'colsample_bylevel': 0.46797569702527864, 'colsample_bynode': 0.3268440283362742, 'min_child_weight': 7.381426087870413, 'gamma': 0.0764106918449804, 'reg_alpha': 0.3142126835114288, 'reg_lambda': 0.07337552036512805, 'max_delta_step': 5.99732999449172, 'booster': 'dart'}. Best is trial 19 with value: 4.059720638927675.[0m
[32m[I 2026-08-06 20:24:57,863][0m Trial 34 finished with value: 4.039664890782504 and parameters: {'n_estimators': 2439, 'max_depth': 4, 'learning_rate': 0.015175746293029995, 'subsample': 0.9955521578028753, 'colsample_bytree': 0.9987237817811894, 'colsample_bylevel': 0.33637857003823124, 'colsample_bynode': 0.47452417048679474, 'min_child_weight': 4.478148235978028, 'gamma': 0.031924631645829385, 'reg_alpha': 0.00039646153242681485, 'reg_lambda': 0.01678074869969249, 'max_delta_step': 7.160413087016562, 'booster': 'dart'}. Best is trial 34 with value: 4.039664890782504.[0m
[32m[I 2026-08-06 20:25:06,508][0m Trial 35 finished with value: 4.047393864467513 and parameters: {'n_estimators': 2006, 'max_depth': 5, 'learning_rate': 0.021413263087269332, 'subsample': 0.8977168834671178, 'colsample_bytree': 0.8708884967960473, 'colsample_bylevel': 0.38815070432285775, 'colsample_bynode': 0.5961239786188767, 'min_child_weight': 3.1932347952588924, 'gamma': 0.2436591350211899, 'reg_alpha': 1.1629023414451203e-05, 'reg_lambda': 0.1373650356755332, 'max_delta_step': 7.630250417792736, 'booster': 'dart'}. Best is trial 34 with value: 4.039664890782504.[0m
[32m[I 2026-08-06 20:25:16,462][0m Trial 36 finished with value: 4.086714147663129 and parameters: {'n_estimators': 1502, 'max_depth': 4, 'learning_rate': 0.014477666509402154, 'subsample': 0.986328890248867, 'colsample_bytree': 0.9269444203022282, 'colsample_bylevel': 0.32826758109038096, 'colsample_bynode': 0.5148339537172106, 'min_child_weight': 3.052167288982174, 'gamma': 0.00632036533977506, 'reg_alpha': 0.000387245257717022, 'reg_lambda': 0.003724943862706135, 'max_delta_step': 7.627156164195243, 'booster': 'dart'}. Best is trial 34 with value: 4.039664890782504.[0m
[32m[I 2026-08-06 20:25:20,122][0m Trial 37 pruned. [0m
[32m[I 2026-08-06 20:25:27,045][0m Trial 38 finished with value: 4.069892783398869 and parameters: {'n_estimators': 2415, 'max_depth': 6, 'learning_rate': 0.022626564129959528, 'subsample': 0.9825963757924683, 'colsample_bytree': 0.9213642095262446, 'colsample_bylevel': 0.46389517709083367, 'colsample_bynode': 0.3040585997062978, 'min_child_weight': 2.432128079970594, 'gamma': 0.21381833309300424, 'reg_alpha': 0.00042291538606655204, 'reg_lambda': 0.10221898380092659, 'max_delta_step': 5.298656938154797, 'booster': 'gbtree'}. Best is trial 34 with value: 4.039664890782504.[0m
[32m[I 2026-08-06 20:25:30,351][0m Trial 39 pruned. [0m
[32m[I 2026-08-06 20:25:33,888][0m Trial 40 pruned. [0m
[32m[I 2026-08-06 20:25:40,030][0m Trial 41 pruned. [0m
[32m[I 2026-08-06 20:25:44,963][0m Trial 42 pruned. [0m
[32m[I 2026-08-06 20:25:48,862][0m Trial 43 pruned. [0m
[32m[I 2026-08-06 20:25:51,694][0m Trial 44 pruned. [0m
[32m[I 2026-08-06 20:25:57,576][0m Trial 45 pruned. [0m
[32m[I 2026-08-06 20:26:00,973][0m Trial 46 pruned. [0m
[32m[I 2026-08-06 20:26:04,121][0m Trial 47 pruned. [0m
[32m[I 2026-08-06 20:26:12,089][0m Trial 48 finished with value: 4.10042118217698 and parameters: {'n_estimators': 2099, 'max_depth': 8, 'learning_rate': 0.016144245286896165, 'subsample': 0.9997598834691477, 'colsample_bytree': 0.7832780638851673, 'colsample_bylevel': 0.38243033993055303, 'colsample_bynode': 0.33893709228859653, 'min_child_weight': 2.5563581098338863, 'gamma': 0.5670540466595061, 'reg_alpha': 0.215132378053747, 'reg_lambda': 1.3390047158396226, 'max_delta_step': 7.110057934592326, 'booster': 'dart'}. Best is trial 34 with value: 4.039664890782504.[0m
[32m[I 2026-08-06 20:26:15,807][0m Trial 49 pruned. [0m
[32m[I 2026-08-06 20:26:21,651][0m Trial 50 pruned. [0m
[32m[I 2026-08-06 20:26:31,270][0m Trial 51 pruned. [0m
[32m[I 2026-08-06 20:26:35,140][0m Trial 52 pruned. [0m
[32m[I 2026-08-06 20:26:49,046][0m Trial 53 finished with value: 4.094111392540026 and parameters: {'n_estimators': 2066, 'max_depth': 5, 'learning_rate': 0.012885384658416151, 'subsample': 0.9847243215782642, 'colsample_bytree': 0.8100888561264041, 'colsample_bylevel': 0.6227870928098582, 'colsample_bynode': 0.3913260083132471, 'min_child_weight': 1.5519441843129222, 'gamma': 0.1020463167924118, 'reg_alpha': 0.0001053576917686342, 'reg_lambda': 0.04257974648319965, 'max_delta_step': 4.636247824364593, 'booster': 'gbtree'}. Best is trial 34 with value: 4.039664890782504.[0m
[32m[I 2026-08-06 20:26:54,844][0m Trial 54 pruned. [0m
[32m[I 2026-08-06 20:26:58,578][0m Trial 55 pruned. [0m
[32m[I 2026-08-06 20:27:05,225][0m Trial 56 pruned. [0m
[32m[I 2026-08-06 20:27:09,227][0m Trial 57 pruned. [0m
[32m[I 2026-08-06 20:27:11,226][0m Trial 58 pruned. [0m
[32m[I 2026-08-06 20:27:22,295][0m Trial 59 pruned. [0m
[32m[I 2026-08-06 20:27:26,375][0m Trial 60 pruned. [0m
[32m[I 2026-08-06 20:27:29,840][0m Trial 61 pruned. [0m
[32m[I 2026-08-06 20:27:34,174][0m Trial 62 pruned. [0m
[32m[I 2026-08-06 20:27:40,216][0m Trial 63 pruned. [0m
[32m[I 2026-08-06 20:27:46,337][0m Trial 64 finished with value: 4.0612870358685464 and parameters: {'n_estimators': 2390, 'max_depth': 11, 'learning_rate': 0.037277778682950985, 'subsample': 0.8629725212641433, 'colsample_bytree': 0.4548823200715394, 'colsample_bylevel': 0.7660664399502556, 'colsample_bynode': 0.7628517219543781, 'min_child_weight': 4.447948989470209, 'gamma': 0.5343320567709531, 'reg_alpha': 1.3667959510135017, 'reg_lambda': 3.6171414522039906e-05, 'max_delta_step': 7.168268018582978, 'booster': 'dart'}. Best is trial 34 with value: 4.039664890782504.[0m
[32m[I 2026-08-06 20:27:49,584][0m Trial 65 finished with value: 4.137273744834977 and parameters: {'n_estimators': 2068, 'max_depth': 9, 'learning_rate': 0.05283484687415905, 'subsample': 0.8626339028084474, 'colsample_bytree': 0.5541347031397936, 'colsample_bylevel': 0.6395950589347168, 'colsample_bynode': 0.8501531155649847, 'min_child_weight': 1.6560817822552398, 'gamma': 1.0758573107759108, 'reg_alpha': 0.06749758380496328, 'reg_lambda': 2.013833286202172e-06, 'max_delta_step': 7.545366714847352, 'booster': 'dart'}. Best is trial 34 with value: 4.039664890782504.[0m
[32m[I 2026-08-06 20:27:57,546][0m Trial 66 finished with value: 4.091790746720984 and parameters: {'n_estimators': 2027, 'max_depth': 9, 'learning_rate': 0.02611384315592471, 'subsample': 0.9397386332210755, 'colsample_bytree': 0.32495638236228863, 'colsample_bylevel': 0.9138861940802386, 'colsample_bynode': 0.7513510467488931, 'min_child_weight': 4.539354701724838, 'gamma': 0.7602698173257334, 'reg_alpha': 2.459657746452006, 'reg_lambda': 2.7623215334435795e-05, 'max_delta_step': 4.720423219617995, 'booster': 'gbtree'}. Best is trial 34 with value: 4.039664890782504.[0m
[32m[I 2026-08-06 20:27:59,578][0m Trial 67 pruned. [0m
[32m[I 2026-08-06 20:28:04,514][0m Trial 68 pruned. [0m
[32m[I 2026-08-06 20:28:09,152][0m Trial 69 pruned. [0m
[32m[I 2026-08-06 20:28:24,780][0m Trial 70 finished with value: 4.104496327824549 and parameters: {'n_estimators': 1981, 'max_depth': 12, 'learning_rate': 0.010053527178682926, 'subsample': 0.8068358457108035, 'colsample_bytree': 0.4569240169571253, 'colsample_bylevel': 0.9759519149927918, 'colsample_bynode': 0.7509102118668907, 'min_child_weight': 3.6008979054650068, 'gamma': 1.0041345142144014, 'reg_alpha': 0.050118304296841595, 'reg_lambda': 0.016141306152694566, 'max_delta_step': 7.853821560093664, 'booster': 'dart'}. Best is trial 34 with value: 4.039664890782504.[0m
[32m[I 2026-08-06 20:28:28,508][0m Trial 71 pruned. [0m
[32m[I 2026-08-06 20:28:33,671][0m Trial 72 finished with value: 4.135823758573813 and parameters: {'n_estimators': 2983, 'max_depth': 12, 'learning_rate': 0.049168963241470486, 'subsample': 0.9965880747552396, 'colsample_bytree': 0.5762355195367511, 'colsample_bylevel': 0.6779065779840125, 'colsample_bynode': 0.77611781317516, 'min_child_weight': 3.150101823903311, 'gamma': 0.7561481831156924, 'reg_alpha': 5.326758563456666, 'reg_lambda': 0.0002619547966984315, 'max_delta_step': 5.6496895395600575, 'booster': 'dart'}. Best is trial 34 with value: 4.039664890782504.[0m
[32m[I 2026-08-06 20:28:42,155][0m Trial 73 pruned. [0m
[32m[I 2026-08-06 20:28:55,297][0m Trial 74 pruned. [0m
[32m[I 2026-08-06 20:29:00,795][0m Trial 75 pruned. [0m
[32m[I 2026-08-06 20:29:08,010][0m Trial 76 pruned. [0m
[32m[I 2026-08-06 20:29:14,445][0m Trial 77 pruned. [0m
[32m[I 2026-08-06 20:29:25,687][0m Trial 78 finished with value: 4.101268647909611 and parameters: {'n_estimators': 2388, 'max_depth': 11, 'learning_rate': 0.013343680980338921, 'subsample': 0.8531778096143554, 'colsample_bytree': 0.48559616985024395, 'colsample_bylevel': 0.6819422744229517, 'colsample_bynode': 0.8180049841006554, 'min_child_weight': 2.4962325202825744, 'gamma': 0.46252923320326866, 'reg_alpha': 0.003748519095453226, 'reg_lambda': 9.407524786742484e-05, 'max_delta_step': 7.226357568445782, 'booster': 'dart'}. Best is trial 34 with value: 4.039664890782504.[0m
[32m[I 2026-08-06 20:29:26,859][0m Trial 79 pruned. [0m
[32m[I 2026-08-06 20:29:28,348][0m Trial 80 pruned. [0m
[32m[I 2026-08-06 20:29:31,235][0m Trial 81 pruned. [0m
[32m[I 2026-08-06 20:29:33,903][0m Trial 82 pruned. [0m
[32m[I 2026-08-06 20:29:46,994][0m Trial 83 finished with value: 4.034284533181372 and parameters: {'n_estimators': 2418, 'max_depth': 4, 'learning_rate': 0.017291447021374366, 'subsample': 0.9894567692880875, 'colsample_bytree': 0.8798378691756217, 'colsample_bylevel': 0.32659844406197036, 'colsample_bynode': 0.34463131220025794, 'min_child_weight': 3.493875919602044, 'gamma': 0.08718942687159764, 'reg_alpha': 1.7680030145510086, 'reg_lambda': 0.000228668608733437, 'max_delta_step': 6.053804693938572, 'booster': 'gbtree'}. Best is trial 83 with value: 4.034284533181372.[0m
