[32m[I 2026-08-06 20:39:36,005][0m Trial 199 pruned. [0m

------------------------------------------------------------
All Trial CV Results:
Trial  Mean RMSE  Std RMSE  CV Scores
------------------------------------------------------------
    0     4.2765
    1     4.1094
    2     4.4254
    3     4.1467
    4     4.1367
    5     4.1152
    6     4.4155
    7     5.5622
    8     4.2925
    9     4.1193
   10     4.2738
   11     4.2422
   12     4.1224
   13     4.0943
   14     4.2299
   15     4.3546
   16     4.3634
   17     4.0432
   18     4.1069
   19     4.0597
   20     4.2361
   21     4.1182
   22     4.2218
   23     4.2645
   24     4.2330
   25     4.2991
   26     4.3060
   27     4.2276
   28     4.0773
   29     4.0953
   30     4.0887
   31     4.0713
   32     4.0884
   33     4.0689
   34     4.0397
   35     4.0474
   36     4.0867
   37     4.3260
   38     4.0699
   39     4.2347
   40     4.2164
   41     3.9887
   42     4.1906
   43     4.0304
   44     3.9982
   45     3.9908
   46     4.2659
   47     4.2422
   48     4.1004
   49     4.3034
   50     4.2848
   51     3.9818
   52     4.2990
   53     4.0941
   54     4.1870
   55     4.4205
   56     3.9796
   57     4.2157
   58     4.3098
   59     4.2907
   60     4.1755
   61     4.1921
   62     4.2093
   63     3.9803
   64     4.0613
   65     4.1373
   66     4.0918
   67     3.9976
   68     4.2244
   69     4.1726
   70     4.1045
   71     4.2060
   72     4.1358
   73     3.9703
   74     3.9729
   75     3.9829
   76     4.1734
   77     4.1653
   78     4.1013
   79     4.1773
   80     4.3343
   81     4.1855
   82     4.2989
   83     4.0343
   84     4.0446
   85     4.3221
   86     4.1950
   87     4.1749
   88     4.1906
   89     4.2207
   90     4.0850
   91     4.2108
   92     4.1897
   93     4.2034
   94     4.1889
   95     3.9728
   96     4.1582
   97     4.1854
   98     3.9793
   99     4.0732
  100     4.1961
  101     4.0028
  102     4.0293
  103     4.0795
  104     4.2103
  105     4.0794
  106     4.1561
  107     4.1652
  108     3.9719
  109     4.3320
  110     4.1932
  111     4.1847
  112     4.2670
  113     4.1630
  114     4.2107
  115     4.2704
  116     4.1937
  117     4.1738
  118     4.1782
  119     4.4051
  120     4.0950
  121     4.0940
  122     4.2303
  123     4.1984
  124     4.1997
  125     4.0496
  126     4.2468
  127     4.1895
  128     4.2095
  129     4.2456
  130     4.2755
  131     4.0214
  132     3.9752
  133     4.2101
  134     4.2365
  135     4.1527
  136     4.1531
  137     4.1899
  138     4.1758
  139     4.2271
  140     4.2724
  141     4.0410
  142     3.9912
  143     4.0309
  144     4.2092
  145     4.1797
  146     4.1688
  147     4.1694
  148     4.0762
  149     3.9690
  150     4.2682
  151     4.2121
  152     4.0709
  153     4.1445
  154     4.1741
  155     4.3425
  156     4.0885
  157     4.1970
  158     4.2175
  159     4.3136
  160     4.1547
  161     4.2213
  162     4.1458
  163     4.1714
  164     4.1427
  165     4.1790
  166     3.9622
  167     4.1520
  168     4.1790
  169     4.1798
  170     4.2111
  171     3.9720
  172     4.1667
  173     4.3766
  174     4.2020
  175     3.9842
  176     4.1727
  177     3.9794
  178     4.2091
  179     4.0600
  180     4.0698
  181     4.2063
  182     4.2298
  183     4.1747
  184     4.1715
  185     4.2816
  186     4.1812
  187     4.1837
  188     4.2956
  189     4.1649
  190     4.2368
  191     4.1487
  192     3.9850
  193     4.2252
  194     4.1470
  195     4.0618
  196     4.1905
  197     4.1665
  198     3.9711
  199     4.2590
------------------------------------------------------------

=== Best Trial ===
  CV RMSE: 4.030918
  Params:  {'n_estimators': 2048, 'max_depth': 7, 'learning_rate': 0.011358049912350973, 'subsample': 0.9659857079649447, 'colsample_bytree': 0.8938110270997532, 'colsample_bylevel': 0.4386669433242925, 'colsample_bynode': 0.4686115615768757, 'min_child_weight': 2.9445293837044333, 'gamma': 0.11647472670746464, 'reg_alpha': 0.0001007859607010745, 'reg_lambda': 2.9671058865733793, 'max_delta_step': 5.691194814087326, 'booster': 'dart'}

Parameter Importance:
  min_child_weight: 0.3544
  learning_rate: 0.2023
  colsample_bytree: 0.1472
  colsample_bynode: 0.0669
  subsample: 0.0587
  colsample_bylevel: 0.0505
  gamma: 0.0378
  n_estimators: 0.0306
  max_delta_step: 0.0191
  max_depth: 0.0164
  booster: 0.0104
  reg_alpha: 0.0036
  reg_lambda: 0.0022

============================================================
Top-5 Holdout Validation — selecting most generalizable params
============================================================
 Rank    CV RMSE   Holdout RMSE   Holdout R²
------------------------------------------------------------
    1     3.9622         3.8240       0.7352
    2     3.9690         3.8119       0.7369
    3     3.9703         3.7673       0.7430
    4     3.9711         3.8241       0.7352
    5     3.9719         3.8978       0.7249

  → Selected params (holdout RMSE=3.7673):
    n_estimators: 1441
    max_depth: 11
    learning_rate: 0.013319584706988926
    subsample: 0.9013710917242597
    colsample_bytree: 0.6213395032068476
    colsample_bylevel: 0.684926515590338
    colsample_bynode: 0.9019277164594888
    min_child_weight: 3.356017210031001
    gamma: 0.31016186552719033
    reg_alpha: 0.15251826071503746
    reg_lambda: 0.02859452402143328
    max_delta_step: 4.93351765524387
    booster: dart

============================================================
Training Final Model with Best Hyperparameters (X_cv: 567 samples)
============================================================

============================================================
Test Evaluation
============================================================
  Test MSE:  18.2120
  Test RMSE: 4.2675
  Test MAE:  2.9343
  Test R虏:   0.6489

============================================================
Top 20 Feature Importances
============================================================
   1. maccs_161                  0.1
   2. bond_mean_12               0.1
   3. bond_mean_3                0.1
   4. bond_std_3                 0.1
   5. atom_min_54                0.0
   6. NumRings                   0.0
   7. atom_max_4                 0.0
   8. atom_max_22                0.0
   9. bond_std_12                0.0
  10. bond_mean_4                0.0
  11. bond_std_4                 0.0
  12. maccs_102                  0.0
  13. maccs_49                   0.0
  14. atom_max_8                 0.0
  15. atom_std_44                0.0
  16. maccs_28                   0.0
  17. maccs_39                   0.0
  18. maccs_158                  0.0
  19. maccs_166                  0.0
  20. maccs_111                  0.0

Plot saved to runs\Pi_CMC\Pi_CMC_xgboost_20260806_202114\pred_vs_true.png
Model saved to runs\Pi_CMC\Pi_CMC_xgboost_20260806_202114\model.pkl

============================================================
SUMMARY - XGBoost + PharmHGT Features
============================================================
  Features:  522-dim (atom_agg + bond_agg + MACCS + BRICS + surfactant + descriptors)
  Train:     567 (holdout 64)
  Test:      70
  Optuna:    200 trials, 5-fold CV, multivariate TPE, gap penalty
  Top-K:     5 candidates re-evaluated on holdout (64 samples)
  Best CV RMSE: 4.0309
  Holdout RMSE: 3.7673
  Test RMSE: 4.2675
  Test MAE:  2.9343
  Test R²:   0.6489

指标已保存: runs\Pi_CMC\Pi_CMC_xgboost_20260806_202114\metrics.json
索引已更新: runs\Pi_CMC\_runs_index.csv
索引已更新: runs\_runs_index.csv
