[32m[I 2026-08-06 20:29:56,980][0m Trial 84 finished with value: 4.04461336236005 and parameters: {'n_estimators': 2363, 'max_depth': 4, 'learning_rate': 0.021124757113892997, 'subsample': 0.9463961244441048, 'colsample_bytree': 0.7834798539267287, 'colsample_bylevel': 0.38579160140534463, 'colsample_bynode': 0.6007923264152246, 'min_child_weight': 3.469675152311827, 'gamma': 0.1141592262258741, 'reg_alpha': 0.01593195350785784, 'reg_lambda': 0.0011047589329706204, 'max_delta_step': 7.08471881544205, 'booster': 'gbtree'}. Best is trial 83 with value: 4.034284533181372.[0m
[32m[I 2026-08-06 20:29:59,026][0m Trial 85 pruned. [0m
[32m[I 2026-08-06 20:30:01,658][0m Trial 86 pruned. [0m
[32m[I 2026-08-06 20:30:06,746][0m Trial 87 pruned. [0m
[32m[I 2026-08-06 20:30:10,096][0m Trial 88 pruned. [0m
[32m[I 2026-08-06 20:30:15,111][0m Trial 89 pruned. [0m
[32m[I 2026-08-06 20:30:22,494][0m Trial 90 finished with value: 4.084952773184023 and parameters: {'n_estimators': 2127, 'max_depth': 10, 'learning_rate': 0.02485843413313307, 'subsample': 0.8802347430163113, 'colsample_bytree': 0.5972345811621327, 'colsample_bylevel': 0.680209497253221, 'colsample_bynode': 0.6629496677971306, 'min_child_weight': 4.844390410260821, 'gamma': 0.653288634211641, 'reg_alpha': 4.333795232400821, 'reg_lambda': 7.790681745369644e-05, 'max_delta_step': 7.2233288607428445, 'booster': 'dart'}. Best is trial 83 with value: 4.034284533181372.[0m
[32m[I 2026-08-06 20:30:25,089][0m Trial 91 pruned. [0m
[32m[I 2026-08-06 20:30:27,853][0m Trial 92 pruned. [0m
[32m[I 2026-08-06 20:30:32,689][0m Trial 93 pruned. [0m
[32m[I 2026-08-06 20:30:40,549][0m Trial 94 pruned. [0m
[32m[I 2026-08-06 20:30:44,685][0m Trial 95 pruned. [0m
[32m[I 2026-08-06 20:30:49,364][0m Trial 96 pruned. [0m
[32m[I 2026-08-06 20:30:53,985][0m Trial 97 pruned. [0m
[32m[I 2026-08-06 20:30:57,428][0m Trial 98 pruned. [0m
[32m[I 2026-08-06 20:31:14,331][0m Trial 99 finished with value: 4.073228799788037 and parameters: {'n_estimators': 1885, 'max_depth': 6, 'learning_rate': 0.010574551660513468, 'subsample': 0.9534841503926166, 'colsample_bytree': 0.9517491542440032, 'colsample_bylevel': 0.602301303274749, 'colsample_bynode': 0.46408141624648147, 'min_child_weight': 5.132728371549389, 'gamma': 0.01726507980187328, 'reg_alpha': 0.002743522270799222, 'reg_lambda': 1.1161169230632784, 'max_delta_step': 6.177185753354876, 'booster': 'dart'}. Best is trial 83 with value: 4.034284533181372.[0m
[32m[I 2026-08-06 20:31:19,909][0m Trial 100 pruned. [0m
[32m[I 2026-08-06 20:31:24,459][0m Trial 101 pruned. [0m
[32m[I 2026-08-06 20:31:30,280][0m Trial 102 pruned. [0m
[32m[I 2026-08-06 20:31:40,756][0m Trial 103 finished with value: 4.079487244889858 and parameters: {'n_estimators': 1870, 'max_depth': 6, 'learning_rate': 0.014430781265060678, 'subsample': 0.9927855862259892, 'colsample_bytree': 0.9438084509032231, 'colsample_bylevel': 0.5636903618437403, 'colsample_bynode': 0.5035448139671718, 'min_child_weight': 5.125652285623075, 'gamma': 0.557548784859087, 'reg_alpha': 0.017666845821535722, 'reg_lambda': 0.11798790353655633, 'max_delta_step': 6.007072919511272, 'booster': 'dart'}. Best is trial 83 with value: 4.034284533181372.[0m
[32m[I 2026-08-06 20:31:43,869][0m Trial 104 pruned. [0m
[32m[I 2026-08-06 20:31:48,944][0m Trial 105 finished with value: 4.079420990715992 and parameters: {'n_estimators': 1483, 'max_depth': 7, 'learning_rate': 0.04231533139291318, 'subsample': 0.9191800995842296, 'colsample_bytree': 0.9794334886413494, 'colsample_bylevel': 0.3954406831702119, 'colsample_bynode': 0.5640972072002034, 'min_child_weight': 5.09390162408117, 'gamma': 0.18845533514396196, 'reg_alpha': 3.559237553886889e-08, 'reg_lambda': 0.39910656197553274, 'max_delta_step': 7.244299045675937, 'booster': 'dart'}. Best is trial 83 with value: 4.034284533181372.[0m
[32m[I 2026-08-06 20:31:53,612][0m Trial 106 pruned. [0m
[32m[I 2026-08-06 20:31:56,252][0m Trial 107 pruned. [0m
[32m[I 2026-08-06 20:32:03,078][0m Trial 108 pruned. [0m
[32m[I 2026-08-06 20:32:07,103][0m Trial 109 pruned. [0m
[32m[I 2026-08-06 20:32:12,091][0m Trial 110 pruned. [0m
[32m[I 2026-08-06 20:32:13,269][0m Trial 111 pruned. [0m
[32m[I 2026-08-06 20:32:18,001][0m Trial 112 pruned. [0m
[32m[I 2026-08-06 20:32:19,732][0m Trial 113 pruned. [0m
[32m[I 2026-08-06 20:32:22,666][0m Trial 114 pruned. [0m
[32m[I 2026-08-06 20:32:23,997][0m Trial 115 pruned. [0m
[32m[I 2026-08-06 20:32:32,728][0m Trial 116 pruned. [0m
[32m[I 2026-08-06 20:32:34,821][0m Trial 117 pruned. [0m
[32m[I 2026-08-06 20:32:39,478][0m Trial 118 pruned. [0m
[32m[I 2026-08-06 20:32:40,540][0m Trial 119 pruned. [0m
[32m[I 2026-08-06 20:32:48,239][0m Trial 120 finished with value: 4.09497825837806 and parameters: {'n_estimators': 1999, 'max_depth': 6, 'learning_rate': 0.02391408438407073, 'subsample': 0.8989331036335895, 'colsample_bytree': 0.8322341276983523, 'colsample_bylevel': 0.4154406874028288, 'colsample_bynode': 0.7063551823616352, 'min_child_weight': 3.899942881072812, 'gamma': 0.35598252466731145, 'reg_alpha': 9.225959819674699e-08, 'reg_lambda': 0.16137395776544314, 'max_delta_step': 7.36322953654693, 'booster': 'dart'}. Best is trial 83 with value: 4.034284533181372.[0m
[32m[I 2026-08-06 20:33:00,466][0m Trial 121 finished with value: 4.093985177978405 and parameters: {'n_estimators': 1997, 'max_depth': 7, 'learning_rate': 0.012589256302485273, 'subsample': 0.9627370156614712, 'colsample_bytree': 0.7957692589316678, 'colsample_bylevel': 0.5895495198435075, 'colsample_bynode': 0.5532847898037357, 'min_child_weight': 2.331249003730474, 'gamma': 0.2532937098267758, 'reg_alpha': 0.014408336696608138, 'reg_lambda': 0.010914756070558695, 'max_delta_step': 6.949462784412315, 'booster': 'dart'}. Best is trial 83 with value: 4.034284533181372.[0m
[32m[I 2026-08-06 20:33:04,121][0m Trial 122 pruned. [0m
[32m[I 2026-08-06 20:33:05,404][0m Trial 123 pruned. [0m
[32m[I 2026-08-06 20:33:09,251][0m Trial 124 pruned. [0m
[32m[I 2026-08-06 20:33:22,528][0m Trial 125 finished with value: 4.049608600125862 and parameters: {'n_estimators': 1918, 'max_depth': 5, 'learning_rate': 0.011142985400808091, 'subsample': 0.9807175766408136, 'colsample_bytree': 0.8468989086548997, 'colsample_bylevel': 0.4742488440527286, 'colsample_bynode': 0.3609648587374451, 'min_child_weight': 3.536064629776291, 'gamma': 0.3504017221568041, 'reg_alpha': 0.0005846513771135491, 'reg_lambda': 0.5411717545632254, 'max_delta_step': 6.0353592539165515, 'booster': 'dart'}. Best is trial 83 with value: 4.034284533181372.[0m
[32m[I 2026-08-06 20:33:26,930][0m Trial 126 pruned. [0m
[32m[I 2026-08-06 20:33:30,135][0m Trial 127 pruned. [0m
[32m[I 2026-08-06 20:33:34,188][0m Trial 128 pruned. [0m
[32m[I 2026-08-06 20:33:38,176][0m Trial 129 pruned. [0m
[32m[I 2026-08-06 20:33:42,843][0m Trial 130 pruned. [0m
[32m[I 2026-08-06 20:33:45,592][0m Trial 131 pruned. [0m
[32m[I 2026-08-06 20:33:51,957][0m Trial 132 pruned. [0m
[32m[I 2026-08-06 20:33:55,110][0m Trial 133 pruned. [0m
[32m[I 2026-08-06 20:33:58,776][0m Trial 134 pruned. [0m
[32m[I 2026-08-06 20:34:02,529][0m Trial 135 pruned. [0m
[32m[I 2026-08-06 20:34:07,362][0m Trial 136 pruned. [0m
[32m[I 2026-08-06 20:34:13,793][0m Trial 137 pruned. [0m
[32m[I 2026-08-06 20:34:18,240][0m Trial 138 pruned. [0m
[32m[I 2026-08-06 20:34:20,695][0m Trial 139 pruned. [0m
[32m[I 2026-08-06 20:34:26,371][0m Trial 140 pruned. [0m
[32m[I 2026-08-06 20:34:40,632][0m Trial 141 finished with value: 4.041020917119126 and parameters: {'n_estimators': 2745, 'max_depth': 5, 'learning_rate': 0.015356198558305814, 'subsample': 0.9763933249825417, 'colsample_bytree': 0.9172478903803238, 'colsample_bylevel': 0.48180560855465826, 'colsample_bynode': 0.32174039944785066, 'min_child_weight': 4.186675265293318, 'gamma': 0.052723453549094725, 'reg_alpha': 2.5844804247862734, 'reg_lambda': 0.00015449011562340464, 'max_delta_step': 4.841566734440127, 'booster': 'gbtree'}. Best is trial 83 with value: 4.034284533181372.[0m
[32m[I 2026-08-06 20:34:47,110][0m Trial 142 pruned. [0m
[32m[I 2026-08-06 20:35:05,574][0m Trial 143 finished with value: 4.030917946486313 and parameters: {'n_estimators': 2048, 'max_depth': 7, 'learning_rate': 0.011358049912350973, 'subsample': 0.9659857079649447, 'colsample_bytree': 0.8938110270997532, 'colsample_bylevel': 0.4386669433242925, 'colsample_bynode': 0.4686115615768757, 'min_child_weight': 2.9445293837044333, 'gamma': 0.11647472670746464, 'reg_alpha': 0.0001007859607010745, 'reg_lambda': 2.9671058865733793, 'max_delta_step': 5.691194814087326, 'booster': 'dart'}. Best is trial 143 with value: 4.030917946486313.[0m
[32m[I 2026-08-06 20:35:09,131][0m Trial 144 pruned. [0m
[32m[I 2026-08-06 20:35:13,578][0m Trial 145 pruned. [0m
[32m[I 2026-08-06 20:35:17,890][0m Trial 146 pruned. [0m
[32m[I 2026-08-06 20:35:22,698][0m Trial 147 pruned. [0m
[32m[I 2026-08-06 20:35:27,748][0m Trial 148 finished with value: 4.076168497219541 and parameters: {'n_estimators': 2481, 'max_depth': 6, 'learning_rate': 0.03396322745914235, 'subsample': 0.9935982461288875, 'colsample_bytree': 0.958364305068183, 'colsample_bylevel': 0.4786742606830877, 'colsample_bynode': 0.33834434325250035, 'min_child_weight': 2.833927124644506, 'gamma': 0.22080573776692766, 'reg_alpha': 0.010164662318009662, 'reg_lambda': 0.4764289204297378, 'max_delta_step': 5.097429516330405, 'booster': 'gbtree'}. Best is trial 143 with value: 4.030917946486313.[0m
[32m[I 2026-08-06 20:35:31,038][0m Trial 149 pruned. [0m
[32m[I 2026-08-06 20:35:35,374][0m Trial 150 pruned. [0m
[32m[I 2026-08-06 20:35:38,883][0m Trial 151 pruned. [0m
[32m[I 2026-08-06 20:35:44,665][0m Trial 152 finished with value: 4.070866890963076 and parameters: {'n_estimators': 1580, 'max_depth': 6, 'learning_rate': 0.03182704861498524, 'subsample': 0.8406651486441337, 'colsample_bytree': 0.9993232205097531, 'colsample_bylevel': 0.45048495993050436, 'colsample_bynode': 0.3790522328572612, 'min_child_weight': 4.616450280412581, 'gamma': 0.03895340735826178, 'reg_alpha': 4.0413552395381735e-08, 'reg_lambda': 0.02297192350145668, 'max_delta_step': 7.91696232680272, 'booster': 'dart'}. Best is trial 143 with value: 4.030917946486313.[0m
[32m[I 2026-08-06 20:35:49,342][0m Trial 153 pruned. [0m
[32m[I 2026-08-06 20:35:50,511][0m Trial 154 pruned. [0m
[32m[I 2026-08-06 20:35:57,094][0m Trial 155 pruned. [0m
[32m[I 2026-08-06 20:36:09,330][0m Trial 156 finished with value: 4.088541766105802 and parameters: {'n_estimators': 1638, 'max_depth': 9, 'learning_rate': 0.011525058122850792, 'subsample': 0.9607514438374325, 'colsample_bytree': 0.8482666199807947, 'colsample_bylevel': 0.4659651458931518, 'colsample_bynode': 0.3659323318151402, 'min_child_weight': 2.4107250959733695, 'gamma': 0.13303860618714222, 'reg_alpha': 0.0009697340617320861, 'reg_lambda': 0.4606801992158105, 'max_delta_step': 6.639189292898745, 'booster': 'dart'}. Best is trial 143 with value: 4.030917946486313.[0m
[32m[I 2026-08-06 20:36:13,380][0m Trial 157 pruned. [0m
[32m[I 2026-08-06 20:36:15,363][0m Trial 158 pruned. [0m
[32m[I 2026-08-06 20:36:17,660][0m Trial 159 pruned. [0m
[32m[I 2026-08-06 20:36:20,541][0m Trial 160 pruned. [0m
[32m[I 2026-08-06 20:36:22,067][0m Trial 161 pruned. [0m
[32m[I 2026-08-06 20:36:28,761][0m Trial 162 pruned. [0m
[32m[I 2026-08-06 20:36:34,729][0m Trial 163 pruned. [0m
[32m[I 2026-08-06 20:36:36,691][0m Trial 164 pruned. [0m
[32m[I 2026-08-06 20:36:40,749][0m Trial 165 pruned. [0m
[32m[I 2026-08-06 20:36:47,271][0m Trial 166 pruned. [0m
[32m[I 2026-08-06 20:36:51,777][0m Trial 167 pruned. [0m
[32m[I 2026-08-06 20:36:54,531][0m Trial 168 pruned. [0m
[32m[I 2026-08-06 20:36:57,366][0m Trial 169 pruned. [0m
[32m[I 2026-08-06 20:37:02,888][0m Trial 170 pruned. [0m
[32m[I 2026-08-06 20:37:06,116][0m Trial 171 pruned. [0m
[32m[I 2026-08-06 20:37:08,201][0m Trial 172 pruned. [0m
[32m[I 2026-08-06 20:37:10,254][0m Trial 173 pruned. [0m
[32m[I 2026-08-06 20:37:11,398][0m Trial 174 pruned. [0m
[32m[I 2026-08-06 20:37:21,643][0m Trial 175 pruned. [0m
[32m[I 2026-08-06 20:37:25,941][0m Trial 176 pruned. [0m
[32m[I 2026-08-06 20:37:28,426][0m Trial 177 pruned. [0m
[32m[I 2026-08-06 20:37:31,856][0m Trial 178 pruned. [0m
[32m[I 2026-08-06 20:37:38,035][0m Trial 179 finished with value: 4.059991070810384 and parameters: {'n_estimators': 2692, 'max_depth': 7, 'learning_rate': 0.027273997187636026, 'subsample': 0.9908887130265027, 'colsample_bytree': 0.9670152865179378, 'colsample_bylevel': 0.466954750877488, 'colsample_bynode': 0.31594006027418065, 'min_child_weight': 6.577467991916321, 'gamma': 0.44448874112735104, 'reg_alpha': 0.12145861553687706, 'reg_lambda': 2.2786539844256994, 'max_delta_step': 6.027761366215169, 'booster': 'gbtree'}. Best is trial 143 with value: 4.030917946486313.[0m
[32m[I 2026-08-06 20:37:52,492][0m Trial 180 finished with value: 4.06980301221986 and parameters: {'n_estimators': 2368, 'max_depth': 6, 'learning_rate': 0.010553759554586602, 'subsample': 0.9812906553343058, 'colsample_bytree': 0.9004384170154031, 'colsample_bylevel': 0.36965582940947467, 'colsample_bynode': 0.4551038406934001, 'min_child_weight': 3.803943555415316, 'gamma': 0.29549303758563106, 'reg_alpha': 0.0004406225788360468, 'reg_lambda': 0.6125107869897649, 'max_delta_step': 7.555925475585453, 'booster': 'dart'}. Best is trial 143 with value: 4.030917946486313.[0m
[32m[I 2026-08-06 20:37:58,504][0m Trial 181 pruned. [0m
[32m[I 2026-08-06 20:38:03,014][0m Trial 182 pruned. [0m
[32m[I 2026-08-06 20:38:05,467][0m Trial 183 pruned. [0m
[32m[I 2026-08-06 20:38:08,358][0m Trial 184 pruned. [0m
[32m[I 2026-08-06 20:38:10,603][0m Trial 185 pruned. [0m
[32m[I 2026-08-06 20:38:15,006][0m Trial 186 pruned. [0m
[32m[I 2026-08-06 20:38:20,032][0m Trial 187 pruned. [0m
[32m[I 2026-08-06 20:38:21,901][0m Trial 188 pruned. [0m
[32m[I 2026-08-06 20:38:23,661][0m Trial 189 pruned. [0m
[32m[I 2026-08-06 20:38:25,038][0m Trial 190 pruned. [0m
[32m[I 2026-08-06 20:38:31,934][0m Trial 191 pruned. [0m
[32m[I 2026-08-06 20:38:40,618][0m Trial 192 pruned. [0m
[32m[I 2026-08-06 20:38:45,981][0m Trial 193 pruned. [0m
[32m[I 2026-08-06 20:38:51,112][0m Trial 194 pruned. [0m
[32m[I 2026-08-06 20:39:10,737][0m Trial 195 finished with value: 4.061756930657146 and parameters: {'n_estimators': 2834, 'max_depth': 8, 'learning_rate': 0.01069497105077618, 'subsample': 0.9275325465162961, 'colsample_bytree': 0.911011647463758, 'colsample_bylevel': 0.3605895974492978, 'colsample_bynode': 0.5432162708433281, 'min_child_weight': 5.015015468437342, 'gamma': 0.033056104097639954, 'reg_alpha': 6.104949721196494e-08, 'reg_lambda': 2.15633689925804, 'max_delta_step': 6.211404281882076, 'booster': 'dart'}. Best is trial 143 with value: 4.030917946486313.[0m
[32m[I 2026-08-06 20:39:17,426][0m Trial 196 pruned. [0m
[32m[I 2026-08-06 20:39:22,835][0m Trial 197 pruned. [0m
[32m[I 2026-08-06 20:39:29,615][0m Trial 198 pruned. [0m
