============================================================
lightgbm — 运行开始  20260806_123004
  输出目录:  runs\pC20\pC20_lightgbm_20260806_123004
============================================================
============================================================
LightGBM + PharmHGT-style Featurization for pC20 Prediction
============================================================
[Cache HIT] Loading features from data\features\surfpro\pC20
  Train features: (564, 522)
  Test features:  (70, 522)

Split: Train 493, Val 71, Test 70

============================================================
Optuna Hyperparameter Tuning (50 trials, 5-Fold CV)
============================================================
[32m[I 2026-08-06 12:30:06,158][0m Trial 0 finished with value: 2.6051200110036024 and parameters: {'boosting_type': 'dart', 'max_depth': 12, 'num_leaves': 159, 'learning_rate': 0.009470976192691145, 'n_estimators': 890, 'subsample': 0.5290418060840998, 'subsample_freq': 9, 'colsample_bytree': 0.7207805082202461, 'reg_alpha': 0.023585940584142682, 'reg_lambda': 1.5320059381854043e-08, 'min_child_samples': 98, 'min_child_weight': 0.021368329072358756, 'min_split_gain': 0.21233911067827616, 'cat_smooth': 9.091248360355031, 'cat_l2': 9.17022549267169, 'drop_rate': 0.09823025045826593, 'max_drop': 27, 'skip_drop': 0.13526405540621358}. Best is trial 0 with value: 2.6051200110036024.[0m
[32m[I 2026-08-06 12:30:11,477][0m Trial 1 finished with value: 1.1980994822284365 and parameters: {'boosting_type': 'dart', 'max_depth': 4, 'num_leaves': 85, 'learning_rate': 0.02240870575939826, 'n_estimators': 1640, 'subsample': 0.8925879806965068, 'subsample_freq': 2, 'colsample_bytree': 0.6599641068895281, 'reg_alpha': 0.0021465011216654484, 'reg_lambda': 2.6185068507773707e-08, 'min_child_samples': 63, 'min_child_weight': 4.809461967501571e-05, 'min_split_gain': 0.06505159298527952, 'cat_smooth': 47.44427686266666, 'cat_l2': 48.28160165372797, 'drop_rate': 0.24443523095377373, 'max_drop': 16, 'skip_drop': 0.03832491306185132}. Best is trial 1 with value: 1.1980994822284365.[0m
Training until validation scores don't improve for 30 rounds
Early stopping, best iteration is:
[910]	valid_0's rmse: 0.760953	valid_0's l2: 0.579049
Training until validation scores don't improve for 30 rounds
Early stopping, best iteration is:
[770]	valid_0's rmse: 0.772734	valid_0's l2: 0.597118
Training until validation scores don't improve for 30 rounds
Early stopping, best iteration is:
[1469]	valid_0's rmse: 0.684961	valid_0's l2: 0.469171
Training until validation scores don't improve for 30 rounds
Early stopping, best iteration is:
[1779]	valid_0's rmse: 0.598304	valid_0's l2: 0.357967
Training until validation scores don't improve for 30 rounds
Early stopping, best iteration is:
[1421]	valid_0's rmse: 0.710435	valid_0's l2: 0.504719
[32m[I 2026-08-06 12:30:13,668][0m Trial 2 finished with value: 0.7056965518464928 and parameters: {'boosting_type': 'gbdt', 'max_depth': 4, 'num_leaves': 134, 'learning_rate': 0.005755963034165359, 'n_estimators': 2774, 'subsample': 0.6293899908000085, 'subsample_freq': 7, 'colsample_bytree': 0.5181977532625877, 'reg_alpha': 0.0004793052550782129, 'reg_lambda': 0.0008325158565947976, 'min_child_samples': 22, 'min_child_weight': 0.07556810141274425, 'min_split_gain': 0.7751328233611146, 'cat_smooth': 46.97494707820945, 'cat_l2': 44.74136752138244}. Best is trial 2 with value: 0.7056965518464928.[0m
[32m[I 2026-08-06 12:30:16,620][0m Trial 3 finished with value: 2.516750924864726 and parameters: {'boosting_type': 'dart', 'max_depth': 4, 'num_leaves': 62, 'learning_rate': 0.006017151754328819, 'n_estimators': 1313, 'subsample': 0.6943386448447411, 'subsample_freq': 3, 'colsample_bytree': 0.8801162564063505, 'reg_alpha': 1.6247252885719427e-05, 'reg_lambda': 3.376063348877853e-06, 'min_child_samples': 57, 'min_child_weight': 3.661819220392426e-05, 'min_split_gain': 0.8021969807540397, 'cat_smooth': 3.727532183988541, 'cat_l2': 49.34434683002586, 'drop_rate': 0.23395098309603066, 'max_drop': 10, 'skip_drop': 0.011601413965844696}. Best is trial 2 with value: 0.7056965518464928.[0m
Training until validation scores don't improve for 30 rounds
Early stopping, best iteration is:
[855]	valid_0's rmse: 0.799677	valid_0's l2: 0.639483
Training until validation scores don't improve for 30 rounds
Early stopping, best iteration is:
[648]	valid_0's rmse: 0.794406	valid_0's l2: 0.631081
Training until validation scores don't improve for 30 rounds
Early stopping, best iteration is:
[1054]	valid_0's rmse: 0.744627	valid_0's l2: 0.55447
Training until validation scores don't improve for 30 rounds
Early stopping, best iteration is:
[540]	valid_0's rmse: 0.680443	valid_0's l2: 0.463003
Training until validation scores don't improve for 30 rounds
Early stopping, best iteration is:
[1188]	valid_0's rmse: 0.74796	valid_0's l2: 0.559445
[32m[I 2026-08-06 12:30:17,995][0m Trial 4 finished with value: 0.7534226020438759 and parameters: {'boosting_type': 'gbdt', 'max_depth': 12, 'num_leaves': 200, 'learning_rate': 0.006770684770701556, 'n_estimators': 1396, 'subsample': 0.5579345297625649, 'subsample_freq': 9, 'colsample_bytree': 0.7363086887792905, 'reg_alpha': 9.507847858536042e-06, 'reg_lambda': 3.732717755563729e-08, 'min_child_samples': 34, 'min_child_weight': 0.00019986340778528852, 'min_split_gain': 0.7296061783380641, 'cat_smooth': 31.877873567760656, 'cat_l2': 44.36063712881633}. Best is trial 2 with value: 0.7056965518464928.[0m
Training until validation scores don't improve for 30 rounds
Early stopping, best iteration is:
[79]	valid_0's rmse: 0.724971	valid_0's l2: 0.525583
Training until validation scores don't improve for 30 rounds
Early stopping, best iteration is:
[146]	valid_0's rmse: 0.65565	valid_0's l2: 0.429877
Training until validation scores don't improve for 30 rounds
Early stopping, best iteration is:
[136]	valid_0's rmse: 0.614064	valid_0's l2: 0.377075
Training until validation scores don't improve for 30 rounds
Early stopping, best iteration is:
[148]	valid_0's rmse: 0.588645	valid_0's l2: 0.346504
Training until validation scores don't improve for 30 rounds
Early stopping, best iteration is:
[114]	valid_0's rmse: 0.610986	valid_0's l2: 0.373304
[32m[I 2026-08-06 12:30:18,523][0m Trial 5 finished with value: 0.6388633438863784 and parameters: {'boosting_type': 'gbdt', 'max_depth': 12, 'num_leaves': 198, 'learning_rate': 0.04977436807314311, 'n_estimators': 2428, 'subsample': 0.7468977981821954, 'subsample_freq': 6, 'colsample_bytree': 0.5992787128509847, 'reg_alpha': 1.6934490731313353e-08, 'reg_lambda': 9.354548757337708e-08, 'min_child_samples': 8, 'min_child_weight': 0.003512704726270845, 'min_split_gain': 0.3143559810763267, 'cat_smooth': 25.42853455823514, 'cat_l2': 45.37832369630465}. Best is trial 5 with value: 0.6388633438863784.[0m
[32m[I 2026-08-06 12:30:19,395][0m Trial 6 pruned. [0m
[32m[I 2026-08-06 12:30:21,051][0m Trial 7 pruned. [0m
Training until validation scores don't improve for 30 rounds
Early stopping, best iteration is:
[210]	valid_0's rmse: 0.933199	valid_0's l2: 0.87086
Training until validation scores don't improve for 30 rounds
Early stopping, best iteration is:
[102]	valid_0's rmse: 0.916726	valid_0's l2: 0.840386
Training until validation scores don't improve for 30 rounds
Early stopping, best iteration is:
[400]	valid_0's rmse: 0.903838	valid_0's l2: 0.816924
Training until validation scores don't improve for 30 rounds
Early stopping, best iteration is:
[228]	valid_0's rmse: 0.750087	valid_0's l2: 0.562631
Training until validation scores don't improve for 30 rounds
Early stopping, best iteration is:
[419]	valid_0's rmse: 0.903408	valid_0's l2: 0.816145
[32m[I 2026-08-06 12:30:21,422][0m Trial 8 finished with value: 0.8814515029015061 and parameters: {'boosting_type': 'gbdt', 'max_depth': 3, 'num_leaves': 161, 'learning_rate': 0.03915699341344363, 'n_estimators': 628, 'subsample': 0.6393232321183058, 'subsample_freq': 10, 'colsample_bytree': 0.46769332346688064, 'reg_alpha': 2.0139739500176936e-07, 'reg_lambda': 0.0002541410632209718, 'min_child_samples': 99, 'min_child_weight': 9.294394155644992e-05, 'min_split_gain': 0.6721355474058786, 'cat_smooth': 38.08098076643588, 'cat_l2': 11.881877199619984}. Best is trial 5 with value: 0.6388633438863784.[0m
Training until validation scores don't improve for 30 rounds
Early stopping, best iteration is:
[330]	valid_0's rmse: 0.789423	valid_0's l2: 0.623188
Training until validation scores don't improve for 30 rounds
Early stopping, best iteration is:
[377]	valid_0's rmse: 0.77531	valid_0's l2: 0.601106
Training until validation scores don't improve for 30 rounds
Early stopping, best iteration is:
[281]	valid_0's rmse: 0.754309	valid_0's l2: 0.568983
Training until validation scores don't improve for 30 rounds
Early stopping, best iteration is:
[296]	valid_0's rmse: 0.653981	valid_0's l2: 0.427691
Training until validation scores don't improve for 30 rounds
Early stopping, best iteration is:
[366]	valid_0's rmse: 0.722637	valid_0's l2: 0.522204
[32m[I 2026-08-06 12:30:21,963][0m Trial 9 finished with value: 0.739142587782103 and parameters: {'boosting_type': 'gbdt', 'max_depth': 11, 'num_leaves': 167, 'learning_rate': 0.044839259184207204, 'n_estimators': 725, 'subsample': 0.917651247794619, 'subsample_freq': 4, 'colsample_bytree': 0.4305629572798979, 'reg_alpha': 2.3279640748356466e-08, 'reg_lambda': 0.0020798714270728416, 'min_child_samples': 70, 'min_child_weight': 1.1650681118986128e-05, 'min_split_gain': 0.512093058299281, 'cat_smooth': 11.324788759896897, 'cat_l2': 32.25863952047249}. Best is trial 5 with value: 0.6388633438863784.[0m
Training until validation scores don't improve for 30 rounds
Early stopping, best iteration is:
[28]	valid_0's rmse: 0.764841	valid_0's l2: 0.584981
Training until validation scores don't improve for 30 rounds
Early stopping, best iteration is:
[31]	valid_0's rmse: 0.767222	valid_0's l2: 0.588629
Training until validation scores don't improve for 30 rounds
Early stopping, best iteration is:
[36]	valid_0's rmse: 0.717541	valid_0's l2: 0.514865
Training until validation scores don't improve for 30 rounds
Early stopping, best iteration is:
[19]	valid_0's rmse: 0.633457	valid_0's l2: 0.401268
Training until validation scores don't improve for 30 rounds
Early stopping, best iteration is:
[32]	valid_0's rmse: 0.72071	valid_0's l2: 0.519422
[32m[I 2026-08-06 12:30:22,196][0m Trial 10 finished with value: 0.7218797260920574 and parameters: {'boosting_type': 'gbdt', 'max_depth': 8, 'num_leaves': 16, 'learning_rate': 0.227364806419381, 'n_estimators': 2938, 'subsample': 0.8139601740123973, 'subsample_freq': 6, 'colsample_bytree': 0.31464890149101077, 'reg_alpha': 3.331630946893803, 'reg_lambda': 0.04422317327084487, 'min_child_samples': 7, 'min_child_weight': 0.002949971987301989, 'min_split_gain': 0.34052523698531706, 'cat_smooth': 21.71781358782057, 'cat_l2': 23.63570033289743}. Best is trial 5 with value: 0.6388633438863784.[0m
Training until validation scores don't improve for 30 rounds
Early stopping, best iteration is:
[8]	valid_0's rmse: 0.787727	valid_0's l2: 0.620513
Training until validation scores don't improve for 30 rounds
Early stopping, best iteration is:
[23]	valid_0's rmse: 0.74982	valid_0's l2: 0.56223
Training until validation scores don't improve for 30 rounds
Early stopping, best iteration is:
[16]	valid_0's rmse: 0.709886	valid_0's l2: 0.503939
Training until validation scores don't improve for 30 rounds
Early stopping, best iteration is:
[18]	valid_0's rmse: 0.643323	valid_0's l2: 0.413864
Training until validation scores don't improve for 30 rounds
Early stopping, best iteration is:
[23]	valid_0's rmse: 0.744434	valid_0's l2: 0.554182
[32m[I 2026-08-06 12:30:22,471][0m Trial 11 finished with value: 0.7270379478525457 and parameters: {'boosting_type': 'gbdt', 'max_depth': 15, 'num_leaves': 255, 'learning_rate': 0.18630559631838284, 'n_estimators': 2732, 'subsample': 0.7745246291075554, 'subsample_freq': 6, 'colsample_bytree': 0.572142222452941, 'reg_alpha': 0.7020808204379202, 'reg_lambda': 1.344933695762981e-05, 'min_child_samples': 8, 'min_child_weight': 0.09464585795213397, 'min_split_gain': 0.9960165317474352, 'cat_smooth': 49.099456007709705, 'cat_l2': 35.02533859293253}. Best is trial 5 with value: 0.6388633438863784.[0m
Training until validation scores don't improve for 30 rounds
Early stopping, best iteration is:
[41]	valid_0's rmse: 0.744652	valid_0's l2: 0.554507
Training until validation scores don't improve for 30 rounds
Early stopping, best iteration is:
[50]	valid_0's rmse: 0.733134	valid_0's l2: 0.537486
Training until validation scores don't improve for 30 rounds
Early stopping, best iteration is:
[58]	valid_0's rmse: 0.686701	valid_0's l2: 0.471558
Training until validation scores don't improve for 30 rounds
Early stopping, best iteration is:
[40]	valid_0's rmse: 0.610388	valid_0's l2: 0.372574
Training until validation scores don't improve for 30 rounds
Early stopping, best iteration is:
[56]	valid_0's rmse: 0.672016	valid_0's l2: 0.451606
[32m[I 2026-08-06 12:30:22,746][0m Trial 12 finished with value: 0.6893855252860783 and parameters: {'boosting_type': 'gbdt', 'max_depth': 7, 'num_leaves': 123, 'learning_rate': 0.09691896534971756, 'n_estimators': 2357, 'subsample': 0.992763962381443, 'subsample_freq': 6, 'colsample_bytree': 0.5875673080585329, 'reg_alpha': 0.00014422243561457965, 'reg_lambda': 1.842274116420653e-06, 'min_child_samples': 26, 'min_child_weight': 0.00718220732407314, 'min_split_gain': 0.48531019619746185, 'cat_smooth': 39.49828442656664, 'cat_l2': 35.55778837110738}. Best is trial 5 with value: 0.6388633438863784.[0m
Training until validation scores don't improve for 30 rounds
Early stopping, best iteration is:
[45]	valid_0's rmse: 0.761645	valid_0's l2: 0.580103
Training until validation scores don't improve for 30 rounds
Early stopping, best iteration is:
[60]	valid_0's rmse: 0.752894	valid_0's l2: 0.566849
Training until validation scores don't improve for 30 rounds
Early stopping, best iteration is:
[57]	valid_0's rmse: 0.660412	valid_0's l2: 0.436143
Training until validation scores don't improve for 30 rounds
Early stopping, best iteration is:
[54]	valid_0's rmse: 0.619107	valid_0's l2: 0.383294
Training until validation scores don't improve for 30 rounds
Early stopping, best iteration is:
[62]	valid_0's rmse: 0.705278	valid_0's l2: 0.497417
[32m[I 2026-08-06 12:30:23,004][0m Trial 13 finished with value: 0.6999525314410675 and parameters: {'boosting_type': 'gbdt', 'max_depth': 8, 'num_leaves': 123, 'learning_rate': 0.09163130297670326, 'n_estimators': 2194, 'subsample': 0.9913430783889022, 'subsample_freq': 5, 'colsample_bytree': 0.6744218832163392, 'reg_alpha': 2.1924173805689023e-07, 'reg_lambda': 1.0975723398726735e-06, 'min_child_samples': 25, 'min_child_weight': 0.006341796182561882, 'min_split_gain': 0.44770429113037885, 'cat_smooth': 38.18736974574263, 'cat_l2': 25.801431934226038}. Best is trial 5 with value: 0.6388633438863784.[0m
Training until validation scores don't improve for 30 rounds
Early stopping, best iteration is:
[83]	valid_0's rmse: 0.721165	valid_0's l2: 0.520078
Training until validation scores don't improve for 30 rounds
Early stopping, best iteration is:
[113]	valid_0's rmse: 0.74358	valid_0's l2: 0.552912
Training until validation scores don't improve for 30 rounds
Early stopping, best iteration is:
[128]	valid_0's rmse: 0.707104	valid_0's l2: 0.499996
Training until validation scores don't improve for 30 rounds
Early stopping, best iteration is:
[109]	valid_0's rmse: 0.613964	valid_0's l2: 0.376952
Training until validation scores don't improve for 30 rounds
Early stopping, best iteration is:
[102]	valid_0's rmse: 0.703479	valid_0's l2: 0.494883
[32m[I 2026-08-06 12:30:23,341][0m Trial 14 finished with value: 0.697858405003213 and parameters: {'boosting_type': 'gbdt', 'max_depth': 8, 'num_leaves': 205, 'learning_rate': 0.10427814598538046, 'n_estimators': 2422, 'subsample': 0.9780139110378141, 'subsample_freq': 7, 'colsample_bytree': 0.5769021621700844, 'reg_alpha': 8.411985243210251e-05, 'reg_lambda': 2.995710376987626e-07, 'min_child_samples': 46, 'min_child_weight': 0.0005770328661424418, 'min_split_gain': 0.2843044578702848, 'cat_smooth': 33.733631918001606, 'cat_l2': 36.262120026213864}. Best is trial 5 with value: 0.6388633438863784.[0m
Training until validation scores don't improve for 30 rounds
Early stopping, best iteration is:
[184]	valid_0's rmse: 0.740348	valid_0's l2: 0.548115
Training until validation scores don't improve for 30 rounds
Early stopping, best iteration is:
[113]	valid_0's rmse: 0.719557	valid_0's l2: 0.517763
Training until validation scores don't improve for 30 rounds
Early stopping, best iteration is:
[111]	valid_0's rmse: 0.649477	valid_0's l2: 0.421821
Training until validation scores don't improve for 30 rounds
Early stopping, best iteration is:
[270]	valid_0's rmse: 0.580047	valid_0's l2: 0.336455
Training until validation scores don't improve for 30 rounds
Early stopping, best iteration is:
[283]	valid_0's rmse: 0.630682	valid_0's l2: 0.397759
[32m[I 2026-08-06 12:30:23,825][0m Trial 15 finished with value: 0.6648695033458606 and parameters: {'boosting_type': 'gbdt', 'max_depth': 6, 'num_leaves': 105, 'learning_rate': 0.07242653284133035, 'n_estimators': 2208, 'subsample': 0.8408424037609818, 'subsample_freq': 1, 'colsample_bytree': 0.6003195309450419, 'reg_alpha': 1.494409441838637e-08, 'reg_lambda': 3.984531156188375e-05, 'min_child_samples': 14, 'min_child_weight': 0.009182380300848954, 'min_split_gain': 0.5388826341561919, 'cat_smooth': 22.683026787514358, 'cat_l2': 28.812815244280362}. Best is trial 5 with value: 0.6388633438863784.[0m
Training until validation scores don't improve for 30 rounds
Early stopping, best iteration is:
[306]	valid_0's rmse: 0.695795	valid_0's l2: 0.48413
Training until validation scores don't improve for 30 rounds
Early stopping, best iteration is:
[272]	valid_0's rmse: 0.662096	valid_0's l2: 0.438372
Training until validation scores don't improve for 30 rounds
Early stopping, best iteration is:
[299]	valid_0's rmse: 0.57008	valid_0's l2: 0.324991
Training until validation scores don't improve for 30 rounds
Early stopping, best iteration is:
[250]	valid_0's rmse: 0.529727	valid_0's l2: 0.28061
Training until validation scores don't improve for 30 rounds
Early stopping, best iteration is:
[286]	valid_0's rmse: 0.588092	valid_0's l2: 0.345852
[32m[I 2026-08-06 12:30:24,645][0m Trial 16 finished with value: 0.6091579214053642 and parameters: {'boosting_type': 'gbdt', 'max_depth': 6, 'num_leaves': 31, 'learning_rate': 0.03839452164203378, 'n_estimators': 1972, 'subsample': 0.8199212859905153, 'subsample_freq': 1, 'colsample_bytree': 0.9869191607308052, 'reg_alpha': 1.2785619069152404e-08, 'reg_lambda': 5.9518082534861874e-05, 'min_child_samples': 13, 'min_child_weight': 0.01852224764070393, 'min_split_gain': 0.05372119777160883, 'cat_smooth': 21.49872794581777, 'cat_l2': 19.215416614464505}. Best is trial 16 with value: 0.6091579214053642.[0m
Training until validation scores don't improve for 30 rounds
Early stopping, best iteration is:
[326]	valid_0's rmse: 0.708746	valid_0's l2: 0.502321
Training until validation scores don't improve for 30 rounds
Early stopping, best iteration is:
[576]	valid_0's rmse: 0.657733	valid_0's l2: 0.432612
Training until validation scores don't improve for 30 rounds
Early stopping, best iteration is:
[612]	valid_0's rmse: 0.581984	valid_0's l2: 0.338705
Training until validation scores don't improve for 30 rounds
Early stopping, best iteration is:
[264]	valid_0's rmse: 0.57442	valid_0's l2: 0.329959
Training until validation scores don't improve for 30 rounds
Early stopping, best iteration is:
[499]	valid_0's rmse: 0.625649	valid_0's l2: 0.391437
[32m[I 2026-08-06 12:30:26,062][0m Trial 17 finished with value: 0.6297065016550163 and parameters: {'boosting_type': 'gbdt', 'max_depth': 10, 'num_leaves': 18, 'learning_rate': 0.018146228234108466, 'n_estimators': 1898, 'subsample': 0.7499972938777936, 'subsample_freq': 2, 'colsample_bytree': 0.9884082479170557, 'reg_alpha': 4.242344923899621e-07, 'reg_lambda': 0.013583886682192004, 'min_child_samples': 16, 'min_child_weight': 0.028222059774847787, 'min_split_gain': 0.02873721860276618, 'cat_smooth': 15.70887852919771, 'cat_l2': 2.099700564838649}. Best is trial 16 with value: 0.6091579214053642.[0m
Training until validation scores don't improve for 30 rounds
Early stopping, best iteration is:
[1173]	valid_0's rmse: 0.715331	valid_0's l2: 0.511698
Training until validation scores don't improve for 30 rounds
Early stopping, best iteration is:
[1059]	valid_0's rmse: 0.694994	valid_0's l2: 0.483016
Training until validation scores don't improve for 30 rounds
Early stopping, best iteration is:
[1885]	valid_0's rmse: 0.615238	valid_0's l2: 0.378518
Training until validation scores don't improve for 30 rounds
Early stopping, best iteration is:
[1212]	valid_0's rmse: 0.570487	valid_0's l2: 0.325455
Training until validation scores don't improve for 30 rounds
Early stopping, best iteration is:
[1114]	valid_0's rmse: 0.643895	valid_0's l2: 0.414601
