[32m[I 2026-08-06 12:30:28,129][0m Trial 18 finished with value: 0.6479888245224745 and parameters: {'boosting_type': 'gbdt', 'max_depth': 10, 'num_leaves': 25, 'learning_rate': 0.01602521699206088, 'n_estimators': 1918, 'subsample': 0.8532705233244291, 'subsample_freq': 1, 'colsample_bytree': 0.9995894458613797, 'reg_alpha': 6.131702907420662e-07, 'reg_lambda': 0.020051398783874658, 'min_child_samples': 44, 'min_child_weight': 0.029607295709814088, 'min_split_gain': 0.013533446219975265, 'cat_smooth': 15.193951827302929, 'cat_l2': 2.2102917393250863}. Best is trial 16 with value: 0.6091579214053642.[0m
Training until validation scores don't improve for 30 rounds
Early stopping, best iteration is:
[252]	valid_0's rmse: 0.723485	valid_0's l2: 0.523431
Training until validation scores don't improve for 30 rounds
Early stopping, best iteration is:
[548]	valid_0's rmse: 0.70274	valid_0's l2: 0.493844
Training until validation scores don't improve for 30 rounds
Early stopping, best iteration is:
[402]	valid_0's rmse: 0.598287	valid_0's l2: 0.357947
Training until validation scores don't improve for 30 rounds
Early stopping, best iteration is:
[430]	valid_0's rmse: 0.547928	valid_0's l2: 0.300225
Training until validation scores don't improve for 30 rounds
Early stopping, best iteration is:
[480]	valid_0's rmse: 0.625596	valid_0's l2: 0.39137
[32m[I 2026-08-06 12:30:29,101][0m Trial 19 finished with value: 0.6396071483737612 and parameters: {'boosting_type': 'gbdt', 'max_depth': 6, 'num_leaves': 44, 'learning_rate': 0.021066700551865273, 'n_estimators': 1984, 'subsample': 0.781890456955353, 'subsample_freq': 2, 'colsample_bytree': 0.9901738481452774, 'reg_alpha': 1.3242499264338727e-06, 'reg_lambda': 0.018265488998581228, 'min_child_samples': 18, 'min_child_weight': 0.022125593555577982, 'min_split_gain': 0.12433125206200203, 'cat_smooth': 6.6614107447837725, 'cat_l2': 19.2244458826595}. Best is trial 16 with value: 0.6091579214053642.[0m
Training until validation scores don't improve for 30 rounds
Early stopping, best iteration is:
[832]	valid_0's rmse: 0.753514	valid_0's l2: 0.567783
Training until validation scores don't improve for 30 rounds
Early stopping, best iteration is:
[748]	valid_0's rmse: 0.725596	valid_0's l2: 0.52649
Training until validation scores don't improve for 30 rounds
Early stopping, best iteration is:
[1288]	valid_0's rmse: 0.649445	valid_0's l2: 0.421779
Training until validation scores don't improve for 30 rounds
Early stopping, best iteration is:
[732]	valid_0's rmse: 0.599357	valid_0's l2: 0.359229
Training until validation scores don't improve for 30 rounds
Early stopping, best iteration is:
[1428]	valid_0's rmse: 0.656258	valid_0's l2: 0.430675
[32m[I 2026-08-06 12:30:30,755][0m Trial 20 finished with value: 0.6768341224423988 and parameters: {'boosting_type': 'gbdt', 'max_depth': 10, 'num_leaves': 47, 'learning_rate': 0.012628706167462396, 'n_estimators': 1581, 'subsample': 0.7115508103429197, 'subsample_freq': 2, 'colsample_bytree': 0.8995211376924175, 'reg_alpha': 2.18278793533481e-06, 'reg_lambda': 0.18465506664174386, 'min_child_samples': 37, 'min_child_weight': 0.031622230925317296, 'min_split_gain': 0.1540187374684618, 'cat_smooth': 0.5075678090460816, 'cat_l2': 0.15677796885341877}. Best is trial 16 with value: 0.6091579214053642.[0m
Training until validation scores don't improve for 30 rounds
Early stopping, best iteration is:
[196]	valid_0's rmse: 0.69034	valid_0's l2: 0.476569
Training until validation scores don't improve for 30 rounds
Early stopping, best iteration is:
[240]	valid_0's rmse: 0.62735	valid_0's l2: 0.393568
Training until validation scores don't improve for 30 rounds
Early stopping, best iteration is:
[223]	valid_0's rmse: 0.549193	valid_0's l2: 0.301613
Training until validation scores don't improve for 30 rounds
Early stopping, best iteration is:
[241]	valid_0's rmse: 0.534878	valid_0's l2: 0.286094
Training until validation scores don't improve for 30 rounds
Early stopping, best iteration is:
[368]	valid_0's rmse: 0.540335	valid_0's l2: 0.291962
[32m[I 2026-08-06 12:30:32,475][0m Trial 21 finished with value: 0.5884190101188496 and parameters: {'boosting_type': 'gbdt', 'max_depth': 14, 'num_leaves': 32, 'learning_rate': 0.034477728298288574, 'n_estimators': 2540, 'subsample': 0.7615436458378084, 'subsample_freq': 4, 'colsample_bytree': 0.8097292775904446, 'reg_alpha': 2.993678707378971e-08, 'reg_lambda': 0.00011150930173509487, 'min_child_samples': 5, 'min_child_weight': 0.002522702042481614, 'min_split_gain': 0.005079886983433701, 'cat_smooth': 27.491634812548984, 'cat_l2': 15.39654923716308}. Best is trial 21 with value: 0.5884190101188496.[0m
Training until validation scores don't improve for 30 rounds
Early stopping, best iteration is:
[286]	valid_0's rmse: 0.699308	valid_0's l2: 0.489032
Training until validation scores don't improve for 30 rounds
Early stopping, best iteration is:
[354]	valid_0's rmse: 0.650483	valid_0's l2: 0.423128
Training until validation scores don't improve for 30 rounds
Early stopping, best iteration is:
[279]	valid_0's rmse: 0.580171	valid_0's l2: 0.336599
Training until validation scores don't improve for 30 rounds
Early stopping, best iteration is:
[288]	valid_0's rmse: 0.546527	valid_0's l2: 0.298692
Training until validation scores don't improve for 30 rounds
Early stopping, best iteration is:
[537]	valid_0's rmse: 0.603174	valid_0's l2: 0.363819
[32m[I 2026-08-06 12:30:33,852][0m Trial 22 finished with value: 0.6159327043568921 and parameters: {'boosting_type': 'gbdt', 'max_depth': 15, 'num_leaves': 35, 'learning_rate': 0.02836355613478298, 'n_estimators': 1997, 'subsample': 0.7567038412240287, 'subsample_freq': 3, 'colsample_bytree': 0.8090209462713847, 'reg_alpha': 9.09327637416114e-08, 'reg_lambda': 9.741024294111088e-05, 'min_child_samples': 15, 'min_child_weight': 0.0015444411631498713, 'min_split_gain': 0.011902793659050663, 'cat_smooth': 16.718806797727243, 'cat_l2': 15.769575079297137}. Best is trial 21 with value: 0.5884190101188496.[0m
Training until validation scores don't improve for 30 rounds
Early stopping, best iteration is:
[88]	valid_0's rmse: 0.724987	valid_0's l2: 0.525607
Training until validation scores don't improve for 30 rounds
Early stopping, best iteration is:
[168]	valid_0's rmse: 0.673457	valid_0's l2: 0.453545
Training until validation scores don't improve for 30 rounds
Early stopping, best iteration is:
[173]	valid_0's rmse: 0.567847	valid_0's l2: 0.32245
Training until validation scores don't improve for 30 rounds
Early stopping, best iteration is:
[125]	valid_0's rmse: 0.560538	valid_0's l2: 0.314203
Training until validation scores don't improve for 30 rounds
Early stopping, best iteration is:
[172]	valid_0's rmse: 0.588016	valid_0's l2: 0.345763
[32m[I 2026-08-06 12:30:34,901][0m Trial 23 finished with value: 0.6229691936139511 and parameters: {'boosting_type': 'gbdt', 'max_depth': 15, 'num_leaves': 43, 'learning_rate': 0.032550889637144795, 'n_estimators': 2667, 'subsample': 0.8113460878094351, 'subsample_freq': 4, 'colsample_bytree': 0.8099037489305375, 'reg_alpha': 7.144573918629425e-08, 'reg_lambda': 7.800118494221213e-05, 'min_child_samples': 5, 'min_child_weight': 0.0008645609610928952, 'min_split_gain': 0.12165525818256603, 'cat_smooth': 29.39167313999486, 'cat_l2': 17.12150933402637}. Best is trial 21 with value: 0.5884190101188496.[0m
Training until validation scores don't improve for 30 rounds
Early stopping, best iteration is:
[215]	valid_0's rmse: 0.747048	valid_0's l2: 0.558081
Training until validation scores don't improve for 30 rounds
Early stopping, best iteration is:
[272]	valid_0's rmse: 0.695307	valid_0's l2: 0.483452
Training until validation scores don't improve for 30 rounds
Early stopping, best iteration is:
[296]	valid_0's rmse: 0.609734	valid_0's l2: 0.371775
Training until validation scores don't improve for 30 rounds
Early stopping, best iteration is:
[301]	valid_0's rmse: 0.575222	valid_0's l2: 0.330881
Training until validation scores don't improve for 30 rounds
Early stopping, best iteration is:
[296]	valid_0's rmse: 0.640911	valid_0's l2: 0.410766
[32m[I 2026-08-06 12:30:35,630][0m Trial 24 finished with value: 0.6536506116937709 and parameters: {'boosting_type': 'gbdt', 'max_depth': 14, 'num_leaves': 84, 'learning_rate': 0.028419009859338488, 'n_estimators': 2097, 'subsample': 0.889951608630117, 'subsample_freq': 4, 'colsample_bytree': 0.8020018623238344, 'reg_alpha': 7.51387313052955e-08, 'reg_lambda': 0.001622283508670351, 'min_child_samples': 27, 'min_child_weight': 0.0018886689115801024, 'min_split_gain': 0.2274775817973972, 'cat_smooth': 19.418096439068975, 'cat_l2': 12.766272380007983}. Best is trial 21 with value: 0.5884190101188496.[0m
Training until validation scores don't improve for 30 rounds
Early stopping, best iteration is:
[213]	valid_0's rmse: 0.714877	valid_0's l2: 0.511049
Training until validation scores don't improve for 30 rounds
Early stopping, best iteration is:
[141]	valid_0's rmse: 0.666131	valid_0's l2: 0.443731
Training until validation scores don't improve for 30 rounds
Early stopping, best iteration is:
[134]	valid_0's rmse: 0.599999	valid_0's l2: 0.359999
Training until validation scores don't improve for 30 rounds
Early stopping, best iteration is:
[178]	valid_0's rmse: 0.573639	valid_0's l2: 0.329062
Training until validation scores don't improve for 30 rounds
Early stopping, best iteration is:
[169]	valid_0's rmse: 0.604868	valid_0's l2: 0.365866
[32m[I 2026-08-06 12:30:36,271][0m Trial 25 finished with value: 0.6319030193045438 and parameters: {'boosting_type': 'gbdt', 'max_depth': 14, 'num_leaves': 40, 'learning_rate': 0.06403493015524242, 'n_estimators': 2420, 'subsample': 0.6678245216424936, 'subsample_freq': 3, 'colsample_bytree': 0.9153050961177474, 'reg_alpha': 1.2288731396723862e-08, 'reg_lambda': 1.226783704138613e-05, 'min_child_samples': 15, 'min_child_weight': 0.0005531834246987928, 'min_split_gain': 0.07769187996487575, 'cat_smooth': 12.606062590620889, 'cat_l2': 19.26453928015939}. Best is trial 21 with value: 0.5884190101188496.[0m
[32m[I 2026-08-06 12:30:43,238][0m Trial 26 pruned. [0m
Training until validation scores don't improve for 30 rounds
Early stopping, best iteration is:
[197]	valid_0's rmse: 0.69819	valid_0's l2: 0.487469
Training until validation scores don't improve for 30 rounds
Early stopping, best iteration is:
[138]	valid_0's rmse: 0.680879	valid_0's l2: 0.463596
Training until validation scores don't improve for 30 rounds
Early stopping, best iteration is:
[156]	valid_0's rmse: 0.580804	valid_0's l2: 0.337334
Training until validation scores don't improve for 30 rounds
Early stopping, best iteration is:
[144]	valid_0's rmse: 0.535306	valid_0's l2: 0.286552
Training until validation scores don't improve for 30 rounds
Early stopping, best iteration is:
[436]	valid_0's rmse: 0.571241	valid_0's l2: 0.326316
[32m[I 2026-08-06 12:30:44,463][0m Trial 27 finished with value: 0.613283990677421 and parameters: {'boosting_type': 'gbdt', 'max_depth': 15, 'num_leaves': 31, 'learning_rate': 0.0564248107737768, 'n_estimators': 1670, 'subsample': 0.8040641747745465, 'subsample_freq': 3, 'colsample_bytree': 0.9358678894087059, 'reg_alpha': 3.1274175495258155e-06, 'reg_lambda': 0.00042821734237346427, 'min_child_samples': 14, 'min_child_weight': 0.003411815027212153, 'min_split_gain': 0.0019274557083514277, 'cat_smooth': 19.372194427336304, 'cat_l2': 15.579521893494608}. Best is trial 21 with value: 0.5884190101188496.[0m
Training until validation scores don't improve for 30 rounds
Early stopping, best iteration is:
[30]	valid_0's rmse: 0.706536	valid_0's l2: 0.499193
Training until validation scores don't improve for 30 rounds
Early stopping, best iteration is:
[65]	valid_0's rmse: 0.651126	valid_0's l2: 0.423966
Training until validation scores don't improve for 30 rounds
Early stopping, best iteration is:
[73]	valid_0's rmse: 0.617459	valid_0's l2: 0.381255
Training until validation scores don't improve for 30 rounds
Early stopping, best iteration is:
[53]	valid_0's rmse: 0.602406	valid_0's l2: 0.362893
Training until validation scores don't improve for 30 rounds
Early stopping, best iteration is:
[68]	valid_0's rmse: 0.585525	valid_0's l2: 0.34284
[32m[I 2026-08-06 12:30:44,813][0m Trial 28 finished with value: 0.6326104795346882 and parameters: {'boosting_type': 'gbdt', 'max_depth': 9, 'num_leaves': 57, 'learning_rate': 0.1372198241618281, 'n_estimators': 1056, 'subsample': 0.9466039228376142, 'subsample_freq': 5, 'colsample_bytree': 0.9399015056608317, 'reg_alpha': 3.0560767139137008e-06, 'reg_lambda': 0.0007243956981275195, 'min_child_samples': 21, 'min_child_weight': 0.011472855766216384, 'min_split_gain': 0.10925384322155297, 'cat_smooth': 29.230310184049273, 'cat_l2': 24.440306432042714}. Best is trial 21 with value: 0.5884190101188496.[0m
[32m[I 2026-08-06 12:31:09,458][0m Trial 29 finished with value: 0.6519780545199072 and parameters: {'boosting_type': 'dart', 'max_depth': 13, 'num_leaves': 84, 'learning_rate': 0.052669813142454065, 'n_estimators': 1556, 'subsample': 0.8514570002039848, 'subsample_freq': 4, 'colsample_bytree': 0.7374597719139281, 'reg_alpha': 4.59078771949354e-06, 'reg_lambda': 0.004819011776450627, 'min_child_samples': 11, 'min_child_weight': 0.0036211244737706714, 'min_split_gain': 0.23864767354235827, 'cat_smooth': 20.766725025740037, 'cat_l2': 7.932654672616614, 'drop_rate': 0.14997381889235567, 'max_drop': 45, 'skip_drop': 0.26194067649906955}. Best is trial 21 with value: 0.5884190101188496.[0m
Training until validation scores don't improve for 30 rounds
Early stopping, best iteration is:
[467]	valid_0's rmse: 0.744407	valid_0's l2: 0.554142
Training until validation scores don't improve for 30 rounds
Early stopping, best iteration is:
[753]	valid_0's rmse: 0.698655	valid_0's l2: 0.488119
Training until validation scores don't improve for 30 rounds
Early stopping, best iteration is:
[849]	valid_0's rmse: 0.630788	valid_0's l2: 0.397893
Training until validation scores don't improve for 30 rounds
Early stopping, best iteration is:
[725]	valid_0's rmse: 0.577378	valid_0's l2: 0.333365
Training until validation scores don't improve for 30 rounds
Early stopping, best iteration is:
[932]	valid_0's rmse: 0.649295	valid_0's l2: 0.421584
[32m[I 2026-08-06 12:31:10,987][0m Trial 30 finished with value: 0.6602424497824086 and parameters: {'boosting_type': 'gbdt', 'max_depth': 13, 'num_leaves': 15, 'learning_rate': 0.011130403768170946, 'n_estimators': 1791, 'subsample': 0.7994382255256481, 'subsample_freq': 1, 'colsample_bytree': 0.9446164045880862, 'reg_alpha': 0.06582082034521083, 'reg_lambda': 1.1373820311433323e-05, 'min_child_samples': 21, 'min_child_weight': 0.014404525122007874, 'min_split_gain': 0.3863568505353269, 'cat_smooth': 33.97689930415903, 'cat_l2': 20.91189505082058}. Best is trial 21 with value: 0.5884190101188496.[0m
Training until validation scores don't improve for 30 rounds
Early stopping, best iteration is:
[130]	valid_0's rmse: 0.735325	valid_0's l2: 0.540703
Training until validation scores don't improve for 30 rounds
Early stopping, best iteration is:
[262]	valid_0's rmse: 0.658072	valid_0's l2: 0.433059
Training until validation scores don't improve for 30 rounds
Early stopping, best iteration is:
[215]	valid_0's rmse: 0.563917	valid_0's l2: 0.318002
Training until validation scores don't improve for 30 rounds
Early stopping, best iteration is:
[254]	valid_0's rmse: 0.522662	valid_0's l2: 0.273176
Training until validation scores don't improve for 30 rounds
Early stopping, best iteration is:
[285]	valid_0's rmse: 0.582695	valid_0's l2: 0.339534
[32m[I 2026-08-06 12:31:12,146][0m Trial 31 finished with value: 0.6125342417260936 and parameters: {'boosting_type': 'gbdt', 'max_depth': 15, 'num_leaves': 33, 'learning_rate': 0.03606660981146604, 'n_estimators': 2121, 'subsample': 0.8351731087786819, 'subsample_freq': 3, 'colsample_bytree': 0.8418522139472557, 'reg_alpha': 6.130986863775147e-08, 'reg_lambda': 0.00023229465866009779, 'min_child_samples': 14, 'min_child_weight': 0.0018251183732325, 'min_split_gain': 0.023341674872587165, 'cat_smooth': 16.471694653075943, 'cat_l2': 15.168215195673952}. Best is trial 21 with value: 0.5884190101188496.[0m
Training until validation scores don't improve for 30 rounds
Early stopping, best iteration is:
[125]	valid_0's rmse: 0.681451	valid_0's l2: 0.464376
Training until validation scores don't improve for 30 rounds
Early stopping, best iteration is:
[136]	valid_0's rmse: 0.642173	valid_0's l2: 0.412386
Training until validation scores don't improve for 30 rounds
Early stopping, best iteration is:
[174]	valid_0's rmse: 0.5636	valid_0's l2: 0.317645
Training until validation scores don't improve for 30 rounds
Early stopping, best iteration is:
[211]	valid_0's rmse: 0.570806	valid_0's l2: 0.325819
Training until validation scores don't improve for 30 rounds
Early stopping, best iteration is:
[199]	valid_0's rmse: 0.567505	valid_0's l2: 0.322062
[32m[I 2026-08-06 12:31:13,091][0m Trial 32 finished with value: 0.6051177887928014 and parameters: {'boosting_type': 'gbdt', 'max_depth': 15, 'num_leaves': 27, 'learning_rate': 0.036259060951226864, 'n_estimators': 2224, 'subsample': 0.8805995564135469, 'subsample_freq': 2, 'colsample_bytree': 0.8566598663015649, 'reg_alpha': 8.435348419501051e-07, 'reg_lambda': 0.0003163225271153144, 'min_child_samples': 5, 'min_child_weight': 0.004719499391411191, 'min_split_gain': 0.05963224799988236, 'cat_smooth': 9.086534871725886, 'cat_l2': 16.123762683360166}. Best is trial 21 with value: 0.5884190101188496.[0m
Training until validation scores don't improve for 30 rounds
Early stopping, best iteration is:
[106]	valid_0's rmse: 0.68173	valid_0's l2: 0.464756
Training until validation scores don't improve for 30 rounds
Early stopping, best iteration is:
[139]	valid_0's rmse: 0.62667	valid_0's l2: 0.392715
Training until validation scores don't improve for 30 rounds
Early stopping, best iteration is:
[178]	valid_0's rmse: 0.566509	valid_0's l2: 0.320932
Training until validation scores don't improve for 30 rounds
Early stopping, best iteration is:
[138]	valid_0's rmse: 0.571018	valid_0's l2: 0.326061
Training until validation scores don't improve for 30 rounds
Early stopping, best iteration is:
[149]	valid_0's rmse: 0.574798	valid_0's l2: 0.330392
[32m[I 2026-08-06 12:31:14,152][0m Trial 33 finished with value: 0.6041448979702194 and parameters: {'boosting_type': 'gbdt', 'max_depth': 14, 'num_leaves': 56, 'learning_rate': 0.037114544599702114, 'n_estimators': 2244, 'subsample': 0.8865855490957069, 'subsample_freq': 2, 'colsample_bytree': 0.8472673648135777, 'reg_alpha': 7.190208886247434e-07, 'reg_lambda': 3.213287484594757e-05, 'min_child_samples': 5, 'min_child_weight': 0.005598255328550654, 'min_split_gain': 0.0720831170136853, 'cat_smooth': 8.208426150089718, 'cat_l2': 12.56531220776849}. Best is trial 21 with value: 0.5884190101188496.[0m
[32m[I 2026-08-06 12:31:23,209][0m Trial 34 finished with value: 0.6171072015427006 and parameters: {'boosting_type': 'dart', 'max_depth': 14, 'num_leaves': 53, 'learning_rate': 0.023182605810449723, 'n_estimators': 2923, 'subsample': 0.872020563983612, 'subsample_freq': 2, 'colsample_bytree': 0.764290810941879, 'reg_alpha': 6.624896986487319e-07, 'reg_lambda': 6.277755830591353e-06, 'min_child_samples': 6, 'min_child_weight': 0.053011343990681664, 'min_split_gain': 0.08194780741202583, 'cat_smooth': 7.594536423101237, 'cat_l2': 11.07332958960273, 'drop_rate': 0.15525870591280835, 'max_drop': 1, 'skip_drop': 0.18792572659193343}. Best is trial 21 with value: 0.5884190101188496.[0m
Training until validation scores don't improve for 30 rounds
Early stopping, best iteration is:
[35]	valid_0's rmse: 0.695621	valid_0's l2: 0.483888
Training until validation scores don't improve for 30 rounds
Early stopping, best iteration is:
[81]	valid_0's rmse: 0.648532	valid_0's l2: 0.420594
Training until validation scores don't improve for 30 rounds
Early stopping, best iteration is:
[82]	valid_0's rmse: 0.561079	valid_0's l2: 0.31481
Training until validation scores don't improve for 30 rounds
Early stopping, best iteration is:
[60]	valid_0's rmse: 0.56911	valid_0's l2: 0.323886
Training until validation scores don't improve for 30 rounds
Early stopping, best iteration is:
[76]	valid_0's rmse: 0.617584	valid_0's l2: 0.38141
[32m[I 2026-08-06 12:31:23,720][0m Trial 35 finished with value: 0.6185361946156512 and parameters: {'boosting_type': 'gbdt', 'max_depth': 11, 'num_leaves': 74, 'learning_rate': 0.07426231359544129, 'n_estimators': 2582, 'subsample': 0.9211794730012697, 'subsample_freq': 2, 'colsample_bytree': 0.6812177418259648, 'reg_alpha': 3.1877264070838336e-05, 'reg_lambda': 2.4449938029963176e-05, 'min_child_samples': 5, 'min_child_weight': 0.005099510644252399, 'min_split_gain': 0.17742372656634592, 'cat_smooth': 3.896904672375295, 'cat_l2': 9.037949496230214}. Best is trial 21 with value: 0.5884190101188496.[0m
Training until validation scores don't improve for 30 rounds
Early stopping, best iteration is:
[184]	valid_0's rmse: 0.73588	valid_0's l2: 0.541519
Training until validation scores don't improve for 30 rounds
Early stopping, best iteration is:
[467]	valid_0's rmse: 0.655653	valid_0's l2: 0.429881
Training until validation scores don't improve for 30 rounds
Early stopping, best iteration is:
[299]	valid_0's rmse: 0.61634	valid_0's l2: 0.379875
Training until validation scores don't improve for 30 rounds
Early stopping, best iteration is:
[319]	valid_0's rmse: 0.551287	valid_0's l2: 0.303917
Training until validation scores don't improve for 30 rounds
Early stopping, best iteration is:
[267]	valid_0's rmse: 0.608413	valid_0's l2: 0.370167
