[32m[I 2026-08-06 12:31:24,638][0m Trial 36 finished with value: 0.6336900682769274 and parameters: {'boosting_type': 'gbdt', 'max_depth': 5, 'num_leaves': 98, 'learning_rate': 0.04395737881803316, 'n_estimators': 2287, 'subsample': 0.9081683931824318, 'subsample_freq': 1, 'colsample_bytree': 0.8488443286951194, 'reg_alpha': 1.9281543084896547e-07, 'reg_lambda': 5.8899415680095765e-05, 'min_child_samples': 21, 'min_child_weight': 0.01768250353764011, 'min_split_gain': 0.08215924874190747, 'cat_smooth': 11.702892228886748, 'cat_l2': 21.85500161306909}. Best is trial 21 with value: 0.5884190101188496.[0m
Training until validation scores don't improve for 30 rounds
Early stopping, best iteration is:
[211]	valid_0's rmse: 0.714841	valid_0's l2: 0.510997
Training until validation scores don't improve for 30 rounds
Early stopping, best iteration is:
[336]	valid_0's rmse: 0.672429	valid_0's l2: 0.452161
Training until validation scores don't improve for 30 rounds
Early stopping, best iteration is:
[339]	valid_0's rmse: 0.59679	valid_0's l2: 0.356158
Training until validation scores don't improve for 30 rounds
Early stopping, best iteration is:
[196]	valid_0's rmse: 0.573071	valid_0's l2: 0.328411
Training until validation scores don't improve for 30 rounds
Early stopping, best iteration is:
[311]	valid_0's rmse: 0.605776	valid_0's l2: 0.366964
[32m[I 2026-08-06 12:31:25,735][0m Trial 37 finished with value: 0.632591515432563 and parameters: {'boosting_type': 'gbdt', 'max_depth': 13, 'num_leaves': 58, 'learning_rate': 0.016774455712816497, 'n_estimators': 2505, 'subsample': 0.876299967255885, 'subsample_freq': 2, 'colsample_bytree': 0.8802189081675069, 'reg_alpha': 2.8881844128658918e-08, 'reg_lambda': 0.0038246059991346743, 'min_child_samples': 11, 'min_child_weight': 0.042724255748089524, 'min_split_gain': 0.24766749491865633, 'cat_smooth': 0.4915323894830923, 'cat_l2': 13.193417901652623}. Best is trial 21 with value: 0.5884190101188496.[0m
[32m[I 2026-08-06 12:31:28,866][0m Trial 38 pruned. [0m
Training until validation scores don't improve for 30 rounds
Early stopping, best iteration is:
[321]	valid_0's rmse: 0.717415	valid_0's l2: 0.514684
Training until validation scores don't improve for 30 rounds
Early stopping, best iteration is:
[384]	valid_0's rmse: 0.676223	valid_0's l2: 0.457278
Training until validation scores don't improve for 30 rounds
Early stopping, best iteration is:
[350]	valid_0's rmse: 0.604993	valid_0's l2: 0.366017
Training until validation scores don't improve for 30 rounds
Early stopping, best iteration is:
[316]	valid_0's rmse: 0.565856	valid_0's l2: 0.320193
Training until validation scores don't improve for 30 rounds
Early stopping, best iteration is:
[345]	valid_0's rmse: 0.626056	valid_0's l2: 0.391947
[32m[I 2026-08-06 12:31:29,773][0m Trial 39 finished with value: 0.6381086907348166 and parameters: {'boosting_type': 'gbdt', 'max_depth': 12, 'num_leaves': 73, 'learning_rate': 0.03610880804561644, 'n_estimators': 2813, 'subsample': 0.9477601634811754, 'subsample_freq': 8, 'colsample_bytree': 0.7711896140804617, 'reg_alpha': 0.0004008756301849086, 'reg_lambda': 4.729663400534356e-07, 'min_child_samples': 31, 'min_child_weight': 0.005012911546504448, 'min_split_gain': 0.0715719970539284, 'cat_smooth': 4.384773987503042, 'cat_l2': 28.193468711604055}. Best is trial 21 with value: 0.5884190101188496.[0m
[32m[I 2026-08-06 12:31:56,044][0m Trial 40 pruned. [0m
Training until validation scores don't improve for 30 rounds
Early stopping, best iteration is:
[144]	valid_0's rmse: 0.718894	valid_0's l2: 0.516808
Training until validation scores don't improve for 30 rounds
Early stopping, best iteration is:
[204]	valid_0's rmse: 0.657224	valid_0's l2: 0.431944
Training until validation scores don't improve for 30 rounds
Early stopping, best iteration is:
[228]	valid_0's rmse: 0.572059	valid_0's l2: 0.327251
Training until validation scores don't improve for 30 rounds
Early stopping, best iteration is:
[153]	valid_0's rmse: 0.553426	valid_0's l2: 0.306281
Training until validation scores don't improve for 30 rounds
Early stopping, best iteration is:
[348]	valid_0's rmse: 0.577323	valid_0's l2: 0.333302
[32m[I 2026-08-06 12:31:57,034][0m Trial 41 finished with value: 0.6157852452127921 and parameters: {'boosting_type': 'gbdt', 'max_depth': 14, 'num_leaves': 32, 'learning_rate': 0.03384354683139159, 'n_estimators': 2084, 'subsample': 0.8661696608446343, 'subsample_freq': 3, 'colsample_bytree': 0.8525555612936937, 'reg_alpha': 4.2007123243005755e-08, 'reg_lambda': 0.0003061509970500857, 'min_child_samples': 11, 'min_child_weight': 0.0009606596997854359, 'min_split_gain': 0.04703062731089356, 'cat_smooth': 9.20356179084346, 'cat_l2': 13.857913066763789}. Best is trial 21 with value: 0.5884190101188496.[0m
Training until validation scores don't improve for 30 rounds
Early stopping, best iteration is:
[167]	valid_0's rmse: 0.728566	valid_0's l2: 0.530809
Training until validation scores don't improve for 30 rounds
Early stopping, best iteration is:
[178]	valid_0's rmse: 0.679271	valid_0's l2: 0.46141
Training until validation scores don't improve for 30 rounds
Early stopping, best iteration is:
[196]	valid_0's rmse: 0.622773	valid_0's l2: 0.387846
[32m[I 2026-08-06 12:31:57,405][0m Trial 42 pruned. [0m
Training until validation scores don't improve for 30 rounds
Early stopping, best iteration is:
[95]	valid_0's rmse: 0.66562	valid_0's l2: 0.443051
Training until validation scores don't improve for 30 rounds
Early stopping, best iteration is:
[131]	valid_0's rmse: 0.622544	valid_0's l2: 0.387561
Training until validation scores don't improve for 30 rounds
Early stopping, best iteration is:
[125]	valid_0's rmse: 0.556173	valid_0's l2: 0.309329
Training until validation scores don't improve for 30 rounds
Early stopping, best iteration is:
[129]	valid_0's rmse: 0.551708	valid_0's l2: 0.304382
Training until validation scores don't improve for 30 rounds
Early stopping, best iteration is:
[172]	valid_0's rmse: 0.568516	valid_0's l2: 0.32321
[32m[I 2026-08-06 12:31:58,407][0m Trial 43 finished with value: 0.5929193006677392 and parameters: {'boosting_type': 'gbdt', 'max_depth': 13, 'num_leaves': 46, 'learning_rate': 0.03903427625343364, 'n_estimators': 1733, 'subsample': 0.8963237372488528, 'subsample_freq': 3, 'colsample_bytree': 0.7644242994077654, 'reg_alpha': 1.246236635879166e-08, 'reg_lambda': 0.0001842364927654221, 'min_child_samples': 5, 'min_child_weight': 0.0023387993975941355, 'min_split_gain': 0.05101967905801141, 'cat_smooth': 17.113386553625528, 'cat_l2': 10.420822689670311}. Best is trial 21 with value: 0.5884190101188496.[0m
Training until validation scores don't improve for 30 rounds
Early stopping, best iteration is:
[138]	valid_0's rmse: 0.679416	valid_0's l2: 0.461606
Training until validation scores don't improve for 30 rounds
Early stopping, best iteration is:
[205]	valid_0's rmse: 0.621927	valid_0's l2: 0.386793
Training until validation scores don't improve for 30 rounds
Early stopping, best iteration is:
[165]	valid_0's rmse: 0.544756	valid_0's l2: 0.296759
Training until validation scores don't improve for 30 rounds
Early stopping, best iteration is:
[189]	valid_0's rmse: 0.568185	valid_0's l2: 0.322835
Training until validation scores don't improve for 30 rounds
Early stopping, best iteration is:
[216]	valid_0's rmse: 0.587075	valid_0's l2: 0.344657
[32m[I 2026-08-06 12:31:59,686][0m Trial 44 finished with value: 0.6002885683155073 and parameters: {'boosting_type': 'gbdt', 'max_depth': 13, 'num_leaves': 66, 'learning_rate': 0.026643714772058003, 'n_estimators': 1454, 'subsample': 0.8947357593083177, 'subsample_freq': 4, 'colsample_bytree': 0.6994053224936317, 'reg_alpha': 1.4465723625556208e-08, 'reg_lambda': 2.7231612064829477e-05, 'min_child_samples': 5, 'min_child_weight': 0.003973129720928311, 'min_split_gain': 0.06258894528815392, 'cat_smooth': 22.654046016440795, 'cat_l2': 11.715166390160737}. Best is trial 21 with value: 0.5884190101188496.[0m
Training until validation scores don't improve for 30 rounds
Early stopping, best iteration is:
[138]	valid_0's rmse: 0.682597	valid_0's l2: 0.465938
Training until validation scores don't improve for 30 rounds
Early stopping, best iteration is:
[177]	valid_0's rmse: 0.647193	valid_0's l2: 0.418859
Training until validation scores don't improve for 30 rounds
Early stopping, best iteration is:
[157]	valid_0's rmse: 0.547994	valid_0's l2: 0.300298
Training until validation scores don't improve for 30 rounds
Early stopping, best iteration is:
[179]	valid_0's rmse: 0.572284	valid_0's l2: 0.327509
Training until validation scores don't improve for 30 rounds
Early stopping, best iteration is:
[185]	valid_0's rmse: 0.584984	valid_0's l2: 0.342207
[32m[I 2026-08-06 12:32:00,837][0m Trial 45 finished with value: 0.6070105491589982 and parameters: {'boosting_type': 'gbdt', 'max_depth': 13, 'num_leaves': 69, 'learning_rate': 0.025990068773542156, 'n_estimators': 1412, 'subsample': 0.9004139383531908, 'subsample_freq': 4, 'colsample_bytree': 0.6411802802122102, 'reg_alpha': 1.592986260147041e-07, 'reg_lambda': 3.0094615954963047e-05, 'min_child_samples': 5, 'min_child_weight': 0.004396648978033956, 'min_split_gain': 0.09804098646007733, 'cat_smooth': 27.93013625612271, 'cat_l2': 11.28842859752518}. Best is trial 21 with value: 0.5884190101188496.[0m
Training until validation scores don't improve for 30 rounds
Early stopping, best iteration is:
[223]	valid_0's rmse: 0.716947	valid_0's l2: 0.514013
Training until validation scores don't improve for 30 rounds
Early stopping, best iteration is:
[306]	valid_0's rmse: 0.666079	valid_0's l2: 0.443661
Training until validation scores don't improve for 30 rounds
Early stopping, best iteration is:
[363]	valid_0's rmse: 0.600144	valid_0's l2: 0.360173
Training until validation scores don't improve for 30 rounds
Early stopping, best iteration is:
[293]	valid_0's rmse: 0.580935	valid_0's l2: 0.337485
Training until validation scores don't improve for 30 rounds
Early stopping, best iteration is:
[333]	valid_0's rmse: 0.628637	valid_0's l2: 0.395185
[32m[I 2026-08-06 12:32:02,119][0m Trial 46 pruned. [0m
Training until validation scores don't improve for 30 rounds
Early stopping, best iteration is:
[256]	valid_0's rmse: 0.719581	valid_0's l2: 0.517797
Training until validation scores don't improve for 30 rounds
Early stopping, best iteration is:
[228]	valid_0's rmse: 0.674666	valid_0's l2: 0.455174
Training until validation scores don't improve for 30 rounds
Early stopping, best iteration is:
[417]	valid_0's rmse: 0.584794	valid_0's l2: 0.341984
Training until validation scores don't improve for 30 rounds
Early stopping, best iteration is:
[495]	valid_0's rmse: 0.567956	valid_0's l2: 0.322574
Training until validation scores don't improve for 30 rounds
Early stopping, best iteration is:
[436]	valid_0's rmse: 0.637801	valid_0's l2: 0.40679
[32m[I 2026-08-06 12:32:03,400][0m Trial 47 finished with value: 0.6369595058682515 and parameters: {'boosting_type': 'gbdt', 'max_depth': 13, 'num_leaves': 110, 'learning_rate': 0.02019232322527103, 'n_estimators': 1485, 'subsample': 0.5050269761741197, 'subsample_freq': 4, 'colsample_bytree': 0.6375284485668226, 'reg_alpha': 1.0066932733669199e-08, 'reg_lambda': 0.00013193667397600004, 'min_child_samples': 9, 'min_child_weight': 0.0024995818954237138, 'min_split_gain': 0.1527807883297698, 'cat_smooth': 13.698105280350882, 'cat_l2': 8.141620130993864}. Best is trial 21 with value: 0.5884190101188496.[0m
Training until validation scores don't improve for 30 rounds
Early stopping, best iteration is:
[196]	valid_0's rmse: 0.738501	valid_0's l2: 0.545384
Training until validation scores don't improve for 30 rounds
Early stopping, best iteration is:
[327]	valid_0's rmse: 0.706837	valid_0's l2: 0.499618
[32m[I 2026-08-06 12:32:03,721][0m Trial 48 pruned. [0m
Training until validation scores don't improve for 30 rounds
Early stopping, best iteration is:
[561]	valid_0's rmse: 0.670965	valid_0's l2: 0.450194
Training until validation scores don't improve for 30 rounds
Early stopping, best iteration is:
[908]	valid_0's rmse: 0.606702	valid_0's l2: 0.368087
Training until validation scores don't improve for 30 rounds
Early stopping, best iteration is:
[751]	valid_0's rmse: 0.550904	valid_0's l2: 0.303495
Training until validation scores don't improve for 30 rounds
Early stopping, best iteration is:
[690]	valid_0's rmse: 0.544155	valid_0's l2: 0.296104
Training until validation scores don't improve for 30 rounds
Early stopping, best iteration is:
[844]	valid_0's rmse: 0.561538	valid_0's l2: 0.315325
[32m[I 2026-08-06 12:32:10,706][0m Trial 49 finished with value: 0.5868527046884425 and parameters: {'boosting_type': 'gbdt', 'max_depth': 12, 'num_leaves': 64, 'learning_rate': 0.008546897757771775, 'n_estimators': 1075, 'subsample': 0.9277938216268977, 'subsample_freq': 4, 'colsample_bytree': 0.697075886899258, 'reg_alpha': 7.644921136056366e-06, 'reg_lambda': 1.1057132004942792e-06, 'min_child_samples': 5, 'min_child_weight': 0.0002673243582151248, 'min_split_gain': 0.0006025923282825928, 'cat_smooth': 43.89330971306369, 'cat_l2': 13.72849903703863}. Best is trial 49 with value: 0.5868527046884425.[0m

=== Best Trial ===
  CV RMSE: 0.586853
  Params:  {'boosting_type': 'gbdt', 'max_depth': 12, 'num_leaves': 64, 'learning_rate': 0.008546897757771775, 'n_estimators': 1075, 'subsample': 0.9277938216268977, 'subsample_freq': 4, 'colsample_bytree': 0.697075886899258, 'reg_alpha': 7.644921136056366e-06, 'reg_lambda': 1.1057132004942792e-06, 'min_child_samples': 5, 'min_child_weight': 0.0002673243582151248, 'min_split_gain': 0.0006025923282825928, 'cat_smooth': 43.89330971306369, 'cat_l2': 13.72849903703863}

============================================================
Training Final Model with Best Hyperparameters
============================================================
Training until validation scores don't improve for 50 rounds
[50]	valid_0's rmse: 0.884507	valid_0's l2: 0.782353
[100]	valid_0's rmse: 0.739903	valid_0's l2: 0.547456
[150]	valid_0's rmse: 0.663726	valid_0's l2: 0.440532
[200]	valid_0's rmse: 0.628733	valid_0's l2: 0.395306
[250]	valid_0's rmse: 0.612094	valid_0's l2: 0.374658
[300]	valid_0's rmse: 0.60654	valid_0's l2: 0.367891
[350]	valid_0's rmse: 0.603157	valid_0's l2: 0.363798
[400]	valid_0's rmse: 0.599528	valid_0's l2: 0.359434
[450]	valid_0's rmse: 0.599803	valid_0's l2: 0.359763
[500]	valid_0's rmse: 0.597336	valid_0's l2: 0.356811
[550]	valid_0's rmse: 0.595992	valid_0's l2: 0.355207
Early stopping, best iteration is:
[531]	valid_0's rmse: 0.59575	valid_0's l2: 0.354918

============================================================
Test Evaluation
============================================================
  Test MSE:  0.4787
  Test RMSE: 0.6919
  Test MAE:  0.4882
  Test R²:   0.6643

============================================================
Top 20 Feature Importances
============================================================
   1. MolWt                      1586.0
   2. tail_ratio                 1254.0
   3. LogP                       1254.0
   4. atom_mean_35               1028.0
   5. atom_std_54                759.0
   6. atom_std_25                747.0
   7. atom_mean_54               717.0
   8. RotBonds                   708.0
   9. atom_mean_41               661.0
  10. atom_std_35                639.0
  11. atom_mean_17               614.0
  12. HeavyAtoms                 601.0
  13. atom_mean_47               555.0
  14. atom_mean_4                548.0
  15. atom_mean_5                534.0
  16. atom_mean_48               531.0
  17. atom_mean_18               525.0
  18. atom_mean_26               508.0
  19. atom_mean_3                499.0
  20. atom_mean_23               487.0

Plot saved to runs\pC20\pC20_lightgbm_20260806_123004\pred_vs_true.png
Model saved to runs\pC20\pC20_lightgbm_20260806_123004\model.pkl

============================================================
SUMMARY — LightGBM + PharmHGT Features
============================================================
  Features:  522-dim (atom_agg + bond_agg + MACCS + BRICS + surfactant + descriptors)
  Train:     493 (val 71)
  Test:      70
  Optuna:    50 trials, 5-fold CV
  Best CV RMSE: 0.5869
  Test RMSE: 0.6919
  Test MAE:  0.4882
  Test R²:   0.6643

指标已保存: runs\pC20\pC20_lightgbm_20260806_123004\metrics.json
索引已更新: runs\pC20\_runs_index.csv
索引已更新: runs\_runs_index.csv
