============================================================
rf — 运行开始  20260723_151026
  输出目录:  runs\rf_20260723_151026
============================================================
============================================================
RandomForest + PharmHGT-style Featurization for LogCMC (pCMC) Prediction
============================================================
[Cache HIT] Loading features from data\features\surfpro
  Train features: (1204, 522)
  Test features:  (140, 522)

Split: Train 1053, Val 151, Test 140

============================================================
Optuna Hyperparameter Tuning (50 trials, 5-Fold CV)
============================================================
[32m[I 2026-07-23 15:10:30,194][0m Trial 0 finished with value: 0.7863152233576431 and parameters: {'n_estimators': 874, 'max_depth': 29, 'min_samples_split': 37, 'min_samples_leaf': 30, 'max_features': 'sqrt', 'bootstrap': True, 'max_samples': 0.8540362888980227}. Best is trial 0 with value: 0.7863152233576431.[0m
[32m[I 2026-07-23 15:10:32,153][0m Trial 1 finished with value: 0.6531848722404883 and parameters: {'n_estimators': 237, 'max_depth': 30, 'min_samples_split': 42, 'min_samples_leaf': 11, 'max_features': None, 'bootstrap': True, 'max_samples': 0.645614570099021}. Best is trial 1 with value: 0.6531848722404883.[0m
[32m[I 2026-07-23 15:10:35,984][0m Trial 2 finished with value: 0.8056774415463603 and parameters: {'n_estimators': 1301, 'max_depth': 6, 'min_samples_split': 16, 'min_samples_leaf': 19, 'max_features': 'log2', 'bootstrap': False}. Best is trial 1 with value: 0.6531848722404883.[0m
[32m[I 2026-07-23 15:10:37,345][0m Trial 3 finished with value: 0.6662458894312177 and parameters: {'n_estimators': 283, 'max_depth': 20, 'min_samples_split': 10, 'min_samples_leaf': 4, 'max_features': 'log2', 'bootstrap': True, 'max_samples': 0.8421165132560784}. Best is trial 1 with value: 0.6531848722404883.[0m
[32m[I 2026-07-23 15:10:40,311][0m Trial 4 finished with value: 0.7070624638417524 and parameters: {'n_estimators': 992, 'max_depth': 6, 'min_samples_split': 26, 'min_samples_leaf': 2, 'max_features': 'sqrt', 'bootstrap': False}. Best is trial 1 with value: 0.6531848722404883.[0m
[32m[I 2026-07-23 15:10:42,357][0m Trial 5 pruned. [0m
[32m[I 2026-07-23 15:10:42,899][0m Trial 6 pruned. [0m
[32m[I 2026-07-23 15:10:43,352][0m Trial 7 pruned. [0m
[32m[I 2026-07-23 15:10:43,802][0m Trial 8 pruned. [0m
[32m[I 2026-07-23 15:10:52,179][0m Trial 9 pruned. [0m
[32m[I 2026-07-23 15:10:56,766][0m Trial 10 pruned. [0m
[32m[I 2026-07-23 15:10:59,937][0m Trial 11 finished with value: 0.5717809692444455 and parameters: {'n_estimators': 692, 'max_depth': 22, 'min_samples_split': 2, 'min_samples_leaf': 1, 'max_features': 'log2', 'bootstrap': True, 'max_samples': 0.727022979252479}. Best is trial 11 with value: 0.5717809692444455.[0m
[32m[I 2026-07-23 15:11:06,705][0m Trial 12 finished with value: 0.5963039619879906 and parameters: {'n_estimators': 672, 'max_depth': 25, 'min_samples_split': 3, 'min_samples_leaf': 9, 'max_features': None, 'bootstrap': True, 'max_samples': 0.688147837963763}. Best is trial 11 with value: 0.5717809692444455.[0m
[32m[I 2026-07-23 15:11:17,261][0m Trial 13 finished with value: 0.5200333598802611 and parameters: {'n_estimators': 633, 'max_depth': 24, 'min_samples_split': 3, 'min_samples_leaf': 2, 'max_features': None, 'bootstrap': True, 'max_samples': 0.7320579645128431}. Best is trial 13 with value: 0.5200333598802611.[0m
[32m[I 2026-07-23 15:11:20,222][0m Trial 14 finished with value: 0.5754632538756029 and parameters: {'n_estimators': 639, 'max_depth': 17, 'min_samples_split': 2, 'min_samples_leaf': 1, 'max_features': 'log2', 'bootstrap': True, 'max_samples': 0.7506324321151319}. Best is trial 13 with value: 0.5200333598802611.[0m
[32m[I 2026-07-23 15:11:25,679][0m Trial 15 finished with value: 0.6529428015191379 and parameters: {'n_estimators': 603, 'max_depth': 26, 'min_samples_split': 12, 'min_samples_leaf': 17, 'max_features': None, 'bootstrap': True, 'max_samples': 0.7655620151757301}. Best is trial 13 with value: 0.5200333598802611.[0m
[32m[I 2026-07-23 15:11:27,238][0m Trial 16 pruned. [0m
[32m[I 2026-07-23 15:11:29,729][0m Trial 17 finished with value: 0.6082436566653754 and parameters: {'n_estimators': 545, 'max_depth': 15, 'min_samples_split': 6, 'min_samples_leaf': 1, 'max_features': 'log2', 'bootstrap': True, 'max_samples': 0.7392478635329598}. Best is trial 13 with value: 0.5200333598802611.[0m
[32m[I 2026-07-23 15:11:32,865][0m Trial 18 pruned. [0m
[32m[I 2026-07-23 15:11:35,391][0m Trial 19 pruned. [0m
[32m[I 2026-07-23 15:11:43,252][0m Trial 20 finished with value: 0.6307474075599434 and parameters: {'n_estimators': 797, 'max_depth': 18, 'min_samples_split': 8, 'min_samples_leaf': 14, 'max_features': None, 'bootstrap': True, 'max_samples': 0.8055482768743157}. Best is trial 13 with value: 0.5200333598802611.[0m
[32m[I 2026-07-23 15:11:45,613][0m Trial 21 finished with value: 0.5788328549813095 and parameters: {'n_estimators': 507, 'max_depth': 17, 'min_samples_split': 3, 'min_samples_leaf': 1, 'max_features': 'log2', 'bootstrap': True, 'max_samples': 0.7638405827893812}. Best is trial 13 with value: 0.5200333598802611.[0m
[32m[I 2026-07-23 15:11:46,967][0m Trial 22 pruned. [0m
[32m[I 2026-07-23 15:11:47,905][0m Trial 23 pruned. [0m
[32m[I 2026-07-23 15:11:48,755][0m Trial 24 pruned. [0m
[32m[I 2026-07-23 15:11:50,011][0m Trial 25 pruned. [0m
[32m[I 2026-07-23 15:11:54,356][0m Trial 26 pruned. [0m
[32m[I 2026-07-23 15:11:55,118][0m Trial 27 pruned. [0m
[32m[I 2026-07-23 15:11:56,310][0m Trial 28 pruned. [0m
[32m[I 2026-07-23 15:12:05,754][0m Trial 29 finished with value: 0.5963910587664769 and parameters: {'n_estimators': 824, 'max_depth': 28, 'min_samples_split': 20, 'min_samples_leaf': 11, 'max_features': None, 'bootstrap': True, 'max_samples': 0.8998892026135178}. Best is trial 13 with value: 0.5200333598802611.[0m
[32m[I 2026-07-23 15:12:10,428][0m Trial 30 finished with value: 0.6158393787850782 and parameters: {'n_estimators': 1041, 'max_depth': 21, 'min_samples_split': 9, 'min_samples_leaf': 4, 'max_features': 'sqrt', 'bootstrap': True, 'max_samples': 0.7161143452296725}. Best is trial 13 with value: 0.5200333598802611.[0m
[32m[I 2026-07-23 15:12:12,688][0m Trial 31 finished with value: 0.6126670621129328 and parameters: {'n_estimators': 492, 'max_depth': 18, 'min_samples_split': 3, 'min_samples_leaf': 2, 'max_features': 'log2', 'bootstrap': True, 'max_samples': 0.766136413789467}. Best is trial 13 with value: 0.5200333598802611.[0m
[32m[I 2026-07-23 15:12:15,539][0m Trial 32 finished with value: 0.5774013038330701 and parameters: {'n_estimators': 608, 'max_depth': 16, 'min_samples_split': 2, 'min_samples_leaf': 1, 'max_features': 'log2', 'bootstrap': True, 'max_samples': 0.745096380382737}. Best is trial 13 with value: 0.5200333598802611.[0m
[32m[I 2026-07-23 15:12:17,081][0m Trial 33 pruned. [0m
[32m[I 2026-07-23 15:12:18,221][0m Trial 34 pruned. [0m
[32m[I 2026-07-23 15:12:19,574][0m Trial 35 pruned. [0m
[32m[I 2026-07-23 15:12:20,097][0m Trial 36 pruned. [0m
[32m[I 2026-07-23 15:12:33,637][0m Trial 37 finished with value: 0.5381262759007451 and parameters: {'n_estimators': 921, 'max_depth': 16, 'min_samples_split': 11, 'min_samples_leaf': 4, 'max_features': None, 'bootstrap': True, 'max_samples': 0.8764191446926606}. Best is trial 13 with value: 0.5200333598802611.[0m
[32m[I 2026-07-23 15:12:38,585][0m Trial 38 pruned. [0m
[32m[I 2026-07-23 15:12:46,592][0m Trial 39 pruned. [0m
[32m[I 2026-07-23 15:13:06,034][0m Trial 40 finished with value: 0.5485785114898591 and parameters: {'n_estimators': 1237, 'max_depth': 29, 'min_samples_split': 17, 'min_samples_leaf': 4, 'max_features': None, 'bootstrap': True, 'max_samples': 0.9539804135007419}. Best is trial 13 with value: 0.5200333598802611.[0m
[32m[I 2026-07-23 15:13:27,820][0m Trial 41 finished with value: 0.545175372252894 and parameters: {'n_estimators': 1348, 'max_depth': 28, 'min_samples_split': 16, 'min_samples_leaf': 4, 'max_features': None, 'bootstrap': True, 'max_samples': 0.9858261100363074}. Best is trial 13 with value: 0.5200333598802611.[0m
[32m[I 2026-07-23 15:13:48,853][0m Trial 42 finished with value: 0.5604124121047349 and parameters: {'n_estimators': 1380, 'max_depth': 29, 'min_samples_split': 24, 'min_samples_leaf': 4, 'max_features': None, 'bootstrap': True, 'max_samples': 0.9827574255937914}. Best is trial 13 with value: 0.5200333598802611.[0m
[32m[I 2026-07-23 15:14:09,201][0m Trial 43 finished with value: 0.5626754898834546 and parameters: {'n_estimators': 1361, 'max_depth': 30, 'min_samples_split': 25, 'min_samples_leaf': 4, 'max_features': None, 'bootstrap': True, 'max_samples': 0.9738792592848377}. Best is trial 13 with value: 0.5200333598802611.[0m
[32m[I 2026-07-23 15:14:32,090][0m Trial 44 finished with value: 0.5907940801542151 and parameters: {'n_estimators': 1723, 'max_depth': 28, 'min_samples_split': 29, 'min_samples_leaf': 9, 'max_features': None, 'bootstrap': True, 'max_samples': 0.9967050497213157}. Best is trial 13 with value: 0.5200333598802611.[0m
[32m[I 2026-07-23 15:14:44,313][0m Trial 45 pruned. [0m
[32m[I 2026-07-23 15:14:51,342][0m Trial 46 pruned. [0m
[32m[I 2026-07-23 15:14:56,276][0m Trial 47 pruned. [0m
[32m[I 2026-07-23 15:15:21,677][0m Trial 48 finished with value: 0.5497706113674908 and parameters: {'n_estimators': 1610, 'max_depth': 25, 'min_samples_split': 19, 'min_samples_leaf': 3, 'max_features': None, 'bootstrap': True, 'max_samples': 0.928391113099498}. Best is trial 13 with value: 0.5200333598802611.[0m
[32m[I 2026-07-23 15:15:45,930][0m Trial 49 finished with value: 0.5528126136764808 and parameters: {'n_estimators': 1618, 'max_depth': 25, 'min_samples_split': 19, 'min_samples_leaf': 3, 'max_features': None, 'bootstrap': True, 'max_samples': 0.8590637474777203}. Best is trial 13 with value: 0.5200333598802611.[0m

=== Best Trial ===
  CV RMSE: 0.520033
  Params:  {'n_estimators': 633, 'max_depth': 24, 'min_samples_split': 3, 'min_samples_leaf': 2, 'max_features': None, 'bootstrap': True, 'max_samples': 0.7320579645128431}

============================================================
Training Final Model with Best Hyperparameters
============================================================

============================================================
Test Evaluation
============================================================
  Test MSE:  0.2311
  Test RMSE: 0.4808
  Test MAE:  0.3355
  Test R²:   0.8128

============================================================
Top 20 Feature Importances
============================================================
   1. LogP                       0.2
   2. HeavyAtoms                 0.1
   3. NAtoms                     0.1
   4. MolWt                      0.1
   5. atom_std_35                0.0
   6. maccs_101                  0.0
   7. maccs_105                  0.0
   8. tail_ratio                 0.0
   9. atom_mean_46               0.0
  10. head_ratio                 0.0
  11. atom_std_46                0.0
  12. atom_mean_35               0.0
  13. atom_std_54                0.0
  14. RotBonds                   0.0
  15. TPSA                       0.0
  16. atom_std_47                0.0
  17. brics_0                    0.0
  18. atom_mean_54               0.0
  19. atom_mean_47               0.0
  20. atom_std_25                0.0

Plot saved to runs\rf_20260723_151026\pred_vs_true.png
Model saved to runs\rf_20260723_151026\model.pkl

============================================================
SUMMARY — RandomForest + PharmHGT Features
============================================================
  Features:  522-dim (atom_agg + bond_agg + MACCS + BRICS + surfactant + descriptors)
  Train:     1204 (split 1053 train + 151 val)
  Test:      140
  Optuna:    50 trials, 5-fold CV
  Best CV RMSE: 0.5200
  Test RMSE: 0.4808
  Test MAE:  0.3355
  Test R²:   0.8128

指标已保存: runs\rf_20260723_151026\metrics.json
索引已更新: runs\_runs_index.csv
