============================================================
rf — 运行开始  20260806_193704
  输出目录:  runs\Pi_CMC\Pi_CMC_rf_20260806_193704
============================================================
============================================================
RandomForest + PharmHGT-style Featurization for Pi_CMC Prediction
============================================================
[Cache HIT] Loading features from data\features\surfpro\Pi_CMC
  Train features: (631, 522)
  Test features:  (70, 522)

Split: Train 552, Val 79, Test 70

============================================================
Optuna Hyperparameter Tuning (50 trials, 5-Fold CV)
============================================================
[32m[I 2026-08-06 19:37:08,988][0m Trial 0 finished with value: 5.730194426046924 and parameters: {'n_estimators': 874, 'max_depth': 29, 'min_samples_split': 37, 'min_samples_leaf': 30, 'max_features': 'sqrt', 'bootstrap': True, 'max_samples': 0.8540362888980227}. Best is trial 0 with value: 5.730194426046924.[0m
[32m[I 2026-08-06 19:37:10,700][0m Trial 1 finished with value: 5.008755568695713 and parameters: {'n_estimators': 237, 'max_depth': 30, 'min_samples_split': 42, 'min_samples_leaf': 11, 'max_features': None, 'bootstrap': True, 'max_samples': 0.645614570099021}. Best is trial 1 with value: 5.008755568695713.[0m
[32m[I 2026-08-06 19:37:14,802][0m Trial 2 finished with value: 5.23297775256505 and parameters: {'n_estimators': 1301, 'max_depth': 6, 'min_samples_split': 16, 'min_samples_leaf': 19, 'max_features': 'log2', 'bootstrap': False}. Best is trial 1 with value: 5.008755568695713.[0m
[32m[I 2026-08-06 19:37:16,191][0m Trial 3 finished with value: 4.696404219850039 and parameters: {'n_estimators': 283, 'max_depth': 20, 'min_samples_split': 10, 'min_samples_leaf': 4, 'max_features': 'log2', 'bootstrap': True, 'max_samples': 0.8421165132560784}. Best is trial 3 with value: 4.696404219850039.[0m
[32m[I 2026-08-06 19:37:19,363][0m Trial 4 finished with value: 4.7745517591843605 and parameters: {'n_estimators': 992, 'max_depth': 6, 'min_samples_split': 26, 'min_samples_leaf': 2, 'max_features': 'sqrt', 'bootstrap': False}. Best is trial 3 with value: 4.696404219850039.[0m
[32m[I 2026-08-06 19:37:21,457][0m Trial 5 pruned. [0m
[32m[I 2026-08-06 19:37:22,026][0m Trial 6 pruned. [0m
[32m[I 2026-08-06 19:37:23,194][0m Trial 7 finished with value: 4.994471470478116 and parameters: {'n_estimators': 334, 'max_depth': 30, 'min_samples_split': 39, 'min_samples_leaf': 10, 'max_features': 'log2', 'bootstrap': False}. Best is trial 3 with value: 4.696404219850039.[0m
[32m[I 2026-08-06 19:37:23,648][0m Trial 8 pruned. [0m
[32m[I 2026-08-06 19:37:28,271][0m Trial 9 pruned. [0m
[32m[I 2026-08-06 19:37:31,699][0m Trial 10 pruned. [0m
[32m[I 2026-08-06 19:37:34,149][0m Trial 11 finished with value: 4.5388977410791504 and parameters: {'n_estimators': 755, 'max_depth': 18, 'min_samples_split': 27, 'min_samples_leaf': 1, 'max_features': 'log2', 'bootstrap': False}. Best is trial 11 with value: 4.5388977410791504.[0m
[32m[I 2026-08-06 19:37:36,688][0m Trial 12 pruned. [0m
[32m[I 2026-08-06 19:37:38,943][0m Trial 13 finished with value: 4.559719159880683 and parameters: {'n_estimators': 679, 'max_depth': 15, 'min_samples_split': 13, 'min_samples_leaf': 6, 'max_features': 'log2', 'bootstrap': False}. Best is trial 11 with value: 4.5388977410791504.[0m
[32m[I 2026-08-06 19:37:41,117][0m Trial 14 finished with value: 4.67504490170011 and parameters: {'n_estimators': 660, 'max_depth': 15, 'min_samples_split': 15, 'min_samples_leaf': 8, 'max_features': 'log2', 'bootstrap': False}. Best is trial 11 with value: 4.5388977410791504.[0m
[32m[I 2026-08-06 19:37:41,955][0m Trial 15 pruned. [0m
[32m[I 2026-08-06 19:37:45,637][0m Trial 16 pruned. [0m
[32m[I 2026-08-06 19:37:47,472][0m Trial 17 finished with value: 4.685593824502143 and parameters: {'n_estimators': 547, 'max_depth': 11, 'min_samples_split': 33, 'min_samples_leaf': 1, 'max_features': 'log2', 'bootstrap': False}. Best is trial 11 with value: 4.5388977410791504.[0m
[32m[I 2026-08-06 19:37:48,862][0m Trial 18 pruned. [0m
[32m[I 2026-08-06 19:37:50,758][0m Trial 19 pruned. [0m
[32m[I 2026-08-06 19:37:53,940][0m Trial 20 pruned. [0m
[32m[I 2026-08-06 19:37:55,676][0m Trial 21 finished with value: 4.631352275985676 and parameters: {'n_estimators': 515, 'max_depth': 15, 'min_samples_split': 16, 'min_samples_leaf': 7, 'max_features': 'log2', 'bootstrap': False}. Best is trial 11 with value: 4.5388977410791504.[0m
[32m[I 2026-08-06 19:37:57,674][0m Trial 22 finished with value: 4.469842462421416 and parameters: {'n_estimators': 594, 'max_depth': 17, 'min_samples_split': 8, 'min_samples_leaf': 5, 'max_features': 'log2', 'bootstrap': False}. Best is trial 22 with value: 4.469842462421416.[0m
[32m[I 2026-08-06 19:38:00,073][0m Trial 23 finished with value: 4.468952831806383 and parameters: {'n_estimators': 722, 'max_depth': 25, 'min_samples_split': 7, 'min_samples_leaf': 5, 'max_features': 'log2', 'bootstrap': False}. Best is trial 23 with value: 4.468952831806383.[0m
[32m[I 2026-08-06 19:38:00,683][0m Trial 24 pruned. [0m
[32m[I 2026-08-06 19:38:03,395][0m Trial 25 finished with value: 4.390630366282204 and parameters: {'n_estimators': 819, 'max_depth': 25, 'min_samples_split': 5, 'min_samples_leaf': 4, 'max_features': 'log2', 'bootstrap': False}. Best is trial 25 with value: 4.390630366282204.[0m
[32m[I 2026-08-06 19:38:04,675][0m Trial 26 pruned. [0m
[32m[I 2026-08-06 19:38:06,261][0m Trial 27 pruned. [0m
[32m[I 2026-08-06 19:38:09,901][0m Trial 28 pruned. [0m
[32m[I 2026-08-06 19:38:11,059][0m Trial 29 pruned. [0m
[32m[I 2026-08-06 19:38:13,832][0m Trial 30 finished with value: 4.320368185581592 and parameters: {'n_estimators': 814, 'max_depth': 23, 'min_samples_split': 5, 'min_samples_leaf': 5, 'max_features': 'sqrt', 'bootstrap': False}. Best is trial 30 with value: 4.320368185581592.[0m
[32m[I 2026-08-06 19:38:16,707][0m Trial 31 finished with value: 4.271379986847373 and parameters: {'n_estimators': 835, 'max_depth': 23, 'min_samples_split': 5, 'min_samples_leaf': 4, 'max_features': 'sqrt', 'bootstrap': False}. Best is trial 31 with value: 4.271379986847373.[0m
[32m[I 2026-08-06 19:38:19,492][0m Trial 32 finished with value: 4.516688996736437 and parameters: {'n_estimators': 834, 'max_depth': 23, 'min_samples_split': 4, 'min_samples_leaf': 9, 'max_features': 'sqrt', 'bootstrap': False}. Best is trial 31 with value: 4.271379986847373.[0m
[32m[I 2026-08-06 19:38:22,850][0m Trial 33 finished with value: 4.27192389551299 and parameters: {'n_estimators': 976, 'max_depth': 24, 'min_samples_split': 6, 'min_samples_leaf': 4, 'max_features': 'sqrt', 'bootstrap': False}. Best is trial 31 with value: 4.271379986847373.[0m
[32m[I 2026-08-06 19:38:24,803][0m Trial 34 pruned. [0m
[32m[I 2026-08-06 19:38:27,997][0m Trial 35 finished with value: 4.318489809636521 and parameters: {'n_estimators': 942, 'max_depth': 28, 'min_samples_split': 12, 'min_samples_leaf': 4, 'max_features': 'sqrt', 'bootstrap': False}. Best is trial 31 with value: 4.271379986847373.[0m
[32m[I 2026-08-06 19:38:29,804][0m Trial 36 pruned. [0m
[32m[I 2026-08-06 19:38:31,601][0m Trial 37 pruned. [0m
[32m[I 2026-08-06 19:38:33,107][0m Trial 38 pruned. [0m
[32m[I 2026-08-06 19:38:34,666][0m Trial 39 pruned. [0m
[32m[I 2026-08-06 19:38:36,508][0m Trial 40 pruned. [0m
[32m[I 2026-08-06 19:38:39,298][0m Trial 41 finished with value: 4.271068128246552 and parameters: {'n_estimators': 806, 'max_depth': 24, 'min_samples_split': 5, 'min_samples_leaf': 4, 'max_features': 'sqrt', 'bootstrap': False}. Best is trial 41 with value: 4.271068128246552.[0m
[32m[I 2026-08-06 19:38:43,002][0m Trial 42 finished with value: 4.217791268674868 and parameters: {'n_estimators': 1073, 'max_depth': 24, 'min_samples_split': 6, 'min_samples_leaf': 3, 'max_features': 'sqrt', 'bootstrap': False}. Best is trial 42 with value: 4.217791268674868.[0m
[32m[I 2026-08-06 19:38:46,576][0m Trial 43 finished with value: 4.214617394121967 and parameters: {'n_estimators': 1052, 'max_depth': 27, 'min_samples_split': 7, 'min_samples_leaf': 3, 'max_features': 'sqrt', 'bootstrap': False}. Best is trial 43 with value: 4.214617394121967.[0m
[32m[I 2026-08-06 19:38:51,181][0m Trial 44 finished with value: 4.165812238398846 and parameters: {'n_estimators': 1368, 'max_depth': 24, 'min_samples_split': 7, 'min_samples_leaf': 1, 'max_features': 'sqrt', 'bootstrap': False}. Best is trial 44 with value: 4.165812238398846.[0m
[32m[I 2026-08-06 19:38:55,922][0m Trial 45 finished with value: 4.205638976132974 and parameters: {'n_estimators': 1389, 'max_depth': 21, 'min_samples_split': 9, 'min_samples_leaf': 1, 'max_features': 'sqrt', 'bootstrap': False}. Best is trial 44 with value: 4.165812238398846.[0m
[32m[I 2026-08-06 19:39:01,645][0m Trial 46 finished with value: 4.202715240237898 and parameters: {'n_estimators': 1710, 'max_depth': 21, 'min_samples_split': 10, 'min_samples_leaf': 1, 'max_features': 'sqrt', 'bootstrap': False}. Best is trial 44 with value: 4.165812238398846.[0m
[32m[I 2026-08-06 19:39:04,740][0m Trial 47 pruned. [0m
[32m[I 2026-08-06 19:39:10,727][0m Trial 48 finished with value: 4.20341988627109 and parameters: {'n_estimators': 1800, 'max_depth': 19, 'min_samples_split': 10, 'min_samples_leaf': 1, 'max_features': 'sqrt', 'bootstrap': False}. Best is trial 44 with value: 4.165812238398846.[0m
[32m[I 2026-08-06 19:39:17,036][0m Trial 49 finished with value: 4.201904727756795 and parameters: {'n_estimators': 1888, 'max_depth': 19, 'min_samples_split': 9, 'min_samples_leaf': 1, 'max_features': 'sqrt', 'bootstrap': False}. Best is trial 44 with value: 4.165812238398846.[0m

=== Best Trial ===
  CV RMSE: 4.165812
  Params:  {'n_estimators': 1368, 'max_depth': 24, 'min_samples_split': 7, 'min_samples_leaf': 1, 'max_features': 'sqrt', 'bootstrap': False}

============================================================
Training Final Model with Best Hyperparameters
============================================================

============================================================
Test Evaluation
============================================================
  Test MSE:  22.6026
  Test RMSE: 4.7542
  Test MAE:  3.2180
  Test R²:   0.5642

============================================================
Top 20 Feature Importances
============================================================
   1. atom_std_44                0.0
   2. atom_mean_44               0.0
   3. atom_mean_4                0.0
   4. atom_std_11                0.0
   5. atom_mean_11               0.0
   6. atom_std_38                0.0
   7. atom_std_4                 0.0
   8. atom_std_40                0.0
   9. bond_std_12                0.0
  10. atom_mean_38               0.0
  11. atom_mean_40               0.0
  12. bond_mean_3                0.0
  13. atom_mean_16               0.0
  14. bond_mean_12               0.0
  15. atom_std_22                0.0
  16. atom_mean_33               0.0
  17. bond_std_4                 0.0
  18. atom_mean_35               0.0
  19. atom_std_33                0.0
  20. bond_std_3                 0.0

Plot saved to runs\Pi_CMC\Pi_CMC_rf_20260806_193704\pred_vs_true.png
Model saved to runs\Pi_CMC\Pi_CMC_rf_20260806_193704\model.pkl

============================================================
SUMMARY — RandomForest + PharmHGT Features
============================================================
  Features:  522-dim (atom_agg + bond_agg + MACCS + BRICS + surfactant + descriptors)
  Train:     631 (split 552 train + 79 val)
  Test:      70
  Optuna:    50 trials, 5-fold CV
  Best CV RMSE: 4.1658
  Test RMSE: 4.7542
  Test MAE:  3.2180
  Test R²:   0.5642

指标已保存: runs\Pi_CMC\Pi_CMC_rf_20260806_193704\metrics.json
索引已更新: runs\Pi_CMC\_runs_index.csv
索引已更新: runs\_runs_index.csv
